Speaker,Text,pageNumbers
NA,"the subject. W i t h regard to the area,'",23
NA,we were told i n a paper received from,23
NA,the Government of New South AVales that,23
NA,in tlie sites recommended by the Federal,23
NA,"Capital Commissioner, Mr Alexander Oliver,",23
NA,1,23
NA,Crown land of an area of 15 miles radius,23
NA,was to be reserved from sale. .AVe found,23
NA,soon afterwards tbat i t was not an area of,23
NA,"15 miles radius, but of 15 miles square.",23
NA,The radius was of course the better thing,23
NA,both for the Commonwealth and for New,23
NA,"South Wales, because that would mean",23
NA,"something like 700 square miles, whilst",23
NA,an area of 15 miles square would - only,23
NA,represent 225 square miles A\ e have made a,23
NA,7,23
NA,representation upon that subject to the New,23
NA,"South AVales Government, ancl have no",23
NA,doubt that i n anything i n regard to the,23
NA,matter we shall meet with an attentive and,23
NA,willing hearing from the Ministry of New,23
NA,"to South AVales, who, judging from tbe atti-",23
NA,tude which they have assumed hitherto-,23
NA,and which I think would be tbe attitude,23
NA,of any Government existing i n New South,23
NA,Wales-wil l give every facility for making,23
NA,"a fair and free choice. As to tbe area,",23
NA,"question, there are some who even think",23
NA,"that we should have 10,000, 50,000, or",23
NA,"100,000 square miles. That is not within the-",23
NA,contemplation of tbe Constitution. I t was.,23
NA,never intended that any federal territory i u,23
NA,a fairly densely populated state should reach,23
NA,such dimensions. I t is all very well to have-,23
NA,presented to us some hundreds of millions of,23
NA,"acres, in the Northern Territory of South",23
NA,Australia.,23
Mr VL SOLOMON ,-Yo v a moderate,23
NA,consideration.,23
Mr BARTON ,"Yes , under a burden of",23
NA,"£100,000 a year, which might put us in the",23
NA,position that Lord Rosebery deprecated,23
NA,"the other day when, i u his letter to the",23
NA,"City of London Liberal Club, he declined",23
NA,to place himself in the situation of a,23
NA,"""strong ass between two burdens."" I t",23
NA,would not do to take for tlie capital a,23
NA,territory which i t is not intended to de-,23
NA,"velop into a State, and to endow i t with an",23
NA,area which would really qualify i tfcobe a,23
NA,"State. Therefore, 1 do not think ifc was",23
NA,within the contemplation of the framers of,23
NA,the Constitution at all that we should go,23
NA,beyond that which will be handy and adapt-,23
NA,"able as -the territory of the Commonwealth,",23
NA,particularly i n consideration of tbe fact_of,23
NA,its being situatedj in one of the largest,24
NA,"State3, and also, as i t must be, fairly",24
NA,"sible to a large population. Now, the",24
NA,visions of the Constitution i n this respect,24
NA,seem to me to point very clearly to what,24
NA,intended. I n section 125 we are told_,24
NA,that-,24
NA,The seat of Government of the Commonwealth,24
NA,"-shall be determined by the Parliament, and",24
NA,be within territory which shall have been granted,24
NA,"-to or acquired by the Commonwealth, and shall",24
NA,"be vested in and belong to the Commonwealth,",24
NA,"and, if New South Wales be an original",24
NA,".shall be in that Stato, and be distant not",24
NA,100 miles from Sydney.,24
NA,Then we find another reference to the,24
NA,"tion i n the 122nd section, which tells",24
NA,that-,24
NA,The Parliament may make laws for the govern-,24
NA,ment of any territory surrendered -by any State,24
NA,"to and accepted by the Commonwealth, or of",24
NA,territory placed by the Queen under the authority,24
NA,-of aud accepted by the Commonwealth or,24
NA,"wise acquired by the Commonwealth, and may",24
NA,-allow the representation of such territory in,24
NA,House of tbe Parliament to the extent and on,24
NA,terms wliich it thinks fit.,24
NA,One may well suppose a territory like,24
NA,of tbe northern part of South Australia,24
NA,"coming i n time a State, but I do not think",24
NA,i t was ever the intention of the framers,24
NA,"this Constitution to dictate,",24
NA,"any way, that the federal territory should",24
NA,"become a State, unless some overwhelmment",24
NA,ing necessity arose that i t should do so.,24
NA,There is another reason why I should,24
NA,"strong i n that contention, and that",24
NA,I f such a territory became a State i t would,24
NA,"require to be represented i n the Senate, and",24
NA,probably would obtain a representation,24
NA,'equal to that of those much larger areas of,24
NA,"which Tasmania is the smallest, though i",24
NA,is still much larger than any territory,24
NA,should secure for the capital.,24
Mr CROUCH ,-I s that so for new States,24
Mr BARTON ,"No , but if we make a",24
NA,"new State, we must give i t representation",24
NA,"in the Senate, and that might lead, to",24
NA,"extent, to an overwhelming of that balance",24
NA,or equilibrium between States,24
NA,"have attempted to institute, and do",24
NA,want unduly to unhinge or destroy. I do,24
NA,not want to speak at great length on,24
NA,this matter. Honorable members will see,24
NA,from the way I have dealt with i t that,24
NA,there is no prejudgment as to sites,24
NA,part of the Government. This territory is,24
NA,doubt to be ultimately selected by the,24
NA,ral Parliament from such land as shall,24
NA,offered to i t by New South Wales. I think,24
NA,the Constitution itself contemplates that-,24
NA,accesthe offer shall be. made under any circum-,24
NA,"prostances by New South Wales, and any",24
NA,action beyond the acceptance of one of the,24
NA,is offers made is not intended to be undertaken,24
NA,by the Commonwealth except as a last re-,24
NA,source. That I feel secure about. But I do not,24
NA,think we need fear great difficulties on that,24
NA,"shall point, when we consider how ready that",24
NA,"State has been, so far as we have gone, to offer",24
NA,further areas. Honorable members will find,24
NA,"State, from the correspondence, which they can",24
NA,"less than see, that the Government of New South",24
NA,Wales is willing to offer further areas,24
NA,quesbeyond those mentioned i n the commis-,24
NA,us sioner's report. I t has asked our opinion,24
NA,"upon that subject, and we have replied that",24
NA,we think ifc is for New South Wales to make,24
NA,"tlie offers in the first instance, and that we",24
NA,any shall be ready to receive any such offers.,24
NA,"That is i n the first iustance, of course,",24
NA,otherbecause the Constitution must not only be,24
NA,"either consulted, but i t is a matter of tact and",24
NA,the good policy to consult tbe wishes and feelings,24
NA,of the State which is most concerned. That,24
NA,that does not of course prevent any last re-,24
NA,"becourse there may be under the Constitution,",24
NA,"but I hope the day for that is far distant,",24
NA,of and that we shall never have any resort,24
NA,or to require i n to i t at all.,24
Mr WILKS , A t what date is the Govern-,24
NA,likely to deal with this matter ?,24
Mr BARTON ,Th e honorable member,24
NA,be may just as well ask me at what date we,24
NA,is this : will bring i n the Tariff.,24
Mr WILKS ,"In November or December,",24
NA,or what month t,24
Mr BARTON ,W e cannot deal with,24
NA,"t this matter in any particular month, because",24
NA,we there is a continuous dealing with ifc going,24
NA,on. There is. correspondence going on with,24
NA,1 a view to arriving afc something definite as,24
NA,to what can be offered i n addition to the,24
NA,sites already placed under offer and men-,24
NA,a large tioned i n the commissioner's report!,24
Mr WILKS , I am referring to the,24
NA,which we inspection of sites.,24
Mr BARTON ,"There , again, I have",24
NA,a difficulty ' in answering the honorable,24
NA,"member, and I think he will appreciate",24
NA,"it. The work of this session is very full,",24
NA,and the business - paper contains a large,24
NA,on the number of most important measures. I,24
NA,no think we shall be lucky if we get away from,24
NA,Fedehere much before Christmas. Tf we were,24
NA,be to lay i t down that we would institute,24
NA,"an inspection of the sites, and fix the",24
NA,"time now, we might be throwing our-",25
NA,selves beyond any proper date at which,25
NA,"the session ought to close. I am, therefore,",25
NA,reluctant to name any date within the ses-,25
NA,sion for the purpose. I t is not a tiling to,25
NA,"force i n any way, because the site re-",25
NA,"quires the satisfaction of this ,Parlia-",25
NA,"ment, as well as the satisfaction of",25
NA,the State of New South Wales. While,25
NA,we are strong i n our desire to have an,25
NA,early choice made-an d no one feels more,25
NA,strongly than I do that the matter should,25
NA,be dealt with as early as possible-w e feel,25
NA,that we must have the good-will of Parlia-,25
NA,ment witb us in making the choice. AVe,25
NA,"must, therefore, - allow for inspection by",25
NA,Member's of Parliament at the proper time.,25
NA,"Now, as to the proper time, the question",25
NA,arises whether the sites should not first be,25
NA,narrowed down by some reference to such,25
NA,"questions as accessibility, engineering facili-",25
NA,"ties, and an abundant supply of water. A l l",25
NA,"these conditions must exist, and of course",25
NA,an abundant supply of water is the first,25
NA,requisite. The inquiry wliich will be insti-,25
NA,tuted on these points will show' to what,25
NA,"extent the sites can be narrowed down,",25
NA,"in respect, for instance, of the water ques-",25
NA,"tion, which is the most important of all.",25
NA,AVhen once we have information upon that,25
NA,"point, I think we shall be able to arrange",25
NA,"for visits by the whole Parliament, or by a",25
NA,committee of Parliament i n the first in-,25
NA,"stance, as may be determined. But I can-",25
NA,not hold out a promise that that can be,25
NA,done while we have the immediate pressure,25
NA,upon us of all the matters that are en-,25
NA,gaging the public mind at the present,25
NA,moment. Honorable members may rely,25
NA,"upon this, that there is no one more",25
NA,anxious that this question should be,25
NA,"brought to a speed}' determination, con-",25
NA,"sistently .with good judgment, than I am. I",25
NA,welcome the co-operation of all honorable,25
NA,"members i n the matter. This, least of",25
NA,"all, is a party question. Ifc is one i n",25
NA,which Ministerialists and Oppositionists can,25
NA,"work heartily together, giving, of course,",25
NA,every consideration to the interests of the,25
NA,"State concerned, but realizing that the in-",25
NA,terests of the future generations of this,25
NA,Commonwealth are the most important of all.,25
NA,"To me, as a native of New South AA ales, i t is",25
NA,"a subject of especial gratification,",25
NA,time the capital is likely to be i n that State.,25
NA,"But my nativity there, and my natural pre-",25
NA,judice in favour of the place i n which I was,25
NA,"born, do not blind me to fche fact that the",25
NA,[179] .,25
NA,"choice should be careful, and, i f necessary,",25
NA,very deliberate-althoug h i t should not be,25
NA,too prolonged-s o that we may have a capi,25
NA,tal which will preserve the best conditions,25
NA,"for the future, of this Commonwealth, not",25
NA,merely i n respect of fche particular fad or,25
NA,"eccentricity of any of us, but i n respect of",25
NA,the interests of the generations that are to,25
NA,come.,25
Mr MAHON ,Befor e sitting down will,25
NA,the right honorable gentleman say whether,25
NA,he will ask the Government of New South,25
NA,"AVales, i n the event of the Common-",25
NA,"wealth having to acquire any territory, to.",25
NA,pass an Acfc^ so fchafc the land may be-,25
NA,acquired at the prairie value.,25
Mr BARTON , I t is the intention of,25
NA,the Government to see that there is no,25
NA,room for the land gambler in respect of the,25
NA,acquirement of this site. AVherever else he,25
NA,"may have free play, I think his claws should'",25
NA,be off the site of the federal capital. Our,25
NA,"desire is, and we intend to secure i t i f i t is",25
NA,"humanly possible,fchafcthere should be some",25
NA,date fixed as tbe date on which the just,25
NA,value can be ascertained. M y own opinion,25
NA,"is that the date can be fixed at, or anterior",25
NA,"fco, the 1st of January of this year, before",25
NA,speculative and fancy values began fco,25
NA,attach themselves to certain areas. I f,25
NA,"that can be done, i t will enable the",25
NA,Commonwealth to acquire land within p,25
NA,"the capital, so much land as policy deems",25
NA,"i t requisite to acquire, on - terms which",25
NA,will enable tlie people of the Commonwealth,25
NA,fco reap the benefit of tbe .leasing of that,25
NA,land. I t is not our intention to consent; to j,25
NA,the alienation of any land that we acquire . ',25
NA,within the capital area. AVe propose to be I v,25
NA,lessors of that land. laskthehonorablemem- :,25
NA,"ber for Tasmania, Mr O'Malley, to leave -",25
NA,"out the words ""on building or other leases,""",25
NA,"and to use only tlie words "" to be let to",25
NA,"utilizers,"" because I think that covers the",25
NA,whole ground. AVe do not intend fchafc,25
NA,there shall be any alienation of the freehold,25
NA,so far as we are concerned. AVe do intend,25
NA,that all thebuildings shall be erected,25
NA,"under strict regulations, but I propose",25
NA,"fco leave out the word "" government""",25
NA,because tbat. will give us a free hand,25
NA,to have the regulations framed by such,25
NA,7,25
NA,authority as might be appointed. AVifch,25
NA,that for all regardfcothe last phrase-,25
NA,With due regard to publio health aud archi-,25
NA,tectural beauty..,25
NA,I take that to be a mere matter of course,25
NA,which we should attend to though i t were,25
NA,not laid down in the'resolution. But I,26
NA,"not view i t with ""any prejudice when I lay",26
NA,"find i t there -I'move""-",26
NA,That the motion be amended' hy the omission,26
NA,"of the w o r d s "" not 'less than '1,000",26
NA,"miles of land in a good, healthy j arid fe'ftile'",26
NA,"tion, the freehold of which-shall for ever remain,""",26
NA,with a view to insert in lieu thereof the,26
NA,"words ""land, well watered, healthily situated,",26
NA,and large enough to f u l l y . meet all probable,26
NA,"requirements, and - 'Secure to the' Commonwealth",26
NA,the benefits to -accrue from the - position of,26
NA,capital; such area when secured to remain,26
NA,"ever.""",26
Mr CHAPMAN ,Eden Monaro) -,26
NA,Realizing the -great importance Of this,26
NA,"-question, I feel sure' the House will be with",26
NA,me when I say'that the countiywill -'read,26
NA,with interest the speech whichhas' just,26
NA,"-delivered by tine Prime 'Minister, i n",26
NA,spirit i n which I thinka great question,26
NA,this should be approached; and will -also,26
NA,welcome the contributions to tlie debate,26
NA,which have been made by several honorable,26
NA,"members on both sides of -this House,",26
NA,"as proving, even at this early stage,",26
NA,that there will be no feeling Other conclusion as speedily as 'possible.,26
NA,than the feeling of patriotism'displayed,26
NA,fixing the site for the federal capital.,26
NA,Comingias I do'froin an eleOtorate that,26
NA,put forward certain claims to -have the,26
NA,"federal capital in its midst, I may say",26
NA,once that I-am in accord with the resold,26
NA,"as moved, ''and also with the amendment,",26
NA,"which, I think, goes even further,-and I feel -subject.",26
NA,sure that the honorable member for Tas-,26
NA,mania will'be only'too pleased to accept'the,26
NA,"amendment, which will find 'favour right",26
NA,throughout tbe whole of this continent.,26
NA,do not propose to pose asa special pleader,26
NA,"for an}' particular 'Site, because, although",26
NA,will afford me' tlie greatest pleasure,26
NA,federal capital should be placed within,26
NA,"four corners of myelectorate, I believe that",26
NA,if there is one vote more'than another i,26
NA,regard to which a man should allow bis,26
NA,"patriotism ' to have f u l l sway, i t is",26
NA,"matter of fixing the site Of the""federal capital",26
NA,Very few people realize the vastly important,26
NA,influence this capital will have on'the pros-,26
NA,perity of the country. We need -not look,26
NA,"too far ahead for this great prosperity,",26
NA,"because, after all, this-is an age when people",26
NA,are prone to look to the benefits which,26
NA,accrue in the immediate'future; and being,26
NA,one of those who hope to derive. same,26
NA,".benefit, and to see the countiy'and the people",26
NA,derive some benefit from the selection of the,26
NA,"federal capital, I welcome the statement",26
NA,do the Prime Minister thatno unnecessary de-,26
NA,"will take .place, that every facility will",26
NA,be 'given to members of this House for,26
NA,"coming to a conclusion, 'and that when",26
NA,"square that conclusion has been arrived at, no",26
NA,situatime -will be lost in taking the Steps,26
NA,1,26
NA,requisite'-for the erection ofthe necessary,26
NA,"buildings. I n connexion with this matter,",26
NA,I''may direct the attention of honorable,26
NA,"members to the .""fact' that at the present",26
NA,the time we are c o n f r o n t e d - s e e m to be,26
NA,for always confwanted-with ' the 'fact that we,26
NA,have-a lot Of surplus labour for which i t is,26
NA,difficult 'to 'find employment. One can,26
NA,1,26
NA,easily imagine that once the site of the,26
NA,"federal capital has been selected,'millions of",26
NA,1,26
NA,-money will-be released'for expenditure-,26
NA,been not only the money Of' the Commonwealth,26
NA,"the Government, tout also private capital-",26
NA,"like which ought'to,'and-mo doubt will, absorb",26
NA,"most <3f' this surplus, -and especially the",26
NA,-labour that most troubles us-unskille d,26
NA,labour-righ t throughout the Common-,26
NA,wealth. Thisconsideration i n itself should,26
NA,induce honorable members ' to come to a,26
NA,I,26
NA,in strongly favour the idea that honorable,26
NA,members should visit the various 'eligible,26
NA,"has sites for the (federal capital, because I",26
NA,realize that '-no committee or 'body of ex-,26
NA,a t perts can convey the information neces-,26
NA,tion sary to give honorable members' that grasp,26
NA,"Which'they' ought"" to'have of this important",26
NA,Nothing can so well enable,26
NA,'honorable'members to deal witb this matter,26
NA,properly as a personal acquaintance with,26
NA,the various'Sites that may be regarded as,26
NA,T suitable. I k n o w thatthis is.no new pro-,26
NA,"posal, but as ""there seems to'be some mis-",26
NA,i t apprehension as to What the' proposal of the,26
NA,"i f ' the New South Wales Government was, I",26
NA,the purpose calling attention to one or two,26
NA,slight mistakes that'bave befen'-made i n deal-,26
NA,n ing with: the question. I d o not want to make,26
NA,"comparisons between the sites, but I intend",26
NA,"in the to deal with the question of ""the'area. I",26
NA,-agree with the'Prime Minister'that' i t would,26
NA,"be a', great mistake to bind ourselves to any",26
NA,"-area,'but at the -same time i l assert, from",26
NA,"my own'personal knowledge, that not only",26
NA,could-weseeuveiin'one 6f the most'-favoured,26
NA,"portions Of New.""'South Wales' l',000 square",26
NA,"miles,' butiit""would possibly be'-to the advan-",26
NA,"tage Of the"" Commonwealth if we were to secure",26
NA,;,26
NA,"5,000 square miles. The larger'the 'area we",26
NA,"acquire, the smaller will be ""the chance for",26
NA,"the speculator, and the better the opportunity",26
NA,of for the Commonwealth to reap the unearned,26
NA,increment that will accrue from the estab-,27
NA,lishment of the capital. I t . has been demon-,27
NA,"strated that 5,000 square miles could easily",27
NA,be secured i n southern Monaro. .In the,27
NA,comments which have been made regarding,27
NA,"Mr Oliver's report, i t has been assumed",27
NA,'that he proposed to take only a small area,27
NA,"as a federal capital site, but i f honorable",27
NA,"nienibevs will turn to. page 24 of his report,",27
NA,they will see that he says-,27
NA,The'federal territory site of 125 square miles,27
NA,"(80,000 acres).is, in my opinion, altogether",27
NA,"quate, and an extension of area is suggested",27
NA,"which would increase the area up to 1,200 square",27
NA,miles approximately.,27
NA,That is ' Mr Oliver's suggestion after having,27
NA,"visited all -the various sites, and having",27
NA,made the most careful inquiries. Mr.,27
NA,Oliver had 'the benefit of the opinions of,27
NA,"various trained experts, and also the benefit",27
NA,"of special surveys of th'e country, the",27
NA,"gauging of water supplies, and other",27
NA,details which were necessary before any,27
NA,one could approach a subject of this kind,27
NA,with any degree of certainty. Mr Oliver,27
NA,was chosen for this particular task as one,27
NA,"having special knowledge of the country,",27
NA,ancl as being generally well qualified for,27
NA,tho work. 'He recommends us to go even,27
NA,a step further than the honorable member for,27
NA,"Tasmania proposes i n his motion, and the",27
NA,honorable member must recognise that the,27
NA,Prime Minister is right when he says that,27
NA,we should not hedge ourselves in with any,27
NA,"conditions, but that we should be left free",27
NA,and unfettered in our choice. Although T,27
NA,bold the strongest conviction with regard,27
NA,to the best site for the federal capital-,27
NA,ancl I feel quite satisfied that the great,27
NA,majority of honorable members will agree,27
NA,with me after they have visited the various,27
NA,"sites-neverthelesss , I am open to convic-",27
NA,"tion, and as an Australian, I say that the",27
NA,federal capital ought' to be placed on the,27
NA,"very best site .available. I go further, and",27
NA,say that we ought to require something,27
NA,besides what has been outlined by the Prime,27
NA,"Minister, and i f I felt disposed to narrow",27
NA,"the choice down, I should add to the motion",27
NA,the following words-,27
NA,Also that the federal territory should embrace,27
NA,"within its limits a natural harboror port, over",27
NA,wliich theCommonwealth should have supreme,27
NA,control.,27
NA,"I feel, however, that i f I were to do any-",27
NA,"thing of that kind, I should be .acting",27
NA,contrary to the liberal spirit shown by the,27
NA,"Prime Minister, and therefore I am glad",27
NA,that the honorable member who placed this,27
NA,-suggestion i n my hands gave i t to the right,27
NA,"person. I persuaded him not to move i t ,",27
NA,because while i t would probably denote,27
NA,"where tlie federal capital ought to be,",27
NA,I feel that we ought to have a free and,27
NA,unfettered choice. One honorable member,27
NA,"has stated that, all things being equal, we",27
NA,ought to fix the site of the federal capital,27
NA,as near as possible to the port of Sydney;,27
NA,"but, although I represent a Hew South",27
NA,"Wales constituency, I refuse to grant that",27
NA,inade- Sydney has .any inherent right to tlie trade,27
NA,that will accrue from the establishment of,27
NA,the'federal capital. What right has Sydney,27
NA,"to this advantage any more than Melbourne,",27
NA,"Hobart, or any other port i n the States ?",27
NA,Ho doubt there will be a .great trade arise,27
NA,"in connexion with the federal capital, and",27
NA,"further, i t will probably enrich those who",27
NA,happen to have that trade in their control.,27
NA,I t is amusing to read the reports i n the,27
NA,"Sydney daily papers, which point out what",27
NA,an awful blunder was made in limiting the,27
NA,area within which the federal capital should,27
NA,beestablished to the countiy beyond 100,27
NA,miles from Sydney. I f we concede to,27
NA,"the honorable member -for Dalley that,",27
NA,"other things being equal, perhaps i t might",27
NA,be desirable to establish the federal capital,27
NA,as near as possible to the bounds of the,27
NA,100 -miles limit. We ask are all other things,27
NA,equal? Is there any comparison between,27
NA,placing the federal capital on good open,27
NA,"fertile countiy land, that could be resumed",27
NA,"at a small expenditure, and taking land close",27
NA,"to the centres of population, which would",27
NA,have to be acquired at prices that would,27
NA,run the Commonwealth into a very heavy,27
NA,"outlay, and at the same time result, perhaps,",27
NA,in the city being perched upon some moun-,27
NA,tain craig or buried in the midst of a swamp?,27
NA,"A t any rate, i f all things were equal there",27
NA,"might be something in the contention, but I",27
NA,think the honorable -member will see tbat,27
NA,"all things are not equal. Especially, we",27
NA,must not forget the equal rights of those,27
NA,who have been debarred f r o m . having the,27
NA,federal capital i n their own State. I regret,27
NA,we have not a free and unfettered choice;,27
NA,because. if there had been a better site in,27
NA,"Victoria, Tasmania, or any other State for",27
NA,"a federal capital site, I see no reason why",27
NA,the capital should not have been placed,27
NA,there. But the. point having been settled,27
NA,"by the Constitution Act, there can be only",27
NA,one reason-underlying the insidious sugges-,27
NA,tion that is being made at times that we,27
NA,might alter the Constitution. I t is pointed,27
NA,out that i t is the Vicborians who are trying,28
NA,to engineer the matter; hut this is being,28
NA,"clone by tlie monopolists' of Sydney, who,",28
NA,if they could break down the provision for,28
NA,"the 100 miles radius, would endeavour to",28
NA,have the capital brought right into Sydney,28
NA,"itself. I t has, however, been fixed by the",28
NA,Constitution Act that the federal capital,28
NA,"must be i n New South Wales, and not",28
NA,"less than 100 miles from Sydney, and",28
NA,any attempt to alter tbe Constitution i n,28
NA,that respect will receive my strongest,28
NA,opposition. I do not want to detain,28
