Speaker,Text,pageNumbers
NA,city is built will belong to the people,18
NA,"of Australia, but that every one of the",18
NA,public conveniences connected with' the,18
NA,"city, such as waterworks, railways, tram-",18
NA,"ways and gasworks, will be owned, con-",18
NA,"trolled, and managed by and i n the",18
NA,interests of the people. We have an,18
NA,opportunity that is possibly unique i n,18
NA,the history of the world. I f we seize,18
NA,"that opportunity, we shall be able to",18
NA,present to the world a spectacle such as,18
NA,the world has not previously seen-a n en-,18
NA,"tire city, and all connected with the city,",18
NA,owned and managed for the people of Aus-,18
NA,"tralia. That being so, let me add that if",18
NA,there are to be any profits coming from the,18
NA,"area itself, all those profits should go into",19
NA,the pockets of the people-no t merely the,19
NA,"profits from the city itself, or the area on",19
NA,"which the actual buildings are erected, but",19
NA,"from the whole area, whatever i t is.",19
NA,Whether the land be built on or leased for,19
NA,"agriculture or other purposes, all the rents",19
NA,or profits coming from the ground itself,19
NA,ought to flow into the national treasury.,19
NA,"By that means,' what the honorable",19
NA,"member for Tasmania, Mr O'Malley,'",19
NA,"desires, will take place. The unearned",19
NA,increment which must necessarily arise i n,19
NA,"connexion with a city of this kind, will go",19
NA,"not to persons, companies, or syndi-",19
NA,"cates, but to those who have a legiti-",19
NA,mate right to it-th e people. The area,19
NA,should be large enough to secure several,19
NA,"distinct advantages. I n the first place, we",19
NA,are necessarily limited by the Constitution.,19
NA,"The area, wherever i t is, must be in New",19
NA,South Wales. I t is somewhat a pity,19
NA,that we are restricted to one particular,19
NA,State. That restriction in my opinion,19
NA,"was a mistake, but inasmuch as i t is",19
NA,"embodied in tbe Constitution, we have to",19
NA,abide by it and do the best we can under the,19
NA,"circumstances. I , at any rate, propose to",19
NA,abide by the Constitution in this regard. I n,19
NA,"the next place, we should ""seek to get",19
NA,"an area which, as a first essential, has",19
NA,"a good climate: and, as a second essen-",19
NA,"tia], is easity accessible. We must have a",19
NA,"first-class water supply, and the. capital",19
NA,"city, wherever i t is, ought to be within",19
NA,reasonable distance of the more central,19
NA,parts of the Commonwealth. I n this,19
NA,second condition there are really three divi-,19
NA,"sions-climate , water supply, and accessi-",19
NA,"bility. A t the same time, as has been",19
NA,"pointed out by writers i n the press, and I",19
NA,think by some honorable members of this,19
NA,"House, the city should be sufficiently inland",19
NA,ancl remote from immediate attack to be,19
NA,quite safe. I t would be unwise to build a,19
NA,city of this kind right on tbe coast. We,19
NA,"do not want an enemy to make a raid, and",19
NA,"destroy a city which ought to be, and I hope",19
NA,"will be, an artistic monument, as well as",19
NA,"a centre of usefulness. The site ought,",19
NA,"therefore, to be sufficiently far inland to",19
NA,"preserve the city itself, and also to preserve",19
NA,"the national treasures, which, I suppose, will",19
NA,be properly stored there. But I think fur-,19
NA,"ther, and this is the main point of the argu-",19
NA,"ment, that tbe area of land ought to be large",19
NA,enough for something more than a mere city.,19
NA,There ought to be the benefit of agricultural,19
NA,and industrial development quite apart from,19
NA,the ground rents of the business premises,19
NA,connected with the city. We ought to,19
NA,secure an area which will feed the city,19
NA,quite apart from the city's own resources.,19
NA,"We should choose a site which, as far as",19
NA,"possible, will give us those advantages. The",19
NA,"city should be fed, and perhaps clothed, out of",19
NA,"its own resources, and for that reason all the",19
NA,area surrounding tlie city for many miles- I,19
NA,am not going to limit myself to any particular,19
NA,area-shoul d beowned by theConimonwealth.,19
NA,A l l that comes out of agricultural or in-,19
NA,dustrial development round about.this city,19
NA,ought also properly to belong to the Com-,19
NA,monwealth. This can only be obtained by,19
NA,acquiring an area greater than 100 square,19
NA,miles. I t is generally agreed that that,19
NA,area is too small. I do not know of any,19
NA,man who regards i t as sufficient. The,19
NA,aim that we are striving after can only,19
NA,be achieved by increasing the size. I,19
NA,hope that no town or hamlet will lie,19
NA,chosen just because i t happens to be i n,19
NA,existence. I do not favour any of the,19
NA,cities where large interests are already,19
NA,"created, such as Albury, Orange, or any",19
NA,other of the larger places that have been,19
NA,mentioned. I f we buy up huge interests,19
NA,"such as these, we shall be making a very",19
NA,great mistake from two points of view.,19
NA,I n the first place the site of the capital,19
NA,would cost us more than i t should. I n the,19
NA,second place we should not be able to build,19
NA,"that artistic and sanitary city, which we",19
NA,"hope to create, without pulling down or re-",19
NA,constructing any one of the towns already,19
NA,"indicated. Personally, as far as possible, I",19
NA,would seek to build acity which would benew,19
NA,from centre to circumference; which would,19
NA,"be up-to-date in every possible respect,",19
NA,and which would include no existing town,19
NA,or village. I f a town must be included,19
NA,"within tbe federal area, then the smallest",19
NA,"possible place ought to be selected, so that we",19
NA,should have to pay as little as possible for,19
NA,"reconstructing or removing i t . Moreover,",19
NA,if we purchase country where no such,19
NA,"vested'interests exist, i t will be very much",19
NA,easier for us to carry out tbe ideal we have,19
NA,in view than i f we select territory where,19
NA,they arefcobe found. The more we look at,19
NA,"this question, the more i t will appear to us",19
NA,thatfcheleast we have to do with existing,19
NA,towns or hamlets the better it will be for,19
NA,us. Another result of buying land which,19
NA,"included a town might be to give to persons,",19
NA,already looking forward to making some,19
NA,"profits, greater claims upon us than they",20
NA,have any right to possess. I do not know,20
NA,exactly how this matter can be overcome. I t,20
NA,may be that the Government -will be able to,20
NA,induce Parliament to pass an Act providing,20
NA,that the land required for the federal capi-,20
NA,tal site shall be taken over at the muni-,20
NA,cipal valuation at a certain date plus a cer-,20
NA,tain amount for its compulsory resumption.,20
NA,Ifc might be enacted that the municipal,20
NA,ation at an existing date shall be the basis,20
NA,"of purchase, plus 10 or 15 per cent, as com-",20
NA,pensation for taking away the necessary land,20
NA,required .for Commonwealth purposes. I,20
NA,am not certain whether that could be,20
NA,done.,20
Mr VL SOLOMON ,Hav e we tlie right,20
NA,to do so ?,20
Mr HUME COOK ," I do not know, but",20
NA,"something should be done to forestall,",20
NA,"as far as possible, the disproportionate and",20
NA,unfair'claims which the residents of some of,20
NA,these towns may make against us when we,20
NA,come to build our capital. I do not desire,20
NA,to take up the time of the House by discuss-,20
NA,ing details i n connexion with tbe question,20
NA,of how the money is to be raised to cany,20
NA,"out this work, nor do I wish to name any",20
NA,particular site which may appear to me to,20
NA,be sufficiently good for the purpose. I,20
NA,have no wish to deal with any other,20
NA,point incidental to the broad question. M y,20
NA,view is that we ought to treat this matter,20
NA,to-day rather from the point of view of,20
NA,principle than from the point of view of de-,20
NA,tail. I hope that when the federal capital,20
NA,is created i t will have an influence upon,20
NA,political and social life of bhe community at,20
NA,large. Every new city is a new centre of,20
NA,thought. There are too few such centres of,20
NA,thought in Australia. We are too much,20
NA,"dominated by fche great cities of Sydney,",20
NA,"Melbourne, and Adelaide, and too much",20
NA,dominated in those cities by ',20
NA,particular newspapers that we take. Every,20
NA,"new city created will therefore, to a large",20
NA,"extent, help to mould and develop the",20
NA,"thought of tbe continent, and tlie capital",20
NA,city of Australia ouglit to be the apex of,20
NA,the thought of the continent. I t ought,20
NA,to contain within its four comers the,20
NA,best and the brightest intellects that the,20
NA,"continent can gather together, and ifc ought",20
NA,to be a centre from which shall radiate the,20
NA,very best that is in Australia. That is the,20
NA,ideal view of fche question. We may never,20
NA,reach that ideal; but if we do not aim high,20
NA,.shall not hit much. I should like to see the,20
NA,ideal aimed at. I should like to see this,20
NA,city a commercial centre. The commercial,20
NA,element cannot be excluded or overlooked.,20
NA,"The capital city, however, should also be",20
NA,something like a model or type of art,20
NA,and refinement-th e artistic element cannot,20
NA,be overlooked. I f we read the words,20
NA,of the motion itself i t will be seen that,20
NA,this is a point which the honorable mem-,20
NA,valu- ber who moves i t has not forgotten. As,20
NA,we listened to his flowing sentences we.,20
NA,must have felt that the ajsthetical and,20
NA,"artistic, from his point of view, was",20
NA,more to be considered than any other,20
NA,matter to which he referred. The build--,20
NA,ing of this city may take some t i m e;,20
NA,"and, whilst we have no right to delay it, we",20
NA,have no right to hurry i t . I hope i t will,20
NA,embrace these three tilings-th e commercial,20
NA,"element, the public element-wherei n every-",20
NA,thing shall belong to the people of Aus-,20
NA,"tralia-an d the artistic element, which will",20
NA,make the city a fit repository of tlie nation's,20
NA,"treasures, and something like a symbol of",20
NA,"its greatness, its liberty, and its progress.",20
Mr WILKS ,Dalley) -A s a representa-,20
NA,"tive of New South Wales, I am pleased that",20
NA,the honorable member for Tasmania has,20
NA,brought this question forward. I hope that,20
NA,later on i n tlie debate the Prime Minister,20
NA,will make some statement to the House as to,20
NA,the intentions of the Government. We have,20
NA,listened to-day to the grandiloquent language,20
NA,"of tbe honorable member for Tasmania,",20
Mr OMALLEY ,"t o his rounded periods,",20
NA,and his wealth of imagery-languag e which,20
NA,the coming from me would sound very much like,20
NA,the words of a quack medicine advertise-,20
NA,"ment. I do not wish to repeat his style, but",20
NA,simply to say that we now have an oppor-,20
NA,"tunity of dealing with this question, although",20
NA,this is only an abstract motion. The Con-,20
NA,stitution provides that the area of tlie,20
NA,the federal capital shall be not less than 100,20
NA,square miles. Since the passing of the Con-,20
NA,"stitution Act, however, the Premier of New",20
NA,South Wales- a State which has a lot,20
NA,to do with this matter-ha s said that the,20
NA,Government of that State are prepared to,20
NA,grant an additional area of 15 miles,20
NA,"square, making a total of 25 miles square.",20
Mr BARTON ,The y made a reservation,20
NA,of 15 miles square.,20
Mr WILKS , That would mean 225,20
NA,"square miles as against 100 square miles,",20
NA,which is tbe area provided for i n,20
NA,we the Constitution - The Constitution ' Act,20
NA,also requires that . the site of the,20
NA,federal capital shall be not less than 100,21
NA,miles from Sydney. Although i t may not,21
NA,seem fit after the speech made by the honor-,21
NA,able member for Tasmania to deal with this,21
NA,"matter from a utilitarian stand-point, I can-",21
NA,not help saying that the granting of 225,21
NA,"square miles, mainly comprised of Crown",21
NA,"lands, is no small present to the Common-",21
NA,wealth.,21
Mr OMALLEY , W e want to pay for i t .,21
Mr WILKS ,If c would be difficult to,21
NA,find in New South Wales an area suitable for,21
NA,the purpose larger than I have named.,21
NA,hope that there will be no restrictions placed,21
NA,on the question of area. New South Wales,21
NA,wants this portion of the bargain completed,21
NA,speedily.,21
Mr OMALLEY , A n d so do we.,21
NA,1,21
Mr WILKS , I quite understand that,21
NA,the honorable member for Tasmania,21
NA,may hold a brief for the Government,21
NA,"whip, the honorable member for Eden",21
NA,"Mouaro, who representsBombala. He",21
NA,did his work very well indeed; but I do,21
NA,not wish to anticipate. Honorable members,21
NA,are to have an opportunityof visiting the,21
NA,various suitable sites i n New South Wales,21
NA,"for the purpose of obtaining information,",21
NA,"and for the purpose, I trust, of coming to",21
NA,an early decision. A l l that has been stated,21
NA,"by the last speaker, and by tlie mover, goes",21
NA,almost without saying. We trust tbat tbe,21
NA,erection of a suitable city on up-to-date,21
NA,principles will be carried out;' but we are,21
NA,not prepared to wait until the tune when,21
NA,the boy i nfchestreet will use the beautiful,21
NA,language which the honorable member for,21
NA,Tasmania used in introducing the. motion.,21
NA,Nor are we prepared to wait for the,21
NA,"city i n the clouds, which the last speaker",21
NA,so airily sketched. A l l we hope is that,21
NA,"the site will be selected, and that the city",21
NA,will be laid out to meet tlie requirements,21
NA,of the day and with possibilities for future,21
NA,development. I am not one of those who,21
NA,"think that, because we have a federal",21
NA,"capital, immediately around that capital",21
NA,will srather the intellect of the Common-,21
NA,wealth. Nor am I prepared to see,21
NA,"raised within a week, or a few hours, an",21
NA,Aladdin city which will astonish the world.,21
NA,"I do not expect anything of that sort, nor",21
NA,do I think that thepeopleof New South Wales,21
NA,"will expect i t . Perhaps we may be cast,",21
NA,i n an inferior mould; but we do hope that,21
NA,a suitable site will be obtained afc an early,21
NA,"moment, and that i t will not be such an area",21
NA,"as 1,000 square miles. I cannot under-",21
NA,stand why fche honorable member did not,21
NA,"suggest 2,000 square miles, so that we could",21
NA,resume the whole of Tasmania for the site of,21
NA,an ideal city. One of the reasons for,21
NA,accepting the Commonwealth Bill i n New,21
NA,South Wales was that the federal citv,21
NA,"would be established within the territory, aud",21
NA,the compromise made by its Prime Minis-,21
NA,"ter, Mr Reid, with the Prime Minister of",21
NA,"Victoria, Sir George Turner, was that that",21
NA,city should be not within 100 miles of,21
NA,Sydney. The reason for inserting that re-,21
NA,I striction to my mind was so that neither tbe,21
NA,commercial city of Sydney nor the commer-,21
NA,cial centre of Melbourne should obtain any,21
NA,"preference. That was the idea thrown out,",21
NA,"and i t was expressed, I suppose, by men i n",21
NA,their calmer moments. The people of New,21
NA,South Wales expect that city to be built,21
NA,"where all tbe surroundings are suitable, and",21
NA,that i t shall be as close as possible to that,21
NA,100-mile line. Although the Constitu-,21
NA,tion says that i t shall be net within,21
NA,"100 miles"" of Sydney, tbe people of New",21
NA,"South Wales expect, all things being equal,",21
NA,that i t shall be as near as possible to that,21
NA,line.,21
Mr CHAPMAN ,No t all the people of,21
NA,New South Wales.,21
Mr WILKS ,Th e larger portion of the,21
NA,people who decided the life of the Common-,21
NA,wealth Bill. Hundreds and thousands of,21
NA,persons voted for the acceptance of that Bill,21
NA,for the consideration that an area of not less -,21
NA,than 100 square miles as close as possible,21
NA,to that line should be the federal territory.,21
NA,But even on that point I do not think the,21
NA,"people of New South Wales feel so strongly,",21
NA,that i f a more suitable area were found,21
NA,some miles outside that line they would not,21
NA,be prepared for their representatives to sup-,21
NA,port tbe selection. . I hope that this motion,21
NA,will elicit from the Prime Minister a state-,21
NA,ment as -to whether any action has been,21
NA,"taken, and i f so, when the people of New",21
NA,South Wales can expect the choice of the,21
NA,federal site to be determined. So far as tlie,21
NA,"erection of the capital is concerned, I hope",21
NA,that when a site has been chosen by the,21
NA,"authorities and approved by this House, i t",21
NA,will not be necessary for this Parliament to,21
NA,wait until a palatial structure can be erected,21
NA,to suit either the demands or the wishes of .,21
NA,honorable members after tlie style which,21
NA,was suggested by the mover or the last,21
NA,speaker. I hope that the Commonwealth,21
NA,will keep the bargain which was made with,21
NA,New South Wales and obey the spirit of the,22
NA,"Constitution, and that immediately a site is",22
NA,selected a structure will be run up for the,22
NA,housing of the Parliament. After that i t,22
NA,will be a matter of development. I do not,22
NA,think tbat any man i n his calm senses,22
NA,anticipates that for many years the federal,22
NA,"city, because i t is the capital, will be sur-",22
NA,rounded by the wealth and prominence,22
NA,which some honorable members expect. I t,22
NA,will be simply a matter of development. I t,22
NA,will be the natural resources around that,22
NA,"area which will attract the population, and",22
NA,not fche fact that i t is the political centre,22
NA,Australia. I hope that the Prime Minister,22
NA,"will give an expression of opinion, because the",22
NA,"people of New South Wales, although not",22
NA,pushingfchequestion are as much concerned,22
NA,in its determination as is the honorable,22
NA,"member for Kalgoorlie, who gave notice",22
NA,of a motion this afternoon in regard to,22
NA,what he considered a bargain on behalf of,22
NA,Western Australia. We simply wish the,22
NA,"provision ""in the Constitution to be carried",22
NA,"out, and the opinion of the people, so far",22
NA,"as i t can be interpreted, is that, all things",22
NA,"being equal, the suitable site should be as",22
NA,close to the 100-mile radius as possible. Of,22
NA,course 1 can understand the honorable,22
NA,member for Tasmania being carried away,22
NA,by his sesthefcie nature into regions repre-,22
NA,sented by the most seductive member who,22
NA,represents Eden-Monaro.,22
Mr BARTON ,Hunter-Ministe r for,22
NA,"External Affairs) - I feel a little cold, after",22
NA,warming myself at the beacon fires l i t by the,22
NA,"honorable member for Tasmania, now that",22
NA,I have been placed under the cold douche of,22
NA,the speech of thehonovablememberfor Dalley.,22
NA,We have had the sentiment of the matter,22
NA,"fully developed i n one direction, and we",22
NA,"have had a good deal of common sense, per-",22
NA,"haps not quite optimistic enough, from my",22
NA,honorable friend on the other side. The,22
NA,question that has been raised by the honor-,22
NA,able member for Tasmania cannot be,22
NA,"said to be inopportunely raised, nor",22
NA,can any complaint be made as to,22
NA,the terms in which he has brought forward,22
NA,bis motion. But I think the House will,22
NA,"agree with me, that, considering the diffi-",22
NA,culties that may arise i n connexion with,22
NA,"the selection of a capital, i t would not be",22
NA,a good thing for the country at large to,22
NA,have too many restrictions laid down at this,22
NA,stage. We all know that 'the site which,22
NA,we are to choose must be a healthy one.,22
NA,.We all know that i t must be well watered.,22
NA,"I t will not do to have a capital, the popula-",22
NA,"tion of which will from time to time increase,",22
NA,"and to find after a generation or two, or",22
NA,perhaps even earlier i f the place is.,22
NA,"lucky, that the needs of the population",22
NA,in respect of water supply are insuffi-,22
NA,ciently met by any reasonable engineer-,22
NA,"ing use of the facilities in tlie district, and",22
NA,"that therefore the capital has to be removed,",22
NA,although a village may remain i n the,22
NA,old spot. That would never do. I n the,22
NA,same way we must not insist on fer-,22
NA,"tility, within tbe particular area as an",22
NA,of essential requirement. And why? Wherever,22
NA,the capital is there -will be Inter-State,22
NA,free-trade. I t will be able to derive,22
NA,"its supplies from the surrounding country,",22
NA,and so long as i t is near to land which is,22
NA,fertile that will be sufficient so far as its,22
NA,own supplies are concerned. I can easily,22
NA,imagine a case i n which the choice might,22
NA,"be between good agricultural laud, well",22
NA,"watered for the raising of crops, but too",22
NA,low and not healthy enough for the site,22
NA,"of the capital, and good hilly country,",22
NA,"quite near to it, with an abundant water",22
NA,"supply, which would more amply satisfy",22
NA,all conditions both as to picturesqueness,22
NA,and healthiness of situation. That is one,22
NA,reason why we should not tie ourselves,22
NA,down. I intend to move an amendment,22
NA,"which will go as far as the Government,",22
NA,think we ought to go in the direction of any,22
NA,restriction. I n that amendment I have not-,22
NA,provided for any particular area by way of,22
NA,"measurement, because i t strikes me that",22
NA,that would be fatal to the very object we,22
NA,"have in view. Now, as to this matter of",22
NA,"area, which would be the better thing-t o",22
NA,"take 1,500 or2,000 square miles of land",22
NA,not perfectly suitable to contain the capital',22
NA,"city and its appanages, or to take 700, 800,",22
NA,or 900 square miles of iand perfectly suitable,22
NA,for all the purposes of a capital territory ?,22
NA,I t is clear that i f we lay down the mini-,22
NA,"mum of 1,000 square miles, we may find",22
NA,ourselves passing by the most adapt-,22
NA,able site we could find i n Australia.,22
NA,The Constitution has made a restriction,22
NA,that shuts out two of the most eligible sites,22
NA,"in Australia, one i n New South Wales and",22
NA,the other in Victoria. I refer to the Moss.,22
NA,"Vale district and the Ballarat district. For,",22
NA,whatever may be said as to the site of the-,22
NA,"capital, I think every one to whom I have-",22
NA,spoken on the subject agrees that among,22
NA,the finest sites are the two districts I have-,22
NA,"just named. But the Constitution having,",22
NA,"by its own operation, cut us off from tlie",23
NA,"selection of either of those places, has",23
NA,reduced the number of suitable sites ; aud 1,23
NA,think we should see to i t that Ave do not,23
NA,further reduce them by unnecessary restric-,23
NA,tions. ' I agree with a very great deal of what,23
NA,has been said by the honorable member for,23
NA,Bourke as to the requirements. I agree,23
NA,with his line of argument against undue re-,23
NA,strictions. We might leave a good deal 'of,23
NA,common ground between tbe motion and,23
NA,"the amendment I intend to submit, and",23
NA,avoid the dangers into which I think we,23
NA,should fall by adopting the motion as i t,23
NA,stands. I propose to omit all the words,23
NA,"after "" area "" with a view to substituting the",23
NA,"following, i n which I retain some of the",23
NA,words offchemotion :-,23
NA,"Of land well watered, healthily situated, and",23
NA,large enough to fully meet all probable re-,23
NA,"quirements, and secure to the Commonwealth",23
NA,the benefits to accrue from the position of the,23
NA,"capital, such area when secured to remain for",23
NA,"ever the property of the Commonwealth, the",23
NA,"ground only to be let to utilizers, all buildings",23
NA,"be erected under strict regulations, with due",23
NA,regard to public health and architectural beauty.,23
NA,I think that amendment should satisfy tlie,23
NA,desires of the honorable member who has,23
NA,"moved this motion, and should also satisfy",23
NA,"the House, without running into any undue",23
NA,restrictions which might limit our choice,23
NA,hereafter. The question of water is so very,23
NA,important in Australia that i t is necessary,23
NA,to be very careful i u our choice from that,23
NA,point of view.,23
Mr OMALLEY , W e can get that in the,23
NA,Snowy Elver district.,23
Mr BARTON ,Ther e are some well-,23
NA,watered spots that would never do for a,23
NA,"capital, and there are many badly watered",23
NA,"spots' that, if they were not in that condition,",23
NA,would be among the best sites in Australia.,23
NA,We are restricted enough by nature as,23
NA,matters stand ; do not let us add to the re-,23
NA,strictions unnecessarily.,23
Mr A MCLEAN ,I s i t wise to pass any,23
NA,"motion 1 We are all agreed, I think.",23
Mr BARTON ,I f we were to negative,23
NA,"this motion, there are propositions i n i t o f",23
NA,such a character that i t would seem to all,23
NA,Australia that we had improperly negatived,23
NA,it. We are in that difficulty. The wiser,23
NA,"course to pursue, if we do not negative the",23
NA,"motion, is to alter it-becaus e as i t stands i t",23
NA,would unduly restrict our choice-an d add,23
NA,other words which would place tine matter,23
NA,upon what we consider to be proper lines. I,23
NA,may state further that tbe Goverhmenthave,23
NA,been in communication with tine Government,23
NA,"of New South AVales, ancl are likely to re-",23
NA,"ceive ""further assistance from them, upon",23
