Speaker,Text,pageNumbers
NA,pressed a very favorable opinion in regard,17
NA,to the water supply of Lyndhurst.,17
Mr KELLY , A n honest opinion.,17
Mr WATSON ,Tha t goes without say-,17
NA,ing.,17
Mr AUSTIN CHAPMAN , I do not,17
NA,accept the honorable member for Wentworth,17
NA,as an authority on this subject.,17
Mr SYDNEY SMITH , Mr Wade has also,17
NA,favorablv reported on Tumut.,17
Mr AUSTIN CHAPMAN , H e has,17
NA,"made a favorable report on Lyndhurst, and",17
NA,for that reason the honorable member for .,17
NA,Macquarie proposes that he shall be ex-,17
NA,amined. I have no. objection to the adop :,17
NA,"tion of that course, because I am satisfied",17
NA,that Mr Wade would not make a report,17
NA,in favour of any site unless he were con-,17
NA,vinced that it was right to do so. I f we,17
NA,are going to question the value of the,17
NA,various reports which have been submitted,17
NA,"to us, we ought to examine not only Mr.",17
NA,NA,17
NA,and other gentlemen having equally high,17
NA,reputations. Surely we are not going to,17
NA,cast a slur on the high officials who have,17
NA,furnished us with reports? The honorable,17
NA,member for Macquarie. telegraphed to the -,17
NA,Government of New South Wales to secure,17
NA,"the attendance of Mr Wade in Melbourne,",17
NA,"and, knowing that that gentleman is pre-",17
NA,pared to speak in favour of the selection o f,17
NA,"Lyndhurst, he desires that he shall be",17
NA,called. Is Mr Wade to be singled out as,17
NA,the one engineer to give evidence at the,17
NA,Bar of the House? I should like to draw-,17
NA,attention to the fact' that the New South,17
NA,very,17
NA,Wales Engineering Department has been,17
NA,responsible for some terrific blunders in,17
NA,connexion with water supply. Every one,17
NA,in New South Wales is aware that some,17
NA,in that Department must be held re-,17
NA,sponsible for serious mistakes in connexion,17
NA,"with the water supplies of Bathurst, Orange,",17
NA,"Goulburn, and Armidale. I do not say",18
NA,"it was Mr Wade, but if we are to dis-",18
NA,"cuss the relative merits of engineers, we",18
NA,should have some information as to who,18
NA,was responsible for those schemes.,18
Mr WATSON , Mr Wade has only re-,18
NA,cently become Chief Engineer.,18
Mr SYDNEY SMITH,It is a very unfair,18
NA,way in which to try to damage a public offi-,18
NA,cer's reputation.,18
Mr AUSTIN CHAPMAN ,I f we,18
NA,are to decide this question by bringing,18
NA,"men to the Bar of the House, we should",18
NA,"bring a number of men, because it is a",18
NA,well-known fact .that in' connexion with,18
NA,the schemes for water supply for the,18
NA,"places I have mentioned, most glowing re-",18
NA,"ports were issued, by the Department in",18
NA,"New South Wales, as to what the rainfall",18
NA,"would be, what the conservation would be,",18
NA,and we really had in respect to those,18
NA,schemes much the same story as we,18
NA,were told last night. The places to which,18
NA,I refer have had water supplies provided,18
NA,for them on the authority of some engineer,18
NA,"in New South Wales, and in every case",18
NA,they have proved dismal failures. At,18
NA,"Orange, where we are told there is such an",18
NA,enormous catchment area for a water sup-,18
NA,"ply, the people of the little town had to be",18
NA,put on half supply in the summer before,18
NA,last. The mistakes in these cases should,18
NA,"be inquired into, and we should know who",18
NA,>vas responsible for them. I t would be a,18
NA,calamity to us i f we were guided by the re-,18
NA,port of engineers who are incompetent. I,18
NA,do not doubt the figures which were given,18
NA,"to us last night, but we want something",18
NA,more tban figures; we should have facts.,18
Mr SYDNEY SMITH ,Som e honorable,18
NA,members do not want the facts.,18
Mr AUSTIN CHAPMAN , I have not am,18
NA,"the .slightest objection to hear them,",18
NA,we are to have an officer sent here specially,18
NA,by. the New South 'Wales Government to,18
NA,"make, at the Bar of this House, certain",18
NA,"statements regarding a particular site,",18
NA,should also have an opinion from other',18
NA,"officers with regard to other sites, and",18
NA,should saddle the responsibility for the,18
NA,takes made in New South Wales in this,18
NA,connexion on the right shoulders.,18
NA,not believe that Mr Wade would make,18
NA,"such mistakes, but I refuse to allow the",18
NA,honorable member for Macquarie to inferenas,18
NA,tially saddle engineers who have reported,18
NA,favorably of sites other than Lyndhurst,18
NA,with that responsibility. I f Mr Wa.de,18
NA,"to be brought to the Bar of the House,",18
NA,NA,18
NA,reputation as his should also be heard. From,18
NA,NA,18
NA,as to what can be done at Lyndhurst. There,18
NA,"is no running water there, and the sugges-",18
NA,tions as to what can be done there in the,18
NA,way of water supply are all dependent on,18
NA,conditions and circumstances. . I f the in-,18
NA,tention is to pit one public officer against,18
NA,"another, they should all be given fair play.",18
NA,The honorable member for Macquarie cast,18
NA,some reflection upon the Commission ap-,18
NA,pointed by the honorable member for,18
NA,"Hume, only because that Commission did",18
NA,not supply him with as good a report on,18
NA,Lyndhurst as he could get from Mr.,18
NA,Wade's figures. The last thing we,18
NA,should try to do in this House is to,18
NA,pit one public officer against another.,18
NA,I f I do not agree that what Mr.,18
NA,"Wade has done is right, that is no",18
NA,reason why I should try to cast the slightest,18
NA,doubt upon his ability or his honesty. No,18
NA,one who knows Mr Wade would think of,18
NA,doing so; but he should not be brought here,18
NA,as a kind of special pleader for one site.,18
NA,That would put Mr Wade in a very false,18
NA,position. The very fact that the honor-,18
NA,able member for Macquarie telegraphed to,18
NA,have this officer brought here should be,18
NA,"enough"" to induce honorable members to",18
NA,hesitate before they agree to what has,18
NA,been proposed. We were told by the,18
NA,honorable member that Mr Wade re-,18
NA,ported that at Lyndhurst there is not,18
NA,only a Sufficient water supply for the,18
NA,"Federal City, but that there could be",18
NA,"procured 135,000,000 gallons a day for",18
NA,irrigation purposes. All I can say is that,18
NA,many of us who could not get even a drink,18
NA,"of cold water there, would be very glad to",18
NA,get such information from Mr Wade. I,18
NA,disposed to think that there is one good,18
NA,but i f reason why that gentleman should be,18
NA,. brought to the Bar of the House. He has,18
NA,"just returned from America, and the hon-",18
NA,orable member for Barrier is under the,18
NA,we impression that the report quoted must,18
NA,"be upon the Mississippi, and not upon",18
NA,"we Lyndhurst, and I think it is well that that",18
NA,misshould be cleared up. I am quite certain,18
NA,that any report by Mr Wade would be,18
NA,"I do an honest one. In my opinion, he is",18
NA,"a very competent engineer, but i f he' is",18
NA,to be brought before the Bar of the House',18
NA,the special pleader for a particular,18
NA,"site, in _ justice to other sites, we",18
NA,should also' have here some of the,18
NA,is engineers who have told us that' un-,18
NA,"less Weare prepared to spend millions, it",18
NA,a will be almost a matter of impossibility to,18
NA,get a water supply at Lyndhurst. We,19
NA,"might get water to the moon, i f we spent",19
NA,enough money. I f Mr Wade is to be,19
NA,"brought to the Bar of the House, another",19
NA,telegram should be sent to Sydney to some,19
NA,"other engineer, whose reputation is just",19
NA,"as good as is Mr Wade's, and who will tell",19
NA,us that unless we go to the expenditure of,19
NA,millions there is a risk that at Lyndhurst,19
NA,we should have more whisky than water.,19
Mr JOSEPH COOK ,Parramatta) -,19
NA,The honorable member for Eden-Monaro,19
NA,has told us that he has not the slightest,19
NA,objection to Mr Wade appearing at the,19
NA,"Bar of the House, and he has further said",19
NA,that he believes that gentleman to be a,19
NA,"competent engineer, who would give an",19
NA,"honest opinion. I f that be so, may I ask",19
NA,what we should gain by questioning Mr.,19
NA,Wade as to the engineering failures that,19
NA,have occurred at different places in New,19
NA,South Wales in connexion with small water,19
NA,supplies.,19
Mr AUSTIN CHAPMAN ,H e might give,19
NA,us some information in respect to them.,19
Mr JOSEPH COOK ,"H e might,",19
NA,but what would be the advantage gained,19
NA,by asking Mr Wade's opinion upon matters,19
NA,"which did not concern him, and which are",19
NA,not connected with the question before us,19
NA,in any way ? The object could only be to,19
NA,try to influence the minds of honorable,19
NA,members adversely to Mr Wade's opinion.,19
NA,At one moment the honorable member says,19
NA,"that Mr Wade is an honest man, and in",19
NA,the next he says that we should have him,19
NA,"here"" that we may ask him about these",19
NA,failures.,19
Mr MCLEAN ,A n honest man may,19
NA,make a mistake.,19
Mr JOSEPH COOK ,Th e honorable,19
NA,NA,19
NA,should be brought here i f Mr Wade is to,19
NA,be consulted. I should like to point,19
NA,that the figures quoted by the honorable,19
NA,NA,19
NA,ham's figures. Mr Wade has taken Mr.,19
NA,"Pridham's figures, and on them he has",19
NA,based his report.,19
NA,NA,19
NA,"ham's figures, he is the engineer",19
NA,"consult, and not Mr Wade.",19
NA,NA,19
NA,has said that Dalgety has a better water torate ?,19
NA,"supply than Lyndhurst can ever have, and",19
NA,Mr Wade does not agree with that.,19
Mr JOSEPH COOK ,Tha t is not the,19
NA,question at all. I am prepared to admit hold the same opinion of Lyndhurst.,19
NA,that there is a better water supply at Dalsubmit,19
NA,gety than at Lyndhurst; but what we are,19
NA,concerned about is to establish the fact that,19
NA,an adequate water supply may be obtained,19
NA,at Lyndhurst for all the purposes c f a,19
NA,Federal Capital. I am not concerned to,19
NA,deny that there may be better water sup-,19
NA,plies found elsewhere in New South Wales.,19
NA,"What we say is that in this neighbourhood,",19
NA,which has been so rryjch maligned by some,19
NA,honorable members in this particular re-,19
NA,"spect, there is an abundance of water, and",19
NA,more than the Federal Capital will ever,19
NA,require. I t is the more advisable that we,19
NA,should take advantage of Mr Wade's en-,19
NA,"gineering skill, as he is already in Mel-",19
NA,"bourne, and we can secure his advice with-",19
NA,out delay to the final determination of the,19
NA,question before us.,19
Mr AUSTIN CHAPMAN ,H e is in Mel-,19
NA,bourne at the request of the Lyndhurst,19
NA,site supporters.,19
Mr JOSEPH COOK , I do not know,19
NA,who brought him here.,19
Mr AUSTIN CHAPMAN ,Th e honorable,19
NA,member for Macquarie says that he tele-,19
NA,graphed for him.,19
- Mr JOSEPH COOK , I am prepared,19
NA,to admit that. I hope the honorable mem-,19
NA,ber d i d ; i t would be but evidence of his,19
NA,industry and enterprise in this matter.,19
NA,May I remind honorable members that the,19
NA,Government of New South Wales are in,19
NA,favour of the Lyndhurst site? I submit,19
NA,respectfully that a site which is recom-,19
NA,"mended by the Government, and is to be",19
NA,recommended by the Parliament of New,19
NA,"South Wales, is entitled to their serious",19
NA,consideration.,19
Mr AUSTIN CHAPMAN ,Th e New South,19
NA,Wales Government are not in favour of i t .,19
Mr JOSEPH COOK ,Al l I have to,19
NA,say to that is that the Premier of New,19
NA,South Wales announced to the country only,19
NA,the other day that i f returned to power he,19
NA,out would ask the Parliament of New South,19
NA,Wales to recommend Lyndhurst to the,19
Mr AUSTIN CHAPMAN ,H e said he,19
NA,would leave i t an open question.,19
Mr JOSEPH COOK ,Th e honorable,19
NA,we should member is quite wrong.,19
Mr AUSTIN CHAPMAN ,Wh y not be f a i r,19
NA,state that Lyndhurst is in his own elec-,19
Mr JOSEPH COOK ,No t only Mr.,19
NA,"Wadclell, but all the influential members o f",19
NA,the late Government in New South Wales,19
NA,I,19
NA,that a site favoured by the Govern-,19
NA,ment of the State which has to grant the,19
NA,"land, and which has spent a very large",20
NA,sum of money in facilitating the object,20
NA,we have in view> should be considered.,20
NA,The New South Wales Government have,20
NA,sent over an engineer with a special report,20
NA,"upon the water supply at Lyndhurst, and we",20
NA,"should, in courtesy to them, hear what this",20
NA,engineer has to say. I t is the more impor-,20
NA,tant that we should hear him since we had,20
NA,last night an expert opinion adverse to,20
NA,Lyndhurst as a site from the right honor-,20
NA,able member for Swan. Nothing more,20
NA,damaging to the character of Lyndhurst as,20
NA,a suitable site for the Federal Capital could,20
NA,be urged than the opinion offered by the,20
NA,right honorable member.,20
Sir JOHN FORREST ,I t was offered some,20
NA,time ago; the report has been on the table,20
NA,for some time.,20
Mr JOSEPH COOK , I am referring,20
NA,to the right honorable member's remarks,20
NA,last night. He told us that it would be,20
NA,absolutely dangerous in summer time i,20
NA,scheme suggested by this engineer were,20
NA,carried out.,20
Sir JOHN FORREST , I do not,20
NA,said that.,20
Mr JOSEPH COOK ,Th e right honor-,20
NA,able member told us that the water stored,20
NA,"would become polluted in summer, and",20
NA,would be a source of danger.,20
Sir JOHN FORREST , I referred to,20
NA,artificial lake suggested.,20
Mr JOSEPH COOK , I could not,20
NA,imagine a more severe condemnation of the,20
NA,scheme than we had from the right honor-,20
NA,able member.,20
Sir JOHN FORREST ,Th e lake need not,20
NA,be made.,20
Mr SPEAKER , I think the honor-,20
NA,able member for Parramatta must see that,20
NA,the remarks he is making now are really but,20
NA,a continuation of the debate upon another,20
NA,question. The mere fact that he is reply-,20
NA,ing to some remarks made in that debate is,20
NA,a proof that the honorable member is trans-,20
NA,ferring to this question debate which should,20
NA,take place in Committee. I must ask the,20
NA,honorable member not to anticipate the de-,20
NA,bate in Committee.,20
Mr JOSEPH COOK , I do not. quite,20
NA,see how I can avoid it. I quite admit,20
NA,"what you say, Mr Speaker, but. on the",20
NA,"other hand, the very purpose of moving",20
NA,the motion for the adjournment of the,20
NA,House is to ask that special engineering,20
NA,skill shall be made available for the pur-,20
NA,"pose, amongst other things, of furnishing",20
NA,information concerning statements made,20
NA,during the course of the debate in,20
NA,Committee. While I know the rule,20
NA,of Parliament that an honorable mem-,20
NA,"ber cannot, upon a motion for the",20
NA,"adjournment, allude to a debate proceed-",20
NA,"ing at another time and place, in this in-",20
NA,"stance it is almost unavoidable. However,",20
NA,I will not further transgress. But I do say,20
NA,"that, in view of the very serious statements",20
NA,imade by the right honorable member for,20
NA,Swan on the question of the water sup-,20
NA,"ply of Lyndhurst, it is of the very utmost",20
NA,consequence that the House should avail,20
NA,itself of every opportunity to test their,20
NA,"truth. Leaving out of sight the advocates,",20
NA,"or partisans, as they have been called, of",20
NA,Lyndhurst-an d I do not object to the term,20
NA,- I urge that the fact that this site is about,20
NA,to be officially recommended for considera-,20
NA,tion by the Government of New South,20
NA,Wales,20
Mr AUSTIN CHAPMAN ,Tha t is absurd;,20
NA,f thehalf the members of the New South Wales,20
NA,Government are against it. The honorable,20
NA,member knows that himself.,20
Mr SYDNEY SMITH ,W e know nothing,20
NA,of the kind.,20
Mr DAVID THOMSON ,Lyndhurs t is in,20
NA,Mr Waddell's electorate.,20
Mr JOSEPH COOK ," I know that, but",20
NA,what has it to do with the question ? Why,20
NA,the does not the honorable member make a simi-,20
NA,lar interjection concerning sites which are,20
NA,in the electorates of other honorable mem-,20
NA,bers?,20
Mr DAVID THOMSON , The remark-,20
NA,applies to them in just the same wav.,20
Mr JOSEPH COOK ,Honorabl e mem-,20
NA,bers opposite imake such interjections with,20
NA,"regard, to those who favour Lyndhurst, but",20
NA,"not concerning the advocates of other sites,",20
NA,who all along have been doing their best,20
NA,for their electorates. More power to,20
NA,them; I do not criticise them on that ac-,20
NA,count. I do not see what point there is,20
NA,in the interjection that Lyndhurst is i n the,20
NA,electorate of the Premier of New South,20
NA,Wales. Of course it is. But that fact,20
NA,would go for nothing i f the people of New,20
NA,South Wales were not behind the site.,20
NA,Since the practicability of this site has,20
NA,been challenged by an expert of the charac-,20
NA,ter of the right honorable member for,20
NA,"Swan, who believes that to construct there",20
NA,artificial works for conserving water will,20
NA,be to menace the health of the people in,20
NA,"the district, we ought to have the benefit",20
NA,of all the available engineering skill which,20
NA,has been devoted to the investigation of,20
NA,such questions. With respect to the,20
NA,"opinions of other engineers, who would",21
NA,"probably report adversely, I would remark",21
NA,that that could not be so in the case of,21
NA,"Pridham, because he furnished the figures",21
NA,"which, after checking, have been adopted",21
NA,by Mr Wade in the preparation of the case,21
NA,submitted last night by the honorable memvernment,21
NA,ber for Macquarie.,21
Mr BATCHELOR ,Boothby-Ministe r,21
NA,of Home. Affairs) - I do not know that,21
NA,Government can complain altogether of,21
NA,delay in the transaction of business which,21
NA,has been caused by this debate.,21
NA,the other hand) it is certain that the Goquest.,21
NA,vernment are not getting quite as much,21
NA,support in their endeavour to push forward,21
NA,".the settlement of the Capital Sites question,",21
NA,"as, perhaps, they had a right to expect",21
NA,from some quarters. A request has,21
NA,"submitted to-day, which, i t seems to",21
NA,the honorable member for Macquarie canmight,21
NA,not reasonably think that the House is,21
NA,likely to grant.,21
Mr SYDNEY SMITH , I do not see why,21
NA,"the House should not, i f we are to have fair settle the matter?",21
NA,play.,21
Mr BATCHELOR ,Suc h a request,21
NA,should only be granted in the event of,21
NA,very serious misstatements having been,21
NA,made. I am expiessing my individual examine him.,21
NA,"opinion in this respect, but my view cer-",21
NA,tainly is that only in the case of very,21
NA,ous misstatements would i t be advisable,21
NA,call any person to the Bar of the House. sites.,21
NA,"I t is a most unusual procedure, and is very",21
NA,seldom adopted by any Parliament. I have,21
NA,never heard of its being adopted for the,21
NA,purpose of rebutting statements made,21
NA,way of interjection in the course of,21
NA,bate. 11 is a most remarkable request. A l l,21
NA,kinds of statements have been made in,21
NA,terjections and in speeches about each of information.,21
NA,the suggested sites.,21
Mr SYDNEY SMITH ,Th e honorable,21
NA,gentleman made a statement himself.,21
Mr BATCHELOR ,Doe s the honor-,21
NA,able member for Macquarie suggest that I,21
NA,made any statement that was unfair to,21
NA,Wade? I can assure him that I did not is,21
NA,for a moment mean to suggest tbat Mr.,21
NA,Wade was a partisan of any site.,21
Mr SYDNEY SMITH , I do not know his,21
NA,opinion.,21
Mr BATCHELOR , I do not know his,21
NA,opinion either. I have' not the,21
NA,"idea what i t is. Indeed, I do not care.",21
NA,"He is certainly an eminent engineer, and",21
NA,to the extent that his professional skill,21
NA,titles him to receive from this House the -statements made.,21
NA,"very fullest credence, he would have that",21
NA,and no more. His professional skill is the,21
NA,. main point; his personal opinion is quite,21
NA,Mr another question. So f a r as concerns the,21
NA,information which the honorable mem-,21
NA,"ber desires to obtain, I desire to say that,",21
NA,i f Mr Wade submits a statement to the Go-,21
NA,they will take care that it is made,21
NA,available to honorable members. Surely,21
NA,nothing more than that can be desired No-,21
NA,the thing more can reasonably be asked for.,21
NA,the I f the honorable member for Macquarie,21
NA,"had put a simple question, the Government",21
NA,"But, on would at once have complied with his re-",21
Mr SYDNEY SMITH , I want Mr Wade,21
NA,"to answer questions put to him, and to meet",21
NA,objections raised by honorable members.,21
Mr BATCHELOR , The honorable,21
NA,been member will see tliat i f that practice were,21
NA,"me, adopted every supporter of a Capital Site",21
NA,make a similar request. I f we are,21
NA,to have experts called to the Bar of the,21
NA,House to be examined by honorable mem-,21
NA,"bers, how long will i t probably take to",21
NA,Instead of days or,21
NA,"weeks being occupied, i t might take months,",21
NA,"or perhaps years, to settle it.",21
Mr JOSEPH COOK , I t would be bad for,21
NA,Mr Wade i f i t took so long as that to,21
Mr BATCHELOR ,Bu t there are other,21
NA,seriexperts who might also be called with just,21
NA,to as - much reason in connexion with other,21
NA,A l l that the honorable member for,21
NA,Macquarie can reasonably ask f o r is what,21
NA,I have already offered to do. I f Mr .,21
NA,Wade likes to send a f u l l statement to,21
NA,by the Government we shall be happy to,21
NA,a demake it available to honorable members.,21
Mr JOSEPH COOK ,Wha t we suggest,21
NA,inwould be a quicker way of securing the,21
Mr BATCHELOR ,Th e honorable,21
NA,member surely does not put that suggestion,21
NA,forward seriously?,21
Mr JOSEPH COOK , I do. indeed.,21
Mr BATCHELOR ,Wha t the honor-,21
NA,Mr able member for Macquarie really urges,21
NA,that the special engineering skill of Mr.,21
NA,Wade should be made available to honor-,21
NA,able members. I am quite prepared to,21
NA,agree to that by circulating any statement,21
NA,which Mr Wade may make.,21
Mr FOWLER ,Wh y not appoint a Select,21
NA,slightest Committee to examine him ?,21
Mr BATCHELOR ,W e should cer-,21
NA,tainly not appoint a Select Committee. I f,21
NA,enwe did that we should have all kinds of,21
NA,I suggest that the honor-,21
NA,able member should accept the undertaking,21
NA,"now given, and let the House get on with",22
NA,the discussion of the sites.,22
Mr BROWN ,Canobolas) -.Certainl y,22
NA,the course of procedure which the honor-,22
NA,able member for Maccjuarie asks the,22
NA,"Government to consent to is unusual, and",22
NA,it requires a considerable amount of reason,22
NA,to justify it. But in view of the treatment,22
NA,which the honorable member for Macquarie,22
NA,"received last night, and also in view of",22
NA,the influences at work in the House,22
Mr SYDNEY SMITH ,Undergroun d,22
NA,fluences.,22
Mr BROWN ,Ther e is ample justifica-,22
NA,tion for the action taken by him. What,22
NA,"is the position? First of all, we had ex-",22
NA,pert reports upon all the sites-th e western,22
NA,"sites, the southern sites, and the south-",22
NA,eastern sites. A l l the sites now mainly,22
NA,under consideration were dealt with,22
NA,by experts appointed by the honorable,22
NA,member for Hume when he was Minister,22
NA,of Home Affairs in the Barton Government.,22
NA,At the close of the debate in the last Parlia-,22
NA,ment a certain movement was made by the,22
NA,then Minister of Home Affairs for the,22
NA,purpose of supplementing the information,22
NA,"then available, and the House was given to",22
NA,understand that an inquiry was to be held,22
NA,in order to obtain some special information,22
NA,that had been overlooked on the previous,22
NA,occasion. But we find that the supple-,22
NA,mentary inquiry with regard to the Bom-,22
NA,bala and Tumut sites has been as exhaus-,22
NA,"tive as, i f not more exhaustive than, the",22
NA,inquiry entered into by the expert Commis-,22
NA,sioners. The whole question has been,22
NA,"reviewed from every possible stand-point,",22
NA,and every tittle of information which it,22
NA,was possible to obtain has been brought to,22
NA,bear. I do not object to that. The,22
NA,House should be placed in possession of,22
NA,all the information bearing upon the ques-,22
NA,tion. But the honorable member for,22
NA,Macquarie-an d I agree with him-ask s,22
NA,that a similar inquiry should be extended,22
NA,to Lyndhurst. We were refused that by the,22
NA,late Government. We were informed' that,22
NA,the information available covered all that,22
NA,was necessary. Whenever we asked that,22
NA,the same treatment as was extended,22
NA,to the other sites should be extended,22
NA,to Lyndhurst we were met by a refusal.,22
NA,When I got possession of the supplementary,22
NA,"reports about a fortnight ago, I made a spe-",22
NA,cial visit to Sydney in order to bring the,22
NA,matter under the notice of the State,22
NA,ment. I was not successful in seeing the,22
NA,State Premier. But I endeavoured to get all,22
NA,the information I could with respect to the,22
NA,Lyndhurst site. I consider that the honor-,22
NA,able member for Macquarie has done the,22
NA,right thing in endeavouring to bring the in-,22
NA,"formation up to date, and to place honorable",22
NA,members in a position to judge this site on,22
NA,the newer and wider information which is,22
NA,now available. Since the investigations,22
NA,were made by the Commission of experts-,22
NA,and these were maimy confined to a pre-,22
NA,scribed area- a considerable section of the,22
NA,people in the western districts have taken,22
