Speaker,Text,pageNumbers
NA,in- up the question of dealing with the source,22
NA,of water supply which has been reported,22
NA,"upon lately by Mr Wade, and deputations,",22
NA,"of which I was a member, have waited on",22
NA,the State Government to deal with the ques-,22
NA,"tion from a State stand-point, and not par-",22
NA,ticularly from a Federal stand-point. I,22
NA,know that I cannot enter into f u l l details at,22
NA,"this stage, but I wish to indicate that there",22
NA,is now available more information than was,22
NA,available when the Commission of experts,22
NA,"made their inquiries, and that information",22
NA,has been secured by the State Department,22
NA,for other than Federal purposes. A league,22
NA,has been formed to secure the erection of,22
NA,a weir and conservation of water for purely,22
NA,State purposes. I am a member of the,22
NA,"league, which I believe includes the Prime",22
NA,Minister and several members of the State,22
NA,Parliament. That shows that since the first,22
NA,inquiry was made the attention of the State,22
NA,Parliament has been specially concentrated,22
NA,on this source of supply for purposes of,22
NA,"water conservation, and it is admitted by",22
NA,the Ministry that it reaches the proportions,22
NA,"of a national scheme, affecting all interests",22
NA,along the Lachlan River. I wish now to,22
NA,refer to the question of Mr Wade's report.,22
NA,The honorable member for Eden-Monaro,22
NA,will not dare to rise here and question,22
NA,straight out the ability of Mr Wade to deal,22
NA,with this matter. Mr Wade is a gentleman,22
NA,who has risen from the ranks in the Public,22
NA,Service of the State until he has attained,22
NA,the position of chief officer of the Depart-,22
NA,ment of Water Conservation. But the hon-,22
NA,"orable member comes to the House, and",22
NA,points to a number of instances of waste-,22
NA,f u l expenditure by the Department in vears,22
NA,"past, and by innuendo he tries to lead",22
NA,honorable members to believe that Mr.,22
NA,Wade had something to do with the com-,22
NA,mission of those mistakes.,22
Mr AUSTIN CHAPMAN ,No t so.,22
Mr BROWN , I am glad to have the,22
NA,"Governhonorable member's denial, because Mr.",22
NA,Wade attained his position as the result of,22
NA,"those mistakes, and the officers who were re-",22
NA,' sponsible for them had to quit the service.,22
NA,Adjournment [REPRESENTATIVES.],23
NA,The present Government of New South,23
NA,Wales has decided to make the question of,23
NA,water conservation an important item in its,23
NA,programme. The people of the State realize,23
NA,the need for water conservation throughout,23
NA,"its length and breadth, and no matter what",23
NA,Government may have the control of its,23
NA,"destinies, it must be prepared to make that",23
NA,question one of the main planks of its plat-,23
NA,form in the near future. For the purpose,23
NA,of thoroughly equipping the State to deal,23
NA,"with this great question, the See Govern-",23
NA,ment sent Mr Wade on a special mission to,23
NA,"America to make inquiry and report, and he",23
NA,has only recently returned. I believe that,23
NA,there is no man in the States to-day who,23
NA,is so well posted as Mr Wade with up-to-,23
NA,date information on this subject. I f hon-,23
NA,orable members had received his report,23
NA,last night in the spirit in which they are,23
NA,prepared to receive the reports of other,23
NA,"officers,. I should have said",23
NA,on the part of the honorable member for,23
NA,Macquarie was uncalled for. But how was,23
NA,it received here? Every innuendo was,23
NA,"thrown out against it, and there were circu-",23
NA,"lated here, not only newspaper letters or",23
NA,"reports, but anonymous letters condemning",23
NA,this site as being unsuitable from the standvery,23
NA,point of water supply.,23
Mr SPEAKER ,Orde r ! The hon-,23
NA,orable member is clearly anticipating the,23
NA,debate in Committee.,23
Mr BROWN , I do not wish to do,23
NA,that. I desire to state this fact as a reason,23
NA,why some official action should be taken to,23
NA,place before the House Mr Wade's infor-,23
NA,"mation, so that honorable members may be",23
NA,satisfied that it is reliable. I understand,23
NA,Mr Wade is at present in Melbourne; I,23
NA,"have not had an interview with him, but the",23
NA,honorable member for Macquarie intimates,23
NA,that he is available to the House. I f it,23
NA,thinks that the information which was sup-,23
NA,"plied is not correct, it has the right and",23
NA,"opportunity of calling Mr Wade to the Bar,",23
NA,and questioning him.,23
Mr WEBSTER ,Wh o has thrown any,23
NA,doubt on the report?,23
Mr BROWN,"Doub t has been exthat,",23
NA,pressed all round.,23
Mr WEBSTER ,No t at all.,23
Mr BROWN,Th e honorable member,23
NA,for Macquarie was met with a running fire,23
NA,of interjections from all parts of the House,23
NA,when he was submitting the document.,23
NA,The main objection taken to the site was,23
NA,"based on the question of water supply,",23
NA,the practicability of which has been,23
NA,discredited by more than one speaker.',23
NA,(Formal).,23
NA,But I cannot deal with that now.,23
NA,I f honorable members feel that the,23
NA,"report is not the handiwork of Mr W.ide,",23
NA,"he is here, and may be questioned. I am",23
NA,not altogether favorable to the dragging,23
NA,of any public officer before the House to be,23
NA,"examined by honorable members, because",23
NA,I do not think that is a proper way to,23
NA,"elicit information, unless there is ,some",23
NA,very special reason for taking that course.,23
NA,Why should not the Government ask Mr.,23
NA,Wade to supply them with an official - re-,23
NA,port-o n which would be staked his re-,23
NA,putation as the Engineer-in-Chief of Water,23
NA,"Conservation in New South Wales, and",23
NA,"which, I believe, would be accepted by",23
NA,the large majority of honorable members,23
NA,as being substantially correct. That has,23
NA,NA,23
NA,report.,23
Mr BATCHELOR ,W e have already,23
NA,that this action agreed to that.,23
Mr BROWN , I am very pleased to,23
NA,"hear that intimation. That, I think, pretty",23
NA,well clears the way. I realize that some,23
NA,good has been done by this discussion in,23
NA,"reaching that position, because, so far as",23
NA,"I could ascertain, there seemed to be a",23
NA,strong desire not to allow this site,23
NA,"to receive the sarr,e amount of inquiry and",23
NA,investigation as has been allowed in the,23
NA,case of other sites.,23
Mr JOSEPH COOK ,Parramatta) - I,23
NA,find that I unwittingly did the right,23
NA,honorable member for Swan a wrong in,23
NA,my comment on some remarks which he,23
NA,"made just now, and I ask permission to",23
NA,make the correction. I find that I did,23
NA,not read enough of his speech as reported,23
NA,"in Hansard, and had I read the words pre-",23
NA,ceding the quotation which he made from,23
NA,"his report, the matter would have been",23
NA,"clear. I find that his statement, suggest-",23
NA,ing grave menace and danger to the Capi-,23
NA,"talSite from, the water supply, relates to",23
NA,"the construction of an artificial lake,",23
NA,as a beauty spot and a water frontage,23
NA,"pure and simple, and does not relate to",23
NA,the water supply proper. Had I known,23
NA,I certainly should not have made the,23
NA,remarks I did concerning that report.,23
NA,NA,23
NA,to the remarks about the water supply of,23
NA,"Lyndhurst, I think it comes very late in the",23
NA,"day, indeed, for the honorable member for",23
NA,Macquarie and the honorable member for,23
NA,Parramatta to say that the supply of water,23
NA,there is as abundant as they try to,23
NA,make out. I was told that during the last,23
NA,drought the people there had to dig wells,23
NA,and put in drives for the purpose of get-,24
NA,"ting sufficient water, and it had to be done",24
NA,"on half-rations, too. That is the place in",24
NA,which the honorable member for Mac-,24
NA,quarie wishes to establish the Federal,24
NA,.Capital !,24
Mr BROWN ,Wher e was that?,24
NA,NA,24
NA,everywhere in the district. A most pecu-,24
NA,liar thing is that these honorable members,24
NA,want to back i t up- I shall not say by,24
NA,faked figures-b y a prejudiced report and,24
NA,for political reasons. The present Premier,24
NA,"of New South Wales has long represented,",24
NA,"ancl is now seeking to represent, a con-",24
NA,stituency in that district. H e is now fight-,24
NA,"ing for his very political existence, and I",24
NA,think it is a prostitution of parliamentary,24
NA,power on the part of the Premier of New,24
NA,South Wales to send,24
Mr SYDNEY SMITH , I rise to a point,24
NA,of order. The honorable member has motion.,24
NA,staled that I have taken this course with a,24
NA,view of helping the Premier of New South,24
NA,Wales in his contest; but i t is well known,24
NA,that that honorable gentleman and I,24
NA,strong political opponents.,24
Mr SPEAKER ,Tha t is not a point of,24
NA,order.,24
NA,NA,24
NA,I made such a statement.,24
Mr SYDNEY SMITH , I accept the honthe,24
NA,orable member's disclaimer; but I underhe,24
NA,stood him to imply that.,24
NA,NA,24
Mr BROWN ," I desire to know, sir,",24
NA,whether the honorable member for,24
NA,is in order in saying that the Premier of,24
NA,New South Wales has prostituted his posihonorable,24
NA,tion because he has acceded to the request he speaks.,24
NA,made to him by the honorable member for,24
NA,"Parramatta and myself, to have this infordresses",24
NA,mation supplied f o r the convenience,24
NA,honorable members?,24
Mr SPEAKER ,Th e honorable,24
NA,"ber did not say that, and i f he had I",24
NA,sure that it would have been out of order.,24
NA,NA,24
NA,these honorable members very hard,24
NA,"deed, when they have to rise and rights",24
NA,"attribute to me"" words which I never that",24
NA,uttered. I do not care what site,24
NA,"is selected, though, of course, for many",24
NA,reasons I favour the Southern Monaro sites.,24
NA,The honorable member for Canobolas has,24
NA,referred to the past misdoings of engineers,24
NA,with respect to water supply ' in New,24
NA,South Wales. Does he wish to see that the,24
NA,sort of thing perpetuated in regard to,24
NA,Federal Capital? Although we have a,24
NA,chance of getting a water supply which we,24
NA,"know is second to none in Australia, yet",24
NA,honorable members wish to bolster up their,24
NA,"contention, and put the Commonwealth in",24
NA,the same unfortunate position that New,24
NA,South Wales is in. I do not know Mr.,24
NA,"Wade, but I have read many of his works",24
NA,"on hydraulic engineering and water supply,",24
NA,and I look upon him as one of the greatest,24
NA,authorities on those subjects in the Common-,24
NA,"wealth. But apart from that, it seems",24
NA,a very strange thing to me that the honor-,24
NA,able member for Macquarie should wish tc,24
NA,bring from New South Wales a public,24
NA,officer to give evidence on one particular,24
NA,"site. I f the honorable imember is honest,",24
NA,let him ask the House to bring Mr Wade,24
NA,here to be questioned on every site.,24
Mr SYDNEY SMITH , I am quite willing,24
NA,to do that. I shall ask leave to alter the,24
NA,NA,24
NA,"Wade to the Bar of the House, let us as-",24
NA,certain who was guilty o f spending millions,24
NA,are of money in New South Wales on water,24
NA,supply works.,24
Mr SYDNEY SMITH , I shall give the,24
NA,honorable member an opportunity of voting,24
NA,NA,24
NA,honorable member for Parramatta rises,24
NA,addresses the House in such a pedantic,24
NA,manner that he has assumed the position of,24
NA,"lecturemaster-general of the Government,",24
NA,or whomsoever is opposed to any scheme,24
NA,Maranrei that he brings forward.,24
Mr JOSEPH COOK , I leave that to the,24
NA,"member, who does it every time",24
NA,NA,24
NA,"the House in this style- "" How daie",24
NA,"of you do such a thing? I have spoken, and",24
NA,"that is quite enough."" I . shall not submit",24
NA,memto be dictated to by the honorable,24
NA,am not member in his role of lecturemaster-,24
NA,general. I hold an equal position in,24
NA,the Chamber with the honorable mem-,24
NA,"inber, and while I do I shall assert mv",24
NA,every time. I should like to move,24
NA,some outside expert be introduced. I t,24
NA,seems that these brethren from New South,24
NA,Wales cannot agree as to the best site.,24
NA,"A Commission, consisting of engineers",24
NA,"from each State, has dealt with the matter,",24
NA,"but they could not agree, and I fhink that",24
NA,the best' and cheapest' way to get over,24
NA,"- difficulty, will be to import an up-to-",24
NA,"the date man from America, and ask him to",24
NA,"choose a site, the Government abiding by",25
NA,his decision.,25
Mr JOSEPH COOK ,W e do not want,25
NA,any Yankees here.,25
NA,NA,25
NA,posite have been Yankeeing all the time.,25
NA,I t is the representatives of New South,25
NA,Wales who are responsible for the delay,25
NA,which has occurred.,25
Mr JOSEPH COOK ,Tha t is as true as,25
NA,everything else that the honorable member,25
NA,has said.,25
NA,NA,25
NA,knows that it is true. Any one who reads,25
NA,the Hansard reports will see that all the,25
NA,-dissension is due to the action of the re-,25
NA,presentatives of New South Wales.,25
NA,"am willing to give my vote to-day, and I",25
NA,feel certain that the mind of every other,25
NA,"honorable member is made up, so that all",25
NA,the talk to which we are compelled to,25
NA,"listen will not influence any one, and will",25
NA,only have the effect of filling up Hansard.,25
NA,I f New South Wales members wish for a,25
NA,"site to be chosen, the sooner they allow us",25
NA,to come to a vote the better.,25
Mr JOSEPH COOK ,Th e honorable,25
NA,"member would give his State away, I sup-",25
NA,pose?,25
NA,NA,25
NA,"my State, or to the Commonwealth. I",25
NA,have never been a renegade. The hon-,25
NA,orable member is again assuming the part,25
NA,of dictator and lecturemaster-general. He,25
NA,knows what I mean.,25
Mr JOSEPH COOK , I know that what,25
NA,the honorable member is uttering is not,25
NA,true.,25
Mr SPEAKER ,Th e honorable mem-,25
NA,ber for Parramatta must withdraw that re-,25
NA,mark.,25
Mr JOSEPH COOK , I withdraw it.,25
NA,NA,25
NA,of what the honorable member says. _ I f,25
NA,honorable members opposite are so anxious,25
NA,that the matter shall be dealt with only on,25
NA,"complete information, let the determina-",25
NA,tion of the question be postponed to an-,25
NA,"other session, and let the Government take",25
NA,"the course I have suggested, of appointing",25
NA,an expert from some other country to make,25
NA,a recommendation on the subject. That is,25
NA,the easiest way out of the difficulty.,25
NA,have not taken part i n any of the picnics,25
NA,"to the various sites, nor have I visited",25
NA,any of the places named; but I have asked,25
NA,"unbiased engineers, to whom it does not",25
NA,"matter which site is chosen, and I shall",25
NA,vote on the information I have received,25
NA,from them. I f we agree to examine Mr.,25
NA,"Wade at the Bar of the House, we shall",25
NA,commence a course of procedure the effect,25
NA,of which cannot be foreseen. I n the first,25
NA,"place, Mr Wade himself will be placed",25
NA,in a very unpleasant position.,25
Mr SYDNEY SMITH , W h y ? He will,25
NA,simply be asked to tell the truth.,25
NA,NA,25
NA,will have any difficulty in telling the truth ;,25
NA,"but i f he is cross-examined, he may be",25
NA,placed in a very difficult position in re-,25
NA,gard to other professional men.,25
Mr MCWILLIAMS , L e t them stand on,25
NA,their reputations.,25
NA,NA,25
NA,surely Mr Wade cannot be asked to pub-,25
NA,I licly criticise them. I think that he should,25
NA,not be brought to the Bar. The Go-,25
NA,"vernment have said that, they are willing",25
NA,to obtain a report from Mr Wade on the,25
NA,"Lyndhurst site, or on any other site, and",25
NA,I think that that is all that is necessary.,25
Mr MCLEAN ,Gippsland) -N o one,25
NA,can blame the honorable member for Mac-,25
NA,quarie for doing all he can to place the,25
NA,site of which he is such an able and earnest,25
NA,advocate in the most favorable light. I,25
NA,wish to have the fullest information on all,25
NA,"the sites, and, therefore, I shall be pre-",25
NA,pared to support the honorable member's,25
NA,request i f he will deal with them all alike.,25
NA,"I am not a supporter of the Tooma site,",25
NA,but I know that a great many honorable,25
NA,members think well of it. We have,25
NA,"had, however, no professional report",25
NA,upon it. I f we are to examine an ex-,25
NA,pert at the Bar of the House in regard to,25
NA,"the Lyndhurst site, I am sure that the hon-",25
NA,orable member for Macquarie will admit,25
NA,the fairness of obtaining an official report,25
NA,"on the Tooma site, and of examining the",25
NA,engineer who furnishes it. at the Bar of the,25
NA,House. I f all sites are treated alike in,25
NA,"this matter, I will support the honorable",25
NA,member's proposal; but any other arrange-,25
NA,"ment would be one-sided and unfair, and,",25
NA,"therefore, could not be supported bv me.",25
Mr HENRY WILLIS ,Robertson) -,25
NA,The speech of the honorable member for,25
NA,"Gippsland was a very fair one, and it was",25
NA,to some extent on the same lines as that of,25
NA,the honorable member for Maranoa. If,25
NA,I expert officials can be brought to the Bar,25
NA,to give ' us information regarding the,25
NA,possibility of water supply at the various,25
NA,"sites, we shall be in a better position in",25
NA,choosing between those sites. A great,25
NA,opportunity will be lost i f we 'do not avail,25
NA,ourselves of Mr Wade's presence in Mel-,25
NA,bourne to examine him on the possibilities,25
NA,of the water supply at Lyndhurst.,26
NA,great discredit has been cast on certain,26
NA,publications respecting the possibilities of,26
NA,"water supply there, and as the Government",26
NA,"of New South Wales have, in the interests",26
NA,"of the Commonwealth, sent down an expert",26
NA,"to give us information on the subject, I",26
NA,"think we should call him to the Bar,",26
NA,and elicit from him what he can tell us,26
NA,about the whole matter. The course pro-,26
NA,posed by the honorable member for,26
NA,"Macquarie is, no doubt, an unusual one,",26
NA,but the House is on the eve of making a,26
NA,very momentous decision. There are in-,26
NA,stances in history of seats of government,26
NA,having been removed from one place to,26
NA,another. That has occurred even in Eng-,26
NA,land itself; But centuries will probably,26
NA,pass before any community will have before,26
NA,it a question such as that with which we are,26
NA,"now asked to deal. Therefore, it is neces-",26
NA,sary to have all possible information regard-,26
NA,ing water supply and other matters of con-,26
NA,sequence before us. While the Lyndhurst,26
NA,"site is not far from my electorate, I would",26
NA,not vote for it unless it could be shown that,26
NA,an adequate water supply could be obtained,26
NA,there. I have told my constituents so. I f I,26
NA,were convinced that the supply would be,26
NA,"inadequate, I should certainly turn my at-",26
NA,tention to some other site. What we must,26
NA,have is the best site available. I hope that,26
NA,the House will agree to examine Mr Wade.,26
NA,The Government have offered to obtain a,26
NA,"report from him, but I "" feel that more than",26
NA,that is required. We have already been,26
NA,"supplied with a great number of reports,",26
NA,and many of us will not have time to study,26
NA,"further reports. I n my opinion, all the ex-",26
NA,perts available should be brought before the,26
NA,"House, so that honorable members may ob-",26
NA,"tain from them the information they require,",26
NA,without the trouble of looking up reports,26
NA,which many of us have not the necessary,26
NA,time to read.,26
Mr WEBSTER ,Gwydir) - I cannot see,26
NA,any justification for the course proposed by,26
NA,the honorable member for Macquarie. I have,26
NA,"every respect for Mr Wade, but the fact",26
NA,that the honorable member asks that he,26
NA,"shall be examined at the Bar, when""he has",26
NA,already furnished us with a report on the,26
NA,"Lyndhurst water supply, shows that the",26
NA,honorable member is not satisfied with that,26
NA,report.,26
Mr SYDNEY SMITH , I am satisfied with,26
NA,it.,26
Mr WEBSTER ,The n why examine,26
NA,"Mr Wade at the Bar of""the House?",26
Mr SYDNEY SMITH ,Becaus e certain,26
NA,honorable members say that they are not,26
NA,satisfied with the information which I have,26
NA,alreadv placed before the House.,26
Mr WEBSTER , I have as much con-,26
NA,fidence in Mr Wade as I have in the officers,26
NA,who occupy similar positions in the other,26
NA,States. I know that it is customary to eu-,26
NA,logize the heads of Departments upon their,26
NA,assumption of office to such an extent as to,26
NA,lead one to believe that they can be abso-,26
NA,lutely trusted to lay down perfect lines,26
NA,in regard to future administration. I f Mr.,26
NA,"Wade be examined at the Bar of the House,",26
NA,what will happen? Every honorable mem-,26
NA,ber will be afforded an opportunity of,26
NA,cross-examining him as to his qualifications.,26
NA,"I n doing so, those who are familiar with",26
NA,the blunders which have been committed,26
NA,in connexion with water conservation works,26
NA,in New South Wales will of necessity,26
NA,question him in such a way as will intro-,26
NA,duce the names of other officials,26
Mr JOSEPH COOK ,I n New South,26
NA,Wales there have not been nearly the same,26
NA,number of blunders committed as have oc-,26
NA,curred in the other States,26
Mr WEBSTER , I admit that errors,26
NA,have been made in Victoria such as have,26
NA,not occurred eleswhere. I very much ques-,26
NA,tion the wisdom of summoning Mr Wade,26
NA,to the Bar of the House to give evidence,26
NA,under such conditions. The honorable,26
NA,member for Gippsland has stated the con-,26
NA,dition upon which he is prepared to sup-,26
NA,port the suggestion of the honorable mem-,26
NA,ber for Macquarie. Does he seriously con-,26
NA,tend that experts other than Mr Wade,26
NA,should be examined ? The Government,26
NA,have already indicated their willingness to,26
NA,obtain a report from him.,26
Mr JOHNSON ,I s the honorable mem-,26
NA,ber afraid to allow Mr Wade to be ex-,26
NA,amined ?,26
Mr WEBSTER , I have the same con-,26
NA,fidence in Mr Wade's report that I have,26
NA,in the reports submitted by other experts,26
NA,upon various aspects of this question.,26
NA,"Having that report before us, what more",26
NA,do we require? I t is true that expert,26
NA,knowledge is of value so far as i t relates,26
NA,to the volume of water which can be con-,26
NA,served at any of the sites. But I hold,26
NA,that the engineering blunders which have,26
NA,been committed in connexion with provid-,26
NA,ing water supplies to various country towns,26
NA,"in New South Wales, afford the most con-",26
NA,demnatory evidence of expert knowledge',26
NA,that can possibly be supplied. Not only,26
NA,' do we require to ascertain the volume of,26
NA,water which is available at each particular,27
NA,"site, but also whether i t can be conserved.",27
NA,"'Further, it is necessary for us to provide",27
NA,against such a result as has occurred at,27
NA,"Tamworth, where, after an expenditure of",27
NA,"50 per cent, in excess of the official estimate,",27
NA,there is merely an apology fo r a water,27
NA,supply to-day. We require to know the,27
NA,character of the country constituting the,27
NA,water sheds of these particular areas. A t,27
NA,Tamworth the water is conveyed to the,27
NA,"town by gravitation, but i t carries with i t",27
NA,"a certain amount of soil, the presence of",27
NA,which is a menace to the health of the,27
NA,people. I have seen that water so dis-,27
NA,"coloured, when coming through the bath-",27
NA,room tap that persons were almost pre-,27
NA,vented from using it. I t is very import-,27
NA,ant that we should know something as to,27
NA,the quality of the water which can be con-,27
NA,served. Obviously any water is useless,27
NA,which contains deleterious matter sufficient to,27
NA,render it unfit for human consumption. I f,27
NA,it be logical to summon an engineering ex-,27
NA,pert to the Bar of the House to give evi-,27
NA,dence as to the quantity of water which,27
NA,"can be conserved at any particular site, i t",27
NA,is equally logical to summon an analyti-,27
NA,cal chemist to testify to the ele-,27
NA,ments which are contained in that,27
NA,water. Is there any honorable member,27
NA,who will deny the necessity which exists,27
NA,for making such inquiry ? The honorable,27
NA,member f o r Macquarie pointed out last,27
NA,evening that a sample of the water supply,27
NA,at Orange had been subjected to an analy-,27
NA,tical test. Why was i t not taken from the,27
NA,Lyndhurst water-shed? The very fact,27
NA,that i t was obtained from Orange indicates,27
NA,a fear that the analyst's report upon a sam-,27
NA,ple taken from the Lyndhurst water-shed,27
NA,would not be satisfactory.,27
Mr SYDNEY SMITH ,Th e sample taken,27
NA,from Orange comes from a part of the,27
NA,Lyndhurst water-shed.,27
Mr WEBSTER ,Th e honorable mem-,27
NA,ber did not indicate that last evening.,27
Mr SYDNEY SMITH , I informed honor-,27
NA,able members that i t was taken from one,27
NA,side of the Canobolas.,27
Mr WEBSTER , But the honorable,27
NA,member also said that the Lyndhurst water,27
NA,supply would be situated upon the other,27
NA,side of the Canobolas. The proposition that,27
NA,the water can run from one side of the,27
NA,"Canobolas into a dam upon the other, is a",27
NA,most remarkable one. Personally I am not,27
NA,prejudiced in favour of any site. I t is,27
NA,"obvious, however, that the most important",27
NA,factor in connexion with any Federal Capi-,27
NA,tal is its water supply. Without a supply,27
