Speaker,Text,pageNumbers
NA,any one who had made a false statement,27
NA,"as to unfair competition, which would",27
NA,bring him within the provisions of clause,27
NA,31. I f he goes into Court and gives evi-,27
NA,"dence of his own criminal intent, he is",27
NA,saved from prosecution therefor.,27
Mr ISAACS ,Indi-Attorney-General ),27
NA,[12.56] -I f this new sub-clause is not in-,27
NA,"serted, a witness can refuse to answer, on the",27
NA,ground that to do so will incriminate him..,27
NA,The sub-clause is intended to compel him to,27
NA,answer. I t opens his mouth; it does riot,27
NA,close i t . I f we assume that he has wil-,27
NA,"fully given false evidence, he may refuse",27
NA,"to answer any questions about i t , because",27
NA,to do so may tend to incriminate him. This,27
NA,sub-clause is to leave it open for the Justice,27
NA,"to say, "" You must answer, although you",27
NA,"cannot, on your own admission, be pro-",27
NA,"ceeded against, unless you commit per-",27
NA,"jury.""",27
Mr KELLY ,Woul d it be possible to in-,27
NA,stitute proceedings for perjury under clause,27
NA,21?,27
Mr ISAACS ,W e will consider that,27
NA,on the recommittal stage.,27
NA,Amendment agreed to.,27
NA,Amendment (by Sir WILLIAM LYNE) pro-,27
NA,posed-,27
NA,That the following new sub-clause be,27
NA,added :-,27
NA,""" 7. The Justice shall forward his determi-",27
NA,"nation to the Minister.""",27
NA,«,27
Mr KNOX ,Kooyong),28
NA,move-,28
NA,That the amendment be amended by the inser-,28
NA,"tion, after the word "" Minister,"" of the follow-",28
NA,ing words :-,28
NA,""" who shall-",28
NA,""" (a) lay the determination before both",28
NA,Houses of the Parliament within,28
NA,"seven days after its receipt, i f",28
NA,"the Parliament is then sitting,",28
NA,i f the Parliament is not then,28
NA,"sitting, within seven days of the",28
NA,next meeting of the Parliament;,28
NA,and,28
NA,""" (i) cause to be submitted to both",28
NA,Houses of the Parliament a reso-,28
NA,lution approving of the determi-,28
NA,nation.,28
NA,""" I f the resolution is passed by both",28
NA,"„ Houses of the Parliament, the Gover-",28
NA,"nor-General may, under the powers of",28
NA,"the Customs Act 1901, prohibit the im-",28
NA,"portation of the imported goods,",28
NA,either absolutely or under such con-,28
NA,ditions and restrictions as he deems,28
NA,"just, and in that case the provisions",28
NA,of that Act shall applv to goods so,28
NA,"prohibited.""",28
NA,Sitting suspended from 1 to 2 p.m.,28
Mr KNOX , T h e objects of the amend-,28
NA,"ment are, I think, sufficiently clear to hon-",28
NA,"orable members, without calling for much",28
NA,"explanation on my part. The sub-clause,",28
NA,"as it stands, reads-",28
NA,The Justice shall forward his,28
NA,"to the Minister, who shall, &c.",28
NA,Since I gave notice of my intention to,28
NA,"move this amendment, there has been a",28
NA,"very important alteration made, and that is",28
NA,the substitution of a Justice of the High,28
NA,Court for the Board. But I still believe,28
NA,that the object and purpose of the mea-,28
NA,sure would have been much more effect-,28
NA,ively and fairly secured i f the course I am,28
NA,"now suggesting had been adopted, even",28
NA,without the intervention of the Justice.,28
NA,As soon as the receipt of the certificate of,28
NA,the Comptroller-General had been acknow-,28
NA,ledged' by .the Minister it should have,28
NA,placed an obligation upon the latter to at,28
NA,once consult Parliament i f sitting.,28
NA,"i f it be not sitting, I venture to suggest that",28
NA,the procedure proposed under a Justice will,28
NA,occupy a considerable time. No inspector,28
NA,can be at the beck and call of the Comp-,28
NA,troller-General or Minister; he mav be in,28
NA,another part of the Commonwealth ; and,28
NA,consequently there may be a long in-,28
NA,terval before a decision can be obtained.,28
NA,[12.59] - I I hold that a similar objection will apply,28
NA,to the employment of a Justice. I do,28
NA,not think that there should be any oppo-,28
NA,sition offered to the amendment on that,28
NA,ground. I would remind the Minister,28
NA,that the Bill is intended to deal with ex-,28
NA,traordinary conditions. The Attorney-,28
NA,General has stated that he regards the,28
NA,Tariff as dealing with ordinary importa-,28
NA,"or, tions, bub this B i l l as dealing with extra-",28
NA,ordinary importations. I may be told that,28
NA,the Minister would always be responsible,28
NA,"to Parliament, and that it would always be",28
NA,open to it to dissent from his action. But,28
NA,"that argument, I submit, does not properly",28
NA,"apply here, inasmuch as there may reason-",28
NA,ably be a diversity of opinion on a sub-,28
NA,ject of this magnitude. I earnestly hope,28
NA,that this fair and just proposal may re-,28
NA,ceive serious consideration from the Min-,28
NA,ister. He perhaps still adheres to his view,28
NA,"that, after representations have been made",28
NA,and justified before a Justice of the High,28
NA,"Court, importations which may be of great",28
NA,"magnitude may be justly prohibited, and",28
NA,that there is no justification for the posi-,28
NA,tion I have taken up. But I earnestly sub-,28
NA,mit that there is a' serious responsibility,28
NA,placed upon the Minister as to the manner,28
NA,"in which the Bill shall be applied, and",28
NA,that anv suggestion is worthy of considera-,28
NA,tion. I understand that a distinct promise,28
NA,has been given by the Opposition to push,28
NA,the B i l l through its Committee stage to-,28
NA,"day. Therefore, I do not propose to deal",28
NA,determination exhaustively with the subject-matter of,28
NA,"the amendment, or to show to what extent",28
NA,restraint of trade may be involved. I t is a,28
NA,tremendous power which is being given to,28
NA,the Minister. I think that even with the re-,28
NA,"ference to the Justice, i t will be found to",28
NA,be rather complicated and expensive,28
NA,machinery; and to entail enormous hardship,28
NA,upon certain importers. I submit°that in-,28
NA,asmuch as the Ministry has - substantially,28
NA,affirmed that the object of the Bill is to,28
NA,"deal with extraordinary conditions, we are",28
NA,justified in asking that Parliament should,28
NA,be afforded an opportunity of considering,28
NA,extraordinary determinations of t h e . M i n-,28
NA,ister. Every item of the Tariff had to be,28
NA,"But approved bv both Houses, and surely when",28
NA,drastic action is taken by the Minister in,28
NA,regard to certain imports his determination,28
NA,ought to be subject to review by the same,28
NA,tribunal. I sincerelv believe that i f the,28
NA,"amendment is adopted, it is likely to im-",28
NA,prove the condition of things. I t is not,28
NA,submitted out of anv feeling of hostility to,28
NA,the principle underlying the measure. I f,28
NA,"the Bill is seriously applied, even with the",29
NA,numerous alterations which have been,29
NA,"made, and the concessions which have been",29
NA,"secured, I fear that serious consequences",29
NA,may result. Parliament is the expression,29
NA,"of the will of the people, and it should, I",29
NA,"think, be called in as arbitrator in a matter",29
NA,of this importance.,29
Mr JOSEPH COOK ,Parramatta),29
NA,"[2.9] - I rise to support the amendment,",29
NA,which I hope will be agreed to. I t has a,29
NA,great deal more importance than appears on,29
NA,the surface. For the first time in the his-,29
NA,"tory of a British Parliament, there is a de-",29
NA,liberate proposal: to put the power of pro-,29
NA,hibiting trade outside Parliament. I see,29
NA,nothing inconsistent with the machinery,29
NA,providing for full and fair inquiry by a,29
NA,"Justice with all the powers of a Court, thus",29
NA,"guaranteeing a disinterested, impartial, and",29
NA,thorough sifting of all the facts concerning,29
NA,allegations of dumping. That will be an,29
NA,"advantage, I have no doubt, because when",29
NA,"we receive such evidence from the Justice,",29
NA,it will be practically the last word as to the,29
NA,substantiality of the facts alleged or other-,29
NA,"wise. Therefore, I think that instead of",29
NA,leaving the matter for the final determina-,29
NA,"tion of a Justice, we ought to reserve to",29
NA,ourselves the right to determine whether,29
NA,goods shall be prohibited from entering,29
NA,the Commonwealth even though they may,29
NA,be subject to the Tariff impositions,29
NA,which Parliament has already provided for.,29
NA,"We have established trading, relations with",29
NA,"other parts of the British Empire, and with",29
NA,"the rest of the world, meeting differences in",29
NA,"skill, advancement, numbers, or efficiency",29
NA,between our workmen and their competitors,29
NA,"by the imposition of duties,. But it is now",29
NA,proposed to hand over to the Minister the,29
NA,"rigjit to arbitrarily prohibit importation,",29
NA,without-the necessity of consulting Parlia-,29
NA,ment in the matter. This is the first time,29
NA,that the giving of such power to the Min-,29
NA,ister has been suggested. Parliament should,29
NA,not let this power leave its hands. I f it,29
NA,"does, it fritters away the sovereign control",29
NA,with which it is invested. I hope that the,29
NA,honorable member for Kooyong will press,29
NA,his amendment to a division.,29
NA,Question-Tha t the words proposed to be,29
NA,inserted be so inserted-put . The Com-,29
NA,mittee divided.,29
NA,Ayes,29
NA,Noes,29
NA,Majority,29
NA,AYES.,29
NA,"Cameron, D . N . MCLean, A.",29
NA,"Cook, J. MCWilliams, W. J-",29
NA,"Edwards, R. Robinson, A.",29
NA,"Glynn, P. MCM. Thomson, E .",29
NA,"Kelly, W. H . Wilks, W. H .",29
NA,"Knox, W. Tellers :",29
NA,"Lee, H . W. Conroy, A. H . B.",29
NA,"Lonsdale, E. Johnson, W. E.",29
NA,NOES.,29
NA,"Bamford, F. W. Mahon, H .",29
NA,"Batchelor, E. L . Mauger, S.",29
NA,"Carpenter, W. H . O'Malley, K.",29
NA,"Chapman, A. Page, J.",29
NA,"Crouch, R. A. Poynton, A.",29
NA,"Culpin, M . Ronald, J. B.",29
NA,"Deakin, A. Salmon, C. C.",29
NA,"Ewing, X. T. Storrer, D.",29
NA,"Fisher, A; Thomsoi, D . A.",29
NA,"Forrest, Sir J. Tudor, F. G.",29
NA,"Frazer, C. E. Watkins,' D.",29
NA,"Groom, L . E. Webster, W.",29
NA,"Hutchison, J. Tellers:",29
NA,"Isaacs, I . A. Cook, Hume.",29
NA,"Lyne, Sir W. J. Wilkinson, J.",29
NA,PAIRS.,29
NA,"Skene, T. Maloney, W. R. N .",29
NA,"Gibb, J. Thomas, J.",29
NA,"Fuller, G. W. Phillips, P.",29
NA,"Srcith, S. Higgins, H . B.",29
NA,Question so resolved in the negative.,29
NA,Amendment of the amendment nega-,29
NA,tived.,29
Mr ROBINSON ,Wannon) [2.20] - The,29
NA,former proposal was that the Justice's de-,29
NA,termination should have no effect until Par-,29
NA,"liament had approved of it, but I now sug-",29
NA,gest that the determination should have,29
NA,effect until thirty days after the meeting,29
NA,of Parliament. This would maintain the,29
NA,supremacy of Parliament in matters of,29
NA,taxation. The form of the amendment is,29
NA,as follows:-,29
NA,Provided that any determination shall have,29
NA,effect only until thirty days after its publication,29
NA,in the Gazette i f the Parliament be then in,29
NA,"session, or until thirty days after the next ses-",29
NA,sion of Parliament i f Parliament be not in,29
NA,"session, unless in the meantime a resolution is",29
NA,passed by both Houses of Parliament approving,29
NA,the determination.,29
NA,I do not know that the wording is the,29
NA,"best that could be adopted, and, therefore,",29
NA,in order to test the feeling of the Com-,29
NA,"mittee, I move-",29
NA,That the amendment be amended by the,29
NA,"addition of the word "" Provided.""",29
Mr KELLY ,Wentworth) [2.22] - I,29
NA,think that the Minister might very well ac-,29
NA,"15 cept the amendment. I could understand,",29
NA,"29 although I could not approve of, his re-",29
NA,fusal to accept the previous amendment.,29
NA,14 He might hold that it would be impossible,29
NA,for the Justice to meet a sudden emer-,30
NA,"gency, i f Parliament were not sitting.",30
NA,Under the amendment proposed by the hon-,30
NA,"orable and learned member for Wannon,",30
NA,"however, the Justice would be able to de-",30
NA,"cide a question pro tern., and we should",30
NA,afterwards have an opportunity to say,30
NA,whether or not his decision should stand.,30
Mr MCWILLIAMS ,- A question of that,30
NA,kind could always be raised in the House.,30
Mr KELLY ,No . I t might not be,30
NA,"possible, under the' Bill as it stands, be-",30
NA,cause a Government with strong fiscal views,30
NA,"might approve of a verdict, and avail them-",30
NA,selves of the forms of the House to pre-,30
NA,clude honorable members from reviewing,30
NA,it. The Government can have no reason-,30
NA,"able excuse for resisting the amendment,",30
NA,unless they are prepared to delegate the,30
NA,powers of Parliament absolutely to an out-,30
NA,side tribunal.,30
NA,Question - That the word proposed to,30
NA,be added be so added-put . The Com-,30
NA,mittee divided.,30
NA,Ayes ... ... ... 16,30
NA,Noes ... ... ... 31,30
NA,Majority,30
NA,"Cameron, D. N . MCLean, A.",30
NA,"Conroy, A. H . B. MCWilliams, W. J.",30
NA,"Cook, J. Robinson, A.",30
NA,"Edwards, R. Thomson, D.",30
NA,"Glynn, P. MCM. Wilson, J. G.",30
NA,"Kellv, W. H .",30
NA,"Knox, W. Tellers:",30
NA,"Lee, H . W. Johnson, W. E.",30
NA,"Lonsdale, E. Wilks, W. H .",30
NA,"Bamford, F. W. Mahon, H .",30
NA,"Batchelor, E. L . O'Malley, K.",30
NA,"Carpenter, W. H . Page, ] -",30
NA,"Chapman, A. Poynton, A.",30
NA,"Crouch, R. A. Ronald, J. B.",30
NA,"Culpin, M . Salmon, C. C.",30
NA,"Deakin, A. Spence, W. G.",30
NA,"Ewing, T. T. Storrer, D .",30
NA,"Fisher, A. Thomson, D. A.",30
NA,"Forrest, Sir J. Tudor, F. G.",30
NA,"Frazer, C. E. Watkins, D .",30
NA,"Groom, L . E. Webster, W -",30
NA,"Hughes, W. M . Wilkinson, J.",30
NA,"Hutchison, J. Tellers:",30
NA,"Isaacs, I . A. Cook, Hume",30
NA,"Lyne, Sir W. J. Mauger, S.",30
NA,"Smith, S. Higgins, H . B.",30
NA,"Fuller, G. W. Phillips, P.",30
NA,"Gibb, J. Thomas, J.",30
NA,"Skene, T. Kennedy, T.",30
NA,"Knox, W. Bonython, Sir J.",30
NA,"Cameron, D. N . Batchelor, E. L .",30
NA,"MCWilliams, W - J. Storrer, D .",30
NA,"Fysh, Sir P. O. Crouch, R. A.",30
NA,Question so resolved in the negative.,30
NA,Amendment of the amendment nega-,30
NA,tived.,30
NA,Amendment agreed to.,30
Mr MCWILLIAMS ,Franklin) [2.30].,30
NA,- I move-,30
NA,That the following new sub-clause be,30
NA,added :-,30
NA,""" (8) I n the case of the following agricul-",30
NA,tural implements :-Plough s of all,30
NA,"kinds over 15 cwt., tine harrows, disc",30
NA,"harrows, grain drills, combined grain,",30
NA,"seed and manure drills, land rollers,",30
NA,"cultivators, chaff cutters, seed cleaners,,",30
NA,"stripper harvesters, and any other im-",30
NA,"plement usually used in agriculture,",30
NA,the Justice shall inquire into and de-,30
NA,termine the question whether jthe,30
NA,goods are being imported with the,30
NA,effect of benefiting the primary pro-,30
NA,"ducers of the Commonwealth.""",30
NA,One of the reasons given for the introduc-,30
NA,tion of this Bill was that a combine of,30
NA,agricultural implement makers might be,30
NA,formed with the object of ruthlessly de-,30
NA,"stroying the Australian industry, and after-",30
NA,wards of inordinately increasing the price,30
NA,of their manufactures' for the purpose of,30
NA,"fleecing the agriculturists. Personally, I",30
NA,have never entertained the slightest fear of,30
NA,"*5 anything of the kind, and there has not",30
NA,AVES. been a tittle of evidence adduced in sup-,30
NA,"port of it. I regard the plough, the har-",30
NA,"row, and the seed drill as the tools of trade",30
NA,of the farmer. I f Australia is ever to pro-,30
NA,"gress, it must be by attracting a rural popu-",30
NA,lation.,30
Mr WILKS ,Ar e these implements,30
NA,made in Great Britaini?,30
Mr MCWILLIAMS ,Yes ; they are,30
NA,NOES. manufactured there very largely. Austra-,30
NA,lia can only progress by the settlement,30
NA,of the people upon the land.,30
NA,"That -fact is generally admitted, but I",30
NA,notice that any proposal to directly assist,30
NA,the agriculturists usually meets with very,30
NA,little sympathy in this House. We hare-,30
NA,only to look at the enormous improvements,30
NA,which have been made in farming imple-,30
NA,ments during the past decade to recognise-,30
NA,the necessity .which exists for the insertion-,30
NA,of the amendment which I have submitted.,30
NA,Ten years ago the position of the agricul-,30
NA,turists was very different from what it is-,30
NA,to-day. Since then all sorts of labour-,30
NA,PAIRS.,30
NA,saving appliances have been introduced.,30
NA,"For example, a better crop can be obtained",30
NA,"to-day by means of the seed drill, using",30
NA,"only half the. quantity of seed, than could",30
NA,be procured under the old method of sow-,30
NA,ing broadcast. Year by year further im-,30
NA,provements are being effected. We know,30
NA,that at the present time enormous rewards,31
NA,are being offered in America for labour-,31
NA,saving appliances in connexion with cotton-,31
NA,"picking, and i f Australia is ever to become",31
NA,"a cotton-producing country, it must be",31
NA,either toy the use of very cheap labour-,31
NA,which none of us' wish to see employed-,31
NA,or by the use of the most up-to-date machi-,31
NA,nery. I believe that the employment of,31
NA,labour-saving appliances would probably,31
NA,solve the problem which is to-day presented,31
NA,by our Northern Teritory tov enabling us to,31
NA,successfully cultivate tropical products.,31
NA,Agricultural machinery is at present in a,31
NA,state of evolution. The machine which was,31
NA,perfect last year may next year be out of,31
NA,date. In the United States and Canada,31
NA,"especially, the enormous fortunes acquired",31
NA,by great implement makers are being util-,31
NA,ized for the one purpose of steadily im-,31
NA,proving their machinery. So far as many,31
NA,"of our primary producers are concerned,",31
NA,Ave must recollect that they have to face the,31
NA,markets of the world with their surplus,31
NA,"products. Our wheat, butter, and fruit",31
NA,have to compete with countries which em-,31
NA,ploy the most up-to-date machinery. No,31
NA,Tariff can possibly assist them. I f our,31
NA,"farmers are to increase their export trade,",31
NA,it can only be by the use of the best,31
NA,labour-saving appliances obtainable. I am,31
NA,aware that a clause has already been in-,31
NA,"serted in the measure which, to some ex-",31
NA,"tent, protects the manufacturer. But i f",31
NA,"we pass the Bill in its present form, it",31
NA,will be within the power of those who are,31
NA,engaged in the manufacture of out-of-date,31
NA,machinery to hold up the importation of,31
NA,"the most modern labour-saving appliances,",31
NA,and thus to place our agriculturalists,31
NA,under an enormous disadvantage.,31
Sir WILLIAM LYNE ,Hume-Min -,31
NA,ister of Trade and Customs) [2.39] - I,31
NA,certainly cannot accept the amendment of,31
NA,"the honorable member in its present form,",31
NA,but i f he is prepared to agree to its modi-,31
NA,fication bv the insertion after the word,31
NA,""" producers,"" of the words "" without un-",31
NA,fairlv iniuring any other section of the,31
NA,"community,"" I will agree to it.",31
Mr MCWILLIAMS ,Tha t would spoil,31
NA,the effect of the clause.,31
Sir WILLIAM LYNE ,I t will spoil,31
NA,ithe honorable member's little game.,31
NA,move-,31
NA,That the amendment be amended by inserting,31
NA,"after the word "" producers"" the words "" with-",31
NA,out unfairly injuring any other section of the,31
NA,"community.""",31
Mr LONSDALE ,New England) [2.40].,31
NA,- I am in favour of the amendment of the,31
NA,amendment proposed by the honorable,31
NA,member for Franklin.,31
Mr JOSEPH COOK , I rise to a point of,31
NA,order. I submit that the amendment,31
NA,of the amendment just proposed by,31
NA,the Minister of Trade and Customs cannot,31
NA,be submitted. An amendment moved by the,31
NA,"honorable gentleman is under discussion,",31
NA,and he cannot more to amend an amend-,31
NA,ment of that amendment until it has been,31
NA,dealt with.,31
The CHAIRMAN , The Minister is,31
NA,quite in order in moving the amendment of,31
NA,the amendment.,31
Mr LONSDALE , I was about to say,31
NA,when the deputy leader of the Opposition,31
NA,"rose to a point of order, that the attitude",31
NA,of the Ministry would be more honest i f,31
NA,they simply negatived the amendment,31
NA,"of the amendment, instead of pro-",31
NA,posing the addition of other words.,31
NA,"If that course were adopted, we",31
NA,should have a fair straight-out vote on the,31
NA,honorable member for Franklin's proposal.,31
NA,Let us consider for a moment what would,31
NA,be the effect of passing the amendment of,31
NA,the amendment in the form now proposed,31
NA,by the Minister. Experiments with a view,31
NA,to the improvement of agricultural machi-,31
NA,nery are being made month after month,31
NA,and year after year. I t is only a little,31
NA,while since complaint was made to the,31
NA,Minister that so-called foreigners were con-,31
NA,ducting a. trial of disc ploughs with the ob-,31
NA,ject of discovering the improvements neces-,31
NA,sary to secure a machine best suited to the,31
NA,various soils of the country. I f an im-,31
NA,proved plough on this pattern were sought,31
NA,"to be introduced, the Minister, under his",31
NA,"further amendment of the amendment,",31
NA,would be able to prevent its importation.,31
NA,We should desire to give free play to the,31
NA,improved machinery which comes here from,31
NA,"other countries, instead of seeking to pre-",31
NA,vent its importation because our own,31
NA,manufacturers do not keep pace with,31
NA,modern development. The amendment of,31
NA,the amendment refers to stripper-harves-,31
NA,ters. There can be no doubt that great im-,31
NA,provements will be made in those machines,31
NA,as the result of experiments being made,31
NA,by agricultural experts. But what would,31
NA,I be the position i f an improved stripper-har-,31
NA,vester were sought to be introduced? Is it,31
NA,to be said that because the improved ma-,31
NA,chine would interfere with the business of,31
NA,a local manufacturer the fanners should be,31
NA,prevented from obtaining it? Should the,32
NA,farmers be injured in this way merely to,32
NA,strengthen the position of a manufacturer,32
NA,of obsolete machines? The Committee,32
NA,have largely followed the lead of the Min-,32
NA,"istry, failing to recognise that they are",32
NA,ing this action in the interests of the manu-,32
NA,"facturers alone, but I trust that they realize",32
NA,the true position. Had the Government,32
NA,agreed to the amendment enabling the Jus-,32
NA,"tice to fix prices, we might have allowed",32
NA,the present proposa.1 to pass; but they seem,32
NA,to be endeavouring to do all they can to,32
NA,"help the manufacturers, who comprise the",32
NA,smallest section of the community. That,32
NA,is the one object of the B i l l . I shall vote,32
NA,for the amendment moved by the honorable,32
NA,member for Franklin. The proposal sub-,32
NA,mitted by the Minister is absurd. I f the,32
NA,Government are opposed to the amendment,32
NA,"of the honorable member for Franklin, the",32
NA,Ministry should negative it in a straight-,32
NA,"out, honest way, and not seek to defeat it",32
NA,by a side wind. No doubt the Minister of,32
NA,Trade and 'Customs will boast to his consti-,32
NA,tuents that he has assisted the farmer by,32
NA,reducing the price of stripper-harvesters;,32
NA,but he knows that his one object has been,32
NA,to enable local manufacturers of those,32
NA,machines to obtain a higher price for them.,32
NA,I f he speaks the truth he will admit that,32
NA,his object is to prevent the competition,32
NA,which keeps down prices. I f he were,32
NA,honestly pursuing the object that 'he claims,32
NA,"to have before him, he would simply",32
NA,refuse to give an advantage to Mr.,32
NA,MCKay when he was in a combine,32
NA,to keep up prices against the farmers.,32
NA,They certainly deserve no consideration.,32
NA,I f I were satisfied that the business of Mr.,32
NA,MCKay was being ruined by importations of,32
NA,"harvesting machinery, I should not be pre-",32
NA,"pared to give him any assistance, because",32
NA,he was in combination with others to keep,32
NA,up the price of agricultural machinery,32
NA,against the farmer. Throughout the con-,32
NA,sideration of this Bill Ministers apparently,32
NA,have assumed that there is only one class in,32
NA,the community in whose interests legislation,32
NA,should be passed. Amendments in the direc-,32
NA,tion of helping other classes have come only,32
NA,"from the Opposition, who have endeavoured",32
NA,to secure that some protection shall be,32
NA,afforded under this measure to the worker,32
NA,and to the consumer. I shall support the,32
NA,amendment.,32
Mr CAMERON ,Wilmot) [2.52] -- I,32
NA,need hardly say that I strongly support the,32
NA,amendment proposed by the honorable,32
NA,I,32
NA,member for Franklin. The Minister of,32
NA,Trade and Customs proposes to add to it,32
NA,"the words "" without unfairly injuring any",32
NA,"other section of the community."" I t ap-",32
NA,pears to me that those words would cover,32
NA,"tak- too much ground. I f they are accepted,",32
NA,and one or two persons claim to be un-,32
NA,"fairly injured, they will prevent the pri-",32
NA,mary producer from being considered. I t,32
NA,is almost universally accepted that in all,32
NA,cases the majority should rule. That is,32
NA,"the principle followed in this House, and",32
NA,I think it should be applied in this case.,32
NA,I f it is shown that only a very limited,32
NA,number of persons are likely to be injured,32
NA,"by the importation of the articles specified,",32
NA,and that their importation will benefit the,32
NA,"great majority of the primary producers, it",32
NA,is the majority who should be considered.,32
