Speaker,Text,pageNumbers
NA,be prohibited either absolutely or sub-,22
NA,ject to any specified conditions or re-,22
NA,"Indeed, the strictions ; and",22
NA,(l>) notify in the Gazelle that the question,22
NA,"has been so referred.""",22
Mr DUGALD THOMSON ,North,22
NA,Sydney) [12.0] - I should like to know,22
NA,"why, under any circumstances, an importer",22
NA,should be denied an opportunity to show,22
NA,why the certificate should not be made. I f,22
NA,the Comptroller-General has time to get in-,22
NA,"... 19 formation from other people, he can surely",22
NA,show the importer a little consideration. I,22
NA,move-,22
NA,That the amendment be amended by leaving,22
NA,"AYES. out the words "" Except where delay would in",22
NA,the opinion of the Comptroller-General defeat,22
NA,"the objects of this Part of this Act,"" lines 1 to",22
NA,3-,22
Sir WILLIAM LYNE , I accept that.,22
NA,Amendment of the amendment agreed to.,22
NA,Amendment (by Mr JOSEPH COOK),22
NA,Tellers: agreed to-,22
NA,That the amendment be further amended by,22
NA,"the addition to sub-clause 4 of the words "" and",22
NA,NOES.',22
NA,"furnish him with a copy of the complaint.""",22
Mr GLYNN ,Angas) [12.5] -W e have,22
NA,alreadv agreed to an amendment providing,22
NA,"that the name, address, and occupation of",22
NA,the person who gives information shall be,22
NA,supplied to the importer. I would point,22
NA,"out, however, that the informer may be a",22
NA,man of straw put forward by some person,22
NA,of means. To prevent the possibility of,22
NA,Tellers.;,22
NA,"anything of that kind, I think that a bond",22
NA,should be taken from the informer that he,22
NA,will comply with any order of the Court,23
NA,as to costs in the event of the adjudication,23
NA,being in favour of the importer. I move-,23
NA,That the amendment be further amended by,23
NA,"the insertion of the following new sub-clause,",23
NA,to follow sub-clause 4 :- .,23
NA,"""44. No certificate shall be issued on infor-",23
NA,mation supplied by any person not,23
NA,being an officer of the Public Service,23
NA,unless such person gives to the Min-,23
NA,ister a bond for such amount and,23
NA,with such surety as the Minister,23
NA,may approve to abide any order of,23
NA,the' Justice as to costs i f the Justice,23
NA,determines the question in favour of,23
NA,"the importer.""",23
Sir WILLIAM LYNE ,Hume-Ministe r,23
NA,of Trade and Customs [12.8] - I trust that,23
NA,the honorable and learned member will,23
NA,"not press his amendment, because",23
NA,I am endeavouring,23
NA,wishes of honorable members as far as,23
NA,I can. I intend to move the insertion of a,23
NA,new clause which will provide that the,23
NA,person giving information may be ordered,23
NA,by the Justice to whom the question is re-,23
NA,ferred under this part of the Act to,23
NA,"pay the whole, or part, of the costs in-",23
NA,curred bv the importer in whose favour the,23
NA,question is determined. That would apply-,23
NA,to the case of a person wilfully making a,23
NA,false declaration or giving misleading infor-,23
NA,mation.,23
Mr GLYNN ,Tha t would afford no se-,23
NA,curity.,23
Sir WILLIAM LYNE ,Doe s the hon-,23
NA,orable member suppose that in the event,23
NA,"of a man of straw coming forward, the",23
NA,"Comptroller-General, or the Minister,",23
NA,would take action?,23
Mr GLYNN , I am afraid he would.,23
Sir WILLIAM LYNE , I do not think,23
NA,the amendment would be workable. On,23
NA,"the other hand, abundant safeguards would",23
NA,be afforded under the provision I intend to,23
NA,insert.,23
NA,Mr LONSDALE,23
NA,[ . ] - 1 - trust,23
NA,I 2 9,23
NA,and learned member for Angas will,23
NA,press his amendment.,23
NA,of workmen were put forward by their,23
NA,employer to say that the importation and,23
NA,"sale of certain' goods in Australia, would",23
NA,have a tendency to reduce their remunera-,23
NA,"tion, how would it be possible to recover",23
NA,costs from them? I suppose that the Minis-,23
NA,ter would act on information supplied by,23
NA,workmen who believed that their interests,23
NA,were suffering.,23
Mr MCWILLIAMS , T h e B i l l is intended,23
NA,"for the benefit of the manufacturer, and",23
NA,not for that of the workers.,23
Sir WILLIAM LYNE , T h e amendment,23
NA,would not help the working man.,23
Mr LONSDALE ,Th e -question is,23
NA,would there be anything unfair in the,23
NA,amendment? Is it not fair that an im-,23
NA,"porter, who may be involved in",23
NA,"heavy loss, owing to false informa-",23
NA,tion being given to the Customs,23
NA,"authorities, should have some redress?",23
NA,"The Minister has asked "" Would anv Min-",23
NA,ister act upon the information of a man of,23
NA,"straw?"" We know that the Minister him-",23
NA,self has acted upon the testimony of local,23
NA,manufacturers without even taking the pre-,23
NA,liminary precaution of examining their,23
NA,books. He has acted upon their mere ipse,23
NA,dixit to do things which were absolutely,23
NA,wrong.,23
Mr WEBSTER ,Wha t things ?,23
Mr LONSDALE ,Th e Minister raised,23
NA,the valuation upon imported harvesters for,23
NA,Customs purposes upon the unsupported,23
NA,statements of local manufacturers.,23
The CHAIRMAN ,Order !,23
Mr LONSDALE ,I am not here to,23
NA,"conceal facts, but to make my position ab-",23
NA,"solutely clear. Personally, I decline to",23
NA,trust a Minister who has got the ear of the,23
NA,manufacturers. We should safeguard the,23
NA,interests of the men at whom this Bill is,23
NA,aimed. If the honorable and learned mem-,23
NA,ber for Angas presses his amendment to a,23
NA,"division, I shall be found supporting",23
NA,him. It is only just that persons who lay,23
NA,an information should back up their state-,23
NA,ments with a bond as an evidence of their,23
NA,bona fides.,23
Mr KELLY ,Wentworth) [12.13] -Th e,23
NA,Minister declares that his aversion to the,23
NA,amendment is due to the fact that it would,23
NA,prevent any person in the position of a,23
NA,workman from initiating proceedings.,23
Sir WILLIAM LYNE ," N o , I said that it",23
NA,might have that effect.,23
Mr KELLY , W e all recognise that it,23
NA,that the honorable would be extremely difficult for a workman,23
NA,to bring the Act into operation. But i f,23
NA,I f a number the Minister will scrutinize its provisions,23
NA,carefully he will find that the Bill itself,23
NA,affords a sufficient answer to his fears.,23
NA,"Clause 14 defines "" unfair competition "" -",23
NA,which is the essential element underlving,23
NA,the commencement of any action-a s some-,23
NA,"thing which, under ordinary circumstances",23
NA,"of trade, ""would probably lead to the Aus-",23
NA,"tralian goods being no longer produced,",23
NA,"or being withdrawn from the market, or",23
NA,"being sold at a loss, unless produced at an",23
NA,"inadequate remuneration 'for labour."" How",23
NA,"can anvbody, except the manufacturer,",24
NA,know that competition is going to affect,24
NA,his industry in the way suggested? A,24
NA,-workman mav fear that his own employ-,24
NA,"ment will be prejudiced, but I take it that",24
NA,the Government will not act upon mere as-,24
NA,sumption. They will act only upon some,24
NA,"bond fide assurance, and that assurance can",24
NA,only properly emanate from the manufac-,24
NA,turer. Consequently I cannot see how the,24
NA,Government can refuse to accept the,24
NA,amendment.,24
Mr MCWILLIAMS ,I f they,24
NA,consent to it we shall never have a re-,24
NA,sponsible person making a charge.,24
Mr KELLY ,Exactly . The object of,24
NA,this part of the Bill is to prevent dump-,24
NA,"ing, but the clause in its present form is an",24
NA,"absolute inducement to "" dummying."". I",24
NA,can understand the Minister's original re-,24
NA,"luctance to accept the amendment, but now",24
NA,that he recognises that under tlie Bill the,24
NA,only persons who can approach him are the,24
NA,"local manufacturers, I think that he should",24
NA,insist upon them backing their statements,24
NA,with a substantial bond. I hope that the,24
NA,amendment will be pressed to a division.,24
Mr GLYNN ,Angas) [12.17] -Th e,24
NA,Minister has asked whether I think that,24
NA,any Minister of Trade and Customs would,24
NA,act upon the evidence of a man of straw ?,24
NA,That depend* entirely upon the charac-,24
NA,"ter of the evidence, and not upon the sol-",24
NA,vencv of the individual. The clause,24
NA,reads-,24
NA,"The Comptroller-General, whenever",24
NA,"reason to believe that any person, &c.",24
NA,"The words ""reason to believe"" consti-",24
NA,tute a clear answer to the statement of the,24
NA,Minister.,24
NA,Ouestion-Tha t the words proposed to,24
NA,be inserted be so inserted--put . The Com-,24
NA,mittee divided.,24
NA,Ayes 15,24
NA,Noes,24
NA,Majority 11,24
NA,"Brown, T. Lonsdale, E.",24
NA,"Conroy, AII . B. MCWilliams, W.",24
NA,"Cook, J. Thomsc -t, D.",24
NA,"Glynn, I>. M . Wilks, W. H .",24
NA,"Hughes, W. M . Wilson, J. G.",24
NA,"Tohnson, W. E. fellers:",24
NA,"Knox, W. Kelly, W. H .",24
NA,"Lee, H . W. Liddell, F.",24
NA,0,24
NA,NOES.,24
NA,"Batchelor, E. L . Poynton, A",24
NA,"Carpenter, W. H . Ronald, J. B.",24
NA,"Chanter, j . M . Salmon, C. C.",24
NA,"Chapman, A. Spence, W. G.",24
NA,"Culpin, M . Storrer, D .",24
NA,"Ewing, T. T. Thomson, D. A.",24
NA,"Fisher, A. Tudor, F. G.",24
NA,"Forrest, Sir J. Watson, J. C.",24
NA,"Hutchison, J. .Webster, W.",24
NA,"Isaacs, I . A. Wilkinson, J.",24
NA,"Lyne, Sir W. J.",24
NA,"Maloney, W. R. N . Tellers:",24
NA,"Mauger, S. Cook, Hume",24
NA,"Page, J. Frazer, C. E.",24
NA,do not,24
NA,PAIRS.,24
NA,"Smith, S. Higgins, H . B.",24
NA,"Gibb, J. Thomas, J.",24
NA,"Fuller, G. W. Phillips, P.",24
NA,"Robinson, A. O'Malley, K.",24
NA,"Skene, T. Deakin, A.",24
NA,"Edwards, Ti. Groom, L . E.",24
NA,Question so resolved in the negative.,24
NA,Amendment of the amendment negatived.,24
NA,Amendment (by Mr KELLY ) agreed to-,24
NA,That the amendment be further amended by,24
NA,the addition of the following new paragraph :-,24
NA,"""(c) Forward to the Justice a copy of the",24
NA,"certificate.""",24
NA,"Amendment, as amended, agreed to.",24
Mr MCWILLIAMS ,Franklin) [12.27].,24
NA,- I move-,24
NA,That the following new paragraph be,24
NA,added :-,24
NA,""" (d) In the case of the following agricul-",24
NA,tural implements :-Plough s of all,24
NA,"kinds over cwt., tine harrows, disc",24
NA,"harrows, grain drills, combined grain",24
NA,"he has seed and manure drills, land rollers,",24
NA,"cultivators, chaff cutters, seed cleaners,",24
NA,"stripper harvesters, and any other",24
NA,"implement usually used in agriculture,",24
NA,the Justice shall inquire into and,24
NA,determine the question whether the,24
NA,goods are being imported with the,24
NA,effect of benefiting the primary pro-,24
NA,"ducers of the Commonwealth.""",24
NA,This is an exact copy of the provision in,24
NA,"the N e W ^ a l a n d Act, under which agricul-",24
NA,tural implements which are tools of trade,24
NA,26- of farmers are exempt.,24
Mr ISAACS ,Indi-Attorney-General ),24
NA,[12.29] -I f the honorable member for,24
NA,"Franklin would allow me, I should like ro",24
NA,point out that the clause with which we are,24
NA,AVES.,24
NA,now dealing relates only to disputes.,24
NA,What the honorable member desires to do,24
NA,is to put in a direction to the Tusfice as,24
NA,"to what he shall determine, and that can be",24
NA,done more appropriately in clause 17.,24
NA,"Amendment, by leave, withdrawn.",24
NA,"Clause, as amended, agreed to.",24
NA,Clause 16-,25
NA,From the date of the Gazette notice until the,25
NA,- report of the Board has been dealt with by,25
NA,"the Governor-General, goods the subject of the",25
NA,investigation shall not be imported except upon,25
NA,such security and subject to such conditions as,25
NA,"the Minister approves; and those goods shall,",25
NA,"i f imported in contravention of this section, be",25
NA,deemed to be prohibited imports within the,25
NA,"meaning of the Customs Act igoi, and the pro-",25
NA,visions of that Act shall apply to the goods,25
NA,accordingly.,25
NA,Amendment (by Sir WILLIAM,25
NA,proposed-,25
NA,"That the words "" report of the Board has",25
NA,"been dealt with by the Governor-General"" be",25
NA,"left out, with a view to insert in lieu thereof",25
NA,"the words "" publication in the Gazette of the",25
NA,"determination of the question by the Justice.""",25
Mr DUGALD THOMSON ,North,25
NA,Sydney) [12.31] -Ther e is a very serious,25
NA,provision in this clause. Immediately it is,25
NA,considered by the Comptroller-General that,25
NA,"there is unfair competition, for instance,",25
NA,the good's are to be held up.,25
Mr ISAACS ,No t by the Comptroller-,25
NA,"General, but by the Minister.",25
Mr DUGALD THOMSON , The,25
NA,"Comptroller-General takes the initiative,",25
NA,and then i f the Minister,25
NA,port the goods are to be held up.,25
Mr ISAACS ,Ha s the honorable memtice,25
NA,ber seen the amendments which are proordinary,25
NA,"posed "" in this clause ?",25
Mr DUGALD THOMSON , I see for,25
NA,that it is proposed that the importer shall,25
NA,give the Minister a bond with such sureshall,25
NA,ties as the Minister approves.,25
Mr ISAACS ,An d later on it may be_,25
NA,voided i f the Justice determines the ques-',25
NA,tion in favour of the importer.,25
Mr DUGALD THOMSON ,Tha t is ported,25
NA,"better than the original clause, and I shall",25
NA,"not, therefore, press my objection.",25
NA,Amendment agreed to.,25
NA,Amendment (by Sir WILLIAM,25
NA,agreed to-,25
NA,"That the words "" except upon such security",25
NA,and subject to such conditions as the Minister,25
NA,"approves"" be left out, with a view to insert",25
NA,in lieu thereof the following words :-,25
NA,""" unless the importer-",25
NA,(a) gives to the Minister a bond with,25
NA,"sureties as the Minister approves,",25
NA,such amount (not exceeding the,25
NA,value of the goods for Customs,25
NA,poses) as the Minister considers,25
NA,and reasonable by way of precaution,25
NA,"in the circumstances, and conditioned",25
NA,to be void i f the Justice determines,25
NA,the' question in favour of,25
NA,porter ; or,25
NA,(i) gives such other security and complies,25
NA,with such other conditions as the Min-,25
NA,"ister approves.""",25
NA,"Clause, as amended, agreed to.",25
NA,Clause 17-,25
NA,1. The Board shall expeditiously and carefully,25
NA,"investigate and report upon the matter, and f or",25
NA,the purpose of the investigation shall have power,25
NA,"to inquire as to any goods, things, and matters c",25
NA,"whatsoever which they consider pertinent, neces-",25
NA,"sary, or material.",25
NA,2. For the purpose of the investigation the,25
NA,Board shall be deemed to be and to have all,25
NA,the powers of a Commission within the meaning,25
NA,"of the Royal Commissions Act 1902, and the",25
NA,LYNE) provisions of that Act shall -apply to the in-,25
NA,vestigation.,25
NA,3. The investigation shall extend to ascer-,25
NA,tain whether the competition is or probably wilt,25
NA,"be unfair, and i f unfair then in what respects,",25
NA,and the Board shall report to the Minister ac-,25
NA,cordingly.,25
NA,4. I n the event of a difference of opinion,25
NA,among the members of the Board as to any mat-,25
NA,ter arising in the course of the investigation or,25
NA,"report, the opinion of the majority shall be the",25
NA,"opinion of the Board, but the dissenting mem-",25
NA,ber of the Board may separately state his,25
NA,opinion.,25
NA,Clause consequentially amended.,25
NA,Amendment (by Sir WILLIAM LYNE),25
NA,proposed-,25
NA,""" That sub-clauses 2, 3, and 4 be left out with",25
NA,a view to insert in lieu thereof the following,25
NA,acts upon his renew sub-clauses :-,25
NA,2. For the purpose of the proceeding the Jus-,25
NA,"shall sit in open Court, and shall have alt",25
NA,the powers of a Justice in the exercise of the,25
NA,"jurisdiction of the High Court, includ-",25
NA,"ing the power, i f he thinks fit, to state a case",25
NA,the opinion of the Full Court upon any,25
NA,question of law arising in the proceeding.,25
NA,3. The certificate of the Comptroller-General,25
NA,be primd facie. evidence of facts by .this,25
NA,Act i f required to be specified thereby.,25
NA,4. I n addition to the Comptroller-General and,25
NA,"the importer the Justice may, i f he thinks fit,",25
NA,allow any person interested in importing im-,25
NA,gation.,25
NA,goods to be represented at the investi-,25
NA,5. The Justice shall be guided by good con-,25
NA,"science and the substantial merits of the case,",25
NA,"without regard to legal forms or technicalities,",25
NA,LYNE) or whether the evidence before him is in accord-,25
NA,"ance with the law of evidence or not.""",25
Mr DUGALD THOMSON ,North Syd-,25
NA,ney) [12.40] - I draw attention to the fact,25
NA,that under this clause no appeal is allowed,25
NA,except as to a question of law. I think,25
NA,such there ought to be an appeal to the Full,25
NA,f or Court from a decision of a Judge in such,25
NA,true an important matter. A man's livelihood,25
NA,"purmay depend on the decision, and I point",25
NA,"just out that the Judge himself may refer ,to",25
NA,the Full Court on questions of law. The,25
NA,Judge has not only to decide questions of,25
NA,"the imfact, but to practically form an opinion",25
NA,and come to certain conclusions; and he,25
NA,may form ai wrong opinion. Why not allow,25
NA,"appeal, as in many other less important",25
NA,cases? I t is not as i f any injury would,26
NA,thereby be done to the plaintiff.,26
Mr ISAACS , There is not generally,26
NA,any appeal as to questions of fact.,26
Mr DUGALD THOMSON ,Bu t it is be,26
NA,not a question of fact; it is a question,26
NA,opinion and decision. The facts may be,26
NA,"admitted, and on those 'facts the Judge",26
NA,comes to a certain determination which,26
NA,seem to the party affected so unjust that,26
NA,he will desire to appeal to the Full Court. conditions.,26
NA,These decisions may affect whole classes,26
NA,of trade-ma y affect very seriously a large,26
NA,portion of the trade of the country-an,26
NA,surely there ought to be the right of ap-,26
NA,"peal, in order to ascertain whether the Full",26
NA,Court will sustain the decision of a single,26
NA,Judge.,26
Mr ISAACS ,Th e decisions will not,26
NA,more extensive in their operation than the,26
NA,decisions of the Judge under the Arbitraconfused;,26
NA,tion Act.,26
Mr DUGALD THOMSON ,Th e Argoods,26
NA,bitration Act differs from nearly all other,26
NA,Acts.,26
Mr ISAACS ,Bu t under the Arbitration,26
NA,Act there are many cases similar to those,26
NA,which will arise under this Bill.,26
Mr DUGALD THOMSON , Under,26
NA,the Arbitration Act it is provided,26
NA,"there shall be no delay, such as would",26
NA,result in keeping a business in a state of,26
NA,disturbance.,26
NA,Mr ISAACS:-Ther e is the same proviUnder,26
NA,sion under the B i l l ; the same words,26
NA,adopted.,26
Mr DUGALD THOMSON ," 'But competition,",26
NA,uncler the Bill the person who suffers is,26
NA,"the person who may desire to appeal, and",26
NA,he cannot conduct his business,26
NA,tering into bonds until the appeal is settled.,26
Mr ISAACS ,Th e business is not disthat,26
NA,"turbed, but may go on.",26
Mr DUGALD THOMSON , A man,26
NA,"has to provide bonds, and that in itself",26
NA,is a great disturbance. A man cannot,26
NA,bonds to an unlimited extent.,26
Mr ISAACS ,I t is not unlimited.,26
Mr DUGALD THOMSON , A man,26
NA,might have to-find a number of bonds one,26
NA,"after another, in order to be permitted",26
NA,caTrv on his business.,26
Mr ISAACS ,Woul d there not be delay,26
NA,in anv case?,26
Mr DUGALD THOMSON , There that,26
NA,would only be delay as affecting the party,26
NA,who desired to appeal. No doubt the,26
NA,cision of the Full Court would take some,26
NA,little time to obtain. The importer,26
NA,"be affected more than anybody else, and i f",26
NA,"he were willing to incur the delay, and give",26
NA,"bonds, why should he not have the oppor-",26
NA,tunity to appeal? The instances will not,26
NA,"occasional, but, even from the Minister's",26
NA,"of stand-point, continuous. I f appeal were",26
NA,"allowed, it would only mean that, for a",26
NA,"little time, the party concerned would have",26
NA,"may to continue his business under bond, and",26
NA,then the Court would finally settle the,26
Mr ISAACS , I can quite see that the,26
NA,difficulty mentioned might arise under the,26
NA,d proposed new sub-clause 7.,26
Mr DUGALD THOMSON , I must,26
NA,say that I do not place so much importance,26
NA,on the point in connexion with the proposed,26
NA,"new sub-clause 2, but I thought I would",26
NA,be mention the matter now. The amendments,26
NA,are so complicated that one is apt to get,26
NA,but I would point out that the,26
NA,decision may mean the forfeiture of the,26
NA,under clause 16. Under the Customs,26
NA,"Act there are certain prohibited gdods, and",26
NA,the Bill includes the provisions of that Act.,26
NA,Section 229 of the Customs Act declares,26
NA,that certain goods shall be forfeited.,26
Mr ISAACS ,A n appeal to the Court,26
NA,that would not affect clause r6.,26
Mr DUGALD THOMSON ,Bu t the,26
NA,seriousness of the matters involved make it,26
NA,desirable to have the power to appeal.,26
NA,the provisions of the Customs Act,26
NA,are the goods might be absolutely forfeited.,26
NA,The more importart ouestion as to unfair,26
NA,"should, I think, also be sub-",26
NA,"ject to appeal, i f the party affected takes",26
NA,the great risk of giving bonds to cover his,26
NA,without enbusiness in the meantime.,26
Mr GLYNN ,Angas) [12.48] - I think,26
NA,the proposed new sub-clause 3 ought,26
NA,not to stand. We have passed clauses,26
NA,under which the opinion of the Judge,26
NA,or the Comptroller-General establishes,26
NA,find the fact of unfair competition. The,26
NA,Comptroller-General mav be of opinion,26
NA,"that unfair competition exists, and when",26
NA,"the question is sent on, the Judge",26
NA,is to have the power to determine that it,26
NA,"to does exist; in other words, the slightest",26
NA,possible evidence will justify the Judge,26
NA,"in expressing that opinion, which no one",26
NA,can possibly challenge. Notwithstanding,26
NA,we give this tremendous power to the,26
NA,"Tudge, we sav that every allegation in",26
NA,dethe certificate shall be 'deemed to be,26
NA,"correct. That is not"" consistent with, the",26
NA,would ordinary methods of proof. By clause,26
NA,1,26
NA,15 we provide that the certificate must,27
NA,"contain certain statements, including one",27
NA,that the goods are being imported with the,27
NA,intention to destroy Australian industry.,27
Mr ISAACS ,No .,27
Mr GLYNN , I beg the Attorney-,27
NA,General's pardon.,27
Mr ISAACS ,Wil l the honorable and,27
NA,learned member look at,27
Mr GLYNN , I know perfectly - well,27
NA,that the Attorney-General is going to refer,27
NA,me to sub-clause 2.,27
Mr ISAACS ,Yes .,27
Mr GLYNN , I do not think that sub-,27
NA,clause is at all exhaustive.,27
NA,"particularly clever Bill, and we have to",27
NA,be cautious.,27
Mr ISAACS , I have no objection to,27
NA,"add to the proposed new sub-clause 3, the",27
NA,"words "" required by sub-section 2 of section",27
Mr GLYNN ,No t only the matters in,27
NA,this sub-clause 2 which the Attorney-Gene-,27
NA,ral now thinks ought to be the limit of this,27
NA,"-prima facie evidence, but also the matters",27
NA,"specified in. sub-clause 1, which contain the",27
NA,"whole gist of these provisions, are pre-",27
NA,"sumed to be correct, no matter how ela-",27
NA,"borate and exhaustive they; may be, unless",27
NA,the importer can show that the evidence,27
NA,concerning any one of them is false. I t,27
NA,will be exceedingly difficult for the im-,27
NA,porter to counteract the effect of that prima,27
NA,facie presumption. He will not only have,27
NA,"to give evidence, but will have to go into",27
NA,the matter of foreign prices in foreign mar-,27
NA,"kets, fair rates of wages, and I do not",27
NA,know what. Not only should we amend,27
NA,the clause in the direction suggested by the,27
NA,"Attorney-General, so as to confine its ope-",27
NA,ration to sub-clause 2-whic h is a consider-,27
NA,able limitation-bu t even with that amend-,27
NA,ment the clause should not stand in the,27
NA,Bill. I move-,27
NA,That the amendment be amended by the inser-,27
NA,"tion, after the word "" by,"" line 12, of the words",27
NA,""" sub-section 2 of section 15 o f .""",27
Mr KELLY ,Wentworth) [12.52] -,27
NA,Under sub-clause 2 of clause 15,27
NA,grounds for interference with the competi-,27
NA,tion will be amongst the matters dealt with.,27
NA,I f those grounds are' to be taken as prima,27
NA,"facie evidence, would it be competent for",27
NA,tlie accused to call for the person who has,27
NA,alleged those grounds to the Comptroller-,27
NA,"General, in order to examine him as to his",27
NA,reasons ?,27
Mr ISAACS ,Certainly . There is power,27
NA,to call any witnesses. There is no limita-,27
NA,tion.,27
NA,Amendment of the amendment agreed to.,27
NA,"Amendment, as amended, agreed to.",27
Mr ISAACS ,Indi-Attorney-General) ',27
NA,[12.54] - I move-,27
NA,That the following new sub-clause be,27
NA,added :-,27
NA,""" 6. No person shall in any proceeding before",27
NA,a Justice be excused from answering any ques-,27
NA,tion or producing documents on the ground that,27
NA,the answer or production may criminate or tend,27
NA,"to criminate him, but this answer shall not be",27
NA,admissible in evidence against him in any,27
NA,criminal proceedings other than a prosecution,27
NA,"for perjury.""",27
Mr KELLY ,Wentworth) [12.551 -,27
NA,Would this provision protect the witness,27
NA,from any penalties under clause 21 in the,27
NA,event of his making a false declaratio-,27
Mr ISAACS ,"Yes , the falsity would have",27
NA,to be proved against him. I t is a well-,27
NA,known principle that no one is obliged to,27
NA,incriminate himself.,27
Mr KELLY , I can see a loop-hole for,27
