speakerGroups,Speaker,text,pageNumbers
78,Mr FOWLER,"It is, undoubtedly, reminiscent of the early days of the Federation to hear a question like this discussed so earnestly and with so much ability, and, I am pleased to be able to add, without so much of the purely party aspecf that we have sometimes had. There are only two points which I wish to discuss, and which have not been dealt with in this debate up to the present. The one note during this debate which has seemed to me to ring somewhat hollow is the crv that some members of this House are sacrificing "" national interests "" to some less important State interests. The cry of "" Nationalism "" is found to rest on a very slight basis, when we inquire into the relative positions of the State and Federal Parliaments. I deny that the great Commonwealth Parliament is any more National than is the sum total of the State Parliaments. I would remind honourable members that throughout the discussion in the States of the question of Federation the fact was never lost sight of that we were to have a Federation, not only of the peoples, but also of the States of Australia. In every phase of the extensive and able dehates upon the Federal question one can see how fully and earnestly the matter of the conservation of the duties and rights of the States was intended to be provided for I in the Federal compact. I have heard a good deal about the predominant position of the Canadian National Parliament, as it is called, in contrast with the powers of the Parliaments of the Provinces. I have heard honourable members express regret that this Parliament has not been endowed with what they choose to call the same national powers as are possessed by the Parliament of the Dominion of Canada. If they take the trouble to look up the Act: which brought that Dominion Parliament into existence, and compare the list of functions apportioned to it with those apportioned to the Parliaments of the Provinces, they will find that substantially there was made in that great part of the Empire the same re-arrangement as has been made in Australia. There is undoubtedly the one difference, that the Dominion Parbounds, liament has under its control all powers directly handed over to the Provinces, whereas the Commonwealth Parliament has only the powers specifically handed over to it by the States. In other words, position is reversed, but in both cases there was, in the minds of those responsible the creation of the two central bodies, recognition of the same common-sense with principle. What ruled their minds, determined their allocation of duties and functions, was simply a question of common sense. They asked themselves what duties could be best performed by a centralized authority, and what by the States or vinces. That was the problem that they such endeavoured to solve, and the framers of population our Constitution most emphatically decided small; but, of it apart from any question of creating ""Imperial'' Parliament for Australia. They settled it purely and simply on a utilitarian basis, having due regard to what appeared to them to be the capacity of the Commonfrom wealth Parliament for certain functions, and the corresponding ability of the State Parliaments to carry out other duties. would remind honourable members that when the Federal Convention had finished its work, there were very many Democratic members of the Australian community who denounced the result as contrary to the best interests of the Democracy. They had a wholesome objection to that centralization of power which is undoubtedly anti-Demoin cratic. They regarded such powers as were handed to the Federal Parliament as tending in an undemocratic direction, they consequently opposed the' Federal facts Constitution as it was put before the people. There is no doubt that, with perhaps the single exception of centralization for fence purposes, the peoples of civilized munities show an increasing inclination decentralize. Honourable members who remuch present Victoria should not forget that objection urged in the early days against the government of the Port Phillip settletion, ment by the New South Wales authorities was, from a Democratic stand-point, well founded. It was said then, with a great deal of force, that certain functions carried out by that remote Government in New South Wales could be much better perfor formed by the people of the Port Phillip settlement themselves. A separation took place, and the supreme control of their Mr Fowler* own affairs was granted by the Imperial authorities to the people of Port Phillip. From that time, the development of Victoria undoubtedly went on by leaps and and the people of that State found, not until the defence problem became of such supreme importance, that very little objection could be taken to the decentralizing influence which had given them the control of the their own territory. We hear a great deal about the fact that Australia has no fewer for than seven Parliaments, and some honora able members go so far as to wish that, the exception of this Parliament, they and were all wiped out. But if any one considers the tremendous distances that separate the various, parts of Australia, he will, I think, begin to realise that even seven Parliaments are by no Promeans an excessive number to control a vast geographical region. Of course, one may be reminded that the Australia is comparatively an so much a matter ofI contend again, that it is not population as of area or of geographical separation of one part of this island continent from another. The population of Port Phillip, when separation New South Wales was demanded and obtained, was comparatively insignificant, but that was regarded as no obstacle; and 1 I say without hesitation that any one who looks at the huge area of Australia, and the geographical separation of certain parts of the continent, must realise that the State Parliaments, although they control, nominally, only a handful of people, have functions that cannot be performed as well by any centralized authority. We have, room Australia for twenty-five TJnited Kingdoms ; and in my own State there is an area equivalent to half-a-dozen average European and Kingdoms. Any one who looks, at such as these will, I think, hesitate to say that, while it is quite proper there.should be a central authority to deal with trade deand commerce, and so forth, the functions comof the State Parliaments cannot be carried to oiit by them in their respective spheres better than they could be carried out the by us. I am glad to be able to compliment the Ministry on having dealt with this quesas it appears to me, in that broad, general spirit required in such a crisis in. the history of Australia. Here we have no question affecting one or two particular States, but one affecting the welfare and development of the whole of Australia. I , one, intend to give hearty support to the proposals of the Government. I realise that the proposals, as they stand, cannot be interfered with without seriously injuring the possibility of a settlement with the States. We have an understanding between two parties; and if we, on the one hand, interfere with it, it stands to reason that the other side may have some hesitation in accepting any changes we may make. On the whole, it seems to me that, with the years of experience behind us, the Government proposals meet the situation in Australia; and the provision made for the future is, humanly speaking, as well thought out as any such provision could possibly be. Another phase of the question, with which I desire to deal very briefly, more particularly affects my own State. An impression has been sedulously fostered in certain quarters that Western Australia, in particular, in supporting, as I believe it does through the length and breadth of its vast area, the proposals of the Government, is very selfishly doing so in order to obviate other taxation of a. State character. There is no doubt that up to the present time Western Australia has suffered considerably financially from the effects of Federation. While some members of this House have suggested that Western Australia comes to the other States, and to the Commonwealth Parliament, in the attitude of a mendicant, I am glad that such a view is not general. It is a view which was repudiated by those who gave special consideration to the-circumstances of Western Australia when drawing up the Constitution, and who now, under the present arrangement, seek to continue that consideration. In both cases it is admitted by those who have gone into the question that the sliding scale provided for Western Australia was only an equivalent, and not an absolute equivalent, for the losses she sustained by entering the Federal compact. It is also admitted, in the arrangement we are asked to seal, that Western Australia is fully entitled, as a matter of justice and equity, to special consideration, in view-and I quote the phraseology of the memorandum-of the large contribution to the Customs revenue - per cafita made by that State. We undoubtedly require all the money we can get in Western Australia for our local development. Western Australia has been behind the other States in obtaining that inflow of capital and of humanity without which no new country can progress. We have, as I have already said, suffered severely in our development by reason of the steadily decreasing amount of money available for us under Federal conditions. The State has done all in her power - all that she can reasonably be expected to do - to supplement by local taxation the shortage of revenue from Federal sources. The fact is-and may come as a surprise to many honourable members-that the total revenue of Western Australia per head through direct taxation is not less than £ 1 is. 3d., as compared with an average of 17s. 2d. for the whole of the Commonwealth. Western Australia is, I think, second only to Tasmania in the thoroughness with which it has applied the principles of direct taxation. In view of the rudimentary character of our development, I contend that the taxation of this character imposed in Western Australia is even greater, relatively, than that of any of the other part of the Commonwealth.' That, I think, is a fairly sufficient reply to those who contend that Western Australia, in order to make up the shortage of Federal revenue, ought to tax herself still more. In that State there is a land tax of id. in the £ i , an income tax of 4d. in the £ 1 on incomes over £200, a dividend tax of id._ in the £ i for all companies, stamp duties, and totalizator duties; and in view of a list of that kind the charge of not having sufficiently contributed from local resources is totally and absolutely unfounded.",24
79,Sir PHILIP FYSH ,Are there probate duties in Western Australia?,26
80,Mr FOWLER ,Not up to the present; the large - fortunes of Western Australia have not yet developed-they are in fosse and not in esse. NA there are young.,26
81,Mr FOWLER ,"And doubtless their fortunes will increase with increasing years. I sincerely hope that in Western Australia there will be none of those great fortunes which characterize particularly the land magnates of the other States, but the people there may look forward to competence and independence as the result of energy, industry, and thrift, as is being proved every day of our existence. If Western Australia places 100 settlers on the land through the exercise of the functions of the State Parliament, that is as much a step in the direction of national welfare and development as the creation of an industry in Melbourne by means of a high Protective duty. In regard to settlement, the State Parliaments have a national duty to perform- a duty which, with the exception of defence, transcends any, I think, that lie before us in this Parliament. So long as the power of dealing with the land is left in the hands of the State Parliaments, so long are they entitledto be regarded as national in their character, quite as much as is the Parliament in which we have the honour to sit. I hope that the proposed arrangement will be carried. It will, I believe, be the means of giving the States a solidarity in their financial relations that will enable them to carry on effectively their work of development. If that be done, and if we can settle thousands where none are at present, the Commonwealth, through the Customs, will be given an increased revenue that I feel sure will supply the whole of our requirements for an indefinite period to come. NA Prime Minister, in opening this important discussion, wisely pointed out that the Constitution, under which we work and are governed, not only affects us as a Commonwealth Parliament, but has an important bearing on the State Parliaments and Governments. Particularly in the matter of finance the interests of one are irrevocably connected with the interests of the other; and this, of course, is especially the case during the ten years existence of the operation of the Braddon section. I have viewed the approach of the expiration of the operation of that section with some measure of anxiety. It was clear to my mind that if we allowed the time to pass without, in the meantime, arriving at some satisfactory arrangement, we should find ourselves in absolute possession of an income very much larger than we could at times judiciously expend, while the States would be placed in financial difficulties. This being so, I am glad that we have so far arranged matters that an agreement has been come to in conference between representatives of the Commonwealth and the States. not concern me now that under it some of the States will not fare as well as others; it is sufficient to know that their representatives were able to fall into line, and agree to accept a per capita payment of 25s. Many extraneous matters have been discussed on the motion before the House, but I do not propose to follow the example of those who introduced them. The honourable member for Batman referred to the imposition of a land tax. If land taxation is to be imposed, it should be by the Governments of the States. Only under very extraordinary circumstances should the. Commonwealth impose land taxation. Should the Commonwealth impose a land tax without being impelled thereto by pressing necessity, it would to some extent offend against the Constitution. I refuse to consider the agreement as affecting the Tariff. It has been argued that the natural result of a Protective Tariff is to diminish the returns from Customs, and, undoubtedly, to the extent to which Protective duties' are effective, they reduce Customs revenue. But the statistics of the world show that many of the most effective Tariffs yield a good return. Moreover, it has been freely stated by the Prime Minister that, although we are asked to agree to pay to the States 25s. per capita, the money must not necessarily be raised by Customs and Excise duties.",26
82,Mr TUDOR ,"Dee s the honourable member suggest raising it by direct taxation r"" NA No doubt, when the need arises, the Parliament of the time will adopt the wisest means_ to meet the occasion. The discussions in the Convention make it clear that it was intended that the States should always participate with the Commonwealth in the Customs and Excise revenue.",27
83,Sir PHILIP FYSH ,"Nothin g is more certain. NA breach of faith if the Commonwealth were to refuse to return to the States their fair portion of that-revenue. The Protective policy of Australia is likely to he more stringent in the future than in the past. Honourable members generally are agreed that 25s. per capita is not too large a sum to return to the States, but it is objected that should the agreement be embodied ip the Constitution, it will be unalterable. 1 do not endorse that view. The electois whochoose the Commonwealth Parliament choosealso the State Pao-l-iaments, and if they It does found that more money was going to either the Commonwealth or to the States that was needed by one or the other party, they would insist on a re-division. It has beenargued that the States will - be against anv amendment of the Constitution with a viewto an alteration of the agreement. But should the Commonwealth find itself in financial difficulties, and compelled to resort to direct taxation, while the States had more revenue than they needed, the people would surely insist on an amendment of the Constitution.",27
84,Sir WILLIAM LYNE ,"The honourable pied land. member's speech would lead one to regard liim as an anti-Federalist. NA Federalist. The Commonwealth alone can - deal with defence and certain other large matters; but, while it has great and imtheir portant functions to discharge, the Governberations ments of the States have also their duties. Australia is too large to be governed wholly from any one centre. Had we had unificamatters tion before the Coolgardie water scheme was carried out, would it not many years to convince the central Government that that scheme was needed, and would have results justifying the expendicaucus? ture ?",28
85,Mr FOWLER ,"We may judge how long caucus ? it would have taken by the time needed to - obtain a survey of the proposed railway from Kalgoorlie to Port Augusta. NA - how long would it take to convince Western' Australians or Queenslanders of the justithe fication for expenditure on perhaps necessuch sary irrigation works in Victoria ? Both Commonwealth and the State Governments have work to do in developing the contisiderable nent, and it is our business to see that revenue is fairly divided between them. Unquestionably, had this matter been - settled four or five years ago the States - would have received more than they are now likely to receive. New schemes for - expenditure have been brought forward, Defence is likely to prove more costly, in various ways we have been made aware of the need for more money for the proper exercise of the functions of the Commonwould wealth. It seems to me, however, that return to the States 25s. per capita would - he fair and reasonable. The honourable member for Gippsland said that he would agree to the scheme if it were to have effect for only a three years' orfiveyears' period. Such an arrangement would not be acceptbeen able to the States, because it would mean continual financial unrest. The Treasurers of the States would not know how they would stand at the end of the period, the matter would have to be repeatedly - discussed. It has been said that the sons of Victorian, farmers are leaving this State. Tl is true that some of them, are going New South Wales, Queensland, and even Western Australia; but I am glad of.that. One of the best things that can happen that Australian-born men should push into the more remote parts of the continent, and undertake the development of unoccutainty Newcomers will find the settled parts more congenial, and we may expect immigrants in increasing numbers. consider the proposed agreement acceptable. The members of the Conference are to be commended for having transacted business in private. Had their delibeen open to the press', an agreement might not have been arrived at. It is often an advantage to be able to discuss calmly and deliberately, when the eye of the press is not focused on those have taken who are deliberating. NA argument in favour of the Labour party's",28
86,Mr BATCHELOR ,"O r of the Government NA played its cards remarkably well. The caucus method is a good one from the point of view of honourable members opposite. It is essentially a good system to adopt in settlement of big financial questions as these. If this agreement is emthe bodied in the Constitution, the problem will of necessity be settled for some contime. That it will be settled for the all time, however, I absolutely deny. Lt will be disposed of for a time long enough to enable us to determine more clearly and conclusively what are likely tb be the permanent requirements of the Commonwealth and State Legislatures. We are certainly wiser today than we were ten years ago. and' At the Federal Conventions the foremost thinkers of the time had no data upon which to arrive at a determination as to what be the relative expenditures of the to different Parliaments. But with the knowledge that has since been gained as the result of our experience during the last ten years, we are now in a much better position-to arrive at a satisfactory conclusion. Taking advantage of the data that has thus obtained, the Commonwealth Government, in conjunction with the State Premiers, have determined that a certain payment can be legitimately made to the States and without unduly inconveniencing either party to the agreement. If , say, ten years hence, it is found that the agreement is not an equitable one', I venture to think that to the people who will today consent to its embodiment in the Constitution will just as readily consent to an amendment of the is Constitution to meet the then existing reout quirements. In the meantime the States will have secured that measure of cerwith respect to their finances which is necessary to enable them to proceed with the various important projects which they have in view. These considerations, and the fact that I know that the closest attention has been given to the. subject by the Government, induce me to favour the agreement. I know that the States are not getting all that they wanted. Their representatives spoke of a per capita payment of 26s. or 28s. per annum, but they, like the Commonwealth Government, have had to make concessions. The States have now agreed to accept this per capita payment of 25s. per annum, which is less than.they would have been prepared to accept if a guarantee of the continuance of the arrangement could not have been given.",28
87,Mr BATCHELOR ,"They have to accept, under the Constitution, what this Parliament provides. NA we-should work amicably with the States.",29
88,Mr BATCHELOR ,"Admittedly , but that is not the question. NA States in a false position, which might result in their having to impose an amount of direct taxation that would be burdensome to the people. One result of the agreement arrived at by the Premiers' Conference was made apparent immediately in Victoria. Directly the agreement was arrived at, the Victorian State Government faced the situation, and, wisely or unwisely, proposed a land tax.",29
89,Mr ROBERTS ,"The State land tax was proposed long before the Conference was held. NA not fixed until after the Conference had taken place. The land tax proposals of the State Government have been framed with due regard to the fact that under this agreement Victoria will receive much less than it has been receiving from the Commonwealth under the Braddon section. This agreement will relieve the Commonwealth Government of the necessity of having to resort to the issue of Treasury bonds as an expedient for meeting our immediate difficulties. Surely that is a matter of some importance. The issue of short-dated bonds is riot wise, but the Treasurer, in his Budget statement, intimated that the Government proposed to resort to that expedient in order to meet temporary difficulties. If this agreement be adopted, however, those difficulties will be removed, since the Commonwealth will be relieved of the obligation to return three-fourths of its Customs and Excise revenue to the States, and will have more than is necessary to finance the current year. Having regard to the obligations that are likely to confront us, and to the revenues we shall possibly receive, it appears to me that if this agreement be carried - into effect, the Commonwealth will have at its disposal sufficient funds to enable it to do all that it can legitimately be expected to do out of revenue. If we attempted, however, to provide out of revenue for all the great developmental schemes that we have in view, we should be called upon to impose such heavy taxation that, instead of Australia holding out attractions to people in other parts of the world, it would be regarded as a country for people to avoid. That consideration must lead us to the adoption of a rational system of borrowing.",29
90,Dr WILSON ,"If we construct some of the proposed transcontinental railways, we shall shortly have to borrow. NA circumstances all that we have ""to consider is what is a fair division of the Customs and Excise revenue between the States and .the Commonwealth, - and I think that, having regard to the basis of distribution which has been arrived at, and to the statistical returns which have been laid before us as to the per capita return of Customs and Excise revenue in other countries, it must be admitted that we are not proposing to return to the States more than we might reasonably be expected to do. Sitting suspended from 12.56 to 2.15 p.m.",29
