speakerGroups,Speaker,text,pageNumbers
136,Mr BATCHELOR ,"It is the Constitution. The Constitution lays it down distinctly that the Commonwealth may take over the State debts, and one of the great reasons urged upon the people for accepting the Constitution was the hope that great savings would result through the Commonwealth taking the debts over.",35
137,Sir JOHN FORREST ,That is right; but the States had to indemnify the Commonwealth'.,35
138,Mr BATCHELOR ,"Of course; but that is not the point. The whole point I wish to make is that it would get over the difficulty as between the States and the Commonwealth. The right honourable member interjects that it was not contemplated in the Constitution, but it certainly was. If there was one thing more than another contemplated in the Constitution it was that the State debts should be taken over, and it was laid down expressly that the States were to indemnify the Commonwealth for 'any costto which it might be put. That part of the problem has now been dropped. I admit that I cannot attach any great importance to the State Debts Bill, which is also to be brought forward, because all that it proposes to do is to extend the Constitution so that the whole of the State debts, and not only a part of them, may be taken over. That does not easily get us any "" forrarder."" For ten years we have had the right to take over the debts incurred by the States up to the time of Federation, but we have done nothing in the matter. We could have wiped out the Braddon blot, and saved all the trouble if we had taken over the debts in the last ten years.",35
139,Sir JOHN FORREST ,Wipe d out the Braddon blot?,35
140,Mr BATCHELOR ,"The Constitution provided that the Braddon section should apply until the Commonwealth took the In debts over, and not after.",35
141,Sir JOHN FORREST ,The Braddon section applied for ten years. It had nothing to do with the taking over of the debts.,35
142,Mr BATCHELOR ,The taking over of the debts would have superseded the Braddon section,35
143,Mr GROOM ,"The honourable member means "" in effect.""",35
144,Mr BATCHELOR ,Of course I ' mean in effect. I did not mean to say in so not the many words that it would do so.,35
145,Mr SPEAKER ,"Order . I would point out to honourable members that this is virtually ,a second-reading debate, and not a dialogue, and that honourable members are not entitled to take up the time occupied by others in making their speeches.",35
146,Mr BATCHELOR ,"If three-fourths of the Commonwealth revenue had ibeen absorbed in paying interest on the State debts, that would have absolutely wiped out, in effect, the Braddon section.",35
147,Mr GROOM ,But it would have left the Commonwealth with only one-fourth.,35
148,Mr BATCHELOR ,"Of course, it would not have affected the revenue of the Commonwealth, but it would have wiped out the difficulties that existed at the time between the Commonwealth and the States. One of the reasons why I greatly object to this agreement is that, instead of being likely to hasten the taking over of the State debts, it will delay it, and I think that any one who looks at the question can hardly avoid arriving at the same conclusion. Under the Constitution as it stands, if the Commonwealth were to take over the State debts at the present time it would be to the interest of the Commonwealth to make every saving possible, because it would receive a larger revenue in consequence. There would be every incentive to the Commonwealth to insure the most careful management, and to save to the people as much as possible, because every penny that could be saved would increase the Commonwealth revenue.",35
149,Sir JOHN FORREST ,How ?,36
150,Mr BATCHELOR ,"When we take over the debts, the interest on them becomes a charge on the Commonwealth revenue, and the more savings we make in conversion, the more economical the management of the debts, the more revenue will be left to the Commonwealth.",36
151,Sir JOHN FORREST ,Would not States get the saving?,36
152,Mr BATCHELOR ,Certainl y not.,36
153,Sir JOHN FORREST ,That is a idea!,36
154,Mr BATCHELOR ,"Does the right honourable member mean to say that if the Commonwealth took over the State debts, and gradually wiped out the whole of them, it would still have to pay to the States the amount which it had wiped out by the saving that it made?",36
155,Sir JOHN FORREST ,Certainly ; savings would go to the States.,36
156,Mr BATCHELOR ,That is a most extraordinary proposition !,36
157,Sir JOHN FORREST ,It was part of my proposal.,36
158,Mr BATCHELOR ,"I have never heard it before, and if the right honourable member considers it, I am sure he will recognise that it is an unthinkable proposition. I admit that that would be the result if the agreement now before us were carried, and the Constitution were amended in such a way that we had to pay the States 25s. per head for all time.' In that case, no matter how many savings the Commonwealth made, it would be no better off. The Commonwealth might wipe out that proportion of the debts which is represented by 25s. per head-abou t £160,000,000-in a period of years, by means of savings in conversion and careful management, but it would the no better off as the States would still receive from it 25s. per head. We should then have taken over the debts from the States, handed over to them their reproductive works, and left them with all their assets and undertakings",36
159,Sir JOHN FORREST ,"Of course, the honourable member regards the States as a lot of aliens !",36
160,Mr BATCHELOR ,"The right honourable member need not be silly. According to the present proposal of the Government, if we wipe out the State debts in twenty or thirty years, and leave the States with their assets free, and in full enjoyment of all the revenues derivable from those assets, it will make no difference to the Commonwealth, which will have to go on paying the States 25s. per head.",36
161,Mr HEDGES ,"We should wipe the debts out with the States' money, which the States allow us to collect.",36
162,Mr BATCHELOR ,That is a curious the sort of argument.,36
163,Sir JOHN FORREST ,Her e are my proposals as reported in Hansard. Will the new honourable member look at No. 8 of them?,36
164,Mr BATCHELOR ,"The right honourable member has handed me a report of the Budget speech for 1906, in which he lays it down thatA l l net profits arising from any conversion or redemption of existing loans should be credited by the Commonwealth to the State concerned, and the annual payment by that State reduced accordingly from time to time. all the Of course, I agree with that, but that is not the point which I was making. It simply means that any saving made would go to reduce the amounts which the States' had to make up to the Commonwealth dur.ing the time that the Braddon section continued to operate. I was dealing with the period when we had got beyond that stage, and when the savings became much more than the amounts by which the States had to indemnify the Commonwealth. Even the Treasurer has never yet suggested that we should then go on paying all the profits to the States.",36
165,Sir JOHN FORREST ,I do.,36
166,Mr BATCHELOR ,"The wordsThe annual payment by that State reduced accordingly from time, to time, refer only to payments by the States to the Commonwealth. They cannot refer to a time when the payments by the States to the Commonwealth will have ceased - As I should like to clear up this point, which is of some importance, I should be glad to obtain leave to continue my remarks on a future day. Leave granted; debate adjourned. ADJOURNMENT. OLD-AGE PENSIONS : REGULATIONS AND CORRESPONDENCE : PAYMENT OF PENSIONS AT POST OFFICES-SUPPL Y OF BAYONETS TO VICTORIAN FORCES-SLO T TELEPHONES-PUBLI C TELEPHONES I N HOTELS.",36
167,Mr DEAKIN ,"Ballarat-Prime Minister) [3.29] - I move That the House do now adjourn. I again invite honourable members to be good enough to assist the Government at this period of the session to reach the next stage of this measure as early as is possible. I do not wish to deprive honourable members of the opportunity of speaking, but simply invite all to follow the many excellent precedents set them by condensing their remarks.",37
168,Dr MALONEY ,"Melbourne) [3.30] I am sorry to have again to bring the administration of the Old-age Pensions Act under the notice of the House. I have NA the representative of North Melbourne in the State Parliament, and forwarded by that gentleman to me, and I have also had brought under my notice by Sir Alexander Peacock, M.L.A., the great difficulty that is caused by the number of questions that are put to applicants. I should have thought that, seeing the Postmaster-General and the honourable member for Batman are opposed to the present system, that some remedy would have been applied; but it would appear that all questions asked or communications sent are evaded or put on one side. The Treasurer, whose stomach is never empty, tells us that cases brought under his notice have been sent 011 to the registrars, and that in a few weeks replies may be expected. Such a state of things is really absurd; and I believe that the unnecessary delay is resented by nine out of ten of the taxpayers.",37
169,Sir JOHN FORREST ,The consideration of the Victorian applications is nearly finished.,37
170,Dr MALONEY ,"If the Treasurer says that, let me tell him that he does not know what he is talking about; and if the matter were debated in a meeting, say, at the Melbourne Town Hall, the pity and contempt of the people would be his. The NA is as follows:In regard to your memo, re Mrs Fahey, ""a pension of ios. per week was recommended in her case on the ist instant, and the papers were sent on the same day to the Old-age Pension Office. I have written in re the matter, which will perhaps liven them up. JFhe above remarks apply to Mr Tucker's case. There seems to be an extraordinary amount of delay in dealing with the claims at the Old-age Pension office. I shall always be glad to do anything for you in this matter. On that letter is the following note by Mr. Prendergast:Please note the length of time the pension papers remain undealt with in the Commonwealth offices. I have another letter here which was handed to me - by the honourable member for Maribyrnong, in whose district the case is, and it is as follows:I wrote you, and gave you full particulars about my husband,- F. W. Ellsworth, applying for a pension, the ist of July. You were kind enough to answer that letter, and thanks very much for your kind sympathy. I thought I would let you know how he got on. The first lime he went before the Court, he was recommended for ios. .a week. Another month passed; then he was told to apply again at Court. He did so, and the gentleman said, "" The papers are returned,"" and said, "" They will not grant you ios. a week."" Everything had to be gone over again, then he was recommended for 7s. 6d. a week. Another month passed. This week he got word his pension was granted, and when he went, all they had granted him is 5s. a week. Now, sir, is that all respectable old people can get at the age of 71 years? He has not been able to work for some years, and I have had a hard struggle to make ends meet. My age is 64, and for many years I have had very bad health, suffering from gall stones. We possess nothing, but if we live for another five years, and can keep the payment up of the house we are buying, we should have a roof over our heads. It seems to me that the Department does not make any allowance for a house that has been bought on the instalment plan. If the amount paid up were considered, it would be a fair thing; but it is decidedly not right to take into account a house which will not be paid for until five years have elapsed. This man is suffering from diabetes.",37
171,Sir JOHN FORREST ,Why do you not send on these cases to the Department?,37
172,Dr MALONEY ,I am sick and tired of sending cases on.,37
173,Sir JOHN FORREST ,I am sure the honourable gentleman always gets civility and attention.,37
174,Dr MALONEY ,"I get civility from those who do not know what these delays mean to the poor people-fro m an officer who draws £ 2 0 a week, and has as much sympathy with the cases as, perhaps, the Treasurer has.",37
175,Mr CROUCH ,"I have written several letters to the Treasurer, and have not received answers.",38
176,Dr MALONEY ,"What , then, becomes of the alleged civilitv and readiness to reply?",38
177,Sir JOHN FORREST ,The honourable member only desires to find fault and advertise himself.,38
178,Dr MALONEY ,"If I advertised myself as the honourable member does, I should be a Guy Fawkes.",38
179,Mr SPEAKER ,"1I have-already called honourable members to order several times, and I ask them not to break the Standing Orders by interrupting the honourable member addressing the House.",38
180,Dr MALONEY ,"Her e is another case in the constituency of the honourable member for Gippsland, to whom I shall hand on the letterA short time ago, I wrote, to you calling your attention to how I had been treated in reference to my old-age pension, but, since then, I have come acquainted with the new feature in reference to the administration of pensions. My wife, not being satisfied as to the amount that she was receiving, wrote to the police magistrate that inquired into her case, at the Moe Court-house, on 26th July last, explaining some mistakes she had made in answering some of the questions that the police magistrate asked her with a view of getting things reviewed, and informing him of the amount she was receiving, viz., 4s. 6d. per week. She got an answer to her letter, a copy of which I herein enclose, informing her that the amount that he, the police magistrate, had recommended to the Commissioner, that she should have was £14 a year for herself, and also, her husband. Now, I consider the difference between £14 that the police magistrate recommended, and the 4s. 6d. a week which we are paid, amounts to £11 14s., making a difference of £ 2 6s. a year for each of us. The question I should like to have answered is, what is the use of appointing a police magistrate to inquire into the old-age pension applications, if their decisions and recommendations are not to be followed out, and by whose authority this kind of thing can be carried out, whether it is by the instruction of the Treasurer to the Chief Commissioner, or the Commissioner to his deputy, to carry on these cheeseparing tactics? It would be interesting to know, so that the blame might rest on the right shoulders. It might not seem much to the officer who has the administration of the pensions, that the difference of £14 and £11 14s. is only £ 6s. a year, is very much to make 2 a complaint about, but if those officers had to change places with us, they would find that that would make a material difference. In reference to this case, the following memorandum was sent by the Clerk of Courts at Traralgon : I am directed by the police magistrate to inform you that he recommended £14 per annum in each case, yours and that of your husband. Any further communication in the matter should be to the Deputy Commissioner of Pensions for Victoria at Melbourne, who may remit the cases to the police magistrate for rehearing if he thinks fit, on the materials that are on the fresh matter you may place before him. There are about 180 questions to be answered by the applicants and their friends j and, in addition, the police magistrate has power to ask any question he likes, and the latter, unlike the officers of the Department, has before him the applicants. I should like to know why it is that the Department so frequently alters the decisions of the magistrates, and why such an unreasonable length of time is occupied in the remission of the cases. It is not pleasant to me to have to continually bring such cases before the House; but if honourable members could see the worry caused by the unnecessary and infamous questions, I feel certain that, on a vote in the House, 95 per cent, of them would be wiped out.",38
181,Mr CROUCH ,"Corio) [3.43] - I do not be- think it is a good practice to bring individual cases before the House, but if the honourable member for Melbourne, who appears to have an unusually large number of them on his hands, has had the same experience as myself, he is justified in his action. ' Personally I have had only fivecases of the kind sent to me, and I wrote in reference to them to the Department. Three of the communications' I forwarded to the Treasurer, and not one of them has been replied to, even in acknowledgment of their receipt. One of these cases, however, I know has been attended to; but, in reference to the other two, I addressed myself to individual officers, and then they were looked after. If letters are addressed to the Treasurer, it should be somebody's duty to, at any rate, acknowledge their receipt. No matter what time may be occupied, the honourable member for Melbourne, if his treatment has been similar, should see that the facts are laid before the House, or, otherwise, his constituents may think that he is neglecting his duty. There is a matter in connection with the Defence Department to which I desire to direct attention. For the last seventeen months the infantry militia of Victoria has been without bayonets. New rifles were issued in March, 1908, to the force at Bendigo, Ballarat, and in the metropolis, and to a number of the men of the volunteer infantry, but they were not accompanied with bayonets. The average service of a militiaman is about eighteen months, so that between one-half and two-thirds of the present militia forces of Victoria are without training in the use of the bayonet. We know how important a part the bayonet played in the Russo-Japanese wai, notwithstanding the long range of the modern rifle, and the usefulness of and need for training in bayonet work is obvious. 1I have been told that representations have been made to the District Commandant by the regimental commanders, but that, as an artilleryman, he knows little about infantry requirements and does not see the importance of issuing bayonets, and has pooh-poohed the proposals submitted to him. About 50,000 bayonets are at some future time to be altered to fit the short rifle. It must be remembered that whatever defence scheme may be adopted will not be perfected for seven years. proposed by the Government is not to be initiated until ist July, 1911. If , until then, the Victorian District Commandant has decreed that the militiamen are to be without training in the use of the bayonet - it is only in Victoria that this state of affairs obtains-it will be a very unfortunate thing for the country. NA have received numerous complaints regarding the administration of the Old-age Pensions Act, one of the most serious reaching me within the last two days. A magistrate in the northern part of the State which I represent is alleged to have said, when inquiry was made as to the cause of delay in dealing with pension applicants, that he had no time for Commonwealth work while there was State, work to be done. informed that he is not paid for Commonwealth work.",38
182,Mr TUDOR ,"Surel v that is incorrect. NA mation which I have received, and I suggest that inquiry should be made to ascertain whether it is correct. It is very hard that the old persons of South Australia, where pensions have been promised since the nineties, should be prevented from taking advantage of our humane legislation. It will be a crying shame if this great Act loses its effect by reason of the inaction of stipendiary magistrates or others. There has been published in Adelaide a list of the applications dealt with and finally settled, but it contains only an infinitesimal part of the whole number of applicants. I cannot understand why so much time is taken in dealing with applications. One complaint I make is that everything is done to prevent old persons from getting pensions. Applicants living in miserable, ramshackle structures, only suitable for wood houses, have had large sums deducted from their pensions. The other day I heard of such a deduction in connection with an applicant living in a three-roomed wooden house in Port Augusta, valued by the council at £160. A few years ago I sold a five-roomed wooden house in that town for JQT.0, and am certain that nothree-roomed wooden affair would realizein the market-whic h is a true test of value-one-thir d of £160. Those administering the Invalid and Old-age Pensions Act accept every inflated valuation made by a municipality, to the detriment of the unfortunate applicants for pensions. I trust that the Minister will have inquiries made from the Deputy Commissioner in That Adelaide as to the cause of the delays which have occurred in South Australia, and as to the reported utterances of the magistrate to whom I have referred.",39
183,Dr LIDDELL ,"Hunter) [3.53] - I desire to put myself right about a matter as to which I have been misunderstood. On Wednesday last I drew attention to the fact that it was the declared policy of the Postmaster-General's Department 'not to put public telephones into hotels. Since then, persons have spoken to me on the subject in a manner which makes me think that there are some who regard me as an advocate for the placing of telephone . bureaux in public-houses or other buildings where drink is sold. That is not my desire. What I wished to point out was that the Department is depriving the travelI am ling public of a necessary .convenience, and is losing revenue, by refusing to place penny-in-the-slot telephones in hotels. I am acquainted with a hotel in Melbourne where there are three telephones-on e in the manager's office, another under the care of the housekeeper, and a third for the use of the guests. As persons staying in the hotel may not use the manager's, or the housekeeper's, telephone, it is very difficult for them to despatch messages. Were the Department managed on commercial principles, it would seize an opportunity like this to install a slot instrument. Some time ago I brought the matter under the notice ot the honourable member for Eden-Monaro, when he was Postmaster General, and being a man of liberal ideas and considerable business experience, he was inclined to adopt my view that, where telephones are needed in large residential hotels, the Department should supply them. I do not blame the Postmaster-General, because I think that these matters are controlled by his officers. They, however, have been trained from their earliest years in the rules of the Department, and have had to look at the world through their pigeon-holes. Nor travelling much, they know of little beyond what happens in the Department.",39
184,Sir JOHN QUICK ,This is a matter' for which the Minister is responsible.,40
185,Dr LIDDELL ,"The Department Should conduct its business on commercial lines, and give the public the facilities to which it is entitled. At the present time the Departmental practice is inconsistent. It is stated in the Telephone Directory that public telephones will not be allowed in public-houses. A hotel keeper may hire a telephone from the Department at the rate of two calls a penny, and charge his lodgers one call a penny. But this arrangement necessitates the continuous employment of an attendant. It has been suggested that a box might be provided into which users of telephones might drop their coins. But the public will not pay when it can get a service without paying. Notwithstanding the rule that public telephones are not to be placed in hotels, I find that there is one at the Palace Hotel, Bourke-street, another at the Anglers' Hotel, Ascot Vale, and a third at the Survey Hotel, Deepdene. Strangely enough, there are only seventy-nine slot payment telephones in Victoria.",40
186,Mr TUDOR ,Is that all the public telephones there are?,40
187,Dr LIDDELL ,"There appears to be a difference between slot payment telephones 'and telephone bureaux. The number of public telephones could be advantageously increased if storekeepers and others were encouraged to provide them for their customers. In New South Wales there are only fourteen slot payment telephones. There must be revenue to be derived from the use of these machines, and yet the Department does not encourage them.",40
188,Mr TUDOR ,I think that there are four at Circular Quay alone.,40
189,Dr LIDDELL ,"There is certainly one at the Grosvenor Hotel, Church Hill, Sydney. There are also what are called public telephones. At the Hotel Australia! there is a public office from which telegrams can be sent, and other postal business transacted. Yet we have the Postmaster-General saying that, on moral grounds, he will not allow these instruments to be used in hotels, lest any one should be encouraged to imbibe liquor. In New South Wales, there are public telephones at the following hotels:-The Arcadia, the Australia, the Metropole, the Wentworth, Tattersall's, the United Service, and the Merrylands, at Holroyd. So that, although the Department says that it will not encourage hotel telephones, we have, nevertheless, a series of public telephones at the principal hotels. One reason given by the Department is that the establishment of slot telephones at hotels might prevent hotel keepers from having private instruments. But the reply is that if a hotel keeper had a slot machine, and used it for his own purposes the Department would probably derive a larger revenue therefrom than it would do if he paid for a private telephone. It is absolutely ridiculous that we in Australia should not be as up-to-date in these matters as are other countries.",40
190,Mr MAUGER ,There are States in America where the telephones are not permitted in hotels at all.,40
