speakerGroups,Speaker,text,pageNumbers
0,NA,"i^ouse of Hfprrsentatibrs . Friday, 1 October, igog. Mr SPEAKER took the chair at 10.30 a.m., and read prayers. PERSONAL EXPLANATIONS. FINANCIAL RELATIONS, COMMONWEALTH AND STATES.",14
1,Mr HENRY WILLIS ,"Robertson) [10.31] - r wish to make a personal explanation. During his very interesting speech last evening, the honourable member for iFremantle referred to a statement made by me on the previous day regarding the proposed arrangement for future payments by the Commonwealth to the States, and contrasted it with what I said a year or two ago on the same subject. But in my earlier speech. I was referring to the pro1 bable future expansion of the Commonwealth power, and the services which would have to be taken over. I saidIt does not necessarily follow that we should take over these large services at once. Then come these words, which were quoted by the honourable memberWe cannot adjust the nnancial relations of the Commonwealth and States unless we take over these great services. Unless we obtain control of them we must return to the States at least ^9,000,000 annually. The honourable member for Fremantle has charged me with inconsistency, but the two speeches are quite consistent. In 1907-8, the States were receiving from the Commonwealth ,£8,856,905. That sum I wish to capitalize under a scheme which I put forward as better than that of the Government. He claims that I should support the Government scheme, but the quotation which he made does not prove that I was ever in favour of such an arrangement. I proposed to give to the States to the very fraction what the Government proposes to give to them, and to take from them, within a trifling amount, what would be taken from them under the Government scheme. But, instead of first giving them 25s. per capita, and then taking away that and 14s. 3d. to pay the interest on the public debt, I would treat them much more liberally. I would give the States as much as they would receive under the Government proposal, and was within the mark in saying that £9,000,000 would have to be returned to them on the basis of the 1907-8 payment. The basis of the calculation on which the Government scheme rests is not sound, whereas my scheme has an actuarial foundation.",14
2,Mr SPEAKER ,The honourable member must not discuss the Government scheme.,14
3,Mr HENRY WILLIS ,"I am merely mentioning facts which show that my speeches on this subject have not been inconsistent. I propose to give to each State what it is actually entitled to. It is because the Government scheme will not do so that I cannot support it. My scheme would provide funds for all time, whatever the expansion of the Commonwealth expenditure might be by reason of the taking over of new services, but under the Government proposal such expansion cannot be provided for. Mr KING O'MALLEY - The honourable member's scheme is a good one.",14
4,Mr HENRY WILLIS ,"I fear, Mr. Speaker, that you may think that it was arranged between the honourable member for Fremantle and me that he should make the quotation to which I have referred, in order that. I might have an opportunity this morning to again explain the merits of my scheme, but I assure you that, although we sit together, nothing of the kind has been done.",14
5,Mr WISE ,"Gippsland) [10.37] - Un fortunately, I was temporarily absent last evening when the honourable member for Fremantle referred to something which I said in this House on a former occasion. He quoted from a speech delivered in 1907, to charge me with inconsistency. To understand the position, it must be remembered that my remarks were made in consequence of something said by the honourable member for Flinders who, in estimating what the revenue from Customs duties would be a few years ahead, referred to the States' debts. He saidWhat we might fairly say is that the lower limit bf the amount which we ought to hand back to the States is that which, to my mind, is impliedly prescribed by the Constitution. I refer to what is, I think, the basis of the constitional proposals, and that is that we should burden ourselves with the whole of the interest of the States' debts as existing at the time of the establishment of the Commonwealth. I believe that to have been in the minds of most of those who framed our Constitution",14
6,Mr SPEAKER ,The honourable member is now dealing with the speech of another honourable member which is not in question. I ask him to confine himself to a personal explanation of such remarks of his as he considers to have been misrepresented.,14
7,Mr WISE ,I cannot do so without referring to the speech of the honourable member for Flinders.,15
8,Mr SPEAKER ,"The honourable member may refer to it incidentally, but may not quote from it at length. Were such quotations allowed, it would be possible, under cover of a personal explanation, to read the whole of the speech made by another honourable member.",15
9,Mr WISE ,"The report of the speech of the honourable member for Flinders covers several pages of Hansard, and I wish to read only about twenty lines of it. If I cannot do so now, I shall certainly take an opportunity to deal with the matter fully on the second reading of the Bill; but to clear myself now of the charge of Inconsistency let me say that the honourable member for Flinders had stated that the idea in the minds of the members of the Convention .was that the Commonwealth, in taking over the Customs and - Excise revenue, should take with it the sponsibility for the debts, and the interest on them, at the time of federating. He pointed out that, in his opinion, the revenue from Customs and Excise in two or three years' time would be £9,000,000, of which three-fourith's would be about £6,750,000. As that would not be sufficient to pay interest on their debts, he proposed to give them another £500,000, or, in all, about £7,250,000. I said that I agreed with that proposal, but, since then we have relieved the States of expenditure on old-age pensions amounting to £1,500,000, which brings the amount down to less than £6,000,000. When speaking the other evening, I said that I had no objection to the proposal on the score of the amount that it was proposed to pay to the States, but that I was in favour of the Lyne-Deakin scheme, which was based on the Harper scheme, under which the States would have received, to 1 begin with, £6,000,000. The honourable member for Mernda originally proposed to give them £6,500,000 a year. ""Under the scheme now before us they would get about £5,500,000 a year. In reply to an interjection, I said the other evening that 1 was in favour of the scheme which the honourable member for Mernda outlined in his speech on the Constitution Alteration (Finance) Bill. He proposed that the States should receive 25s. per capita until their population had increased to 7,200,000, and the payments to £9,000,000, the amount of the interest on the State debts, as they exist at the present day. I found no fault with the proposal to pay, £5,500,000 to the States, and was, indeed, prepared to commence vvith a payment of £6,000,000 under the Lyne-Deakin scheme. The honourable member for Mernda showed that the payments under his scheme would increase to £9,000,000 in about the same length of time as they would increase to that sum under the Lyne-Deakin scheme-betwee n thirty and thirty-five years. There was no inconsistency between my speech of 1907 and that of the other evening.",15
10,Mr HEDGES ,Fremantle) [10.42] By way of personal explanation,15
11,Mr SPEAKER ,"I hope that honourable members do not intend to, each day,, redeliver speeches vvhich they have recently made. The right of personal explanation is always afforded to honourable members who have been misrepresented, but May points out clearly that such explanations reare against the forms and rules of the House, and an indulgence which should be only used on very important occasions. 1 hope that honourable members will not feel it incumbent on them, when a personal explanation has been made, and their names, perhaps only incidentally, mentioned, to make explanations on their own account. If the honourable member desires to explain something vvhich he has said, and which has been misrepresented, I shall allow him to proceed, but I hope that this will not continue very much further.",15
12,Mr HEDGES ,"I wish to explain something which has been misrepresented. What I said last night has been misunderstood. The honourable member for Gippsland misunderstood the point which 1 took. It was contained in the quotation of these wordsSuch an amount represents about ^500,000 in excess of the three-fourths of the present Customs revenue. POSTMASTER-GENERAL'S DEPARTMENT. OVERSEA MAIL CONTRACT : STAY OF VESSELS IN PORT-MORE E POST OFFICE-CHARG E AGAINST A POSTAL ASSISTANT.",15
13,Mr FRAZER ,"In regard to the suggested alteration of ' the time-table for the oversea mails, I wish to ask the Postmaster-General if , during the currency of the present contract with the Orient Steam Navigation Company, "" complaint has been lodged with the Department that the time allowed under it for the stay of their steamers at Port Melbourne is insufficient to enable the necessary loading to take place?",15
14,Sir JOHN QUICK ,"I am not aware of any such complaint having been made. Under the new contract the cool storage accommodation provided on the vessels of the company will be increased to 2,000 tons. The taking in of cargo to fill that largely increased space will, it is said, require additional time, and the vessels of the company will not be able to load in time to leave Adelaide as hitherto on Thursday. The company is therefore strongly urging the adoption of the new time-table, which will enable its vessels to leave Adelaide on Friday.",16
15,Mr FRAZER ,"I wish to ask the Postmaster-General whether the cool storage space now provided on the Moldavia, the Morea, and two or three other new steamers of the Peninsular and Oriental Steam Navigation Company is equal to that which has to be provided on the new vessels of the Orient Steam Navigation Company's vice. If it is, will the honourable gentleman say whether a complaint has been made that the time allowed at present to fill that space at Port Melbourne is insufficient ?",16
16,Sir JOHN QUICK ,"I am not aware of the exact extent of the cool storage accommodation provided at present on the vessels of the Peninsular and Oriental Steam Navigation Company, but there is a material difference between the two. Another point which must not be overlooked is that the vessels of the Peninsular and Oriental Steam Navigation Company terminate their voyage at Sydney, whereas the Orient Company's vessels have to go on to Brisbane, and they cannot go there and back, and take in cargo at Port Melbourne, in the same time as do the vessels on the other line whose terminal port is Port Jackson.",16
17,Mr THOMAS BROWN ,"I desire to ask the Postmaster-General whether his attention has been drawn to the following telegram, appearing in this morning's issue of the Age, under the headings "" Alleged Embezzlement "" ; ""Postal official charged."" "" An overworked staff."" At the Moree Quarter Sessions today Stanley George Weber, assistant at the local post-office, was charged with stealing £ S , the property of the Commissioners of the Government Savings Bank. Accused pleaded not guilty. . . . The Crown Prosecutor described the condition of affairs at the Moree post-office at that time as chaotic and disgraceful. Further evidence showed that complaints were frequent about thai time of the Moree post-office being undermanned and the staff overworked. The business was very heavy, and large sums of money passed through the hands of youths like defendant. In a written statement defendant attributed his failure to hand over the £ 8 to the rush of work at the counter, and the non-entry of the amount in the office book owing to the latter having been mislaid. Acting Judge Dawson commented in strong terms on the Postal Department summoning defendant some time after the missing money had been handed in by the defendant. There was, he said, considerable doubt in the case, and therefore the jury could not convict. The jury acquitted defendant. Is the Postmaster-General aware that the chaotic condition of affairs referred to is not peculiar to the Moree post-office, but obtains generally throughout the States, and will he take steps to remove, as speedily as possible, the cause of complaint as to the undermanning of the Department? Further, will he inquire into this case and ascertain why the prosecution was instituted in the circumstances to which the learnea ser- Judge referred?",16
18,Sir JOHN QUICK ,"I gave no authority for the prosecution, which must, therefore, have been instituted by the Deputy Postmaster-General of New South Wales, acting on legal advice. Under his delegated power, he has a certaindiscretion .",16
19,Sir JOHN FORREST ,This was a prosecution in connection with Savings Bank work.,16
20,Sir JOHN QUICK ,The Moree post office transacts business in connection with the Savings Bank.,16
21,Mr THOMAS BROWN ,That is so.,16
22,Sir JOHN QUICK ,"There has been some slight disorganization in the Moree post-office. The matter has been brought before me, and I have on two or three occasions directed the attention of the Deputy Postmaster-General of New South Wales to it. He reported that the disorganization arose from the frequent changes made .in the office, and he promised to rectify the matters complained of. No doubt, in times past, there has been ground for complaint of undermanning in connection with many post-offices, but I need scarcely remind the honourable member that, in the Estimates now before the House, provision is made for an increase of over 600 hands in the staff of the Department in New South Wales. It is believed that when those additional hands are employed many of the complaints about overwork and overtime will be removed. . DISORDERLY QUESTIONS. ABSENCE OF THE OPPOSITION.",16
23,Dr WILSON ,"I have noticed, with great pain, Mr Speaker, that during the last few . mornings honourable members usually occupying the direct Opposition benches have been absent when the House has met, and I wish to ask .whether you have received any information from them that they object to the prayers.",17
24,Mr FRAZER ,If we drew attention to every absence on the part of the honourable member at the opening of the House the record would be a pretty long one.,17
25,Dr LIDDELL ,"In all sincerity, Mr. Speaker, and with a full sense of the responsibility of my position, I desire to ask whether you can inform the House what has become of our dear friend and comrade, and ex-Leader of the Opposition, the honourable member for South Sydney'.",17
26,Mr SPEAKER ,"I think that I ought to be able to rely upon honourable members to put to the Chair only such questions as relate to matters with which the Chair is concerned. I may say, in passing, that the Chair is not supposed to answer questions. I sincerely hope that I shall not have to remind honourable members again that it is unbecoming to put to the Chair questions of the character of those which have just been addressed to me. Questions of a similar character have previously been allowed'by the Chair to pass without comment, but they ought not to be made.",17
27,Mr MCDONALD ,"I wish to ask your ruling, Mr Speaker, on a point of order in regard to the two questions to which you have just, very properly, taken exception. Is an honourable member in order in rising, under pretence of asking a question, and deliberately offering an insult either to an honourable member or to a party in this House? If such a practice is to be continued by honourable members opposite, the Opposition will have to retaliate.",17
28,Mr SPEAKER ,"I think that the honourable member will admit that I have already dealt with the two questions in the only way in which they could be dealt with. It is impossible for the Chair to know the nature of the question that an honourable member is going to put, but the growth of the practice of asking questions without notice is very largely responsible for what has just taken place. In the Parliament with which I was previously connected, questions without notice were not asked without the permission of the Chair, previously obtained, and with' the permission of the Minister who was to be interrogated. But for the practice which has grown up in this House we should haye been spared questions of the kind to which attention has just been directed, and which, I think, are disorderly and of an objectionable character.",17
29,Mr THOMAS BROWN ,I desire to ask Mr Speaker whether the insulting questions addressed to you - questions which you have described as disorderly- in regard to honourable members on this side of the House,17
30,Mr SPEAKER ,"If the honourable member will permit me, I think that I have dealt with the matter in a way which will prevent its recurrence, and that no good can be obtained by putting further questions, which must tend only to embarrass the Chair.",17
31,Mr THOMAS BROWN ,"I wish to ask, sir, whether the questions addressed to you in respect to the Opposition, and which you have held to be disorderly, are to appear in Hansard ? They seem to have been asked solely with the object of securing their publication in Hansard.",17
32,Mr SPEAKER ,"That is a matter which I shall have to consider. HOURS OF SITTING. NA tance of the discussion of the nnancial relations of the Commonwealth and States which is now taking place in this House, will the Prime Minister consider the advisableness of inviting honourable members to sit on Friday evenings?",17
33,Mr DEAKIN ,"Any proposition for the extension of the hours of sitting during this session will be warmly welcomed by the Government, and I hope the honourable member will be able to add other representations to his own in order that we may take the earliest advantage of the suggestion.",17
34,Mr BATCHELOR ,"In considering the suggestion just made by the honourable member for Echuca, will the Prime Minister have regard to an alternative proposal, which would suit the convenience of a much larger proportion of honourable members, following papers :namely, that we should meet on Wednesday and Thursday mornings?",17
35,Mr DEAKIN ,"An extension of the hours of sitting can be made only by imposing increased difficulties and responsibility on certain honourable members. At an early date, however, it will be necessary to have morning sittings, but I hope, with the assistance of the House, to avoid going further. If it be necessary to sit later as well as earlier, we must do so. PUBLIC SERVICE : MINIMUM WAGE.",18
36,Mr TUDOR ,"Recently a return was prepared to the order of the House, on a motion submitted by myself, showing the number of adults in the Public Service of the Commonwealth receiving less than the minimum wage. Will the Minister of Home Affairs make an effort to have the return prepared in a more intelligible form than that in which it has been submitted?",18
37,Mr FULLER ,"The honourable member having called my attention to the nature of the return, I caused it to be sent back to the Public Service Commissioner, with a request that a further investigation be made with a view to setting out more clearly the information sought by the honourable member. FEDERAL CAPITAL SITE.",18
38,Mr HENRY WILLIS ,"Has the atten. tion of the Minister of Home Affairs been called to a paragraph in this morning's newspapers stating that the Premier of New South Wales, in the Legislative Assembly, yesterday took certain action in regard to the Federal Capital site? Has the honourable gentleman any information on the subject to convey to the House, and will he state when the next step will be taken by the Commonwealth Government to secure finality in the selection and location of the site of the Capital?",18
39,Mr FULLER ,"I have read the paragraph in question, and can only say that the Government are extremely anxious that this important matter shall be dealt with with as little delay as possible. I have every hope that a measure relating to it will be submitted to the Senate next week. PAPERS. MINISTERS laid upon the table the PapuaOrdinances of 1909No. 23-Appropriatio n 1909-10. No. 24 - Supplementar y Appropriation 1909-10, No. 1. Census and Statistics ActOfficial Bulletins Population and Vital StatisticsNo. 15-Quarte r ended 31st March, igoq. Trade, Shipping, Oversea Migration and FinanceNo. 30-June , 1909. No. 31-July , 1909. CONSTITUTION ALTERATION (FINANCE) BILL. Debate resumed from 30th September (vide page 4008), on motion by Mr. DEAKINThat leave be given to bring in a Bill for an Act to alter the provisions of the Constitution relating to finance.",18
40,Mr COON ,"Batman) [11.2] - I do not think I should be ashamed to confess that I rise with some diffidence to address myself to this question. The fact that I have been preceded by the Prime Minister, the Treasurer, the honourable member for Flinders, the honourable member for Mernda, the honourable member for North Sydney, the honourable member for Kennedy, the honourable member for Wide Bay, and last, but not least, the honourable member for Darwin, makes my task all the more difficult, and here I might add that I regret that I have not yet had the pleasure of being able to read the honourable member for Darwin's speech. I wish to say at the outset that I intend to put my own case in my own way, and from a layman's point of view. The honourable member for Wakefield, a new member of the House, delivered from this bench the other night a speech in which there was a lot of force and energy, and by which he made out a splendid case for a land tax. He said that our great necessity was land settlement, that people were flocking from the country to the cities, and that if this agreement were carried out it would be the means of settling people upon the land, of constructing more railways, and of ridding us of the unemployed difficulty. In this connection it seems strange to reflect that in Victoria a few nights ago a candidate for a vacant seat in the State Parliament said that he was opposed to the land tax proposed in this State, and that an easier way of getting the money was for the State to settle the people on the land and collect £ i 5s. per head from the Commonwealth. The honourable member for Wakefield also drew attention to the question of closer settlement. He asserted that what Australia wanted was more people in the country districts, and that the cry should be, "" From the cities to the lands."" He told us that about 36 per cent, of the population of Australia lived in the crowded cities. The figures for the various States are as follow :-Sydney , 36 per cent, of the population of New South Wales; Melbourne, 43 per cent of the population of Victoria; Brisbane, 25 ptr cent, of the population of Queensland : Adelaide, 45 per cent, of the population of South Australia-the State from which the honourable member comes; Perth, 19 per cent, of the population of Western Australia; and Hobart, 21 per cent, of the population of Tasmania.",18
41,Mr THOMAS BROWN ,"""He made out a good case on those figures.",19
42,Mr COON ,"Undoubtedl y he made out a good case in favour of getting the peonle on to the land, and I quite agree with him. In Victoria there are 120 families which own between them 6,000,000 acres, and a short time ago, when the Victorian Government were desirous of purchasing land for closer settlement, one estate was offered to them for £1,000,000, although it was rated at only £50,000. The only way to settle the people upon the land is to impose a stiff land tax, and the only authority that can impose such a tax for the purpose of land settlement 5s the Commonwealth Parliament. The State Parliaments have utterly failed to do so. Mr Watt, the Treasurer of Victoria, in introducing his Land Tax Bill recently, said that the purpose of the tax was not altogether to promote closer ment, .but to produce revenue. While it is a very good thing to impose taxation in order to obtain revenue from the land, I believe that a land tax should be so imposed as to become the means of bursting up large estates. The figures for Victoria according to Mr Watt, are as follow: There are on the land-tax register 405 estates, each over £20,000 in capital value, with a total value of £24,707,448, and a taxable value of £5,748.213. Included in those are 170 estates, each of over £50,000 capital value, with an average value of £105,021, a total value of £ 7)853,675, and a taxable value of I £4,337,413. Included in these are forty-five estates each, over £100,000 in capital value, with an average value of £158,899, and a total value of £7,153,444. The total area of those forty-five holdings is 1,296,538 acres, and the average area is 28,812 acres. One man owns 81,348 acres, another 55,448 acres, and a third52,655 acres. Those estates are devoted almost exclusively to grazing, and have little or no tillage upon them. Those are statements made by the Treasurer of Victoria when introducing his Land Tax Bill- a measure which he will have very little opportunity of carrying if all the members of the State Parliament are of the same way of thinking as the candidate to whom I referred as being against the proposed land tax, and in favour of getting the Commonwealth to make up the State revenue by a per capita contribution of 25s. per annum.",19
43,Mr JOHN THOMSON ,Is the honourable member in favour of an improved or unimproved land value tax?,19
44,Mr COON ,Unimproved .,19
45,Mr JOHN THOMSON ,The figures quoted represent improved values.,19
