speakerGroups,Speaker,text,pageNumbers
46,Mr COON ,"I am not sure upon that point, but I want to make it clear that I favour taxing the land and settling the people upon it. Where one man owns at present 80,000 acres, I would impose a tax sufficiently stiff to settle a few hundred people on such an area, which at present supports, perhaps, ten or a - dozen. That is the sort of taxation that I favour. While we have an area of something like 2,978,000 square miles, the great trouble is that the people cannot get upon the land. The only way to get them upon it is to make the owners use it, or allow some one else to use it for them. Here is a case in point: At Terang, a few miles settlefrom Melbourne, there is some of the richest land in Victoria, but this is the condition of affairs found to exist there by a gentleman who went there recently for the purpose of erecting a churchThe people down there had not much accommodation. If they needed five rooms they generally put up two. He would never forget a ride he had. They had first to cross the creek, and then climb a hillside, slipping every step or so,, for it was raining heavily; then they had tozig-zag down the other side. It took an hour and forty minutes to go those four miles. Whenthey reached Chapel Creek he found how the members of the farmer's family he was to stav with came. The ""bush buggy"" was there; they could not bring it across the creek. On week days it was used to take cream to the nearest factory. It was a sledge, and on it was lashed a kerosene case; and on the kerosene case sat the farmer's wife. A big draught-horse was drawing the sledge, a boy was driving it, and the daughter was walking ahead, carrying a - candle in a bottle to show the way. He, on horseback, followed them all. One of the first things that the States have to do is to impose a stiff land they do not do it I think this Parliament will do it for them. I believe - of every party in this House has declared in favour of a land tax. The right orable member for East Sydney has done so.",19
47,Mr JOHN THOMSON ,When did so?,20
48,Mr COON ,"Mr Watt, in introducing his Land Tax Bill in the State Parliament - recently, stated that the right honourable member for East Sydney had declared if the States would not do their duty in direction the Federal Parliament would. He also said that the present Prime Ministhe ter and the honourable member for Wide Bay had declared for a land tax, and asked whether the State Parliament was going to do its duty, or leave the matter to the Commonwealth.",20
49,Mr MCWILLIAMS ,"That was a very good "" whip "" !",20
50,Mr COON ,"Whether it was a ""whip - or not, the day is coming when the States will see the necessity for a land tax, we shall be placed in the proud position - of imposing one.",20
51,Mr JOHN THOMSON ,We shall have job to do it !,20
52,Mr COON ,"I do not think so; I berun lieve that at the next general election people will declare for a land tax, they will tolerate no longer conditions under which land is unobtainable, and there are no less than 1,200 applicants for - eighty vacant blocks. The honourable member for Wakefield told us the General - other night that crowds of men are applying for positions in the Victorian railway service, and that many of them .are from the country districts. We told that farmers' sons are leaving - land, and it is clearly the duty of State, and also the Commonwealth, to that people are afforded facilities for settlement under satisfactory conditions.",20
53,Mr ATKINSON ,"Will a land tax result ""in settlement?",20
54,Mr COON ,A land tax will give - people the opportunity which they do now possess of going on the land.,20
55,Mr ATKINSON ,I thought the honourable member said that the people were leaving the land?,20
56,Mr COON ,"That is because sufficient land is not available. The fact that 120 families own 6,000,000 acres in Victoria, shows what chance there is for an ordinary tax, and if person to obtain a block.",20
57,Mr ATKINSON ,It all depends on the every leader quality of the land.,20
58,Mr COON ,"I am speaking of some of hon the best lands. The States have parted with about 123,000,000 acres of Crown lands, for which they have received an he do average price of £ 1 per acre.",20
59,Mr JOHN THOMSON ,Where does the honourable member get his figures?,20
60,Mr COON ,"They are the figures used by the Treasurer of Victoria when he in that troduced his land tax proposals. When that Federation was inaugurated, we were told that there would be a great reduction in expenditure of the States, and in the membership of the State Parliaments. As a matter of fact, the Commonwealth, with a population of 4,275,000, and 2,109,562 electors, has 633 members of Parliament. There is a member of Parliament for every 6,000 people, a Minister of the Crown for every 73,000, and a representative of the King for every 579,000. The Governors "" of Australia cost £59,000 annually; and I quote these figures simply because the _ or people voted for Federation on the understanding that the expenditure would be reduced. The Agents-General cost £24,000 a per annum, and I suppose that the appointment of the High Commissioner will that amount up to £40,000 or £50,000, the though it was clearly understood that the because High Commissioner would act for the whole of the States. For the present state of affairs the Commonwealth Parliament cannot be blamed, seeing that we have not the power to dispense with the Agentsof the States; and, under the cir cumstances, I am justified in urging that the States have not reduced their - expenditure to the extent anticipated. I are am one who believes that the railways the should be controlled by the Commonthe wealth. A lengthy debate took place see on this question at the Adelaide Federal Convention, and a number of the speakers took the same view. If we are to develop Australia in the way it should be developed, this Parliament must have control the of the railways, the lands, the mines, not and education. A Select Committee of the State Parliament of Victoria some years ago recommended that a Federal Parliament, when it came into existence, should have jurisdiction over the land, the railways, and the mines; and certainly, if we are to control our trade, and make our own goods, it is absolutely necessary to have our people technically educated. In the city of Melbourne there are between 33,000 and 36,000 boys and girls from fourteen to eighteen years of age, and of that number only 900 are receiving any technical education. We can prosper only by having efficient workmen, and, to that end, our young people should be thoroughly trained; and I venture to say that in this connection the States are not doing their duty. It has been stated by more than one honourable member that this is not a fiscal question-no t a question of Protection or Free Trade. The honourable member for North Sydney said that we could increase our Tariff, or maintain the present Tariff of £ 2 ios. per head, without in any way interfering with its protective incidence; but I have the temerity to disagree with that view. If the revenue is to decrease, it must the on the side of the cent., £29,000; matches, protective duties, for we can raise additional monev through the Customs only by revenue duties, which f all on the masses. At the present time it is clear that the importer is paying the duty, as is shown by the fact that when, for a short time, there was a duty on wire netting, and a revenue of £18,000 was received by the Commonwealth, the price of the commodity was reduced. Who paid the duty? The importer, undoubtedly.",20
61,Mr BAMFORD ,Does the honourable member not think that the consumer paid the duty ?,21
62,Mr COON ,"The honourable member for Echuca challenged the statement. I have made, though I do not quite know on what grounds; but I am certain of the fact that, while the duty was in operation, the price of wire netting was reduced for the purpose of trying to crush out competition in New South Wales. NA wire netting paid more for the commodity.",21
63,Mr COON ,"They may have had to pay more for some wire netting, but the price in New South Wales was reduced while the duty was in operation. revenue from Customs and Excise in 1908-9 was £10,843,900, or £ 2 8s. 6d. per head; and we have to ask ourselves where that revenue came from? Did it come from the revenue duties, or from the protective duties?",21
64,Mr MCDONALD ,The revenue duties.,21
65,Mr COON ,"Did it? Ready-made clothing with a duty of 35 per cent which ,is clearly not a revenue dutyproduced £447,000. This clothing is made in the sweating dens of London, where women work from morning to night under conditions which the House of Commons has said should not be permitted to continue, and to cope with which the House of Lords has approved of Wages Boards on the lines of those instituted at the instance of the present Prime Minister, when in the State Parliament of Victoria. Furniture, with a duty of 35 per cent., produced £57,000; boots and shoes produced £60,000; hats and caps, £112,000; stationery, with a duty of 25 per cent., £60,000; metals and machinery, at 25 per cent., £140,000; glassware, at 10 per cent., £96,000; bolts and nuts, at 20 per cent., £90,000; cement, at is. a cwt., £60,000; twine, at 25 per cent., £ 5 > ° ; motive machinery, at 20 per 2 0 0 £97,000; pianos, £72,000; mining machinery, at 20 per cent., £20,000; electrical machinery, at 20 per cent., £22,000; earthenware, at 25 per cent., £37,000; and confectionery, at 2jd. per lb., £50,000; making a total of £2,564,640.",21
66,Mr MCDONALD ,The revenue from the articles just named will decrease as the import duties become more effective.,21
67,Mr COON ,"I shall endeavour to show that it will disappear. To summarize the figures which I have just given, one line, on which the duty is 35 per cent, and 30 per cent., returns £447,800; five, at 30 per cent., return £165,000; ten, at 25 per cent., return £398,000; twelve, at 20 per cent., return £505,000; one, at 17J per cent., returns £72,000; one, it 15 per cent., returns £25,000; one, at 12J per cent., returns £22,000; and two, at 10 per cent, return £119,000. From miscellaneous duties we get £810,198, making a grand total of £2,564,640. Ready-made clothing is dutiable at 35 per cent, and 30 per cent. In the Old Country some of the women employed in making such clothing receive only 6s. a - week; girls are paid only The 2s. 6d. a dozen for making night-dresses, and fined 2s. each for damaging them. For making blouses they are paid 8d. per dozen, and have to pay 4s. 6d. for any garment that may be damaged. It is the importation of clothing made under such conditions that is swelling our Customs revenue. I do not think that honourable members desire that women and girls shall be sweated in order that our Customs returns may be high. From the duty on pianos we have received from £72,000 to £74,000 per annum, but since the imposition of the duty a factory has been established in Victoria. If 30 per cent, is not a sufficiently high rate to keep out imported pianos, we should do as they do in Japan-increas e it to 60 per cent.",21
68,Mr DUGALD THOMSON ,It would be better to declare that pianos shall not be imported.,22
69,Mr COON ,"I should be prepared to prohibit the importation of pianos while we have men walking about looking for employment. Those who require pianos should buy the Australian article. Why should our people, by purchasing imported goods, send money out of the country? From the duties on iron and steel we receive ,£72,000 a year, notwithstanding that we grant bounties for the production of iron and steel. If the importation is to continue, the bounty will be wasted. It will be useless under such circumstances to spend £150,000 in trying to encourage the industry. We have also offered a bounty for tops, to encourage wool-combing for export, and bounties to encourage other industries. A ll the goods from which the revenue to which. I have just referred is now obtained will, within ten years, be made within the Commonwealth. In justification for that statement, I would mention the fact that Mr Jeffery, whom the Board of Trade sent to Australia in 1905 to inquire why Great Britain was losing business here, reported that we should never be able to manufacture our own matches, because rates of wages here were too high, and hours of labour too short.",22
70,Mr DUGALD THOMSON ,There was a match factory here at the time.,22
71,Mr COON ,"It was not in a satisfactory condition, and we were still importing matches, because the duty was not sufficient to keep out foreign-made matches. present we are obtaining £97,000 a year from the duty on matches. But an up-todate factory has recently been erected, at a cost of £14,000, and it is expected that the matches made there will compete successfully again&t the imported article. Now, in the Old Country, women get 2^d. a gross for making match-boxes in their own homes, and, working ten or twelve hours a day, they earn 3s. or 4s. a week. If we can shut out the production of such cheap labour, surely we can successfully manufacture our own clothing, confectionery, twine, glassware and earthenware. The proposal to pay 25s. per capita is based on the assumption that the Tariff will continue to produce £ 2 8s. 6d. per head. But if the revenue from the articles which I have mentioned is deducted from the total returns, the yield per head will be reduced to £ 1 19s. 8d. A Commission appointed by Mr Justice Isaacs, when Acting Premier of Victoria, reported that a Protective Tariff might be expected to yield about £ 2 per head, which is practically the same figure. During the last seven years, the return from the Commonwealth Tariff .has been about £ 1 16s. 3d. per head. If , in the future, it amounts to £ 1 19s. 8d. per head, and the States receive £ 1 5s. of that, 14s. 8d. will be left for Commonwealth expenditure, or 2s. per head more than we get now. But the Commonwealth liabilities will greatly increase. Therefore, although I do not say that the proposed arrangement would make it impossible to continue a Protective Tariff, I say that that would be its tendency, should it be made permanent. If our Tariff gives the same amount of Protection as is given by the Tariffs of the United States and Japan, we shall lose at least £2,564,640 of revenue which we now levy by means of import duties. The money will have to be found in some ether way. Of the 450 items in the Tariff only 200 are at present producing revenue. There are 250 items on the free list, and more than one statesman and writer has urged that it is impossible, with such a large free list, for the present Customs and Excise revenue of the Commonwealth, to be maintained. There are 750 items in the Canadian Tariff, of which only 232 are on the free list. Under the Commonwealth Tariff we impose on boots and shoes duties ranging up to 30 per cent. Japan, on the other hand, imposes duties on boots and shoes, shirts, and musical instruments, ranging as high as 40 per cent., and on umAt brellas duties as high as 50 per cent. The average of our Tariff, so far as the Protective itemsare concerned, is about 30 per cent., as against 33 per cent, in the case of New Zealand and 44 per cent, in the case of the United States. How can Australia, with a population of 4,275,000, compete with a nation with a population of 90,000,000, which possesses a Tariff averaging 14 per cent, higher than her own The Commonwealth Tariff must be inimmigration. creased if we are to retain our present tion. The fact that we are able in respect of certain items bearing duties of 35 per cent., to collect a revenue of £ 4 7 5 , should satisfy honourable members either that the Protection granted is not high enough or that the local industries to they relate have not yet been sufficiently established. I come now to the question preferential trade. In connection with the visit to Australia of representatives Chambers of Commerce from the Old wealth, Country, a number of importers, in Sydney, were interviewed with reference to the 5 labourers. per cent, preferential duty in favour Great Britain, and the general consensus opinion was that it was too low. It was urged that a preference of 10 per cent., and in some cases of 20 per cent, was necesin sary. As scon as we granted a preference of 5 per cent, on British goods, German manufacturers made a corresponding reducrespect tion in the prices of their manufactures Australian buyers, and in that way the mayoral term. preference granted to the Old Country been nullified. I maintain that we are in a position at present to reduce our duties in order to increase the preference granted to Great Britain.",22
72,Mr MAUGER ,VV e could increase the preference by raising the duties against foreign imports.,23
73,Mr COON ,"I agree with the honourable member that that could be done, but as showing that we have already granted a substantial preference to Great Britain, would point out that if the duties collected on imports from the Old Country last year had been the same as those collected on ports from foreign countries, an additional sum of £740,000 would have been raised. In other words, the preference granted to British imports amounted last year to £740,000. If , at the next general election there is returned to this Parliament, jority in favour of granting an increased ference to British goods, there will be a ther reduction in our Customs revenue, and, taking into consideration what may happen in the future I do not think we should be justified in tying up the Commonwealth for all time to this agreement. If a majority were returned at the next general election in favour of extending a greater prefergreat ence to imports from Great Britain, the sult would be, under this agreement, an crease of taxation paid by those least able for all time to bear it. In dealing vvith this ? must also have regard to the question of During the last six years, posi1,232,000 persons have entered Canada, and when the Prime Minister was in England, he strongly advocated not only pre0 0 0 ferential trade, but the settlement of our empty spaces by British immigrants. Under this agreement we should have to pay to the which States, 25s. in respect of every new arrival, and we should also have to of make that payment in respect of the natural increase in population. Last year of there were 111,545 births in the Commonand it is interesting to note that the fathers of 17,046 of these were Under this agreement everyof one of those children of labourers w&uld of have to bear taxation through the Customs to the extent of £ 1 5s. per head. I have heard of countries where a bonus is granted respect of every increase in a man's family. I have heard of the mayor of a city who decided to give a bonus of £ 1 in of every child, twelve months of to age, brought before him at the end of his",23
74,Mr DUGALD THOMSON ,"The honourable not member does not mean that we shall have to pay to the States 25s. in respect of everyone of the children born. He must deduct the deaths from the births. Mi;.. COON - My point is that we should have to pay that amount in respect of every child that survived. It is a disgrace to the Commonwealth that, according to an undoubted authority, every year 3,000 infants, whose lives could be saved, I die before reaching the age of twelve months. That statement was made by Dr Dunbar Hooper, who represented the Comimmonwealth at the recent convention held in Brussels. He declared that 8,000 children under the age of twelve months die annually in the Commonwealth, and that of that number the lives of 3,000 could be saved. Last year, as I have said, 111,545 children a mawere born in the Commonwealth. The preparents of 32,000 were engaged in the pasfurtoral and mining industry; the fathers of 40,000 belonging to the labouring and industrial classes, and only 140 were of independent means. Whilst I believe that the States should be treated with some consideration, I am not in favour of this agreement being fixed for all time. I am confident that the masses of the people do not believe rein it, and will not endorse it. If we are into put this provision in the Constitution",23
75,Mr MAUGER ,We cannot.,23
76,Mr COON ,"We cannot, but if we say that, while making it ostensibly a permanent provision, we expect the people to afterwards remove it, we shall be asking the people to do something that we do not believe in. We should not take any such course. If I thought that this was a good provision, and should be retained in the Constitution, it would be my duty to vote to make it binding for all time, and to ask the people who sent me here, and whose suffrages I should be seeking in the future, to vote for me because I was in favour of it for all time. But I ' have no right to disfranchise the people I represent by casting in this House a yote which I do not believe in, and* which I do not think they believe in. That being so, while I am prepared to give the States every consideration, I cannot forget that the people who return the members of the State Parliaments, and the people who return the members of this Parliament, are one and the same. It is for them to say that, where the States have been extravagant in the past, that extravagance must cease. If they decide that there must be one member of Parliament for every 6,000 inhabitants, a Minister of the Crown for every 73,000, and a Governor for every 500,000, that is their business. Speaking as a member of this Parliament, I hold that the States should do their duty, and, if they do, I venture to say that the Commonwealth Parliament will also do its duty. If the States and the Commonwealth work hand in hand, as they should, I believe there is a great future for Australia. While that is so, we must safeguard, at all hazards, the 257,000 persons who are engaged in our manufacturing industries. While the States have the control of the lands, it is their duty to promote land settlement, and if they fail in that direction, it will be the duty of this Parliament to undertake it. venture to say that we have dpne our share in finding employment for the people .of the Commonwealth in the factories and workshops throughout Australia. As we have done our part, I trust that the States will do theirs, by seeing that the vast areas of Australia are filled with men and women able and willing to work, because such a policy must be in the interests of the whole of the people of the Commonwealth. Mr .FOWLER (Perth) [12.4] - I think T may congratulate the House on the high tone, as a whole, of the debate which has taken place upon this important question. Some of the speeches might with advantage have been considerably curtailed, but nevertheless I have been very pleased to sit here during the days upon which the debate has proceeded, and have been unable to refrain from contrasting favourably the House and its attitude towards this large public question, with what transpired too frequently during the previous part of this session.",24
77,Mr WILKS ,A reminiscence of the early days of Federation.,24
