Speaker,Text,pageNumbers
NA,heard of countries where a bonus is granted,23
NA,respect of every increase in a man's,23
NA,family. I have heard of the mayor of a,23
NA,city who decided to give a bonus of £ 1 in,23
NA,"of every child, twelve months of",23
NA,"to age, brought before him at the end of his",23
Mr DUGALD THOMSON ,Th e honorable,23
NA,not member does not mean that we shall have,23
NA,to pay to the States 25s. in respect of every-,23
NA,one of the children born. He must deduct,23
NA,the deaths from the births.,23
NA,Mi;.. COON -M y point is that we,23
NA,should have to pay that amount in respect,23
NA,of every child that survived. I t is a dis-,23
NA,"grace to the Commonwealth that, accord-",23
NA,"ing to an undoubted authority, every year",23
NA,"3,000 infants, whose lives could be saved,",23
NA,I die before reaching the age of twelve,23
NA,months. That statement was made by Dr,23
NA,"Dunbar Hooper, who represented the Com-",23
NA,immonwealth at the recent convention held in,23
NA,"Brussels. He declared that 8,000 children",23
NA,under the age of twelve months die annu-,23
NA,"ally in the Commonwealth, and that of that",23
NA,"number the lives of 3,000 could be saved.",23
NA,"Last year, as I have said, 111,545 children",23
NA,a mawere born in the Commonwealth. The,23
NA,"preparents of 32,000 were engaged in the pas-",23
NA,furtoral and mining industry; the fathers of,23
NA,"40,000 belonging to the labouring and indus-",23
NA,"trial classes, and only 140 were of indepen-",23
NA,dent means. Whilst I believe that the States,23
NA,"should be treated with some consideration,",23
NA,I am not in favour of this agreement being,23
NA,fixed for all time. I am confident that the,23
NA,masses of the people do not believe,23
NA,"rein it, and will not indorse it. I f we are",23
NA,into put this provision in the Constitution,23
Mr MAUGER ,W e cannot.,23
Mr COON ,"W e cannot, but i f we say",24
NA,"that, while making it ostensibly a per-",24
NA,"manent provision, we expect the people to",24
NA,"afterwards remove it, we shall be asking",24
NA,the people to do something that we do not,24
NA,believe in. We should not take any such,24
NA,course. I f I thought that this was a,24
NA,"good provision, and should be retained in",24
NA,"the Constitution, it would be my duty to",24
NA,"vote to make it binding for all time, and",24
NA,"to ask the people who sent me here, and",24
NA,whose suffrages I should be seeking in the,24
NA,"future, to vote for me because I was in",24
NA,favour of it for all time. But I ' have no,24
NA,right to disfranchise the people I represent,24
NA,by casting in this House a yote which I,24
NA,"do not believe in, and* which I do not",24
NA,"think they believe in. That being so,",24
NA,while I am prepared to give the States,24
NA,"every consideration, I cannot forget that",24
NA,the people who return the members of the,24
NA,"State Parliaments, and the people who re-",24
NA,"turn the members of this Parliament, are",24
NA,one and the same. I t is for them to say,24
NA,"that, where the States have been extra-",24
NA,"vagant in the past, that extravagance must",24
NA,cease. I f they decide that there must,24
NA,be one member of Parliament for every,24
NA,"6,000 inhabitants, a Minister of the Crown",24
NA,"for every 73,000, and a Governor for",24
NA,"every 500,000, that is their business.",24
NA,"Speaking as a member of this Parliament,",24
NA,I hold that the States should do their,24
NA,"duty, and, i f they do, I venture to say",24
NA,that the Commonwealth Parliament will,24
NA,also do its duty. I f the States and the,24
NA,"Commonwealth work hand in hand, as they",24
NA,"should, I believe there is a great future",24
NA,"for Australia. While that is so, we must",24
NA,"safeguard, at all hazards, the 257,000",24
NA,persons who are engaged in our manufac-,24
NA,turing industries. While the States have,24
NA,"the control of the lands, it is their duty",24
NA,"to promote land settlement, and i f they",24
NA,"fail in that direction, it will be the duty",24
NA,of this Parliament to undertake it.,24
NA,venture to say that we have dpne our share,24
NA,in finding employment for the people .of,24
NA,the Commonwealth in the factories and,24
NA,workshops throughout Australia. As we,24
NA,"have done our part, I trust that the States",24
NA,"will do theirs, by seeing that the vast",24
NA,areas of Australia are filled with men and,24
NA,"women able and willing to work, because",24
NA,such a policy must be in the interests of,24
NA,the whole of the people of the Common-,24
NA,wealth.,24
NA,Mr .FOWLER (Perth) [12.4] - I think,24
NA,T may congratulate the House on the high,24
NA,"tone, as a whole, of the debate which has",24
NA,taken place upon this important question.,24
NA,Some of the speeches might with advan-,24
NA,"tage have been considerably curtailed, but",24
NA,nevertheless I have been very pleased to,24
NA,sit here during the days upon which the,24
NA,"debate has proceeded, and have been un-",24
NA,able to refrain from contrasting favorably,24
NA,the House and its attitude towards this,24
NA,"large public question, with what transpired",24
NA,too frequently during the previous part of,24
NA,this session.,24
Mr WILKS , A reminiscence of the early,24
NA,days of Federation.,24
Mr FOWLER,"I t is, undoubtedly,",24
NA,reminiscent of the early days of the Fede-,24
NA,ration to hear a question like this discussed,24
NA,"so earnestly and with so much ability,",24
NA,"and, I am pleased to be able to add, with-",24
NA,out so much of the purely party aspecf,24
NA,that we have sometimes had. There are,24
NA,"only two points which I wish to discuss,",24
NA,and which have not been dealt with in,24
NA,this debate up to the present. The one,24
NA,note during this debate which has seemed,24
NA,to me to ring somewhat hollow is the crv,24
NA,that some members of this House are sacri-,24
NA,"ficing "" national interests "" to some less im-",24
NA,portant State interests. The cry of,24
NA,""" Nationalism "" is found to rest on a very",24
NA,"slight basis, when we inquire into the rela-",24
NA,tive positions of the State and Federal Par-,24
NA,liaments. I deny that the great Common-,24
NA,wealth Parliament is any more National,24
NA,than is the sum total of the State Parlia-,24
NA,ments. I would remind honorable mem-,24
NA,bers that throughout the discussion in,24
NA,the States of the question of Federation,24
NA,the fact was never lost sight of that we,24
NA,"were to have a Federation, not only of thc",24
NA,"peoples, but also of the States of Australia.",24
NA,In every phase of the extensive and able,24
NA,dehates upon the Federal question one can,24
NA,see how fully and earnestly the matter of,24
NA,the conservation of the duties and rights of,24
NA,the States was intended to be provided for,24
NA,I in the Federal compact. I have heard a,24
NA,good deal about the predominant position of,24
NA,"the Canadian National Parliament, as it",24
NA,"is called, in contrast with the powers of the",24
NA,Parliaments of the Provinces. I have,24
NA,heard honorable members express regret,24
NA,that this Parliament has not been endowed,24
NA,with what they choose to call the same,24
NA,national powers as are possessed by the,24
NA,Parliament of the Dominion of Canada.,24
NA,I f they take the trouble to look up the Act:,24
NA,which brought that Dominion Parliament,24
NA,"into existence, and compare the list of",24
NA,functions apportioned to it with those,24
NA,apportioned to the Parliaments of the,24
NA,"Provinces, they will find that substantially",25
NA,there was made in that great part of the,25
NA,Empire the same re-arrangement as has been,25
NA,made in Australia. There is undoubtedly,25
NA,"the one difference, that the Dominion Parbounds,",25
NA,liament has under its control all powers,25
NA,"directly handed over to the Provinces,",25
NA,whereas the Commonwealth Parliament has,25
NA,only the powers specifically handed over,25
NA,"to it by the States. In other words,",25
NA,"position is reversed, but in both cases there",25
NA,"was, in the minds of those responsible",25
NA,"the creation of the two central bodies,",25
NA,recognition of the same common-sense with,25
NA,"principle. What ruled their minds,",25
NA,determined their allocation of duties and,25
NA,"functions, was simply a question of common",25
NA,sense. They asked themselves what duties,25
NA,could be best performed by a centralized,25
NA,"authority, and what by the States or",25
NA,vinces. That was the problem that they such,25
NA,"endeavoured to solve, and the framers of population",25
NA,"our Constitution most emphatically decided small; but, of",25
NA,it apart from any question of creating,25
NA,"""Imperial'' Parliament for Australia. They",25
NA,settled it purely and simply on a utilitarian,25
NA,"basis, having due regard to what appeared",25
NA,to them to be the capacity of the Commonfrom,25
NA,"wealth Parliament for certain functions,",25
NA,and the corresponding ability of the State,25
NA,Parliaments to carry out other duties.,25
NA,would remind honorable members that when,25
NA,the Federal Convention had finished its,25
NA,"work, there were very many Democratic",25
NA,members of the Australian community who,25
NA,denounced the result as contrary to the best,25
NA,interests of the Democracy. They had a,25
NA,wholesome objection to that centralization,25
NA,of power which is undoubtedly anti-Demoin,25
NA,cratic. They regarded such powers as,25
NA,were handed to the Federal Parliament as,25
NA,"tending in an undemocratic direction,",25
NA,they consequently opposed the' Federal facts,25
NA,Constitution as it was put before the people.,25
NA,"There is no doubt that, with perhaps the",25
NA,single exception of centralization for,25
NA,"fence purposes, the peoples of civilized",25
NA,munities show an increasing inclination,25
NA,decentralize. Honorable members who remuch,25
NA,present Victoria should not forget that,25
NA,objection urged in the early days against,25
NA,"the government of the Port Phillip settletion,",25
NA,ment by the New South Wales authorities,25
NA,"was, from a Democratic stand-point, well",25
NA,"founded. It was said then, with a great",25
NA,"deal of force, that certain functions carried",25
NA,out by that remote Government in New,25
NA,South Wales could be much better perfor,25
NA,formed by the people of the Port Phillip,25
NA,settlement themselves. A separation took,25
NA,"place, and the supreme control of their",25
NA,Mr Fowler*,25
NA,own affairs was granted by the Imperial,25
NA,authorities to the people of Port Phillip.,25
NA,"From that time, the development of Vic-",25
NA,toria undoubtedly went on by leaps and,25
NA,"and the people of that State found,",25
NA,not until the defence problem became of such,25
NA,"supreme importance, that very little objec-",25
NA,tion could be taken to the decentralizing in-,25
NA,fluence which had given them the control of,25
NA,the their own territory. We hear a great deal,25
NA,about the fact that Australia has no fewer,25
NA,"for than seven Parliaments, and some honor-",25
NA,"a able members go so far as to wish that,",25
NA,"the exception of this Parliament, they",25
NA,and were all wiped out. But i f any one con-,25
NA,siders the tremendous distances that sepa-,25
NA,"rate the various, parts of Australia, he",25
NA,"will, I think, begin to realize that",25
NA,even seven Parliaments are by no,25
NA,Promeans an excessive number to control,25
NA,a vast geographical region.,25
NA,"Of course, one may be reminded that the",25
NA,Australia is comparatively,25
NA,an so much a matter ofI contend,25
NA,"again, that it is not",25
NA,population as of area,25
NA,or of geographical separation of one part,25
NA,of this island continent from another. The,25
NA,"population of Port Phillip, when separation",25
NA,New South Wales was demanded and,25
NA,"obtained, was comparatively insignificant,",25
NA,but that was regarded as no obstacle; and,25
NA,1 I say without hesitation that any one who,25
NA,"looks at the huge area of Australia, and the",25
NA,geographical separation of certain parts of,25
NA,"the continent, must realize that the State",25
NA,"Parliaments, although they control, nomi-",25
NA,"nally, only a handful of people, have func-",25
NA,tions that cannot be performed as well by,25
NA,"any centralized authority. We have, room",25
NA,Australia for twenty-five TJnited King-,25
NA,doms ; and in my own State there is an area,25
NA,equivalent to half-a-dozen average European,25
NA,"and Kingdoms. Any one who looks, at such",25
NA,"as these will, I think, hesitate to say",25
NA,"that, while it is quite proper there.should",25
NA,be a central authority to deal with trade,25
NA,"deand commerce, and so forth, the functions",25
NA,comof the State Parliaments cannot be carried,25
NA,to oiit by them in their respective spheres,25
NA,better than they could be carried out,25
NA,the by us. I am glad to be able to compliment,25
NA,the Ministry on having dealt with this ques-,25
NA,"as it appears to me, in that broad,",25
NA,general spirit required in such a crisis in.,25
NA,the history of Australia. Here we have,25
NA,no question affecting one or two particular,25
NA,"States, but one affecting the welfare and",25
NA,"development of the whole of Australia. I ,",25
NA,"one, intend to give hearty support to the",25
NA,proposals of the Government. I realize,25
NA,"that the proposals, as they stand, cannot be",25
NA,interfered with without seriously injuring,26
NA,the possibility of a settlement with the,26
NA,States. We have an understanding between,26
NA,"two parties; and if we, on the one hand,",26
NA,"interfere with it, it stands to reason",26
NA,that the other side may have some,26
NA,hesitation in accepting any changes we,26
NA,"may make. On the whole, it seems",26
NA,"to me that, with the years of ex-",26
NA,"perience behind us, the Government pro-",26
NA,posals meet the situation in Australia; and,26
NA,"the provision made for the future is,",26
NA,"humanly speaking, as well thought out as",26
NA,any such provision could possibly be.,26
NA,"Another phase of the question, with which I",26
NA,"desire to deal very briefly, more particu-",26
NA,larly affects my own State. An impression,26
NA,has been sedulously fostered in certain,26
NA,"quarters that Western Australia, in parti-",26
NA,"cular, in supporting, as I believe it does",26
NA,through the length and breadth of its vast,26
NA,"area, the proposals of the Government, is",26
NA,very selfishly doing so in order to obviate,26
NA,other taxation of a. State character. There,26
NA,is no doubt that up to the present time,26
NA,Western Australia has suffered consider-,26
NA,ably financially from the effects of Federa-,26
NA,tion. While some members of this House,26
NA,have suggested that Western Australia,26
NA,"comes to the other States, and to the Com-",26
NA,"monwealth Parliament, in the attitude of a",26
NA,"mendicant, I am glad that such a view is",26
NA,not general. I t is a view which was re-,26
NA,pudiated by those who gave special con-,26
NA,sideration to the-circumstances of Western,26
NA,"Australia when drawing up the Constitution,",26
NA,"and who now, under the present arrange-",26
NA,"ment, seek to continue that con-",26
NA,sideration. In both cases it is ad-,26
NA,mitted by those who have gone into the,26
NA,question that the sliding scale provided for,26
NA,"Western Australia was only an equivalent,",26
NA,"and not an absolute equivalent, for the",26
NA,losses she sustained by entering the Federal,26
NA,"compact. I t is also admitted, in the arrange-",26
NA,"ment we are asked to seal, that Western",26
NA,"Australia is fully entitled, as a matter",26
NA,"of justice and equity, to special considera-",26
NA,"tion, in view-an d I quote the phraseology",26
NA,of the memorandum-o f the large contri-,26
NA,bution to the Customs revenue -per cafita,26
NA,made by that State. We undoubtedly re-,26
NA,quire all the money we can get in Western,26
NA,Australia for our local development. West-,26
NA,ern Australia has been behind the other,26
NA,States in obtaining that inflow of capital,26
NA,and of humanity without which no new,26
NA,"country can progress. We have, as I have",26
NA,"already said, suffered severely in our de-",26
NA,velopment by reason of the steadily decreas-,26
NA,ing amount of money available for us under,26
NA,Federal conditions. The State has done,26
NA,all in her power - all that she can,26
NA,reasonably be expected to do - to,26
NA,supplement by local taxation the shortage,26
NA,of revenue from Federal sources. The,26
NA,fact is-an d may come as a surprise to,26
NA,many honorable members-tha t the total,26
NA,revenue of Western Australia per head,26
NA,through direct taxation is not less than £ 1,26
NA,"is. 3d., as compared with an average of",26
NA,17s. 2d. for the whole of the Common-,26
NA,"wealth. Western Australia is, I think,",26
NA,second only to Tasmania in the thorough-,26
NA,ness with which it has applied the prin-,26
NA,ciples of direct taxation. In view of the,26
NA,"rudimentary character of our development,",26
NA,I contend that the taxation of this charac-,26
NA,ter imposed in Western Australia is even,26
NA,"greater, relatively, than that of any of the-",26
NA,"other part of the Commonwealth.' That,",26
NA,"I think, is a fairly sufficient reply to those",26
NA,"who contend that Western Australia, in",26
NA,order to make up the shortage of Federal,26
NA,"revenue, ought to tax herself still more.",26
NA,In that State there is a land tax of id. in,26
NA,"the £ i , an income tax of 4d. in the £ 1",26
NA,"on incomes over £200, a dividend tax of",26
NA,"id._ in the £ i for all companies, stamp",26
NA,"duties, and totalizator duties; and in view",26
NA,of a list of that kind the charge of not,26
NA,having sufficiently contributed from local,26
NA,resources is totally and absolutely un-,26
NA,founded.,26
Sir PHILIP FYSH ,Ar e there probate,26
NA,duties in Western Australia?,26
Mr FOWLER ,Not up to the present;,26
NA,the large - fortunes of Western Australia,26
NA,have not yet developed-they are in fosse,26
NA,and not in esse.,26
NA,NA,26
NA,there are young.,26
Mr FOWLER ,An d doubtless their,26
NA,fortunes will increase with increasing years.,26
NA,I sincerely hope that in Western Australia,26
NA,there will be none of those great fortunes,26
NA,which characterize particularly the land,26
NA,"magnates of the other States, but the people",26
NA,there may look forward to competence and,26
NA,"independence as the result of energy, in-",26
NA,"dustry, and thrift, as is being proved",26
NA,every day of our existence. I f Western,26
NA,Australia places 100 settlers on the land,26
NA,through the exercise of the functions of,26
NA,"the State Parliament, that is as much a",26
NA,step in the direction of national welfare,26
NA,and development as the creation of an in-,26
NA,dustry in Melbourne by means of a high,26
NA,"Protective duty. In regard to settlement,",26
NA,the State Parliaments have a national duty,26
NA,"to perform- a duty which, with the",27
NA,"exception of defence, transcends any,",27
NA,"I think, that lie before us in this",27
NA,Parliament. So long as the power of,27
NA,dealing with the land is left in the,27
NA,"hands of the State Parliaments, so long",27
NA,are they entitledto be regarded as,27
NA,"national in their character, quite as much",27
NA,as is the Parliament in which we have the,27
NA,honour to sit. I hope that the proposed,27
NA,"arrangement will be carried. I t will, I be-",27
NA,"lieve, be the means of giving the States a",27
NA,solidarity in their financial relations that,27
NA,will enable them to carry on effectively,27
NA,their work of development. I f that be,27
NA,"done, and i f we can settle thousands where",27
NA,"none are at present, the Commonwealth,",27
NA,"through the Customs, will be given an in-",27
NA,creased revenue that I feel sure will sup-,27
NA,ply the whole of our requirements for an,27
NA,indefinite period to come.,27
NA,NA,27
NA,"Prime Minister, in opening this important",27
NA,"discussion, wisely pointed out that the",27
NA,"Constitution, under which we work and are",27
NA,"governed, not only affects us as a Common-",27
NA,"wealth Parliament, but has an important",27
NA,bearing on the State Parliaments and Go-,27
NA,vernments. Particularly in the matter of,27
NA,finance the interests of one are irrevocably,27
NA,connected with the interests of the other;,27
NA,"and this, of course, is especially the case",27
NA,during the ten years existence of the opera-,27
NA,tion of the Braddon section. I have viewed,27
NA,the approach of the expiration of the opera-,27
NA,tion of that section with some measure of,27
NA,anxiety. It was clear to my mind that,27
NA,"if we allowed the time to pass without, in",27
NA,"the meantime, arriving at some satisfactory",27
NA,"arrangement, we should find ourselves in",27
NA,absolute possession of an income very much,27
NA,larger than we could at times judiciously,27
NA,"expend, while the States would be placed",27
NA,"in financial difficulties. This being so, I",27
NA,am glad that we have so far arranged mat-,27
NA,ters that an agreement has been come to in,27
NA,conference between representatives of the,27
NA,Commonwealth and the States.,27
NA,not concern me now that under it some of,27
NA,the States will not fare as well as others;,27
NA,it is sufficient to know that their represen-,27
NA,"tatives were able to fall into line, and agree",27
NA,to accept a per capita payment of 25s.,27
NA,Many extraneous matters have been dis-,27
NA,"cussed on the motion before the House, but",27
NA,I do not propose to follow the example of,27
NA,those who introduced them. The honorable,27
NA,member for Batman referred to the imposi-,27
NA,tion of a land tax. I f land taxation is to,27
NA,"be imposed, it should be by the Govern-",27
NA,ments of the States. Only under very ex-,27
NA,traordinary circumstances should the. Com-,27
NA,monwealth impose land taxation. Should,27
NA,the Commonwealth impose a land tax with-,27
NA,out being impelled thereto by pressing ne-,27
NA,"cessity, it would to some extent offend",27
NA,against the Constitution. I refuse to con-,27
NA,sider the agreement as affecting the Tariff.,27
NA,It has been argued that the natural result,27
NA,of a Protective Tariff is to diminish the,27
NA,"returns from Customs, and, undoubtedly, to",27
NA,the extent to which Protective duties' are,27
NA,"effective, they reduce Customs revenue. But",27
NA,the statistics of the world show that many,27
NA,of the most effective Tariffs yield a good,27
NA,"return. Moreover, it has been freely stated",27
NA,"by the Prime Minister that, although we are",27
NA,asked to agree to pay to the States 25s.,27
NA,"per capita, the money must not necessarily",27
NA,be raised by Customs and Excise duties.,27
Mr TUDOR ,Dee s the honorable mem-,27
NA,"ber suggest raising it by direct taxation r""",27
NA,NA,27
NA,"No doubt, when the need arises, the Par-",27
NA,liament of the time will adopt the wisest,27
NA,means_ to meet the occasion. The discus-,27
NA,sions in the Convention make it clear that,27
NA,it was intended that the States should,27
NA,always participate with the Commonwealth,27
NA,in the Customs and Excise revenue.,27
Sir PHILIP FYSH ,Nothin g is more cer-,27
NA,tain.,27
NA,NA,27
NA,breach of faith if the Commonwealth were,27
NA,to refuse to return to the States their fair,27
NA,portion of that-revenue. The Protective,27
NA,policy of Australia is likely to he more,27
NA,stringent in the future than in the past.,27
NA,Honorable members generally are agreed,27
NA,that 25s. per capita is not too large a sum,27
NA,"to return to the States, but it is objected",27
NA,that should the agreement be embodied ip,27
NA,"the Constitution, it will be unalterable. 1",27
NA,do not indorse that view. The electois who-,27
NA,choose the Commonwealth Parliament choose-,27
NA,"also the State Pao-l-iaments, and i f they",27
NA,It does found that more money was going to either,27
NA,the Commonwealth or to the States thart,27
NA,"was needed by one or the other party, thev",27
NA,would insist on a re-division. I t has been-,27
NA,argued that the States will -be against anv,27
NA,amendment of the Constitution with a view-,27
NA,to an alteration of the agreement. But,27
NA,should the Commonwealth find itself in,27
NA,"financial difficulties, and compelled to re-",27
NA,"sort to direct taxation, while the States had",27
NA,"more revenue than they needed, the people",27
NA,would surely insist on an amendment of the,27
NA,Constitution.,27
Sir WILLIAM LYNE , The honorable pied land.,28
NA,member's speech would lead one to regard,28
NA,liim as an anti-Federalist.,28
NA,NA,28
NA,Federalist. The Commonwealth alone can,28
NA,-deal with defence and certain other large,28
NA,"matters; but, while it has great and imtheir",28
NA,"portant functions to discharge, the Governberations",28
NA,ments of the States have also their duties.,28
NA,Australia is too large to be governed wholly,28
NA,from any one centre. Had we had unificamatters,28
NA,tion before the Coolgardie water scheme,28
NA,"was carried out, would it not",28
NA,many years to convince the central Govern-,28
NA,"ment that that scheme was needed, and",28
NA,would have results justifying the expendicaucus?,28
NA,ture ?,28
Mr FOWLER ,W e may judge how long caucus ?,28
NA,it would have taken by the time needed to,28
NA,-obtain a survey of the proposed railway,28
NA,from Kalgoorlie to Port Augusta.,28
NA,NA,28
NA,-how long would it take to convince Western',28
NA,Australians or Queenslanders of the justithe,28
NA,fication for expenditure on perhaps necessuch,28
NA,sary irrigation works in Victoria ? Both,28
NA,Commonwealth and the State Governments,28
NA,have work to do in developing the contisiderable,28
NA,"nent, and it is our business to see that",28
NA,revenue is fairly divided between them.,28
NA,"Unquestionably, had this matter been",28
