Speaker,Text,pageNumbers
NA,i^ouse of Hfprrsentatibrs .,14
NA,"Friday, 1 October, igog.",14
NA,Mr SPEAKER took the chair at 10.30,14
NA,"a.m., and read prayers.",14
NA,PERSONAL EXPLANATIONS.,14
NA,"FINANCIAL RELATIONS, COMMONWEALTH",14
NA,AND STATES.,14
Mr HENRY WILLIS ,Robertson),14
NA,[10.31] - r wish to make a personal ex-,14
NA,planation. During his very interesting,14
NA,"speech last evening, the honorable member",14
NA,for iFremantle referred to a statement made,14
NA,by me on the previous day regarding the,14
NA,proposed arrangement for future payments,14
NA,"by the Commonwealth to the States, and",14
NA,contrasted it with what I said a year or,14
NA,two ago on the same subject. But in my,14
NA,earlier speech. I was referring to the pro-,14
NA,1,14
NA,bable future expansion of the Common-,14
NA,"wealth power, and the services which would",14
NA,have to be taken over. I said-,14
NA,It does not necessarily follow that we should,14
NA,take over these large services at once.,14
NA,"Then come these words, which were",14
NA,quoted by the honorable member-,14
NA,We cannot adjust the nnancial relations of,14
NA,the Commonwealth and States unless we take,14
NA,over these great services. Unless we obtain,14
NA,control of them we must return to the States,14
NA,"at least ^9,000,000 annually.",14
NA,The honorable member for Fremantle has,14
NA,"charged me with inconsistency, but the",14
NA,two speeches are quite consistent. In,14
NA,"1907-8, the States were receiving from the",14
NA,"Commonwealth ,£8,856,905. That sum I",14
NA,wish to capitalize under a scheme which I,14
NA,put forward as better than that of the Go-,14
NA,vernment. He claims that I should sup-,14
NA,"port the Government scheme, but the quo-",14
NA,tation which he made does not prove that,14
NA,I was ever in favour of such an arrange-,14
NA,ment. I proposed to give to the States,14
NA,to the very fraction what the Government,14
NA,"proposes to give to them, and to take from",14
NA,"them, within a trifling amount, what would",14
NA,be taken from them under the Government,14
NA,"scheme. But, instead of first giving them",14
NA,"25s. per capita, and then taking away",14
NA,that and 14s. 3d. to pay the interest on the,14
NA,"public debt, I would treat them much more",14
NA,liberally. I would give the States as,14
NA,much as they would receive under the,14
NA,"Government proposal, and was within the",14
NA,"mark in saying that £9,000,000 would",14
NA,have to be returned to them on the basis,14
NA,of the 1907-8 payment. The basis of,14
NA,the calculation on which the Government,14
NA,"scheme rests is not sound, whereas my",14
NA,scheme has an actuarial foundation.,14
Mr SPEAKER ,Th e honorable mem-,14
NA,ber must not discuss the Government,14
NA,scheme.,14
Mr HENRY WILLIS , I am merely,14
NA,mentioning facts which show that my,14
NA,speeches on this subject have not been in-,14
NA,consistent. I propose to give to each,14
NA,State what it is actually entitled to. I t,14
NA,is because the Government scheme will not,14
NA,do so that I cannot support it. My scheme,14
NA,"would provide funds for all time, whatever",14
NA,the expansion of the Commonwealth ex-,14
NA,penditure might be by reason of the taking,14
NA,"over of new services, but under the Go-",14
NA,vernment proposal such expansion cannot,14
NA,be provided for.,14
NA,Mr KING O'MALLEY -Th e honorable,14
NA,member's scheme is a good one.,14
Mr HENRY WILLIS ," I fear, Mr.",14
NA,"Speaker, that you may think that it was",14
NA,arranged between the honorable member,14
NA,for Fremantle and me that he should make,14
NA,"the quotation to which I have referred, in",14
NA,order that. I might have an opportunity,14
NA,this morning to again explain the merits,14
NA,"of my scheme, but I assure you that, al-",14
NA,"though we sit together, nothing of the kind",14
NA,has been done.,14
Mr WISE ,Gippsland) [10.37] -Un -,14
NA,"fortunately, I was temporarily absent last",14
NA,evening when the honorable member for,14
NA,Fremantle referred to something which I,14
NA,said in this House on a former occasion.,14
NA,He quoted from a speech delivered in,14
NA,"1907, to charge me with inconsistency. To",14
NA,"understand the position, it must be remem-",14
NA,bered that my remarks were made in con-,14
NA,sequence of something said by the honor-,14
NA,"able member for Flinders who, in estimat-",14
NA,ing what the revenue from Customs duties,14
NA,"would be a few years ahead, referred to",14
NA,the States' debts. He said-,14
NA,What we might fairly say is that the lower,14
NA,limit bf tbe amount which we ought to hand,14
NA,"back to the States is that which, to my mind, is",14
NA,impliedly prescribed by the Constitution. I re-,14
NA,"fer to what is, I think, the basis of the consti-",14
NA,"tional proposals, and that is that we should",14
NA,burden ourselves with the whole ofthe interest,14
NA,of the States' debts as existing at the time of the,14
NA,establishment of the Commonwealth. I believe,14
NA,that to have been in the minds of most of those,14
NA,who framed our Constitution,14
Mr SPEAKER ,Th e honorable mem-,14
NA,ber is now dealing with the speech of an-,14
NA,other honorable member which is not in,14
NA,question. I ask him to confine himself to,14
NA,a personal explanation of such remarks of,14
NA,his as he considers to have been misrepre-,15
NA,sented.,15
Mr WISE , I cannot do so without re-,15
NA,ferring to the speech of the honorable,15
NA,member for Flinders.,15
Mr SPEAKER ,Th e honorable mem-,15
NA,"ber may refer to it incidentally, but may",15
NA,not quote from it at length. Were such,15
NA,"quotations allowed, it would be possible,",15
NA,"under cover of a personal explanation, to",15
NA,read the whole of the speech made by,15
NA,another honorable member.,15
Mr WISE ,Th e report of the speech,15
NA,of the honorable member for Flinders,15
NA,"covers several pages of Hansard, and I",15
NA,wish to read only about twenty lines of it.,15
NA,"I f I cannot do so now, I shall",15
NA,certainly take an opportunity to deal,15
NA,with the matter fully on the second reading,15
NA,of the Bill; but to clear myself now of the,15
NA,charge of Inconsistency let me say that the,15
NA,honorable member for Flinders had stated,15
NA,that the idea in the minds of the members,15
NA,of the Convention .was that the Common-,15
NA,"wealth, in taking over the Customs and",15
NA,"-Excise revenue, should take with it the",15
NA,"sponsibility for the debts, and the interest",15
NA,"on them, at the time of federating. He",15
NA,"pointed out that, in his opinion, the",15
NA,revenue from Customs and Excise in two or,15
NA,"three years' time would be £9,000,000,",15
NA,of which three-fourith's would be about,15
NA,"£6,750,000. As that would not be suf-",15
NA,"ficient to pay interest on their debts, he",15
NA,"proposed to give them another £500,000,",15
NA,"or, in all, about £7,250,000. I said",15
NA,"that I agreed with that proposal, but, since",15
NA,then we have relieved the States of ex-,15
NA,penditure on old-age pensions amounting,15
NA,"to £1,500,000, which brings the amount",15
NA,"down to less than £6,000,000. When",15
NA,"speaking the other evening, I said that I",15
NA,had no objection to the proposal on the,15
NA,score of the amount that it was proposed,15
NA,"to pay to the States, but that I was in",15
NA,"favour of the Lyne-Deakin scheme, which",15
NA,"was based on the Harper scheme, under",15
NA,"which the States would have received, to",15
NA,1,15
NA,"begin with, £6,000,000. The honorable",15
NA,member for Mernda originally proposed to,15
NA,"give them £6,500,000 a year. ""Under the",15
NA,scheme now before us they would get,15
NA,"about £5,500,000 a year. In reply to an",15
NA,"interjection, I said the other evening that",15
NA,1 was in favour of the scheme which the,15
NA,honorable member for Mernda outlined in,15
NA,his speech on the Constitution Alteration,15
NA,(Finance) Bill. He proposed that the,15
NA,States should receive 25s. per capita until,15
NA,"their population had increased to 7,200,000,",15
NA,"and the payments to £9,000,000, the",15
NA,"amount of the interest on the State debts,",15
NA,as they exist at the present day. I found,15
NA,"no fault with the proposal to pay,",15
NA,"£5,500,000 to the States, and was, in-",15
NA,"deed, prepared to commence vvith a pay-",15
NA,"ment of £6,000,000 under the Lyne-Dea-",15
NA,kin scheme. The honorable member for,15
NA,Mernda showed that the payments under,15
NA,"his scheme would increase to £9,000,000",15
NA,in about the same length of time as they,15
NA,would increase to that sum under the,15
NA,Lyne-Deakin scheme-betwee n thirty and,15
NA,thirty-five years. There was no incon-,15
NA,sistency between my speech of 1907 and,15
NA,that of the other evening.,15
Mr HEDGES ,Fremantle) [10.42] -,15
NA,By way of personal explanation,15
Mr SPEAKER , I hope that honor-,15
NA,"able members do not intend to, each day,,",15
NA,redeliver speeches vvhich they have recently,15
NA,made. The right of personal explanation,15
NA,is always afforded to honorable members,15
NA,"who have been misrepresented, but May",15
NA,points out clearly that such explanations,15
NA,reare against the forms and rules of the,15
NA,"House, and an indulgence which should",15
NA,be only used on very important occasions.,15
NA,1 hope that honorable members will not,15
NA,"feel it incumbent on them, when a personal",15
NA,"explanation has been made, and their",15
NA,"names, perhaps only incidentally, men-",15
NA,"tioned, to make explanations on their own",15
NA,account. I f the honorable member desires,15
NA,"to explain something vvhich he has said,",15
NA,"and which has been misrepresented, I shall",15
NA,"allow him to proceed, but I hope that this",15
NA,will not continue verv much further.,15
Mr HEDGES , I wish to explain,15
NA,something whichhas been misrepresented.,15
NA,What I said last night has been mis-,15
NA,understood. The honorable member for,15
NA,Gippsland misunderstood the point which,15
NA,1 took. It was contained in the quotation,15
NA,of these words-,15
NA,"Such an amount represents about ^500,000 in",15
NA,excess of the three-fourths of the present Cus-,15
NA,toms revenue.,15
NA,POSTMASTER-GENERAL'S,15
NA,DEPARTMENT.,15
NA,OVERSEA MAIL CONTRACT : STAY OF,15
NA,VESSELS IN PORT-MORE E POST,15
NA,OFFICE-CHARG E AGAINST A POSTAL,15
NA,ASSISTANT.,15
Mr FRAZER ,I n regard to the sug-,15
NA,gested alteration of ' the time-table for the,15
NA,"oversea mails, I wish to ask the Post-",15
NA,"master-General i f , during the currency of",15
NA,the present contract with the Orient,16
NA,"Steam Navigation Company, "" complaint",16
NA,has been lodged with the Department that,16
NA,the time allowed under it for the stay of,16
NA,their steamers at Port Melbourne is insuf-,16
NA,ficient to enable the necessary loading to,16
NA,take place?,16
Sir JOHN QUICK , I am not aware,16
NA,of any such complaint having been made.,16
NA,Under the new contract the cool storage,16
NA,accommodation provided on the vessels of,16
NA,"the company will be increased to 2,000 tons.",16
NA,The taking in of cargo to fill that largely,16
NA,"increased space will, it is said, require",16
NA,"additional time, and the vessels of the",16
NA,company will not be able to load in time,16
NA,to leave Adelaide as hitherto on Thursday.,16
NA,The company is therefore strongly urging,16
NA,"the adoption of the new time-table, which",16
NA,will enable its vessels to leave Adelaide on,16
NA,Friday.,16
Mr FRAZER , I wish to ask the,16
NA,Postmaster-General whether the cool stor-,16
NA,"age space now provided on the Moldavia,",16
NA,"the Morea, and two or three other new",16
NA,steamers of the Peninsular and Oriental,16
NA,Steam Navigation Company is equal,16
NA,to that which has to be provided,16
NA,on the new vessels of the Orient,16
NA,Steam Navigation Company's,16
NA,"vice. I f it is, will the honorable gentle-",16
NA,man say whether a complaint has been,16
NA,made that the time allowed at present to,16
NA,fill that space at Port Melbourne is insuffi-,16
NA,cient ?,16
Sir JOHN QUICK , I am not aware,16
NA,of the exact extent of the cool storage accom-,16
NA,modation provided at present on the ves-,16
NA,sels of the Peninsular and Oriental Steam,16
NA,"Navigation Company, but there is a",16
NA,material difference between the two.,16
NA,Another point which must not be over-,16
NA,looked is that the vessels of the Peninsular,16
NA,and Oriental Steam Navigation Company,16
NA,"terminate their voyage at Sydney, whereas",16
NA,the Orient Company's vessels have to go,16
NA,"on to Brisbane, and they cannot go there",16
NA,"and back, and take in cargo at Port Mel-",16
NA,"bourne, in the same time as do the vessels",16
NA,on the other line whose terminal port is,16
NA,Port Jackson.,16
Mr THOMAS BROWN , I desire to,16
NA,ask the Postmaster-General whether his at-,16
NA,tention has been drawn to the following tele-,16
NA,"gram, appearing in this morning's issue of",16
NA,"the Age, under the headings "" Alleged Em-",16
NA,"bezzlement "" ; ""Postal official charged.""",16
NA,""" A n overworked staff.""",16
NA,At the Moree Quarter Sessions to-day Stanley,16
NA,"George Weber, assistant at the local post-office,",16
NA,"was charged with stealing £ S , the property of",16
NA,the Commissioners of the Government Savings,16
NA,Bank. Accused pleaded not guilty. . . . The,16
NA,Crown Prosecutor described the condition of af-,16
NA,fairs at the Moree post-office at that time as,16
NA,chaotic and disgraceful. Further evidence,16
NA,showed that complaints were frequent about thai,16
NA,time of the Moree post-office being undermanned,16
NA,and the staff overworked. The business was very,16
NA,"heavy, and large sums of money passed through",16
NA,the hands of youths like defendant. I n a writ-,16
NA,ten statement defendant attributed his failure to,16
NA,hand over the £ 8 to the rush of work at the,16
NA,"counter, and the non-entry of the amount in the",16
NA,office book owing to the latter having been mis-,16
NA,laid.,16
NA,Acting Judge Dawson commented in strong,16
NA,terms on the Postal Department summoning de-,16
NA,fendant some time after the missing money had,16
NA,"been handed in by the defendant. There was,",16
NA,"he said, considerable doubt in the case, and",16
NA,therefore the jury could not convict. The jury,16
NA,acquitted defendant.,16
NA,Is the Postmaster-General aware that the,16
NA,chaotic condition of affairs referred to is,16
NA,"not peculiar to the Moree post-office, but ob-",16
NA,"tains generally throughout the States, and",16
NA,"will he take steps to remove, as speedily",16
NA,"as possible, the cause of complaint as to",16
NA,the undermanning of the Department?,16
NA,"Further, will he inquire into this case and",16
NA,ascertain why the prosecution was instituted,16
NA,in the circumstances to which the learnea,16
NA,ser- Judge referred?,16
Sir JOHN QUICK , I gave no,16
NA,"authority for the prosecution, which must,",16
NA,"therefore, have been instituted by the De-",16
NA,puty Postmaster-General of New South,16
NA,"Wales, acting on legal advice. Under",16
NA,"his delegated power, he has a certaindis-",16
NA,cretion .,16
Sir JOHN FORREST ,Thi s was a prose-,16
NA,cution in connexion with Savings Bank,16
NA,work.,16
Sir JOHN QUICK ,Th e Moree post-,16
NA,office transacts business in connexion with,16
NA,the Savings Bank.,16
Mr THOMAS BROWN ,Tha t is so.,16
Sir JOHN QUICK ,Ther e has been,16
NA,some slight disorganization in the Moree,16
NA,post-office. The matter has been brought be-,16
NA,"fore me, and I have on two or three occasions",16
NA,directed the attention of the Deputy Post-,16
NA,master-General of New South Wales to it.,16
NA,He reported that the disorganization arose,16
NA,from the frequent changes made .in the,16
NA,"office, and he promised to rectify the",16
NA,"matters complained of. No doubt, in times",16
NA,"past, there has been ground for complaint",16
NA,of undermanning in connexion with many,16
NA,"post-offices, but I need scarcely remind the",16
NA,"honorable member that, in the Estimates",16
NA,"now before the House, provision is made",16
NA,for an increase of over 600 hands in the,17
NA,staff of the Department in New South,17
NA,Wales. I t is believed that when those ad-,17
NA,ditional hands are employed many of the,17
NA,complaints about overwork and overtime,17
NA,will be removed.,17
NA,. DISORDERLY QUESTIONS.,17
NA,ABSENCE OF THE OPPOSITION.,17
Dr WILSON ," I have noticed, with",17
NA,"great pain, Mr Speaker, that during the",17
NA,last few . mornings honorable members,17
NA,usually occupying the direct Opposition,17
NA,benches have been absent when the House,17
NA,"has met, and I wish to ask .whether you",17
NA,have received any information from them,17
NA,that they object to the prayers.,17
Mr FRAZER ,I f we drew attention to,17
NA,every absence on the part of the honorable,17
NA,member at the opening of the House the,17
NA,record would be a pretty long one.,17
Dr LIDDELL ,"I n all sincerity, Mr.",17
NA,"Speaker, and with a full sense of the re-",17
NA,"sponsibility of my position, I desire to",17
NA,ask whether you can inform the House,17
NA,what has become of our dear friend and,17
NA,"comrade, and ex-Leader of the Opposi-",17
NA,"tion, the honorable member for South",17
NA,Sydney'.,17
Mr SPEAKER , I think that I ought,17
NA,to be able to rely upon honorable members,17
NA,to put to the Chair only such questions,17
NA,as relate to matters with which the Chair,17
NA,"is concerned. I may say, in passing, that",17
NA,the Chair is not supposed to answer ques-,17
NA,tions. I sincerely hope that I shall not,17
NA,have to remind honorable members again,17
NA,that it is unbecoming to put to the Chair,17
NA,questions of the character of those which,17
NA,have just been addressed to me. Questions,17
NA,of a similar character have previously been,17
NA,allowed'by the Chair to pass without com-,17
NA,"ment, but they ought not to be made.",17
Mr MCDONALD , I wish to ask your,17
NA,"ruling, Mr Speaker, on a point of order",17
NA,in regard to the two questions to which,17
NA,"you have just, very properly, taken excep-",17
NA,tion. Is an honorable member in order,17
NA,"in rising, under pretence of asking a ques-",17
NA,"tion, and deliberately offering an insult",17
NA,either to an honorable member or to a party,17
NA,in this House? I f such a practice is to,17
NA,be continued by honorable members oppo-,17
NA,"site, the Opposition will have to retaliate.",17
Mr SPEAKER , I think that the,17
NA,honorable member will admit that I have,17
NA,already dealt with the two questions in the,17
NA,only way in which they could be dealt,17
NA,with. I t is impossible for the Chair to,17
NA,know the nature of the question that an,17
NA,"honorable member is going to put, but the",17
NA,growth of the practice of asking questions,17
NA,without notice is very largely responsible,17
NA,for what has just taken place. In the,17
NA,Parliament with which I was previously,17
NA,"connected, questions without notice were",17
NA,not asked without the permission of the,17
NA,"Chair, previously obtained, and with'",17
NA,the permission of the Minister who was to,17
NA,be interrogated. But for the practice which,17
NA,has grown up in this House we should,17
NA,haye been spared questions of the kind to,17
NA,"which attention has just been directed, and",17
NA,"which, I think, are disorderly and of an",17
NA,objectionable character.,17
Mr THOMAS BROWN , I desire to,17
NA,ask Mr Speaker whether the insulting,17
NA,questions addressed to you - questions,17
NA,which you have described as disorderly- -,17
NA,in regard to honorable members on this side,17
NA,of the House,17
Mr SPEAKER , I f the honorable,17
NA,"member will permit me, I think that I have",17
NA,dealt with the matter in a way which will,17
NA,"prevent its recurrence, and that no good",17
NA,can be obtained by putting further ques-,17
NA,"tions, which must tend only to embarrass",17
NA,the Chair.,17
Mr THOMAS BROWN ,I wish to,17
NA,"ask, sir, whether the questions addressed to",17
NA,"you in respect to the Opposition, and which",17
NA,"you have held to be disorderly, are to ap-",17
NA,pear in Hansard ? They seem to have been,17
NA,asked solely with the object of securing,17
NA,their publication in Hansard.,17
Mr SPEAKER , That is a matter,17
NA,which I shall have to consider.,17
NA,HOURS OF SITTING.,17
NA,NA,17
NA,tance of the discussion of the nnancial rela-,17
NA,tions of the Commonwealth and States,17
NA,"which is now taking place in this House,",17
NA,will the Prime Minister consider the ad-,17
NA,visableness of inviting honorable members,17
NA,to sit on Friday evenings?,17
Mr DEAKIN ,An y proposition for the,17
NA,extension of the hours of sitting during this,17
NA,session will be warmly welcomed by the,17
NA,"Government, and I hope the honorable",17
NA,member will be able to add other represen-,17
NA,tations to his own in order that we may,17
NA,take the earliest advantage of the sugges-,17
NA,tion.,17
Mr BATCHELOR ,I n considering the,17
NA,suggestion just made by the honorable mem-,17
NA,"ber for Echuca, will the Prime Minister",18
NA,"have regard to an alternative proposal,",18
NA,which would suit the convenience of a much,18
NA,"larger proportion of honorable members, following papers :-",18
NA,"namely, that we should meet on Wednesday",18
NA,and Thursday mornings?,18
Mr DEAKIN ,A n extension of the,18
NA,hours of sitting can be made only by im-,18
NA,posing increased difficulties and responsi-,18
NA,bility on certain honorable members. At,18
NA,"an early date, however, it will be necessary",18
NA,"to have morning sittings, but I hope, with",18
NA,"the assistance of the House, to avoid going",18
NA,further. I f it be necessary to sit later as,18
NA,"well as earlier, we must do so.",18
NA,PUBLIC SERVICE : MINIMUM,18
NA,WAGE.,18
Mr TUDOR ,Recentl y a return was,18
NA,"prepared to the order of the House, on a",18
NA,"motion submitted by myself, showing the",18
NA,number of adults in the Public Service of,18
NA,thc Commonwealth receiving less than the,18
NA,minimum wage. Will the Minister of Home,18
NA,Affairs make an effort to have the return,18
NA,prepared in a more intelligible form than,18
NA,that in which it has been submitted?,18
Mr FULLER ,Th e honorable member,18
NA,having called my attention to the nature of,18
NA,"the return, I caused it to be sent back to",18
NA,"the Public Service Commissioner, with a",18
NA,request that a further investigation be made,18
NA,with a view to setting out more clearly the,18
NA,information sought by the honorable mem-,18
NA,ber.,18
NA,FEDERAL CAPITAL SITE.,18
Mr HENRY WILLIS ,Ha s the atten.,18
NA,tion of the Minister of Home Affairs been,18
NA,called to a paragraph in this morning's news-,18
NA,papers stating that the Premier of New,18
NA,"South Wales, in the Legislative Assembly,",18
NA,yesterday took certain action in regard to,18
NA,the Federal Capital site? Has the honor-,18
NA,able gentleman any information on the sub-,18
NA,"ject to convey to the House, and will he",18
NA,state when the next step will be taken by,18
NA,the Commonwealth Government to secure,18
NA,finality in the selection and location of the,18
NA,site of the Capital?,18
Mr FULLER , I have read the para-,18
NA,"graph in question, and can only say that the",18
NA,Government are extremely anxious that this,18
NA,important matter shall be dealt with with,18
NA,as little delay as possible. I have every,18
NA,hope that a measure relating to it will be,18
NA,submitted to the Senate next week.,18
NA,PAPERS.,18
NA,MINISTERS laid upon the table the,18
NA,Papua-,18
NA,Ordinances of 1909-,18
NA,No. 23-Appropriatio n 1909-10.,18
NA,No. 24 -Supplementar y Appropriation,18
NA,"1909-10, No. 1.",18
NA,Census and Statistics Act-,18
NA,Official Bulletins -,18
NA,Population and Vital Statistics-,18
NA,"No. 15-Quarte r ended 31st March,",18
NA,igoq.,18
NA,"Trade, Shipping, Oversea Migration",18
NA,and Finance-,18
NA,"No. 30-June , 1909.",18
NA,"No. 31-July , 1909.",18
NA,CONSTITUTION ALTERATION,18
NA,(FINANCE) BILL.,18
NA,Debate resumed from 30th September,18
NA,"(vide page 4008), on motion by Mr.",18
NA,DEAKIN-,18
NA,That leave be given to bring in a Bill for an,18
NA,Act to alter the provisions of the Constitution,18
NA,relating to finance.,18
Mr COON ,Batman) [11.2] - I do not,18
NA,think I should be ashamed to confess that,18
NA,I rise with some diffidence to address my-,18
NA,self to this question. The fact that I,18
NA,"have been preceded by the Prime Minister,",18
NA,"the Treasurer, the honorable member for",18
NA,"Flinders, the honorable member for",18
NA,"Mernda, the honorable member for North",18
NA,"Sydney, the honorable member for Ken-",18
NA,"nedy, the honorable member for Wide",18
NA,"Bay, and last, but not least, the honorable",18
NA,"member for Darwin, makes my task all the",18
NA,"more difficult, and here I might add that",18
NA,I regret that I have not yet had the plea-,18
NA,sure of being able to read the honorable,18
NA,member for Darwin's speech. I wish to,18
NA,say at the outset that I intend to put my,18
NA,"own case in my own way, and from a lay-",18
NA,man's point of view. The honorable,18
NA,"member for Wakefield, a new member of",18
NA,"the House, delivered from this bench the",18
NA,other night a speech in which there was a,18
NA,"lot of force and energy, and by which he",18
NA,-,18
NA,made out a splendid case for a land tax.,18
NA,He said that our great necessity was land,18
NA,"settlement, that people were flocking from",18
NA,"the country to the cities, and that if this",18
NA,agreement were carried out it would be the,18
NA,"means of settling people upon the land, of",18
NA,"constructing more railways, and of ridding",18
NA,us of the unemployed difficulty. In this,18
NA,connexion it seems strange to reflect that in,18
NA,Victoria a few nights ago a candidate for,18
NA,a vacant seat in the State Parliament said,18
NA,that he was opposed to the land tax,18
