speakerGroups,Speaker,text,pageNumbers
223,Mr BOYD ,"Henty) [3.39] - I was a member of the Public AccountsCommittee in the State Parliament of Victoria, and all the work of that Committee was 1 done during the session. We used to meet in the morning and getthrough everything. I think our Committee can do the same. There will be no justification for paying the members of the Committee.",34
224,Mr FENTON ,"The Committee will have a bigger task, having to deal with the whole Commonwealth.",35
225,Mr BOYD ,"But there will be only one set of accounts. The number of States does not make the work any larger. As there will be no necessity for the Committee to travel, the members of the Committee should not incur any expenses.",35
226,Mr BAMFORD ,"Stat e members are not in the same position as Federal members, who come from all over the Commonwealth.",35
227,Mr BOYD ,"The Committee of Public Accounts will be essentially different from the Public Works Committee. The latter will travel to get their information. The Committee of Public Accounts will call their witnesses to Parliament Hougei and they will only meet during the segsign, Mr W . H . IBVINE - The matter is beyond discussion; because we have not brought down a message from the Governor General .",35
228,Mr BOYD ,"There is no necessity to ' posedbring down a message. There will be plenty of honourable members on both sides who will be glad to work on this Committee, and give what experience they have, and what advice they can.",35
229,Mr KING OMALLEY ,"We should low sufficient to enable a man to offer ice-cream to a witness. . Proposed new clause agreed to. Title agreed to. Bill reported with amendments. Standing Orders suspended, and Bill States. passed through its remaining stages. POSTA LVOTING RESTORATION Bill returned from the Senate, with a message intimating that the Senate in sisted on its amendments disagreed to by the House of Representatives. Motion (by Mr. JOSEPH COOK) agreed toThat the Bill be laid aside. INSCRIBED STOCK BILL . Bill returned from the Senate without amendment. DEFENCE LANDS PURCHASE BILL. In Committee (Consideration of Governor General's message):",35
230,Mr JOSEPH COOK ,"ParramattaPrime Minister and Minister of Home Affairs) [3.47] - I move That it is expedient that an appropriation of revenue be made for the purposes of a Bill for an Act to grant and apply out of the Consolidated Revenue a sum for the purchase of land for defence purposes. The Senate, in the exercise of its powers, having eliminated from the Loan Bill an item providing for the borrowing of £300,000 for the purchase of land for defence purposes, we must make this special appropriation, or throw our proposals aside, and I suppose honourable members do not wish us to do that, because there are various defence works to be carried out in many electorates. Question resolved in the affirmative. Resolution reported, and adopted. Ordered That Mr Joseph Cook and Mr W. H . Irvine do prepare and bring in a Bill to carry out the foregoing resolution. Bill presented, and read a first time . Motion (by Mr. JOSEPH COOK) proThat this Bill be now read a second time.",35
231,Mr FENTON ,"Maribyrnong) [3.50]. - I am pleased to know that this money is to be provided out of revenue instead of being borrowed. I understand that al- £120,000 is needed for the purchase of an a manoeuvre area in New South Wales, which was practically decided on by the' last Administration . I wish to know, therefore, if the Defence authorities in tend to purchase manoeuvre areas in other",35
232,Mr JOSEPH COOK ,I presume that the Department is already in possession of adequate areas in the other States.,35
233,Mr FENTON ,Not in Victoria..,35
234,Mr JOSEPH COOK ,I suggest that the honourable member should reserve his question for another occasion. In this matter we are merely shouldering a. burden left to us by our predecessors-. Question resolved in the affirmative-.. Bill read a second time. In Committee: Clause 1 agreed to. Clause 2 (Appropriation) MONICA,35
235,Mr HIGGS ,"Is the money that is being appropriated to bespent only oni the purchase of land for defence purposes? The clause is specific on the point, but I understood, from something said either in this Cliamber or in the other, that part of the money was to be devoted to some other purpose.",35
236,Mr JOSEPH COOK ,"The appropriation is merely for the purchase of land for a manoeuvre area, rifle ranges, and so on. Clause agreed to. Preamble and title agreed to. Bill reported without amendment; report adopted. Standing Orders suspended, and Bill read a third time. COMMONWEALTH PUBLIC SERVI CE BILL .",36
237,Mr JOSEPH COOK ,"ParramattaPrime Minister and Minister of Home Affairs) [3.54] - I move That this Bill be now read a second time. I have already explained the purposes of the measure. Its introduction has become necessary by reason of the taking over of the Lighthouse Departments of the'States, and the trained men who have been doing the work of those Departments. The Bill will prevent these men from being prejudicially affected by the transfer, because it wil l preserve all the rights and privileges which have accrued to them under State employment.",36
238,Mr THOMAS ,Will the Commonwealth have to pay the pensions of the men takenover 1,36
239,Mr JOSEPH COOK ,It is a matter of arrangement with the Government of the State. We are doing in connection with these men what was done under the Constitution in connection with the transfer of the officers taken over by the Commonwealth at the beginning of Federation. A defect has been discovered in our Public Service Act which this Bill will remedy.,36
240,Mr TUDOR ,"Yarra) [3.56] - The Bill practically amends section 33 of the Public Service Act, which readsAnv person not more than sixty years of age who at the establishment of the Commonwealth was engaged in any office or employment in the public, railway, or any other service of any State shall be eligible for appointment to a position in the corresponding division in the Public Service of the Commonwealth. On the recommendation of the Commissioner the provisions of this Act relating to the examination of candidates to appointments on probation to the division or class or subdivision of class and the age of persons who ma""y be so appointed shall not apply to any such person. Provided thai any person in the Professional or Clerical Divisions of the Public Service of a State may be appointed to the Administrative Division. I understand that the Bill provides that men transferred from State Services to the Commonwealth shall be put in the same position as those who were transferred at the beginning, of Federation. It is proper that the accrued rights and privi leges of transferred officers should be preserved, but we ought to take care not to make it possible for men to get into the Commonwealth Service through the State Services more easily than they can get into the Commonwealth Service direct. It may be that entrance to some of the State Services can be obtained without passing an examination, or by passing an examination which is easier than the Commonwealth entrance examination.",36
241,Mr GROOM ,"This measure will be applied only where large bodies of men are transferred, as in the present instance, or in odd cases. Its provisions are not intended to be used generally.",36
242,Mr TUDOR ,"I grant that, and I admit that the Public Service Commissiouer is very careful, and will always exhaust the Commonwealth Service before going to a State Service for a man. And rightly so, too.. But if we make ib easier for the men to come in from the States than to enter the Commonwealth Service direct, they w i ll not be going up for our examinations, but will go up for the State examinations. I want to make it as easy for men to come directly into our our Service as possible, as well as to cqme in by the by-way of the State Services, if I may say so without offence to the States, because capable men have been in exempt positions in the Commonwealth Service for over twelve months, fulfillin g the duties of their positions well, and are unable to come into the Public Service on account of the working of the Public Service Act. Had they gone for the State Service, they might have got into the Lighthouse, or some other Department, .and bave been transferred fo the Commonwealth Service today. I have no objection to this Bill , but I hope the M i nistry will take the matter I have mentioned into consideration in any amendment of the Public Service Act .",36
243,Mr LAIRD SMITH ,Denison) 4.2]. r - I should like to know from the Prime Minister whether this measure will apply fco lighthouse officers now being taken over Mr THOMAS by the Commonwealth?,36
244,Mr GROOM ,That is the reason f,37
245,Mr LAIRD SMITH ,"I am glad to hear it , because I have in case of a lighthouse engineer, who is really an excellent man, and under the existing Act it is impossible for him be retained in the service of the Comi monwealth. It is exceedingly difficult get engineers capable of carrying out the work as that gentleman has not only in Australia, but in the Old World. I am heartily in accord with measure, because it will do much us to take over some very efficient men who are now in the lighthouse services the various States.",37
246,Mr THOMAS ,"Barrier) [4.3] - Per sonally, I have no objection to the Bill , but and am not going to oppose it . understand that the Bill enables an oflicer that to come over from the State Service our Service, and bring his rights with him ? If a State servant is entitled to a them. pension, and we take him over under this Bill , would we become liable for his sion ? The Prime Minister said the B i l was to enable us to take over a State servant if we required him, ancl we agreed with that, but I understood him to say that, in taking him over, we made his rights secure. Does that imply that i has a right fco a State pension, we have Service. to pay that pension? If so, there will be a tendency to two classes in our SerWill vice.",37
247,Mr JOSEPH COOK ,No ; you cure his accrued rights up to the time he is transferred.,37
248,Mr THOMAS ,Then it means that we would have to pay his pension.,37
249,Mr JOSEPH COOK ,No ; it means the State would pay it under the terms of his transfer.,37
250,Mr THOMAS ,The States will have to agree fco that.,37
251,Mr JOSEPH COOK ,I understand that - that is so with all transferred officers.,37
252,Mr GROOM ,"We take over these cers, and this Bill provides tinuing as Commonwealth public ser- . vants.",37
253,Mr THOMAS ,We agree to that. person The question is who pays the pension.,37
254,Mr JOSEPH COOK ,I think the States do.,37
255,Mr TUDOR ,They pay their proportion for the time he was in the State Service. - I suppose the States would be prepared to do that ; but I or it. understand the Bill goes further.,37
256,Mr GROOM ,It makes a State officer my mind the eligible for appointment.,37
257,Mr THOMAS ,"Decidedly . This Bill goes f u r the r than the existing Public to Service Act, but I am not objecting to t. The Public Service Act enables the to Public Service Commissioner to take over a State officer if he was in a State Serbeen doing, vice previous to 1901.",37
258,Mr JOSEPH COOK ,The Act makes it the mandatory on him to exhaust the Public to enable Service before going outside.,37
259,Mr THOMAS ,"That is quite a difi n ferent matter. The Bill enables the Public Service Commissioner, not only - to take over a transferred officer, any oflicer who entered the Do I State Service after 1901. I think is a very good tiling. The to Prime Minister said that they brought over their rights and privileges with I am quite prepared to support the Bill fco the extent of enabling the penPublic Service Commissioner to take adl vantage of the offer of any State officers who are prepared to come over. I shall be glad to seo the Public Service Act so amended as fco enable the Commissioner to go outside if he can get an abler man f he than there is in the Federal or State",37
260,Dr MALONEY ,"Melbourne) [4.6] this Bill allow a system of pensions to creep into the Commonwealth Service? only seI f so, I should object to that.",37
261,Mr GROOM ,No .,37
262,Dr MALONEY ,"Do I understand that the State will undertake to pay an officer whatever pension he is entitled to that under the State law when he retires from the Commonwealth Service ? If he had remained in the State Service, that pension would have increased as years went on. Will the Commonwealth have to pay fchafc increase, or will it simply pay him his salary from the time he enters the offiCommonwealth Service? Section 61 of for their conthe Act saysFor the purposes of this Act service in the public, railway, or other service of a Slate by any who becomes an officer in the Public Service of the Commonwealth shall be reckoned as service in the Public Service of the Commonwealth. I take it that if an officer had ten years' service with a State, it would give him a position in the Commonwealth Service as if he had served the ten years in that Service. All I want to know is whether a system of pensions will be brought into the Commonwealth Service, because I am absolutely opposed to it . Mr W . H . IRVINE (Plinders-At torney-General) [4.7] - The object of the Bill is to render eligible certain persons who would not otherwise be eligible for appointment. W it h regard to the questions how it may. affect the rights of persons in a State Service having accruing pension rights, and to what extent the Commonwealth incurs any responsibility with regard to those rights, and whether they will increase under the Commonwealth r&gime, we have nothing to do so far as this Bill is concerned. Probably there will be no pensioners taken over, but let us assume that some are. Section 84 of the Constitution makes full provision for officers who are transferred. These not transferred officers, because this B does not deal with transferred Departments. The Lighthouse Department has not been transferred, so that that section does not apply, and there is no constitutional or statutory provision giving these officers who come over any statutory pension rights whatever. The question is what becomes of any pension rights they have. There is no compulsion on them to enter the service of the Commonwealth. The Bill merely renders them eligible should they desire it . Supposing we take over in this case a public servant who is already entitled to accruing ension rights, the question is what is to ecome of those rights, and who is responsible. That must be entirely a matter of agreement. The man need not come over. Supposing he has a pension right worth a capitalized value of £200, whab becomes of it? We may say we invite him to apply, with others, to enter the service of the Commonwealth, but he need not if he does not like to, and he still has his existing rights under Public Service Act of the State. State is bound under the Public Service law still to provide him a place, unless it abolishes his post. If it does, the State has to make provision to do what is just regarding any accrued rights. We are not compelling him to come over, but if he chooses to come, he must make his own arrangements with the State Government. We shall be prepared to give opportunities for such arrangements being made, but shall take no financial responsibility. He will enter our service as a newcomer. The only thing that will differentiate him in any way from a man who enters the Commonwealth Service for the first time is the provision in this Bill which brings him under section 61 of the Public Service Act . That section is quite general in its terms. Taken by itself, however, it would not apply to such a man, because it deals obviously with those transferred under section 60. But it is expressly made applicable by this Bill , and we have to see what it means. It declares that For the purposes of this Act service in the public, railway, or other service of a State by any person who become; an officer in the Public Service of the Commonwealth shall be reckoned as service in the Public Service of the Commonwealth. It is to be reckoned in relation only to are such matters as seniority with regard to ill subsequent promotion, or furlough. If we brought in , say, an elderly man who had been in the service of a State for some years, we ought to offer him for these purposes the same rights fchafc he would have if he had been fro m the commencement in the service of the Commonwealth. Bufc the Commonwealth will not take over any responsibility with regard to that man's accrued rights. In all probability he would be a non-pension officer, but would have an insurance policy, and if he chose to keep it in force well and good.",37
263,Mr THOMAS ,I think the explanation is quite sufficient.,38
264,Mr FENTON ,Suppos e he came over with pension rights? Mr W . H . IRVINE - He could not come over with pension rights. Before he came over to the Commonwealth Service he would make his bargain with the State Government as to what was to become of those rights. No doubt the State the Government concerned' would treat him The fairly .,38
265,Mr JOSEPH COOK ,Buf c if he resigned from the State Service he would for f e it his pension rights in connection with it . Mr W . H . IRVINE - Yes ; if this Bill were not passed he would.,38
266,Mr JOSEPH COOK ,"Therefore , this Bill is designed to conserve his pension rights. Mr W . H . IRVINE - It is to give him an opportunity to enter into an agreement with the State which will preserve his pension rights.",38
267,Mr FENTON ,"If a man t h i r t y years in the State Service, and only ten years in our Service, should we have to pay him his pension when he retired ? Mr W . H . IRVINE - We should pay him no pension whatever. It would be entirely a matter of arrangement. The State might say, "" If you like to go over to the Commonwealth Service, we will abolish your office and give you now the value of your pension rights.""",39
268,Mr THOMAS ,"O r it might offer to find another billet for him. Mr W . H . IRVINE - Q u it e so. This is simply to get over a technical bar to applications by men who desire to apply, and whom we might like to take over. ""Question resolved in the affirmative. Bill read a second time, and reported from Committee 'without amendment. Motion (by Mr. JOSEPH posedThat the report be adopted.'",39
269,Mr HIGGS ,".Capricornia) [4.22] - I should like to .draw attention to the magnanimity which is being displayed by .the Opposition. We find in clause 1 a number of provisions which ought really to be dealt with in separate clauses. This is only another instance of inefficiency on the part of the Government and of 'the undue haste with which legislation is being passed. Question resolved in the affirmative. Report adopted. Standing Orders suspended, and Bill read a third time. SUSPENSIO N OF SITTING .",39
270,Mr JOSEPH COOK ,"ParramattaPrime Minister and Minister of Home Affairs) [4.25] - I wish to suggest, with the concurrence of the House, that the sitting be suspended u n t i l 8 o'clock this evening.",39
271,Mr HIGGS ,No .,39
272,Mr JOSEPH COOK ,"Will the honlittle orable member be good enough to listen? A number of Bills have been rapidly that the Clerks at the table have not had time to prepare them for transmission to another place, and it is to give all? them a little time to do this work that I submit this proposal.",39
273,Mr THOMAS ,Why not adjourn u n t i l tomorrow ?,39
274,Mr JOSEPH COOK ,I should not hesitate to move the adjournment had been House u n t i l tomorrow but for the work that will be coming down from the Senate.,39
275,Mr HIGGS ,We want to discuss p r ivate members' business.,39
276,Mr FENTON ,The Leader of the Opposition asked this morning whether an opportunity would be given for the discussion of the Constitution Alteration Bills brought down from the Senate. Could we not go on with their discussion?,39
277,Mr HIGGS ,I beg to call attention to the state of the House. [Quorum formed.'],39
278,Mr JOSEPH COOK ,"We have put through a number of little measures today; and I am suggesting this brief adjournment to enable the Clerks to catch up to their work. By 8 o'clock this evenCOOK) proing, I hope that some of the Bills now before the Senate may find their way here. I make the suggestion with a view to the winding-up of the business of the House; and the courtesy I ask is never denied to a Government at this stage of the session. Under the circumstances, I ask the honourable member for Capricornia not tp press his objection.",39
279,Mr HIGGS ,Capricornia) [4.30] The Prime Minister has said,39
280,Mr SPEAKER ,I remind honourable members that there is no question before the Chair-that no motion has been made. Is it the desire of the House that I leave the chair until 8 o'clock?,39
281,Mr HIGGS ,I object.,39
282,Mr TUDOR ,We cannot keep the Speaker here if he chooses to leave the chair.,39
283,Mr MATHEWS ,Why not go on with the consideration of the Referenda Bills?,39
284,Mr JOSEPH COOK ,"Do honourable members not see that, in order to enable us to deal with Bills, the Clerks must be in the chamber; and it is to give them a respite, and to enable Bills to be prepared for the Senate, that I am sugpassed so gesting an adjournment.",39
285,Mr TUDOR ,Why meet to-night at B,39
286,Mr HIGGS ,"I have been prevented from speaking, and I must say",39
287,Mr JOSEPH COOK ,"Ver y well, then, let us go on. Honourable members are "" bossing "" things in the Senate, and of the wish to do so here!",39
288,Mr SPEAKER ,"As there is nothing before the House, and this discussion is irregular, I shall suspend the sitting u n 8 o'clock this evening Sitting suspended from £.35 to 8 p.m. NORFOLK ISLAND BILL . Bill returned fro m the Senate with a message intimating that it insisted on two amendments disagreed to by the House of Representatives. DEFENCE LANDS PURCHASE Bill returned from the Senate without amendment. BUREAU OF AGRICULTUREBILL . measure. SECOND READING , Debate resumed from 12th December (vide page 4260), on motion by Mr . JOSEPH COOKThat this Bill be now read a second time.",40
289,Mr HIGGS ,I draw attention to the state of the House. [Quorum,40
