speakerGroups,Speaker,text,pageNumbers
116,Mr FINLAYSON ,"Petty buildings costing £ 2 0 , 0 0 0! The Railway Departof Queensland is in a better position Goto build this line than is any private It has the necessary plant within a comparatively short distance of It has The day Government propose, however, that the work shall be given to a contractor, which' nie'arisf that we shall have to pay for the cost, not only of constructing the line, but' of the plant as wellj whereas if n - we handed over this work to the Railway"" His Department of Queensland we should have'to pay for only a proportion of the' The' Government' p'r'opose to throw in ' away thousands of pounds.",23
117,Mr RICHARD FOSTER ,We shall Save' thousands.,23
118,Mr FINLAYSON ,"The only advantage connected with"" the"" Government proposal is that' it ' will give' us one more illustration of the viciousness of the contract system of railway construction as contrasted with the' building of railways sys under the day-labour system. : It ' is no stretch of prophecy tb say that if Comthisrailway is built by contract we shall find, when we have the facts before us in regard tb cost and necessary equipment, ! that it has cost at least £1,00 0 more per mile than is involved in the build1 ing of railway lines on the Queensland we want the side of the border. Th'e CHAIRMAN - There is a ten1 State dency on this amendment to discuss the whole question' of day labour. I must ask honourable members to confine their attention to the question of the construction of this line.",23
119,Mr HANS IRVINE ,"Grampians) [12.26] - In reply to the honourable member for Brisbane, I should like to say - that I read last night a statement in a newspaper to the effect that in Western Australia the Wilson Government constructed a railway under the contract system at a cost of £1,400 per mile, whereas it cost the Scaddan Government, under the day-labour system, £2,000 per mile to build a line running through the same class of country. The difference is due to the fact that under the day-labour system we do not get the best results from the workers. In nine cases out of ten it is based on the principle that there should be no work between meals, and that is what honourable members opposite want. The day-labour system is a bad one to adopt. Let tenders be invited for this work. Give the Department an opportunity to - tender, and if in open competition it can secure the contract, let it carry out the work. Under the rSgime of a Socialistic Labour Government in Western Australia we have had an illustration of the costliness of the day-labour system as applied to railway construction, and We have also had an illustration of its costliness in New South Wales during the last three years.",24
120,Mr WEST ,What has happened in New South Wales?,24
121,Mr HANS IRVINE ,"The people have declared themselves to be in favour of the bribery and corruption which your party are supporting. The State Labour Government when it took office inherited a surplus of over £2,000,000. the largest revenue that had ever been raised in the State",24
122,The CHAIRMAN ,Order !,24
123,Mr HANS IRVINE ,"It borrowed nearly £20,000,000",24
124,Mr CHARLTON ,I rise to a point of order.,24
125,Mr HANS IRVINE ,"And closed its three years of office with a deficit of over £2,000,000.",24
126,The CHAIRMAN ,The honourable member is quite out of order in referring to that matter.,24
127,Mr HANS IRVINE ,"I admit that I am, sir; but I have simply told the truth . The figures I have quoted show unmistakably the added cost of day labour as compared with contract work.",24
128,Mr ARCHIBALD ,"Hindmarsh) [12.30] - It is a matter of regret that the present Government show hostility to the day-labour system - In my opinion, it is always better that the Government should have freedom of action.",24
129,Mr GLYNN ,That is all we desire.,24
130,Mr ARCHIBALD ,"On the other hand, I am inclined to think that the Government are, to a certain extent, pledged to the contract system. It is, as I say, a great mistake to bind the Government down in this regard, because there may be times when it is desirable to have work done by contract, and other times when day labour may. be preferred. I am rather surprised at the tirade of the honourable member for Wakefield, and at the prejudice he has displayed in relation to day labour. No one knows better than that honourable member that great savings have been made in South Australia in consequence of the Government undertaking the construction of their own railways.",24
131,Mr RICHARD FOSTER ,"Yes , fifteen years ago; but I can show a 60 per cent, added cost on the other side.",24
132,Mr ARCHIBALD ,"The honourable member will not deny that the contractors for the overland railway from Adelaide to Melbourne made a remarkably "" good thing "" of it . Mr RICHAR D "" FOSTER - I am talking of today, and not of twenty-five years ago.",24
133,Mr ARCHIBALD ,"The honourable member was in ofiice when the contract system was superseded by the day-labour It had system; and, truly, the evolution of politicians in Australia is marvellous! I know men who at one time were strongly in favour of day labour, and who can now scarcely find language vivid enough to denounce it . This ought not to be a matter of politics-it is simply a matter of' fact.",24
134,Mr RICHARD FOSTER ,It is a matterof the taxpayers' money!,24
135,Mr ARCHIBALD ,"We are trusteesfor the taxpayers, and it is our duty to see that public works are carried out by the cheapest and most efficient method, i r r e spective of party. We know that railwayconstruction has been undertaken by the various State Governments, and that the work has proved cheaper than under contract.",24
136,Mr RICHARD FOSTER ,"Yes , ten or f if teen years ago!",25
137,Mr ARCHIBALD ,"We have the evidence of a Conservative Minister in Queensland, who said that, in regard to day labour, he had heen "" reluctantly compelled "" to alter his opinion. I regret the remarks of the honourable member in regard to South Australia, because we have not the figures here to enable us to judge.",25
138,Mr RICHARD FOSTER ,I have figures here-the tenders.,25
139,Mr ARCHIBALD ,"No doubt the honourable member has the figures for one side, and, unfortunately, my experience of recent years is that there is always another side to any remarks he may make. The Queensland evidence, to which I have referred, is of today, and not years ago; and I think that our distinguished and learned friend the Attorney-General could tell us something about the price of locomotives in Victoria under the contract system. Of course, I do not deny that day labour under a weak Government, with poor organization, may prove expensive; but in Queensland, and, as matters wore in South Australia, for in stance, there is every guarantee that the taxpayers' interest is conserved. The assumption of the late Government, in instituting day labour, was that the work would be properly organized. Another example of a saving under day labour is presented in the Commonwealth Offices in London.",25
140,Mr RICHARD FOSTER ,We cannot find out what the cost has been.,25
141,Mr ARCHIBALD ,"I do not think there would he any difficulty in finding out; and I have no hesitation in saying that, when the accounts are produced, we shall find a similar result to that obtained in Queensland. I regret that the honourable member for Wakefield should have raked up the matter of the Government Printing Office in Adelaide.",25
142,Mr RICHARD FOSTER ,"I "" rake "" it up.",25
143,Mr ARCHIBALD ,"Such mi«ht very well be made in Adelaide, where the necessary information to confirm it, or otherwise, is available. At any rate, we have the fact that the master printers in Adelaide, in applying to the Government for work, desired that the tenders of the Government Printing Office should be loaded to the extent of 10 per cent.; and this cloes not look very much as ifthat establishment were a sink for public money. If the printing work for this Parliament were done by a private firm, the extras in volved in the fact that the office would have to be practically kept going day and night, would be staggering.",25
144,The CHAIRMAN ,The honourable member must not discuss that matter. t-Re,25
145,Mr ARCHIBALD ,"The honourable member for Wakefield wandered a b it , and I thought I would keep hi m company. If freedom of action were left to the Government, as I think it ought to be, I feel pretty confident as to the course that would be pursued by the Minister in charge of this Bill ; but members of the Government, and their supporters, have gone throughout the country declaring that they are in favour of the, contract system, and this, of course, makes honourable members on this side somewhat suspicious. The contention that day labour is unsatisfactory is all nonsense, for the simple reason, as I have pointed out before, that it all depends on the organization; and it is an insult to the Government, and to the army of trained engineers who are at their service, to suggest that they cannot successfully carry out public works. We all know what happens when, under # private contracts, the - specifications are departed from ; and in this connection alone there must be great savings under the system of day labour, which permits variation as the circumstances demand.",25
146,Mr GLYNN ,"The amendment would prevent a modified contract system, which was one of the suggestions I made. The amendment ties my hands; and I think that the modified system would be the best for the men.",25
147,Mr ARCHIBALD ,"F o r many years past I have been in favour of what is called the "" but t y g a n g "" system, which has worked very satisfactorily. For the reasons I have given I think the did not amendment of the Seuate ought to be accepted.",25
148,Mr SAMPSON ,"Wimmera) [12.42]. The time has passed for a general discussion on the relative merits of the day-labour and contract systems. One of the objections I - have to the amendment is that it ties the Government down to one course of action, and presents no opportunity f « r comparison between the two systems. The Northern Territory is very isolated, and, considering its distance from the seat of government, the danger of lax supervision is very much increased.",25
149,Mr FALKINER ,That is trouble in regard to day labour-the supervision.,26
150,Mr SAMPSON ,"Quite so. are times when advantages in both systems might be discovered in practice. In Victoria some years ago, after the appointment of the Railways Standing Committee, certain railways were, on the recommendation of that body, constructed by day labour, but the whole administration, through the investigations of the Committee, was revolutionized, so that there can be no analogy drawn, or com; parison made. Under the circumstances, day labour having apparently proved so beneficial in Queensland, it seems to me that there is good reason for giving the Queensland Government an opportunity ito tender for this railway.",26
151,Mr THOMAS ,Does the honourable member suggest that the Queensland Government will tender ?,26
152,Mr SAMPSON ,I understand that in South Australia the Government tender for Government work.,26
153,Mr THOMAS ,"Yes , for their own work; but would the Queensland Government tender for Commonwealth work ?",26
154,Mr SAMPSON ,The honourable member for Brisbane suggested that we should get the Queensland Government to construct this line.,26
155,Mr THOMAS ,That is a different thing.,26
156,Mr SAMPSON ,"If the Queensland Government have all the necessary equipment, why should they not undertake the work? 1 for Wakefield has placed in my hands some very interesting figures in regard to South Australia. In the case of the Brownlow railway, a line 90 miles in length, tenders were called from outside contractors, and the Government itself also put in a price. The figures show that the Government tender was £155,000 The next tender was submitted by a private contractor for £105,000, and the tender that was accepted was from a private contractor for £89,000, or 60 per cent, lower than the Government tender.",26
157,Mr LAIRD SMITH ,But what did he get?,26
158,Mr RICHARD FOSTER ,There were practically none.,26
159,Mr SAMPSON ,"I think it must be clear that if we are to carry out our i m portant works by day labour, without the whole having any of the disciplinary elements of competition, our works will necessarily be expensive. I do not intend to talk There about the element of "" Government stroke "" ""referred to by some honourable members; but when we eliminate competition we set up an expensive system of carrying out works, whether under private or under Government supervision. In my own district, postal work has been done by day labour, and it has been fairly expensive. I quite realise that there are small works that may be carried out by the Government under the day-labour system, because the Government have their own plant, and contractors cannot be got to tender for work in every part of the country.",26
160,The CHAIRMAN ,I cannot allow anything but an occasional reference to matters outside railway construction.,26
161,Mr SAMPSON ,"I was merely using the outside work as an illustration. I was saying that the day-labour system may be employed by the. Commonwealth in certain small works; but I hold that important public works, involving the expenditure of hundreds of thousands, should be treated in a different fashion. The Commonwealth Parliament, as trustees of the public money, should not spend that money in the way it thinks fit, or as a matter of patronage, or at the dictation of any section of the community. It is our duty to spend the money of the public to the very best advantage, and, in accordance with our wisdom, to devise means of carrying out public works in the most economical way. The honourable member We are not justified in introducing a system which prevents the Government carrying out those works with the elimination of those elements of competition that are necessary to bring about the best results from the expenditure of public money.",26
162,Mr RILEY ,"South Sydney) [12.50]. - I hope that supporters of the Ministry will look at this question from a different stand-point. If we are to invite contractors to submit tenders for the construction of a railway in the Northern Territory, quite away from regular supextras plies and from bodies of men, they must add to their prices a very large margin. I know something about contracting. If I tendered for this work, I would a certain margin, because of the great risk that country. I should run in getting labour there.",26
163,Mr RICHARD FOSTER ,The ment run the same risk.,27
164,Mr RILEY ,"But the difference that if the Government frame a high estimate for the work, and there is saving effected, the Commonwealth benethey fits by the saving; whereas the contractor who submits a high price on account of the risks, and effects a saving, gets all the advantage. Another point is that a conprice tractor must take a complete plant to Northern Territory, and it will not him to take it away again. Mr RICHA BD FOSTEB - The Governployed. ment will have to do the same.",27
165,Mr RILEY ,"No . As the Governrisk ment intend to continue a railway policy extras. there, the plant required for the construction of 50 miles of railway will come in handy for future extensions, and it fore. can be stored in the Northern Territory. We must look upon the building of this railway as an experiment. I tenders certainly there will be a very high price placed upon the construction of the line; but if the Government decide to build the railway, though the estimate of the Department may also be very high, any saving effected will be secured by the Government. will be able ito get people to go there work for them more readily than private employers can. Men always Government employment, because their for money is secure, and, as a rule, they are railway. not bullocked so hard. Not only has contractor to reckon on paying higher wages to induce men to go to the thern Territory, but he must add 10 cent, or 15 per cent. gencies, which there is no need f o Government to do. The surveyors may alter a route, or build two arches instead of one over a river, and if the work being carried out by contract, and specification is altered in one detail, contract is broken.",27
166,Mr LAIRD SMITH ,"And then the f u n £1,000 less per mile than starts.",27
167,Mr RILEY ,"When a contractor a contract; especially from the Governis ment, his first aim is to get away the contract.",27
168,Mr FALKINER ,"If he can do so, does it not show inefficiency on the part of the Department ?",27
169,Mr RILEY ,"No surveyor or draftsput on man can be absolutely accurate in There will certainly be alterations to the original plans; Governand it is no reflection on the Department if they are made. Choosis ing a lighter grade may save hundreds of thousands of pounds in haulage. anyThese things always happen, but when do occur the contractor claims that the contract has been broken, and that he need not build the railway in a certain time. All these things tend to keep up the of a work under the contract system. the Under the departmental system of carrypay ing out a work by day labour the best brains in the Department can be emThe line can be shifted, the grades can be' altered, and yet there is no of running into large expense for",27
170,Mr JOSEPH COOK ,I wonder if we have not ever discussed this question beMONICA,27
171,Mr RILEY ,We have; but we cannot let the statements of honourable members f we call for go without some reply.,27
172,Mr JOSEPH COOK ,I am afraid honourable members on both sides are alike.,27
173,Mr RILEY ,"Honourable members representing South Australian constituencies have said that the construction of The Government railways in New South Wales under the and day-labour system has cost more than construction under the contract system. prefer There has been a great deal of criticism, example, of the North Coast That line has been conthe structed at Tess than the Government estimate, though heavier rails have been Norlaid down, and the grades have been per altered, and Mr Wade, Leader of the Opf o r emerposition in New South Wales, notwithr the standing the onslaught he made on this railway, has been compelled to admit that the line has cost less than the original is estimate. Mr Holman, the Premier of the New South Wales,"" has pointed out that the the policy of building railways in New v South Wales by day labour has cost building under the contract system. The Railgets way Commissioner in New South Wales not bound to carry out any deviations from in railway construction by day labour; he can let contracts; but all the deviation work on the Blue Mountains has been carried out departmentally under the day labour system, and the work had been done cheaper than under the former system of contract workMONICA",27
174,Mr FALKINER ,l t the supervision effective it should he cheaper.,28
175,Mr RILEY ,"Thaf c is the whole thing. If the supervision is right, and the men employed are not delayed in the matter of material, the Government ought to construct a work by the day-labour system at least as cheaply as any contractor can do it .",28
176,Mr JOSEPH COOK ,"Do you not that we might experiment in a better place than in the Northern Territory? Why tie the hands of the Government in regard to the Northern Territory, when the great tiling ib to get anything done in any circumstances ?",28
177,Mr RILEY ,"I was pointing out at the outset of my remarks that it was a great experiment to ask a contractor to take labour to the Northern Territory and build this railway, and that as the contractor would be taking so many risks, ho would be sure to put up his price, and thus the building of the line would be more expensive.",28
178,Mr JOSEPH COOK ,But why hands of the Government up there above all other places?,28
179,Mr RILEY ,"The Government have announced their policy as a policy of assisting contractors. We, on the other hand, stand for a policy of day labour. Mir. JOSEPH COOK - Are you not madly running your theory by starting it in the Northern Territory?",28
180,Mr RILEY ,"No . The Government have the land surveyed and the plans, and all they require are the men and material, so that there will be no risk in building this railway by day labour.",28
181,Mr JOSEPH COOK ,You are with this Bil l as you never thought of dealing with the Bills of your party. Is that fair treatment or fair play?,28
182,Mr RILEY ,T f the Labour party were in power we would insist on this railway being built by day labour.,28
183,Mr JOSEPH COOK ,You would give a thought to it .,28
184,Mr RILEY ,"In my opinion, the Senate had a perfect right to amend the Bill in this direction, and I shall give m j vote lo support their action, because it is in the interests of the country. I resent the aitacKS ""that have been made on working men. It is said that because men work with picks and shovels they go in for the Government stroke. I resent tMs slander upon them. Workmen have done is just as good work for the Government as has been done for private contractors. The Prime Minister will remember that when he was Postmaster-General in New South Wales he carried out that splendid work of constructing telephone tunnels through Sydney. He increased wages to the men, and tlte tunnels were made three inches iarger, necessitating the use of think millions of bricks more, yet ""the whole work was done under the day-labour system in better style and at a saving of £29,000. The first section of the tunnels was carried oufc by contract at so much per cubic yard, and when the work was measured up and compared ""with what was done with day labour, this saving was shown to have been made. In addition the Government paid men with horses and drays two shillings a day more than the contractor paid. W it h these facts before me, I cannot support any proposal to bring about the pernicious system of letting contracts. The contractor always tries to get more .out of the worker. I have worked as builder on contract aud tie the on day labour, aiid my experience is that the Government will get"" a better class of men, that the men will get a better deal from the Government than from private contractors, and that this work will be constructed cheaper by clay labour than by letting a tender.",28
185,Mr WEST ,"East Sydney) [12.59] - I have no desire to be dictated to by the Senate. The Senate is supposed to represent the States, and two States-Ne w South Wales and Queensland-hav e decided that the work of building railways shall be carried out by day labour. dealing Sitting suspended from 1 to 2.30 p.m.",28
186,Mr WEST ,"Whether the Senate, i u making the amendments, is playing a sensible game, or is merely endeavouring to show its strength, is a, matter that does not concern this Committee, so long as the Senate has not exceeded its connot stitutional powers. It may be thought that there would be a loss of dignity in accepting this amendment, but that consideration should not receive much weight, because we have*already accepted another amendment made by the Senate in this Bill , and have accepted amendments made by it in several otherBills. Those who have visited the Northern Territory will agree that it would be abaurd to attempt to construct the proposed railway by contract. No contractor would tender for the work except at an extravagant price: Por one thing, the proposed line begins at a"" place 150 miles away from Port Darwin, and there is no timber suitable for railway construction between Port Darwin and Pine Creek, so that practically all the material required would have to be carried over the existing railway. Again, were a private contractor to tender for the work, he would have to make a heavy charge to cover contingencies. He would be greatly handicapped in the obtaining of labour. The .nearest place at which he could get the necessary labour would be somewhere in Queensland, and it would cost a good deal to take men to the Territory, even from Queensland. Men going there would require some security, and it would be much easier for the Government to obtain labour than for a contractor to do so. The proposal of the Senate is one whose adoption would serve the interests of the taxpayers. We are told that the measure is urgent because it is desirable to proceed with the making of the railway at once. But if the contract system be adopted, there, must be delay, because no contractor will tender until he has gone over the route and carefully considered the specifications. There are not many engineering difficulties along the route. The country is level, so that there would be no grades of more than 1 in 200, and not many bridges will be needed. The MCDonald, the Mclntyre, and the Perguson Rivers will have to be crossed.",28
187,Mr GLYNN ,And the Edith River.,29
