speakerGroups,Speaker,text,pageNumbers
315,Mr SHARPE ,"We should have some opportunity to discuss the Bill and know its principles. The man on the land desires more opportunity to improve his condition ; but this Bill will not help in that direction. We are told by honourable members opposite that many people in different parts of the world grow three or four times the amount of produce on their land that we can grow here, because they have a proper analysis made of their soil, with the assistance of their Governments.",45
316,Mr FALKINER ,Where is this?,45
317,Mr SHARPE ,"Germany , Switzerland, Holland, and France. The men who came into this Parliament as champions of the farmers, have remained silent so far as this Bill is concerned. They have not raised their voices in favour of the farmers.",45
318,Sir ROBERT BEST ,What suggestions does the honourable member rr.akeT,45
319,Mr SHARPE ,I think that the Bill should be drafted . on more liberal lines. Provision should be made for the analysis of soils and the teaching of farmers as to the crops for which their lands are most suited.,45
320,Mr RODGERS ,Rea d the Bill .,45
321,Mr SHARPE ,It would be idle to read it at this hour. I know that the Government are not sincere in bringing l l it down. If they were they would tell as what it is going to cost the country.,45
322,Mr SPEAKER ,The honourable member must not impute insincere motives to the Government.,45
323,Mr FLEMING ,"Surely the Government have not placed on the Estimates merely for f u n an item of £5,000 in connection with this Bureau. Mr SHARPE . ^ - T h at amount should be expended in carrying on the work of the Bureau. Of the new members supporting the Government, only two or three representing rural districts haveaddressed themselves to this question, although when they were before the people they were all most emphatic in their declarations that they intended to do much to bring about improved conditions for the man on the land. This Bill should have been brought down earlier in fei\*» session. The Opposition are most anxious to improve the conditions of the man on the land, and we feel that a Bill of this character, if drafted on broad lines, must tend to help them considerably. We have been told that the Scottish Commissioners, who visited Australia recently, were not altogether pleased with their trip to Queensland, because they found that all the most suitable laud had already been taken up. As a matter of fact, we> have in Queensland vast areas that could be put to a more profitable use than that to which they are at present devoted. I cannot vote for the Bill in its present form.",45
324,Mr GROOM ,"Le t us get into Committee, and the Government will be prepared to consider any reasonable amendment that the honourable member may propose.",46
325,Mr SHARPE ,"If the Government will accept certain suggestions, which I think will tend to improve the Bill , then I shall be prepared to let the second reading go. A few years ago Sir Hector Carruthers, when Minister of Lands in New South Wales, decided to institute a most rigid inspection of dairy cattle, and the result of that inspection was that probably nearly one-half of the dairy cattle of the State were condemned.",46
326,Mr FLEMING ,Nothin g like one-half.,46
327,Mr SHARPE ,"The honourable member knows nothing about the matter. I can speak from experience, because I was living at the time in a dairying district.",46
328,Mr FLEMING ,And I was representing a dairying district in the New South Wales Parliament.,46
329,Mr SHARPE ,"The dairymen of the State were greatly incensed at this action on the part of the Government, and shortly afterwards the system was dropped. Since then, however, dairymen in the South Coast district, fro m which Sydney draws its milk supplies, have expressed their regret that the inspection was not continued, for if it had been they believe that there would have been healthier and more profitable dairy herds in the country. Do the Government propose, under this Bill , to provide for the inspection of stock? They occupy their present position only temporarily, and we must take them for what they are worth, but if this Bill be not passed this session, they wil l probably tell the people that it was i m possible to pass it , owing to the opposition of the Labour party.",46
330,Mr TUDOR ,"Member s of their own party have "" stone-walled "" it .",46
331,Mr SHARPE ,"I am prepared to meet whatever criticism they may indulge in. wi\ h regard to our attitude, and since the Minister of Trade and Customs has promised to give us an opportunity to move amendments in Committee, I shall not further detain the House.",46
332,Mr ARTHUR ,"Bendigo) [8.57] - It is not my intention to detain the House by entering upon a discussion of the general merits of this Bill , since I believe that fchey are well recognised. Nearly every member of every party who has sat in this House has afc one time or another expressed his approval of the proposal, and if it were for no other reason than that it will extend in some degree the activities of the Commonwealth into an area where beneficial results must be achieved, I should give the Bill my support. This question came before the House as far back as 1901, when the ex-member for Bendigo movedThat, in the opinion of this House, a National Department of Agriculture and Productive I ndustries, on the same lines as that of the United States of America, ought to be organized and maintained in connection with the Government of the Commonwealth.",46
333,Mr TUDOR ,That was one of the first motions to be submitted in this Parliament by a private member.,46
334,Mr ARTHUR ,"That is so, and I find that it was supported by the greater part of the talent of the House.. If it were necessary, I would refer honourable members to the very elaborate memorandum on the proposed Australian Bureau of Agriculture which was prepared by the present Minister of Trade and Customs when he was Attorney General in 1908. It will benefit honourable members if they read that document, and consider in detail all the ramifications of the matter. R u t what I wish particularly to refer to is the question of the constitutionality of the Bill . I have not come to any conclusion on the point, but a great number of doubts have been raised by constitutional authorities as to the power of the Commonwealth to appropriate money for anypurposes other than those mentioned in section 51, which specifies the powers that may be exercised by the Commonwealth. In that section, there is no reference whatever to encouraging or fostering agriculture, or anything of the sort, and therefore it is a question whether the Commonwealth can spend money for the purposes of this Bill , or any purpose not there mentioned.",46
335,Sir ROBERT BEST ,The member does not think that as a lawyer?,47
336,Mr ARTHUR ,"Mr Speaker just now - called an honourable member to order for imputing motives of insincerity, and I think that the honourable member for Kooconstitutional yong is imputing such motives to myself. I ask that the honourable member shall withdraw the words.",47
337,Mr SPEAKER ,I ask the honourable member for Kooyong to withdraw the words complained of.,47
338,Sir ROBERT BEST ,"If the honourable welfare"" of the Commonwealth. member is serious, I shall, of course, withdraw the words.",47
339,Mr SPEAKER ,I took the remark being merely jocular.,47
340,Sir ROBERT BEST ,Of course it was.,47
341,Mr SPEAKER ,"If , however, words are regarded as offensive by the honourable member for Bendigo, they must be withdrawn.",47
342,Sir ROBERT BEST ,"Certainly , Speaker, I withdraw them.",47
343,Mr ARTHUR ,"Perhaps I made too much of the honourable member's jocular remark. In support of the view I indicating rather than expressing any support of- a probable view fora constiin tutional lawyer to take- I may say that Mr Justice Higgins, when a member of this House, expressed one exactly similar in 1903. He was then dealing with Naval Agreement Bill , which was somedo thing outside the ordinary purposes of fence as laid down in the expressed powers of section 51. When Mr Justice H i gins was speaking, Mr Deakin saidThe honourable and learned member's argument implies that the power to make appropriations is limited by the legislative powers conferred by section 51. Mr Higgins - Yes . Under the States Constinot tutions, very much wider powers are conferred, and so on. We know, as a matter of fact, that the United States of America tablished a National Bureau of Agriculture, but the powers under the United extent States Constitution are very much wider than our own in this respect. Congress is given expressed power to spend money wealth."" for the purposes of the ""general welof fare."" On anything that may be conof sidered for the general welfare, the branch United States Government may spend extend money, but our Constitution, as I say, is general much more limited. Section 81 of our taxation Constitution saysA l l revenues or moneys raised or received by - he Executive Government of the Common[105]- 2 wealth shall form one consolidated revenue fund, to be appropriated for. the purposes of the Commonwealth in the manner and subject to honourable the charges and liabilities imposed by this Constitution. That that excludes any appropriation of this kind is borne out, I think, by sound reason. If we are able to spend money for this purpose, we are able to spend money for any other purpose which seems good to us-that is, if our power of spending money for the "" purposes of the Commonwealth "" is equivalent to spending money for the "" general We may, from this point of view, spend the m'oneys raised by taxation for any puras poses we choose, and it is the doubt in that regard that I desire to express. Can this be done? Can we spend the money the we raise for any purpose, whether that purpose is, or is not, outside the scope of our legislative powers? Professor Harrison Moore, in his Commonwealth of AusMr tralia, which is well known to many honourable members, deals with this subject; and if the honourable member for Kooyong, who is also a lawyer, will am read what is said by the Professor, he will see that there is some substance the position X present. I personally hope there is no substance in it , because I desire this Bill to go through, regarding it , as I do, as a measure which will prove the of benefit to the Commonwealth. But we not desire to pass such legislation if dethere is any doubt, without having that doubt expressed and considered by the gHouse. It is for that purpose only I rose to make this contribution to the debate.",47
344,Mr AHERN ,Whic h way is the honourable member going to advise us?,47
345,Mr ARTHUR ,"U n for t u n at e l y , it is my function, but that of the At to rney-General, to advise the House on such matters. At page 523 of his book, Prohas esfessor Harrison Moore saysA very important question arises as to the of the power of appropriation. By section 81, the Consolidated Revenue Fund is "" to be appropriated for the purposes of the CommonUnquestionably the Commonwealth may appropriate money for the maintenance its Government and for the execution of any the objects which have been committed to any of it. Does the power of appropriation beyond this so that the Parliament, having a general power of taxation, has an equally power to extend the proceeds of that as it thinks fit without regard to whether the object of expenditure is for the purpose of an incident to some matter which belongs to the Federal Government? That is the question he puts, and he goes on to sayIn the United States, after keen controversy, it is now agreed that "" the power of Congress over the Treasury is, in effect, absolute, and extends to the appropriation of money for any object which in their judgment will conduce to the defence of the country or promote its welfare."" This, however, is under an express power to "" provide for the general welfare."" Professor Harrison Moore deals with a similar position in Canada, which has also expressed powers, and on the following page he saysThere is, moreover, what appears a vital distinction between the United States and the Commonwealth Constitutions in that, in the former, the proceeds of taxation are the unqualified property of the Federal Government, subject to no claim by any one else. Professor Harrison Moore points out that in our Constitution there is a claim which the States may have on the surplus revenue, and that, therefore, there is somebody, or there was before the Financial Agreement came into operation, who could make a claim if the money were spent for purposes other than those specified in the Constitution.",47
346,Mr AHERN ,Was that claim not dissipated by the Financial Agreement?,48
347,Mr ARTHUR ,"Professo r Harrison Moore says that the claim might go, but that does not affect the construction. The Constitution must be construed, not by future events-no t by things which happen afterwards-bu t by the document as it stood originally. the Constitution we have the fact that the States can claim the surplus revenue, and, therefore, they have say whether the Commonwealth shall spend its money on this or that thing. Professor Moore points out a further fact that is important. If honourable members will look at section 51, they w i ll see there are all sorts of directions as to ways in which the moneys may be spent. If the Commonwealth has power to in any direction it pleases, what object was there in placing in the Constitution those particular directions? Honourable members will remember that there power to give bounties; and there would be no necessity for that, if the CommonAttorney-General wealth has power to spend for any purnamely, poses it chooses.",48
348,Mr GROOM ,Coul d we not spend money in connection with quarantinable diseases affecting animals and plants?,48
349,Mr ARTHUR ,That would probably come under the power relating to quarantine.,48
350,Mr GROOM ,The proposed appropriation is one for the investigation of those diseases.,48
351,Mr ARTHUR ,"I am speaking of the general position. The Commonwealth is taking up a position which, I hope, it cat* take up ; and I hope that, if it has the power, that the power will be exercised.",48
352,Mr GLYNN ,"This was discussed at great length last session, and we thought we had the power.",48
353,Mr ARTHUR ,"That was for another purpose altogether, namely, the maternity allowance.",48
354,Mr GLYNN ,But the points that would * guide us now were taken into consideration.,48
355,Mr GROOM ,"The maternity bonus goes all to pieces if the honourable member's, contention is correct.",48
356,Mr ARTHUR ,"Honourable members who were then i u Opposition, bufc a,re now on the Government side, apparently had not the courage to tackle this important point.",48
357,Mr GROOM ,I can assure the honourable member that there was courage here even before he came into the House.,48
358,Mr ARTHUR ,"The opposition to the maternity allowance on this ground was not, I think, pressed with any great eagerness.",48
359,Mr GLYNN ,I was one of the then Opposition who supported the contenA n d in tion that we had the power.,48
360,Mr ARTHUR ,The point is whether it is right or wrong to appropriate money some power to for such a purpose.,48
361,Mr GROOM ,The honourable member is questioning the whole power of appropriation except fbr specified objects.,48
362,Mr ARTHUR ,"I am questioning the that power to appropriate moneys for any purthe poses other than those specified in section 51 and purposes incidental thereto. The spend Minister of Trade and Customs apprehends the position, because, i u his memorandum, he deals with it most elaborately and full y . On page 7 of that report we is find, if I may say so, the error which I conceive the honourable gentleman, as the of that day, fell into, he did not discriminate between the powers expressed in the Constitution of the United States of America and those expressed in the Constitution of Australia.",48
363,Mr GROOM ,I think the honourable member will find that I rested my argument on the combined effect of all the expressed powers.,49
364,Mr ARTHUR ,"The honourable gentleman went on to deal with the matter from another point of view. He dealt with it first by way of analogy between the Australian Constitution and that of the United States of America,-' and, apparently, found the analogy perfect. then went on to deal with it from the point of view of the expressed powers, and he saysMoreover, the power to organize such a department is incidental to the grant of the various specific powers under the Constitution. Under section 51. sub-section (<)> Parliament under its powers of trade and commerce may appoint officers to inspect both imports and exports of agricultural products and stock. How can that power apply to the scope of this Bill?",49
365,Mr GROOM ,There is. the combined effect.,49
366,Mr ARTHUR ,"I will take the powers piecemeal, and then see whether taking them in conjunction carries them any f u r ther. The power as to the exports and imports does not assist us, for that does - not refer to the general encouragement of the agricultural production of the Commonwealth. The next mentioned is the power to grant bounties on the production or export of goods-to grant bounties to encourage persons to produce a certain «lass of commodity. That in no wise - carries the general power to spend money on the general encouragement of agriculture; because this alone indicates the exXcnt to which the Commonwealth is given power to encourage agriculture. The - Commonwealth is given power to en-courage agriculture by granting bounties, and that, in itself, indicates that the .general power to encourage is not given. The Minister of Trade and Customs knows that one of the most important principles in the construction of a document is that ""the expression of one thing excludes the implication of another. The Minister of Trade and Customs goes on to deal with the question of quarantine, and the appointment of officers connected therewith. These are the only powers he mentions. Standing alone, they would ""not include 'this power, and, in conjunction, I submit, they do not give it , and therefore the matter is one that should be taken into consideration. I am not' raising this doubt in order to oppose the Bill . merely wish to point out that we must be extremely careful.",49
367,Mr GROOM ,Thes e doubts were considered by Sir John Quick and by Mr . Justice Isaacs also.,49
368,Mr ARTHUR ,"Accordin g to the record in Hansard, Sir John Quick dealt very briefly with it . Apparently, he f e l l into the same error as the Minister of Trade and Customs in using an analogy He which does not exist between the powers of the United States and the powers of the Commonwealth in their respective Constitutions. We do not wish to fall into any error. We require wider powers for the purpose of the welfare of the Commonwealth. An effort was recently made to get those wider powers, but they were refused; and though we feel ° that we live under a very narrow Constitution, we must appreciate the limits of that Constitution. It is for that reason that I make these few remarks on the constitutionality of the measure, while repeating that I support the Bill in every particular. I hope the law advisers of the Government will find that the points raised by Mr Justice Higgins, Professor Moore, and other people are not valid. NA gratulate honourable members on the unanimity displayed in the direction of forwarding this measure. I think it would be an advantage to the Commonwealth and the whole community if the Commonwealth could control quarantine in regard to diseases in animals and plant life. Many farmers in my district send potatoes to Deniliquin. These potatoes have to pass over the Victorian railway system to reach .Echuca, where they recross the border, and are forwarded to their destination. At the time that Irish blight was prevalent in the Commonwealth, New South Wales was not quarantined, but Victoria was, and though potatoes on the way to Deniliquin could cross the border from New South Wales into Victoria, when they reached Echuca they were classed as being affected by blight. It would be well if we could have effective legislation dealing with this matter, so that a particular disease might be confined to a portion 'of a State irrespective of State boundaries. If there is blight at Warrnambool, the quarantine need not apply to the whole of Victoria.",49
369,Mr TUDOR ,"That is a matter for the State Departments. The Commonwealth I has not the power. NA Federal Bureau has absolute power of think quarantine in regard to diseases in plant lately been and animal life, and I consider a monwealth Bureau should be given the same power. The tick is prevalent in some districts of Queensland, but I think the quarantine should be restricted those areas. We are all concerned in the passing of this Bill , because it deals the most important industry in Australia. It applies not only to the farmers, but Federation. also to the farm labourers. homesteads and farmhouses, I have seen Federation ? the farm hands engaged at night in reading agricultural gazettes to improve their minds. They already have the practical knowledge, and it is our task to give them the theoretical knowledge. The farm labourer of today should be the farmer of tomorrow, and should have every portunity given to him, so that he attain a better position in life. land laws are being considerably liberalother ized to enable him to get a footing, with his practical knowledge, combined with a theoretical knowledge, he should be thoroughly equipped.",49
370,Dr MALONEY ,"The scientific farmer the best asset any State can have. NA dence of that in Denmark. W it h a lation of 2,000,000, that country has capgetting tured the butter and egg market of Engto land, and exports annually £20,000,000 worth of agricultural products. If Denrealize mark can do that with her small popufood-stuffs lation, surely we in Australia, with our ing. wonderful potentialities and opportuniwin ties, should be able to do more. In New South Wales it is said that every farmer needs to get a thorough grip of the three F's-Farrar , fallow, and fertilizers. It was Mr Farrar who made the discovery modest sum of £5,000, which, divided of that wonderful wheat called Federaamong tion, which is now used throughout tralia. We must put the farmers in way of selecting the very best seed wheats. We need to put the best ferwe tilizers on the market to give the people an opportunity to examine their qualidiseases ties, and use the very best, instead of ing with their wheat a lot of sand and bish, as they have been doing in the past. The Agricultura l Bureau could analyze fertilizers, and act as advisers to the farmers in this very important matter. Fallowing is no new system, because a Roman ruler named Cincinnatus centuries the ago wrote largely on the subject. I the Federation wheat has eclipsed. I was 168Commiles west from Melbourne the other day in this wonderful State of Victoria, and I saw a great deal of Federation wheat growing. Fully one-third of to the area under crop was sown with Federation, but alongside I saw a betterwith wheat, namely, the Wallace, which should go one bag to the acre more than",50
