Speaker,Text,pageNumbers
NA,"of what he had seen at the front, and",43
NA,told us what was likely to happen i n this,43
NA,country i f reinforcements. were not pro-,43
NA,vided. W h a t did we do in 1914?,43
NA,We went f r o m platform to platform and,43
NA,read the manifesto issued by Mr Fisher,43
NA,"at the instance of the Labour party, i n",43
NA,which i t was stated that Australia would,43
NA,stand by the Old Country i n this war to,43
NA,""" t h e last man and the last shilling.""",43
NA,Mr Hughes showed us the advantages,43
NA,that would be gained by sending rein-,43
NA,"forcements to the front, and I have since",43
NA,learned that the more men we have there,43
NA,the greater the number of lives that w i l l,43
NA,be saved. The honorable member f o r,43
NA,Capricornia stated last evening that at,43
NA,the time of the conscription referendum,43
NA,"men were not required at the front , and,",43
NA,"i n support of his contention, he stated",43
NA,"that no less than 50,000 Australians had",43
NA,been reviewed by the K i n g at Salisbury,43
NA,Plain. I do not know how many Aus-,43
NA,"tralians were reviewed there, nor do I",43
NA,think the honorable member knows. I,43
NA,doubt whether the Defence Department,43
NA,itself knows. Yet the honorable member,43
NA,for Capricornia stated that there were,43
NA,"50,000 Australians encamped on Salis-",44
NA,"bury Plain. Tf tbere were, they were",44
NA,there because they were not trained men.,44
NA,I t is idle to send undisciplined men,44
NA,front. They would be useless i n the,44
NA,"trenches, and their lives would be need-",44
NA,lessly sacrificed. B u t i f men were not,44
NA,required at the front-a s was urged by,44
NA,tlie honorable member f o r Capricornia-,44
NA,"why, i n heaven's name, have Australians",44
NA,been kept in the firing line since 1914-,44
NA,"meu whom we know personally, and who",44
NA,are longing to get back to their wives and,44
NA,children? Ask the Assistant Minister,44
NA,the nature of the letters he is continually,44
NA,"receiving, and he w i l l say that by every",44
NA,mail he gets communications f r o m wives,44
NA,and children asking that their husbands,44
NA,and fathers may be relieved f r o m duty.,44
NA,"""Why is this so? Because there are not",44
NA,the required men available to relieve,44
NA,them? I s that fair? I ask any unionist,44
NA,who believes i n forty-eight hours a week,44
NA,whether i t ia right to keep men eighty-,44
NA,eight hours weekly i n the trenches? Is,44
NA,i t right to keep them there nineteen days,44
NA,in succession? Only a few days ago I,44
NA,received a letter f r o m a relation of mine,44
NA,who is now i n the hospital with his toes,44
NA,almost dropping off as fche result of,44
NA,""" trench feet,"" due to his being kept too'",44
NA,long in the trenches. Y e t the honorable,44
NA,member f o r Capricornia says that there,44
NA,"were 50,000 Australians reviewed by the",44
NA,"K i n g on Salisbury Plain, and that men",44
NA,were not required at the front. I f he,44
NA,knr-ws that there were that number of,44
NA,Australians i n ' England at the time of,44
NA,"which lie spoke, he knows more than does",44
NA,the Minister for Defence.,44
NA,"Recognising these facts, what sort",44
NA,"of a man would I have been i f , pulsion.",44
NA,"to save my political skin, I",44
NA,-consented to obey those whom. I had,44
NA,"no right to obey? I f i t can be shown, by",44
NA,"reference to the Labour' platform, that I",44
NA,"was pledged to oppose conscription, I shall",44
NA,be thankful indeed. But conscription us i n i t .,44
NA,was not mentioned on the platform which,44
NA,"I signed three years ago, and in the",44
NA,festo which Mr Eisher issued at the,44
NA,"quest of the Labour party i n 1914,",44
NA,assured the Old Country that we were,44
NA,"with her to "" the last man and the last",44
NA,"shilling."" What did the Worker reLabour",44
NA,cently say? I t said that politicians,44
NA,being taught that their masters outside,44
NA,-meanin g the . Labour organizations-,44
NA,were going to take a more active part in,44
NA,politics. The present Prime Minister,44
NA,pointed out to us that men were,44
NA,"to the urgently wanted, and a number of",44
NA,us agreed to follow him. Why? Be-,44
NA,cause we believed that i t was necessary,44
NA,to secure the meu required to win this,44
NA,war and because we were i n honour,44
NA,bound to redeem our promise to the I m -,44
NA,perial Authorities. B u t we believed that,44
NA,as soon as the referendum had,44
NA,"been decided, even i f we were defeated,",44
NA,nothing more would be heard of the,44
NA,matter. We soon discovered that that,44
NA,was not so. I have been informed that,44
NA,"two members of our party, namely, the",44
NA,honorable member f o r Illawarra and,44
NA,"Senator Ferricks, actually attended a",44
NA,meeting i n New South Wales on the Sun-,44
NA,day preceding the memorable Caucus,44
NA,"meeting i n Melbourne, at which they were",44
NA,instructed to come down here and vote,44
NA,for the deposition of Mr Hughes f r o m,44
NA,the leadership of the party. I do not say,44
NA,"that the statement is correct, but i f i t is",44
NA,"not, let the honorable member f o r I l l a -",44
NA,warra refute i t . How can members of,44
NA,Parliament discharge their duties faith -,44
NA,f u l l y i f their attitude is to be dictated by,44
NA,an outside irresponsible body? I t has,44
NA,"been said that the Prime Minister, the",44
NA,"honorable member f o r Darling, and",44
NA,others were asked to explain their position,44
NA,"to that body, when, as a matter of fact,",44
NA,their fate had actually been decided i n,44
NA,advance? Was that just? I am very,44
NA,pleased that the honorable member f o r,44
NA,Brisbane has released me f r o m any obli-,44
NA,gation to observe secrecy by reading to-,44
NA,day a motion which was submitted i n,44
NA,"another place. Apparently, that motion",44
NA,applied only to Mr Hughes and to his ex-,44
NA,B u t what self-respecting body,44
NA,had of men would sit i n that meeting after,44
NA,such a resolution had been carried?,44
NA,NA,44
Mr LAIRD SMITH , I took the,44
NA,manimotion to mean that we were all to get,44
NA,"reout. I n support of my statement, I i n -",44
NA,he tend to quote from the Hobart Mercury,44
NA,"of Thursday, 16th November, 1916. Mr .",44
NA,"Lyons,' the president of the Political",44
NA,"League of Tasmania, upon being",44
NA,were interviewed by a representative of that,44
NA,journal when the Hughes Government,44
NA,"was formed, was asked, "" What about",44
NA,the position of Mr Jensen and Mr Laird,45
NA,"Smith in relation to the Labour party?""",45
NA,"To that Mr Lyons replied, "" They are",45
NA,in the same position as all other followers,45
NA,of Mr Hughes. They have cut them-,45
NA,"selves adrift, a^nd saved the organizations",45
NA,"the trouble of doing i t for them."" Surely",45
NA,that is definite enough. What could we,45
NA,do i n the circumstances ? I ask any,45
NA,unionist i u Australia i f I have ever been,45
NA,remiss i n the discharge of my duties?,45
NA,Yet I was not even given a hearing.,45
NA,"In tbe face of these facts, the honorable",45
NA,member for Kalgoorlie has the temerity,45
NA,to declare that members of the Official,45
NA,Labour party enjoy the same freedom to-,45
NA,day that they did previously.',45
NA,"were so, why is it that certain",45
NA,of that party are being so bitterly opposed,45
NA,in the ballot for selection? Had I been,45
NA,"a member of that party to-day, my selec-",45
NA,tion would have been contested.,45
NA,Because Denison is a fairlv easy Labour,45
NA,"seat now, which it was not when I cap-",45
NA,tured it. lt has been said that we would,45
NA,not have been here to-day but for the,45
NA,Labour'movement. But I would remind,45
NA,my honorable friends opposite that in,45
NA,"the time of Jimmy Hall, before the for-",45
NA,"mation of the Labour party, I was car-",45
NA,peted by the Tasmanian Railways,45
NA,missioners for taking an active part in,45
NA,politics. After that I had no intention,45
NA,of seeking election to Parliament;,45
NA,some time later I was approached,45
NA,"members of the Labour organizations,",45
NA,who assured me that they could not find,45
NA,"a man who could win the Denison seat,",45
NA,and who expressed the belief that I could,45
NA,secure it. I advised them to go to Mr.,45
NA,"L. L. Giblin, who is the Lecturer",45
NA,"Mathematics at the University,",45
NA,"him to become a candidate, as I thought",45
NA,he could win the seat. In a fortnight,45
NA,they came back to me and said that he,45
NA,"could not be induced to stand, and that,",45
NA,"consequently, I must contest it. I did",45
NA,"so, with the result that I am here to-",45
NA,day. I was also one of the framers of,45
NA,the Railways Superannuation Pund,45
NA,"Tasmania. It was formed, and I sub-",45
NA,"scribed to it, with the result",45
NA,at tlie age of sixty-five years,45
NA,would have been entitled to,45
NA,with a pension of about £2 a - week.,45
NA,"Thafc may not seem much,",45
NA,"represents £2,000, and there is not a man",45
NA,in the Labour party to-day who will,45
NA,have that amount at the age of sixty-five,45
NA,Jfr. Laird Smith.,45
NA,"years. I n addition, I was entitled to re-",45
NA,ceive a week's pay for every year that I,45
NA,had been i n the service. I have been,45
NA,twenty-one years there. I had to forfeit,45
NA,that pay when I consented to contest the,45
NA,Denison seat in this House. I did not,45
NA,"mind that, because the feeling which",45
NA,existed i n the constituency at the time,45
NA,made i t a pleasure to me to work for ifc.,45
NA,B u t what a difference there is over here !,45
NA,"Men call you "" brother,"" but they would",45
NA,stab you in the back i f they had an,45
NA,opportunity. Whab do I find here ? The,45
NA,secretaries of unions are continually be-,45
NA,ing opposed for their positions. A man,45
NA,will come from the other end of the,45
NA,"world. Nobody will know who he is, or",45
NA,If that what he is; bub he will criticise the work,45
NA,members of the holder of bhe office. Why? I n,45
NA,order that he may contest the position,45
NA,later on. I represented the Waterside,45
NA,Workers for six years i n the Federa-,45
NA,"Why? tion, and did my b i t side by side",45
NA,with the Prime Minister. When they,45
NA,"expelled me, they did i t i n the most",45
NA,kindly way by affirming that they were,45
NA,no longer going to have a member of Par-,45
NA,"liament to represent them, and each union",45
NA,thanked me for my past services. One of,45
NA,"these gentlemen, who became a union",45
NA,"secretary, jockeyed out of that position",45
NA,"Com- .a good man who had been there for years,",45
NA,and who was of a splendid type. A little,45
NA,later the union could not get an audit of,45
NA,"but its books, and when i t did get i t ,",45
NA,by i t was discovered that the organiza-,45
NA,tion had lost several hundreds of pounds.,45
NA,Where is that man to-day? I n gaol.,45
NA,Who put him i n gaol? The union. A n d,45
NA,he was one of these gentlemen who was,45
NA,going to show us how to ru n a union on,45
NA,in up-to-date lines. I t is not the rank and,45
NA,and ask file of the Labour party outside who are,45
NA,criticising me; i t is rabher the few who,45
NA,would like to have my seat. They say to,45
NA,"themselves, "" Denison is an easy seat to",45
NA,"win."" They think tbe same i n regard to",45
NA,Bass. I shall not allude to what the hon-,45
NA,orable member for Maranoa has said to-,45
NA,"day, because his remarks did not apply",45
NA,in to me.,45
NA,NA,45
NA,"I member putting up a dummy, only to",45
NA,retire knock i t down again ?,45
Mr LAIRD SMITH ,Becaus e I wish,45
NA,but it to acquaint the Committee with a few,45
NA,facts. I do not know what is in tbe,45
NA,"honorable member's mind, but I am stat-",45
NA,ing actual facts. We find to-day that,45
NA,one of the candidates for selection to run,45
NA,in the Labour interest for the represening,46
NA,tation of Tasmania i n the Senate is M,46
NA,"Woods, a prominent officer of the Politias",46
NA,cal Labour League; while Mr Ben,46
NA,"Watkins, another prominent member of",46
NA,"it, is seeking selection so that he can conto",46
NA,test my seat as the selected candidate of,46
NA,the Official Labour pary. Not one of,46
NA,these men who have criticised me so bitceived,46
NA,terly can say that I have departed from,46
NA,one plank of the Labour platform ; the,46
NA,only thing they could find against me,46
NA,that when the right honorable member,46
NA,for Parramatta addressed a meeting at,46
NA,Hobart i n connexion with th© military,46
NA,"service referendum, I occupied a seat",46
NA,the platform.,46
NA,NA,46
NA,a seat.,46
Mr LAIRD SMITH , I recognise,46
NA,that. B u t a man who has done justice to,46
NA,his constituents is entitled to expect re-,46
NA,election - I have as much right to stand,46
NA,for the electorate of Denison as has any,46
NA,man.,46
NA,NA,46
Mr LAIRD SMITH , W h a t would be,46
NA,said of Justices of the H i g h Court who,46
NA,proceeded to adjudicate on cases involving,46
NA,business matters with which they,46
NA,directly concerned ? Yet that is what is Labour party what i t is to-day?,46
NA,being done by these league officials.,46
NA,I agree with tlie honorable member,46
NA,Maranoa that the Labour movement will,46
NA,"still go on. I t will continue to grow,",46
NA,cause i t will be cleaned up as a result,46
NA,"our action, and the rank and file of the ganization.",46
NA,party will arrive at a true appreciation,46
NA,of these officials who are after other men's,46
NA,seats. I f at every election we are to,46
NA,a change of representatives-on e man,46
NA,going out and another man going i n - I which,46
NA,question whether i t will be a good thing,46
NA,"for Australia. Where the secretary, the",46
NA,"treasurer, or the committee of a union",46
NA,"are doing honest service, we should",46
NA,"them i n ofiice. They are tried men,",46
NA,should not be replaced unless they retire,46
NA,or pass away. I invite honorable memBristol,46
NA,bers to consider for a moment the position,46
NA,"of the honorable member for Darling,",46
NA,"Mr Spence, who has been expelled",46
NA,from the Official Labour party.,46
NA,is beloved by every one; no man Labour,46
NA,would say an unkind word of him.,46
NA,"Some one said of him to-day, "" He is not",46
NA,"sad."" But have honorable members ever",46
NA,watched his face when he has been talk-,46
NA,to them of what he did for Labour i n,46
NA,r . the early days? Have they watched him,46
NA,he talked of his struggles in the early,46
NA,"days, when there was no payment of",46
NA,"union secretaries, and when he had almost",46
NA,starve i n the cause of unionism ? Is i t,46
NA,reasonable to believe that he does not feel,46
NA,"sad, i n view of the treatment he has re-",46
NA,at the hands of the Official Labour,46
NA,party's organizations. He must feel very,46
NA,"keenly the treatment meted out to him,",46
NA,was because he is still the same old Spence,46
NA,that he was when he first fought for,46
NA,unionism. H e has not departed one iota,46
NA,from the principles and opinions he held,46
NA,on when he first entered the Labour move-,46
NA,"ment. He is a fine old man, a king of",46
NA,"on humanity, a man of marked intelligence.",46
NA,One has only to hear him talk to,46
NA,recognise that. I understand that on,46
NA,"one occasion, he adjudicated i n a cer-",46
NA,tain case at Campbelltown. and began,46
NA,by putting all the members of the legal,46
NA,profession out of doors. He very speedily,46
NA,"fixed up an agreement, and one of the",46
NA,most conservative gentlemen i n the town,46
NA,declared that he had never listened to an,46
NA,abler or more intelligent man. A n d what,46
NA,has this outside Labour organization done,46
NA,to the honorable member f o r Darling-,46
NA,were this fine old man who has made the,46
NA,Even,46
NA,the most bitter opponents of the cause he,46
NA,for has so long espoused admire him. A n d,46
NA,yet this old gentleman has been cast out.,46
NA,beI n the days of his old age he has been,46
NA,of turned a d r i f t by the Official Labour or-,46
NA,I s that what we call bro-,46
NA,therly love? I s that the sort of Socialism,46
NA,for which we have been working? I s that,46
NA,have the sort of Socialism we want? Unhesi-,46
NA,"tatingly, I say i t is not. I t is something",46
NA,w i l l cast us a d r i f t i n our old age,46
NA,and leave us as paupers. Read the writ-,46
NA,ings and the - speeches of Socialists like,46
NA,"Thomas, the Erench Minister, and those",46
NA,keep of the many French and Belgian So-,46
NA,"and cialists of prominence, whose names I",46
NA,need not mention. These men went to tho,46
NA,Labour Conference with a peti-,46
NA,tion to the British working people to as-,46
NA,sist France and Belgium i n stemming,46
NA,"back the on-rushing tide of Huns, who",46
NA,He were laying waste their land. Not a,46
NA,man refused to listen to that peti-,46
NA,tion. A leading German Socialist told,46
NA,"me, i n Switzerland i n 1911, that i n 1914",46
NA,"Germany would have, f r o m a Socialistic",46
NA,"point of view, the most triumphant gene-",47
NA,ral election it had ever experienced. He,47
NA,"said, "" We have only to secure the",47
NA,agrarian vote-w e have only to win over,47
NA,the farmers-an d we shall sweep the polls.,47
NA,Then the Constitution of Germany will,47
NA,"have to be altered."" The German Em-",47
NA,"peror recognised this fact, and seeing, as",47
NA,"he believed, tin opportunity to conquer",47
NA,"other lands, he declared war, and set to",47
NA,work to crush the German Labour party.,47
NA,He has done so. He has crushed the So-,47
NA,cialists out of existence. Only one of,47
NA,"their leaders dared to stand against him,",47
NA,and that man to-day is in prison. So-,47
NA,"cialists from Belgium, Italy, and Erance",47
NA,"have visited Great Britain, with the ob-",47
NA,ject of urging workers to join with them,47
NA,in the fight to save their countries from,47
NA,the Huns.,47
NA,"In view of all these facts, how could speech.",47
NA,we on this side of the House do other-,47
NA,wise than we have done? Our,47
NA,desire was to save our country.,47
NA,because of that desire we are not to,47
NA,"spoken of as "" scabs"" and "" blacklegs.""",47
NA,Why should such abominable epithets,47
NA,be applied to men who have worked far,47
NA,into the night in the cause of Labour.,47
NA,one works harder than does a Labour,47
NA,ber while the House is in session. I have,47
NA,rushed from this House at 3 o'clock,47
NA,"on a Friday, caught the steamer for",47
NA,"Hobart. reached there, after a rough",47
NA,"sage, pn Saturday evening, addressed a",47
NA,"meeting the same night, returning home",47
NA,early on Sunday morning; addressed a,47
NA,meeting again on Sunday afternoon;,47
NA,"spent the whole of the next day in meetPorts,",47
NA,ing my constituents; addressed another,47
NA,"meeting on Monday night, and next day",47
NA,"have boarded the steamer once more, and",47
NA,have been in my place in this House,47
NA,on the Wednesday afternoon. Labour,47
NA,men iire almost worked to death. My,47
NA,wife has walked from house to house for,47
NA,"three months at a stretch, canvassing,",47
NA,"for me, but for another Labour candidate.",47
NA,And to-day we are practically driven,47
NA,pillar to post by a few outside Labour,47
NA,who would like to have the seat I occupy,47
NA,in Parliament. A few days ago,47
NA,peared in the Herald a statement of the,47
NA,business to be considered at the coming,47
NA,Labour Conference. We find that one,47
NA,branch of the league objects to universal,47
NA,"training, which has been invaluable to",47
NA,Afr. Laird Smith.,47
NA,Australia. Other branches say that the,47
NA,salaries of members should be pooled.,47
NA,"Members of Parliament, they say, should",47
NA,be paid a living wage. Who is to be the,47
NA,judge of what is a living wage ?,47
NA,NA,47
NA,"ries are to be pooled, the honorable mem-",47
NA,ber is just getting out in time.,47
Mr LAIRD SMITH , I do not intend,47
NA,to get out. The honorable member for,47
NA,"Maranoa, we are led to believe, is a rich",47
NA,man. I am not.,47
NA,NA,47
The TEMPORARY CHAIRMAN ,,47
NA,( Mr ATKINSON) -Order ! The honor-,47
NA,able member's time has expired.,47
NA,HONORABLE MEMBERS -G o on.,47
Mr LAIRD SMITH ,(B y leave) - I,47
NA,"thank the honorable member for Bendigo,",47
NA,who has been good enough to give way,47
NA,"to me, in order that I may conclude my",47
NA,We have been told of the soli-,47
NA,"only darity of the Labour party, and it has",47
NA,Surely been said that the majority must rule.,47
NA,be Is there any understanding-i s there,47
NA,anything in our constitution to that,47
NA,effect? The honorable member for Kal-,47
NA,goorlie said that it .was laid down in our,47
NA,No constitution that the majority must rule;,47
NA,membut honorable memhers of the Official,47
NA,Labour party know that that is not so.,47
NA,We were free to vote as we pleased on,47
NA,any question outside the Labour plat-,47
NA,"pasform. By way of illustration, I propose",47
NA,to refer to something that occurred in the,47
NA,Official Labour Caucus when the question,47
NA,of conscription was under consideration.,47
NA,The honorable member for Melbourne,47
NA,"Mr Mathews, is involved in this,",47
NA,"and I regret that he is unable, owing to",47
NA,"other important public business, to be",47
NA,present this evening. I told him that I,47
NA,"intended to refer to this matter, so that",47
NA,I am not doing him any injustice. Be-,47
NA,fore the honorable member for Brisbane,47
NA,submitted his motion at the Caucus meet-,47
NA,not ing that the Prime Minister should be,47
NA,deposed from the leadership of the Labour,47
NA,"from party, the honorable member for Mel-",47
NA,"men, bourne Ports said, "" I am not in favour",47
NA,"of conscription, and I shall not be bound",47
NA,"there apby any vote of this party.""",47
NA,"Mr ""HANNAN -Hear , hear!",47
NA,NA,47
Mr LAIRD SMITH ,The n i f he was,47
NA,not to be bound by any vote of the party,47
NA,"on a question outside our platform, why",47
NA,"should the Prime Minister and myself,",48
NA,together with others who stand with u?,48
NA,"to-day, be blamed for refusing to be",48
NA,bound by the vote of the Official Labour,48
NA,party on a question outside the party,48
NA,"platform? ""What is f a i r i n the one case",48
NA,is surely f a i r i n the other.' I told the,48
NA,honorable member that I was going to,48
NA,"mention this fact, and he said, "" You are",48
NA,"quite correct."" He was consistent i n the",48
NA,"action he took. How, then, can wc be",48
NA,charged with inconsistency? Why should,48
NA,we be pushed out of the Labour move-,48
NA,"ment, which is as dear to us as i t is to",48
NA,every member of the Opposition. We de-,48
NA,"cline to be pushed out of i t , and we shall",48
NA,not be pushed out. I shall appeal to,48
NA,"those to whom I have appealed before,",48
NA,and I feel sure that they w i ll give me the,48
NA,consideration that I have always received,48
NA,at their hands.,48
NA,The honorable member for Illawarra,48
NA,"has just entered the chamber, and",48
NA,I should like him to say whether,48
NA,i t is not a fact that he would have,48
NA,had a sent i n this House sooner than he,48
NA,-did i f he had received justice at the hands,48
NA,of the few men who are now opposing me.,48
NA,Does he think that they gave h i m justice,48
NA,when he stood f o r Denison? Decidedly,48
NA,-not. Denison was to be kept f o r a cer-,48
NA,tain Labour man when i t was felt that i t,48
NA,could be won. Meantime the honorable,48
NA,member for Illawarra was put up fo r the,48
NA,constituency. A n d did these people help,48
NA,him ? D i d they go from house to house,48
NA,canvassing f o r him? D i d they put their,48
NA,hands in their pockets to assist him in his,48
NA,candidature? Wo; I can tell the Com-,48
NA,"mittee what they did when I went there,",48
NA,and they thought I had a chance of win-,48
NA,ning the seat. They put every obstacle,48
NA,"i n my way, and one of the leading mem-",48
NA,bers of the organization cleared out of,48
NA,the district fo r a fortnight before the,48
NA,polling day. The honorable member f o r,48
NA,Illawarra knows that this is true.,48
NA,opposition to-day is coming f r o m the,48
NA,"same old quarter. I t comes, not f r o m",48
NA,"the rank and file, who have always helped",48
NA,"a Labour candidate, taking the most ac-",48
NA,"tive interest in the contest, but f r o m men",48
NA,who dare not fight me openly. I t ema-,48
NA,nates from men who would come i n at the,48
NA,back door and deprive me of my seat.,48
NA,They were not prepared to contest the,48
NA,"Bass constituency, because they did not",48
NA,think i t could be won by a Labour man.,48
NA,The honorable member f o r Maranoa is,48
NA,"left unopposed again and again, because",48
NA,he represents a very large and difficult,48
NA,constituency to canvass. He is a good,48
NA,"fellow, big i n brain and big i n heart, and",48
NA,his constituency is also a big one. I t i3,48
NA,because of the difficulties i t presents to,48
NA,a candidate that he is not worried by,48
NA,"union officials, who would take i t f r o m",48
NA,him. He does not know what i t is to,48
NA,have a union man constantly watching,48
NA,"him, always finding fault with him, and",48
NA,telling him that he would be a much,48
NA,"better representative. One man, i t is",48
NA,"said, can do little. But one man can up-",48
NA,set a party; when he knows i t,48
NA,"is safe, he can criticise the Government",48
NA,"which he was returned to support, and can",48
NA,score off i t .,48
NA,NA,48
NA,man who broke up two parties.,48
Mr LAIRD SMITH , I do not think,48
NA,that is quite correct. I do not regret,48
NA,"having supported the Prime Minister, be-",48
NA,cause I believe he is honest in his convic-,48
NA,tions. Would he have made such a sacri-,48
NA,"fice if i t had been otherwise, and when",48
