Speaker,Text,pageNumbers
NA,"know his work, and because I differ from",33
NA,"him on tliis question, I am not one who",33
NA,wishes to put a dagger into him. Onthe,33
NA,"other hand, I know the other man also.",33
NA,I know that Senator Watson is an upright,33
NA,"man, with an exemplary character, the",33
NA,same as the Prime Minister bears. Let a,33
NA,proper tribunal be appointed to sift this,33
NA,"matter, and i f i t is found that Senator",34
NA,Watson bas made any statements which,34
NA,"reflect on the Prime Minister, and which",34
NA,"are not i n accordance with the facts, he",34
NA,will carry the odium attaching to that,34
NA,offence. I would be sorry for any,34
NA,man who had to appear before the,34
NA,people i f a H i g h Court Judge had decided,34
NA,that he had done an i n j u ry to a man by,34
NA,statements he had made in Parliament.,34
NA,"I n sanctioning an inquiry by Judges, or",34
NA,"one Judge of tlie H i gh Court, the Go-",34
NA,vernment will only be doing what is right,34
NA,and just in the interests of members of,34
NA,this House. Possibly the people will come,34
NA,to the conclusion that Senator Wat-,34
NA,son is being cited to appear be-,34
NA,fore the Supreme Court for the purpose,34
NA,of keeping this matter i n suspense u n t i l,34
NA,after the appeal to the people has been,34
NA,made and in order to prevent honorable,34
NA,members from speaking. I f you take one,34
NA,"statement to the Supreme Court, you can-",34
NA,"not bring i n any outside matter, or any",34
NA,matter which may be indirectly relevant,34
NA,"to i t , f or the simple reason that you will",34
NA,be confined to the one issue before the,34
NA,Court. Where will the Ready dis-,34
NA,appearing trick go to? Can the Court,34
NA,deal with that matter ? Can any one give,34
NA,"evidence i n connexion with it? A f t e r all,",34
NA,the statement would not have been made,34
NA,by Senator Watson had i t not been for,34
NA,Senator Ready disappearing from the,34
NA,arena of politics.,34
Mr MATHEWS ,Yo u cannot disconnect,34
NA,the two.,34
Mr CHARLTON , N o . B u t i f you,34
NA,go to the Court i n regard to one,34
NA,"statement, you will be confined to",34
NA,ifc. I f fche Government desire to,34
NA,"do the fair and honorable thing, they",34
NA,must appoint a Commission of Judges from,34
NA,the High Court to deal with the Watson,34
NA,"and Ready cases, and clear the atmo-",34
NA,"sphere, and let the public know that",34
NA,everything is right. I speak with feeling,34
NA,on this matter. I have been i n public,34
NA,"life f or twelve years and a half, and I",34
NA,have never known anything like this to,34
NA,be alleged before. I have always en-,34
NA,deavoured to take a straight and honor-,34
NA,able path. I believe that other men who,34
NA,are concerned i n this matter have done,34
NA,"the same t h i n g ; but, evidently, there is a",34
NA,difference of opinion. Let the matter be,34
NA,settled by referring i t to a proper t r i -,34
NA,bunal. I t would be a preposterous posi-,34
NA,"tion for the House to say tliat, whenever",34
NA,a charge is levelled by a member against,34
NA,"the Government or the Prime Minister, or",34
NA,"a private member, he will have to waive",34
NA,privilege and go into the Supreme Court.,34
NA,I f that should ever become an established,34
NA,"fact in Australia, then good-bye to re-",34
NA,sponsible government; good-bye to poor,34
NA,men representing the people i n this,34
NA,Chamber. They would be less than use-,34
NA,less. They would not dare to open their,34
NA,mouths on any matter which they,34
NA,"thought vitally affected the public, i f",34
NA,"i t involved a reflection on somebody else,",34
NA,for i f they spoke they would have to r u n,34
NA,"the risk of losing their homes, and their",34
NA,wives and children might be rendered,34
NA,penniless i n order to meet the costs of an,34
NA,appeal to the Court.,34
Mr FENTON ,If c would afford a splen-,34
NA,did opportunity to blackmail members -,34
Mr CHARLTON ,Exactly . There,34
NA,can be no escape from that position.,34
NA,I wish to say a few words in regard to a,34
NA,"question which was asked last evening, be-",34
NA,"cause, i n these times, so much feeling is",34
NA,engendered. The question which was,34
NA,asked last night by the honorable member,34
NA,for Bourke i n regard to Senator Watson,34
NA,and Mr Baddeley waiting upon the Prime,34
NA,Minister seemed to me to be loaded. I n,34
NA,"view of the situation here, i t is only fair",34
NA,that I should narrate the facts as they,34
NA,occurred. That question was prompted,34
NA,by an individual who occupies - a very,34
NA,high place i n connexion with the northern,34
NA,coal trade. The question was based upon,34
NA,"suspicion, because he saw Senator Watson",34
NA,and Mr Baddeley come over i n fche same,34
NA,"train, and because Senator Watson went",34
NA,back last week i n the same train that Mr .,34
NA,Baddeley travelled i n . I wish to state,34
NA,"the facts, and the Prime Minister-i f he",34
NA,were here-woul d bear out my statement.,34
NA,I n the previous week.. Senator Watson,34
NA,"went home on Thursday, and on Friday",34
NA,I received from Mr Baddeley a wire ask-,34
NA,ing me i f I could arrange for a deputa-,34
NA,tion to the Prime Minister i n regard to,34
NA,troubles i n connexion with mining. I,34
NA,saw the Prime Minister sitting on the,34
NA,"other side, and the Acting Prime Minister",34
NA,was close to him. I went over and asked,34
NA,the Prime Minister i f he could meet the,34
NA,"deputation. He said, "" I do nofc know",34
NA,"what I will be doing next week, but i f I",34
NA,"am alive and well, and here, yes."" "" On",34
NA,"the strength of that statement,"" . I said,",34
NA,""" I will tell him to come over."" "" Very",34
NA,"w e l l , "" said the Prime Minister, "" he will",34
NA,"take the risk."" I said, "" I will",34
NA,"ask him to come."" H e came oyer",35
NA,on Wednesday by the same train as car-,35
NA,ried Mr John Brown and Senator Wat-,35
NA,"son. A f t e r luncheon I saw the latter, and",35
NA,told him that I had arranged that Mr .,35
NA,Baddeley should see the Prime Minister,35
NA,"on the Thursday or Friday, and that I",35
NA,would send for him ab the appointed time.,35
NA,"Until then, Senator Watson knew nothing",35
NA,of Mr Baddeley's visit. The Borehole,35
NA,"Seam mine a t Newcastle, the foreign",35
NA,"trade of the porb having fallen off, has",35
NA,"been slack, the mine working about two",35
NA,days a week. The Government is taking,35
NA,"a iarge quantity of coal, and we thought",35
NA,that i f we could get assistance for the,35
NA,"mines that are suffering, i t would be a",35
NA,"good thing. The Caledonian, the West",35
NA,"Wallsend, the Killingworth, and the South",35
NA,"Waratah mines have been doing worst,",35
NA,and we asked i f the Government could not,35
NA,give more coal orders to them. The M i n -,35
NA,ister for the Navy told us that the Go-,35
NA,"vernment had contracted to take 100,000",35
NA,tons of coal from the Caledonian mine,35
NA,"and 50,000 tons of coal from the Seaham",35
NA,"mine, but thafc they were not likely to need",35
NA,"all that coal, and, therefore, he was afraid",35
NA,that he could not give any help. The man,35
NA,who prompted the question asked in the,35
NA,"House is the proprietor of coal mines,",35
NA,"and has no love for the Caledonian mine,",35
NA,or any other in the Newcastle district.,35
NA,I mention these facts so that i t may not,35
NA,be thought that Senator Watson was endea-,35
NA,vouring to help one coal mine proprietor,35
NA,at the expense of another. I hope that a,35
NA,"tribunal will be appointed, consisting of",35
NA,"one or more Justices of the H i g h Court,",35
NA,to sift this matter. I n the interests of,35
NA,"Parliament and of all parties concerned,",35
NA,i t should be cleared up as early as possible.,35
NA,No honorable member has a right to be,35
NA,called on to forfeit his privileges and ex-,35
NA,pose himself to the cost of a legal action i n,35
NA,defence of anything thafc he mav say in,35
NA,"Parliament. I n my opinion, i t is cow-",35
NA,ardly fco t r y to drag an bonorable mem-,35
NA,ber into Court for something thafc he has,35
NA,said in Parliament. When the honorable,35
NA,member for Perth made his charges against,35
NA,"Mr Chinn, there were those i n my party,",35
NA,"which was then in power, who said that",35
NA,he should repeat his charges outside;'bufc,35
NA,"I contended that, as a representative of",35
NA,"the neople, he was privileged, and should",35
NA,not be expected to forego that privilege.,35
Mr MASSYGREENE ,The honorable,35
NA,for Perth did repeat his charges,35
NA,Mr Charlton.,35
Mr CHARLTON ,Yes ; but he,35
NA,should not have been asked to do so.,35
Mr MASSYGREENE ,H e was a man.,35
Mr CHARLTON ,Yes ; but he did,35
NA,not make his charges outside at the time,35
NA,I spoke of.,35
Mr MATHEWS , He did not make,35
NA,them i n connexion with the Supreme,35
NA,"Court action, but i n connexion with the",35
NA,Police Court action.,35
Mr MASSYGREENE ,H e did make them out-,35
NA,side.,35
Mr CHARLTON ,"Yes , but not at",35
NA,that time. I contended that he should,35
NA,not be asked to do that.,35
NA,I wish to repeat now what I have,35
NA,said on previous occasions regarding,35
NA,"the presentation of the Estimates,",35
NA,in fche hope that something may,35
NA,ultimatelv be done to improve matters. I,35
NA,"admit that the times are abnormal, and",35
NA,that the war has interfered with the. ad-,35
NA,"ministration of the various Departments,",35
NA,"but I do not think that any Department,",35
NA,"except the Defence Department, has been",35
NA,interfered with to such an extent as to,35
NA,make i t unable to present its Estimates,35
NA,afc least two months after the close of the,35
NA,financial year. Last year we did not get,35
NA,the Estimates until the year to which they,35
NA,"applied had expired, and we have not yet",35
NA,"got the Estimates for this year, which ex-",35
NA,pires at the end of June. Last year the,35
NA,financial statement was delivered i n May.,35
NA,Is i t a fair thing that the financial year,35
NA,should be nearly over before a statement,35
NA,is made to Parliament of tbe financial,35
NA,position of the country ? Surely the Esti-,35
NA,mates and the Treasurer's statement,35
NA,should be before Parliament early i n the,35
NA,year. I t is only after we have had the,35
NA,"financial statement, with an account of",35
NA,the revenue and expenditure of the coun-,35
NA,"try, and the Estimates, that we know",35
NA,where we are.,35
Mr MATHEWS ,Th e Treasurer would,35
NA,be superhuman who could do what you,35
NA,wish.,35
Mr CHARLTON , I am a member of,35
NA,a Committee that has examined the ex-,35
NA,"Secretary to the Treasurer, the present",35
NA,"Secretary, and the Auditor-General, of",35
NA,whom the first two say that there is no,35
NA,reason why the Estimates should not be,35
NA,presented early in the financial year.,35
Mr MATHEWS ,The y take no account,35
NA,of the political situation.,35
Mr CHARLTON , T h a t has little t o,35
NA,member do with i t - Parliament cannot control,35
NA,outside. the Administration of the country whep,35
NA,i t does not deal with the Estimates u n t,36
NA,most of the money provided for therein,36
NA,has been expended. During the year we,36
NA,spend week after week i n discussing Sup-,36
NA,"ply Bills, wasting time, and heaping up",36
NA,"expense i n printing and the like, when",36
NA,we could deal with the Estimates early,36
NA,"in the year, and do without Supplv Bills.",36
NA,The Treasurer tells us that there will be,36
NA,a great increase of expenditure this year.,36
NA,But we shall know little about the finan-,36
NA,cial position u n t i l we have received a,36
NA,complete statement. I admit that i t is not,36
NA,possible for him to do much at the pre-,36
NA,"sent time; but, as a general rule, Parlia-",36
NA,ment should be made acquainted eafly i n,36
NA,the year with the financial state of,36
NA,the country. We have voted a sum for,36
NA,"the establishment of Naval Bases, but we",36
NA,do not know anything as to the plans,36
NA,that are being adopted. We do not,36
NA,know how much of the money has been,36
NA,"spent, or how much of the work has been",36
NA,-completed. We are supposed to safe-,36
NA,"guard the Exchequer, and yet we get no",36
NA,information about these and other im-,36
NA,portant matters.,36
NA,NA,36
NA,a Supply and Tender Board.,36
Mr CHARLTON , I agree w itb tbe,36
NA,honorable member. During the short,36
NA,"time that he was in office, he did excel-",36
NA,"lent work; and, no doubt, had he re-",36
NA,"mained tliere, he would have tried to",36
NA,make an alteration. The present state of,36
NA,affairs cries aloud for redress. Intelli-,36
NA,gent men should not be asked to discuss,36
NA,"Supply Bills month after month, and",36
NA,then at the end of the year to sit up all,36
NA,night to deal with the Estimates. I f the,36
NA,Estimates were disposed of early i n the,36
NA,"year, there would be more time to deal",36
NA,with the general business of the country.,36
NA,I hopethat whoever may be Treasurer,36
NA,in the future will give consideration to,36
NA,"this matter, and furnish the Budget and",36
NA,Estimates within a reasonable period;,36
NA,"and, further, that the Estimates may be",36
NA,dealt with sufficiently early to make,36
NA,Supply Bills unnecessary -,36
NA,Sitting suspended from 6.27 to 7J/.5,36
NA,NA,36
NA,find i t difficult to understand why,36
NA,"political parties in"" the Commonwealth",36
NA,Parliament should be unable to drop,36
NA,their differences of opinion in order,36
NA,that a National Government might be,36
NA,formed to devote their energies to the,36
NA,"i l successful prosecution of the war, as has",36
NA,been done i n other parts of the Empire.,36
NA,I n the TJnited Kingdom we find that par-,36
NA,ties who have been opposed to each other,36
NA,"for generations, and who have viewed",36
NA,"each others' political ideals with hatred,",36
NA,dropped all their political differences at,36
NA,"the call to arms, -and formed themselves",36
NA,into a National Government to prosecute,36
NA,the war to the bitter end. I n the House,36
NA,"of Commons, previous to the war, there",36
NA,"was a combination of Liberals, National-",36
NA,ists and Labour members on the Govern-,36
NA,"ment side numbering 398, whilst the Con-",36
NA,servatives i n opposition numbered 272.,36
NA,"I n proportion to their numbers, the poli-",36
NA,tical parties are now represented i n a,36
NA,National Government of tlie TJnited,36
NA,Kingdom that is carrying on the govern-,36
NA,ment of the country i n this crisis to the,36
NA,satisfaction and admiration of the Em-,36
NA,pire. I n South Africa political differences,36
NA,of opinion are most marked. There is the,36
NA,"South African party of 54 members, the",36
NA,"Unionists of 40 members, the National-",36
NA,"ists of 27 members, a Labour .party of",36
NA,"4, and an Independent party of 5.",36
NA,Yet we learn that all these gentlemen,36
NA,find i t possible to see eye to eye i n the,36
NA,present great crisis. They dropped their,36
NA,"political differences, and since the war be-",36
NA,gan have loyally supported the Empire,36
NA,and the flag by forming a National Go-,36
NA,"vernment. I n Canada, there are 134 Con-",36
NA,servatives and 87 Liberals in the,36
NA,"Dominion House of Commons, and they",36
NA,have done the same. I n our neighbour-,36
NA,"ing Dominion of New Zealand, we find",36
NA,that Conservatives and Liberals have,36
NA,"dropped their political antipathies, and",36
NA,have formed themselves into one party f or,36
NA,the prosecution of the war.,36
Mr SAMPSON ,Ther e are no outside,36
NA,juntas there.,36
NA,NA,36
NA,common front to the common enemy.,36
Mr FENTON ,Canad a hae not done,36
NA,that.,36
NA,NA,36
NA,i t. During the last Commonwealth elec-,36
NA,"tions, shortly after the war broke out,",36
NA,p.m. members of the Labour party told the,36
NA,peopie throughout Australia that there,36
NA,"should net be an election. They said,",36
NA,""" Let us drop our political differences,",36
NA,"and form a National Government.""",36
Mr FENTON , I did not say that.,36
NA,NA,36
NA,"may not have said i t , but he knows as well",36
NA,as I do that i t was said. That was ad-,37
NA,mitted in this House. The suggestion was,37
NA,made that i n this Commonwealth we,37
NA,should drop party politics and form a,37
NA,National Government to prosecute the war,37
NA,to a successful issue.,37
Mr FENTON ,Wha t did the honorable,37
NA,member's party do? They spurned the,37
NA,"overtures, whatever they were.",37
NA,NA,37
NA,"fessed to desire a National Government,",37
NA,and there is no doubt that they made the,37
NA,suggestion that such a Government should,37
NA,be formed. I t was a party cry with them,37
NA,"at the elections, bufc they knew that at",37
NA,that time ifc was impossible.,37
Mr GROOM , Mr Fisher said that no,37
NA,suggestion was made.,37
NA,NA,37
NA,members of the Labour party put i t down,37
NA,"to Mr Hughes, but wherever I went",37
NA,"throughout my electorate, I heard that",37
NA,"suggestion made, and honorable members",37
NA,have only to look up the newspaper files of,37
NA,that time to find ample confirmation of my,37
NA,statement. Why did we not form a,37
NA,National Government ? Ifc was because,37
NA,"the writs of election had been issued, and",37
NA,there was no Government that could do,37
NA,"so. Still i t is very regrettable indeed, i n",37
NA,"my opinion, that we in this Parliament",37
NA,cannot see eye to eye at this particular,37
NA,juncture. I have looked through the,37
NA,financial statement with very great i n -,37
NA,"terest, and I congratulate the right honor-",37
NA,able member f o r Swan upon the introduc-,37
NA,"tion of such a concise, clear, and up-to-",37
NA,date statement. Even members of the,37
NA,House who have not had a long,37
NA,political experience are able to follow i t,37
NA,with ease. I n previous financial state-,37
NA,"ments, we have found the figures so",37
NA,"jumbled and mixed, that i t has been i m -",37
NA,possible to separate war expenditure from,37
NA,ordinary expenditure. This can be done,37
NA,at once i n the statement which the pre-,37
NA,sent Treasurer has introduced. I regret,37
NA,very much to find that the estimated ex-,37
NA,"penditure of the Commonwealth, other",37
NA,"than war expenditure, exceeds that of the",37
NA,"previous year by no less than £4,653,887.",37
NA,I t is time that we called a halt in such,37
NA,expenditure. We have enormous finan-,37
NA,cial responsibilities to meet i n this time of,37
NA,"war, and we should curtail the ordinary",37
NA,expenditure of the Commonwealth ag much,37
NA,as possible. I f the estimated expenditure,37
NA,amounted to no more than that for last,37
NA,"year, there might perhaps be nothing to",37
NA,cavil a t ; but when such an increase as I,37
NA,"have mentioned is shown, i t is time that",37
NA,we gave very serious consideration to the,37
NA,matter. Looking through the items of,37
NA,"estimated' expenditure from revenue, not",37
NA,"including war expenditure, I find that the",37
NA,"sum of £2,081,510 is to be spent on",37
NA,"capital works, and that the increase i n",37
NA,expenditure upon ordinary new works is,37
NA,"estimated at £499,292. I n my opinion,",37
NA,"these works, most of which are connected",37
NA,"with the Naval Bases, should be very",37
NA,largely suspended. We are spending,37
NA,thousands of pounds i n building Naval,37
NA,"Bases, ostensibly for the purpose of ac-",37
NA,"commodating our Fleet, whilst our Fleet",37
NA,"is i n the North Sea, and we have not a",37
NA,single battleship here. I t is time that we,37
NA,"called a halt, and decided to build our",37
NA,Naval Bases later on. We do not know,37
NA,where this expenditure is to end. I find,37
NA,thafc i n the estimates for new works for,37
NA,"1916-17, an amount of £1,025,530 is ""set",37
NA,down f or Naval works.,37
Sir JOHN FORREST ,T o be paid out of,37
NA,revenue this year?,37
NA,NA,37
Mr BAMFORD ,Wil l the honorable,37
NA,"member, as a representative of a New",37
NA,"South Wales constituency, sanction tbe",37
NA,hangingup of works at the Federal,37
NA,Capital ?<,37
NA,NA,37
NA,possible. I think that all these works,37
NA,should be suspended u n t i l the war is over.,37
NA,Every penny we can conserve should be,37
NA,ear-marked at this time f or one purpose.,37
NA,"We have only one thing to consider, and",37
NA,"that is the war, and nothing but the war.",37
NA,I have noticed with satisfaction the fol-,37
NA,lowing statement by the Treasurer: -,37
NA,At the recent Conference of Premiers the,37
NA,following particulars were given:-,37
NA,Estimated number of soldiers who' can be,37
NA,settled on the land-,37
NA,"Up to 30th June, 1917 . . 2,400",37
NA,"Up to 30th June, 1918 . . .11.000",37
NA,"Up to 30th June, 1919 . . 13,600",37
NA,Total number of settlers in,37
NA,"three years .. . . 27,000",37
NA,Amount said to be required by States for,37
NA,"land settlement, irrespective of purchase of",37
NA,land-,37
NA,"Up to 30th June, 1917 .. £1.250,000",37
NA,"Up to 30th June; 1918 .. £8.447,000",37
NA,"Up to 30th June, 1919 .. £9,245,000",37
NA,Total amount for three,37
NA,"years .. .. £18,942,000",37
NA,I am quite sure thafc every honorahle,38
NA,member will agreefchafcthis is proper ex-,38
NA,penditure. The people of Australia will,38
NA,"nofc mind being taxed, so long as ample",38
NA,and adequate provision is made for the,38
NA,brave boys who have risked everything for,38
NA,tlie cause of tho Empire. There is another,38
NA,paragraph of the Treasurer's statement,38
NA,"for which, I think, the primary producers",38
NA,of Australia will thank the right honor-,38
NA,able gentleman. H e says-,38
NA,Information recently supplied to the,38
NA,sury shows that the cash payments already,38
NA,made to farmers on account of last season's,38
NA,"wheat may be taken as £24,200,000. As the",38
NA,"balance of the crop has now been disposed of,",38
NA,"further payments of £8,000,000 may be ex-",38
NA,pected.,38
NA,There is a feeling of discontent amongst,38
NA,the farmers of Australia. Let me say,38
NA,that the men whom we should encourage,38
NA,more than any one else i n Australia are,38
NA,"fche primary producers. I find, according",38
NA,"to Mr Knibbs' figures, that i n 1914-15,",38
NA,the area under wheat i n the CommonTreasurer,38
NA,"wealth was 9,651,081 acres; 1915-16,",38
NA,"area was 12,530,721 acres; and i n 1917,",38
NA,"the area was 11,524,031 acres. That",38
NA,"to say, that for these three years, the light",38
NA,aggregate area cultivated for wheat was,38
NA,"33,705,833 acres. According to the New",38
NA,"South Wales Agricultura l Department,",38
NA,the expense involved i n the cultivation of any one.,38
NA,land amounts to £ 2 0s. 6d. per acre. We,38
NA,farmers consider that a fair cost is 35s.,38
NA,per acre. I f we multiply the total area,38
NA,I have quoted for the three years men-,38
NA,"tioned by 35s., we shall find that",38
NA,"£58,985,607 15s. was spent upon the",38
NA,cultivation of the wheat lands of,38
NA,Australia in those three years.,38
NA,"The yield for the year 1914-15, unfor-",38
NA,"tunately a bad year for the farmers, was",38
NA,"24,892,402 bushels, for which the farmers",38
NA,"received £7,500,000. The yield for",38
NA,"1915-16 was 179,fi24.183 bushels, for",38
NA,"which, at the rate of 3s. 6d. per bushel,",38
NA,less about 6d. per bushel which was de-,38
NA,"ducted for expenses, the farmers received",38
NA,"£27,000,000. The yield for 1916-17 was",38
NA,"143,475,516 bushels, for which the far-",38
NA,"mers have received £18,000,000. For the",38
NA,three years the farmers have received,38
NA,"£52,500,000, whereas the cost of cultiva-",38
NA,"tion bas been £58.985,607. This shows",38
NA,"a net loss of £6,485,607, which has been",38
NA,met by advances from financial institu-,38
NA,"tions, banks, and private persons who",38
NA,have come to the assistance of t h e ' f a r -,38
NA,mers. There is a great shortage of food-,38
NA,[400],38
NA,stuffs throughout the world. England is,38
NA,particularly desirous of getting as much,38
NA,"wheat as she can. Therefore, we should",38
NA,above all things encourage the farming,38
NA,industry. The farmer does not need,38
NA,"much urging. The Treasurer says, i n his",38
NA,"financial statement, "" As the balance of",38
NA,"fche crop has now been disposed of, f u r -",38
NA,"ther payments of £8,000,000 may be ex-",38
NA,"pected."" A small deputation of honor-",38
NA,able members waited on him this after-,38
NA,"Trea- noon, and he gave i t most sympathetic",38
NA,consideration. I understand that he has,38
NA,made an arrangement with the Governor,38
NA,of the Commonwealth Bank so that the,38
NA,farmers may receive an extra instalment,38
NA,by way of advance on their wheat crop.,38
NA,When the farmers were asked to go into,38
NA,"the Wheat Pool with their 1915-16 crop,",38
NA,they were informed that payment would,38
NA,"be made on the 30th November last, but,",38
NA,"so far, they have only received an instal-",38
NA,ment of the amount that they were pro-,38
NA,"mised. Therefore, I am pleased tbat the",38
NA,"is considering their position,",38
NA,the and is guarding their interests. Before,38
NA,"we prorogue, i t is possible that we may",38
NA,is take action towards repealing the Day-,38
NA,"Saving B i l l , which is nofc acceptable",38
NA,"to fche people i n country districts, nor, I",38
NA,"believe, to many people i n the cities.",38
Mr BURNS , I t is not acceptable to,38
NA,NA,38
NA,"like a flash. I put my watch on i t , and",38
NA,found that the measure passed through,38
NA,this House i n five minutes. Every hon-,38
NA,"orable member on both sides voted f or ifc,",38
NA,so thafc the responsibility rests on the,38
NA,"whole Parliament, and not on any par-",38
NA,ticular party. I was thunderstruck tne,38
NA,other day when the Leader of the Oppo-,38
