Speaker,Text,pageNumbers
NA,"interest at 5 per cent, on war-time saving",19
NA,-certificates. I am quite satisfied that if,19
NA,the system is properly instituted it will,19
NA,be successful. It is important to remem-,19
NA,ber that under such a system there would,19
NA,be a continuous stream of money coming,19
NA,"in, as there is under the system in force in",19
NA,the United Kingdom to-day. It would,19
NA,"encourage people to save, and, at the same",19
NA,"time, assist in providing the money neces-",19
NA,sary to win the war. I have mentioned,19
NA,"our commitments, and honorable mem-",19
NA,"bers will agree that the help is required,",19
NA,"not of a few individuals, but of every one",19
NA,"in Australia, to provide the funds which",19
NA,are as essential to the winning of the war,19
NA,"as are the men who are engaged"" in it.",19
NA,I trust that the Treasurer will give a,19
NA,stimulus to the latest War Loan. Under,19
NA,the legislation which has been passed by,19
NA,"this Parliament, we have the power to in-",19
NA,NA,19
NA,"crease the amount of £18,000,000, last",19
NA,"called for, up to £29,000,000. To-day",19
NA,"we have had contributed over £20,000,000,",19
NA,and I am satisfied that we could easily,19
NA,secure the balance i f a little effort is made,19
NA,to do so. I repeat that at the end of the,19
NA,present financial year we shall have pro-,19
NA,vision for only one month's Supply for,19
NA,"war purposes, and we must make an effort",19
NA,to get all the money that it is possible to,19
NA,obtain while it is available.,19
Mr HIGGS ,I call attention to the,19
NA,state of the Committee. [ Quorum formed.'],19
NA,NA,19
NA,sorry that the Postmaster-General is not,19
NA,"present, because I would not have risen",19
NA,to take part in the debate but for some,19
NA,remarks which the honorable gentleman,19
NA,made last evening. As he does not choose,19
NA,"to come into the chamber, I must go on",19
NA,with my speech in his absence. The ob-,19
NA,servations he made last night would lead,19
NA,one to believe that he represented the,19
NA,"whole of the Labour movement, and was",19
NA,the only pure merino. I felt somewhat,19
NA,sore about what the honorable gentleman,19
NA,had to say with regard to the Australian,19
NA,"Workers Union, and what he called the",19
NA,""" junta."" I f there is one man in this",19
NA,"chamber who, more than another, should",19
NA,be grateful to the Australian Workers,19
NA,"Union, he is William Webster, the Post-",19
NA,master-General of the Commonwealth.,19
NA,The Australian Workers Union have,19
NA,done something for the honorable gentle-,19
NA,man that he could not have done for,19
NA,himself. They not only gave him place,19
NA,"and power in the Commonwealth, but",19
NA,financially assisted him to secure his posi-,19
NA,tion.,19
Mr MAHONY ,I think we should have,19
NA,a quorum. [Quorum formed.],19
NA,NA,19
NA,able member for Gwydir fumed and',19
NA,"fretted, and walked up and down like a",19
NA,"caged tiger, when speaking of what the",19
NA,"junta had done for him, and what he had",19
NA,done for the junta. I venture to say that,19
NA,if the relations between the junta and the,19
NA,honorable member were considered from,19
NA,"the pounds, shillings, and pence point of",19
NA,"view, i t would be found that the honor-",19
NA,able gentleman is a debtor to the Labour,19
NA,movement to a very great extent. He,19
NA,tried at one time to get into the New,19
NA,South Wales Parliament for the electoral,19
NA,division of Canterbury. The honorable,19
NA,"gentleman stood at the time, not in the",19
NA,"Labour interest, but in the Protectionist",20
NA,"interest, and he was pelted from one end",20
NA,of the electorate to the other with bags of,20
NA,flour. Therefore he has indeed a lot to,20
NA,talk about. These gentlemen make,20
NA,me smile when they talk of what,20
NA,they have done for the Labour move-,20
NA,ment. I wish to be candid. The,20
NA,honorable member for'' Moreton seems,20
NA,terribly concerned about '.' poor old Dad,20
NA,"Spence,"" the honorable member for Dar-",20
NA,ling. As far as that honorable member,20
NA,"is concerned, his drop from grace has",20
NA,"been a tragedy in connexion, with this",20
NA,political crisis. He has been the father,20
NA,of the Labour movement in Australia; his,20
NA,name until a few months ago was one,20
NA,to conjure with; he had the love of.,20
NA,every man of the .pastoral branch of the,20
NA,Australian Workers Union from one end,20
NA,"of Australia to the other, and I say, in",20
NA,"all sincerity, his drop from grace has",20
NA,been a tragedy.,20
Mr LYNCH , He is more honoured,20
NA,than ever.,20
NA,NA,20
NA,prove it. Until the time that he slipped,20
NA,he had a majority of votes from all parts,20
NA,of Australia for the presidency of the,20
NA,Australian Workers Union.,20
Mr ARCHIBALD , Was he not' sus- scription.,20
NA,"pended, and the voting in his favour",20
NA,stopped ?,20
NA,NA,20
NA,"ing all through the year, and up to",20
NA,time that he seceded from the Labour,20
NA,movement he was in the ascendant on,20
NA,that ballot.,20
Mr ARCHIBALD ,fi e did not secede.',20
NA,NA,20
NA,all walk oub like a lot of cattle going,20
NA,"the crush ? You all went into the crush,",20
NA,"and, like cattle, you were slaughtered.",20
NA,Certainly you walked out.,20
Mr ARCHIBALD ,Instea d of suspendand show i t to me.,20
NA,"ing him, why did you not "" chuck """,20
NA,out!,20
NA,NA,20
NA,""" chucked "" out; he "" chucked "" himself",20
NA,out.,20
Mr ARCHIBALD ,Di d he not have to,20
NA,resign in order to get any votes at all?,20
NA,NA,20
NA,"long before his suspension took place,",20
NA,and up to that time he led in the ballot.,20
NA,I t was from that moment that he went,20
NA,"down, and went down badly, not only",20
NA,"in Victoria and New South Wales, but tion ?",20
NA,"-throughout Australia, and there is nothing",20
NA,I regret in this poitical crisis,20
NA,than the fate that has befallen the hon-,20
NA,orable member for Darling.,20
Mr ARCHIBALD ,H e does not worry,20
NA,about i t .,20
NA,NA,20
NA,told that the man who has carried the,20
NA,banner of Labour for a lifetime does not,20
NA,feel his position when he finds himself,20
NA,"suddenly thrown out, and is passed in",20
NA,"the street, as I have seen myself, by",20
NA,members of the Australian Workers,20
NA,Union. He would not be human' if he,20
NA,did nob feel his position.,20
NA,Mr W. ELLIOT JOHNSON -I t only,20
NA,shows the ingratitude of those who pass,20
NA,him in the street.,20
NA,NA,20
NA,"be no "" monkeying"" with the Labour",20
NA,movement. . A man has to be a Labour,20
NA,man or has not to be one.,20
Mr ARCHIBALD , He has to be a,20
NA,""" lackey"" of the Trades Hall, just as",20
NA,the honorable member is.,20
NA,NA,20
NA,member that since I have been in the,20
NA,Commonwealth Parliament I have not.,20
NA,been asked by 'the organizations i n,20
NA,Queensland to vote for or against any,20
NA,proposition.,20
Mr RICHARD FOSTER ,Excep t con-,20
NA,NA,20
NA,vote for or against conscription. I am,20
NA,that the honorable member has,20
NA,"the made thab remark, because a gentleman",20
NA,in another place is anxious to fasten on,20
NA,to me the report that I was a supporter,20
NA,of conscription. I ask honorable mem-,20
NA,bers who are now with the Government i f,20
NA,they ever heard me talking in favour of,20
NA,into conscription before the campaign started?,20
Mr SINCLAIR , I did. ',20
NA,NA,20
NA,"of mine where I supported conscription,",20
NA,The honorable,20
NA,him member for Denison is one of the most,20
NA,sober and truthful men among those,20
NA,I ask him whether,20
NA,he remembers bhe occasion when upstairs,20
NA,I opposed the taking of the war census.,20
NA,"I stood up alone, and said to the present",20
NA,Prime Minister that he had bulldozed,20
NA,"on the Cabinet, and now came prepared to",20
NA,"bulldoze the Caucus. D i d I not say that,",20
NA,"if I had to stand alone in the House, I",20
NA,would tell the country that what was pro-,20
NA,posed meant the thin end of conscrip-,20
Mr MAHONY ,Wha t the honorable,20
NA,more member says is perfectly true.,20
Mr ARCHIBALD , T h a t was i n Mr upon the honorable member-'',21
NA,Fisher's time.,21
NA,NA,21
NA,"time ; and when I stated that i t was my the light, and about tearing",21
NA,intention to resign and contest my conconscriptionists,21
NA,"stituency on the issue, Mr Fisher perwith",21
NA,suaded me not to do so.,21
NA,"keenly about conscription so far back as Cessnock was-Yes,",21
NA,"then, and it) ill-becomes any honorable he went to Wellington",21
NA,"gentleman i n another place to t r y to meeting,",21
NA,"fasten conscription on to me. However, "" Bumper meeting at Wellington,",21
NA,that is beside the question.,21
NA,the Postmaster-General tried to claim,21
NA,the Opposition were all opposed to the,21
NA,"voluntary system; that, though some of us dose of what he got st Canterbury",21
NA,"had done something for recruiting, we years previously.",21
NA,were all at heart rebels and disloyalists.,21
NA,"What has the Postmaster-General done to worker, opened the eyes of the",21
NA,"show his loyalty, except a little flag-wavand made many converts.""",21
NA,"ing and band-playing, and the despatch",21
NA,of sensational telegrams during the mili-,21
NA,tary service referendum campaign ? Here him to do.that?,21
NA,"is one telegram that he sent, "" Addressed",21
NA,"2,000 people in picture theatre at Cessmeeting",21
NA,"nock. Spoke for two hours ""-tha t is how",21
NA,"he does his bit, by speaking f o r two hours time i n his telegram.",21
NA,"- "" and answered questions f o r another",21
NA,"hour ""-h e must have had a lively time;",21
NA,"I know what platform work is, and I conluded",21
NA,sider that he must have had one of the,21
NA,"liveliest times of his l i f e - "" Splendid",21
NA,"meeting ""-n o doubt i t was- "" Nailed",21
NA,"down ' a n t i ' delusions ""-whateve r they",21
NA,are; what did he nai l them down with?,21
Mr BOYD ,Wit h,21
NA,speech.,21
NA,NA,21
NA,were listening to h i m ! The telegram prothe,21
NA,"ceeds, "" Letting the light into dark same",21
NA,"places."" I s i t not peculiar that every",21
NA,orable member opposite is looking for speech,21
NA,"light? The Prime Minister, when he",21
NA,"came back t o Australia, was still looking",21
NA,for l i g h t ; he was looking for light at,21
NA,mantle. The Postmaster-General was looksion,21
NA,ing f o r light at Cessnock. Neither of them,21
NA,has said what that light was. The other,21
NA,day there was a little reference i n this,21
NA,chamber to a red light and a green light. opposite are doubtful.,21
NA,"The telegram proceeds, "" The tide is t u r",21
NA,"ing."" W h a t tide was turning that",21
NA,"Postmaster-General had, like",21
NA,"Partington, to endeavour",21
NA,i t back with a ' broom ? Who turned,21
NA,the tide? This modern,21
NA,who upset the whole building with,21
NA,his shoulders. I would like to know,21
NA,lady who shore his locks. The telegram,21
NA,"proceeds, "" Civilization w i l l survive!""-",21
NA,the whole civilized world was depending,21
NA,Australia,21
NA,"will be ithere!"" After all this flapdoodle",21
NA,seeing,21
NA,the anti-,21
NA,"to shreds, and doing away",21
NA,"all their delusions, came the fatal day",21
NA,I felt very -the 28th October-and the voting at,21
NA,"975; No, 2,475. Then",21
NA,and addressed a,21
NA,"and he sent another telegram,",21
NA,though,21
NA,"Last night a bit lively."" They made it a bit lively",21
NA,that for him there; they began to know our,21
NA,"William there, and they gave him another",21
NA,a few,21
NA,""" I have mangled Doyle's",21
NA,"manifesto, routed the shirker, inspired the",21
NA,"farmer,",21
NA,What would,21
NA,have happened if he had not gone there 1,21
Mr SINCLAIR ,Ho w long did i t take,21
NA,NA,21
NA,"was lively, you can bet your bot-",21
NA,tom dollar that i t was. H e mentions no,21
NA,He merely says,21
NA,"that he mangled Doyle's manifesto, routed",21
NA,"the shirker, upset the worker, and de-",21
NA,"the farmer, and the voting turned",21
NA,out to be five to one against h i m .,21
Mr BOYD ,Wh o is the Doyle referred,21
NA,to?,21
Mr ANSTEY ,:-H e is the junta.,21
NA,NA,21
NA,"his two-hours' New South Wales. I have not met. him,",21
NA,but I have read the manifesto referred to.,21
NA,"I f the Postmaster-General, when he faces",21
NA,"music i n a few days, is going to do the",21
NA,i n his electorate as he d i d during the,21
NA,"honmilitary service referendum' campaign, his",21
NA,last night was his swan-song i n this,21
NA,"chamber, and i f he is to rout the shirkers,",21
NA,"delude the farmers, upset the workers,",21
NA,Freand tear up Doyle's manifesto on this occa-,21
NA,"as he did on that, and his efforts",21
NA,"are to have the same result, my advice to",21
NA,the Government W h i p is to keep him out,21
NA,of any electorate about which my friends,21
NA,When he was,21
NA,"n - speaking last night, I interjected that i t",21
NA,the was a dirty bird that fouled its own,21
NA,Mother nest. The least the honorable member,21
NA,to sweep could do was not to besmirch the char-,21
NA,"acter of the men who have stood to h i m,",21
NA,"Sampson, and by h i m . and p u t him i n his present",21
NA,position. Some of those who are now sit-,21
NA,"the ting cheek by jowl with him w i l l , no",21
NA,"doubt, remember the nice, kind things",21
NA,he said about them. They have all got,21
NA,"their arms round each other's necks now,",21
NA,"and one of them said to-day, "" We are",22
NA,"going to sink or swim together."" Some",22
NA,of them are going to do both.,22
NA,"the consequences -will be, time alone will",22
NA,tell.,22
NA,When the Postmaster-General is throw-,22
NA,"ing his compliments about, he ought",22
NA,to be careful of what he is saying. He,22
NA,accused every man on this side last night,22
NA,"not only of being disloyal, but of believ-",22
NA,ing in neither the voluntary nor the con-,22
NA,"script system. He asked, "" What have",22
NA,"you done for voluntarism ?"" I inter-",22
NA,"jected, "" W h a t have you done?"" Since",22
NA,"the referendum vote was taken, he has",22
NA,riot been game to go on a single plati-,22
NA,form. Yet he had the cold audacity to,22
NA,talk here about what members of this side,22
NA,have been doing. I do not want to tell,22
NA,"people that I am loyal, or about what I",22
NA,"am doing, or have done; but m y feeling",22
NA,towards Great Britain and Australia is,22
NA,that fchey can not only have my carcass,22
NA,"to do what they like with , but every",22
NA,""" b o b "" i n my possession, too. W i l l the",22
NA,Postmaster-General say the same?,22
NA,"he w i l l , I am prepared to hand over my",22
NA,"bank book to the Treasurer to-morrow,",22
NA,"giving him every "" bob "" I possess. That",22
NA,is my feeling towards this country.,22
NA,There is no fairer country under,22
NA,"the sun than Australia, and I w i l",22
NA,shed my last drop of blood i n,22
NA,fence of the country that has been the solidarity party.,22
NA,"so good f o r me, and to me, and",22
NA,"give i t everything I possess, too.",22
NA,is the patriotism that permeates me. I,22
NA,"the Postmaster-Generai is a patriot,",22
NA,"him also - put his lot into the pool, and",22
NA,show his patriotism i n that manner.,22
NA,"him put i n all he can, whether i t be little sign i t .",22
NA,"or much, and I will do the same. That",22
NA,"will show how much our loyalty is worth. Labour party, refused to sign i t .",22
NA,When the new recruiting scheme was,22
NA,"started in Queensland, Senator Turley",22
NA,"and I went out just after Christmas,",22
NA,put i n time out west on recruiting platcusing,22
NA,forms. We were so successful that my,22
NA,"vice-chairman, now at Dalby, only",22
NA,terday senfc me a letter asking me to,22
NA,"up this "" talking shop,"" and come out they",22
NA,aud get recruits. I am quite willing,22
NA,"do i t , and as soon as I can be released",22
NA,' from my duties here my dart is straight,22
NA,into my electorate to do my duty there,22
NA,to my country. W i l l the Postmaster-Genethey,22
NA,ral do the same ? N'ot much. He w i,22
NA,"urgent business to do here in Melbourne,",22
NA,"not only in his own Department, but i n cisions.",22
NA,minding the business of other Depart-,22
NA,ments.,22
Mr ANSTEY ,Won' t he be after sav-,22
NA,ing his own skin ?,22
NA,NA,22
NA,""" S.O.S."" signal up very quickly, and",22
NA,will be out as soon as the rest of us; but,22
NA,he will stop i n Melbourne as long as he,22
NA,can. He should be the last to speak,22
NA,about what members on either side of the,22
NA,House have done towards recruiting.,22
NA,People who live i n glass houses should,22
NA,"nofc throw stones, and those he has thrown",22
NA,w i l l come back on him.,22
NA,As this may be the last time I shall,22
NA,have the opportunity of speaking i n,22
NA,"the House, I want to record i n Han-",22
NA,sard the' facts as to what took place,22
NA,i n New South Wales i n 1893 and,22
NA,1894. The State then passed through,22
NA,exactly the same political crisis as the,22
NA,"Commonwealth is passing through to-day,",22
NA,and the principal actors i n the events of,22
NA,that time were .William Morris Hughes,22
NA,and William Holman. The same names,22
NA,If were being applied to the honorable mem-,22
NA,ber for Parramatta when he was Leader,22
NA,of the Labour party.,22
Mr LAIRD SMITH , W a s not Senator,22
NA,Gardiner i n i t also?,22
NA,NA,22
NA,"were two parties i n the Labour ranks,",22
NA,l the solidarity party and the liquidarity,22
NA,departy. Hughes and Holman belonged to,22
NA,They said the,22
NA,whole Labour movement should be con-,22
NA,"That trolled, not by honorable members i n",22
NA,"f Parliament, but by the organizations out-",22
NA,let side. They said the organizations should,22
NA,"have fche right to frame the platform, and",22
NA,Let that any man standing for Labour should,22
NA,The honorable member for,22
NA,"Parramatta, who was then Leader of the",22
NA,He,22
NA,"refused to be bound, and all the political",22
NA,vitriol possible was thrown at him when,22
NA,and he stood for Lithgow. Those who are ac-,22
NA,the junta to-day of doing certain,22
NA,things are the very men that created that,22
NA,yesjunta i n 1893 and 1894. Their chickens,22
NA,shut have come home to roost. They find that,22
NA,cannot restrain this junta. I t w i l l not,22
NA,to do what they want i t to do. They have,22
NA,controlled whafc they call the junta up to,22
NA,"to-day, but the outside organizations",22
NA,have taken a greater hand i n politics than,22
NA,"took before, and rightly so. They",22
NA,l l have sent us here to do certain things.,22
Mr SAMPSON ,T o register their de-,22
NA,NA,23
NA,that they put in the platform. I f a man,23
NA,signs a promissory-note and does not pay,23
NA,"ifc, he commits a dishonest act. We sign",23
NA,"the platform, and fchey expect) us to carry",23
NA,i t into effect. That is all they ask of us.,23
Mr SAMPSON ,I s not Parliament,23
NA,very costly machine to do simply the regis-,23
NA,tration work of outside bodies ?,23
NA,NA,23
NA,honorable member doing,23
NA,"against his party, and see how he would",23
NA,"get on, although he has not signed a",23
NA,"pledge. One particular member, whom",23
NA,"I shall not name, went against his party,",23
NA,and has remembered i t ever since. The,23
NA,"late Tommy Bent was in i t , and so were",23
NA,"the Minister for Works and Railways,",23
NA,and several other members of this House.,23
NA,The honorable member to whom I,23
NA,refer took i t on himself to play a lone,23
NA,"hand, and they not only sacrificed him,",23
NA,but scarified him from one end of Vic-,23
NA,toria to the other. Honorable members,23
NA,"opposite, therefore, must not blame the",23
NA,Labour party as i f they were the only,23
NA,ones to do that sort of thing. We have,23
NA,too often been deluded by promises by,23
NA,men who forgot them as soon as they got,23
NA,into Parliament. For the time being,23
NA,this vituperation seems bad. but we have,23
NA,"been through i t all before, and the Labour",23
NA,party will survive i t all. A cork will,23
NA,stay under water only as long as a man,23
NA,"^ffips his hand on i t , and even i f we do",23
NA,go down at the next election-an d I do,23
NA,not expect that we will-w e w i l l bob up,23
NA,"again more serenely than before, as the",23
NA,cork does when the hand is removed.,23
NA,The only way to get pure and stable go-,23
NA,vernment in this country is by return-,23
NA,"ing the Labour party, which stands",23
NA,"for liberty, equality, fraternity, and",23
NA,humanity.,23
NA,Mr W . ELLIOTJOHNSON (Lang),23
NA,[4.551 -If . this debate serves no other,23
NA,"useful purpose i t w i l l , at any rate, have'",23
NA,served the one of opening the eyes of the,23
NA,people to the character of their represen-,23
NA,tation in Parliament when they repose,23
NA,their trust i n the Labour candidates at,23
NA,a general election. We have had during,23
NA,this debate some entertaining and instruc-,23
NA,tive light lefc i n on the methods and,23
NA,practices of Caucus government.,23
NA,"revelations are very useful, because when",23
NA,"we, as members of the Liberal party,",23
NA,attempted to open the eyes of the eleotors,23
NA,fco the farce enacted under the name of,23
NA,"Democracy, by which the Labour party,",23
NA,professing adherence to the principles o f,23
NA,"eoual freedom and equal justice, and the",23
NA,representation of the majority of the peo-,23
NA,"ple, in practice showed that they did",23
NA,"nothing for, and cared less about, such",23
NA,"principles, the united voice of the Labour",23
NA,a members declared thafc we were stating,23
NA,something which was not correct. We-,23
NA,pointed out thafc their only guiding prin-,23
NA,ciple was slavish obedience to an irrespon-,23
NA,something sible self-constituted authority which,23
NA,"has been termed a junta, and which",23
NA,"claimed, and exercised, the righ t to hold",23
NA,a sword over the head of every Labour-,23
NA,member i f he did not do its bid-,23
NA,"ding, and to destroy his political career",23
NA,for ever by withholding f r o m h i m any,23
NA,chance of getting another Labour selec-,23
NA,tion. The public will now have the satis-,23
NA,faction of knowing that our statements on,23
NA,those occasions have been more than amply,23
NA,"corroborated by members who, until re-",23
NA,"cently, belonged to that party, but have-",23
NA,severed their connexion with ib through,23
NA,circumstances of overbearing tyrannical,23
NA,despotism which need not be again re-,23
NA,ferred to. We have now some inside,23
NA,knowledge of the peculiar ethics which,23
NA,"govern the constitution of that party, and'",23
NA,the Caucus revelations i n this debate,23
NA,show clearly that there can be no such,23
NA,thing as responsible government under,23
NA,Labour rule i n this country.,23
Mr FENTON ,Yo u have responsible go-,23
NA,"vernment now, have you not?",23
Mr W ELLIOTJOHNSON ,W e hope-,23
NA,to re-establish responsible government.,23
NA,Those honorable members who recently,23
NA,"belonged to the Caucus party, and have",23
NA,"since severed their connexion with i t , must",23
NA,feel already the beneficial effects of the,23
NA,freer political atmosphere they are now,23
NA,breathing.,23
Mr FENTON ,Tha t accounts for their-,23
NA,ferocity.,23
Mr W ELLIOTJOHNSON ,Th e,23
NA,ferocity seems to have been all on the,23
NA,other side. One of the most excruciatingly,23
NA,funny features of the whole situation is-,23
NA,fche vituperation and vindictiveness dis-,23
NA,played towards their late leader by the,23
NA,members of what is now known .as the,23
NA,Official Labour party. We have only to,23
NA,These carry our minds back to a few short weeks -,23
NA,"ago, when the present Prime Minister re-",23
NA,"turned from England, with exactly the",23
NA,same views that he has since been express-,23
NA,ing. There was then i n the minds o f,23
NA,every member of the Caucus party the-,23
NA,feeling that the speeches delivered i n Lon-,24
NA,don-whic h they applauded and which,24
NA,they described as being the speeches of,24
NA,one of the greabesb statesmen of uhe Em-,24
NA,pire-speeche s by a man of whom they,24
NA,said they had every reason to be intensely,24
NA,proud-portende d a certain course of action,24
NA,in the raising of the necessary reinforce-,24
NA,ments for the f r o n t ; and they f u,24
NA,"cipated, and were prepared for the Prime",24
NA,"Minister, as their leader, declaring",24
NA,straight out for conscription as soon as he,24
NA,returned. Had he taken the course which,24
NA,a strong man would have taken under,24
NA,"the circumstances, undeterred by fear of",24
NA,what might happen to his party as a,24
NA,"result of his action, I have reason to know",24
NA,that many of those who are amongst the,24
NA,most extreme in their denunciation of him,24
NA,would still have been amongst his heartiest,24
NA,supporters. I t was only because he shirked,24
NA,"a responsibility which he, as the Prime",24
NA,Minister of the countrv. ought to have,24
NA,shouldered-an d I have never said any-,24
NA,thing to the contrary-h e being the one,24
NA,man alone i n Australia who was i n posses-,24
NA,"sion of all the facts, and shifted i t on to",24
NA,"the people, that the present position of",24
NA,vitriolic personal animosity has arisen.,24
NA,H e took what I consider was the,24
NA,most injudicious step of calling up the,24
NA,"manhood of the country, without any",24
NA,discrimination-withou t any regard to the,24
NA,"various interests, either of the men them-",24
NA,"selves or of employers and others-and ,",24
NA,"further, he delayed the taking of the",24
NA,referendum for so long a time as to give,24
NA,every opportunity for hostile organiza-,24
NA,"tion, and for the work of misrepresenta-",24
NA,"tion, mendacity, destruction, and defeat",24
NA,t o be arranged and efficiently carried,24
NA,out. I t was only when this work,24
