Speaker,Text,pageNumbers
NA,"am willing"" to give the method a trial.",29
NA,"The inquiries of the Board, and its re-",29
NA,"ports to Parliament, will be wholesome reduced ?",29
NA,in their effect; but whether the methods,29
NA,of distributing manufactured goods can,29
NA,"be regulated, and penalties imposed for",29
NA,"the charging of unreasonable prices, is",29
NA,another matter. I have grave doubts on,29
NA,the subject. I f the Attorney-General and,29
NA,the Minister for Trade and Customs,29
NA,think that the suggestion of the honor-,29
NA,able member for Wakefield is impractic-,29
NA,"able and unconstitutional, I shall not",29
NA,"support it. But, i n my opinion, i t is the",29
NA,"best that can be done, and goes as far as",29
NA,we can go under the Constitution.,29
Mr GROOM ,"Darling Downs-Minis- """,29
NA,ter for Works and Railways) [12.20] -,29
NA,We have discussed this matter with the,29
NA,"Solicitors-General,"" and he agrees that",29
NA,there is the grave doubt about the con-,29
NA,stitutionality of the amendment of the,29
NA,honorable member for Dampier ( Mr.,29
NA,Gregory). Ministers: desire that the,29
NA,fullest investigations should be made into,29
NA,everything directly or indirectly con-,29
NA,"nected with the Tariff, so that no one",29
NA,may take undue advantage of the Tariff.,29
NA,The honorable member proposes that any,29
NA,complaint that a consumer is being,29
NA,charged unfair prices for protected ar-,29
NA,ticles shall be investigated. But suppose,29
NA,that a Sydney merchant were selling an,29
NA,"agricultural implement, manufactured",29
NA,"under the protection of the Tariff, to a",29
NA,"farmer in the Wagga district, and that",29
NA,the farmer complained that he was being,29
NA,charged an unfair price for that imple-,29
NA,"ment. I f the Board made an investigation,",29
NA,and called upon the merchant to answer,29
NA,"itsquestions, he, like in the Colonial",29
NA,"Sugar Refining Company, in a case in",29
NA,which a Royal Commission wished to ob-,29
NA,"tain evidence some time ago, would say,",29
NA,""" I shall not reply to your questions, and",29
NA,"you cannotcompel me to do so, because",29
NA,I bought the article in question within,29
NA,"the State, and sold i t within the State.",29
NA,"No Customs duty was collected on i t , and",29
NA,the transaction was wholly a State mat-,29
NA,"ter, with which you have no constitu-",29
NA,"tional power to interfere."" I n those cir-",29
NA,"cumstances, the investigation might not",29
NA,be possible.,29
Mr GREGORY ,Th e Board would re-,29
NA,port that it was complained that unfair,29
NA,"prices were being charged, and that the",29
NA,merchant concerned refused to give evi-,29
NA,dence on the subject.,29
Mr GROOM ,Bu t i t could do,29
NA,nothing more.,29
Mr STEWART ,Coul d not the duty be,29
NA,M i \ GEOOM -Woul d tliat be fair to,30
NA,"the manufacturer of tbe article, who, per-",30
NA,"haps, was in no way responsible for the",30
NA,.conduct of the merchant?,30
Mr STEWART ,"Th e effect would be ""to",30
NA,require him to make' a better choice of,30
NA,distributors - -,30
Mr GREGORY ,Ther e would be prim&,30
NA,-facia evidence in the. conduct,30
NA,chant that there was something to hide.,30
- Mr GROOM ,^-Parliament should not;,30
NA,"in Federal legislation,, assume powers and",30
NA,a jurisdiction .that it. may hot possess:,30
NA,"But we have tried ,to meet the honorable",30
NA,"member, and also to.meet the honorable",30
NA,member for -Wakefield ( Mr Eichard,30
NA,Foster). The protection of industry,30
NA,and the general regulation of distribution,30
NA,throughout the commiunity are two dis-,30
NA,"tinct matters. , There is no power to deal",30
NA,"directly with distribution,- and the hon-",30
NA,orable member for Dampier has asked us,30
NA,"to deal^with a matter concerning ""which",30
NA,serious doubts exist - The honorable,30
NA,member for Wakefield contends that. a,30
NA,"manufacturer should, in effect, be willing",30
NA,to sell his goods to every person who is,30
NA,ready to buy from him. But it is con-,30
NA,ceivable that a -concern might wish t.o,30
NA,save distributing costs by making arrange-,30
NA,ments with outside firms. Some of,30
NA,the big companiesain -Australia are pro-,30
NA,"viding their workmen with goods, and",30
NA,saving the cost of distribution by buying,30
NA,direct from the wholesale merchants.,30
NA,This Parliament could not impose on any,30
NA,"individual, as an express and positive",30
NA,"duty, that he should do what the",30
NA,honorable member for Wakefield sug-,30
NA,"gests, because it cannot dictate to an in-",30
NA,dividual in any State to whom he shall,30
NA,or shall not sell. I f a woollen manufac-,30
NA,"turer were making a trade arrangement,",30
NA,"resulting in higher prices being charged,",30
NA,the Minister's proposal would permit an,30
NA,investigation. He is willing to widen the,30
NA,scope of inquiry. I t is the consumer' who,30
NA,is entitled to make the complaint. He may,30
NA,"say, "" I was charged an undue price for",30
NA,"the goods which I purchased, owing to",30
NA,"some arrangement, agreement, or under-",30
NA,"standing which had that result""; and an",30
NA,investigation may be made into that com-,30
NA,plaint. The honorable member for Wake-,30
NA,field wishes to interfere in a case such,30
NA,as that i n which a man in a country,30
NA,town applies to a manufacturer to buy,30
NA,"his goods, and cannot get supplies, al-",30
NA,"though he .finds that the .manufacturer""",30
NA,"has arranged to sell to other persons,,",30
NA,:,30
NA,"and, as the result of that arrangement;-",30
NA,the would-be purchaser finds that he haa,30
NA,"ultimately to pay,, buying indirectly, un-i",30
NA,reasonably high prices.,30
Mr GREGORY ,Bu t the'Minister's .pro-^,30
NA,posal does not allow the Board to get into,30
NA,of the mer- touch with the consumer.,30
Mr GROOM ,Yes ; the consumer,30
NA,would be the complainant under the,30
NA,Minister's amendment. The inquiry,30
NA,would be into the complaint that unneces-,30
NA,sarily high prices were being charged to,30
NA,the consumer for goods.,30
Mr GREGORY ,Wha t is the difference,30
NA,between the Minister's proposal and,30
NA,mine ?,30
NA,Mr GROOM:-Th e honorable mem-,30
NA,ber's amendment ' includes .purely retail,30
NA,"transactions, in which the manufacturer",30
NA,is not concerned; but under the Minis-,30
NA,ter's proposal the manufacturer who is,30
NA,protected must be brought in. The Min-,30
NA,ister's proposal meets the honorable mem-,30
NA,"ber to a great extent, and tries to apply",30
NA,"undoubted constitutional powers, with a",30
NA,view to doing to some extent what the,30
NA,honorable member desires to have done.,30
NA,I f the consumer has been charged un-,30
NA,necessarily high prices he can make his,30
NA,"complaint, and the Board can report on",30
NA,it.,30
Mr CONSIDINE ,"S o far as I can see"",",30
NA,the only difference between the proposal,30
NA,of the honorable member for Dampier. and,30
NA,that of the Minister is that one speaks of,30
NA,"unfair prices, and the other of unneces-",30
NA,sarily high prices.,30
Mr FRANCIS ,Henty) [12.29] -W e,30
NA,are right in endeavouring to protect the,30
NA,"consumer in every possible way, and the",30
NA,amendment of the honorable member for,30
NA,Dampier ( Mr Gregory) opens the way,30
NA,"to doingthat. I n my opinion, the pro-",30
NA,posal of the Minister would not remedy,30
NA,"the charging of unduly high prices, be-",30
NA,cause the manufacturer of the' goods may,30
NA,not be responsible for the prices charged,30
NA,to the consumers of them. I recognise,30
NA,the constitutional difficulties in -the way,30
NA,of the acceptance of the amendment of,30
NA,"the honorable member for Dampier, but",30
NA,there is always a difference of opinion,30
NA,"among lawyers, both in this Chamber and",30
NA,"outside, as to the constitutional powers of",30
NA,the Commonwealth. When the last ap-,30
NA,peal was made to the people to agree to,30
NA,"certain amendments i n the Constitution,",31
NA,"there were constitutional lawyers, who",31
NA,urged that the Parliament already,31
NA,had the power to do that for which those,31
NA,amendments of the Constitution were,31
NA,sought. The Acting Attorney-General,31
NA,{ Mr Groom) has said that he has dis-,31
NA,cussed this amendment with the Solicitor-,31
NA,"General, and that both are convinced that",31
NA,it goes beyond our constitutional' autho-,31
NA,"rity, Thero are other lawyers who take",31
NA,"a different view, and it seems to me that",31
NA,we could do no harm by giving the con-,31
NA,sumer the benefit of the doubt. The,31
NA,"amendment simply, provides that the",31
NA,Board shall be called upon to inquire and,31
NA,report as to any complaint that the con-,31
NA,sumers are being charged unfair prices,31
NA,for protected articles. I approve of the,31
NA,"amendment, whereas it seems to me that",31
NA,the suggestion made by the Minister,31
NA,amounts merely to a repetition of some-,31
NA,thing already appearing in the clause.,31
Mr RYAN ,Assumin g that the local,31
NA,"manufacturer of spokes, about whom the",31
NA,honorable member has been so much con-,31
NA,"cerned, sold them at a reasonable rate,",31
NA,but that some retailer of those spokes in,31
NA,an outback district charged unreasonable,31
NA,"prices for them, would the honorable",31
NA,member punish the manufacturer by tak-,31
NA,ing off the protective duty?,31
Mr FRANCIS , I recognise that it,31
NA,is difficult to control prices throughout the,31
NA,"States. ""We cannot exercise the control",31
NA,we desire unless we have a uniform fixa-,31
NA,tion of prices throughout the Common-,31
NA,"jwealth. We can, however, throw upon",31
NA,manufacturers the onus of showing that,31
NA,they have set up a system of distribution,31
NA,that will avoid exorbitant charges to the,31
NA,consumer. During the Tariff debate it,31
NA,was suggested that high duties might give,31
NA,"rise to monopolies and combines, but if",31
NA,? the people of Australia have to deal with,31
NA,a combine i t is better that i t should be,31
NA,".within the Commonwealth, where we can",31
NA,""" jcontrol i t , rather than overseas, where we parties.",31
NA,could not hope to control it. We have to,31
NA,"make the best of a bad job, and I am in-",31
NA,clined to think that the amendment moved,31
NA,hy the honorable member for Dampier will,31
NA,show the people of this country that we,31
NA,"are sincerely anxious to protect, the con-",31
NA,sumer. Where complaint is made that,31
NA,"unfair prices are being charged, the",31
NA,"Tariff Board, under the amendment,",31
NA,.would be called upon to investigate and,31
NA,"report, and on receipt of its report it",31
NA,would be for the Parliament itself to de-,31
NA,termine whether or not the protective duty,31
NA,affecting the industry concerned should,31
NA,be reduced or abolished. I hope that the,31
NA,Minister will accept the amendment.,31
Mr GREGORY ,Dampier) [12.35] -,31
NA,"Throughout the Tariff debate, when we",31
NA,suggested that the imposition of high,31
NA,duties would mean increased cost to the,31
NA,"consumer, i t was pointed out again and",31
NA,again by honorable members on both sides,31
NA,of the House that the Tariff Board would,31
NA,be able to take action to insure that rea-,31
NA,sonable prices were charged for the pro-,31
NA,ducts of protected industries. The Min-,31
NA,ister said that legislation would be,31
NA,brought forward to protect the consumer,31
NA,from unfair prices. That legislation is,31
NA,now before us; but i n submitting this,31
NA,"amendment, apparently, I have touched",31
NA,upon a very sore spot. I do not think i t,31
NA,would have been out of place had I asked,31
NA,that the Board should have pow«r to in-,31
NA,quire into the collection and distribution,31
NA,of moneys for the purposes of Tariff re-,31
NA,"form, or how such funds have reached",31
NA,various political ogranizations.,31
Mr RYAN ,Tha t must be a subject,31
NA,about which the honorable member knows,31
NA,a good deal.,31
Mr GREGORY ,Som e grave in-,31
NA,"sinuations, and, indeed, libellous state-",31
NA,ments have been published with regard to,31
NA,"the Country party, and I challenged the",31
NA,"Minister ( Mr Greene), in the earlier",31
NA,"stages of the debate on the Tariff, to go",31
NA,into that matter.,31
Mr RYAN ,I f the honorable member's,31
NA,party is free from any. taint of that,31
NA,sort,31
Mr GREGORY ,I t is absolutely,31
NA,free.,31
Mr RYAN , I dp not suggest that i t is ',31
NA,"not free from such a taint; but, if i t is,",31
NA,the honorable member should be the last,31
NA,to throw such an insinuation at other,31
Mr MASSYGREENE ,I t is best to ignore such,31
NA,insinuations.,31
Mr GREGORY ,Th e honorable mem-,31
NA,ber for West Sydney ( Mr Ryan) was.,31
NA,anything but generous in his remarks,31
NA,concerning the Country party a little,31
NA,while ago.,31
Mr RYAN , I did not suggest anything,31
NA,improper.,31
Mr GREGORY , I was not referring,31
NA,to the honorable member or his party,31
NA,when I alluded to this question of distri-,32
NA,bution of moneys collected for the pur-,32
NA,poses of Tariff reform. B u t I cannot,32
NA,help realizing the extent to which three,32
NA,or four big organizations i n this country,32
NA,have beeu obtaining control during the,32
NA,"last three or four years, and the great",32
NA,danger attaching to such a development.,32
NA,"We are told that i t is impossible, under",32
NA,"the. Commonwealth Constitution, to take",32
NA,action similar to that for which provi-,32
NA,sion is made in the Canadian Tariff A c t .,32
NA,"That A c t contains no reference to "" re-",32
NA,"straint of trade,"" but provides that i f",32
NA,there is anything i n the way of a com-,32
NA,bination or arrangement,32
Mr RYAN , I think this'Tariff Board,32
NA,should have power to investigate the,32
NA,question of whether any contribution is,32
NA,made to party funds. I will support the,32
NA,honorable member up to the hilt i f he,32
NA,will move an amendment to that effect.,32
Mr GREGORY , I t would be a very,32
NA,good thing i f that could be done. Libel-,32
NA,lous charges have been made as to contri-,32
NA,butions to our party funds by certain i n -,32
NA,terests.,32
Mr GABB , I do not think any manu- -,32
NA,facturers would contribute to the funds,32
NA,of the Country party.,32
Mr GREGORY ,Hardly .,32
Mr GROOM , I have seen no such*,32
NA,"charges published. """,32
Mr GREGORY ,The n the honorable,32
NA,gentleman does not read the Age or the,32
NA,Industrial Australian. We have had,32
NA,high legal opinion that the statements of,32
NA,which I complain are grossly libellous.,32
NA,The Canadian Tariff A c t makes i t clear,32
NA,"that i f , i n regard to any article of com-",32
NA,"merce there exists any conspiracy, com-",32
NA,"bination, agreement, or arrangement of",32
NA,any kind among manufacturers of such,32
NA,"article, or dealers therein, action shall",32
NA,bo taken. Although we have not the,32
NA,wide power enjoyed by the Canadian,32
NA,"Dominion Parliament, we certainly have",32
NA,the power of inquiry. A l l I am asking,32
NA,in my amendment is that the Board,32
NA,shall have specific authority to inquire,32
NA,into complaints that consumers are being,32
NA,charged unfair prices for protected,32
NA,articles.,32
Mr BELL ,Th e Acting Attorney-,32
NA,General ( Mr Groom) says that we have,32
NA,not that power.,32
Mr GREGORY ,Tha t is absurd.,32
NA,May I remind honorable members of the,32
NA,powers that we conferred on the Inter-,32
NA,State Commission. Section 16 of the,32
NA,Inter-State Commission Act provides,32
NA,that-,32
NA,The Commission shall be charged witb the,32
NA,"duty of investigating, from time to time, all",32
NA,matters which in the opinion of the Commis-,32
NA,sion ought in the public interest to be inves-,32
NA,"tigated, affecting-",32
NA,"(a) the production of, and trade in, com-",32
NA,modities ;,32
NA,"(&) the encouragement, improvement, and",32
NA,extension of Australian industries,32
NA,and manufactures;,32
NA,"(c) markets outeide Australia, and the",32
NA,opening up of external trade gener-,32
NA,ally;,32
NA,(ti) the effect and operation of any Tariff,32
NA,"Act, or other legislation of thc Com-",32
NA,"monwealth in regard to revenue,",32
NA,"Australian manufactures, and indus-",32
NA,"try and trade, generally.",32
Mr BELL , B u t not as to prices.,32
Mr GREGORY ,An d also^ as to,32
NA,prices. We gave the Inter-State Com-,32
NA,mission power also -to inquire into-,32
NA,(e) prices of commodities;,32
NA,(/) profits of trade and manufacture.,32
NA,and so forth . This Board should have,32
NA,power to inquire into the prices of com-,32
NA,modities and the ..profits of trade and,32
NA,manufacture.,32
Mr GROOM ,Bu t ever since the deci-,32
NA,sion of the P r i v y Council i n the case of,32
NA,the Colonial Sugar Refining Company,32
NA,the extent of the power to require evi-,32
NA,dence on oath as to those matters has been,32
NA,the subject of doubt.,32
Mr GREGORY ,W e have had be-,32
NA,fore us the balance-sheet of the Broken,32
NA,"H i l l Proprietary Company, which shows",32
NA,"that, although the mine was closed down",32
NA,"for two years, its net profits i n respect",32
NA,of a ll its activities over a three-year,32
NA,"period, amounted to £1,800,000, or",32
NA,"£600,000 a year. The Minister ( Mr -",32
NA,"Greene) slipped a duty through the*Com,-",32
NA,"mittee late one evening, and we did not",32
NA,have time to consider i t . I do not know,32
NA,whether he realized at the time what,32
NA,"would be' its ' effect, but i t was subse-",32
NA,"quently reported to us f r o m Perth that,",32
NA,"under that duty, £18 per ton was being",32
NA,charged on 14-gauge wire. That was an,32
NA,ad valorem duty. I f we found any com-,32
NA,pany taking the fullest advantage of the,32
NA,"protection granted them, and making",32
NA,enormous profits by charging unfafir,32
NA,"prices, surely we should be able to call",32
NA,upon the Board to make inquiry and re-,32
NA,port !,32
NA,:,33
Mr MASSYGREENE ,The . Board has f u l l,33
NA,-power to inquire into questions as to the,33
NA,profits of companies that are charging,33
NA,"unnecessarily high prices for their, goods.",33
NA,The clause as it stands covers the whole,33
NA,question of profits.,33
Mr GREGORY ,W e gave the Inter-,33
NA,"State Commission power to inquire into,",33
NA,not only the subjects I have already enu-,33
NA,"merated, but wages and social and",33
NA,industrial conditions. I n support of my,33
NA,"desire , I quoted last night the Canadian",33
NA,1,33
NA,"Act. My object"" ia to get as near to",33
NA,that legislation as possible. Heavy duties,33
NA,have been imposed by this Parliament.,33
NA,"Although i t may be difficult to prove, we",33
NA,feel satisfied that there are combinations,33
NA,in existenoe in connexion with many,33
NA,forms of trading interests in Australia.,33
Mr MASSYGREENE ,Th e same remark ap-,33
NA,"plies to ""the importers.",33
Mr GREGORY , I do not desire that,33
NA,the proposed Board shall worry over,33
NA,trifles. Its duties should be turned to,33
NA,"the bigger things. Por example, if i t is",33
NA,'found that an important manufacturing,33
NA,organization of the calibre of the Broken,33
NA,H i l l Proprietary Company has entered,33
NA,"into a combination to fix prices, or to deal",33
NA,only with certain persons.,33
Mr GROOM ,Ther e is complete power,33
NA,of inquiry afforded in the Bill.,33
Mr RYAN ,I t would not be possible,33
NA,to punish a manufacturer unless the re-,33
NA,sponsibility could be sheeted home to,33
NA,. him .,33
Mr GREGORY ,Al l I am asking is,33
NA,that the Board should have the power to,33
NA,"make inquiries, and, if the party con^",33
NA,cerned refused to furnish any informa-,33
NA,"tion, that should be taken as primd facie",33
NA,evidence of a case for submission.,33
Mr RYAN , I am with the honorable,33
NA,"member ""up to that point, but we must",33
NA,see that we do not punish an innocent,33
NA,person for a guilty one.,33
Mr GREGORY ,Th e matter would,33
NA,eome before Parliament. The Board,33
NA,would report that i t considered that there,33
NA,was something in the nature of a com-,33
NA,"- bination, and. that unfair prices were",33
NA,being charged for a protected article.,33
Mr RYAN ,"Then , does not the com-",33
NA,promise offered by the Minister ( Mr.,33
NA,Greene) meet the case?,33
Mr GREGORY , I contend that my,33
NA,proposal would do so. I want to bring,33
NA,the dealer in as well. I am only asking,33
NA,that there should be a Board of Inquiry,33
NA,through which Parliament should be,33
NA,made conversant with anything i n the,33
NA,"nature of a combination, or an attempt",33
NA,to unfairly fix prices.,33
Mr RYAN , I am afraid that the hon-,33
NA,orable member will be setting np an un-,33
NA,"sound principle, which some unjust Go-",33
NA,vernment may apply to primary pro-,33
NA,"ducers, and make them responsible for",33
NA,following their primary product right to,33
NA,the consumer.,33
Mr GREGORY , I am not afraid of,33
NA,that. I t is the duty of every member to,33
NA,try to protect the consumer. Honorable,33
NA,members have been doing their best to,33
NA,"aid the manufacturer. Now, having put",33
NA,"him on a good wicket, they should insure",33
NA,fair play for the consumer. I believe,33
NA,that my amendment will tend to effect,33
NA,"whab is necessary, although i t does not go",33
NA,as far as I could wish. But I am disap-,33
NA,pointed with the Bill. I t contains next,33
NA,"to nothing, after all the fine promises of",33
NA,the Government.,33
Mr MCGRATH ,Th e honorable mem-,33
NA,ber voted against the proposed alteration,33
NA,".of the Constitution, which would have",33
NA,given the Government power.,33
Mr RYAN ,An d the honorable mem-,33
NA,ber voted against the amendment of the,33
NA,honorable member for Maribyrnong ( Mr.,33
NA,Penton.).,33
Mr GREGORY ,Mos t decidedly! I,33
NA,am opposed to the principle of the New,33
NA,"Protection. I want nothing, so far as",33
NA,the primary producer is concerned. He,33
NA,is going to be pretty well ruined by the,33
NA,Tariff. I take with a grain of salt any-,33
NA,thing which the Minister ( Mr Greene),33
NA,may say about his keen desire to help the,33
NA,producer.,33
Mr RYAN , I agree with the honor-,33
NA,able member that this Bill is only camou-,33
NA,flage; but I point out that he helped to,33
NA,put i t in its present form.,33
Mr GREGORY ,I f the honorable,33
NA,member will assist me we will throw the,33
NA,Bill out altogether.,33
Mr RYAN , I shall vote with the hon-,33
NA,orable member to do that.,33
NA,Question-Tha t the amendment ( Mr.,33
NA,GREGORY'S) be agreed to-put . The Com-,33
NA,mittee divided.,33
NA,Ayes . . 13,33
NA,Noes . . 19,33
NA,Majority .. .. 6 !,33
NA,"Anstey, F. Mahony, W. G.",34
NA,"Charlton, M. MCGrath, D. C.",34
NA,"Considine, M. P, Page, Dr Earle",34
NA,"- Francis, F. H. Riley, E.",34
NA,"Gabb, J. M. 2'eMers.",34
NA,"Gregory, H. Makin, N. J. 0.",34
NA,"Lavelle, T. J. Stewart, P. G.",34
NA,"Bell, G. J. Livingston, J.",34
NA,"Blundell, B. P. Mackay, G. H.",34
NA,"Cameron, D. C. Rodgers, A. S.",34
NA,"Cook, Sir Joseph Ryan, T. J.",34
NA,"Corser, E. B. C. Ryrie, Sir Granville",34
NA,"Foster, Eichard Smith, Laird",34
NA,"Greene, W. M. Wise, G. H .",34
NA,"Groom, L. E. Tellers.",34
NA,"Higgs, W. G. Marr, C. W. C. *",34
NA,"Lister, J. H. Story, W. H.",34
NA,"Jowett, E. | Marks, W. M.",34
NA,Question so resolved in the negative.,34
NA,Amendment negatived.,34
NA,Sitting suspended from 1 to 2.15 p.m.,34
Mr GREGORY ,I n order to make the,34
NA,"clause clear, will the Minister agree to",34
NA,"insert before "" in restraint of trade "" the",34
NA,"words "" acting by way of conspiracy,",34
NA,"-combination, agreement, or arrangement",34
NA,"-of any kind""?",34
Mr MASSYGREENE ,Richmond-Ministe r for,34
NA,Trade and Customs) [2.16] - I think,34
NA,the honorable member for West Sydney,34
NA,"( Mr Ryan), as a lawyer, will support",34
NA,me in saying that any words that may,34
NA,be added in definition to what is restraint,34
NA,-of trade will be a limitation of that term.,34
Mr RYAN ,O f course.,34
Mr MASSYGREENE,Althoug h probably,34
NA,the words suggested 'by the honorable,34
NA,member for Dampier cover everything,34
NA,that is restraint of trade- 1,34
Mr RYAN ,The y would i f to them,34
NA,"were added ""or otherwise"".",34
Mr GREGORY , I want to prevent any-,34
NA,thing i n the nature of gentlemanly agree-,34
NA,ments to maintain high prices.,34
Mr MASSYGREENE ,Th e Board will have,34
NA,to determine whether a gentlemanly,34
NA,agreement came within the various,34
NA,qualifications of restraint of trade,34
NA,which the honorable member has,34
NA,"mentioned, and i t might determine",34
NA,that i t did notI think it is better to,34
NA,adhere to the wider language employed,34
NA,in the clause as drafted. I have no,34
NA,jection to the amendment which the hon-,34
NA,"orable member suggests, but I think i t",34
NA,will have the effect of limiting,34
Mr GROOM ,Darling Downs-Minis -,34
NA,ter for Works and Railways and Acting,34
NA,Attorney-General) [2.18] -Th e addition,34
NA,of the specific words ending with,34
NA,"""general"" in the amendment which",34
NA,the honorable member for Dampier,34
NA,"has suggested would, under the",34
NA,"NOES. ordinary rule of interpretation, refer",34
NA,back to the preceding words and imply,34
NA,some action in the nature of conspiracy,34
NA,or combination. That is the doctrine of,34
NA,"ejusdem generis. The clause, as drafted,",34
NA,covers any restraint of trade whether by,34
NA,"conspiracy, agreement, combination, or",34
NA,"individual action. The word "" con-",34
NA,"spiracy"" means several persons acting",34
NA,together with a certain intention. Agree-,34
NA,PAIB. * ment and arrangement ' also suggest a,34
NA,"number of persons, but restraint of trade",34
NA,might be an individual act. Suppose that,34
NA,one company has a monopoly of the,34
