Speaker,Text,pageNumbers
NA,turers of articles in Australia to see,24
NA,those to whom they sold retail the,24
NA,goods at reasonable rate. But he gives,24
NA,"the manufacturers , absolute discretion",24
NA,concerning the persons to whom they,24
NA,sell. That is the very thing we want,24
NA,prevent. We desire to insure that,24
NA,facturers shall sell to every person,24
NA,is willing to pay a reasonable price for,24
NA,their goods; and the conditions - governin,24
NA,ing a reasonable price must ibe laid,24
NA,by the law. Once we affirm the principle,24
NA,that the manufacturer may sell to whom,24
NA,he desires we establish the very conditions,24
NA,of which we have most to complain. A,24
NA,striking example Avas given last evening the amendment.,24
NA,when an honorable member related the,24
NA,-,24
NA,case of a retailer in a country town,24
NA,"was* a shareholder in a certain factory,",24
NA,but was unable to buy the goods which,24
NA,"produced in his own town, and had to",24
NA,send to Sydney for supplies.,24
Mr MCWILLIAMS ,Hav e not the,24
NA,brewers and the Tobacco Trust been,24
NA,doing that kind of thing for a long time?,24
Mr RYAN ,rAn d does the honorable,24
NA,member approve?,24
Mr MCWILLIAMS ,No !,24
NA,[409]- 2,24
Mr RYAN ,No r do I . We want to,24
NA,end it. The honorable member for Bal-,24
NA,for larat ( Mr MCGrath) has prepared an,24
NA,"amendment which, I think, will prevent",24
NA,any such state of affairs as that continu-,24
NA,i,24
NA,- ing. But 'my main objection to the amend-,24
NA,under discussion is its absurdity.,24
NA,those The only power that Parliament has,24
NA,under the Bill is the power to reduce or,24
NA,remove the duty. I f one retailer is sell-,24
NA,ing an article at an unreasonable price,24
NA,"it is very unfair to remove the duty, and",24
NA,so take away protection from manufac-,24
NA,"turers who may be selling to retailers,",24
NA,who are distributing at a reasonable price.,24
NA,I t is of no use to destroy tho whole in-,24
NA,direction. dustry in that way.,24
Mr STEWART ,Th e manufacturer,24
NA,should get another retailer who will not,24
Mr RYAN ,I f tbe honorable member,24
NA,thinks tliat that kind of reasoning will,24
NA,appeal to an intelligent public he is con-,24
NA,siderably mistaken. I would not have,24
NA,"risen, but that I wished to drive home",24
NA,patent fact that the honorable mem-,24
NA,what ber who moved the amendment is not,24
NA,only incompetent to deal with a subject,24
NA,"such importance, but that those who",24
NA,that support him are similarly incompetent.,24
Mr RICHARD FOSTER ,Wakefield),24
NA,[11.34] - I sympathize with the aims,24
NA,and objects of the mover of the,24
NA,"may amendment, but I cannot perceive that",24
NA,to his method of procedure is likely,24
NA,manuto bear result. .1 wish to point out,24
NA,who where a considerable practical bene-,24
NA,fit might accrue. The only effective way,24
NA,which any material good can be gained,24
NA,down for the people under this Bill is by,24
NA,widening the field of distribution with as,24
NA,little intervening profit as possible to the-,24
NA,manufacturers who have been protected.,24
Mr STEWART ,Tha t is the object of,24
Mr RICHARD FOSTER ,Bu t i t,24
NA,who cannot hope to secure the best results.,24
NA,There are very few woollen mills in. Aus-,24
NA,i t tralia which are not bound by agreements,24
NA,to. a very narrow system of distribution.,24
NA,Nearly all the mills are compelled to sell,24
NA,to the big warehouses. I know of only,24
NA,"one, namely, the Lobethal Mills, in South",24
NA,"Australia, which make their output avail-",24
NA,able to every distributorin the trade.,24
Mr GROOM ,Th e honorable member,24
NA,says that among other distributors there,24
NA,is a combination in restraint of trade and,24
NA,commerce.,24
Mr RICHARD FOSTER ,"I u effect,",25
NA,"tliat is so. Possibly, there are good rea-",25
NA,"sons, since I wish to be fair. Perhaps it",25
NA,does not pay the manufacturers to be dis-,25
NA,tributors also. I t may be that an agree-,25
NA,ment entered into with the wholesale,25
NA,houses to undertake distribution proves,25
NA,as profitable to the manufacturers as,25
NA,undertaking distribution direct; but I,25
NA,ask the Minister . ( Mr Greene) to,25
NA,make i t incumbent upon the manu-,25
NA,facturers of a protected article to,25
NA,see that that article is available for,25
NA,distribution to the entire trading com-,25
NA,munity. The only penalty I would im-,25
NA,pose is that provided in this Bill. I f,25
NA,the manufacturers are to continue to bene-,25
NA,fit from the protection which has beeu,25
NA,"afforded them, -their goods must be made",25
NA,available to the whole trade. I n the,25
NA,"woollen. mills, there are two profits. I f",25
NA,"ono profit will secure distribution, in-",25
NA,"stead of the Iwo, why should it not be",25
NA,possible to conduct activities in that man-,25
NA,"ner? I know, of course, that there are",25
NA,practical difficulties. I t has been a matr,25
NA,ter of grievance to the retail trade that,25
NA,they have not been able to go to the,25
NA,manufacturers direct and pass on the,25
NA,benefit to their customers. I am asking,25
NA,for more than the mere power of inquiry,25
NA,by the Board.,25
Mr GROOM ,I f a manufacturer makes,25
NA,an agreement with a limited number of,25
NA,"distributors, and that agreement is i n re-",25
NA,"straint of trade, an inquiry can be held",25
NA,under the terms of this Bill.,25
Mr RICHARD FOSTER , I want,25
NA,"more than that, namely, that the manu-",25
NA,facturer should be made to throw open,25
NA,his articles for general sale throughout,25
NA,the trading community.,25
Mr GROOM ,Thi s Parliament cannot,25
NA,pass a direct law to say expressly that,25
NA,any individual shall sell his goods to cer-,25
NA,tain persons.,25
Mr RICHARD FOSTER , I am not,25
NA,"asking for price-fixing, but that the Go-",25
NA,vernment shall make really effective the,25
NA,penalty which it is possible to impose,25
NA,under this Bill. The way to do that is,25
NA,to say that goods shall be made available,25
NA,for sale to the entire trade. I am,25
NA,not asking the Minister to provi.de that,25
NA,every factory shall be a distributing,25
NA,"agency for its own goods, and send travel-",25
NA,lers all over the country. But I do ask,25
NA,him to provide that those goods shall be,25
NA,available to the wholetrade. The manu-,25
NA,facturer could be told that i f his goods,25
NA,were not supplied to the consumer at,25
NA,lower prices the duty would be reduced or,25
NA,removed. That is the only penalty for,25
NA,'which I ask.,25
Mr GABB ,I call attention to the,25
NA,state of the Committee. [Quorum,25
NA,formed.],25
Mr RICHARD FOSTER , I ask the,25
NA,Acting Attorney-General ( Mr Groom),25
NA,to explain in what way the provision I,25
NA,am suggesting would be legally imprac-,25
NA,ticable.,25
Mr GROOM ,Thi s Parliament cannot,25
NA,directly impose any obligation on a manu-,25
NA,facturer in Victoria as to how he shall,25
NA,"conduct his trade within, that State. But",25
NA,"the Board can, under the terms of tho",25
NA,"Bill, inquire as to whether he is acting",25
NA,in restraint of trade in the way indicated,25
NA,"by the honorable member, and if i t is",25
NA,reported by the Board that he is doing,25
NA,so this House can' decline to continue the,25
NA,duty.,25
Mr RICHARD FOSTER , I desire,25
NA,some provision inserted that the manuf ac^,25
NA,turer of goods supported by a highly-pro-,25
NA,tective Tariff shall make such goods avail-,25
NA,able to the entire distributing trade of,25
NA,theCommonwealth.,25
Mr GROOM ,Tha t is attempting to im-,25
NA,"pose an obligation on a man who, perhaps,",25
NA,is operating i n only one State.,25
Mr RICHARD FOSTER ,A t present,25
NA,we are giving protection to manufactu-,25
NA,rers who are acting in restraint of trade.,25
Mr MASSYGREENE ,I f i t is thought that a,25
NA,manufacturer is acting in restraint of,25
NA,"trade, ample"" power of inquiry is provided",25
NA,"in the clause, as drafted, and the Board",25
NA,can report to the Parliament that such,25
NA,restraint of trade is detrimental to the,25
NA,public.,25
Mr GREGORY ,Thi s is a very im-,25
NA,"portant Bill, and should be discussed be-",25
NA,"fore a f u l l Comniijtee. I call fon, a",25
NA,quorum.,25
Mr GROOM ,Th e honorable member,25
NA,was absent from the chamber a few,25
NA,moments ago.,25
Mr GREGORY , I was. I tried to count,25
NA,out the Bill. [Quorum formed.],25
Mr RICHARD FOSTER , I am dis-,25
NA,appointed with the view expressed by the,25
NA,"Acting Attorney-General, because this",25
NA,matter affects the publio interest very,25
NA,"closely. , A close corporation acting in re-",26
NA,straint of trade does not deserve protec-,26
NA,"tion, and I should have fought the Tariff",26
NA,"very keenly indeed i f I had"" not thought",26
NA,that we could insure that goods manufac-,26
NA,tured under a high Tariff would be dis-,26
NA,tributed to the people with less interven-,26
NA,"ing cost. I f that is legally impossible, we",26
NA,are apparently restricted to the power of,26
NA,getting the Board to inquire and report to,26
NA,Parliament. The intention of the Bill,26
NA,seems to me to be that the inquiry shall,26
NA,not go beyond the factories.,26
Mr GREENE ,Eichmond-Ministe r for,26
NA,Trade and Customs) [11.55] - I think,26
NA,I know what the honorable member for,26
NA,"Dampier"" ( Mr Gregory) desires to do,",26
NA,and I am just as anxious as he is to do,26
NA,it. What I have been striving for is a,26
NA,measure framed in such a way that there,26
NA,can be no doubt as to the constitutionality,26
NA,of the remedies we are proposing. We,26
NA,want to be sure that we have definite,26
NA,"power to do what we set out to do, and",26
NA,that the law will be effective i n achieving,26
NA,our purpose.,26
Mr GREGORY ,°-IS the Minister assum-,26
NA,ing that we have not constitutional power,26
NA,to do what I have suggested?,26
Mr MASSYGREENE , I am advised that i t,26
NA,is extremely doubtful that we have such,26
NA,power. When.a trade is carried on en-,26
NA,"tirely on competitive lines, the consumer,",26
NA,"generally speaking, is not charged too",26
NA,"much for his goods, but when there are",26
NA,"close corporations and rings, and trade",26
NA,arrangements which prevent free competi-,26
NA,"tion, the consumer probably is charged",26
NA,"too much. The clause, as drafted, en-",26
NA,ables the Minister to refer to the Board,26
NA,"of Inquiry, and report, inter alia-",26
NA,(Jl) any complaint that a manufacturer is,26
NA,tiiking undue advantage of tbe protection,26
NA,"afforded him by the Tariff, and in particular",26
NA,in regard to his-,26
NA,(i) charging unnecessarily high prices for,26
NA,"his goods, or",26
NA,(ii) acting in restraint of trade to the,26
NA,detriment of the public.,26
NA,I shall movb to add after sub-paragraph,26
NA,(ii) certain words which' I think will be,26
NA,effective in doing what the honorable,26
NA,member for Dampier wants to do.,26
Mr MATHEWS ,I f the Minister does,26
NA,what the honorable member for Dampier,26
NA,"wants to do, he will kill the Bill. I f he",26
NA,"does not understand that, he is not fit for",26
NA,"his job, and I am damned if I will stick",26
NA,with him! I am remaining in my place,26
NA,"here to save this Bill and the Tariff, and",26
NA,the honorable member for Dampier is try-,26
NA,ing to kill both.,26
Mr MASSYGREENE ,I f the idea of the,26
NA,honorable member for Dampier-is-to kill,26
NA,"the Tariff, no one can accuse me of co-",26
NA,operating with him i n that endeavour.,26
NA,After the amendment now before the,26
NA,"chair is disposed of, I shall move to"" add",26
NA,"after sub-paragraph (ii) the words "" o r",26
NA,(iii) acting in a manner which results i n,26
NA,unnecessarily high prices being charged,26
NA,"to the consumer for his goods.""",26
Mr RICHARD FOSTER ,Tha t implies,26
NA,what I want.,26
Mr MASSYGREENE ,Ther e is no doubt,26
NA,that we can link up very definitely with,26
NA,"the manufacturer, and the amendment",26
NA,will cover the particular point mentioned,26
NA,by the honorable member for Wakefield,26
NA,"( Mr Richard Foster), while also substan-",26
NA,tially meeting the position as put by the,26
NA,honorable member for Dampier ( Mr.,26
NA,Gregory). I feel confident that the latter,26
NA,gentleman has no idea of setting out on,26
NA,a general policy of price fixing.,26
Mr GREGORY , I have never been asr,26
NA,sociated with any such policy.,26
Mr RYAN ,Woul d the fact that a,26
NA,manufacturer sold to a retailer in the,26
NA,"ordinary course of business, and that the",26
NA,retailer sold at an exorbitant rate 'to the,26
NA,"consumer, constitute a cause for inquiry",26
NA,under the suggested amendment? ;,26
Mr MASSYGREENE ,No ; i t would not.,26
NA,"After all is said and done, we have to re--",26
NA,collect that we are not giving power to an,26
NA,"outside body to act, but merely power to",26
NA,report. The report must come to Parlia-,26
NA,ment as the final -Court for judgment.,26
Mr RYAN ,Th e amendment will not,26
NA,throw the responsibility on to the mana-,26
NA,"factiirer, as suggested by the honorable",26
NA,"member for Wimmera ( Mr Stewart), to",26
NA,follow up the retaileT?,26
Mr MASSYGREENE ,No .,26
Mr GREGORY ,I t is merely a matter,26
NA,of inquiry and report.,26
Mr RYAN ,"I n other words, the",26
NA,amendment does no more than the B i l l,26
NA,already does?,26
Mr MASSYGREENE ,Yes ; I think the,26
NA,amendment widens the scope of the Bill.,26
Mr RYAN ,Wha t does i t cover other,26
NA,than what is.already covered?,26
NA,"Mr.'GREENE -Well , i t covers those",26
NA,"classes of trading agreements which, fromi",26
NA,"their very nature, lead to the consumer",26
NA,being charged unnecessarily high prices -,26
NA,1,26
NA,e-.,26
Mr RYAN ,Tha t is already provided,27
NA,JOT under another sub-paragraph.,27
Mr MASSYGREENE , I am doubtful,27
NA,-whether i t is covered to the same extent;,27
NA,"in my opinion, the amendment widens the",27
NA,basis of the inquiry.,27
Mr BELL ,Th e Minister says that if,27
NA,a manufacturer of agricultural machines,27
NA,refused to supply machinery to a firm i n,27
NA,a country town he would be acting in,27
NA,restraint of trade; supposing the manu-,27
NA,facturer had one distributing firm in a,27
NA,"country town who refused to sell, would",27
NA,that be in restraint of trade?,27
Mr MASSYGREENE,"Yes , I think i t would;",27
NA,but it does not necessarily follow that it,27
NA,would be a detriment to the publicThe,27
NA,final test of whether or not any action i n,27
NA,restraint of trade can be properly taken,27
NA,"cognisance of, is whether i t is to the de-",27
NA,triment of the public.,27
Mr BELL ,I s there any reason why a,27
NA,manufacturer should not sell to any dis-,27
NA,tributor who cares to place an order with,27
NA,him? Could that be provided in the,27
NA,Bill?,27
Mr MASSYGREENE , I .do not think we can,27
NA,do that; I feel pretty confident that con-,27
NA,stitutional limitations would render such,27
NA,a provision null and void. What I pro-,27
NA,"pose, 1 think, is within our power.",27
Mr MCGRATH ,Ballarat) [12.3] - I,27
NA,do - not think i t matters whether the,27
NA,amendment is carried or not; and i f it,27
NA,"pleases the members of the Country party,",27
NA,"tbey are easily satisfied. After all, i t",27
NA,simply means that the Board will in-,27
NA,quire and define what are unnecessarily,27
NA,"high prices, and then report to this Cham-",27
NA,ber. We know how the parliamentary,27
NA,"machine works, and months, or years,",27
NA,may elapse without anything being done;,27
NA,it certainly does not mean cheap goods,27
NA,-for consumers. The only proper method,27
NA,would have 'been to test our constitutional,27
NA,powers by adopting the amendment of the,27
NA,honorable member for Maribyrnong ( Mr..,27
NA,Fen ton). The members of the Country,27
NA,"party, who have taken up hours with their",27
NA,"camouflaging amendments, were those",27
NA,"who voted, practically i n a body, against",27
NA,that proposal. I f that amendment had,27
NA,"been agreed to, the High Court would be",27
NA,given another opportunity of. deciding the,27
NA,"constitutional question, and, i n view of",27
NA,"-the recent decision, there was every reason",27
NA,to believe the constitutionality of the,27
NA,amendment would have been upheld.,27
Mr BELL ,Tha t is just what the,27
NA,Country party do not desire!,27
Mr MCGRATH ,Th e proposal of the,27
NA,Country party to-day is merely a pre-,27
NA,tence.,27
Mr BELL ,Th e effect of the amend-,27
NA,ment of the honorable member for Mari-,27
NA,byrnong would have been to increase the,27
NA,price of everything.,27
Mr MCGRATH ,W e were prepared,27
NA,"to take the risk of that; in any case', the",27
NA,amendment before us will neither increase,27
NA,nor decrease prices.' I shall vote neither,27
NA,for nor against it.,27
Mr MARR ,Parkes) [12.5] -Afte r,27
NA,listening to the arguments of the honor-,27
NA,able member for Grampians ( Mr Jowett),27
NA,and the honorable member for Dampier,27
NA,"( Mr 'Gregory), and to the legal argu-",27
NA,ments by lawyers on both sides,27
Mr GREGORY ,On e of those members,27
NA,"has not read the Bill-a t any rate, he",27
NA,knows nothing about it -,27
Mr MARR ,I n my opinion as a lay-,27
NA,"man, the honorable member for Gram-",27
NA,pians does not realize the powers we lack.,27
Mr RYAN ,Yo u could express the,27
NA,same plain conclusion in a homely way !,27
Mr MARR ,Th e honorable member,27
NA,for Grampians suggests that the onus of -,27
NA,responsibility of selling goods at unrea-,27
NA,sonable prices is on the. manufacturer.,27
NA,"Why, in the same sense, we might 3ay",27
NA,that the onus for selling milk at an un-,27
NA,reasonable price in the cities rests on the,27
NA,dairy farmer!,27
Mr RYAN ,O r on the manufacturer-,27
NA,the cow!,27
Mr MARR ,"Yes , or the cow itself.",27
NA,I t has been said that the manufacturer,27
NA,"controls the industry, but in 99 per cent,",27
NA,of cases the manufacturer has no more Jo,27
NA,do with the disposal of his goods than I,27
NA,have. My father was a manufacturer in,27
NA,"New South Wales for forty-four years,",27
NA,and he never controlled the selling of his,27
NA,"goods. On the contrary, every retailer con-",27
NA,trolled him; it was the retail houses which,27
NA,told him where he had to sell. There is,27
NA,not a manufacturer in New South Wales,27
NA,who has any more to do with the selling,27
NA,of bis goods to the consumer than has,27
NA,this House.,27
Mr GREGORY ,Ther e could be inquiry,27
NA,and report as to what was going on.,27
Mr MARR ,Eve n i f there were,27
NA,a report that a retailer was charg-,27
NA,ing more than he had a right to,27
NA,"do, what power would this Parlia-",28
NA,ment have to act? I f the Broken,28
NA,"H i l l Proprietary Company, or any other",28
NA,"of the big controlling influences, sells at",28
NA,"an exorbitant rate, we have power to wipe",28
NA,"out the Protection, but when a company",28
NA,sells through five or six subsidiary chan-,28
NA,"nels, the public ultimately may have to",28
NA,"pay 500 per cent, above the manufactur-",28
NA,ing costs. What could this Parliament,28
NA,do in such cases? I f there is any doubt,28
NA,as to tne accuracy of what I have just,28
NA,said in regard to the percentage ulti-,28
NA,"mately paid by the public, I am pre-",28
NA,pared to bring proofs next week.,28
Mr LIVINGSTON ,I f a retailer made,28
NA,such charges he would soon lose his,28
NA,business.,28
Mr MARR ,Bu t the cost is added to,28
NA,because the goods go through so many,28
NA,channels. When the Tariff was under,28
NA,"consideration, we' were told by Queens-",28
NA,land representatives that Queensland tim-,28
NA,"ber, sent to Melbourne, was first handled",28
NA,by the man who distributed it to the vari-,28
NA,"ous yards, and charged 2^ per cent., and",28
NA,then' distributed by the yards to the,28
NA,builders at a cost of 25 per cent. I f we,28
NA,add the charges made by the builder and,28
NA,others until the timber reaches the con-,28
NA,"sumer we find about 100 per cent, added",28
NA,to the cost of production in the forest or,28
NA,at the mill.,28
Mr LIVINGSTON ,I n what State does,28
NA,that take place?,28
Mr MARR ,I n every State in the,28
NA,Commonwealth.,28
Mr LIVINGSTON ,No t in South Aus-,28
NA,tralia ! ',28
Mr MARR ,I t is said that the manu-,28
NA,facturer of the Ford car controls the sell-,28
NA,ing price in Australia; but that is not,28
NA,correct.,28
Mr RICHARD FOSTER , I say it is!,28
Mr MARR ,Wha t the manufacturer,28
NA,says is that the car shall not be sold for,28
NA,less than a certain price -insuring,28
Mr RICHARD FOSTER ,Tb e price is,28
NA,arranged in America by the Ford Com-,28
NA,pany.,28
Mr MARR ,Tha t is not so. I have,28
NA,been in a place where it was possible to,28
NA,"buy Ford cars by the hundred at £36 each,",28
NA,but where could you buy one in Mel-,28
NA,bourne for £136? Can we compel the,28
NA,public to pay less or more than a certain,28
NA,amount? We cannot compel the retailer,28
NA,to sell to the public as our friends in the,28
NA,Corner suggest.,28
Mr STEWART ,W e can penalize the,28
NA,manufacturer.,28
Mr MARR , I have already explained,28
NA,"the position of the manufacturer, and",28
NA,illustrated my argument with a reference,28
NA,to the distribution of milk.,28
Mr STEWART ,Th o dairy farmers,28
NA,should themselves distribute their milk.,28
Mr MARR ,Wit h that I agree; in-,28
NA,"deed, the high cost of living is largely,",28
NA,due to lack of system in distribution.,28
Mr RYAN ,D o you suggest that i f tha-,28
NA,dairy farmer does not see that the retailer,28
NA,sells at a reasonable price his .cows should),28
NA,be confiscated?,28
Mr MARR , I do not think I would,28
NA,go as far as that.,28
Mr STEWART ,Th e interjection is,28
NA,very sarcastic-an d foolish.,28
Mr MARR , I understand the Coun-,28
NA,try party to aTgue that i f a dairy farmer,28
NA,knows that a retailer is selling his milk,28
NA,at an unreasonable price he heed not,28
NA,supply that retailer with any more. But,28
NA,can any one say tljat there is a dairy,28
NA,farmer anywhere who ever says where his,28
NA,milk shall or shall not be sold? The,28
NA,whole business is controlled by the distri-,28
NA,buting agencies.,28
Mr STEWART ,Coul d not the dairy,28
NA,farmers be their own distributing agents ?,28
Mr MARR ,Certainly .,28
Mr STEWART ,Wha t is there to pre-,28
NA,vent them under the Bill?,28
Mr MARR ,Wha t power has the Go-,28
NA,vernment to say that the dairy farmer,28
NA,"shall, be his own distributing agent? I",28
NA,hope the clause will remain as printed.,28
NA,"I n my opinion, the amendment will make",28
NA,not the slightest difference in the selling,28
NA,prices of commodities.,28
Mr BELL ,Darwin) [12.13] -Th e,28
NA,honorable member for Wakefield ( Mr.,28
NA,Richard Foster) has expressed my idea of,28
NA,what it is possible to do in the way of,28
NA,that goods are distributed to the,28
NA,"public at reasonable prices. We are told,",28
NA,"however, by the Acting Attorney-General",28
NA,( Mr Groom) that what is proposed can-,28
NA,not be done under the Constitution. Un-,28
NA,"like many other lay members, I do not",28
NA,profess to be able to interpret the Con-,28
NA,stitution better than the High Court has,28
NA,already done. There is an old saying,28
NA,that a man who is his own lawyer has a,28
NA,"fool for a client, and although we may",28
NA,interpret the Constitution to OUT own per-,28
NA,sonal satisfaction we are not likely to,28
NA,do so in the way acceptable to the Oourt.,29
NA,"We are, therefore, face to face with",29
NA,"trouble directly we endeavour, by Act of",29
NA,"Parliament, to insure that goods are sold",29
NA,at prices that will give satisfaction to,29
NA,the public generally.,29
Mr GREGORY ,I n Canada there are,29
NA,special arrangements under the Tariff,29
NA,Act to enable all protected goods to be,29
NA,followed up.,29
Mr GROOM ,"I n Canada, unlike Aus-",29
NA,"tralia, the trade and commerce power is",29
NA,complete. We have not the power we,29
NA,would like.,29
Mr GREGORY ,W e ought to try to get,29
NA,as nearly the same power as possible.,29
Mr BELL ,Th e Acting Attorney-,29
NA,General has said that we have no power,29
NA,to tell a manufacturer how he shall dis-,29
NA,tribute his goods within one State. So I,29
NA,should think we have not the power to,29
NA,interfere when the selling transaction is,29
NA,"oonfined to one State. """,29
Mr GROOM ,Th e Federal power is over,29
NA,Customs matters - and Inter-State and,29
NA,oversea trade. Trade - and commerce,29
NA,within a State is not within Pederal juris-,29
NA,diction.,29
Mr BELL ," I understand that, and",29
NA,therefore agree with the Minister and,29
NA,others who say that the amendment of,29
NA,the honorable member for Dampier can-,29
NA,nob be effective. His object is the same,29
NA,as that of the honorable member for,29
NA,"West Sydney ( Mr Ryan), though the",29
NA,"methods differ, and the members them-",29
NA,selves differ in their views of our power,29
NA,to enforce what they think should be,29
NA,done. I f the Minister's proposal is as,29
NA,near as we can go towards attaining our,29
NA,"end, I shall support i t ; but I should like",29
NA,"a closer definition of "" restraint of",29
NA,"trade."" The Board might make in-",29
NA,"quiries as to, among other things, the",29
NA,"conduct of a certain manufacturer,- whe-",29
NA,ther i t might reasonably be considered in,29
NA,"restraint of trade, and might report to",29
NA,"the House on .the subject, and we could",29
NA,then debate the question here for weeks,29
NA,and for months without coming to a sat-,29
NA,isfactory conclusion. The difficulties of,29
NA,doing so are illustrated by the discussion,29
NA,"on this clause. I t appears to me that,",29
NA,"although we wish to do what is right, we",29
NA,-shall probably not attain our ends by,29
NA,"this Bill, or-by any other. However, J",29
