speakerGroups,Speaker,text,pageNumbers
130,Mr BLAKELEY ,"That is not an exact the repetition of what the Leader of the NA to be able to repeat his statement word for word, but, at the time the right honourable member was speaking, I made a to the effect that he said that Mr. and Collins had a more intimate knowledge of the details than any Minister going The from here could hope to have, and could Godo better. I submit that it is not a mere knowledge of the details-althoug h I have a great respect for the knowledge of detail possessed by the right honourable in member for Flinders-bu t a. broad grasp by of Australia's position that is required by a Minister going to represent Australia overseas. Who would be the more powerful or more impressive advocate of Australia, of her resources, of her honourable record for prompt payment when so many countries have defaulted, of her capacity and determination to stand up to her obligation- Mr Bruce, or some Commonwealth public servant, ao matter how able he might be, or how great the respect in which Ave hold him? E do not believe, nor, I am sure, does Mr. Collins himself, that our financial adviser in London could do the Avork required at the present time so satisfactorily as could a man with the standing of Mr Bruce. We have already read something, particularly in the financial press of England, of the good effect produced in financial circles by the advocacy of Australia's interests by the Attorney-General ( Mr Latham) Avhen he was recently in London. We have learned how he was able most effectively to dispose of certain ill-informed and groundless prejudices against Australia and her methods of finance. I believe that the right honourable member for Flinders will do this task as well as any man could. The Government could not make a better choice. He is a well-known figure, he has an international reputation, he has a personality which inspires confidence, and he has many valuable contacts, both in the business world and with financial institutions, which must be of incalculable value to Australia Avhen we are seeking to convert large sums on the London market. The additional advantage of ministerial authority which he will possess not be overlooked. The Deputy Leader of the Opposition said that Mr Bruce's position in London would be virtually a sinecure. That, I think, is the best joke we have heard yet in connection with this proposal. The honourable member for West Sydney said that Mr Bruce had not an Australian outlook, and this was repeated by the Deputy Leader of the Opposition. Well, I do not know that West Sydney has a monopoly of Australian outlook, and certainly, within the last nine months or so, the people of Australia have shoAvn that they do not regard the West Sydney outlook as the Australian outlook. This is demonstrated by the present personnel of this House. The Deputy Leader of the Opposition spoke of marketing arrangements overseas, and appears to think it absurd that MT. Bruce should be expected to do anything to advance Australia's trade in Great Britain. His argument reminded me of the very narroAv view held by some - members of certain trade unions that one man must do only one thing; that, for instance, a plumber must never touch anything which could be done by a carpenter. Surely if a Minister goes to London it is not out of place for' him to do anything and everything to advance Australia's prospects and trade. There is no need, even though his principal mission be in regard to finance, to exclude rigidly everything else. We know that in 1923 it Avas this same gentleman, the right honourable member for Flinders, who did a great deal for a number of our important exporting industries by obtaining certain preferences from the British Government. Although their extent was then limited, Australia obtained preference for dried fruits, wines, and sugar, three concessions which were extremely valuable to the people of Australia, and particularly to some of the constituents of the Deputy Leader of the Opposition, Avho has been at such pains to belittle Mr Bruce. Some of the gibes of honourable members in respect of the emoluments of the High Commissioner are very paltry. The Prime Minister has shown that there will be an actual saving as the result of the neAv arrangement; but, even if .there were not, when Ave consider the importcanance of the task which Mr Bruce is to undertake, and the enormous benefits which will accrue to Australia if he is successful, we realise IIOAV petty are complaints about the salary of the Besident Minister in London. Consider, for instance, the first task which Mr. Bruce will undertake-the conversion of a loan of £13,000,000 for New South Wales, which is falling due in ""NoAem- r ber. If it were possiblefor Australia, owing to the efforts of a man of the standing of Mr Bruce, to secure terms only 2s. 6d. per cent, lower in the interest' payable on the loan, it would mean a saving of £16,000 a year. I do not think it would be expecting too much, or exaggerating the possibilities of the situation, to say that Mr Bruce might - be able to obtain that additional advantage when another man could not. Then there is a larger conversion which it'might 'he advantageous to undertake later. We were told by the Prime Minister in his budget speech that, of the £474,000,000 which we owed in Great Britain apart from war debt, about £307,000,000 was borrowed at 5 per cent, and over. No less than £93,000,000 was at more than 5 per cent., and up to 6£ ;.per cent. We were also reminded last week that we have current option conversion rights over £96,000,000 worth - of our overseas debt, on which we pay 5 per cent, and up to 6-J por cent, interest. There is nothing to prevent us from negotiating with the overseas bondholders at the present time, or at any time we think fit, because the first of two maturity dates in connection with these particular issues has already passed. If Mr Bruce were able to obtain an advantage of 2s. 6d. per cent, less interest on £96,000,000 worth of debt, that alone would represent a saving of £120,000 a year to Australia. The Government could not have made a better choice for this position, and I support the bill.",33
131,Mr WHITE ,"Balaclava) [5.12] - It is hardly necessary to say anything in support of this bill, because the appointment of such a man as Mr Bruce is obviously a good one. He has peculiar characteristics, he has travelled, he is educated, and he is, above all things, a gentleman, which one cannot say of some of the representatives of Australia who have been sent abroad in the past. I have risen chiefly because of the attacks made on Mr. Bruce by the honourable member for East. Sydney ( Mr Ward), the honourable member for West Sydney ( Mr Beasley) and the Deputy Loader of the Opposition ( Mr Forde). The Leader of the Opposition ( Mr Scullin) said that Mr Bruce had carried Australia to disaster, and treated the warnings of various personshimself included, I suppose-in an airy manner; and that, consequently, he was thrown from office in 1929. Honourable members know well that the main issue at that election was arbitration-the removal of a great many petty industrial matters from the jurisdiction of the Commonwealth Arbitration Court to that of State tribunals. The Leader of the Opposition used all his oratory on that occasion to defeat the right honourable member for Flinders ( Mr Bruce), stating that there was no need to economize, no need to cut down the costs of industry by reforming the arbitration system. But what'did the Leader of the Opposition and his supporters do after they had brought about the fall of Mr Bruce and his Government? They found themselves up against financial and economic problems, and were compelled to bring in wage reduction bills, which cut the earnings of the Avorkers very substantially. Yet they have the audacity now to charge Mr. Bruce with, having neglected his duty, the when, they themselves were prepared to bribe the people by offering what they could noi deliver. For six years, the right honourable member acquitted himself honourably as leader of the Bruce Page Government, whose term of office was one of the most prosperous periods in Australia's history. The right honourable gentleman has been attacked today because it happens that his interests are not entirely political; but I claim that one of the greatest curses in Australia, today is the professional politician. Many honourable members on the other side of the House represent that class. They have the gift of the gab, and having acted as union secretaries, often through being indifferent tradesmen, they are regarded as suitable candidates for parliamentary honours. These men have to do-as they are told; yet they pose in this Parliament as the representatives of a democratic movement. The man who has been criticized in this House today has shown his ability in other than political walks of life. In reply to the gibe that he does not know this country so well as some petty-minded Australians do, I point out that the fact that he went abroad for some of his education stands to his credit, rather than to his detriment. He spent several years in doing his part during a national crisis, while certain other honourable members seemed not to remember to do so. That, too, may be said to the credit of the right honourable member. The honourable member for West Sydney ( Mr Beasley) remarked that when the right honourable member was defeated in Flinders, ho left. Australia, and took no part in assisting to get this country out of its difficulties. I am in a position to state that he could then have had a safe seat in this Parliament, had he chosen to take it. I accidentally met him when he knew that the figures in his own electorate were against him. On that occasion, I had been a member of this House for only three or four weeks and had successfully faced a second election, but in view of the attack made upon Mr Bruce by honourable members opposite, I make"" no apology for saying that I offered to resign if he cared to take my seat in Balaclava.",35
132,Mr GANDER ,Anothe r dummy!,36
133,Mr WHITE ,"I know that the honourable member for Beid ( Mr Gander) is a seat-warmer for the ex-Premier of New South Wales, but, as I have pointed out, when I made that offer I had heen a member for only a few weeks, and I realized that it was a tragedy for the services of a man of the calibre of Mr. Bruce to be lost to Australia. The right honourable gentleman said that he was going on a holiday, but he promised that when he returned from Great Britain, he would fight for his old seat, and win it back. The honourable member for Melbourne Ports ( Mr Holloway), who left the Blinders seat for a safer electorate, can tell us whether the right honourable member for Flinders carried out that promise. The 'honourable member for West Sydney remarked that Mr Willis had complained that the United Australia party had "" cruelled the pitch "" for him, because it refused to i>e a party to repudiation of overseas interest payments, and that he could have secured lower interest rates overseas if the Lang policy had been adopted. The honourable member for West Sydney preferred an importation of the type of Mr Willis to an honest and. influential man like Mr Bruce.",36
134,Mr GANDER ,Does not the honourable member believe in importation?.,36
135,Mr WHITE ,"We could well do with the exportation of some of the "" reds"" and their associates. I regret that a most worthy member of this House has been unfairly criticized. [10 ] The international situation is most complex. Affairs in Germany have come to such a pass that there may be civil war in that country, and Bussia is mysterious and menacing. Honourable members opposite address each other as comrades, and profess to believe in the brotherhood of man, but in the arena of domestic politics, they fight bitterly between themselves. Paradoxically, they favour a high tariff, which makes a country selfishly national, and is often the cause of international disputes. The party opposite is alive only to the petty, local interests of Australia, but we are fortunate in having, in Mr Bruce, a man who sees affairs in their imperial and international aspects. I support the bill.",36
136,Mr BLAKELEY ,"Darling) [5.21] - 1 oppose this measure. I do not say that my opposition to it would have disappeared if the Prime Minister ( Mr. Lyons), the Attorney-General ( Mr. Latham), and several of those supporting the bill had been more frank in explaining the supposed necessity for it . Its real object seems to be shrouded in mystery. Apparently, no good reason can be advanced for clothing the Besident Minister in London with the powers of the High Commissioner. As a matter of fact, under present conditions it is not necessary to have a High Commissioner in London at all. Mr J. B. Collins has practically carried out the work of that officer for many years. Judging by the powers proposed to be given to the right honourable member for Flinders ( Mr. Bruce), under this more or less spectacular measure, it would seem that the House has not been informed of the real reason for the bill. I do not intend to make a personal attack on Mr Bruce in his absence, but I am entitled, I think, to offer criticism of a political nature. The injurious effect on Australia of the administration of the Bruce-Page Government is still remembered, and, unfortunately, this country, will for many years have to bear the burden which that Government imposed upon it.. I l had an un-Australian outlook, for it adopted a policy of borrowing and buying abroad. Our secondary industries and our finances were crippled during its regime. When, in 1929, it ignoniiniously went out of office, it was generally regarded as a Ministry which had administered the finances of this country unwisely. . During thisdebate, many encomiums have been heaped upon the right honourable member for Flinders. One can readily find a reason for that. When 'he Comes back, in all probability he will be in a' position to reward, those who have defended him in his absence from the charges levelled against him as a public financier. One Can appreciate the desire of certain honourable members to stand in well with a man who will probably occupy a high position in this country before the expiration of the twelve months for which he is to be appointed Besident Minister in London. His first duty, it seems to me, is to rehabilitate himself in the eyes of the people of Australia, and that will be a difficult job. Much has be6n said today of his capacity as an administrator, but I claim that during his term of office as Prime Minister he showed blundering incapacityj and a total disregard for the Welfare of Australian industries. There was lavish expenditure during his regime; public money was wasted,- and from ten to fifteen years will be required to enable the Commonwealth to recover from the bankrupt condition in which he left it. This is the man who is held up today as the only person suitable for the special mission on which he has been sent to London. As a matter of fact, the job for which he is ostensibly going there, has already been done. What I am afraid of is that the right honourable member, with his kindly regard for the overseas financiers and the bondholders, will not strike such a bargain for Australia as could be obtained by a representative other than himself. my opinion, he has neither the necessary capacity, nor the temperament required to enable him to carry out delicate financial negotiations. The right honourable member has not an Australian outlook. I speak as the result of about ten years' experience of him in the public life of this country, and that is also the conclusion which many thousands of people in Australia have reached ing him. Owing to his mismanagement of the finances of the Commonweal th, cannot accept him as the plenipotentiary Mr lilakeleu. of Australia. No doubt, the Government thinks that it is doing right in selecting the right honourable member for this work, but the Opposition is entitled to protest against his selection to carry out the conversion of Australia's' overseas loans. If the main reason for the appointment of the right honourable gentleman to this high position is not his personal rehabilitation in the eyes of the Australian people, one wonders-and I regret that the Prime Minister' was not more frankfor whom the right honourable gentleman is- "" seat-warming "" in Flinders. Some talk has been indulged in about ""seatwarming "" this afternoon. Why did not the honourable member for Balaclava ( Mr. White) enlighten the House on this matter? I have no doubt that the right honourable member for Flinders is very happy in' his new position. A ll his business interests, or at least the greatei part of them, lie in London, and they have caused him great concern in the last couple of years; in fact he had to hurry to London some time ago to take over a more or less staggering concern.",36
137,Mr WHITE ,The honourable member promised not to be personal.,37
138,Mr BLAKELEY ,"My criticism is not personal; I am merely reminding honourable members of something which the right honourable member himself said in this House. It is common knowledge that the firm of Paterson, Laing and Bruce has suffered heavy losses during the last two years; in one year the loss was £80,000. No doubt the public duties of the right honourable member for Flinders will dovetail very happily with attention to his private interests abroad. Those who are for ever gibing at professional politicians will approve of the appointment of the right In honourable gentleman as representative of Australia in London. Contemptuous reference is made to those men whose only source of livelihood is their parliamentary allowance. God help Australia if it should ever become dependent on men who subordinate their parliamentary duties to their private business interests. Mr E. J. HAKBISON - Unio n organizer? regardwould be much better!",37
139,Mr BLAKELEY ,"In suits are hurled I at union secretaries. In what respect is, say, the manager of a shirt and pyjaraa factory better qualified for public life than a union secretary? NA was one of the much abused political organizers, not a trade union organizerGod forbid!-bu t something much more . respectable.",37
140,Mr SPEAKER,Order ! I ask the honourable member to connect his remarks with the bill.,38
141,Mr BLAKELEY ,"Australi a could be represented in London as well by a union secretary as by the director of an importing firm, and with all due respect to high finance and big business, I believe the former would do the job more efficiently. There is no need to alter the law to enable the right honourable member for Flinders to be appointed to represent Australia in London, and there is certainly no justification for paying him more than his ministerial salary. He will control a capable staff in Australia House, and I have no doubt that after the preliminary negotiations are completed the detail work of loan conversion will be done by men who understand these matters much better than the right honourable member for Flinders.",38
142,Mr ARCHDALE PARKHILL ,That the ordinary course of business.,38
143,Mr BLAKELEY ,"The Leader of the Opposition said that the conversion negotiations would be conducted up to a certain point by the Minister now in London, but that the detail work could be done by Mr Collins, who has a more intimate knowledge of public finance and loan operations than has the right honourable member for Flinders, or any other person who is not constantly in touch with the financiers of London. contention was completely misrepresented, inadvertently I believe, by the honourable NA The explanation of this measure by the Prime Minister was not frank; possibly he thought that the time was not opportune to take the House into his confidence. The Attorney-General ( Mr Latham) also showed a keen desire to withhold from the House the real reason for the step that is proposed. Other honourable members supporting the Government do not know the real reason, but accept the ostensible one in the hope that their encomiums of the right honourable member for Flinders and their defence of his The political reputation will be suitably recognized on his return.",38
144,Mr GABB ,"Angas) [5.36] - The debate seems to have centred on the right honourable member for Flinders ( Mr. Bruce), but I do not find in the bill any reference to him, although we .know that he is to be appointed acting High Commissioner. I have arrived at the conclusion that it is immaterial whether one votes for or against the bilL The Leader of the Opposition ( Mr Scullin) has asserted that a vote for the second reading will be an endorsement of a new system. The Attorney-General, on the other hand, assured the House that the bill does not introduce any new general principle. Perhaps the Leader of the Opposition is right, but governments will please themselves, as they have done in the past. The operation of the bill is limited to two years, but if a government desires to send some of its members abroad, it will find excuses.for doing so. For a considerable time, at least one Commonwealth Minister of the Crown has been absent from Australia. The Scullin Ministry sent four Ministers abroad. To date, the present Government has sent is three abroad, and I doubt that that will be the end of these trips. I regard many of them as merely political plums, and I am certain that if the present Government or any future Government wants to send other Ministers on trips at the public expense, it will do so, whether this bill be accepted or"" rejected. I support the measure for two reasons. The first is that it will enable a saving of £2,000 a year to be effected.",38
145,Mr JAMES ,How does the honourable member arrive at that figure?,38
146,Mr GABB ,"Accordin g to the Prime Minister, the ministerial allowance of the Minister resident in Loudon will be augmented by an amount sufficient to bring it up to the salary and allowances usually paid to the High Commissioner. I estimate that this will mean a saving of between £1,700 and £2,000. I am not convinced that the calibre of the representation in London will be improved. The High Commissioner has always been an <;x-Minister of, the Crown, and whether the occupant of the office be a Minister in harness or a Minister out of harness is immaterial. My second reason for supporting the bill is that governments will find it less easy to send another Minister tripping to London when there is already one resident there. This will mean a further saving. I was interested and amused by the Attorney-General's emphasis of the need for efficient representation of Australia in London. Undoubtedly the need exists, but I could not help recalling some earlier appointments of High Commissioners and Agents-General. If rumour be correct, Sir Granville Ryrie was appointed High Commissioner because of his political services to his party, and to get him out of the way at a time when his vote was uncertain. Sir Henry Barwell was appointed Agent-General for South Australia purely for political reasons. Had he stood for the Senate, he might, have prejudiced the chances of the Nationalist or Liberal candidates. Therefore, the salary of the Agent General was increased, and Sir Henry Barwell was shipped to London. Happenings of this character make me feel that ability and efficiency arc not the factors which govern these appointments abroad ; the primary consideration is the interest of the political party in power. This debate is another illustration of how political parties throw dust in the eyes of the people, and continue their party wrangles regardless of what happens to the country.",38
147,Mr JAMES ,"Hunter) [5.42] - I am opposed to the appointment of the right honourable member for Flinders Bruce) to be Resident Minister in London. Some honourable members have lauded the special qualifications of the right honorNew South Wales? able gentleman, but I claim that the Bruce-Page Administration was largely responsible for the present financial tion of Australia. That Ministry intro20,000 duced thousands of migrants from overcould seas.",39
148,Mr SPEAKER ,"Order ! Some honorFlinders able members seem to be under the fications erroneous impression that they are parister ticipating in a debate on the budget. The bill before the House is for the pose of vesting in the Minister without Portfolio, who is now in Great Britain, the powers given to 'the 'High Commisdesignation sioner by the High Commissioner Act, which it amends. I ask the honourable member for Hunter to confine his reinarkt to the subject-matter of the bill.",39
149,Mr JAMES ,"Unfortunately , I always seem to be the member reproved by the Chair for transgressing. Other honourable members have spoken of the special qualifications of the right honourable member for Flinders, and surely I am entitled to answer them. The Bruce-Page Ministry introduced approximately 160,000 migrants at a cost of £2,000,000.",39
150,Mr HUTCHIN ,The migrants were introduced by the State Governments.,39
151,Mr JAMES ,"The Bruce-Page Ministry expended £2,000,000 on the steamship passages of assisted migrants. During the time that the right honourable inembei was Prime Minister £300,000 a year was expended on immigration. To-day the community generally has to maintain a considerable number of migrants who could not bo absorbed in industry. They were brought here for a specific purpose.",39
152,Mr SPEAKER ,I cannot alloy the honourable member to enlarge hie argument on that subject. If he wishes to bring outside matters into the debate he must do so by way of illustration and by directly connecting them with the subject-matter of the bill. 7,39
