speakerGroups,Speaker,text,pageNumbers
82,Mr WHITE ,"That is why a Minister rather than an official, is required there. MrSCULLIN - A government can give definite instructions to an official at Australia House, but it will be impossible to give instructions to a Minister. If our representative were instructed, he would cease to be a Minister, and would become a mere official. My confention is that the right honourable member for Elinders ( Mr Bruce), having completed the special mission upon which he is visiting Great Britain, should return to Australia. The principles of democracy demand that the representatives of the people in this Parliament shall keep as closely as possible in touch with their electorates. To make the right honourable member a permanent Besident Minister in London would be to disfranchise his constituents.",22
83,Mr WHITE ,Hi s electorate will be well looked after in his absence.,22
84,Mr SCULLIN ,"It s needs were not not properly attended to when he represented it before. There is great reluctance on the part of the Government to state the real reason for sending the Minister abroad. It is said that there is special work for him to do; but that is not an adequate reason. Special work has had to be done at Ottawa, Lausanne, and Geneva. Is it seriously suggested that it is essential to have a Besident Minister in London because special work must be done there? What is the reason for sending a special Minister to London, and what will be the term of his residence there? He will be out right of touch with not only Australia, but also bis own constituents. Seeing that this bill authorizes the appointment of a Besident Minister in London, and places the imprimatur of Parliament upon such a procedure, the Opposition intends to oppose the measure. The Prime Minister, in endeavouring to find a special argument in support of this proposal, set out to eulogize the right honourable member who has gone abroad, and said that he was sure that he would represent Australia as well as any previous High Commissioner had done. We have not always been fortunate in the choice of our High Commissioners, and I hope that an improvement will be brought about in this instance. It seems to me that the basis of the Prime Minister's argument is the exceptional experience and profound knowledge of the right honourable member for Flinders. 1 do not intend to indulge in personal criticism, particularly regarding a member who is absent. I read of the case for trade preference presented by him on behalf of Australia at Ottawa, aud I thought that he made out a strong claim. I am very doubtful, however, regarding his judgment as to what should be conceded by Australia, and I am waiting with grave anxiety to know how his judgment has been exercised in relation to concessions. I was not particularly impressed by the right, honourable member's judgment on the economic position generally, when he was leader of a government, because I recall the warnings given by members ofmy party and by myself with regard to our trade balance in 1926, 1927 and 1928. The Bruce-Page Government was then warned of the disaster likely to overtake this country if its policy continued. I recall the light and airy way in which those warnings were dismissed by the.right honourable gentleman, who had not sufficient judgment to see what was likely to result from the action then taken. I am opposed to any government of Australia from abroad, and I object to the appointment of a Besident Minister in London. I shall support the visit of a member of the Cabinet on any special and important mission, and I grant that there is important, work to lie done in London by the right honourable member on this occasion. I wish the right honourable gentleman every success in his mission, and I hope that the result will be a reduction of the rate of interest on our overseas loans; but, on. the completion of his mission, he should return to Australia to represent his constituents in this Parliament.",22
85,Mr LATHAM ,"Kooyong-Attorney General) [3.58] - The Leader of the Opposition ( Mr Scullin) has called attention to the obvious fact that this bill proposes a change, at least for the time being, in the character of Australia's representation in London, and has justly asked for reasons in support of that change. Those reasons were given by the Prime Minister in moving the second reading, and I propose shortly to develop one or two of them. I dissent from the view of the Leader of the Opposition as to the possibility of Australia being represented in London by someone other than, an official. I consider it most important to have efficient representation of Australia in London, representation of a. character such that our representative may stand alongside, and, I hope, often above, the representatives of other countries. To have an official in a world centre such as London as the representative of a dominion or a foreign country is particularly unfortunate in many respects. It necessarily and inevitably results in the impression being conveyed that the country so represented is of second-rate importance, and unable to obtain any one of distinction to represent it abroad. The Australian representative in London has a tremendous field for useful activity, and is able to exercise a wide influence in promoting the well-being of our' people. Discussions with people abroad may at the present time turn largely on finance. But there are other vitally important subjects. Australia's principal markets are in Great Britain, and it is important that we hold and extend them. The competition for them is intense at the present time, and the Commonwealth must be kept well before the minds of the British people in order that we may have the full advantage of not only the quality of our products, but also that sentimental interest in the dominions which is of great importance to - Australia's exporting trade.",23
86,Mr GREGORY ,We want a business man with commercial capacity rather than a politician.,23
87,Mr LATHAM ,"A representative whose ability and distinction appeal to the minds of the British people is worth a great deal more than a mere office man, however great may be his commercial knowledge. Of course, we must have a well-qualified commercial staff, but we particularly need a man whose eminence catches the public imagination, and who is able to make a contribution to the public life of not only the Commonwealth, but also the Mother Country itself. Great endeavours have been made to increase the consumption of dominion products in Great Britain, and excellent work to that end has been done by the Empire Marketing Board. Australia must do everything possible to maintain its commercial reputation and prestige abroad, for I assure honourable members that prestige is a highly important element in both finance and trade. This bill is not brought forward for the purpose of introducing a^new general principle. From time to time the relative advantages of a High Commissioner or a Besident Minister to represent dominions in London have been discussed. I have never accepted j t as a general principle that Australia would be most effectively represented by a Besident Minister. While that system would have advantages it would have also great disadvantages. It is true that Canada has on occasions been represented by a Besident Minister, but it is very much easier for him to keep in direct contact with his colleagues than it would be for an Australian Minister resident in London. Amongst the advantages of having a Besident Minister would be that he would have an authority abroad which no other appointee could have. He would be able to speak directly for his Government, and in all negotiations would achieve more a shorter space of time than would any - official. He would also be in closer - contact with his Government. element of authority which he would enjoy would play an important part in dealings with representatives of other countries. When it is known that the representative of a dominion has full authority to aet for the Government of that country, much more can be achieved than when discussions with a High Commissioner or other official are known to be merely preliminary and provisional. On the other hand,' a system of represenI tation in London by a Besident Minister would possess distinct disadvantages. It could not be adopted as a general principle, because often it would be impossible for a Minister to be absent for a considerable length of time from this Parliament and from his constituency. Therefore, the innovation now proposed may be regarded as only an experiment to meet special circumstances. In the highly-important financial negotiations that must be conducted during the next few months, it is of the utmost importance that the man who speaks on behalf of Australia shall be vested with the maximum of authority. Direct conversational dealing is worth many months of indirect negotiation through an official. The Minister without Portfolio ( Mr Bruce) possesses special qualifications for doing the work for which he has been appointed, and it would be very difficult for the Official Secretary, competent as he is, to achieve as much as the man with the status of a former Prime Minister and late AssistantTreasurer of the Commonwealth. The loan conversions will involve mainly direct negotiation with individuals and institutions, and as a result of my own experience in London recently, I am convinced that the Minister will achieve much more than could any official, however competent. The passage of this bill is necessary to enable the right honourable member for Flinders to control the stalf of Australia House. Its operation is limited to two years, and the Minister in London will exercise the functions mentioned in the bill only during the pleasure of the Governor General. The object of that provision is to put it beyond doubt in that any appointment under this legislation will not be even remotely binding on any subsequent administration MONICA",23
88,Mr GREGORY ,What is the salary of the High Commissioner?,24
89,Mr LATHAM ,"The salary is £3,000, plus an allowance of £2,000, both amounts being subject to a 25 per cent, reduction under the financial emergency legislation. While the right honourable member for Flinders is doing the work of the High Commissioner, lie will receive these reduced amounts, and a saving equivalent to his ministerial salary will be effected. ask the House to accept the bill, not as a measure introducing a new principle, but because it will enable us to have the benefit of the services of the right honourable member for Flinders in London in connection with highly important financial transactions during the next few months. The Government does not intend to prolong this appointment beyond what the necessities of the case demand-. In connection with these matters, it is very often difficult to state publicly what the necessities of the case are, because financial transactions may depend upon personal negotiations, sometimes intimate, and always private, which, would be rendered abortive if publicity were given to them.? I consider that the Commonwealth is fortunate in being able to obtain the services of the right honourable member for Flinders in London at this juncture, and for the special task which he has been asked to undertake.",24
90,Dr EARLE PAGE ,"Cowper) [4.10] I congratulate the Government upon the step it has taken. My only criticism of the bill is that it does not go far enough. I object to the limitation of the appointment to two years; that restriction could have been imposed later if the experiment proved unsatisfactory. I am disappointed also that there is no provision for negotiation .with the States for the abolition of the office of Agdnt-General, so that Australia might be wholly represented by a Minister of this Parliament.",25
91,Mr GABB ,Thos e positions are kept as political plums.,25
92,Dr EARLE PAGE ,"I welcome the policy contained in this bill because, while it continues, the position of High Commissioner will no longer be a political plum. I have no complaint to make of the gentlemen who have filled that office in the past. All had distinguished themselves in the public life of Australia, but none of them returned to this Parliament to enrich it with the increased 'knowledge which they must have gained by their residence and contacts abroad. In future, if the system of appointing a Resident Minister in London be continued, a member of this Parliament will discharge that duty, and he will be obliged to return here to give to Parliament and to his constituents an account of his stewardship. One reason why I have always advocated the appointment of a Resident Minister in London is the .need for widening the circle of men in this Parliament who have definite and intimate kaowledge of conditions and governing authorities on the other side of the world. If there is one matter in respect of which Australia compares unfavorably with some of the other dominions, it is the failure of its people to realise the international position they have attained since the Great War. The Commonwealth must have international contacts. The increasing extent and distribution of its trade make it essential that this Parliament shall contain men with experience abroad. I have always hoped that the constant return to the Commonwealth Parliament of men who had served for a year or so as Resident Minister abroad would gradually build up from all parties-becaus e as governments changed the ministerial representation abroad would change-committee s of members, qualified to advise governments in regard to external affairs, thus creating a definite interest in Imperial and foreign policy. A striking feature of the debates of this Parliament is the entire absence of comment on foreign relations ; we seem to be absorbed in our internal politics.",25
93,Mr BEASLEY ,We do not get a chance to discuss other matters.,25
94,Dr EARLE PAGE ,"The character of the business-paper does not vary much with changes of government. One explanation is that there are not in this Parliament sufficient men who have had extensive experience abroad and made - intimate contacts with governments and public men in other countries. Although I have always advocated the appointment of a Besident Minister in London, there was, in the past, one valid objection to it, namely, the difficulty of maintaining close contact between the Minister overseas and the Government here, but since the' invention of wireless telephony that disadvantage has been removed. There is no reason why the Minister overseas should not, if necessary, be in daily personal contact with the Government of Australia that will remove the grave danger that there was previously, of the representative overseas committing his Government, without previous discussion with it, to an undesirable policy. Another reason why there should be a Besident Minister representing the Government of Australia in Great Britain, is that the status of the Governor General has altered during the past few years. At present that office is held by an Australian who has not had the opportunity that previous GovernorGenerals had of being in touch with the British Government or with His Majesty himself.",25
95,Dr MALONEY ,An Australian is a better representative.,25
96,Dr EARLE PAGE ,"I am not now criticizing the action the previous Government in appointing an Australian as the Governor General, but that appointment has made it more necessary for us to have a direct representative of the Government of Australia in Great Britain, so as to keep us fully informed of the position overseas. I recognize the difficulty of obtaining the services of a man suitable for the position. A member of this House having a doubtful electorate could not afford to be absent from Australia during the last year of a Parliament, but that difficulty could be overcome to some extent by appointing to the position during the first year of Parliament a representative of the House ef Representatives, and during the last two years of Parliament, a representative of the Senate. Thus, during a period of six years at least two members of this House, and four members of the Senate would hold the position of Resident Minister in London. I have no doubt that if a Minister were absent in Great Britain, and an election took place, some other honourable member would he prepared to handle his constituency for him. If that were done we should save considerable expense in connection with the enforced visits of Ministers overseas.",26
97,Mr GABB ,Coul d we prevent forced visits ?,26
98,Dr EARLE PAGE ,"Since the formation of the Loan Council and handling of the conversion of loans by council, there has practically been cessation of the visits of State premiers and treasurers which used to take place so regularly in previous years. The fact that the Attorney-General was overseas recently enabled the Lausanne negotiathe tions to be completed. During the years that the previous Government in office four Ministers went overseas. I do not cavil at that, because I have always maintained that it should be necessary for every member of this Parliament to be brought into contact with international and imperial affairs. I have never objected to the visits of Ministers overseas, because they are for the good of Australia. Unfortunately our Ministers generally have little intimate contact with foreign affairs. With regard to the position of High of Commissioner, this gentleman is appointed for five years, and there is usually, during that period, a change of Government. When that takes place the High Commissioner, who is probably a political appointee, is no longerin close contact - with the Government that he is supposed to represent, and that Government does not feel disposed to consult him to the extent that it would consult a member of its own Cabinet, if he were resident in London. I welcome the entrance into this Parliament of the honourable member for Corio ( Mr Casey), who has had considerable experience of imperial and foreign policy. Because of his knowledge, he is a valuable asset to this Parliament. If every year or second year, men with similar experience and qualifications were returned to this Parliament, we should be able to appoint a committee on imperial and foreign affairs with the object of framing a definite policy and laying down a nationaltradition in respect thereto. It is a mistake to limit this appointment to two years, and I regret that the Attorney-General ( Mr Latham) has stated that when the present occupant of the position returns to. Australia there will probably be an appointment for five years. In eighteen months' or two years' time, special circumstances may arise, which, being beyond the control of a High Commissioner, will warrant the sending the overseas of a capable Minister. I the join with the Prime Minister and the a Attorney-General in saying that as the Ministers who become specially qualified for this particular mission return to Australia, the status of the position will become so important that it will become custom for this Government to be two represented in Great Britain by a was Minister. I shall support the bill.",26
99,Mr BEASLEY ,West Sydney) [4.23]. - I listened with interest to the speeches of the Prime Minister ( Mr Lyons) and the Attorney-General ( Mr Latham). They certainly made heavy weather in endeavouring to justify the action of the all Government in making this new appointment. I also gathered from those speeches that we have not been informed of all the reasons for the appointment.,26
100,Mr HOLLOWAY ,The honourable member could not expect that.,27
101,Mr BEASLEY ,"On e could hardly expect to be informed of all the reasons for this appointment, but if we cannot obtain information from the Government we are entitled to draw our own conclusions, and to express them as the opportunity arises. The bill provides that the Besident Minister will exercise the powers of the High Commissioner. It is stated that it is necessary to make this appointment in order that the work previously performed by the High Commissioner may be carried out by the right honourable member for Flinders, and that there is no intention, at the moment, of filling the vacant position by appointing another High Commissioner. It is quite likely that the Government, for political reasons, does not, at present, wish to fill this vacancy. The Leader of the Country party (Dr Earle Page) seems to have as much knowledge of this appointment as the Prime Minister himself. For instance, he suggested that a Besident Minister might be appointed, and that the office might be held alternately by members of this House and ' of the Senate. If that suggestion is to be given effect, I can forecast that probably after the lapse of twelve months the right honourable member for Flinders ( Mr Bruce) will return from London and Seuator Sir George Pearce will take his place. Later, circumstances may arise to compel the Government to fill the position of High Commissioner in London.",27
102,Mr LYONS ,"The Government, if it wished, could do that tomorrow.",27
103,Mr BEASLEY ,"It is true that the Government has that power, but it may not be prudent to exercise it just now, in view of the political position. Prime Minister has had a varied experience of political exigencies, and I have no doubt that he will have a wider experience as time goes on.",27
104,Mr GABB ,Is that a threat or a promise ?,27
105,Mr BEASLEY ,"I do not make threats, nor am I competent to make promises. In these times it is not possible for any honourable member to make predictions regarding the political future.",27
106,Mr WHITE ,Is the honourable membei referring to New South Wales?,27
107,Mr BEASLEY ,"If an opportunity presented itself at the present time, some big changes would take place in that State. It has been definitely stated by the Prime Minister that the Besident Minister will deal with the conversion of loans. I agree entirely with the remarks of the Leader of the Opposition ( Mr Scullin) on this subject. Mr Collins has previously undertaken this work, and I claim that he has been a competent and capable officer. I know from my own experience that during the regime of the Scullin Government, Mr . Collins did great work for this country. Therefore all this talk by members of the Government about the necessity to appoint as Besident Minister a man of high prestige and standing, is mere makebelieve, the intention being to provide a suitable environment for the right honourable member for Flinders. The Attorney-General said that the appointee will not confine his activities to the work of conversion alone, and that he will be employed in a number .of other spheres in which his services will be invaluable. The disposal of our primary products in foreign markets was mentioned. I understand that already we have in London trade representatives whose special duty it is to provide markets for our products. Mr Devereux, when associated with the Development and Migration Commission, was transferred by the late Government to London in order to reduce the expense occasioned by the high salaries paid to men appointed on long-term contracts by the Bruce-Page Government. As Mr Devereux is in London, doing work in connection with the wool industry, there is no necessity for the Besident Minister to assist in that direction. The A gentleman from the Queensland Department of Agriculture ( Mr MacGregor) was also sent to London.",27
108,Mr SCULLIN ,He is a very capable officer.,27
109,Mr BEASLEY ,"He must be, for the present Government made arrangements for him to be in Ottawa during the recent conference, to advise on certain aspects of the negotiations. All the circumstances go to show that there is no justification whatever for adding to Australia's repreHe sentation in Great B r it a in by having Besident Minister there permanently. This is not the real reason for the making of this appointment. The expense involved i u this new departure was mentioned by the Leader of the Opposition ( Mr Scullin), who steps to obtain additional information London. under this heading. I am not satisfied with the information furnished to h i Something has been said about the alleged saving as between the salary of a Minister and that of the High Commissioner; the fact is that the expense has probably are laughable. hardly commenced. I direct attention to one small point which may interest struggling farmers in the outback, unemPrime ployed workers in the cities, and other Australian people whose paymentSjibecause of our social welfare legislation, have reduced. The first thing that we heard from this right honourable gentleman after his arrival in London was that the mansion in which he was to reside was not satisfactory to him and would have to be renovated. Apparently he did not like the pattern of the wallpaper on the bathroom or somewhere else, and it had to be torn down and replaced. I am under the impression that this palatial residence was renovated, or a considerable sum of money spent on it , only about three years ago. I should like to hear what honourable members opposite would say if some of our citizens who are on the basic wage were to complain that the homes provided since then. under this wage scale were not decorated according to their tastes, and must thereright fore be renovated.",27
110,Mr WHITE ,Surely the honourable member realizes that this is providing work.,28
