speakerGroups,Speaker,text,pageNumbers
193,Mr A GREEN ,"The Attorney General ( Mr Latham) in support of the bill today, said that the appointment of the right honourable member for Flinders was made because of his financial ability and prestige. The Minister emphasized the latter point, and suggested that the right honourable gentleman had been selected for the position because of his wide knowledge of the financial problems which confront Australia. I , and other honourable members on this side, take the view that we need to cultivate an Australian sentiment, not necessarily in antagonism to Great Britain, but because our trade interests need special attention. The Ottawa Conference decisions reveal the fact that wo must be prepared to fight for the preservation of our trade interests, just as the British delegates at Ottawa fought for the trade interests of the Mother Country. The renvesentotive in Great. Britain of White TIous"" does not sink his individuality as an American citizen. He does not pose as an Englishman, in order to make himself acceptable to the people of Great Britain. They know that he comes to them as a plain American, representing the views of the Government of the United States of ""America, and does not deem it necessary to go to the court of St. James in court dress. That, I suggest, is the spirit which the representative of Australia should emulate in the Mother Country. I am opposed to the bill, because such an appointment has never been found necessary before, and because the Ministry has advanced no sound reason why it should be made. The other dominions have not taken similar action. The Dominion of Canada, which lies closer to the heart of the Empire, and could more readily spare a Minister fov a few months, has not deemed it necessary to have a Besident Minister in London. The Government's proposal is a departure from established precedent. The honourable member for New England ( Mr Thompson) made a strong point when he urged that the electorate represented by the right honI orable member for Flinders had a right to be considered in this matter. Personally, I have nothing against the right honourable gentleman, but I entirely differ from him on political matters, and I share the view of the honourable member for New England that the electors concerned should have been consulted. The right honourable gentleman conducted his campaign from abroad to a large extent, and I feel sure that had the electors been told that, within a comparatively short time of his election he would be sent as Besident Minister in London fov a. period of two years, he would not have been returned. Mr Collins, the Official Secretary of Australia House, was appointed by the Government led by the right honourable member for Flinders, and is well equipped to carry through successfully any loan conversion operations that may be deemed necessary. The new Besident Minister will be obliged to wait until the London market is favourable, just as Mr Collins would have to wait, had he been entrusted with the mission. Some time ago, it was anticipated that loan conversions on a large scale would take place. We were led to . believe that immediately upon his arrival in London the right honourable member for Minders would get in touch with financial interests and take steps to vert oar overseas debts into securities bearing a lower rate of interest. We are now advised that the only operation before Christmas will be the conversion of the £ 13y000,000 due by the New South Wales Government.",51
194,Mr GREGORY ,There will be another conversion next year.,52
195,Mr A GREEN ,"Neithe r the honourable member for Flinders ( Mr Bruce) nor anybody else can foretell that next year will be more suitable than the present. He cannot do this job better than it could be done by Mr Collins, and, as the proposed appointment involves an entirely new departure, something without precedent in Australia or in any other portion of the Empire, the Government will have to support it with stronger reasons than have yet been given to this House before it will be approved by the people. Even the Attorney-General ( Mr. Latham) has stated that he regards the proposed appointment as an experiment. The Leader of the Country party (Dr Earle Page) declared that he has advocated for years the appointment of a Besident Minister in London. He has also advocated for years, without result, the creation of new States, and, apparently, will continue to do. so for many more years. The right honourable gentleman is fond of chasing a will-o'-the wisp. The reasons advanced by the Attorney-General cancel the arguments adduced by other supporters of the bill. We are told that the passage of the hill is necessary in order that the right honoreverybody. able member for Flinders may take control of the staff at Australia House. Without this legislation he can still take charge of the staff while he is in London, but I hope he will not remain abroad for more than a few months, because the present Ministry is not over-rich in ability, and if the right honourable member for Flinders is as capable as his friends have declared during this debate, his right place is in Australia. I can see no justification for the bill, and the reason for its introduction is a mystery. Mr E. F. HARRISON (Bendigo) [9.18] - In answering some of the critiwhich cism that has been directed by members of the Opposition against, the right honourable member for Flinders ( Mr Bruce), con- I do not propose to follow them to the depths to which they descended. At the outset I wish to nail the oft-repeated lie that the right honourable member for Flinders was educated abroad and has no sympathy for Australia. He was born in Australia and received his school education here. At the outbreak of war he was in England completing his education, and in order to avoid the loss of time that would be involved in returning to the Commonwealth to join up with the Australian Expeditionary Force, he enlisted in a British regiment, and while serving with it was gravely wounded. This bill has been introduced at an opportune, time. Australia has experienced two years of serious depression, but now, because governments are restoring the country to a firm financial footing, our credit overseas is so improved that an opportunity presents itself to reduce appreciably the interest payable on the external public debt. If Australians are true to themselves, the New South Wales loan of £13,000,000, which will fall due in a few weeks, will probably be converted at a lower rate of interest, which will represent a saving of between £150,000 and £160,000 a year. I remind the House that large loans are not converted by merely publishing a notification in a newspaper. Careful negotiations are necessary between the financial houses and the representatives of the borrowing dominion. The doors of banks aud other financial institutions are strongly guarded, and do not open to I say nothing in"" disparagement of Mr Collins, who has given extraordinarily good service to Australia, but he has not access to those financial circles in which it is necessary to explain Australia's present situation and its prospects. A favourable impression in those circles is essential if we are to effect a conversion upon satisfactory conditions. In those circumstances it is fortunate that the High Commissionership is at present vacant, through the expiration of Sir Granville Eyrie's term of office. This has enabled the right honourable member for Flinders to proceed from Ottawa to London to carry out an operation for the ground was most care-fully prepared by the Attorney-General ( Mr. Latham) on 'his recent visit abroad. Probably in connection with the High Comniissionership alone a saving of £2,000 a .year will be effected, and if Resident Minister in London is able to effect the conversion of the maturing New South Wales loan upon improved conditions, he will in one year save 70 or 80 times his own salary. The present official secretary at Australia House has not been in the Commonwealth for several years, and has no first-hand knowledge of the perils through - which Australia has recently passed. If the conversion operations are to be successful, we must have on the spot a man who can speak with authority and first-hand knowledge. Who is better fitted for this critical task than the right honourable member for Flinders, who left Australia recently after taking an active aud prominent part in the public affairs of the Commonwealth? Mr Collins, whom I have known and esteemed for many years, is without up-to-date knowledge of Australia's financial problems, and has not the authority and prestige which will be enjoyed by the right honourable member for Flinders. Whatever may be done for us by our representative in London, our fate will be more or less in our own hands. If we make fools of ourselves and follow false prophets who would lead us to destruction, we shall not satisfactorily convert the overseas debt and reduce our interest bill. On us alone the success of the impending transactions depends, and our mouthpiece will be the Resident Minister in London. His appointment has been described as a political plum. Having been very closely associated with him prior to his departure from Australia, I am able to say definitely that he did not desire to go abroad, but went from a sense of public duty. The fact that this bill may be operative for two years does not necessarily mean that the right honourable member for Flinders will remain abroad for that period. Probably when he has completed the task which has been delegated to him, he will return to Australia, where his real interests are. But if in order to complete his mission he should be required to stay in London longer than he originally contemplated, the bill will mit him to do so for two years aud no Mr E. W. Harrison. longer. During his absence, which, I hope for Australia's sake, will not extend to two years, I shall ""attend to the work of his constituency. So far I have not heard the from any elector of Flinders criticism of the right honourable gentleman for having gone overseas in obedience to the call of duty. Without exception, all of his constituents who have sj>oken or written to me have expressed pride and satisfaction in the fact that their representative has been chosen for this important task. I am convinced that upon his return not only will his electors express their approval of the service he has given to Australia, but the people of the Commonwealth generally will be satisfied that the fruits of his mission have well justified the departure which this bill proposes. NA debate has reminded me of the saying that a prophet is not without honour, save in his own coivntry. I predict that future generations will proudly refer to the right honourable member for Flinders ( Mr. Bruce) as a great Australian. Other public men of the past have been subjected to similar criticism and attack, but today we honour them for their loyalty to principle, their integrity, and their wisdom. Far too much debate has taken place on a comparatively simple proposal. It is true that no appointment of the nature now proposed was ever previously made in Australia, but the present financial situation is without precedent in Australian history. I have been recollecting the cabled correspondence between the then Prime Minister ( Mr Scullin) when he was in Loudon and his colleagues in Australia in connection with the proposal of the then Treasurer ( Mr. Theodore) to issue a fiduciary currency. Message after message came from the right honourable gentleman to warn Cabinet that if this proposal were persisted in, onr credit in London would be destroyed and Australia would be unable to meet its obligations. Amongst the members who have 3poken most disparagingly of the right honourable member for Flinders are some representing New South Wales. Yet the conversion of a debt of that State will be the first and most urgent problem to be tackled by the Resident Minister in London. The per- character of the right honourable member for Flinders has been disparagingly referred to. The right honourable member is persona grata in any company, no matter how high it might be, either in England or in Australia. If any commercial concern had an important mission to accomplish, would it not select for the pose a person who was acceptable everywhere, and who thoroughly understood the business? In this case the Government is not incurring additional expenditure. I differ from those who say that the right honourable member for Flinders is in any way anti-Australian. I have sat in the Commonwealth Parliament for as long a period as the right honourable gentleman, and can say of him that I have not met one whose integrity or chivalry was higher than his. I , as an Australian, am glad to have been associated with an Australian of his type. I believe! that he will render inestimable service to the Commonwealth, and that in no sense will he let Australia down. I cannot understand how the idea has occurred to the minds of some persons that, the right honourable gentleman was an ti-Australian a,t Ottawa. I should have been pleased had he given way a little more to the Mother Country in order to obtain for Australia a greater measure of reciprocity. Much has been said regarding the necessity for saving money. If we were to calculate the cost involved in the discussion of this matter, we would realise how much could have been saved had it been debated on its merits. NA right honourable member for Flinders ( Mr. Bruce) ought to feel flattered at the attenlivered tion that has been paid to him during the course of this debate. Most of the speeches have been purely partisan, and those who have opposed the proposal of the Government have made out a very poor case. The point has been made that this is a departure from established practice. I remind honourable members, however, that the subject was discussed at the Imperial Conference that was held in 1925 or 1926, when it was decided that, in the near future, each of the governments there represented should have a Besident Minister in London. I am in favour of this step, because I believe that one who has had experience in the Cabinet must have a thorough grasp of Australian affairs. Australia is the first of the dominions to take this step, and I believe that, in thus acting, we are serving the best interests of the Commonwealth. The pur- honourable member for East Sydney ( Mr. Ward) has decried the right honourable member for Flinders; but I consider that he is the right man in the right place, and I hope that he will continue to work on Australia's behalf in London for some time to come. One of his first duties will be to arrange for the conversion of the New South Wales £13,000,000 loan, and I feel confident that he will bring that operation to a successful issue.",52
196,Mr HOLLOWAY ,"Melbourne Ports) [9.40] - I regret that the tone of this debate has been so considerably lowered since it was initiated. I cannot find in the bill any reference to either the right honourable member for Flinders ( Mr. Bruce), or any other person. I hope that the personal element will be kept out of the discussion. In fairness to the Leader of the Opposition ( Mr Scullin), may I point but that he did not oppose Mr Bruce's remaining in London for the period necessary to complete the pending loan conversion; but, as a matter of fact, suggested that that was a wise course to adopt. The real principle has been cleverly side-tracked by some of the professional debaters in the House who, as the Minister has pointed out, have put up a straw man merely for the purpose of knocking it down. The honourable member for GippsNA an excellent speech, probably the most logical to which we have listened; but he made it on wrong premises, because he focussed attention on the wisdom of allowing a Minister to remain in London until the loan conversion operation was completed. Not a single member has opposed that. I have listened to every speaker, and have not heard one object to the right honourable member for Flinders remaining in London for the purpose of effecting a reduction in the interest on our overseas indebtedness. My only complaint is that that problem was not tackled long ago. I have accidentally come across a speech that was delivered in the House of Commons in April last by Sir Bobert Home. He did uor. suggest that Australia would be - acting in an undignified manner, if it .sought a reduction in the rates of interest. .He pointed out to the members of the . House of Commons that Australia could - not possibly meet her obligations if Englqnd remained any longer on the gold - standard, and said that it was almost - criminal to suggest that the smaller countries, the new countries, the primary producing countries, including Australia, should be expected to meet their obligations unless prices were increased, and there was a departure from the almost criminal practice of making debtor countries pay twice as much as they borrowed. He further .said that instead of the people of Great Britain taking a hostile view of a suggestion by Australia that repayment of loans should be postponed or that interest * rates should be lowered, they almost welcomed such overtures. Yet this matter has been held up here because of party political differences, and meanwhile, Australia has been suffering. I agree with the Leader of the Opposition that . the right honourable member for Flinders should be allowed to complete the pending loan conversion; hut I and the Opposition as a body are opposed to the principle of having a Minister permanently resident in London. That, consider, is an honest attitude to adopt. [, and the school of thought to which I belong, believe that there is danger in Australia being governed according to expert outside advice. We are suffering today as a result of the acceptance of the advice of supposed experts who have visited Australia during the last four or five years. A.ustria like and many other small also is suffering as a consequence of the acceptance of the advice of financial experts, particularly in Great Britain. The advice that they gave three or four years ago is now obsolete in Great Britain, and is entirely contrary to the opinions of the experts of today. T object to the way in which the debate has been conducted. It has been turned to new premises altogether. The Opposition has been charged with being opposed to the loan conversion operations. Honourable members supporting the Governor. Holloway. ment have even pointed out the amount of money that would be saved by these operations, as if the Opposition were all centred upon not allowing the Minister to remain in London to carry on that work. Actually We are opposed to this bill because we think that by allowing a Commonwealth Minister to be permanently resident in Loudon, we shall add to the danger of this country being controlled from overseas. Mr E. J. HARRISON (Wentworth) [9.46] - Wit h the honourable member for Melbourne Ports ( Mr Holloway), I deplore the tone that, has crept into this debate. It seems to me that we should endeavour to help Australia in this time of depression, not only by giving due consideration to the problems that beset, us but also by aiding the Resident, Minister in London to arrange a successful conversion loan. The tone that has been adopted in this debate may considerably embarrass the conversion of that loan, because, instead of the Resident Minister receiving the wholehearted support of this House in his efforts-to secure the conversion of the loan, accusations are being levelled at him by the Opposition that will embarrass him. Notwithstanding the statement of the honourable member for Melbourne Ports that no objection is being taken to the proposal that the ResiI dent Minister should remain in London until such time as the conversion is accomplished, some honourable members object, to the appointment of a Resident Minister in London at all. They seem to resent the fact that the right honourable member for Flinders ( Mr Bruce) is to represent Australia abroad. The honourable member for Melbourne Ports suggests that, this will be a permanent appointment, but I Australia refer him to the provision in the bill countries which states that it shall remain in operation for a period of two years and no longer. The position of Resident Minister in London, therefore, cannot be considered as permanent.",54
197,Mr MAXWELL ,"It is purely experimental. Mr E. J. HARRISON - That being so, the arguments of the Opposition cannot be substantiated. The honourable member for East Sydney ( Mr Ward) said that the debate has centred round the name of the right honourable member for Flinders, and not the bill itself. The general tone of the speeches from the Opposition suggest that in tlieir opinion .he has an. anti-Australian outlook, but I , for one, certainly prefer the outlook of -.the right honourable member for Flinders to that of ""members of the Lang party who represent a group of persons who have no claim at all to be considered as Australians. It is a wise move at this stage have a Resident Minister in London, if only to convince the people there that we in Australia have a national outlook and a - clear understanding of international questions. Reference has been made to the educational qualifications of the right honourable member for Flinders. It is wise that we should select such a member as our representative, mainly because of those qualifications since, at least, they have given him a breadth of vision and sportsmanship, that cannot be claimed to - be possessed by those who now attack him. Had he no other qualification than the fact that he was instrumental in bringing about the fall of the Lang Government, it would be sufficient to establish his status in the eyes of oversea financiers. The members of the-Opposit ion have professed to show great consideration for the constituents of the right honourable member for Flinders, whom, they say, are likely to be disfranchised while he remains overseas. Let me suggest that they should rather watch their interests in their own constituencies, because their positions in this House may, in the near future, be seriously jeopardized, because of the attempts they have made by mischievous statements to prevent the successful conversion of the loan.",55
198,Mr GREGORY ,"Swan) [9.53] - I support the bill. At no time since the war has it been so necessary as it is today to have a responsible Minister resident in London. The confidence of oversea investors in Australia is being gradually restored. In November, loans amounting to £13j000,000 have to be converted. Some heavy loans are maturing next year, and there is the probability of a big conversion taking place. We could not have chosen any more suitable person for the position of Resident Minister in London than the right honourable member for Flinders ( Mr Brace). I cannot understand the attitude of the Leader of the Opposition ( Mr Scullin), who has contended that the work of conversion should be left entirely to Mr Collins, our principal officer in London. What would the Opposition have to say if the Government failed to ensure the success of the conversion loan by neglecting to send a capable representative overseas?",56
199,Mr MARTENS ,The Leader of the to Opposition did not say that the conversion should be left entirely in the hands of Mr Collins.,56
200,Mr GREGORY ,"The Leader of the Opposition said that this matter could well be left in thehands of Mr Collins, and that there was no necessity for this appointment. I have nothing but contempt for honourable members who have attacked the right honourable member for Flinders. I am entirely opposed to the permanent appointment of a Minister in London. That would hardly be a wise procedure, in view of the great distance to the Old Country. If I thought that the object of the Government was to make this position jiernianent, I should protest against the bill, but I do not believe that that is the desire of the Government. I hope that, in the near future, the Besident Minister in London, will be able to make such financial arrangements there as will permit him to return to this country. We should not appoint a politician to the position of High Commissioner. We must encourage trade and business enterprise. Instead of appointing some one from our political ranks, we should appoint a business man who would be able to inspire confidence in the British commercial world, and to stimulate our trading relations with Great Britain and Europe in general. I should like embodied in the bill a provision to the effect that no member of Parliament should be eligible for such a position until at least eighteen months after he had ceased to be a member. We can best build up our-export trade by appointing the most suitable representative overseas. I hope that the Government will give consideration to my suggestion, particularly in respect to, not only the High Cornmissionership, but also to appointments to the High Court.",56
