speakerGroups,Speaker,text,pageNumbers
0,NA,"House of Representatives. Thursday, IS March, 1936.",9
1,Mr SPEAKER ,"Eon. 0. J. Bell) took the chair at 2.30 p.m., and read prayers. MOTION"" OF CENSURE. GOVERNMENT AND COMMONWEALTH BAN X - ISSUE OT TREASURY-BILLS-INTERES T RATE-OVERSEA S TRADE BALANCE. Debate resumed from the l l t h March (vide page 59), on motion by Mr. CURTINThat the Government is deserving of censure for(a) Failing to take action to safeguard Australia's oversea funds by checking the increasing flow of unnecessary imports, thus leaving it to the Commonwealth Bank Board exclusively to direct national monetary - policy in a manner gravely affecting &he economic conditions of Australia. (6) Disclaiming all responsibility for the course now taken, which .prejudices the employment of the people and increases ihe difficirl-bies of trade and commerce generally.",9
2,Mr ARCHIE CAMERON ,"Barker) [2.30] - I do not know whether or not the action of the Opposition in bringing forward this motion of censure was due to a misreading of scripture. I would point out to them, however, that when the prodigal son returned to his father a calf was slaughtered to celebrate his homecoming. The attempt on this occasion, apparently, is to slaughter a lion. Possibly honourable members opposite are hunting the more ferocious animal oil account of the fact that eight prodigals have returned to their father. The Opposition could have launched Beveral motions that might have caused the Goverument some embarrassment, or if not the Government, at all events some of its supporters. Por example, had it been proposed to censure the Government for failure to restore - within Australia the system of compulsory military training, which is necessary for the defence of this country, and is one of the outstanding planks in the platform of the Labour party, I , and probably quite a number of other honourable members on this side, whether wo liked it or not, on account of our principles, would have been obliged to cross the floor and assist in the defeat of the Government. That matter must be discussed before very long. All the talk about brighter uniforms will not overcome the difficulty with which we are faced. I shall not at this stage debate the matter further than to suggest that, if certain statements which have appeared in the press lately are to be regarded seriously, I shall expect an order to be issued recalling the existing army 'boots and replacing them with dancing shoes. MONICA",9
3,Mr ARCHDALE PARKHILL ,It would be a silly thing of that sort which the honourable member would think of.,10
4,Mr ARCHIE CAMERON ,"The'nex t point with which I wish to deal is the very definite expression by the Opposition of what amounts to a lack of confidence in the Commonwealth Bank Board. My personal view is that the Government should test the feeling of the House on this matter. It should move an amendment to the motion designed to discover whether honourable members opposite are prepared to state by their votes whether they have or have not confidence in the management of the financial situation by the Commonwealth Bank Board. believe that that would place some of my friends opposite in a somewhat awkward position. They are the political representatives of quite a body of people who are part owners of savings bank deposits, amounting to £130,000,000, which have been entrusted to the care the directors of the Commonwealth Bank. Yesterday's debate left well in the air the position in regard to the board. The motion of censure consists of a concatenation of suggestions, conjectures, suppositions and prophecies. Time after time those occurred throughout the speech of the Leader of the Opposition ( Mr. Curtin). I would recall to honourable members certain prophecies made during the last period of this session. Night after night, on the motion for the adjournment of this chamber, honourable gentlemen on the left of the Chair rose in their places and announced that a terrific war would be on our doorstep before the House next met. That state of affairs., however, to which apparently they looked forward with some gusto, has fortunately not yet materialized. I trust that honourable members opposite will ho just as much astray in their prognostications with respect to the trade position. This is not the first occasion upon which I have heard a similar motion debated in this House. The last onslaught was led by our friend from Capricornia NA there is little difference between what was said about twelve months ago and what was said on this motion by the Leader of the Opposition. To my mind, the attitude of the Labour party is inexplicable. We find that party, whioh prides itself on representing the underdog and on taking up the cudgels against the great vested interests, criticizing the action of the Commonwealth Bank Board in making available to the general investing public £1,000,000 worth of treasury bills on the same terms and. conditions as were enjoyed as a monopoly for some years hy the private hanking institutions of Australia. The situation is most interesting, and we are entitled to a clear pronouncement of policy upon it hy lionorable members of the Opposition. They are not in the happy position of I being able to censure the Government unless they can advance a fairly concrete proposal. The House listened last night to quite a disquisition in regard to experiments and the increased rate of interest. This Government cannot he charged with of having freely indulged in experimental legislation. Hitherto, that has been the particular monopoly of our friends opposite. The Labour party has .been a reservoir from which has flowed stream after stream of experimental legislation, most of which has ended in the marsh to which Robert Burns consigned the whole of the Stuart family. If honourable members opposite had the power to work their will with the Commonwealth Bank, along the lines advocated last night by the honourable member for Griffith ( Mr. Baker), I am afraid that that institution would find itself in such a marsh. The concern for interest rates is not the special monopoly of the Opposition. It is the concern of every member of the House who represent electorates in which primary and secondary industries are conducted. Let us consider for a moment the history of the Opposition when it was in power. To which party belonged the Ministry that first went on the New York loan market, and paid the highest rate of interest ever required of an Australian government? That Ministry was not constituted from this side of the House. In all my political experience I have heard only one Labour man-and he was well kicked for his pains-advocat e a reduction of the rate of interest before it was brought about some years ago. I refer to the Honourable Thomas Butterfield. When he came out into the open, he said that the rates then being charged could not be maintained, as they were no longer the true rates, because the borrowers were paying an insurance against risk. He contended that the risk of lending money was so great that the lender was asking for something in addition to the real rate in order to insure himself against the risk taken. On that occasion Mr Butterfield was taken seriously to task by men who were considered to be financial experts in the party of which he was rather a distinguished member. Let us consider the interest rates that have been charged during the last few years, and let us view the matter from the broad aspect. I am not at all satisfied that the rates of interest that have prevailed in recent years are the proper ones. Certain important factors were brought into calculation in fixing the rates, and one was the fact that the lender - for instance the holder of Government bonds when the Premiers plan was instituted in 1931-wa s so chary about being able to secure his capital that he was prepared to accept a big reduction of interest, if he could see his principal safe. Another factor considered was that on account of the fall of prices it was no longer possible to make a profit by the investment of money in primary industries, or ordinary manufacturing and trading concerns. There was also extra heavy taxation on account of the general depression. The whole of these factors, and perhaps some others, were a contributing cause of the considerable reduction of the rate of interest, not because people thought that the rate would remain down indefinitely, but because they had an immediate objective in view-the safeguarding of their capital rather than securing for a short time a doubtful, though high, rate of interest. The Leader of the Opposition was good enough to suggest one or two directions in which he thought improvements might be made. First, he said that something might be done by way of a bounty to assist sales overseas.",10
5,Mr CURTIN ,I did not advocate those things.,11
6,Mr ARCHIE CAMERON ,"That is just the trouble. The honourable member did not advocate anything. He put forward a destructive argument of a weak kind, but we could see his natural common sense oozing through his contentions. This was noticeable in his references to bank deposits and economic anarchy. One had no difficulty, however, in recognizing the low tariffist. In this Parliament we witness the anomaly of the high tariff party led by one who, so far as my knowledge of him goes, is definitely a low-tariff man. That probably explains the interesting announcement in the COMberra 'Times this week that the forthcoming tariff debate will be led from the Opposition side by its Deputy Leader, the lionorable member for Capricornia ( Mr. Forde), instead of by its Leader ( Mr. Curtin).",11
7,Mr CURTIN ,"The honourable member, too, is good at suppositions.",11
8,Mr ARCHIE CAMERON ,"I am dealing with a question that the honourable gentleman must answer in this House before he is a month older. He' said something about bounties. I would not accuse him or his party, under present conditions, of being foolish enough to advocate anything. Not even the Opposition desires a motion like that now before the House to be carried, after the experience in both the State and Federal spheres of Labour in power in bad times. Does the Opposition wish to split once more the party that was re-united last week? Every honourable member opposite knows that the last thing he desires is the responsibility of office in the monwealth sphere.",11
9,Mr BAKER ,We thought that good times were back again.,12
10,Mr ARCHIE CAMERON ,"We have to admit that a decided improvement has occurred; but as the honourable member for Wakefield ( Mr Hawker), and the honourable member for Flinders ( Mr. Fairbairn) pointed out last night, the speech of the honourable member for Griffith ( Mr Baker) showed that there was serious misunderstanding on the part of the honourable member as to the actual position of the pastoral industry even in his own State. The honourable member seemed to overlook the fact that certain disabilities due to drought were still prevalent in Central and Western Queensland. These influences are also felt in parts of New South Wales, a section of Yictoria, and large portions of South Australia and Western Australia. Whilst a definite improvement in conditions has taken place, due partly to the increase of the prices of wool and wheat, no member on this side of the chamber is prepared to say that normal conditions have been restored. If he were to make such an assertion, I would not believe him. I shall now deal with the six points mentioned by the Leader of the Opposition. The first was a bounty to assist sales. If that became the policy of the Opposition, taxation would have to be maintained at its present high level, or even increased, in order to provide the money necessary for the payment of the bounty. One complaint I have heard from the Opposition is that certain commodities are sold here at a much greater price than is charged for them in foreign markets. If the Opposition persisted in that policy, it would mean an extension of the system to which they object. The next point was that there should be tariff restrictions to reduce the stream of imports; but that is in direct contradiction to one of the most important statements in another part of the speech made by the Leader of the Opposition, when he referred to economic anarchy due to tariff policy shutting out trade. A further point taken was the raising of an external loan but did the honourable gentleman seriously mean that the ComLabour party would consider the raising of loans on an external market under present conditions? If so, I think that it would find such a proposal impracticable. Next came a suggestion for the rationing of exchange, without varying the rate. The honourable member himself said that that would be unsuccessful, so I need add nothing on that point. As to the variation of the exchange rate, from my point of view, and that of those whom I represent in this chambeT perhaps more closely than some other honourable members, this would be a decided advantage. If there were an increase of the rate, it would immediately mean an increase of the prices of those exportable commodities which the producers have to sell; but coupled with that would be an increase of the internal price levels of those commodities which the working man on wages has to buy. Consequently I am a little dubious as to whether that course would be adopted by the Opposition if they had the responsibility of making the decision. The next matter raised by the Leader of the Opposition was that of general deflation, the establishment of a higher interest rate and the contraction of Australian purchasing power, which it is contended, will, in essence, have practically the same result as an increased rate of exchange. The Opposition has had quite a lot to say about the increasing flow of imports. Let us examine what is meant by the term "" trade"". I have always understood trade to mean an exchange of goods for goods if not directly, at least, indirectly. But if we are to take the statements of honourable members of the Opposition at what appears to be their face value, their idea of trade is that we should go oh exporting and exporting but never receiving anything in exchange. That sort of trade, if it can be so called, cannot continue for long. It is obvious that if we are to speed up our production and so become competitors in foreign markets, as the Leader of the Opposition mentioned yesterday, then we have to be prepared to accept goods from foreign purchasers in exchange for the goods which we send to them. That conception of trade, however, does not fall in with the tariff policy of the Australian Labour party.",12
11,Mr CURTIN ,"But the mere exchange of goods for goods would not enable us to pay our external obligations. Mr Archie CAMERON"" - Austra lia has a certain amount of external obligations to meet, but I do not think that the honourable member seriously suggests that the Cabinet would not take cognizance of the London reserve position although he made that charge. I am afraid he has not produced a bill that would stand inspection by a political Auditor-General, at any rate, because the charges he makes are not accurate.",13
12,Mr BAKER ,It is the honourable member's duty to prove that they are not accurate.,13
13,Mr ARCHIE CAMERON ,"When speaking last night the honourable member for Griffith ( Mr Baker) did not prove the accuracy of those charges. He certainly spoke about ad hoc and propter hoc, which caused me to accuse him of being all hocks; but with all due respect to what the Prime Minister said yesterday about the modesty of the honourable member, I suggest that the most distinguishing feature about him is not his "" hocks "", but his ears.",13
14,Mr CORBETT ,"Mr Speaker, I ask, is that a parliamentary expression?",13
15,Mr SPEAKER ,"Hon. Gr. J. Bell) The expression was certainly not parliamentary. Unfortunately it was occasioned by an interjection, which I overlooked, and which should not have been made. I hope that honourable members will not interject or make personal remarks.",13
16,Mr ARCHIE CAMERON ,"There is such a thing as a law of interest which, I am afraid, in the discussion of such things as trade and interest rates, there is rather a tendency to overlook. If there is a great demand for money in the community for certain products, whether primary or secondary, and the industries concerned show signs of revival, then there will be a growing demand for money from the banking institutions for investment in those particular industries. That demand, to my mind, is one of the factors which, today are causing a slight increase of the rate of interest. This morning a number of honourable members viewed a picture dealing with the great motor works at Woodville, South Australia. Two or three years ago very few men were employed in those works; today in two of those establishments there are over 7,000 men employed in the making of motor bodies. It is obvious that if there is an increased demand for motor bodies there must also be an increased demand for certain materials or goods which are not manufactured in this country, but which must be imported by the firms concorned, which in this instance, are Messrs. Holdens and Richards. The same thing applies to public utilities, such as the laying of the telephone cable to Tasmania, which was recently completed by the Commonwealth Government. For that particular work the Commonwealth Government had to import the cable. Was it wrong in doing so, although it must have reduced the balance of our London funds? A similar process goes on throughout industry generally, this factor and others affecting our London reserve. The Leader of the Opposition dealt at some length with the matter of our London balance and how it is arrived at. I suggest that no team of statisticians has yet been born that can forecast accurately what the London balance is going to be, say, in a month's time; this is mathematically impossible because of the many factors which enter into the matter. An alteration of the prices we obtain for our goods may not affect the London balance in our favour at all. For instance, if the alteration of price occurs after a commodity has been bought in Australia by an overseas merchant, it makes no difference to our London balance. That balance is, however, affected by the amount of money which goes out of this country to pay the costs of travellers who leave this country. Likewise, it is affected by the amount of money transferred to this country by visitors to Australia from overseas. Another factor to be considered is the shipping rate, mo3t of which is payable to the United Kingdom, whilst a reduction of the rate of insurance is bound to affect the balance in London. These things cannot be forecast. The prices of staple commodities, which are very largely responsible for the maintenance of this balance, cannot be forecast with any degree of accuracy even a day ahead, let alone a month ahead. Thus, this is a subject which should be left entirely to the management of those who have had some experience in dealing with it ancl can speak with authority on it . The suggestion was made last night that this chamber should be given the sole right of determining the policy of the Commonwealth Bank. I am absolutely opposed to such a proposal, and in this respect I cannot do better than refer honourable members to the report of the royal commission which inquired into the affairs of the Agricultural Bank in Western Australia. One point made by that commission was that Ministers in Western Australia so interfered with the investments and activities of that bank, that today Western Australia is faced with a debt of some millions of pounds- a loss which has to be made good by the taxpayers. I understand that the interest bill on those losses amounts to something like £640,000 a yetir. Another instance of political interference with banking policy is the notorious attempt of the Government of New South Wales to interfere in the business of the Savings Bank of New South Wales, as a result of which many of the depositors in that bank were placed in ; i very unfortunate position. Nothing iias been brought forward by the Opposition to show that the Government has failed in its duty in regard to the interest rate or the exchange rate or the offer of treasury-bills to the general the public. Honourable members on this side of the chamber, especially those who represent producers who owe considerable sums of money, would like to see the interest rate kept as low as possible.",13
17,Mr MAHONEY ,The producers cannot pay increased interest rates.,14
18,Mr ARCHIE CAMERON ,"Wit h an increased demand for money and an extension of secondary industries, there is bound to be a hardening of interest rates. The present rate of per for call money is not fixed; at any time it may either drop or rise. It would be interesting to know what the Opposition would do if it were on the treasury bench. Could it prevent the Bank of New South Wales from increasing the rate of interest on fixed deposits ?",14
19,Mr BEASLEY ,Does the honourable member think that the action of the bank was right?,14
20,Mr ARCHIE CAMERON ,"I do not know all the circumstances. No evidence has been presented to this House that the action of the Commonwealth Bank Board in making available in the open market treasury-bills to the value of £1,000,000 was responsible for the increased rate of interest payable by the Bank of New South Wales on fixed deposits. Decisions of this nature are not made hurriedly. I do not know Mr. Davidson, of the Bank of New South Wales, other than by reputation, but he would be a very impetuous gentleman to control such an institution as the Bank of New South Wales if, a few minutes after the Commonwealth Bank Board announced its decision to make treasury bills available to the public, he decided to increase the rate of interest payable by his bank on fixed deposits. The Opposition has no more knowledge of this question than has the ordinary private member on this side of the chamber. It may be that the Government has more information; but, if so, it has kept that information to itself. As I have said, decisions of this nature are not made suddenly, but are the result of mature and deliberate consideration on the part of the directorates of the banks concerned. If we knew the facts, we should probably find that the Bank of New South Wales arrived at its decision before Commonwealth Bank Board announced its intention to place treasury bills on the open market. At least Opposition members are unable to produce any evidence to the contrary.",14
21,Mr GARDEN ,It may be that there was a conspiracy to throw the blame on the Commonwealth Bank instead of on the private banH.,14
22,Mr ARCHIE CAMERON ,"I do not know anything about conspiracies, because I was not brought up in the cent, atmosphere in which they are hatched. The attitude of the Opposition reminds me of a story of the man who caused a great deal of noise, 'but gathered very little wool when he attempted to shear the pig.",14
23,Mr WARD ,"East Sydney) [3.4] Not one speaker from the Government side of the chamber has answered the serious charge made by the Leader of the Opposition ( Mr Curtin), that the functions of government have passed from this Parliament to an authority outside Parliament. Moreover, differing statements as to what actually took place to the action of the Commonwealth Bank Board in making available treasury-bills in the open market have been given by the Prime Minister ( Mr Lyons) and the Treasurer ( Mr Casey). The Prime Minister did not tell the whole of the facts to this House, probably because he was not in possession of them. If that be the situation, it is rather a peculiar position for a Prime Minister to occupy. The right honourable gentleman said that he was not aware of the action contemplated by the Commonwealth Bank Board until the day before action was taken. He went on to say that it is not the duty of the Government to tender advice to the Commonwealth Bank unless that advice is sought. Not long after the lionorable gentleman took his seat the Treasurer told us that the Government had been in close consultation with the Commonwealth Bank Board throughout. It would appear either that the Prime Minister had the information but was not prepared to give it to this House, or that he did not have it, and is, indeed, Prime Minister only in name. The fact is that, instead of this being test between the Commonwealth Bank and the private banks, the whole business has been most cunningly managed in order to make it appear that the Labour party is inconsistent in that, although was responsible for the establishment of the Commonwealth Bank, it now supports the private banks against that institution. That is not the position, because the Commonwealth Bank today is a vastly different institution from that which was established by the Labour party in 1911. To-day the Commonwealth Bank is merely a bulwark of the private banks. I am of the opinion that the Commonwealth Bank Board, the heads of the private banks and their representatives in this Parliament have all along been in close collaboration. The honourable member for Barker ( Mr. Archie Cameron) referred to Mr Davidson, of the Bank of New South Wales, as an impetuous person.",15
24,Mr ARCHIE CAMERON ,"I said that he would be an impetuous man if , immediately the Commonwealth Bank decided to put treasury-bills on the open market, he raised the rate of interest payable by prior his bank on fixed deposit.",15
