speakerGroups,Speaker,text,pageNumbers
94,Mr CURTIN ,"Fremantle) [9.2] - In the motion I submitted I did not level any charge against the Commonwealth Bank, and tliere can be no conceivable implication of a charge against thaf institution in the speech which 1 delivered. My charge is against tin Government, and the Government's answer is that whatever action the Commonwealth Bank Board has taken has been for purposes quite unrelated to tlu reasons which, I conjectured, had impelled the bank to take action. I stated that during the last 30 months the balance of payments overseas swung decidedly against Australia., and as i> result the reserves had been drawn upon not for one or two months or one year, but almost uninterruptedly throughout the 30 months. For that period our reserves had been depleted so seriously that the position for this year could not be viewed other than apprehensively. Using the only data available to rue. which was up to the end of January, or seven months of the fiscal year, I made an estimate of the possible position at the end of June of this year. The only reply which the right honourable the Prime Minister ( Mr Lyons) has been capabh of making to that estimate of our probable position, is that during the month of February and the first week of Marcl there had been an extraordinary increase of the value of exports over the average of the previous seven months, due to improved prices for wool and the increased sales of that commodity. I conceded in my speech that it was very probable that the February figures woub' show an improvement in respect o'"" exports over the average of the previou: seven months. Even after allowing for such, increases, I still contend that the overseas trade of the Commonwealth during the present year, having regard to the external obligations of Australia, involving continual strain upon our overseas payments and reserve funds has impelled the Commonwealth Bank to take action because the Government itself failed to act. I put that forward as a reasonable hypothesis. Notwithstanding the fact that five Ministers have participated in the debate in defence of the Government, only one has attempted to explain why treasury-bills amounting to £1,000,000 ' which the Commonwealth Bank now holds are to be made available to the public, not in an open bill market, but at a fixed rate, and only to those individuals in the community who are capable of subscribing for £10,000 worth. Thus this restricted and limited issue at a higher rate of interest than could be secured if the money were placed on fixed deposit, will inevitably have the consequence of hardening interest rates in Australia. Only one Minister has explained why it has been done. He stated that it has been done as an experiment in order to try out the reaction of the Australian public to the establishment of an open bill market. The Treasurer ( Mr Casey) declares that it is an experiment, but the Minister for Health ( Mr Hughes), with all his years of experience, says that the proposition is not novel. The honourable member regards it as a quite ordinary exercise of the bank's administrative power. He knows that for some time treasury-bills have been taken up by the Commonwealth Bank Board as issued by the Commonwealth Government on its own behalf and on behalf of the States. Granting that the issue to the public is an experiment, it would be interesting to know the necessity which exists for such an experimentparticularly at this juncture when the action being taken will necessarily so. increase the interest, rate in Australia. What perspicacity do the members of the bank board possess if they did not know that the effect of issuing to the public this amount of money at the rate of interest prescribed would have a hardening effect upon interest rates? I did not make the charge that interest rates commenced to harden when Mr Curtin. this issue of treasury-bills was made available to the public. I carefully pointed out that from the time our London funds continued to be drawn upon because of excessive importations of unnecessary goods which we could not afford and which could be characterized as luxuries, interest rates tended to decrease. The right honourable the Prime Minister discounted my figures for 30 months by quoting the most recent figures for February and March, and, parenthetically, I ask why it is that a Commonwealth department should refuse to supply me with figures which are made available to the Prime Minister? I applied to the Commonwealth Statistician for the most recent figures upon this subjust because, as the Prime Minister was good enough to acknowledge, it is not my practice to suppress available facts when discussing any subject in this Parliament. I submit that an explanation ought to be made by some one.",49
95,Mr CASEY ,"The figures are compiled by the Department of Trade and Customs, and then made available to the Bureau of Census and Statistics. The figures referred to by the Leader of the Opposition were available in the Customs Department, but at that time had not reached the Commonwealth Statistician.",50
96,Mr CURTIN ,"Why should the right Department of Trade and Customs undertake the responsibility of being the purveyor of statistics even to Ministers? I have not the slightest doubt that the research which it was known that I was conducting impelled the Prime Minister to discover whether by whipping up the officers in some departments it would be possible to obtain information later than that, which would be available to me.",50
97,Mr CASEY ,The statistical bureau is under my administration and I assure the Leader of the Opposition that is not,50
98,Mr CURTIN ,"I unreservedly accept the Treasurer's statement. I have every confidence in the impartiality of the Commonwealth Statistician's bureau and the sense of propriety which characterizes those who control it. I felt certain that when I asked for the latest information the bureau gave me the latest in its possession. But I was astonished to find that almost within a day or two of data having been supplied to me much later information was made available to the Prime Minister. My statement that the Loudon position can be regarded as having excited the concern of the Commonwealth Bank Board can be tested by examination of the amount of short-call funds held by the Commonwealth Bank Board in London. I wish to place on record the amounts of shortcall funds available to the Commonwealth Bank in London on certain dates-no t the total amount held by the pool because there is a pooling arrangement under which the Commonwealth Bank has first call on available funds belonging to other banks. I am quoting only the funds which the Commonwealth Bank had at short call. On June 25, 1934, the amount was £32,400,000; on September 24, 1934, £27,800,000: on December 25, 1934, £22,400,000; June 24, 1935, £15,100,000; December, 30, 1935, £12,900,000, and March 2, 1936, £12,700,000. I was accused of not having the latest figures in regard to the London position. If it is argued that this fall in the cash reserves of the Commonweal th Bank in London is not a true reflection of the position of our reserves overseas the implication must be that while the funds held by the Commonwealth Bank itself were steadily falling as a result of the continual drain in connection with the payments for imports, by some astonishing piece of commercial alchemy the funds available to the private banks must have been increasing.",50
99,Mr CASEY ,That is a fact.,51
100,Mr CURTIN ,"That is an extraordinary rejoinder in view of the significant paragraph in the latest report of the Commonwealth Bank Board just tabled in Parliament, in which the board draws attention to the imports position. Furthermore, a statement by the National Bank was published only yesterday, surveying the possible explanations as to why the treasury-bill issue has been made available to the public. Despite the oratory of five Ministers, no adequate explanation has been given to this Parliament concerning this proposal which the Treasurer says is an experiment. The honourable member for Parramatta ( Sir Frederick Stewart), who was once a member of the Cabinet, does not accept the Treasurer's explanation. According to the Melbourne Star of the l l t h March, the monthly summary of the National Bank makes the following comment:In some quarters it is lield that the Commonwealth Hank, by making a public issue of treasury-bills, has inaugurated a chain of consequences, including rising interest rates and a hardening in the money market. While those things may happen, the dominating causes lie outside the Commonwealth Bank's action. They are to be found in rapid utilization of"" bank lending resources in the last two years and the over-stimulation of imports which has resulted therefrom. I have never been in any way identified with the view of the private trading banks in Australia as against the banking and monetary policy of the party which I have the honour to lead; but when there has been need for a cold survey of the facts of our capitalistic situation, I have never ignored the views of those competent to express an opinion. The explanation that this issue of treasury-bills is an experiment conducted by the Commonwealth Bank, regardless of consequences, simply will not go down. The Commonwealth Bank Board could not disregard the consequences. I believe that it would be the last bank board which would wantonly, or even experimentally, introduce a change of policy the immediate effect of which would be to hasten the hardening of interest rates., particularly - when the hardening process had already commenced. If that is the explanation for this issue of treasury-bills, then, indeed, one can only say that, for the first time in. its long history, the Commonwealth Bank Board has, in a whimsical and freakish spirit, entered upon an experiment the immediate first consequence of which has been a disastrous reaction to interest rates in Australia. I refuse to hold the bank culpable on that ground. The Minister for Health ( Mr Hughes) entertained us to-night with a recital of the magnificent way in which the Commonwealth Bank has served this country, and how it has always been free from political control. I seek no political control over the bank in the exercise of its administrative functions; but I submit that it is the duty of this Parliament to ensure that the bank is not compelled to resort to a device, which, is the best that it can employ, to make good the deficiency occasioned by the Government's wanton disregard of its responsibilities. The right honourable gentleman says that there is nu serious position overseas; yet all the evidence available-the shrinkage of the London funds of the Commonwealth Bank, the continuous increase of imports into Australia, the swelling of customs revenue, and the utilization of that revenue by the Government to reduce direct taxation in order to satisfy the chief political interests that it represents - go to show the contrary. The Government claims responsibility for the improvement that has taken place in factory employment, and in conditions generally, and would have us believe that the situation is satisfactory; but I point out that associated with that recovery, has been a definite exercise of inflationary credit in the Australian monetary system. It is conceivable that some authorityit may be either the Government or the Commonwealth Bank-has come to the conclusion that that movement towards inflation, which commenced in 1931 in order to combat the worse effects of the depression, has continued long enough. The circular issued by the National Bank, from which I have just quoted, refers in specific terms to the "" over-stimulation of imports"". Probably it meant the unwise expenditure by many Australian people in the purchase of motor cars, thereby tending to create that unfavorable balance between the United States of America and Australia to which the honourable member for Flinders ( Mr. Fairbairn) referred this afternoon as something that ought to be corrected. It is clear to economists in Australia that certain phases of expenditure., both public and private, have reached a. stage threatening a new credit boom, and it may be that steps are being taken to put some brake upon the inflation movement and the momentum which it has generated. If that be the case, my accusation is that the Constitution imposes upon this Parliament the responsibility for determining the monetary policy of this country. Here I point out that monetary policy is a distinctly different thing from bank management, or the management of treasury-bills, or Mr Curtin. decisions as to whether or not Brown shall get credit which is refused to Jones. I deny-and I hope that the country will regard my denial as emphatic;-that the Labour party ever did, or does now, stand for political interference with banking, as between bank and client. Further, I deny that this party has ever stood for interference with the Commonwealth Bank Board in the discharge of the functions of bank management. But when it comes to the rate of interest which governments shall pay for credit, based upon their own tax-collecting capacity, and to deciding whether or not credit shall be issued hy its own national instrumentality, on conditions favourable to the people or favourable to speculators and investors, then I say, most definitely, that if the people of this country are to be sovereign, their sovereignty must express itself in the national management of the credit structure of the nation.",51
101,Sir HENRY GULLETT ,The honourable memher is making a political speech.,52
102,Mr CURTIN ,"As an illustration to the Minister, I point out that the education policy of a nation should be determined by the legislature, but the schoolmasters should be appointed by the department and the text-books prescribed by its experts. I submit, further, that political responsibility for national policy is entirely different from the administrative agencies whereby that policy is carried out. Whatever has been the attitude of the people of Australia hitherto in regard to the limits of national control of banking and the dangers of political interference, they had a rude awakening during the last fortnight when they discovered that an entire disregard of political responsibility on the part of the Commonwealth Government has exposed this country to an unnecessary increase of interest rates, prejudicing industry and imperilling the recovery of the nation from the depression. Question-That the motion be agreed to-put . The House divided. ( MR . SPEAKER-HON . G. J. BELL . ) Ayes .. .. .. 25 Noes .. .. .. 41 Majority .. .. 16 Baker, J?. M. J. Mahoney, G. W. Barnard, H . C. Makin, N . J. O. Beasley, J. A. Maloney, Dr Blackburn, M . M . Martens, G. W. Clark, J. J. Mulcahy, D. Curtin, J. Kiordan, D. Drakeford, A. S. Rosevear, J. S. Forde, F. M . Scullin, J. H . Frost, C. W. Ward, E. J. Garden, J. S. Watkins, D. 0. Holloway, E. J. Tellers: James, R. Gander, J. H . Lazzarini, H . P. Lawson, George Abbott, C. L . A. Lyons, J. A. Cameron, Archie Marr, Sir Charles Cameron, Sir Donald MCBride, T. A. M. Ciisey, R. G. MCCall, W. V. Corser, Bernard MCClelland, H . Fairbiiiru. J. V. MCEwen, J. Fisken, A. C. W. Nairn, W. M . Francis, J. Xnck, H . K . Qrepory, H . Parkbil!, Archdale Groom,' Sir Littleton Paterson, T Gullett, Sir Henry Price, J. L Harrison, K. F. Prowse. ,1. EL. Harrison, E. J. Scholfield, T. H . Hawker. C. A. S. Stacey, F. H. Holt. H . K. Stewart, Sir Frederick Hu?hes, W. M . Street. G. A. Hunter, J. A. J. Thorby. H . V. C. Hntehinoon. W. J. White. T. W. Jennings, J. T. Tellers: Lane, A. Gardner, S. L . Lawson, John Thompson, V. C. Brennan, F. Collins. T. J. Green, A. Perkins, .T. A. Question so resolved in the negative. Motion negatived. RHINELAND DEMILITARIZED ZONE. OCCUPATION BY GERMAN TROOPS.",52
