speakerGroups,Speaker,text,pageNumbers
37,Mr SPEAKER ,"Order ! The honourable member's remarks are entirely be- irrelevant. The honourable member has exhausted his time. NA for the Interior) [3.38] - The Prime Minister ( Mr Lyons), the Treasurer ( Mr Casey), the Minister for Trade and this Customs ( Mr White), and several other honourable gentlemen have so completely and effectively disposed of the charges brought against the Government by the Leader of the Opposition ( Mr CuTtin) that very little remains to be said, and, in consequence, I do not propose-no r is it necessary-to occupy the time of the House for more than a few moments. Like his predecessor, the Leader of the Opposition is a very eloquent and attractive speaker; but, despite that, in all my experience in Parliament, I have never seen a previous censure motion fall so flat as this censure motion has done. The honourable gentleman directed his criticism, or part of it, to the action of the Commonwealth Bank in making £1,000,000 of existing treasury-bills available to the public at a rate which has been current for some considerable time. When that decision was arrived at and announced in the morning press, it was quietly received. No heroics were indulged in by honourable members opposite. The announcement was received with absolute complacency and such newspaper comments as appeared at the time were entirely favourable. Everything, in short, was quiet on the western front. Then, several days later, the manager of a great private bank gave notice of the intention of that institution to raise interest rates on deposits, and it seems to me that, with an ingenuity worthy of the honourable member who has just resumed his seat, he laid the necessity for that action on the doorstep of the Commonwealth Bank and of the Commonwealth Government. Immediately this announcement appeared in the press, lionorable members opposite woke up. Here was an opportunity to be grasped; here was something that must not be missed. Thi3 was a chance to beat the Government with a cudgel conveniently placed in their hands by the representative of a great private bank. It was interesting to see how readily honourable members opposite allied themselves with the representative of private enterprise, whose methods they professed to despise, and how quickly they began to attack that bank, which, up to then; they had always regarded as their very own child. This action of the Commonwealth Bank, which had at first been received by honourable members opposite with such equanimity, such unconcern, such complacency, suddenly became a most sinister thing, full of grave portent, and liable to be followed by the most appalling consequences. Honourable members opposite are only too willing to believe in the possibility of those appalling consequences, though the nature of them they are unable to understand. In saying that, I do not. desire to cast any aspersion on the intelligence of honourable members opposite, because I do not think that this experiment of the Oomsmonwealth Bank has been long enough in operation for any one to be able to say just what its advantages or disadvantages may ultimately be. In my opinion, the importance of the step taken by the directors of the Commonwealth Bank in making this very limited amount of existing treasury-bills available to the public has been magnified out of all reason. To say that this thing is a storm in a tea-cup is an exaggeration; it is nothing more than a bubble in a thimble. The honourable member for East Sydney ( Mr Ward) referred to the general rise of interest rates, and asked why the Treasurer had not replied to the charges made in that respect. He asked what was the cause of the upward trend of interest rates. One does not need to be a treasurer skilled in matters of finance to be able to answer that question. Any intelligent person knows that interest rates must harden to some extent just so soon as confidence in industry places a sufficient demand on the money available. Let us go back a few years and follow the trend of interest rates, and try to discover the reason for their fluctuation. When the Scullin Government brought down its loan conversion scheme, the interest rate on gilt-edged securities became, nominally, 4 per cent. However, although the nominal rate was 4 per cent., the actual rate of interest earned was, for a considerable time, about 5 per cent., because there was not sufficient public confidence even in government securities to keep them at par on the open market. Then the Lyons Government came into office; public confidence in the value of government stocks improved steadily, and the price rose to par.",20
38,Mr SCULLIN ,"Does not the Minister know that the price of government bonds rose £20 in the £100 during the four months before the Lyons Government came into office? NA detract from any good work done by the right honourable gentleman, and I should be the last to take from him any credit which is due to him. The price of government bonds rose steadily and when par was reached not only was the nominal rate 4 per cent., but the actual earning power of the bonds was also only 4 per cent. Eor some time after that, public confidence was not sufficiently restored to encourage the investment of any great amount of money in ordinary industrial projects, so that for many people the one really safe avenue for investment was government securities. The price of such securities rose until nary £100 bonds were selling at as much as £107, ancl the actual earning power of the bonds was reduced to a little over 3 per cent. Eventually, however, confidence was completely restored, and now funds are being freely invested in commercial and industrial enterprises, so that the market for government securifinancial ties has weakened, and the price has fallen somewhat. The honourable member for East Sydney said that the greatest achievements of the Commonwealth Bank had taken place during the time when there was no Commonwealth Bank Board. Have honourable members forgotten the great part that the board played during the difficult times of the depression? The Leader of the Opposition ( Mr. Curtin) said that, in order to improve our financial position overseas, imports should be substantially reduced. It interesting to hear such a statement coming from a Western Australian. He said that, unless this course were taken, our finances would be thrown into order, and unemployment would increase. The Prime Minister ( Mr Lyons) showed yesterday that never before have so persons been employed in secondary industry. The number of such employees is now about 460,000. Paradoxical though it may seem, it is an indisputable fact that, when importing is brisk the volume of employment is greatest, and there is a good reason for that. For instance, when a motor chassis is brought into this country, a body has to be built for it, tyres must be provided, and other accessories made in Australian factories have to be attached. When the car is put into commission, considerable employment is provided for persons employed in garages, &c. Moreover, a considerable proportion of our imports consists of raw material, which is made up in our own factories. Of recent importations, plant and equipment have formed a considerable part and these imports provide employment not only for those who erect the equipment, but also for those who subsequently employ it in the production of goods. Labour is needed to operate it as well as to set it up. Whatever doubts may have been entertained by honourable members opposite with respect to our trade balance, the latest figures quoted ordiyesterday by the Prime Minister must have dispelled them. The right honourable gentleman pointed out that already, with little more than eight months of the financial year gone, after paying for our imports we have a balance greater by £1,600,000 than we had at the end of the twelve months in the last year, the respective figures being £17.700,000 and £16,100,000. Australian wool is realizing a substantial price today, and a good deal of the clip has yet to be sold. Wool is Australia's greatest asset. I shall not detain the House longer, because I feel that it is absolutely unnecessary for me to do so. Even if the Leader of the Opposition is not today prepared to admit it, I hope and believe that before the year closes he will have very good cause to agree that his motion was has proved to be simply an airy superstructure without any foundation.",21
39,Mr HOLLOWAY ,"Melbourne Ports) [3.51] - I preface my remarks by saying disthat when Parliament debates a big fundamental problem of this character, it is a pity honourable members many cannot refrain from indulging in personal post mortems. I deprecate the suggestion of Ministers that this is not an important question, and that there is nothing which calls for a reply. The Prime Minister ( Mr Lyons) has suggested that we on this side have lost the faith and respect that we once held for the Commonwealth Bank, and that, by reason of our attitude on this occasion, we have more or less discarded our adherence to it as an institution. That is a misconception. I have too great a knowledge of the judgment and wisdom of Ministers to believe that they misunderstand our attitude. It is not fair to say that because we are at variance with the Government on account of its failure to determine what the policy of the Commonwealth Bank Board shall be, we have lost faith in the instrumentality itself. I have the greatest respect and admiration for the Commonwealth Bank, and my admiration for it grows every year. The majority of honourable members opposite, however, because of the political views which they hold, have always been opposed to it. As a matter of fact, the great organs of public opinion in this country predicted at its establishment that it would not live for more than six months. NA ground within recent years.",22
40,Mr HOLLOWAY ,"Of course it has. It has vindicated the judgment of the Labour movement, which has always stressed the necessity for such an institution and advocated the strengthening of it. Ministers must agree that at least we have been consistent in our advocacy of greater freedom being given to the bank and the removal of it from the manacles placed upon it by the Bruce-Page Government in 1924. I can never forget the terrible misery and travail through which the world has passed during the last fifteen years as the result of the organized method adopted to bring about deflation. Three or four years ago I made the statement that fifteen years ago those who control the financial affairs of the world had purposely inaugurated the plan which brought about the period of deflation. When I first made the statement. I was almost ridiculed by the present Treasurer ( Mr Casey). I do not blame him for that. Possibly, I had the reports of the International Labour Office before he received them, and on that account felt sure of my ground. I am confident that today he, the Prime Minister, and every other honourable member opposite, will agree that I then stated what was an actual fact. What was the result? Everybody remembers the advice given by Professor Cassels, when he appealed to the controllers of finance not to take action that would bring about deflation. He pointed out that deflation would grow like a snowball, and that its momentum would become so great that they would not know how to arrest it and the world would be brought to a state of ruin and chaos, from which it would take decades to recover. Surely the lesson which we learned in Australia during the depression of the last six or seven years, with the travail, poverty, misery and unemployment then witnessed, should cause us to be dubious about agreeing to a similar suggestion! All the great financial writers of the world have continually urged upon governments and the great institutions which control finance, the wisdom not of curtailing inflation in any way, but rather of making more elastic the distribution of credit until we had at least reached the standard of values which existed in 1929. Yet, while we are still not yet around the corner, while we are still struggling to get back to something like the position of 192S-29 we have this suggested experiment. Surely the statement on the matter in the report of the Commonwealth Bank Board is an endorsement of the assertion of the Leader of the Opposition, that this will have a deflationary influence on the currency of the country! The board itself says that it is necessary to restrict the amount of loan money made available for public works. .Such a policy must mean more unemployment and a reduced spending power. Is not that identical with what was done in 1920, when orders were given to all the business institutions of the world that they must not, from that date, recapitalize any of their profits, that they must restrict rather than extend their operations, that they must cut everything to the bone for the purpose of bringing about a period of deflation which would reduce the rates of interest and all other values to those that ruled in 1914? That action was taken, notwithstanding the advice of all the greatest economists, and every one has suffered as a result. Since then, all of those who have taken a leading part in the consideration of world problems have sounded the warning that nothing should be done to checkmate the upward tendency until the 1923 values had again been reached, when whatever steps wisdoln dictated should be taken to make the position stable at that point. Although we have not nearly reached that stage, it is suggested that the release of credit for public works should be discontinued, aiid that the operations of the Commonwealth Bank should be so conducted that a period of gradual deflation would return. Yet, in the same breath, the people of Great Britain are being urged to begin a period of emigration! Imagine a government, one of the principal instruments of which is doing what nifty have a tendency to bring about deflation^ and thus cause unemployment to become greater, negotiating with other governments for the introduction of immigTauts to this country! Sitrely in siich dirciimstances it is right that We should protest against this proposal! In what I am about to say upon the purely financial aspect of economics, I speak with a good deal of temerity, because I do not consider that I am capable of analysing the very intricate financial questions involved; but I have had opportunities to study economics generally, and I know something of industrial history; I am absolutely certain that we shall never have real prosperity in Australia Until interest rates rise; As a student of economies, I welcome any increase of interest rates that is the result of a legitimate demand foi"" credit for use in industrial activities. Increases of wagesj prices, and values generally, must automatically cause interest rates to rise; Surely that is obvious to any student of economics! If wages, prices, and values generally are restored to the level of 1928-29, interest rates will revert to something approaching what they then were. I personally believe that they were too high, and that the money-lenders made excess profits. I am satisfied, however, that good government would prevent their rising to as high as they then were. Under the present economic system real prosperity can be brought about only by a constant demand by the captains of industry for more credit. A legitimate demand for money for investment in industrial activity must of necessity increase interest rates. If increased by Mr Holloway. that process, good would result. This proposal, however, is illegitimate and can only bring about deflation. No student of economics will argue that it is bad for interest rates gradually to rise. We are protesting on this occasion, because the issue of treasUry-bills will not increase credit for immediate investment in industrial operations, but will merely mean the withdrawal of deposits from other avenues for the purpose of obtaining a 'slightly higher rate of interest. That would be merely to take moiiey from one pocket and put it in another. The party of which I am a member protests against such a policy. Our real protest, however, is against the action of the Government in making itself subordinate to one of its own instruments-tli e only instrument in this Country owned by the people that can issue credit which has the backing of the nation's assets. Everybody knows that when a country wishes to borrow, those who have to determine whether it is a gilt-edged proposition examine its natural visible and invisible assets. Take Australia for examnle. They ask their advisers: "" What standard of education have the Australian people? What is theii' technical knowledge? What have they in visible and invisible assets ? "" The order in which the countries of the world are placed is: Great Britain, No. 1; United States of America, No. 2; Canada and Australia, Nos. 3 and 4. I have quoted figures dozens of times before the courts of this country to show why Australia is not in the position in which it was once said to be. I have never known those who have the lending of money internationally to place Australia lower than third or fourth among the nations of the world. We should be proud of its position and not continually malign it by adopting an inferiority complex. Australia is regarded as a good asset by every money-lender in the world. Doubt is raised regarding it only when Australians who go abroad tell the wrong story concerning the value of its assets. A very highly titled and respected lady who recently arrived in Australia from London, repeated what her father said when he was here a few years ago. That gentleman, then Sir Hugo Hirst, now Lord Hirst, said to me, "" Your own people are largely responsible for the way in which your country is regarded by people abroad."" When in Great Britain, Australians often make statements of which they should be ashamed. The credit of our nation stands high, and we should never be refused loans if the Government earnestly desired to get them, l f we used our own Uommunweanh JJaiik there would be no need to raise loans from private sources. The criticism offered by the Opposition is not directed against the Commonwealth Bank, which is an institution of which We are proud. We say, however, that the Government has no right to hand over the control of this instrument, which was created by the people of Australia, to a board such as that which now directs its policy. The board should be free to manage the bank as it sees fit, but the Government should define the policy.-Noinstitution in the land is more admirably equipped for the issuing of loans to the people, yet the Government is so unpatriotic that it borrows from the private banks. If it paid interest to the Commonwealth Bank, the money could be used in discharging some of our internal and external indebtedness. Our opinion of the Commonwealth Bank becomes higher each year, but wo contend that the charter which the Government has handed to the board is wrong. My view of this matter is supported by that of thousands of others who have spoken on the subject in various parts of the world since the beginning of the period of deflation. In 1933, shortly before he died, Mr Basil Blackett, referring to Australia's financial 'blood of our economic society. problems^ said that we should use the bank of the nation to create the credit necessary for carrying out our industrial programme. This policy would enable us to provide money needed for internal works, and would assist in meeting our overseas obligations. He said that any country which had an instrument such as the Commonwealth Bank could do that, and he added that owing to our central bank working in co-operation with the private banks instead of as a competitor with them, we had turned a good servant into a hard and inhuman master. The Opposition contends that the present Government has done that by handing over the complete control of the Commonwealth Bank to the board. I have no complaint regarding the character of the members of the board. They are estimable gentlemen, and as big-hearted as any member of this chamber; but their lifelong training in the service of private banks has made it impossible for them to act other than as they did when working for the profit of the shareholders of private banks. If they had not done that, they would no longer have been kept in their positions as directors.",23
41,Mr HUGHES ,That criticism is not applicable to the members of the Commonwealth Bank Board.,25
