speakerGroups,Speaker,text,pageNumbers
69,Mr BEASLEY ,"Our contention is that the Government knows exactly why these treasury-bills are to be issued in this way. It is taking refuge behind the in Commonwealth Bank Board because it is that tied to a free trade element within the Cabinet, and also to certain interests the associated with the Ottawa decisions, which have forced an import situation by upon Australia which is compelling the country to face a state of affairs that mean, before very long, a reversal of Government policy. Actually the situation is getting beyond the control of the Government. The action of the Commonwealth Bank Board has been taken, in our opinion, to enable the Government to avoid the necessity for having to make a volte-face upon its own policy. It is for this reason that the Commonwealth Bank Board is issuing these treasury-bills at a fixed rate of interest and distributing them to a very limited constituency. In tlic circumstances that face us it is as well to bear in mind that the national debt of Australia has increased since 1931 by £86,000,000. The debt per head of the population has advanced from £177 2s. 3d. to £1S4 14s.. This increase of £6 l is . 9d. per head of the population is very serious. How, in the face of it, can honourable gentlemen opposite talk about the return of prosperity or the restoration of confidence? Even if they laugh off such a serious state of affairs, they may be very sure that the general public will not laugh it off when made acquainted with the facts. We have grave reason to complain, too, of the accuracy of certain statistical information which was used by the Prime Minister yesterday. The right honourable gentleman told us that the unemployment figure in Now South Wales as present is only 8 per cent. If he knew the situation in New South Wales as some of us know it, he would not attempt to bolster up a bad case by such figures. In view of our knowledge of the unemployment situation in New South Wales we are forced to question the accuracy of the right honourable gentleman's figures in this regard and, if in this regard, in others also. There has, of course, been consultation between the Commonwealth Bank Board and the Government in regard to these treasury-bills. There can be no question at all about that. I believe that the Treasurer went further than he intended to go yesterday in the earlier part of his speech when he admitted that there had been close collaboration between himself and the Chairman of the Commonwealth Bank Board. The chairman of the board acted, apparently, as an intermediary between the board and the Government. The Treasurer further said that, regardwill ing matters which he considered to be of minor importance, he did not advise the Cabinet, but that the more important aspects were considered by members of the Government. I think it is safe to say that some of the Ministers know nothing whatever about this matter, and the Minister in charge of negotiations for trade treaties ( Sir Henry Gullett), who laughs loudest, probably knows least. While I am on the subject of that Minister, let me inform honourable members what that gentleman stated the other day when speaking to the members of the Coburg Men's Club in Victoria. He saidThe people sliould wipe the bogey of depression out of their minds, and realise that Australia is in an extremely prosperous position. I intend to get thousands of copies of that statement printed, and every week, when unemployed men, whose social benefits have been reduced, come to me for help, I shall hand them a copy, and tell them to laugh off their troubles. I shall remind them that, in the words of the Minister, they are "" extremely prosperous "". The Leader of the Opposition pointed out that the Government, though it realized that the financial position overseas was becoming precarious, was unable to take the necessary action to put matters right because, through its alliance with the Country party, it was debarred from limiting importations by tariff adjustments. Therefore, in collaboration with the Commonwealth Bank, it adopted the alternative course of making money dearer in an endeavour to restrict the operations of importers. It is evident that there was collusion between the Commonwealth Bank Board and the private banks over the issue of treasury-bills. It was altogether improper that the private banks should be given the opportunity to make profits out of treasury-bills, especially as they received 4 per cent, for the accommodation they provided, when similar bills were being taken up on the open market in London for l is . The Treasurer stated that the Commonwealth Bank rate of interest for deposits was \ per cent, lower than the rate offered by trading banks, and he said that there was no squeal about that. There was no squeal, because the arrangement was eminently suitable to the private banks. The Commonwealth Bank has never set out to be a serious competitor of the private banks. Any manager of a country branch of the Commonwealth Bank will say that he has been advised not to seek country business in the way of making advances to agriculturists or pastoralists, but to allow that business to be done by the private banks. Since the rate of interest for treasury-bills to be offered on the market was fixed, one private bank has raised the rate of interest on deposits, and now it is stated that all the other associated banks have fallen into line. Before long, no doubt, the Commonwealth Bank will also raise its rate. This may check the operations of importers to some extent, but it will also retard the developorable ment of our secondary industries, and will make it even more difficult for the primary producers to carry on. Very few primary producers are free of debt, and hardly any of them can extend their operations without financial accommodation from the banks. The members of this party are convinced either that the majority of the members of the Government were unaware of what was being done in connection with the treasury-bills, or that the Government has refused to reveal the real motive behind the transaction. It is evident that consultations took place between the Commonwealth Bank Board and some members of the Government, so that it is idle to pretend that the Commonwealth Bank Board has been entirely free of political influence. No doubt, if the facts are ever revealed, the public will learn that the Government was warned more than once by the Commonwealth Bank Board that the financial position overseas was unsound. Government, however, refused to meet the situation in the ordinary way, because the only effective method of doing so would be to take the same action as the Scullin Government took on a previous occasion, ancl then it would have been reminded of the things its members had said of the Scullin Government at that time. It is perhaps good to inform some honourable members opposite, who have only recently entered this House of what occurred in 192S and what led up to those occurrences. The Minister in charge Mr Beasley. of negotiations for trade treaties was a member of the Bruce-Page Government which, for years prior to 1928, had pursued a policy that finally landed Australia in the position from which the Scullin Government had to extricate it . The chairman of the Commonwealth Bank repeatedly warned the Bruce-Page Government of the unsound financial position into which the country was drifting, but no action was taken by that Goopen vernment. I am convinced that there is no truth in the statement that these treasury-bills have been offered at the present time for the purpose of testing the market. Any statement to that effect is mere hypocrisy. The Opposition is well aware of this, and that is why the present motion was moved. Even honmembers opposite, if they view the matter impartially, and decline to be influenced by the special pleading of Ministers, must realise the seriousness of the situation. They should pay some heed to what responsible authorities outside Parliament are saying. I am con vinced that if this motion is not carried by the House, it will, before very long, receive the unqualified endorsement of the public.",34
70,Mr FAIRBAIRN ,"Flinders) [5.33] I am afraid that I ca.nnot offer honourable members anything in the way of excitement and entertainment such as has been given by the honourable member for West Sydney ( Mr Beasley) in his excellent speech-excellent , that is, as an entertainment. Some matters which have been brought up during the course of this debate are deserving of further attention and dispassionate discussion. The first part of the motion of censure chides the The Government for not havinsr undertaken to dictate the policy of the Commonwealth Bank. During the last two elections the Government gave an undertaking to the people that it would not tamper with the monetary system of Australia, and on that undertaking it was re-elected. Therefore, for members on this side of the House to round on the Government because it has adhered to a policy on which it was elected is astounding. That honourable members opposite should criticize the Government is only natural, and in accordance with their expressed intention during the election campaign.",36
71,Sir FREDERICK STEWART ,I am prepared to be a party back.,37
72,Mr FAIRBAIRN ,"During the last two election campaigns honourable members opposite said frankly and unmistakeably that they stood for an alteration of the financial system, and complete control of banking by the Government. Tbat point I do not wish to discuss further, because I consider that the Government would be failing in its trust if it went back on its pledge to the electors and departed from the policy on which it was returned to power with such a substantial majority. The second point in the speech of the Leader of the Opposition ( Mr Curtin) dealt with what he described as the failure of the Government to check the alarming position in relation to the balance of trade. Since the Prime Minister ( Mr. Lyons) has given to the House figures which were not available to the Leader of the Opposition when he prepared his speech, I shall not endeavour to make capital out of the remarks of the honourable gentleman, because to do so would be to take an unfair advantage of him. There are, however, other points to which I desire to refer. First, there is the fact referred to by the Treasurer ( Mr Casey), that honourable members on both sides of the House are inclined to exaggerate the deflationary effect of the action of the Commonwealth Bank Board in making available to financial institutions other than the trading banks treasury-bills to the value of £1,000,000. The Treasurer pointed out clearly that that sum represents only one-thirtieth of the amount of money on fixed deposit for a term of three months, not to mention money on deposit for six, nine, twelve or 24 - months. That there is approximately £30,000,000 invested with the trading banks on threemonth terms, means that about £1,000,000 is deposited at fixed rates with them about every three days. It will be seen, therefore, that of itself this experimental issue of £1,000,000 of treasury-bills gives to the trading banks very little real cause for increasing their interest rate. issue of treasury-bills is only one of many ways in which the Commonwealth Bank can control interest rates. This issue means that the Commonwealth Bank will not obtain £1,000,000 from investors who otherwise might have invested their money with the trading banks on fixed deposit. The Commonwealth Bank, however, can use that £1,000,000 in ways which will counteract the effect of the increased interest rate. I want to make clear that, although a return to higher interest rates has been precipitated by this issue of treasury-bills, the major responsibility does not rest with the Commonwealth Bank Board. Every person who has taken any interest in business affairs in Australia during recent months, as either a borrower or a lender, has been aware that the law of supply and demand would result in interest rates rising soon - possibl y within four or five months, or, it may be, not for twelve months.",37
73,Mr JOHN LAWSON ,Should the Commonwealth Bank precipitate that rise?,37
74,Mr FAIRBAIRN ,The Commonwealth Bank has not started the movement towards increased interest rates.,37
75,Mr JOHN LAWSON ,But it is doing its best to help in that direction.,37
76,Mr FAIRBAIRN ,"Every one who has seen a mortgage drawn within the last few months is aware that the borrower has endeavoured to get the longest term possible and the lender the shortest term. Both borrowers and lenders know that, by the law of supply and demand, interest rates must inevitably rise soon.",37
77,Sir FREDERICK STEWART ,"Does not that argument apply also to wheat, butter and sugar?",37
78,Mr FAIRBAIRN ,"The responsible members of the Opposition have frankly admitted that for some time Australia has been heading towards higher interest rates. During this debate they have not denied that tendency; they have merely contended that this action on the part of the Commonwealth Bank Board has precipitated a rise. I suggest that the responsible party is, not the Commonwealth Bank Board, but a certain individual in charge of an institution which wishes to make capital out of the tendency towards higher interest rates. I The do not think that any one who considers this subject can honestly say that this issue of treasury-bills by the Commonwealth Bank Board could, of itself, have any appreciable effect on interest rates, especially as it was obvious that a majority of the trading banks did not intend to increase their fixed deposit immediately. To me it is most distastef ul to criticize in public any individual or institution, but I suggest, with all diffidence, that a certain individual who is at the head of a private trading bank is primarily responsible for precipitating the rise of interest rates which for some time has been threatening. It is well the members of this House, and the people of Australia, should realise that the man who has used this issue of treasury-bills as an excuse for endeavouring to gain a trading advantage over hia competitors is the individual who for some time, with no false modesty, has held himself up as the apostle of cheap money in Australia. In spite of this, and knowing that higher interest rates are bound to come as a result of the application of the law of supply and demand, he has used the action of the Commonwealth Bank as a smoke screen behind which he has endeavoured to gain a trade advantage over his rivals. As I have said, such references are most distasteful to me; but, in fairness to the Commonwealth Bank Board, whose reputation is of vital importance to the people of Australia, I cannot emphasize the facts too strongly. The work commenced by the individual referred to is being furthered in this House by those who say that an era of dearer money has been thrust upon us. Naturally, after the eloquent speeches delivered this after- lic interests. noon by honourable members on both sides of the House, investors will approach the managers of other banks and ask for the higher rate of interest which is being paid by the Bank of New South ""Wales. For fear of losing customers, the other trading banks will be forced to fall into line.",37
79,Mr JOHN LAWSON ,The y are already falling into line.,38
80,Mr FAIRBAIRN ,"It is to their credit that they were not stampeded into immediately declaring higher rates. They have delayed several days since one bank took advantage of the existing circumstances to gain a trade advantage over them. I pass on to the service rendered yesterday by tha honourable member for Griffith ( Mr. Baker) when he drew attention to the high qualifications of certain members of the Commonwealth Bank Board. I canrates not understand why he omitted to mention one other member of that board - a man who has been closely associated with organized Labour. During his speech, the honourable member paused to remark, NA appointed to the Commonwealth Bank Board because of his great knowledge of that the grazing industry, was probably the most successful grazier in Queensland. Starting more or less from scratch, Mr. Tait has become a successful grazier, who has earned the respect and confidence of, not only the graziers of Queensland, but also, I venture to suggest, more employees in the grazing industry than perhaps any other grazier in that State. Yet the honourable member criticized his appointment. I can only suggest that his judgment as to who are suitable persons to control the Commonwealth Bank is on a par with his knowledge of seasonal conditions in Australia, as exemplified when he described a cycle of droughty conditions as a series of fortuitously good seasons. It is not to be wondered at in those circumstances that he should consider that at all costs, if the Commonwealth Bank is to render good service, successful business men sliould not be placed upon the board. The honourable member said that he did not mind members of the board having business experience.",38
81,Mr BAKER ,I object to their having private interests which conflict with pubMONICA,38
