Speaker,Text,pageNumbers
NA,House of Representatives.,15
NA,"Wednesday, IkMarch, 191,5.",15
Mr SPEAKER ,Hon. J. S. Rosevear),15
NA,"took the chair at 3 p.m., and read prayers.",15
NA,DEATH OF GENERAL SIR HARRY,15
NA,"CHAUVEL, G.C.M.G. , K.C.B .",15
Mr CHIFLEY ,Macquarie - Trea-,15
NA,surer) -Th e news of the death of,15
NA,"General Sir Harry Chauvel on Sunday,",15
NA,"the 4th March, will have been received",15
NA,by all members of the Commonwealth,15
NA,Parliament with very great sorrow. Sir,15
NA,"Harry was a distinguished soldier, and",15
NA,a great Australian. I f his greatness has,15
NA,not been fully appreciated by our genera-,15
NA,"tion, posterity certainly will acclaim him",15
NA,one of our Empire's great men. Born at,15
NA,"Tabulan, in northern New South ""Wales,",15
NA,"on the 16th April, 1865, he obtained, his",15
NA,early education at Toowoomba and,15
NA,Sydney Grammar .Schools. Selecting,15
NA,"a military career, he applied himself",15
NA,throughout his active soldiering days,15
NA,to mastering the profession of arms.,15
NA,"That he was successful, ,is indicated, by",15
NA,the history of his achievements.,15
NA,"When our defence force was in embryo,",15
NA,Harry Chauvel joined the New South,15
NA,"Wales Cavalry in 1886, the Queen's Own",15
NA,"Mounted Infantry i n 1890, and the Per-",15
NA,manent Forces ia 1896. He fought,15
NA,through the South African War from,15
NA,1899 to 1902 with the Queensland,15
NA,"Mounted Infantry, and later as com-",15
NA,"mander of a composite force of English,",15
NA,"Canadian, South African and Australian",15
NA,"horsemen known as "" Chauvel's Mounted",15
NA,"Infiantry"". For those services he was",15
NA,"created a C.M.G., and was granted a",15
NA,brevet rank of Lieutenant-Colonel. I n,15
NA,"1911, he became Adjutant-General of the",15
NA,"Australian Military Forces, and was",15
NA,Australian representative on the Imperial,15
NA,General Staff at the War Office in 1914.,15
NA,On the outbreak of the first Great War he,15
NA,was given command of the First Light,15
NA,"Horse Brigade in Egypt, and took i t to",15
NA,"Gallipoli, dismounted. There, again,",15
NA,Harry Chauvel demonstrated his capacity,15
NA,for leadership. During the most bitter,15
NA,"fighting of that campaign, he commanded",15
NA,the centre section of the Anzac defences;,15
NA,[21],15
NA,the command included his own brigade,15
NA,and the 4th Australian Infantry Brigade.,15
NA,"I n September, 1915, he commanded for",15
NA,a time the New Zealand and Australian,15
NA,"Division, and later the First Australian",15
NA,"Division, which formation he took back",15
NA,to Egypt. Throughout the Sinai cam-,15
NA,"paign, Harry Chauvel led the Anzac",15
NA,"Mounted Division, to which was attached",15
NA,"the Imperial Gamel Corps, and further",15
NA,distinguished himself in the battles at,15
NA,"Romani, Magdhaba and Gasa. Follow-",15
NA,"ing these battles, he was created a",15
NA,"K.C.M.G., as an "" immediate"" decora-",15
NA,tion- a very rare distinction. His com-,15
NA,mand-th e Desert Column-wa s enlarged,15
NA,"into the Desert Mounted Corps, and in",15
NA,"August, 1917, he was promoted to the",15
NA,"rank of Lieutenant-General, being the",15
NA,first Australian soldier to reach that rank.,15
NA,From among all the cavalry generals of,15
NA,"the British Empire, . Sir Harry Chauvel",15
NA,was selected to lead the largest force of,15
NA,mounted troops the modern world had,15
NA,known. His generalship at the battles,15
NA,"which followed, which brought about the",15
NA,destruction of the Turkish armies and,15
NA,culminated in the capture of Damascus,15
NA,"and Aleppo, and the capitulation of the",15
NA,"Turks, proclaimed to the world the genius",15
NA,of the man whose passing we now mourn.,15
NA,His awards during the 1914-18 war,15
NA,"earned him the O.B., K.C.M.G., K.C.B.,",15
NA,"G.C.M.G., Oroix de Guerre (France),",15
NA,Order of the Nile-thir d and second class,15
NA,-an d Mention in Despatches nine times.,15
NA,"Following the 1914-18 war, Sir Harry",15
NA,"Chauvel became Inspector-'General, and",15
NA,"later Chief o£ the General Staff, of the",15
NA,"Australian Military Forces, and was pro-",15
NA,moted to f u l l General in 1929. During,15
NA,"this time, and indeed for some years",15
NA,"afterwards, his vision and influence did",15
NA,much to build up the nucleus of the Army,15
NA,of which we are so proud to-day. Retire-,15
NA,ment from the Army in 1930 was not the,15
NA,end of Sir Harry's life work. Right up,15
NA,"to the time of his death, he held the",15
NA,appointment of Inspector-in-Chief of the,15
NA,"Volunteer Defence Corps. I n addition,",15
NA,he had actively engaged in pursuits of,15
NA,"a philanthropic nature, with a view to",15
NA,advancing the well-being of ex-service-,15
NA,"men, and promoting worthy objects",15
NA,in various spheres of community,15
NA,life. He pursued these activities,15
NA,"until only a few months ago, when his",15
NA,"declining health, aggravated :by an injury",16
NA,"sustained while riding, prevented his con-",16
NA,tinuance of them. The late general was,16
NA,accorded a State military funeral as a,16
NA,tribute to his outstanding public service.,16
NA,I n paying the respects of the House,16
NA,"to the memory of this great Australian,",16
NA,whose deeds and service had earned the,16
NA,"gratitude of our nation, and indeed, of",16
NA,"the Empire, I am sure that every honor-",16
NA,able member joins with me in extending,16
NA,the deepest sympathy to Lady Chauvel,16
NA,and her family. I move-,16
NA,That this House expresses its deep regret,16
NA,"at the death ot General Sir Harry Chauvel,",16
NA,"G.C.M.G., K.C.B., places on record its appre-",16
NA,"ciation of his meritorious public service, and",16
NA,tenders its profound sympathy to his widow,16
NA,ii ud family in their bereavement.,16
Mr MENZIES ,Kooyong-Leade r of,16
NA,the Opposition) -M y colleagues and,16
NA,"desire to be associated with the motion,",16
NA,and with the words that have fallen,16
NA,"from the Treasurer ( Mr 'Chifley), turned",16
NA,who has summarized a military career,16
NA,that must be one of the most res-ervicemen,16
NA,"markable of the century. Indeed, i",16
NA,"has been said, and said by those comLiberal",16
NA,"petent to judge, that, in the military",16
NA,"sphere, Sir Harry Chauvel was one",16
NA,the most remarkable cavalry leaders of all organization?,16
NA,"history. I n addition, we recall i Sir Harry",16
NA,"Chauvel, the man, because, with all the",16
NA,"capacity for decision, tlie force of characand",16
NA,ter and the strength of mind that must,16
NA,"have informed his military actions, he",16
NA,was in private life a man of the greatest,16
NA,"simplicity, of the most exquisite courtesy,",16
NA,"and of direct, honest and attractive",16
NA,"character. Indeed, although they were",16
NA,"not physically similar, I could not",16
NA,him without being reminded 'by his,16
NA,"manner, and that which was inside him,",16
NA,of the late General Sir Brudenell White.,16
NA,"This country is, indeed, fortunate to",16
NA,"have produced out of the turmoil of war,",16
NA,"on two or three occasions, such amazing",16
NA,servants of the people.,16
Mr FADDEN ,Darling Downsthat,16
NA,Leader of the Australian Country party).,16
NA,- I rise to add my party's tribute to the,16
NA,sentiments already expressed. We,16
NA,called upon this afternoon to pay this,16
NA,"respect to the memory of, I supLeader",16
NA,"pose, one of the greatest soldiers question",16
NA,that Australia has ever produced. to-morrow.,16
NA,I u Queensland his name is almost a,16
NA,legend. I was privileged to know him,16
NA,"intimately, and I feel his passing keenly.",16
NA,I add my -humble quota of appreciation,16
NA,of the services which that great man has,16
NA,"rendered to this young nation, and of the",16
NA,example which he -has set to those who,16
NA,shall follow him. I join in the sentiments,16
NA,of sympathy to be conveyed to those left,16
NA,to mourn his loss.,16
NA,"Question resolved in the affirmative,",16
NA,honorable members standing in their,16
NA,places.,16
NA,LIBERAL PARTY.,16
NA,APPOINTMENT OF ORGANIZES.,16
NA,Mr 'CHAMBERS -I s the Minister,16
NA,for Post-war Reconstruction aware that,16
NA,the New South Wales branch of the new,16
NA,Liberal party has appointed Mr George,16
NA,I A. Wilson as its State organizer at a,16
NA,"salary of £2,000 .a year ? I n view of the",16
NA,fact that this gentleman is not a re-,16
NA,"soldier, will the Minister consider",16
NA,making provision in the preference-to-,16
NA,legislation that this position,16
NA,t shall be declared vacant so that the,16
NA,party will have to give preference,16
NA,to servicemen when filling any posi-,16
NA,of tions which are created in its new,16
Mr DEDMAN ,"Yes , I am aware",16
NA,"that the appointment has been made,",16
NA,had the position become vacant after,16
NA,the passing of certain legislation that is,16
NA,"to be brought jbef ore the House, i t would",16
NA,have been obligatory on the Liberal party,16
NA,to appoint an ex-serviceman. I cannot,16
NA,"say whether the legislation, i f passed,",16
NA,"can be made retrospective, but I shall",16
NA,meet give the matter consideration.,16
NA,PRICE OF MILK .,16
Mr ABBOTT ,Mor e than a fort-,16
NA,"night ago, I asked the Prime Minister,",16
NA,"on notice, to arrange for the holding of",16
NA,an independent inquiry into the cost to,16
NA,dairymen of producing milk i n the,16
NA,"Sydney and Newcastle zones, and I asked",16
NA,the price recommended by the,16
NA,authority appointed for this purpose be,16
NA,accepted by the Prices Commission as the,16
NA,are amount to be paid to dairymen. As,16
NA,"matter' is urgent, I ask the Acting",16
NA,of the House to see that the,16
NA,"shall be, i f possible, answered",16
Mr CHIFLEY , I shall arrange for,17
NA,"an answer to be given, as soon as possible.",17
NA,RAIL TRANSPORT.,17
NA,ACCOMMODATION FOR MEMBERS OF,17
NA,PARLIAMENT-RESTRICTION S ON INTER-,17
NA,STATE TRAVEL.,17
Mr BRYSON ,Whe n I was travel-,17
NA,ling from Melbourne to Canberra yester-,17
NA,day I was given a seat at Albury in,17
NA,an obsolete second-class railway carriage,17
NA,of the kind that is normally used for,17
NA,carrying passengers between intermediate,17
NA,stations. A bus capable of seating 36,17
NA,passengers was provided to carry four,17
NA,members of Parliament from Yass to,17
NA,"Canberra, and took two hours to make",17
NA,the journey of less than 40 miles. A,17
NA,private car was waiting for another,17
NA,member. I ask the Minister for Trans-,17
NA,port whether he can make immediate,17
NA,arrangements to provide a sleeping-car,17
NA,for the journey between Albury and,17
NA,"Canberra. I f not, will he arrange for",17
NA,some other suitable method of transport,17
NA,to replace the present one?,17
Mr WARD ,Mor e than one authority,17
NA,is involved in arranging transport to and,17
NA,"from Canberra. The State railways, as",17
NA,"the honorable memiber is aware, still",17
NA,remain under the direct administration,17
NA,of State authorities. The provision of,17
NA,a bus service between Yass and Canberra,17
NA,is the concern of the Minister for the,17
NA,Interior. As for the suggestion that sleep-,17
NA,ing cars be restored in order to suit the,17
NA,"convenience of members of Parliament,",17
NA,I regret that I cannot favorably con-,17
NA,sider any proposal for discriminating in,17
NA,favour of members of Parliament as,17
NA,compared with the general public.,17
NA,The question of the restoration of sleep-,17
NA,ing cars is to be considered at the next,17
NA,"meeting of the War Railway Committee,",17
NA,and it is hoped that arising out of its,17
NA,deliberations a decision to restore sleeping,17
NA,cars at an early date will be. made.,17
Mr SHEEHAN ,Ca n the Minister,17
NA,for Transport say whether the War Rail-,17
NA,way Committee at its forthcoming con-,17
NA,ference will give consideration to the,17
NA,lifting of restrictions on interstate rail,17
NA,"travel? I f not, will he arrange to have",17
NA,this matter placed on the committee's,17
NA,agenda?,17
Mr WARD ,Tha t matter is included,17
NA,"in the committee's agenda, and judging",17
NA,from the latest reports I am very hopeful,17
NA,that some of the restrictions will be lifted.,17
NA,QUESTIONS.,17
Mr HOLT ,Ha s the Acting Leader,17
NA,of the House any information to give to,17
NA,honorable members regarding press,17
NA,reports that the practice which has existed,17
NA,for many years in dealing with questions,17
NA,without notice is to be changed? Is it,17
NA,intended tbat the proposed change shall,17
NA,apply only to questions directed to the,17
NA,"Prime Minister, and, i f so, does the right",17
NA,honorable gentleman propose to nominate,17
NA,a deputy in this House to deal with,17
NA,matters concerning his own administra-,17
NA,tion when put to him by private members ?,17
NA,Can he say whether it is proposed to,17
NA,extend the new practice to Ministers,17
NA,other than the Prime Minister?,17
Mr CHIFLEY ,A s the result of,17
NA,what appears to be a growing practice of,17
NA,"asking, without notice, questions which",17
NA,are not of urgent public importance,17
Mr SPEAKER,Order ! The Chair,17
NA,at all times determines the importance,17
NA,and urgency of questions. I hope that,17
NA,the Treasurer is not reflecting on the,17
NA,Chair.,17
Mr CHIFLEY , I had no intention to,17
NA,"reflect on the Chair, Mr Speaker. I was",17
NA,merely expressing the Prime Minister's,17
NA,"opinion that some questions, without",17
NA,"notice, do not seem to him to be of urgent",17
NA,"public importance, and that the number",17
NA,of such questions is increasing.,17
Mr MENZIES , Questions without,17
NA,notice are not more numerous than they,17
NA,were ten years ago.,17
Mr SPEAKER ,Order ! I cannot,17
NA,allow a debate on the subject.,17
Mr CHIFLEY ,Whe n Mr Bruce,17
NA,was Prime Minister he referred to this,17
NA,"matter in, I think, 1929. The Prime",17
NA,Minister proposes to give direct answers,17
NA,only to questions which are addressed to,17
NA,"him by party leaders in the House, and",17
NA,then only i f he is able to answer them,17
NA,with the information at his disposal.,17
Mr HOLT ,Ar e questions by private,17
NA,members to be addressed to a deputy of,17
NA,the Prime Minister?,17
Mr CHIFLEY ,"Generall y speaking,",17
NA,the Prime Minister's intention is to,17
NA,confine his answers to questions addressed,17
NA,to him by the leaders of the parties,18
NA,the House. As to questions addressed,18
NA,"private members to other Ministers,",18
NA,is hoped that i f they are of an urgent,18
NA,"character and can be answered readily,",18
NA,Ministers will continue to reply to,18
NA,I t is proposed to ask that long questions,18
NA,which obviously the Ministers to whom,18
NA,they are addressed cannot answer such,18
NA,off hand shall be placed on the noticeof,18
NA,paper.,18
Mr MENZIES ,Th e Prime Minister is,18
NA,also Minister for Defence. Should,18
NA,-private member desire to ask a question,18
NA,"touching the Department of Defence, to",18
NA,what Minister should he direct it?,18
Mr HOLT ,Th e Prime Minister also House?,18
NA,will deputize for the Minister for the,18
NA,Army during the absence of the latter,18
NA,from Australia.,18
Mr CHIFLEY ,Tha t is a matter to may,18
NA,"which I have not given much thought, to",18
NA,and I do not know the Prime Minister's lating,18
NA,views concerning it.,18
Mr SPENDER ," I ask you, Mr.",18
NA,"Speaker, whether it is competent for any",18
NA,Minister to state as a matter of practice,18
NA,that he will not answer any. questions,18
NA,in respect of a matter of public,18
NA,portance and urgency ? Is i t not for you,18
NA,to permit any private member to put any,18
NA,question on any matter of public,18
NA,urgency to a Minister? Can there,18
NA,any preclusion of that right?,18
Mr SPEAKER ,A n honorable mem-,18
NA,ber has the choice of asking a question,18
NA,"either orally or in writing, upon notice,",18
NA,"in his own way, provided always that forthwith.",18
NA,he keeps within the 'Standing Orders;,18
NA,and it then rests with the Minister,18
NA,whom the question is asked to decide ing a question?,18
NA,"whether he will answer it orally, or re-",18
NA,quire that notice of it be given. How-,18
NA,"ever, i t is a well-established practice,",18
NA,"for which they are many precedents,",18
NA,that a Minister need not answer any,18
NA,"question, and it is totally disorderly",18
NA,an honorable member to insist that,18
NA,given an answer.,18
NA,Later:,18
Mr ABBOTT ,Standin g Order 92,18
NA,relates to the asking of questions reto,18
NA,specting public business. I n view of the answer.,18
NA,in statement of the Acting Leader of,18
NA,"by the House, will you, Mr Speaker,",18
NA,it rule as to whether or not the Prime,18
NA,"Minister, or any other Minister,. has",18
NA,any power under the Standing Orders,18
NA,them. to refuse to accept a question that,18
NA,is put to him by an honorable,18
NA,"member? I f no such power exists, and",18
NA,a refusal would constitute a breach,18
NA,the Standing Orders and of the rights,18
NA,"and privileges of honorable members, will",18
NA,"you, as the custodian and guardian of",18
NA,"those rights and privileges, submit to the",18
NA,a Prime Minister a memorandum explain-,18
NA,ing their nature? Will you also ensure,18
NA,that there shall not be a breach of the,18
NA,rules and procedure of this honorable,18
NA,"Mr SPEAKER,-Standin g Order 92",18
NA,provides-,18
NA,"After Notices have been given, Questions",18
NA,be put to Ministers of the Crown relating,18
NA,public affairs; and to other Members re-,18
NA,"to any Bill, Motion, or other public",18
NA,matter connected with the business on the,18
NA,"Notice Paper, of which such Members may",18
NA,have charge.,18
NA,I t will be noted that honorable members,18
NA,have the privilege of asking Ministers,18
NA,questions. The practice has been for a,18
NA,imMinister either to answer a question,18
NA,orally or to require its submission in writ-,18
NA,"ing, in order that a written reply may",18
NA,be made. I have already informed the,18
NA,be honorable member for Warringah that,18
NA,there is not the slightest doubt that,18
NA,although an honorable member is pri-,18
NA,"vileged to ask a Minister a question, the",18
NA,Minister is not bound to answer i t,18
Mr ABBOTT ,Bu t a Minister cannot,18
NA,of prevent an honorable member from ask-,18
Mr SPEAKER , The honorable,18
NA,member is answering his own question.,18
NA,I am pointing out to him that nothing,18
NA,which the Prime Minister or any other,18
NA,for Minister may do can prevent an honor-,18
NA,he able member from asking a question. At,18
NA,"the same time, every Minister has the",18
NA,right either to answer or to decline to,18
NA,"answer it and, should he decline, it would",18
NA,be disorderly were an honorable member,18
NA,endeavour to insist upon an immediate,18
NA,DISCHARGED SERVICE,19
NA,PERSONNEL.,19
NA,VOCATIONAL TRAINING-UNIVERSIT Y,19
NA,TRAINING ALLOWANCES.,19
Mr DEDMAN ,"Las t Wednesday, the",19
NA,honorable member for Wentworth ( Mr.,19
NA,Harrison) asked for certain information,19
NA,relating to the vocational training of dis-,19
NA,"charged service personnel, and I under-",19
NA,took to furnish it.,19
Mr SPEAKER ,Order ! Does the,19
NA,Minister desire to read an answer to a,19
NA,question?,19
Mr DEDMAN ,Yes .,19
Mr SPEAKER , I have ruled that,19
NA,leave of the House must be obtained in,19
NA,such circumstances.,19
Mr DEDMAN ,b y leave--The total,19
NA,number of ex-servicemen who have,19
NA,applied and have been accepted for full-,19
NA,"time training of all types is 1,190. Two",19
NA,methods of training are provided for in,19
NA,the scheme-,19
NA,(a) Training in technical schools until,19
NA,the trainee attains a standard of,19
NA,proficiency equal to an earning,19
NA,capacity of not less than 40 per,19
NA,"cent, of the appropriate award",19
NA,minimum wage payable in the,19
NA,calling for which he is being,19
NA,"trained, as assessed by appro-",19
NA,priate Industrial Committees,19
NA,set up under the Common-,19
NA,wealth Reconstruction Training,19
NA,"Scheme. This period will, in",19
NA,"general, vary from three to",19
NA,"twelve months, according to the",19
NA,"calling, and the initial qualificaservicemen",19
NA,"tions, aptitudes and progress of",19
NA,the trainee.,19
NA,(b) Training in industrial establish-,19
NA,ments which are approved by the,19
NA,appropriate Industrial Commit-,19
NA,"tee representative of employers,",19
NA,employees and technical educa-,19
NA,tional authorities as suitable,19
NA,establishments for basic training,19
NA,purposes until the trainee,19
NA,attains a proficiency of 4'0 per,19
NA,cent.,19
NA,To a slight extent the commencement,19
NA,of training has been delayed while,19
NA,arrangements are being made for build-,19
NA,ings to be transferred and the release,19
NA,from the services obtained of teachers,19
NA,selected for the job. The difficulties will,19
NA,continue as long as the present man-,19
NA,"power shortage exists, but every step is",19
NA,being taken to hasten the release of suit-,19
NA,able instructors.,19
NA,"I n each case, all training allowances,",19
NA,"which vary from £3 5s. to £5 5s. a week,",19
NA,and benefits such as books and tools of,19
NA,trade are paid by the Commonwealth,19
NA,"until not less than 40 per cent, pro-",19
NA,"ficiency is attained, when the trainee is",19
NA,placed in employment at full award rates,19
NA,"by the placement authority, the Man",19
NA,"Power Directorate, which works closely",19
NA,in co-operation with the Industrial Com-,19
NA,mittees. The Commonwealth reimburses,19
NA,the employer the difference between the,19
NA,award rate and the periodical assessment,19
NA,value of the trainee's efficiency. During,19
NA,this period until the trainee readies 100,19
NA,"per cent, proficiency, he is receiving",19
NA,further training on the job and gaining,19
NA,experience and speed.,19
Sir EARLE PAGE ,Ha s the Minis-,19
NA,ter for Repatriation seen a report in this,19
NA,morning's press of a statement by Mr.,19
NA,"Woodward, president of the Universities",19
NA,"Services Club, headed "" Low Pay for Ser-",19
NA,"vice Students "", in which he claims that",19
NA,many soldiers may have to abandon their,19
NA,rehabilitation training course at Aus-,19
NA,tralian universities because of the low,19
NA,living allowance paid to them by the,19
NA,Government-rangin g from £2 a week,19
NA,for a student w'ith no dependants to,19
NA,£5 5s. a week for a student with two or,19
NA,"three dependants, less deductions for any",19
NA,money earned in spare time? I f these are,19
NA,"the facts, will the Minister ensure that",19
NA,shall be treated at least as,19
NA,well as students attending universities,19
NA,under the Universities Commission's,19
NA,scheme?,19
Mr FROST , I shall have inquiries,19
NA,made?,19
NA,PARTY DESIGNATIONS .,19
Mr CONELAN ,I s the Minister for,19
NA,Information aware that the Leader of,19
NA,the Queensland Peoples party and Lord,19
NA,"Mayor of Brisbane, Alderman Chandler,",19
NA,"said last night, ""The Queensland",19
NA,Peoples party is prepared to co-operate,19
NA,"with the Liberal party, but it is not pre-",19
NA,pared to commit suicide in order that,19
NA,"the Liberal party might live "" ? I n view",19
NA,of the announcement by the Leader of,19
NA,the Opposition that the name of his party,19
NA,has been changed from the United Aus-,20
NA,"tralia party to the Liberal party, can the",20
NA,Minister inform me what is the position,20
NA,of anti-Labour members representing.,20
NA,Queensland constituencies?,20
Mr CALWELL , I am aware that,20
NA,Alderman Chandler made that statement,20
NA,"last night, and I commend him for his",20
NA,perspicacity. I n regard to the future of,20
NA,members of the Opposition who represent,20
NA,"the anti-Labour seats in Queensland, they",20
NA,seem to me to be like Mahomet's coffin,20
Mr SPEAKER , The honorable,20
NA,gentleman seems to me to be out of order.,20
Mr CALWELL ,Thinkin g I might,20
NA,"be, I paused to receive your direction.",20
NA,All I want to say about the position of,20
NA,anti-Labour members from Queensland,20
NA,is that their suspense will not last very,20
NA,"long, because they all will disappear at",20
NA,next general elections.,20
NA,HOUSING.,20
Mr CONELAN , I ask the Minister,20
NA,representing the Acting Minister for the,20
NA,"Army whether,, in view of the housing",20
NA,"shortage in Queensland, he will take",20
NA,immediately to have private homes now,20
NA,occupied by Army base officers released,20
NA,immediately in order to relieve the he -belongs?,20
NA,position ?,20
Mr DEDMAN , I shall refer the,20
NA,matter to the Acting Minister for the,20
NA,Army.,20
NA,COMMONWEALTH GRANTS,20
NA,COMMISSION.,20
Mr GUY , I ask the Treasurer,20
NA,whether he has yet received a report from,20
NA,what is known as the caucus committee wool industry.,20
NA,appointed some time ago to investigate,20
NA,a claim made by the Government of report,20
NA,"Tasmania for an additional grant, and",20
NA,to inquire into the methods adopted,20
NA,the Commonwealth Grants Commission,20
NA,in calculating the grants to be,20
NA,the claimant States? I f the report ha3,20
NA,"been received, will he lay it upon the",20
NA,table of the House? I f it has not,20
NA,"received, when does he anticipate it will",20
NA,be made available to honorable members?,20
Mr CHIFLEY ,M y knowledge of Probably,20
NA,the matter is that the Government party,20
NA,appointed a committee of its members,20
NA,look into certain complains that were,20
NA,made regarding the calculation of,20
NA,State grants. I did not know that the,20
NA,complaint referred to any one particular,20
NA,State.,20
NA,Mr 'GUY -Th e whole committee,20
NA,visited Tasmania to investigate this,20
NA,matter.,20
Mr CHIFLEY ,"Probably , that wns",20
NA,on account of the Tasmanian climate.,20
NA,My impression is that the committee is,20
NA,to report generally to the party with re-,20
