Speaker,Text,pageNumbers
NA,body. There were some who predicted a,56
NA,swift Russian collapse. I believe that,56
NA,"they were, and for that matter still are,",56
NA,disappointed that this event did not occur.,56
NA,The Red Army was forced to retreat many,56
NA,"hundreds of miles, but i t did not lose its",56
NA,"fighting efficiency. Now, of course, the",56
NA,"battle has been taken to German soil,",56
NA,Poland having heen liberated on the,56
NA,way.,56
NA,The Leader of the Opposition,56
NA,Menzies) was concerned lest,56
NA,Lublin Provisional Government-a,56
NA,vernment on the spot-should,56
NA,reflect the opinion of the,56
NA,of the Poles. By wishful,56
NA,he reasoned that perhaps the emigre,56
NA,Government in London might represent,56
NA,Polish opinion. It must be admitted,56
NA,that until a ftree election has been held,56
NA,"there is room for doubt, however slender",56
NA,it might be. Had the right honorable,56
NA,gentleman taken the trouble to study,56
NA,"the decisions of the Yalta Conference,",56
NA,he would have found that the question,56
NA,had been answered in advance. That con-,56
NA,ference laid it down that the Lublin Go-,56
NA,vernment must be so broadened by the,56
NA,inclusion of democratic elements at home,56
NA,Mr Mountjoy.,56
NA,and abroad as to make i t trul y repre-,56
NA,sentative of all shades of Polish opinion;,56
NA,"and further, that free elections must be",56
NA,held at the earliest possible moment.,56
NA,I think that I have said enough to show,56
NA,that fears as to Poland's future are,56
NA,without foundation. The Sydney Morn-,56
NA,"ing Herald of the 1st March, published a",56
NA,leading article i n which the following,56
NA,comments occurred:-,56
NA,"To those critics who, like Sir William",56
NA,"Beveridge, seem prone already to anticipate",56
NA,"having to make a choice between "" friends",56
NA,"and principles"", Mr Churchill said, in effect,",56
NA,they could not hope to enjoy both tlie luxury of,56
NA,old prejudices and the benefits of a co-operative,56
NA,international society freed from the menace of,56
NA,war. To have faith in a world peace organiza-,56
NA,tion and no faith in Russia is an incongruity,56
NA,for which there can be no accommodation in,56
NA,"the post-war world, where materially and",56
NA,psychologically every nation will have to be,56
NA,"rebuilt afresh, and rebuilt as a member of an",56
NA,international order devoted to the outlawing,56
NA,of war. The ideal may prove to be beyond,56
NA,"human roach, but at least if the world means",56
NA,to strive for it there can be no condoning of,56
NA,such suspicions as those which Mr Churchill,56
NA,condemned.,56
NA,I t is this incompatibility of aims which lm?,56
NA,disfigured the activities of the Polish Govern-,56
NA,"ment in London, and exposes the weak case of",56
NA,those who protest that the Yalta resolutions,56
NA,are a desertion of the principles of the Atlantic,56
NA,Charter and of Britain's pre-war pledge to,56
NA,Poland. Obviously the London Poles had no,56
NA,"voice in the redrawing of the map of Poland,",56
NA,or in the debates on the establishment of the,56
NA,"""Provisional Polish Government of National",56
NA,"Unity "", which the Allies have agreed shall be",56
NA,set up in place of both the London Govern-,56
NA,ment and the Lublin Committee. But on what,56
NA,ground is it maintained that there is no,56
NA,"majority Polish view in favour of the Allies',",56
NA,"arrangement; and how, save at the free elec-",56
NA,( Mr tions to be held under the new Provisional,56
NA,"the Government, is the voice of Poland to be ascer-",56
NA,go- tained? In the political administration there,56
NA,is nothing settled which the prescribed vote of,56
NA,"not the Polish people themselves cannot change,",56
NA,"majority and, if the London Poles did not participate",56
NA,"thinking, with the Lublin Committee in the preliminary",56
NA,"negotiations in Moscow, that is due solely t""",56
NA,their obstinate refusal to do so. The necessity,56
NA,for some interim administration in the,56
NA,liberated country before the end of the war,56
NA,was clearly pointed out by Mr Churchill:,56
NA,"Russia, he said, as the instrument of Poland's",56
NA,"liberation, had a right, while engaged in large-",56
NA,"scale operations against the heart of Germany,",56
NA,to have her army communications assured in,56
NA,an orderly countryside.,56
NA,As for the objection to the redrawing of,56
NA,"Poland's eastern boundary, Mr Churchill",56
NA,"justly protested that the "" Curzon line"" is not",56
NA,"a Russian imposition on Pola,nd, but an",56
NA,ethnographical border proposed by the British,56
NA,Foreign Office in 1919. In 1939 i t was made,56
NA,quite clear by tlie British Government that its,57
NA,guarantee to Poland related to the meditated,57
NA,German aggression and was never intended t °,57
NA,cover her eastern frontiers. The territorial,57
NA,"compensation now proposed for Poland,",57
NA,"especially on the Baltic, will make not only",57
NA,for a stronger State but also for one more,57
NA,easily protected by its sponsors. I t was the,57
NA,exposure of the pre-war Poland to German,57
NA,aggression which made any guarantee of her,57
NA,independence so precarious. Only Russia's,57
NA,strong arm and goodwill can preserve Polan.,57
NA,"from any future German attack, and, in that",57
NA,"responsibility, Russia is entitled to be assured",57
NA,of the best position for any such action com-,57
NA,patible with ethnographical realities. Tin:,57
NA,"critics, Polish or other, of the Allies' plan can-",57
NA,not be brought to explain why an eastern,57
NA,frontier which was adjudged just in 1919 by,57
NA,experts who certainly had no prejudices in,57
NA,"favour of Soviet Russia, should be considered",57
NA,a.ny less so to-day.,57
NA,That leading article more than answers,57
NA,the accusations of the Leader of the,57
NA,Opposition and the honorable mem-,57
NA,ber for Barker ( Mr Archie Cameron).,57
NA,He would be a bold man who,57
NA,would say that that journal is pre-,57
NA,judiced in favour of the Soviet Union.,57
NA,Not even the Leader of the Opposition,57
NA,"would make such a charge, especially in",57
NA,view of the large amount of space that,57
NA,that newspaper now gives to him for the,57
NA,purpose of spreading his anti-Australian,57
NA,theories.,57
NA,A great deal of progressive legislation,57
NA,has be«n outlined in the Governor-,57
NA,General's Speech. That fact has been,57
NA,seized upon by members of the Opposi-,57
NA,tion who now accuse the Government of,57
NA,distracting the minds of the people from,57
NA,the immediate tasks of war. The facts are.,57
NA,"of course, that the plutocrats are tired of",57
NA,"the war, and it is their propaganda that",57
NA,is disturbing the people's minds. The,57
NA,workers are not fools. I t is as patent to,57
NA,them as to anybody else that the glitter-,57
NA,"ing promise of the "" new order "" made by",57
NA,"scared reactionaries back in 1941, and",57
NA,"early in 1942, is not to be honoured. I f a",57
NA,""" new order "" is to be, i t must be fought",57
NA,for. Any one who thinks that the people,57
NA,who now hold power and wealth will re-,57
NA,treat from their position of privilege will,57
NA,be sadly mistaken. Vested interests have,57
NA,already commenced their offensive. Tens,57
NA,"of thousands of pounds, which should be",57
NA,"going into war loans, are now being",57
NA,spent on anti-working class propaganda.,57
NA,"Newspaper space, leaflets and radio time",57
NA,are being used in an attempt to create,57
NA,a feeling of distrust and doubt. The,57
NA,"working people can quite easily see that,",57
NA,if they are to be i n a position to meet,57
NA,this offensive on their wages and con-,57
NA,"ditions when the war is over, they must",57
NA,build up wages and conditions now while,57
NA,they have the chance. The amount of,57
NA,industrial unrest is directly propor-,57
NA,tionate to the volume and intensity of,57
NA,the propaganda o f the O p p o s i t i o n forces.,57
NA,T h e L a b o u r p a r t y is n o t d a u n t e d by,57
NA,"thi s flood o f propaganda, n o r are t h e",57
NA,people deceived b y i t . I have before me,57
NA,a n unsolicited letter signed b y twenty*,57
NA,"f i v e f a r m e r s i n a small c o u n t r y t o w n ,",57
NA,w h i c h is one o f m a n y such letters t h a t I,57
NA,have received. I t states-,57
NA,"Dear Sir,",57
NA,"We, tlie undersigned, desire to assure you",57
NA,and the Government that we are not being,57
NA,"influenced by press and,' Ibamk propaganda",57
NA,against the pending legislation dealing with,57
NA,"banking, and, for that matter, the taking over",57
NA,of the airways. We stand right behind the,57
NA,Government iu any course i t may be advisable,57
NA,to take.,57
NA,I t may ibe claimed that the banking system,57
NA,of Australia is the best ever; but we are of,57
NA,the opinion that many changes can be effected,57
NA,for the betterment of the people as a w' o e.,57
NA,"In reference to the wheat scheme, let i t be",57
NA,known that wo consider the Scully Quota,57
NA,Scheme was the salvation of the smaller,57
NA,growers. We trust we will not be landed,57
NA,back into the unenviable position which pre-,57
NA,vailed iprior to the scheme coming into being.,57
NA,I shall not read the names of the signa-,57
NA,"tories, as I know that many of them are",57
NA,"clients of private banks, and to read",57
NA,their nameswould leave them open to,57
NA,"victimization by those "" benevolent"" in-",57
NA,stitutions. I t will be noted that they also,57
NA,"support the Scully wheat scheme, and as",57
NA,the twisted reasoning of the honorable,57
NA,member for Indi ( Mr MCEwen) has,57
NA,once again been exposed by my friend,57
NA,"and colleague, the honorable member for",57
NA,"Forrest ( Mr Lemmon), I shall not com-",57
NA,"ment further, other than to warn the",57
NA,farmers that this campaign being waged,57
NA,"by the honorable memiber for Indi, Mr.",57
NA,"John Teasdale, and others is designed",57
NA,to smash the Australian Wheat Board,57
NA,and land the growers back into the,57
NA,"tender hands of the wheat agents, once",57
NA,more to be mercilessly exploited. The,57
NA,events of the last five years have clearly,57
NA,shown that only a Labour Government,57
NA,has the courage and capacity to lead,57
NA,the nation in these difficult times. The,57
NA,events of tie future will show that only,58
NA,a Labour Government has the courage,58
NA,and foresight to meet the difficult periods,58
NA,ahead. Just as it planned to meet the,58
NA,war situation it now plans for peace.,58
NA,"The ,pToblem of Australia's need for",58
NA,increased population seems to be a hardy,58
NA,"annual in this chamber. Undoubtedly,",58
NA,this country needs more people. That,58
NA,cannot be denied. Neither can i t be,58
NA,denied that the best way to increase the,58
NA,population is to rely on the natural,58
NA,"increase, but the solution is not so simple",58
NA,"that we merely need a ""grow more",58
NA,"babies"" campaign. I f we are to have",58
NA,"more people, either by natural increase",58
NA,"or by immigration, work must be found",58
NA,for them. I t is worsethan useless to,58
NA,increase the population and have .that,58
NA,"increased number out of work, sleeping",58
NA,"-under bridges, or filling unemployment",58
NA,-camps. We need more people to increase,58
NA,the wealth of our country and to develop,58
NA,our natural resources to a greater degree,58
NA,than at present. Numbers of people,58
NA,alone do not increase wealth. Only by,58
NA,people working can wealth be produced.,58
NA,"The farmer on his land, the worker at",58
NA,"the factory bench, the man or woman",58
NA,"performing some socially necessary task,",58
NA,are the wealth producers. The gilded,58
NA,society damsel or the wealthy loafer in,58
NA,his club chair produce no more wealth,58
NA,than the poor unfortunate sheltering,58
NA,"under a bridge, although, of course, one",58
NA,gets the lion's share of the wealth.,58
NA,"Some one else produces, and the other,",58
NA,"denied the right to work, has perfect",58
NA,freedom to starve.,58
NA,"It follows, then, that before populatremendous",58
NA,tion is increased work should be guaranland,58
NA,teed. How is this work to be found?,58
NA,I suggest that that can be done in two,58
NA,ways. In the first place we should,58
NA,expand secondary industries. In this,58
NA,field Western Australia opens up almost,58
NA,untouched resources. In that State there,58
NA,are. large deposits of almost every,58
NA,mineral known to man. The honorable,58
NA,member for Kalgoorlie ( Mr Johnson),58
NA,has told us something about those reare,58
NA,"sources, and about his personal observaEast",58
NA,"tions in that part of Australia. SeconIndia,",58
NA,dary industry could be expanded if,58
NA,employed more people than at present in,58
NA,processing our own wool and making,58
NA,own cloth. We were told to-day that,58
NA,Mr Mount joy.,58
NA,double-weft cloth is being made in Aus-,58
NA,tralia in order to capture the New Zea-,58
NA,land market. I f that work can be,58
NA,done in the eastern States it can also,58
NA,"be done in Western Australia, because",58
NA,the Albany Woollen Mills are capable,58
NA,of competing with any other mills of,58
NA,the kind in the Commonwealth. The,58
NA,second way in which I suggest work,58
NA,could be found is by expanding primary,58
NA,"production. During the present drought,",58
NA,Western Australia has once again proved,58
NA,the sheet-anchor of Australia in the,58
NA,supply of grain. That State occasionally,58
NA,"experiences dry years, but a general",58
NA,drought is unknown there. I t has never,58
NA,had a devastating drought such as that,58
NA,experienced in the eastern States. I n the,58
NA,safest rainfall area in Australia-south -,58
NA,"western Australia-18,000,00 0 acres of",58
NA,"country, after providing for forests,",58
NA,awaits development. The climate in that,58
NA,area-a s a white man's country-ha s no,58
NA,peer in all the world. Western Aus-,58
NA,tralia grows the best grapes in the Com-,58
NA,"monwealth, although that statement may",58
NA,be contested by honorable memlbers from,58
NA,South Australia. I f any honorable,58
NA,member will visit the Swan Valley with,58
NA,"me, I shall show him that, although",58
NA,Western Australia does not make a,58
NA,"great deal of wine, it produces the best.",58
NA,This has been proved many times by,58
NA,"wines from the Houghton vineyards, at",58
NA,"Middle Swan, which have defeated those",58
NA,of all-comers at the Melbourne Royal,58
NA,"Show, including Seppelts, Penfolds, and",58
NA,other well-known makers. Those safe,58
NA,rainfall areas in Western Australia have,58
NA,"potentialities; but, if closer",58
NA,"settlement is to be made a reality,",58
NA,large estates will have to be subdivided.,58
NA,"Some of these estates have been developed,",58
NA,but others are covered with virgin bush.,58
NA,Another problem which must be faced,58
NA,is to find markets in which to sell our,58
NA,"surplus products, and the more we develop",58
NA,the land the greater will be the surplus.,58
NA,"Viewing this problem as a layman, it",58
NA,seems to me that our natural markets,58
NA,"to be found, not in Europe, but in",58
NA,"Asia. The people of Java, China,",58
NA,"Burma and the Malay States, i f",58
NA,"we they had a higher standard of living,",58
NA,could use more goods than Australia could,58
NA,our ever produce. The Soviet Union could,58
NA,take a tremendous quantity of our wool.,58
NA,The people of Australia have a very real,59
NA,interest in the standard 'of living of our,59
NA,"near neighbours, and we should use what",59
NA,influence we have in world affairs to,59
NA,assist them to secure political inde-,59
NA,pendence.,59
NA,I am firmly convinced that the basic,59
NA,cause of the declining birth-rate is,59
NA,"economic, as is borne out by vital",59
NA,statistics-,59
NA,1928 .. ..,59
NA,1929 .. ..,59
NA,1930 ..,59
NA,1931 .. ..,59
NA,1932 .. .. 16.86,59
NA,1933 :. 10.78,59
NA,1934 .. ..,59
NA,Honorable members will note the,59
NA,gradual decline during the depression,59
NA,"years. I n 1934, the volume of employ-",59
NA,"ment increased a little, so that in 1936 the",59
NA,"birth-rate rose to 16.55. I n 1936, it rose",59
NA,"still further to 17.13, in 19'37 to 17.43, in",59
NA,"1938 to 17.46, and in 1939, the last year",59
NA,"for which figures are available, it was",59
NA,17.65. These figures definitely show that,59
NA,the birth-rate rises and falls according to,59
NA,the economic standard of the people. Of,59
NA,"""course, the answer given in advance to",59
NA,this contention by the right honorable,59
NA,member for North Sydney ( Mr Hughes),59
NA,i? that the more money people possess the,59
NA,fewer children they have. He points to,59
NA,the wealthy classes and says that they,59
NA,have very few children. He points to,59
NA,the working class and says that they,59
NA,have most children. That is perfectly,59
NA,"true, but he fails to point out that history",59
NA,has always shown that a dying class has,59
NA,"no faith in the future, being concerned",59
NA,only with the selfish pursuit of pleasure.,59
NA,The rich woman will not have children,59
NA,because they would interfere with her,59
NA,"social engagements. I n the main, such",59
NA,people look upon children as a nuisance.,59
NA,"The working-class woman, on the other",59
NA,"hand, likes and has children. I n her",59
NA,case the limiting factors are economic-,59
NA,"the fear of insecurity of employment, the",59
NA,thought that a son lovingly raised may,59
NA,"be killed in a future war, and the fear",59
NA,that a son or daughter will not be able to,59
NA,find a job. The inability properly to,59
NA,"feed, clothe and educate a family are",59
NA,powerful limiting factors.,59
NA,The honorable member for Parkes ( Mr.,59
NA,Haylen) is in my corner when he advo-,59
NA,cates marriage loans. I go further and,59
NA,"say, let the fear of unemployment be",59
NA,abolished; let us ensure that every child,59
NA,"born in Australia shall be properly fed,",59
NA,"clothed, housed and educated, and its",59
NA,future guaranteed. We should provide,59
NA,free kindergartens and free the working-,59
NA,class mother from kitchen drudgery by,59
NA,Birth-rate. giving her the benefit of such modern,59
NA,"21.27 appliances as washing machines, electric",59
NA,21.25 cooking and refrigeration. We should get,59
NA,ISI.86 on with our building programme now in,59
NA,18.10 order to relieve the serious housing,59
NA,shortage. We recognize that the present,59
NA,10.39 Government has inherited from previous,59
NA,"governments a housing problem, but",59
NA,much could be done immediately to relieve,59
NA,the present situation. One way would,59
NA,be to compel people to make available,59
NA,accommodation which they do not need.,59
NA,I t is only necessary to go to any of the,59
NA,fashionable seaside resorts to see houses,59
NA,which arc not being occupied. Huge,59
NA,"mansions with a great number of rooms,",59
NA,that are inhabited by only two or three,59
NA,"people, should be divided into flats. The",59
NA,owner could have one and the other flats,59
NA,"should be let. Of course, i t would still be",59
NA,necessary to build_ many houses and we,59
NA,should begin to do so immediately. The,59
NA,housing situation is desperate now-wha t,59
NA,will it be when the servicemen are,59
NA,demobilized? The position in Perth may,59
NA,not be as bad as in some of the other,59
NA,"capital cities, but it is bad enough. I",59
NA,"know one man who, with his wife and",59
NA,"thirteen children, is living in a shack",59
NA,which no decent person should be required,59
NA,"to live in, while just across the road is",59
NA,an empty military camp in which the,59
NA,buildings are being destroyed by vandals,59
NA,because there is no one to look after them.,59
NA,We should provide houses of which people,59
NA,can be proud at rents which they can,59
NA,"afford to pay, or we should sell them at",59
NA,prices which they can afford to give. I f,59
NA,we improve economic conditions as I,59
NA,"have suggested, and provide proper hous-",59
NA,"ing and amenities for the people, the",59
NA,problem of the declining birth-rate will,59
NA,solve itself.,59
NA,Debate (on motion by Mr SHEEHAN),59
NA,adjourned.,59
NA,ADJOURNMENT.,60
NA,QUESTIONS-WHEA T INDUSTRY-,60
NA,NORTHERN TERRITORY.,60
NA,Motion (by Mr CHXFLEY) proposed-,60
NA,That the House do now adjourn.,60
Mr HOLT ,Fawkner) [ 1 0 . 7 ] -,60
NA,pose to discuss a matter which I believe,60
NA,"to be of great constitutional importance,",60
NA,"namely, tlie announcement made through",60
NA,the press that the Prime Minister ( M,60
NA,Curtin) proposed to vary the customary,60
NA,method of dealing with questions asked,60
NA,without notice i n this House. The i n,60
NA,mation was that he himself would answer,60
NA,only such questions of urgency as were,60
NA,directed to h i m by party leaders.,60
NA,regret that the Prime Minister himself,60
NA,not present. I understand that he is i,60
NA,and I hope that he w i l l have a speedy,60
NA,recovery. I regard this matter as of,60
NA,"such importance that, even i n the",60
NA,"absence of the Prime Minister, ParliaGeneral's",60
NA,ment cannot allow the announcement to,60
NA,pass without comment. This is a time,60
NA,when private members of Parliament,60
NA,must assert as powerfully as they can,60
NA,"the rights whicli they possess, and the",60
NA,"rights which, through them, the citizens",60
NA,of the Commonwealth have to air their,60
NA,grievances i n Parliament. Question time,60
NA,in this House has acquired a good deal,60
NA,"of significance, particularly i n recent",60
NA,years. I recall a conversation which,60
NA,had some time ago on this subject with,60
NA,"Professor Kenneth Bailey, who has",60
NA,advised the Government on constitutional,60
NA,matters. I n i t he stressed the imporhim,60
NA,tance which question time has acquired,60
NA,in the proceedings of the National,60
NA,Parliament. When we are faced w i t h,60
NA,the possibility of so grave a departure,60
NA,from custom as that announced by the,60
NA,"Prime Minister, i t calls f o r discussion,",60
NA,and f o r a defence by private members,60
NA,of the rights which they have hitherto,60
NA,enjoyed.,60
NA,I t is misleading to attach too much,60
NA,importance to the practice i n other,60
NA,liaments. Each Parliament develops,60
NA,own practices and traditions. I n some,60
NA,of the State Parliaments of Australia,60
NA,is the practice to devote more time,60
NA,private members' business than is done,60
NA,"in this Parliament, Therefore, private",60
NA,members of this Parliament must guard,60
NA,jealously their limited opportunities,60
NA,bring before Ministers and the Govern-,60
NA,ment matters which they feel should,60
NA,be ventilated. I t has been said,60
NA,by Ministers and Government sup-,60
NA,porters that the time devoted to questions,60
NA,"without notice, as well as the number",60
NA,"I proof questions asked, has grown. That is",60
NA,"true, but the growth can easily be ex-",60
NA,plained. The increase of the number of,60
NA,questions arises f r o m the fact that the,60
NA,r . business attended to by this Parliament,60
NA,has grown and that the number of,60
NA,matters which come to the notice of,60
NA,t i - individual members has increased enor-,60
NA,"mously i n recent years, particularly dur-",60
NA,ing the war. Those of us who have had a,60
NA,I decade or more of service i n this Parlia-,60
NA,is ment w i l l remember that a comparatively,60
NA,"l l , limited range of matters came before us",60
NA,"for attention, say, ten years ago. We had",60
NA,"the budget to discuss, and various matters",60
NA,"relating to (pensions, or the Postmaster-",60
NA,Department or the Defence,60
NA,"Department came before us, but there was",60
NA,"nothing like the mass of detail, or the",60
NA,complex questions that there are to-day.,60
NA,W i t h that growth of the number of mat-,60
NA,ters dealt with by the Parliament there,60
NA,has been an increase 'of the number of,60
NA,questions properly put to Ministers. I say,60
NA,"properly put, because otherwise you, Mr .",60
NA,"Speaker, would restrain the questioner.",60
NA,Had the Prime Minister said that his,60
NA,I health was such that he could not give,60
NA,personal attention to these matters i n the,60
NA,"House, all of us would have sympathized",60
NA,with hi m and accepted the nomination by,60
NA,of some deputy to deal with matters,60
NA,"brought to his notice, but that is not the",60
NA,reason that is advanced. The justifica-,60
NA,tion f o r the proposed change is said to be,60
NA,"that the number of questions has grown,",60
NA,and that too much time is devoted to,60
NA,them. I point out that the Prime Minis-,60
NA,ter is more than the head of the Govern-,60
NA,"ment, although i n that capacity there are",60
NA,matters which should he brought to his,60
NA,"notice, and to which satisfactory replies",60
NA,Parare desired. The Prime Minister is also,60
NA,its the head of an important government,60
NA,department-th e Prime Minister's De-,60
NA,"i t partment-and , as the Leader of the",60
NA,to Opposition ( Mr Menzies) pointed out,60
NA,"earlier to-day, he is also Minister f or",60
NA,"Defence, and i n that capacity co-",60
NA,"ordinates, through the Defence Depart-",60
NA,"to ment, matters of policy which arise in",60
NA,"other service departments. To him, there-",61
NA,"fore, we must look for decisions or",61
NA,announcements on matters of defence,61
NA,"policy which affect all the services, as",61
NA,distinct from those which affect them in-,61
NA,dividually. I f the private members of,61
NA,this Parliament are to be denied oppor-,61
NA,tunities normally available to them to,61
NA,place questions before the Prime Minis-,61
NA,ter in his capacity as head of the -Govern-,61
NA,"ment, or as head of thePrime Minister's",61
NA,"Department, or as Minister for Defence,",61
