Speaker,Text,pageNumbers
NA,what attitude they would adopt towards,58
NA,the banking legislation of 1945.,58
Mr ADERMANN ,Wha t did the Sunday,58
NA,Sun say about the honorable member?,58
Mr ROSEVEAR ,Whateve r,58
NA,Sunday Sun said about me will gain f o r,58
NA,"me thousands of votes. To-night, the",58
NA,honorable member for Fawkner explained,58
NA,that his only objection to the banking,58
NA,legislation of 1945 was to the control by,58
NA,the Treasurer of the financial policy of,58
NA,the country. I f his choice as to who shall,58
NA,dominate the economic and financial,58
NA,policy of the country lies between the,58
NA,directors of the private banks and the,58
NA,"Government, I have not the slightest",58
NA,doubt what the people of Australia will,58
NA,have.,58
Mr HOLT ,Th e choice is between the,58
NA,Parliament and the Treasurer.,58
Mr ROSEVEAR , I f the choice as,58
NA,to who shall control the economic and,58
NA,financial policy of the country is between,58
NA,the Parliament and the people who are,58
NA,financially interested i n making profits,58
NA,"out of the private banks, I have not the",58
NA,slightest doubt about the one which the,58
NA,people will support.,58
Mr HOLT ,Th e choice is between the,58
NA,Parliament and the Treasurer. The,58
NA,honorable member should not make a,58
NA,mistake about that.,58
Mr ROSEVEAR ,A s I assessed the,58
NA,value of the honorable member's argu-,58
NA,"ment on the banking legislation of 1945,",58
NA,his opposition was not so much to the,58
NA,Treasurer having the final voice i n deter-,58
NA,mining banking and credit policy as i t,58
NA,was to the fact that that legislation,58
NA,abolished the Commonwealth Bank,58
NA,"Board, which was strangling the Com-",58
NA,monwealth Bank in the interests of the,58
NA,private banks.,58
The TEMPORARY CHAIRMAN ,,58
NA,Order! The honorable member's time,58
NA,has expired.,58
Mr SPENDER , I desire to make a,58
NA,persona] explanation.,58
The TEMPORARY CHAIRMAN ,,58
NA,What is the nature of the personal ex-,58
NA,planation that -the honorable member,58
NA,desires to make?,58
Mr SPENDER ,Th e honorable member,58
NA,"for Dalley ( Mr Rosevear), who at other",58
NA,time9 occupies the position of Speaker of,58
NA,"this chamber, has spent the major portion",58
NA,of the time allotted to him in alleging,58
NA,against me unethical conduct. I heard,58
NA,"him clearly, and I now want to give the",58
NA,"the facts to the committee, because this is the",58
NA,second occasion on which the honorable,58
NA,member has so accused me. The state-,58
NA,"ments ascribed to me are, I assume,",58
NA,perfectly correctly repeated. I t is,58
NA,correct that a non-suit was obtained. I t,58
NA,is equally correct that I was elsewhere,58
NA,during portion of that case. I t is,58
NA,"also correct, although the honorable",58
NA,"member for Dalley did not mention i t ,",58
NA,that the whole of the facts which he had,58
NA,taken up the time of the committee to,58
NA,mention to-night were placed with other,58
NA,facts before the highest tribunal of the,58
NA,"legal profession, on the complaint of the",58
NA,"informant, namely the Bar Council, and",58
NA,that my conduct was completely vindi-,58
NA,cated. The Speaker of this House has,58
NA,occupied ten minutes i n laying a charge,58
NA,against me when he should know better.,58
NA,"He has indulged i n personal abuse of me,",58
NA,although my conduct was completely,58
NA,vindicated by the highest tribunal in my,58
NA,profession.,58
Mr ANTHONY ,Richmond) [9.52] -,59
NA,The speech just delivered by the honor-,59
NA,able member for Dalley ( Mr Rosevear),59
NA,is of the kind that is becoming rather,59
NA,typical of his utterances. His method is,59
NA,to divert attention from the Banking Bill,59
NA,by making personal attacks upon leading,59
NA,figures of the Opposition. On the last,59
NA,previous occasion on which he resorted,59
NA,to such tactics he made a bitter personal,59
NA,attack on the Leader of the Opposition,59
NA,( Mr Menzies) in the course of which he,59
NA,said that there was in the right honor-,59
NA,"able gentleman "" a yellow streak a yard",59
NA,"wide and a foot thick "". I pay a tribute",59
NA,to the Leader of the Opposition for the,59
NA,way in which he has placed the case for,59
NA,the Opposition before the Parliament,59
NA,and the people in connexion with the,59
NA,high and important issues involved in,59
NA,this legislation. I f any man in this,59
NA,chamber has made a real sacrifice to serve,59
NA,his country i t is the Leader of the Oppo-,59
NA,sition. He has sacrificed earnings,59
NA,"amounting to probablv £10,000 a year.",59
NA,Compare his courage and ability with,59
NA,that of the man who attacked him 1,59
NA,Having spent the week-end licking the,59
NA,"wounds that he received last week, and",59
NA,brooding over the discredit he has,59
NA,"brought upon his own party, the",59
NA,honorable member for Dalley came into,59
NA,this chamber to-night and made a further,59
NA,personal attack-thi s time on the honor-,59
NA,"able member for "" Warringah ( Mr.",59
NA,"Spender), to whom he delivered a lecture",59
NA,on ethics. I f any one in this chamber,59
NA,ought to be lectured on that subject it,59
NA,is the Speaker of the House of Represen-,59
NA,tatives. Frequently honorable members,59
NA,on the Government benches say that we,59
NA,"on this side can "" give i t "" but we cannot",59
NA,""" take i t "" . To-night I propose to do",59
NA,"some ""giving"" , even i f in doing so I",59
NA,have to follow the line set by the honor-,59
NA,able member for Dalley. On the question,59
NA,"of ethics, an authority on the Constitu-",59
NA,tion and the judiciary says of Mr -before the chair.,59
NA,Speaker,59
The TEMPORARY CHAIRMAN , -,59
NA,The honorable member must refer to the,59
NA,honorable member for Dalley by the name,59
NA,"of his constituency and not as "" Mr .",59
NA,"Speaker"".",59
Mr ANTHONY , I want to deal with,59
NA,the question of ethics on the highest,59
NA,possible plane. There are the ethics of,59
NA,"the judiciary, the ethics of the Parlia-",59
NA,ment and the ethics of the courts. On the,59
NA,"subject of the ethics of the Parliament,",59
NA,Bryce says-,59
NA,The note of the Speaker of the British,59
NA,House of Commons is his impartiality. He,59
NA,"has indeed been chosen by a party, because",59
NA,a majority means in England a party. But,59
NA,on his way from his place on the benches to,59
NA,the Chair he is expected to shake off and,59
NA,leave behind all party ties and sympathies,59
NA,The Speaker can lower or raise the tone,59
NA,and efficiency of the House as a whole by the,59
NA,way he presides over i t ; but a custom as,59
NA,strong as law forbids him to render help to,59
NA,"his own side, even by private advice. What-",59
NA,ever information as to parliamentary law he,59
NA,may feel free to give must he equally at the,59
NA,disposal of every member.,59
NA,That is the example set by the Mother,59
NA,"of Parliaments, but to-night the honor-",59
NA,"able member for Dalley, who at other",59
NA,times presides over the House of Repre-,59
NA,"sentatives as "" Mr Speaker "", indulged",59
NA,in an abusive attack on another honorable,59
NA,member. Could absurdity go further?,59
NA,I t has been said that there was no sug-,59
NA,gestion in the speech of the honorable,59
NA,"member for Dalley last week, or that of",59
NA,"the Minister for Transport ( Mr Ward),",59
NA,that the Government intended to pack the,59
NA,High Court. Now that those two honor-,59
NA,able gentlemen have felt the strength of,59
NA,public opinion-the y had the week-end to,59
NA,reflect on what they had said-the y are,59
NA,trying to remedy the mischief that they,59
NA,have wrought. Let us consider some of,59
NA,the appointments made by the present,59
NA,Government to high judicial offices. I,59
NA,refer now to the recent life appointment,59
NA,of a member of the conciliation comis-,59
NA,sioners. These men will have complete,59
NA,powers over the several industries with,59
NA,which they will have to deal.,59
The TEMPORARY CHAIRMAN , -,59
NA,The appointment of conciliation commis-,59
NA,sioners has nothing to do with the clause,59
Mr ANTHONY ," I realize, Mr Tem-",59
NA,"porary Chairman, that a fairly wide",59
NA,interpretation of the matter before the,59
NA,chair would be .needed to cover my,59
NA,"remarks, but I submit that considerable",59
NA,latitude has already been allowed to the,59
NA,"honorable member .for Dalley and, there-",59
NA,"fore, I trust that I may answer him.",59
NA,"Unless I do so, it will probably be as-",59
NA,"sumed that I , as the next speaker from",59
NA,"this side of the chamber, had no answer",60
NA,to give to the honorable member. Of,60
NA,the fifteen conciliation commissioners,60
NA,"recently appointed, fourteen were either",60
NA,union secretaries or supporters of the,60
NA,Labour party. That is not packing a,60
NA,judicial body! Included among them was,60
NA,"Mr Hamilton Knight, formerly Minis-",60
NA,ter for Labour in the MCGirr Govern-,60
NA,ment in New South Wales. Also in-,60
NA,cluded among them was the private,60
NA,"secretary of the Minister for Transport,",60
NA,Mr Donovan. An impartial judicial,60
NA,authority they are supposed to consti-,60
NA,tute! I am not now going to suggest,60
NA,anything about them other than this:,60
NA,There is not a man among them who has,60
NA,not spent a great part of his life either,60
NA,giving political decisions in favour of,60
NA,Labour or in advancing political,60
NA,policies in favour of Labour. I t is sug-,60
NA,gested that because certain people believe,60
NA,that their constitutional and legal rights,60
NA,are being violated by the legislation now,60
NA,"before the Parliament, and intend to",60
NA,"appeal to the High Court against it, they",60
NA,are doing so only because they know in,60
NA,advance what the decision of the court,60
NA,will be. What other course is open to,60
NA,"any person who feels aggrieved, whether",60
NA,he be the lowest labourer in the land or,60
NA,"the highest captain of industry, or the",60
NA,"representative of a bank, other than to",60
NA,appeal to the authority appointed by the,60
NA,"Constitution, namely, the High Court,",60
NA,"and after the High Court, to the Privy",60
NA,Council ?,60
NA,I n the speeches of the honorable mem- wrong in that?,60
NA,ber for Dalley and the Minister for,60
NA,"Transport, they have clearly shown their",60
NA,hand. They first said that some of the,60
NA,"judges of the High Court were senile,",60
NA,and that the appointments of all judges,60
NA,should terminate upon their reaching a,60
NA,"specified age. Then, when the honor-",60
NA,able member for Barker ( Mr Archie,60
NA,"Cameron), on Thursday night last, moved",60
NA,that members of the Federal Court,60
NA,of Claims should be appointed with,60
NA,"a retiring age of 65 years, the",60
NA,"honorable member for Dalley, who",60
NA,"first espoused such a proposal, walked",60
NA,out of the chamber. He was not,60
NA,game to have his name recorded in,60
NA,Hansard as voting in support of the pro-,60
NA,posal which he claimed to favour.,60
NA,The Prime Minister ( Mr Chifley) ex-,60
NA,cused himself for proposing to appoint,60
NA,"the judges for life on the ground that,",60
NA,"under the Constitution, there was no",60
NA,"authority to do anything else. Well, i f",60
NA,"that be so, why have leading government",60
NA,spokesmen tried to discredit and besmirch,60
NA,"the members of the High Court, knowing",60
NA,all the time that there was no power to,60
NA,do anything about it? I f it is really de-,60
NA,sired to introduce a retiring age for,60
NA,"judges in the Commonwealth judiciary, it",60
NA,can be done by altering the Constitution,60
NA,with the consent of the people. Let the,60
NA,Government submit its proposals to the,60
NA,"highest tribunal in the land, namely, the",60
NA,people themselves. With an air of great,60
NA,"bravado, the Government proposes to sub-",60
NA,mit to the people next year certain pro-,60
NA,posals in regard to prices control. I t will,60
NA,say to the people that i t needs more,60
NA,power in order to protect their interests.,60
NA,I t will have courage enough to do that-,60
NA,"to use this word "" courage "", of which the",60
NA,honorable member for Dalley is so fond.,60
NA,The Government will have the courage,60
NA,"to go before the people in February next,",60
NA,"and ask for more power to control prices,",60
NA,but it has not the courage to invite the,60
NA,opinion of the people on this banking,60
NA,legislation.,60
NA,We on this side of the chamber have,60
NA,been criticized by the Prime Minister,60
NA,and his minions for our defence of the,60
NA,Commonwealth Bank Board. We have,60
NA,been twitted because we have said that,60
NA,if we were returned to power we would,60
NA,re-appoint the board. Is there anything,60
Mr WARD ,Yes .,60
Mr ANTHONY ,Th e Minister for,60
NA,Transport says that our proposal is,60
NA,wrong. Let me quote from a speech by,60
NA,"Mr W. C. Taylor, who, I understand,",60
NA,was federal pesident of the Australian,60
NA,Labour party.,60
Mr WARD ,"No , he was not.",60
Mr ANTHONY ,"Well , he was senior",60
NA,vice-president.,60
Mr CALWELL ,Wron g again.,60
Mr ANTHONY ,Thi s man was the,60
NA,Government's nominee on the Common-,60
NA,wealth Bank Board before i t was,60
NA,abolished. He was the Government's,60
NA,nominee on the Australian National,60
NA,"Airlines Commission, and the ' con-",60
NA,fidential adviser to the Prime Minis-,60
NA,ter. This is what he said at a,60
NA,meeting of the Henry Lawson Labour,61
NA,"College, held i n the Trades H a l l , as re-",61
NA,ported i n the Sydney Morning Herald,61
NA,of the 27th September-an d the 3peech,61
NA,was made since this legislation was intro-,61
NA,duced i n Parliament-,61
NA,Nationalization should be discussed on an,61
NA,"economic rather than a political level, said",61
NA,Mr Taylor. Labour supporters were too prone,61
NA,to discuss economic problems with a cliche:,61
NA,"that the banks caused the depression, that the",61
NA,banks kept people out of work. These state-,61
NA,ments were quite untrue. . . .,61
NA,The nationalized bank should he controlled,61
NA,by a board or commission comprising repre-,61
NA,sentatives of all interests.,61
NA,I t will be seen that he proposes to re-,61
NA,constitute the controlling authority which,61
NA,the Prime Minister and the Minister for,61
NA,"Transport, and other honorable members",61
NA,"opposite, have described as an anachro-",61
NA,nism. I have no more to say other than,61
NA,this: When the honorable member f o r,61
NA,Dalley is next tempted to lecture on t h t,61
NA,"ethics that should, guide honorable mem-",61
NA,"bers of this Parliament, I suggest that",61
NA,he himself should read more carefully,61
NA,"May's Parliamentary Practice. Then, i f",61
NA,"he still feels the need of further reading,",61
NA,let him study Quick and Garran on the,61
NA,Constitution.,61
Mr ROSEVEAR , I desire to make,61
NA,"personal explanation, because I have been",61
NA,misrepresented by the honorable member,61
NA,for Richmond ( Mr Anthony).,61
NA,mind how he criticizes what I say; but,61
NA,his statement that I walked out of the,61
NA,chamber when a vote was taken on the,61
NA,amendment of the honorable member f o r,61
NA,Barker ( Mr Archie Cameron) is untrue.,61
Mr ARCHIE CAMERON ,Th e honorable,61
NA,member did not vote.,61
Mr ROSEVEAR ,Th e statement,61
NA,that I walked out of the chamber and did,61
NA,not vote. The fact is that I was not i n,61
NA,the chamber during the discussion on the,61
NA,amendment. I have never voted i n the,61
NA,House or i n committee since I have been,61
NA,"Speaker. Furthermore, I will never",61
NA,stupid enough to vote f o r something that,61
NA,is not worth the paper i t is written upon.,61
Mr CALWELL ,Melbourne-Ministe,61
NA,for Informatio n and Minister f o r I m m i -,61
NA,gration [10.7] - Mr Temporary Chair-,61
NA,man,61
Mr ARCHIE CAMERON , I rise to,61
NA,order. I have observed that during the,61
NA,debate this afternoon the honorable mem-,61
NA,ber f o r Reid ( Mr Lang) has risen to,61
NA,"speak, but he was not called. H e is not",61
NA,"an official member of the Labour party,",61
NA,but he is more bitterly opposed to my,61
NA,opinions than are many members of that,61
NA,"party. Nevertheless, I believe that he",61
NA,should be heard i n this debate.,61
Mr HOLT , O n a point of procedure.,61
NA,I understand that some honorable mem-,61
NA,"bers on the Government side, and possibly",61
NA,"on this side also, have been called twice,",61
NA,while other honorable members who have,61
NA,tried to speak have not been called at a l l .,61
NA,I understand that the practice i n com-,61
NA,mittee is that no honorable member shall,61
NA,be given a. second call unti l all other hon-,61
NA,orable members who desire to speak,61
NA,have had an opportunity to do so.,61
The TEMPORARY CHAIRMAN ,,61
NA,"( Mr Watkins) -Afte r I took the chair,",61
NA,"the first call, was given to the",61
NA,honorable member f o r Dalley ( Mr .,61
NA,"Rosevear). He caught my eye, and",61
NA,"I called him. A fte r him, the call went to",61
NA,tlie honorable member f o r Richmond,61
NA,"( Mr Anthony). ""When he finished, the",61
NA,honorable member f o r Reid ( Mr Lang),61
NA,and the Minister f o r Informatio n ( Mr .,61
NA,Calwell) rose together. I assumed that,61
NA,a the Minister was representing the Prime,61
NA,Minister as Minister i n charge of the hill,61
NA,"at the moment, and therefore had a right",61
NA,I do not to reply to criticism.,61
Mr ARCHIE CAMERON ,Bu t he has,61
NA,already spoken.,61
Mr CALWELL , I shall not detain,61
NA,"the committee very long, but I want to",61
NA,reply to some of the criticism,61
Mr HOLT , I raised a point of pro-,61
NA,"was cedure, and referred to what I under-",61
NA,stand has been a practice of long stand-,61
NA,ing i n committee. The Minister f o r I n -,61
NA,formation is not in charge of the bill. The,61
NA,Prime Minister is i n his place i n the,61
NA,"committee. He is i n charge of the bill,",61
NA,be and any honorable member who wishes,61
NA,to speak f o r the first time on the clauses,61
NA,now before the committee is entitled to,61
NA,receive the call before any other honor-,61
NA,r able member is called a second time.,61
The TEMPORARY CHAIRMAN ,,61
NA,Order! The Chair has already given,61
NA,the call to the Minister f o r Information.,61
Mr CALWELL , T h e debate this even-,61
NA,ing has been responsible for two things.,61
NA,"First, i t brought f o r th a statement by",62
NA,Leader of the Opposition ( Mr Menzies),62
NA,that the Opposition-an d I assume the,62
NA,right honorable gentleman,62
NA,both of the parties i n Opposition-,62
NA,still stands on the statement he made i n,62
NA,connexion with the Commonwealth Bank,62
NA,B i l l of 1945; i t still wants the Common-,62
NA,wealth Bank controlled by the Common-,62
NA,wealth Bank Board. Our objection to,62
NA,that is as solid to-day as ever i t was;,62
NA,"it goes right back to 1924, when the support",62
NA,former Leader of the Australian Country,62
NA,"party, the right honorable member for",62
NA,"Cowper ( Sir Earle Page), who was then",62
NA,"the Leader of the "" rump "" party, withand",62
NA,"out a mandate f r o m the people, imposed",62
NA,upon this national Parliament the bankstands,62
NA,ing policy of the Country party.,62
NA,"are opposed to the control of the destinies clause, taken",62
NA,of the people by a Commonwealth Bank,62
NA,Board because i n effect i t means control,62
NA,of an instrumentality of the people,62
NA,representatives of the private .banks,62
NA,whose desire is to make the Commonposititious,62
NA,wealth Bank a bankers' bank. We want,62
NA,the bank to be the people's bank. On,62
NA,previous occasion I cited the instance,62
NA,one member of the Commonwealth Bank in,62
NA,"Board, Sir Clive MCPherson, who reThe right honorable",62
NA,signed a. directorship on the National,62
NA,Bank of Australasia Limited to become,62
NA,member of the Commonwealth Bank carry,62
NA,"Board, but who, when we decided that",62
NA,"we no longer wanted his services, went",62
NA,straight back from the Commonwealth,62
NA,Bank Board to his former position on,62
NA,the directorate of the National Bank of,62
NA,Australasia Limited. The Opposition,62
NA,says that i t stands for that kind of thing.,62
NA,I am indebted to the Leader of the OppoSpeaking,62
NA,sition fo r the frankness with,62
NA,has expressed his case. As'a matter of,62
NA,"fact, everybody seems to be indebted to",62
NA,somebody else to-night. The Leader of,62
NA,the Opposition expressed his indebtedness,62
NA,to me for some references I had made over the individual.,62
NA,to clause 46. The Minister for Trans-,62
NA,"port ( Mr W a r d ) , who followed",62
NA,"right honorable gentleman, expressed",62
NA,indebtedness to the Leader of the Oppoment,62
NA,sition for some legal opinions which,62
NA,had given i n the course of his remarks.,62
NA,The second statement made by the,62
NA,Leader of the Opposition was one for,62
NA,which we are also indebted to the right,62
NA,the honorable gentleman. I did not take down,62
NA,his words verbatim but as far as I recall,62
NA,"he said, speaking for the Opposition-",62
NA,includes We have not said that we do not support,62
NA,the Banking Act of 1945.,62
NA,"That is, as distinct fro m the Common-",62
NA,.m on wealth Bank Act of 1945 the right,62
NA,honorable gentleman has resorted to the,62
NA,old technique of using the double nega-,62
NA,"tive, leaving i t to be inferred that the",62
NA,Opposition i n this Parliament does now,62
NA,"the bill of 1945, but not saying so",62
NA,in. unequivocal language. I hope that be-,62
NA,fore the committee finally disposes of this,62
NA,"clause he wil l say i n positive language,",62
NA,not i n a phrase containing a double,62
NA,"negative, just where the Opposition",62
NA,i n regard to that legislation. He,62
NA,We then went on to say that i f this,62
NA,"by itself, were to",62
NA,"stand, and irrespective of whatever else",62
NA,"in the bill may be declared ultra vires,",62
NA,by it would enable the Government to do,62
NA,many things. He conjured up a sup-,62
NA,case which nobody with the,62
NA,"slightest intelligence would believe, that",62
NA,a notwithstanding a declaration of i n -,62
NA,of validity i n respect of every other clause,62
NA,the bill this clause could still stand.,62
NA,gentleman is,62
NA,setting up annt-sallys merely to knock,62
NA,a them down again. Those tactics do not,62
NA,conviction with those who analyse,62
NA,this subject. The right honorable gentle-,62
NA,man also said that this clause gives to,62
NA,the Government power to intrude into,62
NA,the most private banking affairs of every,62
NA,"citizen. Let us see what Mr MCConnan,",62
NA,one of the bankers directing the opposi-,62
NA,"tion campaign to this bill, has had to say.",62
NA,i n respect of the 1945 legisla-,62
NA,which he tion Mr MCConnan said-,62
NA,"Government control over the banking system,",62
NA,"which meaii6 control over tlie people's money,",62
NA,would permanently give the Government vjist,62
NA,powers over industry and substantial control,62
NA,Mr MCConnan said that i n respect of,62
NA,the the 1945 legislation. The Leader of the,62
NA,his Opposition now brings the same argu-,62
NA,forward as a reason why the 1947,62
NA,he legislation should not be passed. He,62
NA,affirms i n a double negative phrase that,62
NA,the Opposition now has no objection to,62
NA,the Banking Act of 1945 about which Mr .,62
NA,MCConnan so graphically and extensively,62
NA,expressed his fears. These are the same,62
NA,fears which the Leader of the Opposi-,63
NA,tion now expresses about the 1947 legisla-,63
NA,tion. Mr MCConnan continued-,63
NA,This would place in the government's hands,63
NA,a powerful control not only over industry as,63
NA,a whole but over the economic and financial,63
NA,ambitions of every individual.,63
NA,The Leader of the Opposition now,63
NA,attempts to terrorize the customers of the,63
NA,banks by using the same arguments w i th,63
NA,which Mr MCConnan failed to impress,63
NA,the people about the 1945 legislation.,63
NA,When i n 1911 the Labour party brought,63
NA,forward its first banking bill much the,63
NA,same attempt was made to blackmail the,63
NA,people into accepting the arguments,63
NA,used i n the Opposition campaign.,63
NA,When i n 1911 Mr Fisher intro-,63
NA,"duced his Commonwealth Bank B i l l ,",63
NA,a measure which i n succeeding years,63
NA,Opposition members began to hold,63
NA,up as a perfect piece of legislation which,63
NA,we should support and beyond which we,63
NA,"should not go, the Sydney Morning",63
NA,Herald i n its issue of the l 7 t h Novem-,63
NA,"ber, 1911, had this to say-",63
NA,The bank is to be pitted against all other,63
NA,"banks, with intent to displace them, and the",63
NA,better i t succeeds the sooner may private and,63
NA,State concerns be invited to put up their,63
NA,shutters. This is really little better than a,63
NA,"species of wholesale confiscation, and i t should",63
NA,be resisted to the last ditch.,63
NA,We have heard of fights to the last ditch,63
NA,prophesied by the Opposition i n con-,63
NA,nexion w i th this bill.,63
Mr WARD ,Th e second battle for,63
NA,Australia.,63
Mr CALWELL , A s I am reminded,63
NA,"by my colleague, the fight against this",63
NA,bill has been referred to as the second,63
NA,battle f or Australia. Whenever a pro-,63
NA,gressive Labour Government introduces,63
NA,progressive legislation i n connexion w i th,63
NA,banking the same extravaganza of mis-,63
NA,representation and distortion takes place.,63
NA,The dire happenings prophesied by the,63
NA,Opposition i n 1911 did not come to pass.,63
NA,The f r i g h t f u l consequences that were,63
NA,prophesied to follow the Banking A c t,63
NA,"of 1945, which we are told the Opposi-",63
NA,"tion parties now approve, did not come",63
NA,to pass. Yet the same arguments are,63
