Speaker,Text,pageNumbers
NA,I have not the slightest doubt that the,32
NA,owners of such shares will support that,32
NA,"view. First, the present market value is",32
NA,not the true Value of the shares in private,32
NA,"banks, because, since the war years, a sum",32
NA,"of £267,000,000, the property of the",32
NA,"private banks, has been held in special",32
NA,accounts by the Commonwealth Bank for,32
NA,"which 10s. per cent, is paid and the",32
NA,"Government, through the Common-",32
NA,"wealth Bank, has had the use of",32
NA,that money. Because the ^private,32
NA,Constibanks have been deprived of the,32
NA,use of those funds they have not been,32
NA,able to make a greater rate of profit than,32
NA,"10s. per cent., whereas the Common-",32
NA,wealth Bank has made profits through the,32
NA,use of those funds. I f the private banks,32
NA,had had the use of those funds their,32
NA,"profits would be very much greater, and,",32
NA,"therefore,' the inducement to the public",32
NA,to purchase bank ' shares would he,32
NA,greater. Thus the value of the shares,32
NA,would be considerably increased. The,32
NA,action of the Government in forcing the,32
NA,private banks to place those funds in,32
NA,special accounts with the Commonwealth,32
NA,Bank has reduced the value of their,32
NA,shares. I sincerely trust that the share-,32
NA,holders of the private banks will realize,32
NA,"that fact, and will seek adjustment on",32
NA,that basis by appealing to any court,32
NA,which may be instituted to adjudicate on,32
NA,disputes which may arise. I have no,32
NA,doubt that an equitable adjustment of,32
NA,the value of shares in that respect would,32
NA,return to the investors concerned a,32
NA,greater benefit than they are likely to ob-,32
NA,tain in the form of any taxation conces-,32
NA,sion which the Government proposes to,32
NA,give to those who agree to acquisition.,32
NA,"Secondly, we know that the Govern-",32
NA,"ment, as it is still doing, took from the",32
NA,private banks d uring the war thG total,32
NA,of their gold reserves and placed them,32
NA,with the Commonwealth Bank. That,32
NA,"action, also has tended to depreciate the",32
NA,value of shares in private banks. I n addi-,32
NA,"tion, the Commonwealth Bank, since it",32
NA,"has become more active in its operations,",32
NA,has been prone to skim off the cream of,32
NA,investments and to leave the second-class,32
NA,risks to the private banks. Institution --,32
NA,whose applications for advances from,33
NA,the Commonwealth Bank have been re-,33
NA,jected include public utility bodies. I n,33
NA,r.liis respect I have in mind various,33
NA,regional bodies which have been set up,33
NA,"in Queensland. For example, the Wide",33
NA,"Bay Regional Electricity Board, which",33
NA,was recently set up by the State govern-,33
NA,"ment, applied to the Commonwealth",33
NA,"Rank for an advance of £35,000 to en-",33
NA,able it to inaugurate its operations. The,33
NA,Commonwealth Bank rejected that appli-,33
NA,"cation, but within two hours of the board",33
NA,applying to a private bank for an ad-,33
NA,vance the latter advanced the full sum,33
NA,"of £35,000.",33
Mr DALY ,Whe n was that?,33
Mr BERNARD CORSER ,Tha t,33
NA,happened within the last few weeks. The,33
NA,"manager of a local government body,",33
NA,the Wide Bay Regional Electricity,33
NA,"Board, Mr Cotton, applied to the",33
NA,Commonwealth Bank for an advance of,33
NA,"£35,000. I have not had any communi-",33
NA,cation with him or any member of the,33
NA,"board on this matter, but I have care-",33
NA,fully checked the facts. The Queensland,33
NA,National Bank accepted the hoard's,33
NA,application and made possible the,33
NA,payment of any part of an ad-,33
NA,"vance of £35,000 within two hours",33
NA,of the application being made. The,33
NA,Commonwealth Bank rejected,33
NA,"board's application, although the board",33
NA,was set up by the State Govern-,33
NA,ment and had the blessing of that Go-,33
NA,vernment. That is typical of the way in,33
NA,which the Commonwealth Bank has been,33
NA,skimming the cream off the investment,33
NA,market and leaving to private banks,33
NA,those investments which it rejects. This,33
NA,"development, which has been going on",33
NA,"for some years, has also tended to reduce",33
NA,"the profits of the trading banks, because",33
NA,"such investments are regarded, more or",33
NA,"less, as second-class risks in the eyes of",33
NA,"the Commonwealth Bank. I n future, the",33
NA,"private banks, whose eyes the Govern-",33
NA,"ment is now attempting to burn out, will",33
NA,not be in operation to offset this tendency,33
NA,on the part of the monopoly bank. I n,33
NA,"view of the facts which I have cited, and",33
NA,which have tended to depreciate the,33
NA,"value' of shares in private banks, I urge",33
NA,"shareholders in those institutions, should,",33
NA,"unfortunately, the High Court declare",33
NA,"this legislation to be valid, to seek",33
NA,adjustment of the value of their shares,33
NA,on those grounds by approaching any tri-,33
NA,bunal that may be set up for the purpose.,33
Mr CHIFLEY ,Macquarie - Prime,33
NA,Minister and Treasurer) [5.19] -Th e,33
NA,honorable member for Warringah ( Mr.,33
NA,Spender) raised a question which is,33
NA,largely a legal interpretation of clause,33
NA,37. The legal explanation is that the,33
NA,clause merely provides for the keeping of,33
NA,a register in which will be recorded the,33
NA,names of shareholders on the day on,33
NA,which the shares in private banks are,33
NA,compulsorily acquired by the Common-,33
NA,wealth Bank under clause 13. Any sub-,33
NA,"sequent assignment, or devolution of the",33
NA,right to be .paid compensation will also,33
NA,be entered in that register. I n prac-,33
NA,"tice, a bank's share register will become",33
NA,the register of rights for the payment of,33
NA,"compensation, and in it will be recorded",33
NA,all assignments and the right to be paid,33
NA,compensation. That is the simple legal,33
NA,explanation of clause 37.,33
NA,The honorable member for Warringah,33
NA,made the point that shares held in Aus-,33
NA,"tralia in a private bank, which are not",33
NA,compulsorily acquired on the date set out,33
NA,"in the notice, might belong to English",33
NA,"shareholders, and that the value of the",33
NA,"shares might fall before they are, in due",33
NA,"course, vested in the Commonwealth",33
NA,the Bank.,33
Mr SPENDER ,The y might also rise.,33
Mr CHIFLEY ,Th e honorable,33
NA,gentleman may rest assured that the posi-,33
NA,tion of any of these shareholders will not,33
NA,be prejudiced in any way by the fact that,33
NA,the shares are acquired by the Common-,33
NA,wealth Bank at a date later than was the,33
NA,case in respect of Australian share-,33
NA,holders.,33
Mr SPENDER ,N o provision is made,33
NA,for that in the bill.,33
Mr CHIFLEY ,Th e point that the,33
NA,honorable member for Warringah has,33
NA,taken may have some substance. I t is,33
NA,not possible to cover in legislation every,33
NA,"detail that might arise. I f , on the other",33
NA,"hand, the shares are not acquired but the",33
NA,assets of private banks concerned are,33
NA,"acquired, the interests of the British",33
NA,shareholders will be identical with those,33
NA,of the Commonwealth Bank itself. I t is,33
NA,beyond reason to suggest that the Com-,33
NA,monwealth Bank would take action which,33
NA,would have the effect of depreciating the,34
NA,value of the assets.,34
NA,The Leader of the Australian Country,34
NA,pnrty ( Mr Fadden) was most disturbed,34
NA,about the capacity of the Commonwealth,34
NA,"Bank, which is the central bank of Aus-",34
NA,"tralia, to take over, as a business trans-",34
NA,"action, the assets of the private hanks. I n",34
NA,"my second-reading speech, I said that",34
NA,that transaction could be done from the,34
NA,resources of the Commonwealth Bank.,34
NA,Sonic people endeavour to raise a bogy,34
NA,"that, for this transaction we must produce",34
NA,"bank notes to the value of £100,000,000,",34
NA,which will be paid to the shareholders of,34
NA,the private banks.,34
Mr ANTHONY ,Ban k notes?,34
Mr CHIFLEY,On e honorable mem-,34
NA,ber spoke of the inflation of the note,34
NA,issue.,34
Mr FADDEN ,Th e honorable member,34
NA,for Hindniarsh ( Mr Thompson) spoke,34
NA,of it.,34
Mr CHIFLEY ,"First , 1 point out",34
NA,"that, a considerable percentage would have",34
NA,"to be paid, to British shareholders.",34
Mr ANTHONY ,Wha t percentage?,34
Mr CHIFLEY , I do not know holds,34
NA,whether we have worked out all the deare,34
NA,"tails, but it was a substantial percentage",34
NA,of the shareholders. We shall,34
NA,by in akin g a payment in Australian bank,34
NA,"notes. That is clear. Does any honorresources ""?",34
NA,able mem her imagine that the share-,34
NA,holders of the private banks desire to be,34
NA,paid bank notes to the value of,34
NA,"£'1.00,0§9,000?",34
Mr FADDEN ,W e did not suggest that.,34
NA,Will the right honorable gentleman ex-,34
NA,plain how the shareholders will be paid?,34
Mr CHIFLEY ,Th e honorable,34
NA,ber for Richmond ( Mr Anthony) has,34
NA,endeavoured to suggest that the Govern-,34
NA,ment's proposals will cause inflation.,34
NA,implied that the Commonwealth Bank,34
NA,will pay to the shareholders of the,34
NA,"banks £100,000.000 in bank notes, and and dictates its policy.",34
NA,that the country will befloodedwith,34
NA,notes.,34
Mr ANTHONY ,Eve n if the sharenot,34
NA,"holders are paid by cheque, the result will",34
NA,still be inflation.,34
Mr CHIFLEY ,Tha t is the honorCommonwealth,34
NA,able member's implication. During the,34
NA,"last twelve months, in Australia,",34
NA,made by banks have increased by,34
NA,"£100,000,000. Does the honorable mem-",34
NA,ber suggest that that was inflation?,34
Mr FADDEN ,No t i f that amount were,34
NA,met by production. That is the greatest,34
NA,safeguard. What is the Government,34
NA,doing to increase production?,34
Mr MENZIES , The Government' -,34
NA,banking proposals will not increase pro-,34
NA,duction.,34
Mr CHIFLEY ,Withou t any protest*,34
NA,"from honorable members opposite, tin-",34
NA,amount of increased advances made by,34
NA,banks during the last twelve months wa -,34
NA,"£100,000,000.",34
Mr ANTHONY ,Wa s not the figure,34
NA,"£79,000,000? The Commonwealth Bank",34
NA,"stated in"" its report that the peak has",34
NA,been reached.,34
Mr CHIFLEY ,Thos e increased,34
NA,advances have been made during the last,34
NA,twelve months. One does not know what,34
NA,"the shareholders of the private banks, in-",34
NA,"cluding the British shareholders, mighi",34
NA,"want. At all events, I do not imagine",34
NA,that they will want to be paid with bank,34
NA,notes. The Commonwealth Bank itself,34
NA,"a certain amount of securities, whicli",34
NA,its own property and assets. I t has,34
NA,"other resources. First, i t is the central",34
NA,"not, begin - bank of Australia.",34
Mr FADDEN ,"Wha t are those "" other",34
Mr CHIFLEY , I could ask the,34
NA,"right, honorable gentleman the same",34
NA,question about the resources of the private,34
NA,banks.,34
Mr FADDEN , I am not under an obli-,34
NA,gation to tell the right honorable gentle-,34
NA,"man, but he is under an obligation to tell",34
NA,memme. That is the difference.,34
Mr CHIFLEY ,Som e honorable,34
NA,He members always complain that the,34
NA,Government interferes with the con-,34
NA,"private duct of the Commonwealth Bank,",34
NA,We have,34
NA,£1 an assurance from the Common-,34
NA,wealth Bank that the assets which i t is,34
NA,taking over are tangible assets. They are,34
NA,something which might disappear,34
NA,"overnight. These are tangible assets, and",34
NA,"from them, within its own resources, the",34
NA,Bank is able to handle,34
NA,this business as a financial deal. That is,34
NA,advances the plain fact of the matter.,34
Mr FADDEN ,Th e taking over of fixed,35
NA,assets does not give the liquid resources,35
NA,with which to liquidate the liability.,35
Mr CHIFLEY ,Ther e is nothing in,35
NA,that contention. Reference has been made,35
NA,to the special deposit account held by the,35
NA,"Commonwealth Bank. I n this account,",35
NA,the surplus funds of the private bank3,35
NA,are retained. The right honorable gentle-,35
NA,"man himself agreed to that principle,",35
NA,although he did not believe in its.being,35
NA,made law. He believed in a voluntary,35
NA,arrangement with the private banks.,35
Mr FADDEN ,W e should have made,35
NA,that provision law i f the private banks,35
NA,had not agreed to the arrangement.,35
Mr CHIFLEY , I incorporated that,35
NA,provision in the act for the right honor-,35
NA,able gentleman. A large amount of this,35
NA,money in the special account has come,35
NA,from current accounts on which the pri-,35
NA,vate banks do not pay interest. Any sug-,35
NA,"gestion that the Commonwealth Bank,",35
NA,"to-morrow, will not be able to return to",35
NA,the private banks any of the money which,35
NA,"has been lodged with it, and meet any of",35
NA,"the commitments which it might have, not",35
NA,"only to its own depositors, but also to the",35
NA,"depositors of the private banks, is wrong.",35
NA,The truth is that the banking legislation,35
NA,of 1945 created a precedent in the finan-,35
NA,cial history of the British Empire. I t,35
NA,gave to the people of Australia a guaran-,35
NA,tee that all depositors would receive their,35
NA,"money on demand, even i f those deposits",35
NA,were held in a private bank which had,35
NA,"gone into liquidation. I n effect, the",35
NA,Labour Government was the first govern-,35
NA,ment of any country which gave to,35
NA,depositors a guarantee that their,35
NA,interests would be protected. I t is,35
NA,true that we did not give a guarantee,35
NA,"to shareholders. However, for any one",35
NA,"to suggest, as the honorable member for",35
NA,"Richmond did, that the depositors in",35
NA,banks were likely to feel that they would,35
NA,not receive full value for their money or,35
NA,that they might be paid in depreciated,35
NA,"currency, was quite absurd. Subject",35
NA,"to the legislation being valid, about",35
NA,"which there may be some doubt, the",35
NA,Government has endeavoured to give to,35
NA,those people who have deposited money,35
NA,with private banking institutions what,35
NA,is in effect a guarantee that they will,35
NA,not lose their money.,35
Mr ANTHONY ,I f the currency is,35
NA,inflated their assets must depreciate.,35
Mr CHIFLEY ,Th e honorable mem-,35
NA,ber for Richmond should not talk non-,35
NA,sense about the depreciation of the,35
NA,Australian currency. I f I may make,35
NA,"passing reference to this matter, I point",35
NA,out to him that the Australian £1 has,35
NA,"40 per cent, more purchasing power in-",35
NA,ternally than British sterling and 60 per,35
NA,"cent, more purchasing power internally",35
NA,than the American dollar. On the basis,35
NA,"of sound financial practice, the Ausr",35
NA,tralian £1 is one of the few currencies,35
NA,"in the world which, from a mathematical",35
NA,"point of view, could be appreciated. That",35
NA,is a fact which causes the honorable,35
NA,member for New England ( Mr Abbott),35
NA,to shiver in his shoes whenever he thinks,35
NA,about it. The honorable member knows,35
NA,that under the law of supply and de-,35
NA,mand the Australian £1 has greater value,35
NA,than almost any other currency in the,35
NA,world. He knows what would happen i f,35
NA,that law were put into operation.,35
Mr ABBOTT , I do not know what will,35
NA,happen when the Government has finished,35
NA,with its banking proposals.,35
Mr CHIFLEY ,Th e honorable mem-,35
NA,ber has been saying things about me for,35
NA,six years. Suggestions have been made,35
NA,"that something the Government has done,",35
NA,"or is likely to do, will render the Aus-",35
NA,tralian currency less valuable. There is,35
NA,no justification for that fear. The Aus-,35
NA,tralian currency could be appreciated.,35
NA,What I have said applies to the private,35
NA,trading banks as well as to the Common-,35
NA,wealth Bank.,35
Mr ANTHONY ,Ho w much is the dol-,35
NA,lar worth now?,35
Mr CHIFLEY ,Ther e is no need for,35
NA,the honorable member to tell me that,35
NA,when the Americans came here they knew,35
NA,what the value of the dollar was in Aus-,35
NA,tralia compared with its value in their,35
NA,own country.,35
Mr ANTHONY ,Wha t is the Aus-,35
NA,tralian £1 worth in the United States,35
NA,of America?,35
Mr CHIFLEY ,O n a sterling basis,35
NA,"it would be worth a lot, but any attempt",35
NA,to establish wch a basis would meet with,35
NA,violent opposition from members of the,35
NA,"Australian Country party. Indeed, they",35
NA,would set up such a howl that the roof,36
NA,this building would be in danger of being,36
NA,lifted.,36
Mr FADDEN ,Doe s the Government,36
NA,intend to do that?,36
Mr CHIFLEY , I am something of,36
NA,a realist. I f the Government had taken,36
NA,the stand frequently taken by bankers,36
NA,"the years gone by, those are the things",36
NA,that it would have done. The only,36
NA,plaint that I have heard about the Comsame,36
NA,monwealth Bank while 1 have been,36
NA,Treasurer has been that its ex gratia,36
NA,payments to local governing bodies have this clause.,36
NA,not given satisfaction. The bank,36
NA,denies that that complaint is justified.,36
Mr FADDEN ,Peopl e know that it,36
NA,no use complaining to the right honorable,36
NA,gentleman.,36
Mr CHIFLEY ,I t has been said,36
NA,that the profits made by the Commonchoose,36
NA,wealth Bank go into the sinking fund.,36
NA,The money paid into that fund must,36
NA,come out of revenue. Reference has,36
NA,been made to the saving of stamp duty.,36
NA,The people get the benefit of that.,36
NA,of the greatest ramps that this country,36
NA,has ever known is the internal exchange opposite.,36
NA,on cheques charged by banks. Both the,36
NA,honorable member for New England and,36
NA,I have been interested in that subject,36
NA,for several years. I merely mention,36
NA,these subjects in passing.,36
Mr MENZIES ,"""Wh y not make a passing",36
NA,ing reference to the bill?,36
Mr CHIFLEY , I thought that I had,36
NA,done so. I was replying to some of the,36
NA,statements made by the honorable memment,36
NA,"ber for Wide Bay ( Mr Corser), who",36
NA,covered a wide field in his remarks. of the private banks.,36
NA,"However, as that honorable member is",36
NA,"member of the Australian Country party,",36
NA,I realize that the Leader of the OpposiParliament,36
NA,"tion ( Mr Menzies) cannot be responpowers,",36
NA,"sible for what any member of that "" spare",36
NA,"part"" may say.",36
NA,"I rose chiefly to say, first,",36
NA,"Commonwealth Bank, from its own Commonwealth",36
NA,"assets, is in a position to pay off the pri-",36
NA,vate banks and in return acquire tangible,36
NA,assets. My second object was to make i,36
NA,completely clear that shareholders of what,36
NA,"banks, whether in England, or Australia,",36
NA,will get justice. They may enter into,36
NA,"voluntary agreement, or they may",36
NA,to the Federal Court of Claims. I t is,36
NA,of all very well for honorable members,36
NA,opposite to sneer about the courts. That,36
NA,is one of the things about which com-,36
NA,plaints have been made recently. I could,36
NA,give the committee some of the history,36
NA,"of appointments to courts in Australia,",36
NA,but I have never been one to cast reflec-,36
NA,tions on judges. Whatever their back-,36
NA,"in ground has been, I have not doubted the",36
NA,honesty of judges when sitting on the,36
NA,combench. I have not always held the,36
NA,high opinion of their ability. No,36
NA,proposal of the Government will pre-,36
NA,judice the rights of any one affected by,36
NA,The shareholders of,36
NA,itself the banks may choose to accept,36
NA,Government bonds. That may necessi-,36
NA,is tate some adjustment of the rate of,36
NA,interest. Or they may accept pay-,36
NA,ment by cheque. I believe that 99,36
NA,"per cent, of the people affected will",36
NA,one of those two methods. A,36
NA,third method is open to them; they may,36
NA,"ask for payment in notes, but I do not",36
NA,also think that many of them will seek a,36
NA,settlement in that way. I hope that I,36
NA,One have removed any doubts which existed,36
NA,in the minds of honorable members,36
Mr ARCHIE CAMERON ,Barker),36
NA,[5.40] -Th e Prime Minister ( Mr.,36
NA,Chifley) made two points: The first was,36
NA,that the Commonwealth Bank would take,36
NA,over the shares in the private banks pay-,36
NA,for them out of its own assets. The,36
NA,second was that the shareholders would,36
NA,get justice provided they did not go to,36
NA,the court and ask for it. The Govern-,36
NA,is relying upon the Constitution,36
NA,for authority to acquire the assets,36
NA,The Con-,36
NA,a stitution gives this Parliament cer-,36
NA,"tain powers, hut it does not give the",36
NA,authority to delegate those,36
NA,nor does it authorize any,36
NA,"authority, governmental, semi-govern-",36
NA,"mental or private, to usurp the powers",36
NA,that the conferred by the Constitution,36
NA,Constitution. The,36
NA,Act,36
NA,authorizes the Government to acquire,36
NA,any property from any State or person,36
NA,t on just terms; but I do not believe that,36
NA,the Government is now proposing,36
NA,to do represents a proper exercise of its,36
NA,a powers of acquisition. As for what the,36
NA,go Government proposes to do by way of,36
NA,"compensating shareholders, I say that the",36
NA,Australian Government has,37
NA,"authority, either legally or morally, to",37
NA,tell the Commonwealth Bank or anybody,37
NA,else to pay for property acquired by the,37
NA,Commonwealth. I f the Commonwealth,37
NA,"acquires property on just terms, it, stands",37
NA,"to reason that it, must pay for the",37
NA,property out of assets belonging to the,37
NA,Commonwealth itself. There must be an,37
NA,exchange of something of value owned by,37
NA,the Commonwealth for something of,37
NA,"vnlue which it, is taking away from the",37
NA,"citizen. I n the present instance, accord-",37
NA,"ing to the statement, of the Prime Minis-",37
NA,"ter, it is proposed to pay the shareholders",37
NA,"t>f the private hunks out, of assets which",37
NA,the Commonwealth Bank already,37
NA,possesses. The Prime Minister does not,37
NA,claim that these assets are the property,37
NA,of the Commonwealth Bank. As a,37
NA,"matter of fact, we know that the total",37
NA,capital of the Commonwealth Bank is,37
NA,"only just a little over £16,000,000, and",37
NA,yet it is proposed that the Commonwealth,37
NA,"Bank shall acquire £100,000,000 worth",37
NA,"of other people's assets. I n other words,",37
NA,without an appropriation by the Parlia-,37
NA,"ment, without the imposition of taxes,",37
NA,"without raising loans, and, thank God,",37
NA,without any'suggestion of inflation by in-,37
NA,"creasing the note issue, the Government",37
NA,"proposes to get hold of £100,000,000",37
NA,worth of other people's goods.,37
NA,"The late Sir Henry Morgan, a",37
NA,famous seaman who operated on the,37
NA,Spanish Main before he became respect-,37
NA,able and was appointed Governor of,37
NA,"Jamaica, would have been very envious",37
NA,nf the Australian Government be-,37
NA,"cause, during the whole period of his",37
NA,"depredations, ho never took from the",37
NA,Spaniards oue fraction of what this Go-,37
NA,vernment is getting out of the share-,37
NA,holders of the private banks. There has,37
NA,been talk of the soundness of the cur-,37
NA,"rency, and of maintaining the purchasing",37
NA,power of the £1. I do not know,37
NA,"whether any one mentioned ""Fisher's",37
NA,"rlimsies"". If not. I will do so now.",37
NA,"When the Fisher Government took over,",37
NA,honorable members who preceded me as,37
NA,the representatives of political parties,37
NA,"now on this side of the House, called",37
NA,the notes issued by the Commonwealth,37
NA,""" Fisher's flimsies"". A better title",37
NA,was never invented. At the time those,37
NA,"notes were first issued, they bore a",37
NA,Mr Archie Cameron.,37
NA,no printed declaration that they could be ex-,37
NA,changed at the Commonwealth Treasury,37
NA,"for one golden, sovereign. Not very long",37
NA,"afterwards, a sovereign was worth 25s.",37
NA,That was the beginning of a process by,37
NA,which the Australian £1 note has,37
NA,approximated more and more in value to,37
NA,that of a. piece of very ordinary ipaper.,37
NA,This process has continued until to-day,37
NA,the Australian sovereign-an d some of us,37
NA,"still keep one or two as souvenirs, not-",37
NA,withstanding the regulations-i s worth,37
NA,£2 12s. 6d. in Australian notes. I ask,37
NA,"members of tbe Government, and their",37
NA,loquacious supporters who are trying to,37
NA,talk themselvesout of the bog in which,37
NA,"they are stuck, whether they want the",37
NA,Australian £1 note to become even more,37
NA,flimsy than it is. I address myself par-,37
NA,ticularly to the honorable member for,37
NA,"Eden-Monaro ( Mr Fraser), who seemed",37
NA,to doubt that honorable members would,37
NA,"take up the challenge about "" Fisher's",37
NA,"flimsies "". There must be something in",37
NA,"historical association, after all. I recall",37
NA,"that Simon Fraser, who was Lord Lovat,",37
NA,"sent his son to Culloden, while he himself",37
NA,was maintaining close contact with the,37
NA,British Government. The honorable,37
NA,member for Eden-Monaro would also like,37
NA,to have it both ways. He would like to,37
NA,argue in favour of the soundness of the,37
NA,"currency, whilst supporting a proposal",37
NA,"to acquire £100,000,000 worth of assets",37
NA,merely by making an entry in the books,37
NA,of the Commonwealth Bank. An honor-,37
NA,able member of his attainments is fully,37
NA,entitled to entertain such ambitions i f,37
NA,"he wants to, but whether they will he",37
NA,satisfied is another matter. So much for,37
NA,""" Fisher'sflimsies"".",37
