speakerGroups,Speaker,text,pageNumbers
76,The CHAIRMAN ,Order! The honourable member's time has expired.,24
77,Mr TURNBULL ,"Mallee) [5.13] - Let 1 us see just bow much the increased taxation will affect farm workers. A man with a taxable income of £600 a year paid under the old rate £24 18s. Under the new rate he will pay £27 8s., an increase of £2 10s. Is it suggested that such an increase will take away the incentive to earn? Let us remember that the 1 increase represents only 10' per cent, on the assessed tax. Members of the Labour party have been trying to confuse the minds of the people. It would be amusing if it were not serious to hear the' honourable member for Perth ( Mr Toiw Burke) setting himself up as the champion of the primary producers, and to hear his colleague, the honourable member for Yarra ( Mr Keon). speaking as if hs were really concerned for the interests of' the primary producers when we all remember him describing the wool-groAvers as the."" Mood-sucking wool-growers "". .",24
78,Mr CREAN ,"Who "" said that? 1 1",24
79,Mr TURNBULL ,"The honourable member for Yarra. If anybody wants proof, the remark is reported in Hansard.",25
80,Mr KEON ,"I rise to order, Mr. Chairman. The honourable member for Mallee has attributed to me a remark that I did not make.",25
81,Mr TURNBULL ,It is in Hansard.,25
82,Mr KEON ,The people whom I described as blood-suckers were the members of the Australian Country party. I said that they were sucking the blood of the rural community.,25
83,Mr TURNBULL ,It is in Hansard. I will not withdraw it.,25
84,The CHAIRMAN ,"Order ! If the honourable member for Yarra is calling members of this committee blood-suckers, I ask him to witlidraw and apologize to the committee.",25
85,Mr HAYLEN ,"But that was in another debate. You are out of order, Mr. Chairman.",25
86,The CHAIRMAN ,Order ! honourable member for Yarra will obey the Ohair. He must withdraw and apologize.,25
87,Mr KEON ,"The remark was made over six months ago, Mr Chainnan.",25
88,The CHAIRMAN ,"The honourable member has just made a statement by implication. If the honourable member intended that remark to apply to the Australian Country - party, he will withdraw and apologize to the committee.",25
89,Mr KEON ,"I shall' withdraw the remark retrospectively, if it is offensive tp you, Mr Chairman. ;",25
90,The CHAIRMAN ,And apologize!,25
91,Mr KEON ,"I will withdraw and apologize, but nobody objected when the remark was made oh the previous occasion.",25
92,The CHAIRMAN ,I point out that honourable members are not permitted to make such statements on points of order. The honourable member for Mallee will continue.,25
93,Mr TURNBULL ,"I'was referring to the fact that, about six months ago, the honourable member for Yarra described the wool-growers as ""the blood-sucking wool-growers "". It is in Hansard.",25
94,Mr KEON ,"I rise to order. The honourable member for Mallee has attributed to me a remark that I did not make, and I suggest that he sliould be made to withdraw and apologize.",25
95,The CHAIRMAN ,"If the honourable member has been misrepresented, he can obtain his remedy by making a personal explanation after the honourable member who is now addressing the committee has concluded his remarks.",25
96,Mr TURNBULL ,I am perfectly willing to show to the honourable member and anybody else who may be interested the report of his remarks in Hansard. That report cannot be denied.,25
97,Mr KEON ,Will the honourable member apologize if the alleged remark is not in Hansardl,25
98,Mr TURNBULL ,"Certainly . If it is not there, I shall publicly apologize for the remarks that I am making now.",25
99,The CHAIRMAN ,Order ! The honourable member must address the The Chair.,25
100,Mr TURNBULL,"Apparentl y the honourable member for Yarra varies the tone of his speeches in order to tickle the ear of the public and tries by that means to gain more votes or some favourable comment for the Labour party. If he thinks that advantage may be gained by supporting the wool-growers, he makes a speech such as we have just heard from him. The same course appears to have been followed by the honourable member for Perth, because no speech could possibly cause more confusion of thought than that of the honourable member. There are approximately 300,000 primary producers in Australia, and over 250,000 of them will continue to pay taxes under the averaging system. Only those who have received exceptionally large wool cheques will be affected by theproposed legislation. Not one member of the Labour party in this chamber has ever been known to express any sympathy for the wool-growers who have been receiving large incomes in recent years. As I look at the various members of the Opposition, I recall the statements that they have made and I know that they have no sympathy for the wool-growers. If I were to ask all members on the other side of the chamber who represent primary producing constituencies to stand in tlieir places, only about two of tbem would rise to their feet.",25
101,The CHAIRMAN ,Order ! has this to do with the motion?,26
102,Mr TURNBULL ,"I am pointing out that the sympathies of honourable members opposite are not with the wool-growers and otlier primary producers, and that the sympathies of the primary producers are not with the Labour party. The farmers know exactly what to expect from the Labour party.",26
103,The CHAIRMAN,The honourable member must connect his remarks with the motion.,26
104,Mr TURNBULL ,"The 10 per cent, tax increase will not be retrospective. It will apply only to income of the year 1951-52. The relative incidence of income tax will be on the same scale as previously. The proposal will not put any more weight on the shoulders of a man with a small income than it will put on the shoulders of a man with a large income. As I have said, a man earning £600 a year will have to pay only £2 10s. more in 1951-52 than he paid last year. This issue can be debated more fully at a later stage when the authorizing bill is under consideration. Then, if honourable members opposite have anything more to say on the subject, we shall be very happy to answer their objections.",26
105,Mr CREAN ,"Melbourne Ports) [5.20]. - I propose to discuss the averaging provisions that are dealt with in the motion. For the sake of clarity, it should be emphasized at the outset that wool growers are not the only primary producers to whom the averaging provisions apply. Under the averaging system, a taxpayer pays tax at a rate determined by taking the average of his income for the tax year and the preceding four years. One effect of the motion will be to remove from the scope of the averaging provisions primary producers whose current income and average income over the preceding four years is in excess of £4,000 a year. Individuals whose actual income for the current year will be less than £4,000, but whose average income over the previous four years was over £4,000, will be taxed at the rate applicable to £4,000 as laid down in the Eirst Schedule. Furthermore, taxpayers who have been paying tax under the averaging provisions will be given the option of paying nnder the ordinary system in What future. In the process of removing from the scope of the averaging provisions primary producers whose current income and average income for the past five years are both in excess of £4,000 a year, an anomaly in the averaging provisions will be eliminated. I shall explain how that anomaly arises. For some years prior to the financial year 1950-51, taxpayers claimed concessions in respect of dependants, insurance premiums, medical expenses and so forth by the concessional rebate system. But, commencing from 1950-51, the concessional deduction system was re-instituted. The effect of changing back to the concessional deduction system was to alter the concept of taxable income. That fact has an important bearing upon individuals whose income is les3 than £4,000, and I remind honourable members on the Government side of the chamber that there are still many primary producers in receipt of comparatively small incomes. These taxpayers are to be penalized because the Government did not alter the concept of taxable income under the averaging provisions when it re-introduced the concessional deduction system in place of the concessional rebate system. The situation can be best illustrated by reference to a hypothetical case. I take the case of a primary producer who has had an actual income of £1,200 in each of the last five years. I ask honourable members to note the distinction between actual income and taxable income. For the sake of the illustration, I assume that the taxpayer has a wife and children and that the tax concessions to which he is entitled represent £40Q a year. Over the period of four years prior to 1950-51, his taxable income for the purposes of the averaging system was £1,200 a year. But in 1950-51, with the same actual income of £1,200, his taxable income was only £800 because the concessions to which he was entitled were first deducted from the total. However, nnder the averaging system, the rate at which he will be i required to pay tax on his taxable income | will be determined on the basis of four J years at £1,200 and one year at £800.$ His total income over the five-year period § will be regarded as £5,600, which gives an average figure of £1,120. This year, upon a taxable income of £S00, he will pay income tax at the rate applicable to an income of £1,120. Mr Davidsun interjecting, "" Mr CHEAT*?"" - The honourable member for Dawson ( Mr Davidson) has not listened to what I have been saying. All that he wants to do is to defend a mistake that has been made by this Government. The honourable member for M!oore ( Mr Leslie) said that the Government was considering the interests of the small people. I am pointing out that the more dependants a taxpayer has, the worse, relatively, is he penalized, because his taxable income for this year is less than was his taxable income for the previous year. Taxpayers should have been permitted to elect, if they so desired, to withdraw from the averaging system, not next year but this year, l t would have been easy to make provision for that to be done. I have worked out some examples. The taxpayer to whom I have referred would pay £90 in income tax this year if the tax were imposed upon his taxable income of £S00 a year at the rate applicable to that income, but, owing to the operation of the averaging system, he will pay £120 income tax, because the tax will be imposed at the rate applicable to his average taxable income of £1,120 a year. Therefore, his tax liability will be increased by 33 per cent, as a result of this anomaly. If his actual income were £3,200 a year for the last 4 years and if it remained at that figure this year, bis average taxable income would be £3,120 because he, being entitled to concessional deductions to the value of £400, would have a taxable income this year of only £2j800. If income tax were levied upon him at the rate applicable to an income of £2.800, he would pay £S26 6s. Sd., but, under the averaging system, it would be levied at the rate applicable to an income of £3,120 a year, and he would pay £SS5 3s. 5d - a n increase of his tax liability by £60. The lower the general income during the previous years, the harsher is the effect of this provision. I am suggesting that there is, as it were, a forgotten race. There is a great deal of difference between the concept of taxable income under a concessional rebate system and the concept of taxable income under a system of concessional deductions. We have changed the system but, as far as the averaging system is concerned, we have made no allowance for the fact that in the previous four yeai'3 we were using the old concept of taxable income ancl that in the current year we shall use the new concept. We have changed from the concessional rebate system to the concessional deductions system, but we have overlooked the effect that the new system will have upon people who are taxed upon the averaging system.",26
106,The CHAIRMAN ,Order ! The honourable gentleman's time has expired.,27
107,Mr THOMPSON ,"Port Adelaide) [5.28] - I was interested in the attempts of the honourable member for Moore ( Mr. Leslie) and the honourable member for Mallee ( Mr Turnbull) to hide the fact that this year primary producers will pay an additional £47,000,000 in income tax. The Treasurer ( Sir Arthur Fadden) made no bones about that at all. He said that he was going to abolish the averaging system in respect of primary producers with annual incomes of over £4,000 and that the effect of the change would be to increase revenue by £47,000,000. The honourable member for Perth ( Mr Tom Burke) dealt with that matter at some length, and I was amazed when the honourable member for Moore suggested that he had misrepresented the position. J could understand what the honourable member for Perth was saying, even if the honourable member for Moore was unabie to do so. The Vice-President of the Executive Council ( Mr Eric J. Harrison) interjected when the honourable member for Perth was speaking and asked whether we on this side of the chamber believed in sectional taxation. Almost immediately afterwards, the honourable member for Mallee pointed out how many primary producers would not be taxed under the averaging system and how many would be. Apparently the honourable gentleman is quite prepared lo agree to the imposition of a sectional tax upon primary producers with incomes of over £4,000 a year. It is not the Opposition but honourable gentlemen opposite wbo are doing the seetionalizing. The Australian Country party, which supposed to represent the primary ducers, finds it very difficult to explain why they should be called upon to pay an additional £47,000,000 in inoome tax this year. However, I do not want to dwell at length upon that point. As I said recently, the members of the Ausreceived tralian Country party should be left argue it. I am concerned about the Government's attempt to make it appear that income tax is to be increased by only 10 per cent. That is not the position. Last living year, the basic wage was approximately £8 a week. This year, it is approximately £10 a week. Therefore, this year a man who is in receipt of the basic wage will suggested. pay, not 10 per cent, more income tax than he paid last year, but tax upon income of £10 a week, plus 10 per cent. The rate at which income tax is imposed upon an income of £10 a week is greater than that at which it is imposed upon ment ! an inoome of £S a week. I recall that when the Labour party was in office, members of the present Governmenl case, parties, who were then in Opposition, would say, "" Last year the tax paid per head of population was £70, and this year it is £90 "". They have not argued in that way during this debate. They not pointed out that, under the rates of tax specified in this motion, the Government will collect from individuals 'this year 100 per cent, more income tax than it collected last year. When the Governposition ment talks about increasing income tax by only 10 per cent., although it knows that it will receive 100 per cent, more from the tax this year than it did last year, it is putting something over people. Let us examine the case of a man with children. a wife and two children whose income last year was £400, or roughly the basic wage. Last year he paid £2 8s. in income If his income tax were increased by only 10 per cent., this year he would pay £2 13s. But his income this year will be approximately £500, because the basic wage has been increased to approximately £10 a week. He will be no better off as a result of the increase, because the price of almost everything has increased, Mr Thompson. but instead of paying £2 8s. income tax he will pay £9 l is . If it can be is shown that that is an increase of proonly 10 per cent., I shall go "" he"". If the Taxation Branch and the Treasurer had been fair they would have made the rate of tax appropriate to an income of £400 now applicable to an income of £500, because the additional £100 a year by basic wage workers is intended to to cover increased living costs. Under .these proposals the unfortunate basic wage worker will be hit both ways. In addition to having to pay tax on an income that has been increased to cover higher costs, he will have to pay a special levy equal to 10 per cent, of the tax applicable to that higher income. The rates should be scaled down as I have Mr EKIC J. HAHKISON - Does the an honourable member suggest that a poli; tician who formerly received £1,000 and now receives £1,500 should pay tax on only £1,000? What a ridiculous arguMr THOMPSON:- I am arguing the not of a taxpayer in a high income group, but of a man on the basic wage. Living costs affect every member of the community and not only one section of it.",27
108,Mr TURNBULL ,What would happen have when living costs were reduced?,28
109,Mr THOMPSON ,Cost s would be reduced to all persons alike. The honourable member for Mallee referred to the of a basic wage worker employed by a farmer who previously paid £2 8s. in tax and under the new proposal will pay £2 10s. The honourable member did not say that that tax applied to a taxtho payer who had a wife and one child.,28
110,Mr TURNBULL ,I said that it applied to a taxpayer with a wife and two,28
111,Mr THOMPSON ,"A basic wage tax. worker with no dependants would pay very much more than the amount stated by the honourable member. This proposal is iniquitous because it ignores the 'fact that increases of the basic wage have been granted solely to offset higher living costs. The honourable member for Moore ( Mr. Leslie) has said that the Government has adopted the simple procedure of imposing a special levy equal to 10 per cent, of assessed tax and that if a new scale of rates were introduced the people would have great dimculty in understanding it. I need not remind the honourable member that what interests the ordinary man in the street is not the method by which his tax commitment is assessed but the amount he has to pay. Under this proposal, instead of merely paying a special levy equal to 10 per cent, of assessed tax he will pay an amount which niay be 20 per cent, higher than that paid last year.",28
112,Mr LESLIE ,He will have additional money with which to pay the increased tax.,29
113,Mr THOMPSON ,The only additional money in the hands of the workers is money that has been awarded to them by the Commonwealth Arbitration Court to offset increased living costs.,29
114,The CHAIRMAN ,Order! The honourable member's time has expired.,29
115,Mr HAMILTON ,"Canning) [5.40] Tho honourable member for Port Adelaide ( Mr Thompson) referred to the collection of £47,000,000 from primary producers in consequence of the modification of the averaging system. In order to clarify the position I propose to read what the Treasurer ( Sir Arthur Fadden) had to say on the subject. The right honourable gentleman is reported in Hansard to have saidThe total number of primary producers is estimated to be 300,000. Of this total .number, 202,500 are within the range whose taxable incomes do not exceed £4,000. The of the averaging system will thus apply only to 37,500 primary producers out of 300,000, and df the 37,500 abor.t 9,500 would not to any appreciable extent. Thus, only about 28,000 primary producers will be affected to any great degree by the modification of the averaging system. Listening to the honourable member one would have thought that the wbole of the £47,000,000 would be collected as income tax for one year. He is well aware that that is not the case - - The Treasurer has explained that of the £47,000,000 to be collected from the primary producers £22,500,000 will be in respect of the - income year 1950-51, and £24,500,000 will be in respect of provisional tax for 1951-52. Opposition members generally have endeavoured to delude the primaiy producers into believing that the whole amount will be collected in respect of the income year 1950-51. Most of the farmers who will be affected by this proposal have not yet sold their wool. They will not receive their assessments until February next, by which time they will have at their disposal the return from their clip to meet their tax commitments. Opposition members told a similar story last year about the Government's wool deduction scheme and forecast all sorts of dire results from that legislation; but when the wool growers found out what was really involved they refused to listen further to Opposition scaremongers. The Treasurer has explained that of the total estimated receipts of £47,000,000 in 1951-52, resulting from the modification of the averaging system, primary producers with incomes of between £4,000 and £6,000 will pay only £3,500,000, and that the balance of £43,500,000 will come from those with incomes in excess of £6,000. If primary producers - examine this proposal fairly they will see that it will do them a great service. They realise that the prices of primary products will not remain at their present high level and that when prices fall they will have lower incomes with which to meet their tax commitments. At the commencement of this debate the honourable member for Perth ( Mr. Tom Burke) said that the special levy of 10 per cent, of assessed tax would apply to income earned in the income year ended modification the 30th June, 1951.",29
116,Mr TOM BURKE ,The honourable membe affected ber can never tell the truth.,29
117,Mr HAMILTON ,"The honourable member knows that the special levy applies to income of the taxable year ending the 30th June, 1952, and that it has no retrospective application whatsoever. I rose principally to deal with some of the remarks of the honourable member for Yarra ( Mr Keon), who seemed to take great delight in telling the people that there is likely to be a very serious shortage of food in Australia. If there is a shortage of food, it will result from the activities of persons whom the honorknows ' able member has supported during the last five or six years.",29
118,Mr KEON ,Rot !,30
119,Mr HAMILTON ,The honourable member spoke about potatoes.,30
120,The CHAIRMAN ,Order ! honourable member is getting rather of the motion.,30
121,Mr HAMILTON ,The incentive produce more food,30
122,The CHAIRMAN ,Order ! I ask the honourable member to confine his remarks to the motion.,30
123,Mr HAMILTON ,"It has been said that we should give some incentive primary producers by reducing the of taxation. If such a reduction were made it would not affect the production of at least some of the foodstuffs that were mentioned by the honourable member. At present primary producers in some States indirect taxes must obtain a permit to grow potatoes. What incentive would be given to pective potato-grower by a reduction of taxes if he could not obtain a permit grow them? Legislation was introduced in the Queensland Parliament recently prescribing that primary producers must deliver foodstuffs where directed. What incentive would be given to Queensland producers by a reduction of taxation while legislation of that kind continues to operate? Opposition members have advocated the reduction of rates of income applicable to farm labourers. When Opposition members sat on this side of the chamber they were supported to the hilt by the Governments of New South Wales and Queensland in their attempt to prescribe a 56-hour week for farm labourers when a 40-hour week was standard working week for every other obtain enough. section of industry. Yet they come into this chamber and say that the Government should, by reducing tax rates, give the dairy-farmers an incentive to produce more. Honourable members opposite would do better to go into the workshops of this country and encourage the workers to produce more machines for the use of the farmers, because lack of machinery is a brake on rural production at present. Every sane Australian that the increase of taxes that is to operate from the beginning of this financial year is designed for a specific purpose, which is the financing of our intensified defence programme. Have some honourable gentlemen opposite not heard of the fact that a war of internaThe tional significance broke out in Korea wide about eighteen months ago, as a consequence of which the whole international situation, and also the interto nal conditions of this country, have changed? Honourable members opposite say that the Government has not reduced taxes since it took office, although they know that throughout the whole of the last financial year they paid a reduced rate of tax on their parliamentary to salaries, because the Government had rates reduced taxes on all incomes.",30
124,Mr BIRD ,What about indirect taxes?,30
125,Mr HAMILTON ,The position about,30
126,The CHAIRMAN ,Order ! That a prosmatter is not under discussion.,30
