speakerGroups,Speaker,text,pageNumbers
140,Mr WARD ,"I shall return to the taxation field. When Labour was. in office, a worker who was earning £340 a year, which was approximately the base rate, paid £15 a year in tax. This year, a worker who receives the base rate of £538 a year willpay £45 in income tax and, as I have shown, he will be relatively much worse off. The same discrepancy is obvious right throughout the lower income scale. Everybody in this country knows that no man can exist and maintain a family on the prevailing basic wage. What is happening, of course, is that bread-winners are working overtime, and in many cases the members of the family have to go to work to supplement the household income. They can do that at present because of the great demand for labour but, if families were forced to exist on the basic wage, starvation would result because the basic wage, reduced by this Government's tax imposts, is insufficient to meet the needs of a family. The Treasurer invited the Opposition to show how the proposed tax increases could be avoided. He complained that no constructive suggestions had been made from the Labour side of the chamber. I propose to make a few now. The Government is budgeting for a surplus. The Treasurer's excuse for doing so is that Australia is following the example set by Canada. The right honourable gentleman did not refer to New Zealand, of course, because in that country where the Administration is faced with the identical problems-includin g increasing defence expenditure-that confront this Government, taxes are being reduced. It is ridiculous to argue that inflation can be met by increasing taxes. We have been told repeatedly that the only real counter to inflation is to increase production, and that production can be increased only if the right incentives are provided. Will higher taxes give an incentive to increase production ? Even the Prime Minister ( Mr Menzies) in the 1949 election campaign conceded that a reduction oftaxes was essential to stimulate production. He saidIt hiis, by way of outstanding example, been most reluctant to grapple with the problem of tax reduction. This is partly because it seems to believe that Government can spend our earnings for us more wisely than we can (which is a common delusion), and, therefore, that it is more important to maintain Government ture than to reduce the taxes which them; and partly because the Government has never come to understand that real tax reductions would be the best of all incentives to increased effort, earnings and production. Mr Ward. That statement was made by the P*ime Minister who now uses exactly the opposite argument. The Government is saying to the people, "" We have to draw off some of your surplus funds to meet the inflationary situation "". It is quite true that if surplus money is abroad in the community the demand for scarce commodities will be accentuated, but how will inflation be reduced if the Government, after drawing off the surplus spending power, itself expends that money, and - thus does exactly what the Prime Minister complained about in the 1949 election campaign? To-day the right honourable gentleman is saying to the Australian people, "" We can expend the money much more efficiently and much more satisfactorily than you can "". I am not arguing that there is no surplus money in the community. If the volume of money is continually increasing, it must have some effect on prices unless there is a corresponding increase of production, but surely the Government's plan sbould not be to draw money away from people who cannot spare it. Obviously people in the lower income groups have no surplus funds. With the high cost of living today, many of them have a great struggle to make ends meet. The Government, ehould draw surplus money from the people who have too much but that is just what it does not propose to do. It will not take surplus money from the wealthy monopolies to wbich I have referred. Of the estimated increase of £160,000,000 in taxation revenue this year, the wealthy companies will contribute only 7 per cent. Let us see what the Treasurer himself has said. [Quorum - formed.] His views in 1949 were similar to those held by the present Prime Minister. He saidThe Chifley Government might blame the coalminers, wharflabourers, or the Communists foi' the slowing down of production, but it alone is responsible for the paralysing effect of restrictive taxation. The Government's policy of maintaining departments taxation at unduly high levels has killed the incentive to produce. This, in turn, has conSocialist tributed to industrial dislocation, absenteeism, spasmodic stoppages of work and a general expendi- disinclination to work overtime. maintain Therefore, substantial and immediate taxation reductions must be made to remedy tht country's economic ills. The most practical way to alleviate industrial unrest and encourage full employment is by a substantial reduction of individual taxation. Tax reduction is the most effective way of increasing wages. Every penny taken from a pay envelope by the Government represents a reduction in wages. That is the Opposition's contention. But there will not be any reduction of dividends. I challenge the Government to produce any recent instance of a company which has been compelled to reduce its dividend rate because its pronts have fallen, or any instance of a company wbich will have to reduce its dividend rate because of the present taxation proposals. The people who draw dividends from these great companies will find greater amounts going into reserves and greater profits being earned. Their incomes will not be affected by the proposals of the Government. Only the workers who have no way of passing the taxation on will be affected by these .proposals. The Treasurer has cited figures in regard to the increased profits of the great companies. He said that during the last financial year they earned an additional £90,000,000 in profit. Of that amount the Government has proposed to take £10,900,000, but that amount will not be taken from the individual shareholders. The proposal will result in only a small token payment being made from the inflated pronts of these companies. The workers have been very harshly treated by the Governm.ent. The proposed taxation is inequitable. The Treasurer has stated that the Government's policy is to tax spending rather than earning. The result of such a policy will be that workers who maintain families will have to pay a disproportionate amount of the tax because they are compelled to spend all their income, in most cases, in order to exist. The honourable member for Fremantle ( Mr. Beazley) was criticized by the Treasurer because he advocated the abolition of the sales tax. I consider that the sales tax should be abolished. The Treasurer has proposed that the taxation burden on large companies should be eased, on the plea that such taxes were imposed as a war-time measure. Was not the sales tax imposed as a war-time measure in the first instance? Surely this tax which was imposed in order to provide some of the finance for World War I . could be removed now that so many years have passed since that war terminated. Indirect taxation bears most heavily on the worker and the family man. The fairest method of taxation has always been a direct tax on a graduated scale according to the ability of the individual to pay. Beference was made in a previous debate to the policy of the Government in regard to wool-growers. Members of the Australian Country party have twitted Opposition members by calling them the friends of the wool-growers and by telling them that they do not represent rural constituencies. Many members of the Labour party are directly representative of rural industries, and all members of the Labour party are Australians and regard themselves as representatives of Australia. We do not believe that any section of the community should be treated unfairly, regardless of what electorate it lives in. Many wool growers are probably better off now than they have ever been before. It is quite true that many of them could bear a greater proportion of the taxation burden than they have borne in the past. But that is not relevant to the proposition before the House. As the honourable member for Perth ( Mr Tom Burke) said, the Government is peeved because the wool-growers had the audacity to reject the wool stabilization scheme when"" they voted on that matter, so that the Government is obliged to repay to them £45,000,000. The Government now intends to give that amount back to'the wool-growers with one hand and take £47,000,000 away with the other. I do not argue that the primary producers generally are not in a very prosperous position. I wish that some so-called representatives of primary interests in -; this House were less eager to extract higher prices from our unfortunate kinsfolk overseas and were satisfied with their present returns. The subject of taxation is<associated with- /the Government's defence programme. There is no member of the Opposition who does not believe in the adequate defence of Australia. But the Government must take into account the capacity of the country to meet defence expenditure and contribute to a joint effort with other countries. Surely honourable members opposite recognize that there must be a limit to what this country can do in the matter of defence.",49
141,Mr SPEAKER ,Order ! I am sorry to say that the honourable gentleman is getting away from taxation.,52
142,Mr WARD ,"The Government has asked the Opposition to suggest ways in which increased taxation could be avoided In order to show how it can be avoided is necessary to deal with the subject of expenditure. Mr SPEAKER,-Order ! The honourable gentleman cannot deal with expenditure in this debate. This is purely a taxation bill.",52
143,Mr WARD ,The bill relates to taxation for a special purpose. The Government should review its programme. It should reduce its expenditure on immigration because of the difficulties,52
144,Mr SPEAKER ,Order ! The honourable gentleman is getting away from taxation.,52
145,Mr WARD ,I am only making a passing reference.,52
146,Mr SPEAKER ,"The honourable gentleman will have an opportunity in Committee of Supply to deal with other matters. He cannot deal with them now, but must confine himself to taxation.",52
147,Mr WARD ,"It is not necessary for the Government to impose this burden of taxation on the people. The Government's proposals will place an inequitable burden on the community and benefit wealthy interests to the disadvantage of the workers. The Government will not encourage greater production by treating the workers, who are the real producers, unfairly, but only by treating them more equitably. No worker in receipt of the basic wage or less should have to pay taxes, because that would leave him with insufficient money on. which to live. If the Governmeut proposes to increase the rate of taxation with every additional £50 earned in the lower incomes, why does it not propose to do so regardless of total income? Why should the rate of tax payable by a man in receipt of £8*000 a year not be subject to increase until his salary has increased by £2,000 ? Despite the attempts of the Treasurer to work up some measure of enthusiasm for the budget, the people are disturbed and alarmed at the Government's propo sals and they are continually heard asking how much longer the Government wil] remain in office. I suggest that the Government parties should do what they invited Labour governments to do in the past if they consider that this is a popular budget - tes t the feeling of the people by giving it . them an opportunity to demonstrate whether they consider that the Government has acted in a fair and reasonable manner. As a matter of fact, this Government was elected by fraud, because it has reversed every one of its election promises.",52
148,Mr SPEAKER ,-Order ! The honourable gentleman is getting away from' taxation.,52
149,Mr WARD ,"The Government parties promised to reduce taxation, but",52
150,Mr TURNBULL ,I rise to order! The honourable member for East Sydney ( Mr. Ward) said that this Government wa? elected by fraud. I ask for that statement to be withdrawn.,52
151,Mr SPEAKER ,"I do not think that "" fraud "" is a parliamentary.word. However, no member of the Ministry took objection to its use by the honourable member for East Sydney.",52
152,Mr ANTHONY ,We take no notice of what the honourable member for East Sydney says.,52
153,Mr TURNBULL ,"Surely a private member has some rights, Mr Speaker?",52
154,Mr SPEAKER ,"A private member has rights but the Government was referred to. However, I think that the honourable member for East Sydney should withdraw the expression.",52
155,Mr WARD ,"In deference to yon, Mr Speaker, I withdraw it.",52
156,Mr SPEAKER ,Order ! The honourable gentleman's time has expired.,52
157,Mr WENTWORTH ,"Mackellar) [10.11] - Some of us wonder whether the honourable member for East Sydney ( Mr Ward) Conversation being audible across the table,",52
