Speaker,Text,pageNumbers
NA,"£30,000,000 in foreign exchange during",55
NA,the last five or six years.,55
NA,NA,55
NA,were established in States when Labour,55
NA,governments were in office.,55
Mr CHANEY , I come from Western,55
NA,Austraha. I will not refer to what has,55
NA,happened in Victoria. In Western Aus-,55
NA,tralia the refinery was established during,55
NA,the regime of the MCLarty-Watts non-,55
NA,Labour Government. Originally the Com-,55
NA,monwealth Oil Refining Company Limited,55
NA,intended to build its refinery in Victoria.,55
NA,That is a complete answer to the honorable,55
NA,member's suggestion that these establish-,55
NA,ments were built only in States in which,55
NA,Labour governments were in office.,55
NA,"Lastly, I shall refer briefly to the state",55
NA,of Western Australia's economy. The,55
NA,Government of that State is making valiant,55
NA,efforts to bring Western Australia's pro-,55
NA,gress and development somewhat into line,55
NA,with that in the eastern States. It faces a,55
NA,mammoth task. Honorable members,55
NA,opposite criticize overseas investments and,55
NA,complain about the profit made by General,55
NA,Motors-Holdens' Limited or by Broken,55
NA,Hill Proprietary Company Limited. My,55
NA,reply to their criticism is that if New South,55
NA,Wales or Victoria object to the investment,55
NA,"of overseas capital in their States, Western",55
NA,Australia will welcome such investment,55
NA,with open arms. Industries may come,55
NA,there and establish their factories and pro-,55
NA,"gress to their heart's content, because we",55
NA,realize that this would improve the,55
NA,economy of our State and provide employ-,55
NA,ment for the thousands we want to see,55
NA,employed in Western Australia.,55
Mr CLARK ,Darling) [4.50] - I wish to,55
NA,deal with some of the items which were,55
NA,"covered by the Treasurer ( Mr Harold Holt),",55
NA,in his Budget speech. Previous speakers,55
NA,have dealt with many of its points and have,55
NA,shown that this Budget is designed to assist,55
NA,those in the community who are better off,55
NA,but gives little aid to those in greatest need.,55
NA,One of the first matters to which the Trea-,56
NA,"surer referred was employment, and he",56
NA,said-,56
NA,Of the additional people available for employ-,56
NA,"ment, most if not all found occupations.",56
NA,"He went on to deal with overseas reserves,",56
NA,and said-,56
NA,"Externally, our position improved as the year",56
NA,went on and instead of our overseas reserves fall-,56
NA,"ing by something over £100,000,000 as had been",56
NA,"feared when the year began, they fell by only",56
NA,"£10,000,000. . . . This came about partly",56
NA,through a strong inflow of private capital com-,56
NA,bined with some success in public borrowing,56
NA,"abroad, and partly through a recovery in exports.",56
NA,He further pointed out that the ceiling for,56
NA,import licensing was being raised from,56
NA,"£800,000,000 a year to £850,000,000 and",56
NA,added-,56
NA,These are the essential facts of a successful,56
NA,Any business man who balanced his trad-,56
NA,ing budget only by borrowing from his,56
NA,friends would not be regarded as being,56
NA,very successful. Most people would conand,56
NA,sider that the business was in a very,56
NA,way. I f a business cannot show adequate,56
NA,"profits in its trading activities it is concountries,",56
NA,sidered to be very unsatisfactory. National,56
NA,finances can only be considered in the,56
NA,light as we view a private business. I draw,56
NA,attention to a further statement in the,56
NA,get speech which reads-,56
NA,In net terms the addition to the work force,56
NA,"year will probably be about 80,000.",56
NA,"That is a very significant figure, and",56
NA,been frequently cited in this debate. The,56
NA,Treasurer also said-,56
NA,"To keep all resources, and particularly",56
NA,"resources of labour, fully employed is, of",56
NA,not only a social obUgation but also a vital,56
NA,nomic need.,56
NA,One would think that if the Treasurer felt,56
NA,"it was a vital social and economic obligaindustries,",56
NA,tion to keep our labour force fully env,56
NA,"ployed, he would do more about the matter",56
NA,than is being done at the present time. For,56
NA,quite a considerable time in Australia,56
NA,number of unemployed has stood at,56
NA,"60,000, which is a very substantial number",56
NA,"indeed. In the year 1957-58, about",56
NA,"£2,000,000 was paid out in unemployment",56
NA,"benefit, but in the year 1958-59, payments",56
NA,"under that head amounted to £4,900,000,",56
NA,which was more than double the figure for,56
NA,the preceding year. The Treasurer stated,56
NA,"that about 80,000 persons had become control",56
NA,available for employment this year. Last remittances.,56
NA,year the estimate was about the same num-,56
NA,ber. It would be interesting to know,56
NA,whether these people actually found em-,56
NA,ployment. I know that in my electorate,56
NA,"this year, many children who were old",56
NA,"enough to leave school, returned there",56
NA,because they could not find employment.,56
NA,That is one of the very serious aspects of,56
NA,unemployment to-day. The figures avail-,56
NA,able for last year show that the total,56
NA,"number of persons employed in Australia,",56
NA,apart from those engaged in the defence,56
NA,"forces, increased by 22,000. Of that num-",56
NA,ber 16.000 became engaged in Government,56
NA,"activities, so only 6,000 persons commenced",56
NA,employment with private organizations. It,56
NA,"is rather startling to learn that of 80,000",56
NA,persons who became available for employ-,56
NA,"ment, only 22,000 obtained employment,",56
NA,"year. and of that number 16,000 were absorbed",56
NA,in the Public Service.,56
NA,A budget should contain a definite policy,56
NA,a programme designed to expand the,56
NA,bad country's production. We have read of,56
NA,five-year plans and seven-year plans in other,56
NA,but in Australia we have no speci-,56
NA,fic programme. We should set a target for,56
NA,"same primary production, and the Government",56
NA,should give substantial assistance to primary,56
NA,Budproducers to enable them to reach that,56
NA,target. But the Government leaves every-,56
NA,this thing to the producers. A similar target,56
NA,"should be set for the heavy industries, which",56
NA,it has produce our consumer goods. We have,56
NA,been told that our population will increase,56
NA,"substantially during the next ten years, and",56
NA,our that the demand for goods will rise corre-,56
NA,"course,, spondingly. The Government should do",56
NA,ecomore to assist private enterprise in its,56
NA,efforts to expand our economy. It could do,56
NA,this by assisting in the establishment of new,56
NA,and by protecting those that,56
NA,already have been established. The Minis-,56
NA,ter for Trade ( Mr MCEwen) has stated that,56
NA,an increase in our export income is depen-,56
NA,"the dent on producers, manufacturers and ex-",56
NA,"porters, and not on the Government. The",56
NA,"leading article in the "" Sydney Morning",56
NA,"Herald"" of l l t h August dealt with the",56
NA,Minister's statement in these terms-,56
NA,Some good progress should undoubtedly be,56
NA,aimed for in the exports drive from now on. The,56
NA,great capital inflow . . . . lies beyond our,56
NA,and will in due course carry servicing,56
NA,obligations in the form of dividend and interest,56
NA,The honorable member for Perth ( Mr.,57
NA,Chaney) has referred to the benefits to be,57
NA,derived from the investment of foreign,57
NA,capital in Australia. Although I do not,57
NA,oppose the establishment of foreign enter-,57
NA,"prises, or the investment of foreign capital,",57
NA,"in this country, there should be a percentage",57
NA,of Australian holdings in all companies so,57
NA,established. Those companies should have,57
NA,the right to export their production to any,57
NA,"part of the world. However, in Australia",57
NA,we have companies wholly owned by over-,57
NA,seas organizations which exploit this coun-,57
NA,"try, obtain huge profits and then take out",57
NA,of Australia a great proportion of those,57
NA,profits. The much maligned General,57
NA,Motors-Holden's Limited raised its capital,57
NA,in Australia. That company advertises every,57
NA,day for debenture capital to finance its,57
NA,"operations, offering to pay 6 i per cent,",57
NA,interest on a long-term loan although it,57
NA,"is making many hundreds per cent, in",57
NA,profits. G.M.H. is not an example of,57
NA,foreign capital investment; it is an example,57
NA,of foreign interests exploiting Australian,57
NA,capital. Only by expanding the home,57
NA,markets for our produce can we obtain a,57
NA,turnover in goods to enable us to build up a,57
NA,sound export market. If we have a substan-,57
NA,tial home market which is protected to the,57
NA,extent that our industries are able to,57
NA,"develop on sound economic lines, use more",57
NA,efficient methods of production and diminish,57
NA,"costs, those industries will be in a better",57
NA,position to go on the export market. But,57
NA,the Government has not helped our pro-,57
NA,"ducers, because during the ten years it has",57
NA,been in office the march of inflation has,57
NA,"been unchecked, and the cost structure has",57
NA,become a heavier burden on our industries.,57
NA,I have been rather alarmed to learn that,57
NA,"the Minister for Trade, a member of the",57
NA,"Australian Country Party, has initiated",57
NA,quiries before the Tariff Board into about,57
NA,300 items on the most-favoured-nation,57
NA,schedule designed to lower the rate of duty,57
NA,on a comprehensive range of goods imported,57
NA,from foreign countries. I have taken the,57
NA,opportunity to examine all those,57
NA,have found that the proposed reductions,57
NA,of duty will be very substantial in many,57
NA,instances and will be disastrous to the,57
NA,establishment of new industries and to the protection.,57
NA,security and development of those already,57
NA,established. Advertisements have appeared,57
NA,in Sydney newspapers to the effect,57
NA,Tariff Board inquiries will commence on,57
NA,"20th July into 164 items, and on 6th",57
NA,October into a further 106 items. Unfor-,57
NA,"tunately, the Tariff Board must complete",57
NA,its inquiries within a specified time so it,57
NA,does not have the opportunity to inquire,57
NA,carefully into all of the 300 items on the,57
NA,schedule. I shall refer to only a few of,57
NA,the items on the schedule. The duty of,57
NA,"47i per cent., plus 10 per cent, primage,",57
NA,"on screws, bolts, nuts, rivets and metal",57
NA,washers will be reduced to 17i per cent.;,57
NA,"the duty of 22i per cent., plus 10 per cent,",57
NA,"primage, on screw hooks, eyes and rings",57
NA,will be reduced to 7 i per cent.; the duty,57
NA,"of 45 per cent, on transmitters will be re-",57
NA,duced to 30 per cent.; the duty of 45 per,57
NA,"cent, on electrical machines and appliances",57
NA,will be reduced to 30 per cent.; and the,57
NA,"duty of 22i per cent., plus 10 per cent,",57
NA,"primage, on certain electrical household",57
NA,equipment will be reduced to 7 i per cent.,57
NA,Industries producing the goods to which,57
NA,I have referred are already established in,57
NA,"Australia, and I am sure that the proposed",57
NA,reductions will make it more difficult for,57
NA,them to carry on. Instead of trying to,57
NA,"build up home markets for our production,",57
NA,the Government seems to be trying to,57
NA,"wreck established industries. Unfortunately,",57
NA,many Australian Country Party members,57
NA,"are one-eyed, and cannot see what the",57
NA,Government is doing.,57
NA,Let me refer now to textiles. The duty of,57
NA,"22i per cent, on blankets, which are manu-",57
NA,"factured on a large scale in Australia, will",57
NA,be reduced to 12i per cent. A similar,57
NA,reduction will be made in the case of quilts.,57
NA,The examples that I have given to the com-,57
NA,mittee indicate the substantial reductions of,57
NA,duty that the Government suggests should,57
NA,be made in order to encourage other coun-,57
NA,"tries to purchase our primary products,",57
NA,inbut it is doing this at the expense of our,57
NA,secondary industries. Such a policy is,57
NA,"disastrous. Indeed, Mr G. R. Bain, the",57
NA,tariff officer for the Associated Chambers,57
NA,"of Manufactures of Australia, made a very",57
NA,strong comment about the attitude of the,57
NA,"items, and Government. He said-",57
NA,If Ausbralian industry is to grow and to make,57
NA,"a greater contribution to national development,",57
NA,it must have tariff rates which will give real,57
NA,Labour will never agree to substantial tariff,57
NA,reductions. We have always regarded the,57
NA,that home market as a sound one for our,57
NA,"primary products, and the establishment",58
NA,and fostering of secondary industry as,58
NA,essential to our national well-being.,58
NA,Under the Scullin Government Labour,58
NA,"did much to establish industries, and",58
NA,any reduction of tariff rates would be a,58
NA,backward step. The current Tariff Board,58
NA,inquiries were initiated as a result of,58
NA,tralian Country Party pressure within the,58
NA,Cabinet. That party has always been pre-,58
NA,"judiced against, if not opposed to, the",58
NA,establishment of secondary industry. It,58
NA,"has been reactionary, and has never realized",58
NA,that its best customer was the home cus-,58
NA,tomer. It is significant that the Minister,58
NA,for Trade is a member of the Australian,58
NA,Country Party and that the chairman of,58
NA,"the Tariff Board, Dr Westerman, com-",58
NA,menced his service with the Department,58
NA,of Commerce and Agriculture. Another,58
NA,"member is Mr Boyer, the son of a mem-",58
NA,"ber of the party, who is well known in",58
NA,the broadcasting world. Labour believes,58
NA,that at least half of the members of the,58
NA,Tariff Board should be men with a vast,58
NA,experience of manufacturing industry.,58
NA,Such men would be in the best position to,58
NA,review the tariff schedules. It would be,58
NA,fallacious to suggest that any lowering of,58
NA,the most-favoured-nation tariff would,58
NA,"Australia. On the contrary, such action",58
NA,would harm this country. In my 25 years,58
NA,of parliamentary life I cannot recall a,58
NA,previous occasion when the Tariff Board,58
NA,has been directed to inquire whether a,58
NA,wide range of duties could be substantially,58
NA,"reduced-obviously , in order to benefit",58
NA,foreign industries and embarrass local,58
NA,manufacturers. The proposals are fantas-,58
NA,"tic, especially as they are made at a time",58
NA,"when, on the one hand, Australia is",58
NA,"experiencing unemployment, and, on the",58
NA,"other, secondary industry is expected to",58
NA,provide work for thousands of new Aus-,58
NA,tralians brought in under our immigration,58
NA,"scheme. Recently, certain tariff rates",58
NA,designed for the protection of Australian,58
NA,"industry have been reduced, though",58
NA,increases in the rates had been sought. I,58
NA,"have in mind certain rubber goods, textiles",58
NA,and wheeled tractors. The Government also,58
NA,refused to give protection to woollen piece,58
NA,goods in the way recommended by the,58
NA,Tariff Board. All this is indicative of a,58
NA,"move to break down tariff protection and,",58
NA,"in that way, substantially injure the",58
NA,secondary industries.,58
NA,Mr Duthie -Wh o is inspiring it?,58
Mr CLARK ,I t is inspired by the Aus-,58
NA,tralian Country Party. Recent events in,58
NA,connexion with Tariff Board recommenda-,58
NA,tions leave no doubt in our minds that,58
NA,that party is prepared to sacrifice our,58
NA,"secondary industries, and remain blind to",58
NA,Austhe advantages of the secure home market,58
NA,that they provide.,58
NA,I shall not labour the point further,58
NA,except to emphasize that our tariff system,58
NA,is in great danger as a result of the inquiry,58
NA,which is now taking place. I hope that,58
NA,the board will not be stampeded by the,58
NA,Government into reducing tariffs in the,58
NA,way I have described. That would sound,58
NA,the death knell for many great Australian,58
NA,"industries, and would add to the ranks of",58
NA,the unemployed.,58
NA,The honorable member for Perth ( Mr.,58
NA,Chaney) referred to the inflow of capital,58
NA,from overseas. I believe that we should,58
NA,borrow in order to finance the business of,58
NA,"this country, but that loans should be raised",58
NA,within Australia. It is fallacious to borrow,58
NA,"£20,000,000 abroad in order to implement",58
NA,the Mount Isa to Townsville railway,58
NA,"assist scheme when the whole of the labour,",58
NA,material and resources required for the,58
NA,project are obtainable in Australia. We,58
NA,can only be excused for borrowing over-,58
NA,seas when we are short of dollars or sterl-,58
NA,ing with which to purchase essentia] re-,58
NA,quirements. We have substantial sterling,58
NA,balances and should be able to buy what,58
NA,"we need from Britain. If we do that, the",58
NA,resultant production will swell our export,58
NA,income and help our trade balance. It is,58
NA,humiliating for Australia that her Prime,58
NA,Minister ( Mr Menzies) should be a party,58
NA,to bowing and scraping before the Ameri-,58
NA,can people so that Australia can obtain a,58
NA,"miserable £20,000,000. To-day, when",58
NA,hundreds of millions are spent annually,58
NA,"by governments, £20,000,000 is a small",58
NA,sum indeed. It could be advanced by the,58
NA,Commonwealth Bank under the guarantee,58
NA,of this Government. That is a simple,58
NA,banking process which we see put into,58
NA,effect frequently. If an individual wants,58
NA,an overdraft to help him carry out some,58
NA,business enterprise he obtains the help of,58
NA,a guarantor of more substantial means and,58
NA,is then entitled to write cheques up to a,58
NA,specified limit. If the banks-an d particu-,59
NA,larly the Commonwealth Bank-ca n do,59
NA,"this for an individual, how much more can",59
NA,"be done for a State, which is backed",59
NA,by all the security which the nation can,59
NA,provide? As long as the nation is sound,59
NA,"the security will hold good, and if the",59
NA,nation fails all else is lost. I was rather,59
NA,pleased that the loan for the Mount Isa,59
NA,railway project was turned down. I am,59
NA,"hopeful that better counsels will prevail,",59
NA,that the money will be advanced by the,59
NA,Commonwealth Bank and that this Govern-,59
NA,ment will guarantee its repayment.,59
NA,Our essential industries should be,59
NA,developed with local capital. People should,59
NA,be encouraged to invest the substantial,59
NA,savings at present lying in the savings,59
NA,banks. The return to the individual would,59
NA,be much greater if the Commonwealth,59
NA,were to use its own resources to finance its,59
NA,"works, and public savings were invested in",59
NA,secondary industry. We should be a more,59
NA,prosperous country and every one would,59
NA,benefit.,59
NA,Another matter with which I should like,59
NA,to deal in the few minutes at my disposal,59
NA,is the intention of the Government to in-,59
NA,crease the charges for telephone calls and,59
NA,"the postage of letters, periodicals and so",59
NA,on. This proposal must have been very,59
NA,little understood by Government suppor-,59
NA,"ters, lt is rather significant that an Aus-",59
NA,tralian Country Party member is respon-,59
NA,sible for that proposal. I have been re-,59
NA,liably informed that the officers of the,59
NA,Postal Department were entirely opposed,59
NA,to the suggested increases and that the new,59
NA,rates were adopted without their approval,59
NA,or recommendation. Who else could have,59
NA,done it but the Minister in charge of the,59
NA,"department, in collaboration with the",59
NA,Treasurer? And to-day he is trying to get,59
NA,out from under by introducing a charge,59
NA,which is opposed by the omcers of his,59
NA,own department as being most unjust and,59
NA,inequitable! The Country Party must bear,59
NA,the full brunt of responsibility for these,59
NA,creased charges which will bear so heavily,59
NA,"upon the country people, because they make",59
NA,great use of post and telephone facilities.,59
NA,"The cost of newspapers, periodicals and",59
NA,so on must increase as the result of these,59
NA,higher rates and all this will add to the,59
NA,already high costs being borne by the com-,59
NA,"munity. Costs have gone up in many ways,",59
NA,yet the Government proposes to double cer-,59
NA,tain postal charges.,59
NA,The Prime Minister admits that he knows,59
NA,nothing about the matter. This is not the,59
NA,first occasion on which I have found that,59
NA,he does not know what is going on. He,59
NA,travels around the world so much that he,59
NA,"gets out of touch with things here, and",59
NA,knows very little about what is going on,59
NA,at home. The price of wool has been down,59
NA,"for over twelve months now, and the Go-",59
NA,vernment takes great credit to itself for the,59
NA,"recent increase, but I point out that twelve",59
NA,months ago I asked the Prime Minister why,59
NA,interest rates had been increased for money,59
NA,for the purchase of wool. I pointed out,59
NA,that this increase would be responsible for,59
NA,reducing the price of wool. The Prime,59
NA,Minister informed me that he had no,59
NA,knowledge of the matter other than what,59
NA,I had said to him. On the next sitting day,59
NA,I brought to the chamber the actual docu-,59
NA,ment furnished by the woolbuyers' banks,59
NA,in which it was stated that the interest,59
NA,"rates would be increased as from, I think",59
NA,"it was, 4th October. I asked the same",59
NA,"question again, having the document in my",59
NA,"hand at the time, and the Prime Minister",59
NA,still said he had no knowledge of the matter.,59
NA,I state emphatically that the'restriction of,59
NA,credit then for the purchase of wool made,59
NA,it more difficult for people to buy. It re-,59
NA,stricted the number of purchasers because,59
NA,many of the small buyers were unable to,59
NA,operate owing to inability to obtain credit.,59
NA,This had the effect of reducing the price,59
NA,of wool. Those buyers were not asking,59
NA,for long term credit; they wanted only short,59
NA,term loans to cover the wool during transit,59
NA,and until the signing of the documents on,59
NA,"fhe other side of the world. After all,",59
NA,that is only the usual practice on the London,59
NA,market. These operators earn millions of,59
NA,pounds in profit out of financing the sale,59
NA,of wool in Australia whereas if Australia's,59
NA,Commonwealth Bank provided the financial,59
NA,assistance Austraha would receive millions,59
NA,of pounds in extra returns from the sales,59
NA,in- and would also enjoy the benefit of a con-,59
NA,siderable reduction in adverse overseas,59
NA,balances. Such charges as freight and in-,59
NA,"surance cost Australia about £100,000,000",59
NA,"a year, and I suggest that with the estab-",59
NA,"lishment of our own shipping line, the",59
NA,carrying of our own insurance and the,59
NA,financing of the sale of our primary pro-,60
NA,"ducts from Australian sources, similar to",60
NA,the way in which wheat sales are financed-,60
NA,by making advance payments to producers-,60
NA,Australia could effect a tremendous saving.,60
NA,"My time has nearly expired, and I hope",60
NA,that some of the points that I have made,60
NA,will be noted by the Government. The,60
NA,taxation proposals put forward in the Bud-,60
NA,"get are very illuminating indeed, and, after",60
NA,perusing a short summary of the Budget,60
NA,I find that increased social services and,60
NA,benefits to be granted to the people this,60
NA,"year will cost a little more than £20,000,000",60
NA,whereas increased taxes will return to the,60
NA,"Government an extra £78,500,000. This,",60
NA,"together with other increased charges, will",60
NA,"return an additional £97,300,000 to the",60
NA,"Government this year. It will be seen,",60
NA,"therefore, that although the Government",60
NA,takes credit for granting considerable con-,60
NA,cessions to the community by way of tax,60
NA,"reductions, more will be taken from the",60
NA,people this year.,60
The TEMPORARY CHAIRMAN , ( Mr.,60
NA,Luchetti) -Order ! The honorable mem-,60
NA,ber's time has expired.,60
Mr FAIRHALL ,Paterson) [5.20] -A s,60
NA,we are considering the state of the national,60
NA,economy in the context of the Budget pro-,60
NA,"posals, it is not inappropriate to do as I",60
NA,propose-spen d a few minutes looking at,60
NA,the wool industry. It is a happy circum-,60
NA,stance that the opening sales of the new,60
NA,season should have shown an increase of,60
NA,"from 10 per cent, to 15 per cent, in wool",60
NA,"returns, but I believe that would turn into",60
NA,an unhappy circumstance if we allowed,60
NA,ourselves to be bemused by the short-term,60
NA,advantages of this increased price because,60
NA,I think that in the long term the picture,60
NA,ahead of the wool industry is not nearly,60
NA,so bright.,60
NA,I am encouraged in that belief by the,60
NA,statement made by two informed contri-,60
NA,butors to the wool seminar organized by,60
NA,the Australian National University who,60
NA,"said of the demand for wool that "" only",60
NA,a narrow line separates prosperity from,60
NA,"disaster."" With that view I am inclined to",60
NA,"agree. Indeed, I believe that the time has",60
NA,come for a searching inquiry into the wool,60
NA,industry and the likely influence of the,60
NA,industry's future on the Australian,60
NA,economy.,60
NA,There is a general feeling of disquiet,60
NA,about the industry's prospects; but there is,60
NA,a general hope that whatever is wrong with,60
NA,the industry will somehow cure itself if,60
NA,we leave it alone. I do not believe that.,60
