Speaker,Text,pageNumbers
NA,count for a moment the need to launch,80
NA,promotion drive with sales talk to teach,80
NA,people the virtues of wool and encourage,80
NA,them to buy it. But when the honorable,80
NA,member urges the Government to appoint,80
NA,a royal commission to inquire into sales,80
NA,"promotion methods and so on, I think",80
NA,indulging in the same sort of talk that,80
NA,coming from other interests in this counoperating,80
NA,try in an effort to divert the minds of,80
NA,wool-growers from the very real immediate,80
NA,"problem, which is the price of wool.",80
NA,Mr Killen -I t was a very good,80
NA,suggestion.,80
NA,NA,80
NA,ber says it was a good suggestion. Any,80
NA,intelligent Cabinet Minister could gather,80
NA,around him within a reasonable period all,80
NA,the experts on sales promotion that this,80
NA,country has-an d some of them are pretty,80
NA,good. On television one sees these experts,80
NA,engaged in all sorts of sales promotion. I,80
NA,"think of the "" Four and Twenty Blackbirds """,80
NA,unit. They give all sorts of commercial pep,80
NA,talks. Surely the advertising of wool either,80
NA,at home or abroad does not require an,80
NA,inquiry by a royal commission in order to,80
NA,launch a sales promotion drive. Such an,80
NA,inquiry would only cause delay.,80
NA,The constitution of the Australian Wool,80
NA,Bureau is in question. I have some sym-,80
NA,pathy with the point of view of the honor-,80
NA,"able member for Paterson, but do not let",80
NA,us be deluded about the other important,80
NA,question of getting hold of the marketing,80
NA,end. What did the late William Morris,80
NA,Hughes do in 1921 when the wool industry,80
NA,"went to him and said, ""The price of wool",80
NA,is down to 6d. a lb.; we want you to do,80
NA,"something about it""? He drafted regula-",80
NA,"tions under the Customs Act, I think, which",80
NA,prescribed that no wool was to be allowed,80
NA,to leave this country under what was then,80
NA,considered to be the bare cost of produc-,80
NA,"tion, namely, 9d. per lb. Areserveprice",80
NA,was to be declared from time to time. Im-,80
NA,"mediately, the people who had been bidding",80
NA,6d. per lb. lifted their bids to over 9d.,80
NA,Some people say that was a purely for-,80
NA,"tuituous circumstance, but the fact remains",80
NA,that the regulation was effective. Until,80
NA,"some drastic action is taken, we shall be",80
NA,"fools in the eyes of the world, because, as",80
NA,the producers of a great product-th e world,80
NA,dishas proved it wants our wool because it,80
NA,a takes it every year-w e do not have sense,80
NA,enough to take steps to have an effective,80
NA,say in the price paid for it.,80
NA,Any man who says that we should ask,80
NA,outrageous prices ought to be examined,80
NA,"mentally, but we have the Bureau of Agri-",80
NA,"he is cultural Economics, estabhshed by a",80
NA,"is Labour Government, which has been",80
NA,for the last ten years. It has,80
NA,the earned the admiration of the whole world,80
NA,by the soundness of its findings. The,80
NA,bureau is capable of telling us the average,80
NA,cost of production of wool. It can assess,81
NA,the cost of production of a highly efficient,81
NA,producer and that of a less efficient pro-,81
NA,ducer and take an average. That infor-,81
NA,mation could be utilized in a pricing,81
NA,"method, or in some other way of dealing",81
NA,"with this very vital and, I believe, im-",81
NA,mediate problem.,81
NA,I want to add a few words about postal,81
NA,charges. I have not time to say very,81
NA,"much, but I do say that it is a well-known",81
NA,fact that from 1901 to 1945 the Post Office,81
NA,paid for all of its capital requirements,81
NA,of its earnings. It is true that since 1945,81
NA,capital works have been provided for out,81
NA,"of Consolidated Revenue, but apparently",81
NA,there has been no very effective bookwas,81
NA,keeping system by which the actual Interest,81
NA,obligations of the Post Office in respect,81
NA,of its more recently borrowed money and,81
NA,in respect of the valuation of its capital,81
NA,property can be ascertained. The Post,81
NA,Office does not seem to have any effective,81
NA,knowledge of these things.,81
NA,It is quite true that at the moment,81
NA,"Post Office is losing some money, but",81
NA,also true that it is unjust to raise extra,81
NA,revenue to meet losses incurred by the,81
NA,Office when a major portion of those losses,81
NA,"is due to the fact that this Government,",81
NA,"and all other governments, as a matter",81
NA,"of policy, have laid it down that country",81
NA,"residents shall have mail deliveries,",81
NA,"phone services, telegraphic services",81
NA,other public services at far below cost.,81
NA,Are we now to tolerate a Government,81
NA,in order to recoup the cost of the services Australian.,81
NA,that have been given to people in isolated,81
NA,"areas, as a matter of pohcy, is going to",81
NA,"load that cost on to, for instance, the",81
NA,humble suburban householder who has a,81
NA,telephone? The husband may be away,81
NA,from home all day. If he is a member,81
NA,"of Parliament, he may be away for a week.",81
NA,Are we to load on to telephone users,81
NA,"the city and, Tjy the same rule, on to",81
NA,"phone users in the country, an obligation",81
NA,"that, in view of the policy of assisting",81
NA,"people of the outback, should properly",81
NA,"discharged from Consolidated Revenue,",81
NA,which every itaxpayer contributes on,81
NA,equitable basis? That .is the place to put,81
NA,the burden. The ;present proposals are,81
NA,just because they penalize non-profit-makmoment,81
NA,"ing organizations, such as religious, sportthat",81
NA,ing and other bodies.,81
The TEMPORARY CHAIRMAN , ( Mr.,81
NA,Wight) -Order ! The honorable member's,81
NA,time has expired.,81
Mr BRIMBLECOMBE ,Maranoa),81
NA,"[9.24] -A t this late stage, when the Budget",81
NA,"debate is drawing to a conclusion, I want,",81
NA,"first of all, to offer my congratulations to",81
NA,the Treasurer ( Mr Harold Holt) on the,81
NA,presentation of his first Budget in this,81
NA,"chamber. I intend, however, despite the",81
NA,"second speech he has delivered, to offer",81
NA,some criticisms of certain matters con-,81
NA,out tained in that Budget.,81
NA,I think this is an appropriate occasion,81
NA,"to pay a tribute to Sir Arthur Fadden, who",81
NA,the Treasurer of this country for so,81
NA,"many years, and who played a very big part",81
NA,in bringing about the sound economic con-,81
NA,ditions which this country enjoys to-day. I,81
NA,think it should be put on record that he,81
NA,played a major part in placing the economy,81
NA,of Australia on a very sound basis. I think,81
NA,it is worth recalling to the minds of some of,81
NA,the younger people in the community that,81
NA,the when he introduced some of his early,81
NA,"it is Budgets, which I well remember, he was",81
NA,criticized by all sections of the people from,81
NA,"Post one side of the country to the other, so",81
NA,much so that at one period he said that he,81
NA,could entertain the only friends he had left,81
NA,"in a telephone box! However, as time went",81
NA,"on, he was proved to be right, and I think",81
NA,telethe great majority of the people of Aus-,81
NA,and tralia now are prepared to say that what,81
NA,Sir Arthur Fadden did was in the interests,81
NA,"that, of his country and that he is a great",81
NA,The honorable member for Lalor ( Mr.,81
NA,Pollard) gave us a dissertation on the posi-,81
NA,tion of the wool industry as he saw it. His,81
NA,speech was in contrast with those made,81
NA,earlier by the honorable member for Pater-,81
NA,son ( Mr Fairhall) and the honorable mem-,81
NA,in ber for St. George ( Mr Clay). They dis-,81
NA,telecussed this matter with a view to advising,81
NA,the people of Australia of what would,81
NA,happen to the country and the great,81
NA,be majority of the workers if the wool market,81
NA,to collapsed any further than it has done in,81
NA,an recent months. I think they did a duty,81
NA,"to their country by stating the facts, and the",81
NA,unpeople of Australia should pause for a,81
NA,to think of the dire circumstances,81
NA,would arise if the wool industry were,81
NA,to go to the wall.,81
NA,"I recall that, not many years ago, when",82
NA,woolgrowers were enjoying high prices for,82
NA,"their wool, they did not receive any sym-",82
NA,pathy from a number of Labour members,82
NA,of this Parliament. I can remember speak-,82
NA,"ing, on this subject in the House. I spoke",82
NA,as the representative of one of the biggest,82
NA,fine woolgrowing electorates in the Com-,82
NA,"monwealth. As a matter of fact, over half",82
NA,"of the sheep in Queensland-11,000,00 0",82
NA,of them-ar e in my electorate. When I,82
NA,"spoke on behalf of the woolgrowers, I was",82
NA,"chided for being parochial, and I was told",82
NA,that I was always looking after the great,82
NA,wool and beef barons. I was chided with,82
NA,"that, and the record can be seen in",82
NA,""" Hansard "". To-day we find that honor-",82
NA,able members opposite are talking in a diff-,82
NA,erent strain. I do not include the honor-,82
NA,able member for St. George in what I am,82
NA,"going to say, because he has already",82
NA,demonstrated that he can see the dangers,82
NA,ahead if any further calamity happens to,82
NA,the wool industry.,82
NA,Members of the Opposition are now dis-,82
NA,playing great sympathy and telling this Go-,82
NA,"vernment, quite rightly, that it should do",82
NA,something to rectify the position. It is,82
NA,their duty to do that sort of thing if they,82
NA,think it is in the interests of the nation.,82
NA,But they should be consistent. The pro-,82
NA,duction of the wool industry is subject to,82
NA,the vagaries of the seasons to a very great,82
NA,extent. The industry also relies on the,82
NA,"auction system, which the growers them-",82
NA,selves have decided they want. The Go-,82
NA,vernment adopts the attitude that if the,82
NA,"growers want a free auction system, they",82
NA,shall have it. It is their product and they,82
NA,should decide the best method for its dis-,82
NA,posal. The honorable member for Lalor,82
NA,has claimed that some of the buyers rig,82
NA,the sales and that a free auction system,82
NA,does not exist. He has said that the buyers,82
NA,go to the sales and make one bid. My,82
NA,"colleague, the honorable member for",82
NA,"Mallee ( Mr Turnbull), has reminded me",82
NA,that the infamous Newmarket one^bid,82
NA,auction was introduced by the Labour,82
NA,Party. What reply can the honorable,82
NA,member for Lalor make to that assertion?,82
NA,During his speech he did not say one word,82
NA,about what that system has cost the primary,82
NA,producers.,82
NA,He said that the Labour Party would,82
NA,trade with any country irrespective of the,82
NA,religious beliefs and political views of. its,82
NA,people. I remind him of the attitude,82
NA,adopted by the Labour Party when this,82
NA,Government announced its intention to,82
NA,enter into a trade agreement with Japan.,82
NA,The Labour Party opposed the move very,82
NA,vigorously and voted against it in this,82
NA,House. How can the honorable member,82
NA,reconcile that fact with his statement to-,82
NA,night that the Labour Party is prepared,82
NA,"to trade with all and sundry, whether it is",82
NA,"red China, Russia or any other ountry?",82
NA,The Labour Party should be consistent in,82
NA,its attitude.,82
NA,I should like to comment on the pro-,82
NA,posal to reduce income tax by 5 per cent.,82
NA,I join with the honorable member for,82
NA,Canning ( Mr Hamilton) in saying that the,82
NA,reduction will be of advantage to only a,82
NA,very small minority of the people. The,82
NA,proposal will benefit those who have assets,82
NA,and will give nothing to those whose income,82
NA,is so low that they are not liable to be,82
NA,taxed. I refer in particular to the great,82
NA,majority of the people whom I represent.,82
NA,One has only to look at the figures to see,82
NA,how income from primary industries has,82
NA,been falling and how costs have been,82
NA,rising. Although the total income from,82
NA,1956-57 to 1958-59 has remained fairly,82
NA,"static, costs in the form of wages, depre-",82
NA,ciation and other charges have risen con-,82
NA,siderably. I venture to say that the great,82
NA,free majority of primary producers will not be,82
NA,"liable for income tax in any case, so they",82
NA,will not receive any benefit from the pro-,82
NA,posed reduction of 5 per cent.,82
NA,I should like to refer now to postal,82
NA,charges. Of all the Ministers who have,82
NA,"participated in this debate, only the Prime",82
NA,"Minister ( Mr Menzies), the Treasurer and",82
NA,the Minister for Supply ( Mr Hulme) have,82
NA,made any reference to this very conten-,82
NA,tious matter. The Prime Minister has,82
NA,announced that some alteration will be,82
NA,made in the bulk postage rates. The,82
NA,"Minister for Supply, in a very brief refer-",82
NA,"ence to the subject, made a poor defence",82
NA,of the proposal to increase the postal rates.,82
NA,The Government would be wise to recon-,82
NA,sider its proposal. I make that statement,82
NA,after having given some thought to the,82
NA,subject. During the last few years I have,82
NA,made it my business to study the operations,82
NA,of the various sections of the Post Office.,82
NA,I have found that senior officers have been,82
NA,able to effect many economies in all,83
NA,branches. During his Budget speech the,83
NA,"Treasurer, referring to the efficiency of the",83
NA,"organization, said-",83
NA,We all know it to be a highly competent,83
NA,"organization-efficientl y managed, devoted to the",83
NA,"service of the public, progressive iu its outlook,",83
NA,eager to meet the ever-increasing demands upon,83
NA,"it for wider and better facilities, lt has had",83
NA,success in this; it has made really great headway,83
NA,in providing Australia with an adequate and up-,83
NA,to-date communications system.,83
NA,I know that statement to be true because 1,83
NA,have investigated the operations of the Post,83
NA,Office. I have visited practically all the,83
NA,large post offices in Australia as well as,83
NA,"many of the smaller establishments, and I",83
NA,have talked with the employees in those,83
NA,places. A committee wiil investigate the,83
NA,capitalization of the Post Office and express,83
NA,it in proper accounting terms. If that com-,83
NA,mittee reports that there is no justification,83
NA,"for the increased charges, I wonder wheth :r",83
NA,the Government will reduce thern. I sup-,83
NA,"pose that, in this instance, any reduction",83
NA,could not be made retrospective.,83
NA,It has been suggested that losses have been,83
NA,sustained by various sections of the Post-,83
NA,master-General's Department. [ agree that,83
NA,there may have been losses in terms of,83
NA,"pounds, shillings and pence, but how can",83
NA,one place a monetary value on the service,83
NA,that the Post Office has given to the people,83
NA,"of Australia, particularly those in the",83
NA,country areas? The Government has a,83
NA,duty to provide services for the people who,83
NA,are prepared to pioneer the outback. Un-,83
NA,less they are given some of the amenities of,83
NA,city life-an d postal and telephone ser-,83
NA,vices are what may be called an essential,83
NA,amenity in the country areas-ho w can the,83
NA,Government expect them to go into the wide,83
NA,open spaces?,83
NA,Every day we read and we hear that it is,83
NA,essential that we produce more and reduce,83
NA,"costs. Industries, particularly primary in-",83
NA,"dustries, in the electorate which I repre-",83
NA,sent are very conscious of the fact that costs,83
NA,must be reduced if vve are to compete in,83
NA,overseas markets. But the manufacturers,83
NA,and the primary producers have no control,83
NA,over the majority of the costs that they must,83
NA,"bear, and this Budget has not given them",83
NA,a lead as to the way in which the question,83
NA,should be approached.,83
NA,I shall state briefly my view on how,83
NA,duction costs may be reduced. First and,83
NA,"foremost, transport costs should be re-",83
NA,viewed. Jf there were some co-ordination,83
NA,between the transport services of the,83
NA,"various States, these costs could be reduced",83
NA,materially. Transport represents between,83
NA,"20 per cent, and 30 per cent, of the cost",83
NA,of primary production. Another way to,83
NA,notable reduce production costs is to assist people,83
NA,engaged in primary industry to obtain up-,83
NA,to-date equipment and thus produce more,83
NA,efficiently. I have in mind especially those,83
NA,who have commenced operations within,83
NA,the last eight or nine years. In my own,83
NA,area those people are well and truly up,83
NA,against it in obtaining finance for modern,83
NA,equipment and taking advantage of the,83
NA,new techniques made available by the,83
NA,Commonwealth Scientific and Industrial,83
NA,"Research Organization. Of course, I am",83
NA,living in hope that the proposed Common-,83
NA,"wealth Development Bank of Australia,",83
NA,"which will commence operations next year,",83
NA,will be able to provide the necessary credit,83
NA,for this purpose nnd for other essential,83
NA,purposes. At present it is difficult to obtain,83
NA,"finance from the trading banks, which",83
NA,prefer to invest in avenues offering quicker,83
NA,returns.,83
NA,Until recent years it was the practice,83
NA,"for the country storekeeper, and the stock",83
NA,"and station agent, to act as a sort of",83
NA,banker for the farmer to carry him over,83
NA,the seasonal period. They could obtain,83
NA,short term credit with which to buy the,83
NA,whole of the sacks or fertilizer needed in a,83
NA,district and could extend similar credit to,83
NA,the primary producers using them. Such,83
NA,short-term credits are no longer available.,83
NA,Their withdrawal is retarding production,83
NA,and is imposing a great handicap on pri-,83
NA,mary producers.,83
NA,At present a convention of scientists is,83
NA,being held in Perth. Once again we have,83
NA,been told that there is a dearth of able,83
NA,scientists in Australia. I shall mention,83
NA,"only one group, for whose services pri-",83
NA,mary industry is crying out. I refer to the,83
NA,aericultural scientists. Why are they not,83
NA,available in greater numbers? Facilities,83
NA,for training young people are provided at,83
NA,"the universities, but pupils are not coming",83
NA,forward for training. When the agricul-,83
NA,tural scientist has taken his degree and,83
NA,progoes out on probation he is paid less than,83
NA,is a plumber. He is the lowest paid of all,83
NA,"scientists, yet this country depends upon",84
NA,the sale of primary produce for the over-,84
NA,seas credit that it needs if it is to buy the,84
NA,material which keeps secondary industry,84
NA,going.,84
NA,Mr Clyde Cameron -Whos e fault is,84
NA,that?,84
Mr BRIMBLECOMBE ,"I t is our fault,",84
NA,and doubtless when Labour was in office,84
NA,it made the same mistake. I ask the Go-,84
NA,vernment to grant more scholarships for,84
NA,work in this faculty; to make the associated,84
NA,grant more liberal; and to ensure that the,84
NA,probationer is given adequate remuneration.,84
NA,It may be said that I have an axe to grind,84
NA,in bringing forward this matter. Indeed I,84
NA,have. Almost all the members of my,84
NA,family are agricultural scientists. They,84
NA,are leaving their government employment,84
NA,because they do not receive sufficient,84
NA,remuneration to make it worth their while,84
NA,to remain. They could make more outside,84
NA,"with private enterprise, or by simply going",84
NA,on the land. Australia cannot afford to,84
NA,"lose agricultural scientists, who are the",84
NA,link between the producers and the sales,84
NA,end. We must encourage them in every,84
NA,way possible. I plead with the Government,84
NA,to look at this matter and ensure that these,84
NA,people are given a decent position in the,84
NA,"list of scientists, which is a very long",84
NA,At present they are at the bottom and there,84
NA,are available very few to fill the positions,84
NA,that are vacant.,84
NA,"Trade is the life blood of this country,",84
NA,and the Minister for Trade ( Mr MCEwen),84
NA,has done a mighty job in promoting,84
NA,"overseas. I recall that, some years ago, he",84
NA,warned Australia that we must encourage,84
NA,our secondary industries because we could,84
NA,not live for ever on our earnings from,84
NA,mary industry. He has done everything in,84
NA,his power to attain that end. We of the,84
NA,Australian Country Party believe that,84
NA,proper balance should be maintained now,84
NA,between the primary and secondary indus-,84
NA,tries. We believe that the home market,84
NA,"the best market, but we have not forgotten",84
NA,that the export market is the most important,84
NA,for the maintenance of this country's,84
NA,economic stability.,84
Mr CLYDE CAMERON ,Hindmarsh) made,84
NA,[9.49] - I think that I ought to tell any,84
NA,who may have been listening to the honorcountry.,84
NA,able member for Maranoa ( Mr Brimble-,84
NA,combe) that he is normally a supporter of,84
NA,the Government. He is an Australian,84
NA,Country Party representative and his party,84
NA,alone is responsible for keeping in office,84
NA,this Government-whic h he has criticized,84
NA,"so correctly, and with such justification.",84
NA,"Indeed, it is his party alone that makes it",84
NA,possible for the Government to increase,84
NA,postal charges in the way that he has,84
NA,criticized. It is the Australian Country,84
NA,Party alone which is responsible for this,84
NA,Government being able to make tremendous,84
NA,reductions in tax on high incomes-givin g,84
NA,practically no benefit to the smaller income-,84
NA,earners whom he mentioned when referring,84
NA,to the primary producers. It is perfectly,84
NA,"correct, as the honorable member said,",84
NA,that there are very few primary producers,84
NA,to-day who will get any benefit at all from,84
NA,the reduction in income tax that is pro-,84
NA,posed in this Government's Budget. On,84
NA,"the other hand, people living in the capital",84
NA,cities who own large parcels of shares in,84
NA,the big concerns which manufacture the,84
NA,things that the primary producer has to,84
NA,buy at a price fixed arbitrarily by the manu-,84
NA,"facturing combines themselves, will have the",84
NA,lion's share of the reduction.,84
NA,If the members on the Government side,84
NA,list. of the chamber who have criticized this,84
NA,Budget in the same way as the Opposition,84
NA,"has criticized it vote, in a few minutes'",84
NA,"time, in accordance with the way in which",84
NA,"they have spoken, the Budget will be re-",84
NA,jected and this Government will have to,84
NA,"face another general election. Of course,",84
NA,it although some honorable members oppo-,84
NA,site often speak against things that the Go-,84
NA,"vernment does, they can always be relied",84
NA,upon to vote for the Government when ita,84
NA,prifate is likely to be in the balance.,84
NA,Whilst it is pleasing to know that some,84
NA,a members of both Government parties are,84
NA,agreeing with the criticisms which the,84
NA,Opposition has levelled against this rich,84
NA,"man's Budget, it would be very much more",84
NA,is pleasing if we could see them match their,84
NA,words with deeds and vote against the,84
NA,Government when the division bells cease,84
NA,ringing and the count of heads takes place.,84
NA,The honorable member for Maranoa,84
NA,yet another important point when he,84
NA,one said that trade is the life blood of this,84
NA,There is no doubt that trade,84
NA,is the life blood of a country.,85
NA,Any government that knows its respon-,85
NA,sibility to its people ought to do every-,85
NA,thing possible to expand trade.,85
NA,"agree that a country should not, of course,",85
NA,send to countries that may become,85
NA,"enemies, strategic raw materials or materials",85
NA,that could be turned into war goods. On,85
NA,"the other hand, I cannot understand the",85
NA,double talk of members of the Liberal Party,85
NA,and Australian Country Party when they,85
NA,"pretend on the one hand, that they are op-",85
NA,"posed to trade with China, but, on the other",85
NA,"hand, do not oppose trade with red Russia.",85
NA,"They are opposed to recognizing red China,",85
NA,yet they are quite prepared to recognize,85
NA,red Russia!,85
NA,The honorable member for Hume ( Mr.,85
NA,Anderson) who is interjecting knows that,85
NA,he sold his wool to red Russia at a time,85
NA,when it seemed that wool would be a very,85
NA,important factor in a war which the Go-,85
NA,vernment had told us was only three years,85
NA,away. This honorable member who always,85
NA,has so much to say about not recognizing,85
NA,"red China, sold his wool to red Russia for",85
NA,no better reason than that red Russia was,85
NA,able to pay him a few pence per pound,85
NA,more for it than anybody else was willing,85
NA,to pay. The primary factor in the honor-,85
NA,"able member's mind was not any "" hi-",85
NA,"falutin "" principle about recognizing Com-",85
NA,"munist countries, but the question of how",85
NA,much more money he could get by selling,85
NA,to red Russia- a country which his own,85
NA,"Prime Minister had told him, in 1951,",85
NA,would be at war with us within three years.,85
NA,That illustrates the kind of split principle,85
NA,that seems to be applied in this question of,85
NA,the recognition of red China.,85
NA,Although the Government talks a lot,85
NA,"about refusing to recognize red China, the",85
NA,Minister for Trade ( Mr MCEwen) has told,85
NA,us that it is now quite in order to sell not,85
NA,only wool and foodstuffs but also steel to,85
NA,red China. This indicates how strong are the,85
NA,Government's moral objections to trade,85
