Speaker,Text,pageNumbers
NA,to the timber trade would be a good,30
NA,national investment. A cycle of employ-,30
NA,ment is created starting with the loggers,30
NA,and the millers in the bush. The mills go,30
NA,into increased production and that provides,30
NA,"employment for bricklayers, tilers, plumbers,",30
NA,electricians and home furnishers. That,30
NA,cycle influences and affects whole sections,30
NA,"of the community, and any move to create",30
NA,employment in this country should be con-,30
NA,sidered carefully by the Government.,30
NA,Unemployment figures have risen from a,30
NA,"minima of 31,000 in 1956, 46,000 in",30
NA,"1957, and 56,000 in 1958, to a minimum",30
NA,"of 63,000 in any month of this year. The",30
NA,unfortunate unemployed and their depen-,30
NA,dants are the people for whom the Budget,30
NA,should have provided a greater measure,30
NA,of social justice. But they are simply,30
NA,referred to by the Government as a per-,30
NA,"centage of the work force, and the Budget",30
NA,contains no mention of any attempt to,30
NA,solve this problem of growing unemploy-,30
NA,ment. This Government has succeeded in,30
NA,its objective of creating a pool of unem-,30
NA,"ployment and, by denying those out of",30
NA,work any increase in the unemployment,30
NA,"benefit, shows itself to be quite indifferent",30
NA,to this great social problem.,30
NA,"In conclusion, I wish to support the",30
NA,"claims made by my colleague, the honor-",30
NA,"are able member for Wilmot ( Mr Duthie), for",30
NA,the provision of television services to the,30
NA,north-west coast of Tasmania as soon as,30
NA,practicable. In this area we are averaging,30
NA,"40 per cent, reception from Melbourne tele-",30
NA,"vision stations and, since television is here",30
NA,"to stay, people there are keen to avail",30
NA,themselves of this medium of entertain-,30
NA,ment. The Government should investigate,30
NA,the possibility of relaying programmes to,30
NA,"the coast, from Melbourne, by means of a",30
NA,"booster station on King Island, or from",30
NA,to Hobart by a booster station on Mount,30
NA,"Roland, and should make television recep-",30
NA,tion available to the isolated mining com-,30
NA,remunities on the west coast by a booster,30
NA,a station on Mount Sedgewick or some,30
NA,other suitable west coast peak.,30
NA,Retailers are reaping a harvest by selling,30
NA,receivers which will be out of,30
NA,date by the time television comes to the,30
NA,north-west coast in its right and proper,31
NA,fashion. If a station can be set up for,31
NA,"£300,000 to £400,000, as mentioned in",31
NA,<ne recent debate on the extension of tele-,31
NA,"vision to country areas, I hope it will not",31
NA,be long before the Postmaster-General,31
NA,approves of the extension of television to,31
NA,the areas I have mentioned.,31
Mr ASTON ,Phillip) [12.37] - I have,31
NA,listened with interest to the first speech,31
NA,the honorable member for Braddon ( Mr.,31
NA,"Davies) on a budget, and I must confess",31
NA,"that I was rather disappointed, because he",31
NA,followed the humdrum line that we have,31
NA,had from the Labour Opposition right,31
NA,throughout this debate. We have heard,31
NA,honorable members opposite trying to whip,31
NA,"into life the old, dead story of unem-",31
NA,"ployment. Surely, Mr Temporary Chair-",31
NA,"man, any political party with any political",31
NA,nous knows that unemployment in this,31
NA,"country is a dead issue-know s that, far",31
NA,"from rising, unemployment has fallen.",31
NA,"Indeed, I have very high hopes that it will",31
NA,continue to fall.,31
NA,The honorable member for Braddon,31
NA,talked about this Government having,31
NA,succeeded in creating a pool of unemploy-,31
NA,ment. To rebut that statement I simply,31
NA,refer the honorable gentleman to the Go-,31
NA,vernment's history over the ten years in,31
NA,"which it has been in office, when, at many",31
NA,"times, we have had full employment in",31
NA,Australia.,31
NA,Like many other members of the Labour,31
NA,"Party, the honorable gentleman looks on",31
NA,Budget-time as a time for gathering round,31
NA,"the Christmas tree, with handouts for",31
NA,"everybody, irrespective of where the",31
NA,finance is to come from. We never hear,31
NA,from the Opposition at Budget-time any,31
NA,constructive suggestion for improving the,31
NA,economy or increasing our expansion and,31
NA,productivity. All we have from it this,31
NA,time is criticism about the level of social,31
NA,"service benents, tax rates and postal",31
NA,"charges. At the same time, honorable",31
NA,"members opposite talk about the "" colossal",31
NA,"profits "" made by large manufacturers and",31
NA,retailers. Surely a little simple arithmetic,31
NA,would tell any one that the creation of a,31
NA,condition of full employment relies on the,31
NA,expansion of the activities of our manu-,31
NA,"facturers, so that the working people of",31
NA,"this country, whom the Opposition claims",31
NA,"to represent here, can have the high",31
NA,standards of living that Australians con-,31
NA,sider necessary. I believe that before the,31
NA,public will ever return the Labour Party,31
NA,"to the treasury bench, that party will have",31
NA,to develop a more national outlook-,31
NA,losing its sectional outlook and abandon-,31
NA,ing its attempt to whip up ill-feeling in,31
NA,the community about class distinctions.,31
NA,The days when that kind of thing meant,31
NA,anything have gone. The people are sick,31
NA,by of it. They have had good government,31
NA,"over the last ten years, and I suggest to",31
NA,honorable gentlemen opposite that at least,31
NA,they should develop a more national out-,31
NA,look for the benefit of this country.,31
NA,"With those few remarks, Mr Temporary",31
NA,"Chairman, I turn now to matters which",31
NA,I believe are important in relation to the,31
NA,Budget. During the Budget speech the,31
NA,Treasurer ( Mr Harold Holt) quite properly,31
NA,referred in commendatory terms to the,31
NA,expansion and increased productivity that,31
NA,had taken place in Australia over the last,31
NA,ten years. He rightly took pride in the,31
NA,"record of the Government which, as a result",31
NA,"of its sound, progressive policy, has main-",31
NA,tained the Australian economy in a most,31
NA,sound and extremely stable position.,31
NA,I was particularly pleased to learn that,31
NA,the Budget provides for increases of age,31
NA,and invalid pensions and repatriation bene-,31
NA,"fits. I point out, however, that these in-",31
NA,"creases, at this particular time, are no",31
NA,more than could reasonably be given by,31
NA,the Government. Particularly do I say so,31
NA,because I feel that there are real prospects,31
NA,of further increases in the prices of con-,31
NA,sumer goods in the ensuing year.,31
NA,Whilst the proposed increases of pen-,31
NA,sions and repatriation benefits are accept-,31
NA,"able, I should prefer to see them coupled",31
NA,with a relaxation of the means test. I,31
NA,share the views of the honorable member,31
NA,for Sturt ( Mr Wilson) on this matter. The,31
NA,means test does not encourage thrift. In,31
NA,"fact, it penalizes those who have taken",31
NA,pains in their early life to save up for their,31
NA,old age. With the proposed increases in,31
NA,the rates of pensions people on super-,31
NA,"annuation, or who come within the ambit",31
NA,"of the means test, will be further pena-",31
NA,lized. Many of them have put their,31
NA,savings into bonds and superannuation,31
NA,"schemes, and have made a contribution to",31
NA,the comforts that they will enjoy-o r hope,31
NA,to enjoy-i n the later stages of their lives.,32
NA,Under the Budget proposals a married,32
NA,couple will be able to receive an income,32
NA,"of £16 10s. a week, made up of their pen-",32
NA,sions and any outside income they may,32
NA,"gain, without affecting their pensions. That",32
NA,is more than £3 above the basic wage.,32
NA,"There are many people who, because of",32
NA,"their thrift, are not receiving this amount",32
NA,into their homes to-day. The return from,32
NA,their investments and the superannuation,32
NA,"benefits for which they have contributed,",32
NA,together do not give them such an income.,32
NA,"Consequently, those people are becoming",32
NA,the new poor of Australia. I urgently sug-,32
NA,gest to the Government that it give con-,32
NA,sideration to a further alleviation of the,32
NA,"means test so as to embrace these people,",32
NA,who at present are being penalized because,32
NA,of their past thrift.,32
NA,"Thrift, of course, should be encouraged,",32
NA,not discouraged. As a result of the con-,32
NA,tinued application of the means test people,32
NA,"who might otherwise save to support, or",32
NA,"help to support, themselves in their old",32
NA,"age, will squander their savings so that",32
NA,they will be eligible to receive pensions.,32
NA,Most honorable members have experiences,32
NA,of people telling them of their financial,32
NA,position and wanting to know how far they,32
NA,must bring their assets down in order to,32
NA,receive a pension without being affected,32
NA,"by the means test. I believe, Sir, that this",32
NA,position should be avoided. I realize that,32
NA,wherever we draw the line in relation to,32
NA,the means test there will always be some-,32
NA,body above it and somebody else below it.,32
NA,"At the same time, however, when we con-",32
NA,sider that a pensioner couple may have an,32
NA,"income of £16 10s. a week, without their",32
NA,"pensions being affected, and without their",32
NA,"having had to save a penny towards it, we",32
NA,can see that people who did save for the,32
NA,future are being penalized.,32
NA,Another matter touching social services,32
NA,to which I wish to refer is the funeral,32
NA,benefit. I believe that the funeral benefit,32
NA,has not been increased since 1943. It still,32
NA,stands at the princely sum of £10. Every-,32
NA,body knows of the increases in costs that,32
NA,"have occurred since 1943, particularly",32
NA,"funeral costs, which seem to have risen",32
NA,to an exorbitant degree. In most cases it,32
NA,is the relatives of a deceased age pen-,32
NA,sioner who have either to pay for the,32
NA,"funeral in full or contribute to its cost,",32
NA,although many aged pensioners do manage,32
NA,to scrape from their pensions a few shillings,32
NA,"each week, which are put aside to help",32
NA,them to keep their pride by knowing that,32
NA,they will have a decent burial. I submit,32
NA,that £10 as a funeral benefit is grossly in-,32
NA,"adequate at this time, and the Government",32
NA,should look at this with a view to increas-,32
NA,ing it to an amount more in keeping with,32
NA,actual funeral costs to-day.,32
NA,Sitting suspended from 12.45-to 2.35 p.m.,32
Mr ASTON ,Prio r to the suspension,32
NA,of the sitting I made a plea to the Govern-,32
NA,ment to make some modification in the,32
NA,means test and also to increase funeral,32
NA,benefits. The cost to the community of,32
NA,"social services must inevitably increase,",32
NA,but at the same time I believe that the,32
NA,majority of Australians will accept that,32
NA,cost if it means that the aged and the,32
NA,sick in the community will enjoy a better,32
NA,"standard of living, provided, of course,",32
NA,that social services are based on needs.,32
NA,I was extremely disappointed that the,32
NA,"Budget, except for a liberalization of the",32
NA,"retention allowance for private companies,",32
NA,did not give any incentives for the expan-,32
NA,sion of the private sector of the economy.,32
NA,It may be argued that public works in,32
NA,themselves add to the expansion and are an,32
NA,"encouragement to the private sector, but",32
NA,I believe that the private sector of the,32
NA,economy deserves some other incentives.,32
NA,The Treasurer in his Budget speech re-,32
NA,peatedly acknowledged the part played by,32
NA,industry and on several other occasions he,32
NA,has emphasized the role of industry in the,32
NA,past ten years. He posed the question:,32
NA,Can this development be equalled or sur-,32
NA,passed in the next decade? I believe that,32
NA,"the answer is "" Yes""; but I also believe",32
NA,that encouragement for industry to achieve,32
NA,still higher production and efficiency and,32
NA,to reduce costs of production must be,32
NA,"given, and not given too late.",32
NA,In recent years our work force has in-,32
NA,creased considerably. In the last four,32
NA,years it has increased by approximately,32
NA,"60,000 persons a year and now numbers",32
NA,"approximately 4,000,000 people. By 1970",32
NA,it is anticipated that the work force will,32
NA,"total 5,300,000 people, or an increase of",32
NA,"1,300,000 people in ten years. This is a",32
NA,"rate of 2.6 per cent, per annuni compared",33
NA,"with 1.6 per cent, in recent years. It is",33
NA,"estimated that in 1960 104,000 additional",33
NA,workers will be available for employment.,33
NA,Opportunities for employment must be,33
NA,available immediately if we are to main-,33
NA,tain or improve our low unemployment,33
NA,"percentage and our standard of living, and",33
NA,to increase our productivity level. The,33
NA,manufacturing industries will be called,33
NA,"upon to absorb approximately 40,000 of",33
NA,the additional work force. It is well to,33
NA,note that the yearly absorption rate over,33
NA,the last two years has been approximately,33
NA,"16,000 people. It is obvious therefore that",33
NA,employment will have to be found for,33
NA,approximately two and one half times the,33
NA,number now absorbed yearly.,33
NA,Those figures show quite starkly the,33
NA,magnitude of the problem ahead and repre-,33
NA,sent a challenge that must be faced by,33
NA,industry. One cannot fail to conclude that,33
NA,unless these additional persons are readily,33
NA,"absorbed into employment, our internal",33
NA,economy may require some unpleasant,33
NA,adjustments.,33
NA,"In addition to these responsibilities, in-",33
NA,dustry and commerce must play a leading,33
NA,role in fulfilling our much needed export,33
NA,requirements. The Export Development,33
NA,Council has reached tbe conclusion that if,33
NA,we are to avoid continual balance of pay-,33
NA,ments problems we must extend our income,33
NA,"from trading overseas by £250,000,000",33
NA,"within the next five years, or at the rate",33
NA,"of £50,000,000 a year. The report of the",33
NA,Export Development Council states-,33
NA,"Prospects in traditional markets, particularly",33
NA,"for agricultural foodstuffs, were not encouraging",33
NA,although exports of basic raw materials would,33
NA,improve if economic growth was maintained,33
NA,abroad. . . .,33
NA,To earn the export income needed to support,33
NA,"economic development, ever increasing attention",33
NA,must be devoted to manufactured and semi-,33
NA,manufactured products.,33
NA,The council points out that although,33
NA,spects for wool exports are somewhat enit,33
NA,couraging-thi s has proved to be correct-,33
NA,there is less optimism for wheat exports,33
NA,the next five years.,33
NA,The council believes that the chief possioverall,33
NA,bilities for growth in overseas sales lie,33
NA,"iron and steel products, motor vehicles,",33
NA,"agricultural machinery and parts, engineertaxes",33
NA,"ing products, tools, hardware and",33
NA,products. Those articles at present are,33
NA,supplied and manufactured by secondary,33
NA,industries. It can be seen clearly then that,33
NA,industry is urgently in need of encourage-,33
NA,ment if it is to gear itself to the task ahead.,33
NA,"The building of great factories, the carrying",33
NA,"out of more scientific experiments, and the",33
NA,improving of efficiency depend very greatly,33
NA,on the ability of industry to meet the chal-,33
NA,"lenge of absorption, productivity and in-",33
NA,"creased sales abroad, all of which are vital",33
NA,to our economy.,33
NA,A great deal has been done to advertise,33
NA,Australian goods in overseas markets. But,33
NA,much more must be done in this field to,33
NA,secure the necessary expansion and provide,33
NA,the incentive to sell or market overseas.,33
NA,Our commercial undertakings and manu-,33
NA,facturing industries must become conscious,33
NA,of the advantages of trading with Asian and,33
NA,"other countries. Australia is a young, pro-",33
NA,gressive and expanding country. We enjoy,33
NA,the confidence of the free world. We,33
NA,"should not be afraid of incipient inflation,",33
NA,however much we may dislike the idea of,33
NA,"inflation, because a young country expand-",33
NA,ing as rapidly as Australia has been expand-,33
NA,ing in the past can hardly avoid some,33
NA,measure of inflation if it is to go forward.,33
NA,A too cautious attitude could have severe,33
NA,limiting effects on the rate of our expansion,33
NA,and development. If we are to avoid being,33
NA,priced out of overseas markets and if we,33
NA,are to reduce the cost of living on the con-,33
NA,"sumer market in Australia, costs of manu-",33
NA,facture must be kept to a minimum.,33
NA,It may be pointed out that undoubtedly,33
NA,the proposed increase in telephone and,33
NA,postal charges will be borne in the main by,33
NA,"industry. Those increases, together with",33
NA,"the recent basic wage increase, must have a",33
NA,substantial and unavoidable effect on costs,33
NA,in Australia. Industry generally will not,33
NA,"be content to bear those costs and, as a",33
NA,"consequence, will pass them on to the con-",33
NA,prosumer. I suggest to the Government that,33
NA,may see fit to examine the range of taxes,33
NA,"that add to inflation-taxe s which, when",33
NA,in trade and industry are playing and will,33
NA,continue to play an increasing part in our,33
NA,"economy, inflate the prices at which",33
NA,in we are required to sell overseas or on the,33
NA,consumer market. Such taxes are retarding,33
NA,and should be either progressively,33
NA,similar reduced or abolished altogether.,33
NA,This brings me to the point that the,34
NA,Government should have considered some,34
NA,"measure of relief in pay-roll tax, either in",34
NA,"the form of reduction in the rate of the tax,",34
NA,"an increase in the deductible allowance, or,",34
NA,"less probable, its total abolition. To my",34
NA,mind that would have had the effect of,34
NA,reminding industry that the Government,34
NA,had not entirely forgotten it and was con-,34
NA,cerned with the magnitude of the task that,34
NA,lies ahead. I do not want it to be thought,34
NA,that I believe that industry is not doing,34
NA,"well at present. In fact, industry and com-",34
NA,merce have improved their positions in,34
NA,recent years and have made good profits,34
NA,and achieved good trading results. I think,34
NA,any fair-minded person will agree that had,34
NA,it not been for the fact that industry and,34
NA,commerce have been able to progress and,34
NA,"make profits, our economy would not be in",34
NA,its present healthy state.,34
NA,Relief from the pay-roll tax would,34
NA,"stimulate the development, expansion and",34
NA,"progress of industry, and it would encourage",34
NA,the inflow of capital investment which is,34
NA,imperative if we are to get the new build-,34
NA,ings and capital equipment which are so,34
NA,necessary for the expansion of our eco-,34
NA,nomy. If the Government had taken any,34
NA,"of the courses that I have suggested, it",34
NA,would have added to the capacity to reduce,34
NA,the prime cost of goods to the manufacturer,34
NA,and to reduce the sale price to the distri-,34
NA,"butor or retailer, whose profits would be",34
NA,"struck at the lower cost level. This, in",34
NA,"turn, would result in the capacity to sell",34
NA,our commodities to the community at,34
NA,"generally lower prices and, at the same",34
NA,"time, would strengthen our trade with other",34
NA,countries by making our prices more com-,34
NA,petitive in the world's markets.,34
NA,"The pay-roll tax, Sir, was introduced in",34
NA,"1941, and it is estimated that, in the current cluding",34
NA,"financial year, it will return some",34
NA,"£53,000,000 to revenue. As I shall show,",34
NA,the burden of this tax is placed mainly on,34
NA,industry and the manufacturer. The pay-,34
NA,roll tax has quite frequently been related to,34
NA,the financing of child endowment. It has,34
NA,been said that child endowment is part of,34
NA,"the wage structure and, therefore, a logical",34
NA,addition to the costs of the employer. The,34
NA,"basic wage, however, is now fixed on the",34
NA,basis of the capacity of industry to pay and,34
NA,on the needs of the family wage-earner.,34
NA,and therefore the employer virtually con^,34
NA,"tributes twice, owing to the increased wages",34
NA,resulting from the method of fixing the,34
NA,"basic wage, and owing to the imposition",34
NA,of this iniquitous tax. As the basic wage,34
NA,takes into consideration the needs of the,34
NA,"family man, child endowment becomes a",34
NA,straight-out social service obligation. I do,34
NA,not support the contention that any parti-,34
NA,cular section of the community should be,34
NA,called upon to finance any particular part,34
NA,of social service benefits. Social services,34
NA,should be the responsibility of the whole,34
NA,"community, and child endowment should",34
NA,not be regarded differently from any other,34
NA,social service benefit such as age pensions,34
NA,or medical benefits.,34
NA,All State governments and local,34
NA,"authorities pay this tax, which, in turn,",34
NA,increases the costs of State railways and,34
NA,"public transport, with consequent increases",34
NA,in fares and freight rates. This further adds,34
NA,to the costs of industry and consumers. It is,34
NA,interesting to analyse the break-up of the,34
NA,sources of pay-roll tax. State government,34
NA,instrumentalities and State government de-,34
NA,partments and local government authorities,34
NA,"contribute between them £15,000,000 a",34
NA,"year. Manufacturing, building and con-",34
NA,"struction industries contribute £25,000,000.",34
NA,Distributing wholesalers and retailers con-,34
NA,"tribute £4,000,000 each. Primary produc-",34
NA,"tion, including mining, contributes",34
NA,"£3,000,000, and all others not shown in",34
NA,the preceding categories contribute,34
NA,"£2,000,000. This gives a total pay-roll tax",34
NA,"yield of £53,000,000. It can readily be",34
NA,"seen that the manufacturing, building and",34
NA,construction employers pay almost one-half,34
NA,"of the tax, and that commerce, in the form",34
NA,"of wholesalers and retailers, pays",34
NA,"£8,000,000, whereas primary industry, in-",34
NA,"mining, contributes only",34
NA,"£3,000,000. The burdensome tax has an",34
NA,"undoubted inflationary effect, and its sec-",34
NA,tional application can readily be seen by,34
NA,reference to the figures which I have just,34
NA,given.,34
NA,"If the pay-roll tax were to be abolished,",34
NA,the net loss to revenue would not necessarily -,34
NA,"total £53,000,000, for the loss could be",34
NA,offset in a number of ways. Grants to the,34
NA,States could be reduced by the amount of,34
NA,pay-roll tax that the State governments are,34
NA,"now called upon to pay-£15,000,00 0 a",34
NA,year. The yield of company tax and tax,35
NA,on income derived from companies would,35
NA,be increased. As pay-roll tax payments,35
NA,are deductible from gross figures before the,35
NA,"profit or loss is struck, it is estimated",35
NA,the abolition of the tax would result in,35
NA,"additional revenue of £13,000,000 from",35
NA,this source. It can be seen that these two,35
NA,factors alone would increase the Govern-,35
NA,"ment's revenue by £28,000,000. If we",35
NA,add to this the savings that the Govern-,35
NA,ment would make in lower costs for goods,35
NA,"and services, together with the saving of",35
NA,expenditure resulting from the necessary,35
NA,"readjustment of the staff policing the tax,",35
NA,we could conservatively take the total gain,35
NA,"to £30,000,000. This would leave a loss",35
NA,"to revenue of only £23,000,000 from the",35
NA,total abolition of the pay-roll tax.,35
NA,As it is estimated that the returns from,35
NA,income tax will be reduced by more than,35
NA,"£22,000,000 as a result of the tax con-",35
NA,"cessions in this Budget, the pay-roll tax",35
NA,could well have been abolished and the,35
NA,benefit spread over the whole community.,35
NA,This would have made a real contribution,35
NA,towards stability by removing an inflation-,35
NA,ary medium from our economic structure.,35
NA,The abolition of this tax would have made,35
NA,the prices of our exports more highly com-,35
NA,"petitive with those of overseas products,",35
NA,and home-consumption prices would have,35
NA,been reduced. The private investment of,35
NA,capital would have been given a fillip which,35
NA,industry will most certainly need if it is to,35
NA,undertake the task of expansion ahead.,35
NA,"Therefore, I ask the Government to con-",35
NA,"sider the abolition, or, alternatively, the",35
NA,"reduction, of this iniquitous tax. It is dis-",35
NA,"criminatory and sectional, and it is imposed",35
NA,only on the employer of labour. It does,35
NA,not apply to other kinds of business people,35
NA,whose businesses may be equally as profit-,35
NA,"able, or even more profitable-fo r example,",35
NA,"farmers and graziers, who qualify for",35
NA,exemption.,35
NA,This tax penalizes the employer for effi-,35
NA,ciency and for increasing his staff. The,35
NA,"more workers he employs, the more tax",35
NA,"he is called upon to pay. In fact, he is",35
NA,penalized for increasing the work force-,35
NA,the very thing for which incentive should,35
NA,be given. Pay-roll tax must be paid by the,35
NA,the employer regardless of whether his,35
NA,operations show a profit or a loss. In,35
NA,"respect, to my mind, this tax disregards",35
NA,basic principle of taxation-tha t a tax must,35
