Speaker,Text,pageNumbers
NA,arisen which this Parliament cannot pass by,42
NA,in the manner in which the Prime Minister,42
NA,( Mr Menzies) evidently proposes to pass it,42
NA,by. The Prime Minister has a responsibility,42
NA,to this Parliament as well as to his own,42
NA,party. When this matter was mentioned a,42
NA,"few days ago, reference being made to the",42
NA,allegations of Messrs. Pringle and Shand,42
NA,concerning the Government and the Minis-,42
NA,"ter, the Prime Minister suggested that the",42
NA,whole affair was a kind of a stunt. The,42
NA,following day a member of his own party,42
NA,"supported the allegations, and the Prime",42
NA,Minister did not attempt then to dismiss,42
NA,them as a stunt. He went further and said,42
NA,that the matter had become a political issue,42
NA,"because an election was approaching, and",42
NA,that we of the Opposition were merely ex-,42
NA,ploiting it for political purposes. I say,42
NA,definitely that a case has been made out that,42
NA,warrants the appointment of a royal com-,42
NA,"mission, as proposed in the amendment of",42
NA,the Deputy Leader of the Opposition ( Mr.,42
NA,Whitlam).,42
NA,To-day a further witness comes into the,42
NA,picture. An article in this morning's,42
NA,""" Sydney Morning Herald "" reads-",42
NA,"Mr Shand said last night lhat on July 29, 1961,",42
NA,Captain Smith,42
NA,"Captain Smith, I may say, is connected with",42
NA,East-West Airlines-,42
NA,submitted the following record of the meeting:,42
NA,""" The result was:-",42
NA,""" 1. A better understanding of our position in",42
NA,relation to the requirements of the,42
NA,"Government, to know everything that",42
NA,East-West Airlines is planning if it wants,42
NA,its subsidy to continue.,42
NA,""" 2. Definite knowledge that the Minister would",42
NA,like to see East-West Airlines join ihe.,42
NA,Ansett Transport Industries group. It,42
NA,is my opinion that he would be in favour,42
NA,of this without caring very much how,42
NA,ii was accomplished.,42
NA,""" 3. The Minister, and to a degree, the Director-",42
NA,"General, were infuriated by the com-",42
NA,pany's approach to the N.S.W. Govern-,42
NA,"ment, with its subsequent promise of",42
NA,support for East-West Airlines and bad,42
NA,publicity for Ansett.,42
NA,""" 4. The Director-General gave a resume of the",42
NA,assistance that the department had given,42
NA,"to East-West Airlines, which, it would",42
NA,appear was responsible for almost every-,42
NA,thing that East-West Airlines has,42
NA,"achieved to date, and effectively",42
NA,punctuated his remarks with brief,42
NA,references to the difficulty that ihe,42
NA,Minister would experience in paying a,42
NA,subsidy to a company that did not place,42
NA,"its destiny entirely in his hands, or words",42
NA,to that effect.,42
NA,""" Senator Paltridge was completely",42
NA,honest in his talks and does not bear,42
NA,any malice towards East-West Airlines.,42
NA,Indeed he was very friendly. Both of,42
NA,"these men, however, would, for various",42
NA,"reasons, be prepared to see East-West",42
NA,Airlines sacrificed on the altar of,42
NA,rationalisation in order to make their,42
NA,two-airline policy work. We must never,42
NA,"Jose sight of this fact.""",42
NA,The position is lhat two reputable citizens,42
NA,have made allegations against a responsible,42
NA,Minister of this Government. Those allega-,42
NA,"tions have, in effect, been confirmed by a",42
NA,Government supporter in this House.,42
NA,To-day we have a fourth person coming,42
NA,"into the picture, Captain Smith. I say that",42
NA,a prima facie case has been established,42
NA,that calls for an investigation. It is im-,42
NA,quite possible to escape that conclusion. I ask,42
NA,the Government: How serious or how grave,42
NA,must allegations be before the Government,43
NA,will make a move? The Prime Minister and,43
NA,the members of his Government seem to be,43
NA,concerned only with their own personal,43
NA,"prospects, rather than with the well-being",43
NA,and prestige of this Parliament. The posi-,43
NA,tion of the Parliament was well stated by the,43
NA,"late honorable member for Barker, Mr.",43
NA,"Archie Cameron, in 1948, when he was",43
NA,speaking in this House about the appoint-,43
NA,ment of a royal commission to investigate,43
NA,a matter involving a Minister of the Crown.,43
NA,"May I say, incidentally, that the royal com-",43
NA,mission was appointed at the request of the,43
NA,Minister himself at that time. That Minis-,43
NA,ter is now the honorable member for East,43
NA,Sydney ( Mr Ward). The late Mr Cameron,43
NA,said-,43
NA,The time-honoured procedure of democratic,43
NA,"government in British countries is that, as soon as",43
NA,a Minister is called into question in relation to his,43
NA,transactions and his reputation as they touch the,43
NA,"administration of his department, he shall with-",43
NA,draw from the administration of the department,43
NA,until his reputation and his administration have,43
NA,been cleared by competent authorities. Precedents,43
NA,for such a course of action have occurred in this,43
NA,Parliament during my membership of it and during,43
NA,the membership of many other honorable members,43
NA,on both sides of the chamber. A precedent,43
NA,occurred recently in the United Kingdom.,43
NA,To-day's press contains references to the return,43
NA,"to the Attlee Government of Dr Hugh Dalton,",43
NA,who left that Government last year in circum-,43
NA,stances which were not without precedent in the,43
NA,United Kingdom Parliament. Dr Dalton was not,43
NA,charged with any impropriety; he had merely made,43
NA,a slip in regard to the disclosure of some informa-,43
NA,tion contained in the United Kingdom Budget.,43
NA,"On 3rd November, 1938, the then Postapplied",43
NA,"master-General, Senator A. J. MCLachlan, business?",43
NA,after a question concerning his activities had,43
NA,been placed on the notice-paper of the West,43
NA,House of Representatives by the honorable company?,43
NA,"member for Brisbane ( Mr George Lawson),",43
NA,"tendered his resignation, which read, in",43
NA,part-,43
NA,Having regard to the suggestion,43
NA,question that I may in some obscure way have,43
NA,"influenced the department, I feel that one course",43
NA,"only is open to me, and that is to tender my",43
NA,resignation as Postmaster-General. This I do with,43
NA,"some reluctance at such a time, but the protection",43
NA,of my honour and the honour of the,43
NA,against any insinuation that underlies the question,43
NA,on the notice-paper leaves no other course open,43
NA,"to me, and appears to be the one I should adopt",43
NA,under the circumstances.,43
NA,While speaking in the Senate on the day,43
NA,"on which he tendered his resignation,",43
NA,Senator MCLachlan said-,43
NA,My only regret is that the public life of this,43
NA,democracy has sunk so low that it should be for,43
NA,one moment suspected that a man would abuse,43
NA,the trust reposed in him by the Crown. I say that,43
NA,it is a degradation of democracy that such a,43
NA,charge should be made. My personal honour is,43
NA,dearer to me than all the pelf in the world.,43
NA,It is quite obvious that a very strong case,43
NA,has been made out: for government action.,43
NA,The Opposition is not alone in holding this,43
NA,opinion. Reference has been made to,43
NA,reaction throughout the country to these,43
NA,allegations. A n editorial in this morning's,43
NA,""" Sydney Morning Herald "" said-",43
NA,"If, however, as a great many people will prefer",43
NA,"to believe after Mr Drummond's revelations, the",43
NA,Federal Government through the Minister for,43
NA,Civil Aviation tried to intimidate a small private,43
NA,airline into surrendering to a big competitor mani-,43
NA,festly favoured by ths Government in other direc-,43
NA,"tions, then the affair assumes the proportion of a",43
NA,serious scandal. That the Government should,43
NA,intervene at all in such an issue is beyond all,43
NA,propriety. That it should intervene to promote,43
NA,a monopoly and force free-enterprise competition,43
NA,out of existence is the grossest possible betrayal of,43
NA,the principles it is pledged to uphold.,43
NA,"It is quite true, as the speaker who preceded",43
NA,"me in this debate said, that the Sydney",43
NA,""" Daily Telegraph"", in its editorial of",43
NA,"yesterday, expressed support of the Govern-",43
NA,ment. It may be of interest to the House if,43
NA,I read some remarks that appeared in that,43
NA,editorial-,43
NA,Is it rational to take away a business-an d an,43
NA,air route is a business-tha t a company may have,43
NA,built up at considerable expense and give it to,43
NA,someone else?,43
NA,What would the response be if the Government,43
NA,the same principle to other kinds of,43
NA,"And, looking at it soberly, why should the",43
NA,Government have to move in to protect East-,43
NA,Airlines any more than it protects any other,43
NA,I may add that the only company in this,43
NA,field that it has protected is Ansett-A.N.A.,43
NA,Six companies have disappeared from the,43
NA,"civil aviation field, as I said earlier. The",43
NA,underlying the leader continues-,43
NA,"Takeover bids, in any case, are masters between",43
NA,"companies, and not the concern of governments.",43
NA,East-West Airlines has a comparative handful,43
NA,of shareholders. Ansett has thousands of share-,43
NA,holders who have just as much right to con-,43
NA,Government sideration as any others.,43
NA,That last paragraph is a rather illuminating,43
NA,"one to find in a leader in the "" Daily Tele-",43
NA,"graph"". That newspaper, as would be",43
NA,"expected, comes down on the side of mono-",44
NA,poly. I should say that people in small,44
NA,enterprises will be disturbed to find that,44
NA,that newspaper has very little to say for,44
NA,them.,44
NA,Mr Reynolds -Th e honorable member,44
NA,"knows the record of the "" Daily Telegraph """,44
NA,in take-overs.,44
Mr OCONNOR ,A s my honorable,44
NA,"friend has intimated, the Sydney "" Daily",44
NA,"Telegraph "" has indulged in take-overs, but",44
NA,so far it has not come out of them very,44
NA,well. The extract that I have just read,44
NA,from the newspaper's leader is typical of,44
NA,sort of thing that one would expect of a,44
NA,newspaper company that has made many,44
NA,thousands of pounds out of the community,44
NA,"in New South Wales and, for the assistance",44
NA,"of the community, can do nothing better",44
NA,"than endow to the tune of £10,000 a race",44
NA,"run at Randwick each year. The needy,",44
NA,the poor and those who are destitute receive,44
NA,nothing at all from the people who conduct,44
NA,"the "" Daily Telegraph "" newspaper. The",44
NA,proprietors of that journal consider that,44
NA,most worth-while contribution to com-,44
NA,munity welfare can be made by donating,44
NA,"£10,000 to the Australian Jockey Club in",44
NA,Sydney. The attitude of those who conduct,44
NA,this newspaper speaks for itself.,44
NA,I return now to the speech made last,44
NA,evening by the Prime Minister. Among,44
NA,"other things, he tried to evade the issue",44
NA,on the question of whether the statement,44
NA,alleged to have been made by the Minister,44
NA,for Civil Aviation was in fact made. The,44
NA,"Prime Minister, nowhere in his speech,",44
NA,faced up to that issue. He consistently,44
NA,ran away from it and tried to impose his,44
NA,own strangely improvised statute of limita-,44
NA,tions. He tried lo make out that the lapse,44
NA,of eighteen months since the incident in,44
NA,question was supposed to have happened,44
NA,was a sufficiently long time to warrant his,44
NA,refusing to consider the matter further.,44
NA,This brings me back to the Royal Com-,44
NA,mission on Timber Rights in the Territory,44
NA,"of Papua-New Guinea, which I mentioned",44
NA,"earlier. As I have said, that commission",44
NA,"was appointed, at the request of the honor-",44
NA,"able member for East Sydney, by letters",44
NA,"patent dated llth January. 1949, to inquire",44
NA,into certain transactions in relation to,44
NA,timber rights in the Territory of Papua,44
NA,"and New Guinea. The royal commissioner,",44
NA,"in the introduction to his report, stated-",44
NA,This inquiry arose out of a transaction embodied,44
NA,in two Deeds dated respectively the 19th Decem-,44
NA,"ber, 1944, and the 20th November, 1945 . . .",44
NA,"Incidentally, I may say that I do not think",44
NA,that any man has ever been acquitted so,44
NA,clearly and definitely of charges made,44
NA,against him as was the honorable member,44
NA,for East Sydney on that occasion.,44
NA,The pertinent point that I am making is,44
NA,that that royal commission was not appointed,44
NA,until about four years after the times in 1944,44
NA,and 1945 to which the allegations related.,44
NA,What a fatuous approach has been adopted,44
NA,the by the Prime Minister towards the matter,44
NA,at present at issue in attempting to play,44
NA,down its importance by stating that the,44
NA,allegations relate to a time eighteen months,44
NA,ago! Surely the time is not relevant. The,44
NA,"important question that should be answered,",44
NA,not only on behalf of the Minister but also,44
NA,on behalf of the Government is: Were these,44
NA,statements really made? Are the allegations,44
NA,correct or incorrect? If one accepts the,44
NA,"reasoning of the Prime Minister, one will",44
NA,"the take the view that, if more than eighteen",44
NA,months have elapsed since an incident is,44
NA,"alleged to have occurred, an inquiry into it",44
NA,"is impossible. Significantly, the Prime",44
NA,Minister at no time faced up to the ques-,44
NA,tion of whether the statement alleged to,44
NA,have been made was in fact made.,44
NA,I consider that the allegations are of such,44
NA,a kind as to warrant full investigation. I,44
NA,offer no opinion at all about whether they,44
NA,are correct or otherwise. I prefer to believe,44
NA,that they are not. Party opportunism and,44
NA,party advantage seem to have become the,44
NA,main considerations for the Prime Minister.,44
NA,He has accused us of participating in a,44
NA,political stunt by raising this matter on the,44
NA,"eve of an election, but his approach to the",44
NA,issue and his actions in relation to it leave,44
NA,him open to the charge that he is not un-,44
NA,mindful of the possible effect on the Go-,44
NA,vernment's election prospects of the appoint-,44
NA,ment of a royal commission now.,44
NA,"I appeal to the Government, even at this",44
NA,"late stage, to lake the right course and to",44
NA,uphold the standards of this House and of,44
NA,public life generally in Australia. In this,44
NA,"instance, prima facie evidence which has",44
NA,"been submitted to this House comes, not",44
NA,"from one reputable person, but from no",44
NA,fewer than four. How many persons does,45
NA,the Government require to make and sub-,45
NA,stantiate allegations before it will act? A,45
NA,sufficient answer is not to be found by say-,45
NA,ing that cordial relations have existed be-,45
NA,tween the Minister for Civil Aviation and,45
NA,East-West Airlines in the last eighteen,45
NA,"months, the cordiality of those relations",45
NA,"being shown in correspondence, and that",45
NA,this in itself is a sufficient reason why the,45
NA,matter need not be investigated. I say that,45
NA,this Parliament has a clear responsibility to,45
NA,investigate the issue and that it will fail to,45
NA,discharge that responsibility if it does not,45
NA,take the course suggested by the Deputy,45
NA,Leader of the Opposition. For these,45
NA,"reasons, I support the amendment that he",45
NA,has proposed.,45
Mr CHANEY ,Perth) [3.23] - Mr .,45
NA,Deputy Speaker,45
NA,NA,45
Mr CHANEY ,Th e honorable member,45
NA,ought to wait for it and not become tion,45
NA,"impatient. Probably, until the Deputy",45
NA,Leader of the Opposition ( Mr Whitlam),45
NA,"proposed his amendment, most of the bad light.",45
NA,speeches made in this debate had little or,45
NA,no relation to the bill. Now that the,45
NA,"amendment is before the House, honorable",45
NA,"members are at liberty, under the Standing",45
NA,"Orders, to discuss the matters that have",45
NA,arisen in the way in which the honorable,45
NA,member for Dalley ( Mr O'Connor) dealt will,45
NA,with them. He took as the authority for,45
NA,"his remarks the "" Sydney Morning Herald",45
NA,newspaper. I do not know whether or not on it.,45
NA,that newspaper can be relied on for,45
NA,accuracy. 1 think that most honorable,45
NA,members have learned that what the newsno,45
NA,"papers print is not always accurate. Indeed,",45
NA,honorable members on both sides of the this,45
NA,House have at various times had occasion,45
NA,complain in this place of gross misrepreproportions,45
NA,sentation in the newspapers.,45
NA,The text of the remarks made by the,45
NA,honorable member for Dalley was a passage,45
NA,"from a "" Sydney Morning Herald "" report,",45
NA,which was in these terms-,45
NA,Mr Shand said last night that on July,45
NA,Captain Smith submitted the following record of,45
NA,the meeting:,45
NA,"The details then follow, and the record of",45
NA,the meeting continues-,45
NA,Senator Paltridge was completely honest in his,45
NA,talks and does not bear any malice towards East-,45
NA,West Airlines.,45
NA,This is a record of the proceedings at a,45
NA,"meeting which took place on 7th July, 1960",45
NA,-mor e than twelve months before the,45
NA,account was submitted by Captain Smith.,45
NA,"As I have said, I do not know whether the",45
NA,statements made are true. I do not know,45
NA,whether or not to believe the newspaper.,45
NA,An Opposition member may accept this,45
NA,"statement, which was made more than",45
NA,"twelve months after the meeting, as being",45
NA,"an accurate record of what occurred, but I",45
NA,"refuse to believe that, even three weeks after",45
NA,"a meeting, somebody could commit to",45
NA,paper an account as long as that and vouch,45
NA,absolutely for its accuracy. We have had,45
NA,quoted in this House passages from corre-,45
NA,spondence between East-West Airlines,45
NA,Limited and the Minister for Civil Aviation,45
NA,(Senator Paltridge). Which account do we,45
NA,believe?,45
NA,I think it is unfortunate that the Opposi-,45
NA,"has attempted, in this debate, in some",45
NA,way or other to put the honorable member,45
NA,for New England ( Mr Drummond) in a,45
NA,NA,45
Mr CHANEY ,T o any one on this side,45
NA,"of the House, it appears to be a bad light.",45
NA,If you study carefully what he said you,45
NA,see that it is totally different from the,45
NA,interpretation that the newspapers and,45
NA,""" honorable members opposite are putting",45
NA,I do not want to devote my time to the,45
NA,"defence of somebody who, I believe, needs",45
NA,defence-th e Minister for Civil Aviation,45
NA,-an d I think that enough has been said on,45
NA,matter in this House. 1 believe that the,45
NA,to whole thing has been blown up out of all,45
NA,by the newspapers because,45
NA,there is nothing in the bill for them to,45
NA,comment on anyway. If there is a royal,45
NA,commission- I think that is in the terms of,45
NA,the amendmet.t moved by the Opposition-,45
NA,it should not inquire into the activities,45
NA,"of the Minister, but could well inquire into",45
NA,the activities of the New South Wales,45
NA,"29. 1961, Government and the company itself.",45
NA,NA,45
Mr CHANEY ,Jus t get these things,46
NA,right. We have heard the word,46
NA,""" pressurization"" used-no t in regard to",46
NA,"aircraft, but in regard to companies. I",46
NA,believe that pressurization has gone on in,46
NA,"totally different areas, and if honorable",46
NA,members accept the documented facts,46
NA,given in this House and in another place,46
NA,they must agree with that. The Leader of,46
NA,the Opposition in another place said only,46
NA,this morning that he accepted the word of,46
NA,"the Minister all along, but that it was",46
NA,obvious that somebody was telling a lie.,46
NA,This is totally different from the attitude,46
NA,adopted by the Opposition in this House.,46
NA,The honorable member for Dalley said,46
NA,that the Prime Minister was responsible,46
NA,to his own party. I do not think I am,46
NA,giving any secrets away when I say that,46
NA,the whole of the Prime Minister's party,46
NA,supported him and the Minister for Civil,46
NA,"Aviation in this matter, and without any",46
NA,"doubt. If the position were reversed, and",46
NA,the Labour Party were on this side of the,46
NA,"House, in government, no doubt the same",46
NA,charge as is made against us-tha t we,46
NA,were simply supporting the government in,46
NA,any event-woul d be made against Labour,46
NA,Party supporters. That is the most natural,46
NA,"thing in politics, as a study of the",46
NA,""" Hansard"" reports for the 60 years of",46
NA,the life of the Commonwealth Parliament,46
NA,will show.,46
NA,"Now I turn to the bill, which has not",46
NA,been discussed at all during the debate.,46
NA,The honorable member for Dalley and the,46
NA,Deputy Leader of the Opposition said that,46
NA,this was a clear-cut case of the Minister,46
NA,trying to destroy T.A.A. This is really,46
NA,"ludicrous in the extreme, as the record of",46
NA,T.A.A. soon shows. We should get back,46
NA,to the bill and forget about East-West,46
NA,"Airlines Limited, as I think honorable",46
NA,"members opposite could well do, because",46
NA,the whole thing has so obviously been,46
NA,whipped up into something big in the news-,46
NA,papers. Let us go back to the record of,46
NA,"T.A.A., which shows that the initial plan-",46
NA,ning for that airline was done in 1948.,46
NA,"From 1949 to 1961, T.A.A. has been",46
NA,under the control of the present Govern-,46
NA,"ment. If any Minister, including the",46
NA,Minister for Defence ( Mr Townley) who,46
NA,"is now at the table, and the present Minister",46
NA,for Civil Aviation had set out to destroy,46
NA,"T.A.A., how could we have the picture",46
NA,now presented in its own record? In the,46
NA,"two-year period that ended on 30th June,",46
NA,"1949, T.A.A. aircraft flew 132,225 hours,",46
NA,"embarked 798,570 passengers, travelled",46
NA,"376,346,800 passenger-miles, carried 18,675",46
NA,"short tons of freight and 2,162 short tons",46
NA,of mail. Over those two years T.A.A.,46
NA,"earned £6,828,000 total revenue, and in-",46
NA,"curred losses amounting to £392,000. The",46
NA,losses were incurred under the adminis-,46
NA,tration of the Labour Government.,46
NA,I am not critical of the loss incurred by,46
NA,"T.A.A. in those first two years, because in",46
NA,the initial stage of the establishment of an,46
NA,airline many non-recurring costs must be,46
NA,"met, and I think that earnings of nearly",46
NA,"£7,000,000, with a loss of £392,000, in a",46
NA,time when the airline had its teething,46
NA,"troubles, was a fairly worthwhile perform-",46
NA,"ance. In 1960, T.A.A.'s operations had",46
NA,"increased quite dramatically, as the figures",46
NA,for the financial year that ended on 30th,46
NA,"June, 1960, show. The hours flown totalled",46
NA,"86,795, as against an average of about",46
NA,"66,000 for each of the two years in the",46
NA,"period that ended on 30th June, 1949. It",46
NA,may be said at first glance that that is,46
NA,"only an increase of 30 per cent., but it",46
NA,must be remembered that that total of hours,46
NA,"was flown by faster aircraft, which covered",46
NA,more miles per hour. The growth in the,46
NA,airlines' activities is fairly high in actual,46
NA,fact- a growth which has occurred under,46
NA,"Ministers, who, according to the Opposition,",46
NA,have been trying to destroy T.A.A.,46
NA,Honorable members opposite can keep,46
NA,firmly in their minds that the Government,46
NA,"is determined to have a two-airline system,",46
NA,and is determined that neither T.A.A. nor,46
NA,the other major airline will be destroyed.,46
NA,It is easy for people who live in Melbourne,46
NA,or Sydney to say that this country could,46
NA,"do with a one major airline system, but it",46
NA,is a different story in Western Australia and,46
NA,"other remote parts of this continent, where",46
NA,it is difficult enough to get service on the,46
NA,line that is available.,46
NA,"In 1960, the number of passengers em-",46
NA,"barked had risen to 1,071,253 compared",46
NA,"with the average of about 390,000 for each",46
NA,of the two years of the period that ended,46
NA,"on 30th June, 1949. And this happened",46
NA,"while the Government, according to honor-",46
NA,"able members opposite, was trying to",46
NA,destroy the airline. What a magnificent,46
NA,kind of destruction! I hope that we try to,46
NA,destroy everything in Australia in the same,46
NA,way. Passenger miles travelled by the air-,47
NA,"line in 1960 were 513,319,100 as against",47
NA,"an average of about 180.000,000 in each of",47
NA,the other two years that 1 have mentioned.,47
NA,The freight carried in 1960 almost doubled,47
NA,compared with each of those other two,47
NA,years.,47
NA,Thosefiguresare the answer to the argu-,47
NA,ment which we hear time and time again,47
NA,that the Government is out to des-troy T.A.A.,47
NA,Now let us look at the particulars regarding,47
NA,"T.A.A.'s fleet of aircraft. In 1949, the air-",47
NA,line was operating with aircraft which were,47
NA,mostly surplus aircraft disposed of by the,47
NA,"armed forces. As at 30th June, 1949,",47
NA,"T.A.A. had just bought five Convair 240's,",47
NA,"three Douglas DC4's, nineteen Douglas",47
NA,"DC3 passenger aircraft, three Douglas DC3",47
NA,freighters and four de Havilland 84's. It,47
NA,"employed 3,393 persons. As a result of the",47
NA,so-called process of destruction undertaken,47
NA,"by this Government, with the various Minis-",47
NA,"ters using all their efforts to destroy T.A.A.,",47
NA,"somehow by 30th June, 1961, the airline",47
NA,"had acquired three Lockheed ISS's, two",47
