Speaker,Text,pageNumbers
NA,them whatever to spend any specific,108
NA,amount of money in any given area or to,108
NA,develop the tenements of which they have,108
NA,"gained possession. These, I know, are",108
NA,matters that are controlled by the State,108
NA,"governments, but it is perfectly possible",108
NA,for this Government to make arrangements,108
NA,with a State. The obvious tendency at,108
NA,present is for companies to take up very,108
NA,"large areas, with no relation whatever to the",108
NA,amount of exploration that they intend to,108
NA,make or to their capacity to make it.,108
NA,The only sedimentary basin areas that,108
NA,are now not held under tenement are in,108
NA,"Papua, New Guinea, the Northern Terri-",108
NA,"tory and Tasmania, apart from a few off-",108
NA,shore areas. All the rest of the sedimentary,108
NA,basins on the mainland and in Papua are,108
NA,"already held by companies which, as I",108
NA,"have said, are chiefly controlled by foreign",108
NA,capital. It would seem obvious that if,108
NA,exploration is to be carried out at a,108
NA,"satisfactory rate, the area held should be",108
NA,related to the capacity to carry out ex-,108
NA,ploratory work and to the amount of work,108
NA,actually being performed. It appears at,108
NA,present that there are companies which are,108
NA,"simply squatting, with no intention of doing",108
NA,any serious work in the areas they hold;,108
NA,they are waiting and hoping that some,108
NA,other company which is spending money,108
NA,"will make a discovery, whereupon they will",108
NA,reap a rich profit from their leases.,108
NA,In the last moments avilable to me I,108
NA,"return to my main theme, which is that if",108
NA,we as a nation want to be sure of finding,108
NA,oil-an d of course we do; we must find,108
NA,"it, and it is there; every expert agrees on",108
NA,that-w e must be prepared to make the,108
NA,"search a national task, financed from the",108
NA,"national purse, and we must at least under-",108
NA,take intensive exploration of those few,108
NA,areas where indications are generally pretty,108
NA,favorable.,108
NA,Mr Forbes -Yo u are boring everybody,108
NA,in the House.,108
Mr ALLAN FRASER ,Th e honorable,108
NA,member from South Australia declares that,108
NA,he is bored by what I am saying. He,108
NA,thereby declares that he is not interested,108
NA,in the question of the search for oil in,108
NA,Australia.,108
NA,"Mr Forbes -No , that is not correct.",108
Mr ALLAN FRASER ,H e has said,108
NA,that he is bored. His constituents must be,108
NA,easily satisfied if they are satisfied with,108
NA,him. I imagine they will not be satisfied,108
NA,with him for much longer.,108
NA,With the capita] provided from the public,108
NA,"purse, the equipment and the technical skills",108
NA,"can be imported. They are available, not",108
NA,only in the United States of America but,108
NA,"also in Great Britain, France and Germany.",108
NA,Why should not the Government imme-,108
NA,"diately determine to explore, say, four or five",108
NA,"of the most favorable areas, which would",108
NA,"cost from £20,000,000 to £50,000,000?",108
NA,That task could be carried out in the course,109
NA,of a very few years and the rewards that,109
NA,might flow from it are incalculable in bene-,109
NA,fits for the Australian people; nor would it,109
NA,"require a large government staff. Actually,",109
NA,it would require only a small group of ex-,109
NA,"perienced and vigorous oil searchers, with",109
NA,no restrictions placed upon them in the,109
NA,planning and carrying out of the operation.,109
NA,That is the kind of policy which the Labour,109
NA,"Party has in mind, instead of the niggardly",109
NA,and quite unrealistic proposals contained,109
NA,in the Government's legislation.,109
NA,"On behalf of the Opposition, as an amend-",109
NA,"ment to the motion for the second reading,",109
NA,I move-,109
NA,"That all words after ""That"" be omitted with a",109
NA,view to inserting the following words in place,109
NA,"thereof:- "" this House is of opinion that the",109
NA,Government should lead and hasten the search,109
NA,for oil by developing the activities of the Bureau,109
NA,"of Mineral Resources in mapping, in geological and",109
NA,"geophysical surveys and in drilling, and shouid",109
NA,undertake research into the production of oil,109
NA,"coal and shale."".",109
Mr DEPUTY SPEAKER ,Hon. VV. C.,109
NA,Haworth) -Order ! Is the amendment,109
NA,seconded?,109
NA,Mr Cairns -Yes . I second the amend-,109
NA,ment.,109
Mr BUCHANAN ,MCMillan) [11.56] -,109
NA,The honorable member for Eden-Monaro,109
NA,( Mr Allan Fraser) has given us some very,109
NA,"interesting figures, the great majority of",109
NA,which were accurate. I am grateful to,109
NA,him in some respects. He has given us an,109
NA,outline of some of the activities in the search,109
NA,for oil which it is worthwhile to have on,109
NA,record. His comments will probably save,109
NA,me from making similar references as I,109
NA,"proceed with my speech. However, 1",109
NA,thought that the honorable member was quite,109
NA,irresponsible in advocating an increase in,109
NA,expenditure on the scale envisaged by him.,109
NA,Mr Bryant -Why ?,109
Mr BUCHANAN ,Becaus e there is a,109
NA,limit to the amount that the taxpayers can,109
NA,provide. The honorable member referred,109
NA,"to an amount of £80,000,000 for one item.",109
NA,Not so long ago we heard the Leader of the,109
NA,Opposition ( Mr Calwell) telling us of the,109
NA,hundreds of millions of pounds that the,109
NA,Australian Labour Party proposed to spend,109
NA,on various projects if it were returned to,109
NA,office after the forthcoming general election.,109
NA,He has told us what ought to be done about,109
NA,"many things, but the expenditure would",109
NA,reach such astronomical proportions that,109
NA,the taxpayers would not be able to bear it.,109
NA,The amendment moved by the honorable,109
NA,member for Eden-Monaro is really only,109
NA,fiddling with the question. This Govern-,109
NA,ment has had experience over the years in,109
NA,"the search for oil, whereas the Labour Party",109
NA,"has not. In 1957, the Government pro-",109
NA,vided a subsidy towards the cost of strati-,109
NA,graphic drilling. It also extended tax con-,109
NA,cessions on capital investment in companies,109
NA,"engaged in that work. It did so, very",109
NA,"largely, because it believes in doing things",109
NA,methodically and properly. The honorable,109
NA,member for Eden-Monaro did not mention,109
NA,those matters. The Government took,109
NA,these steps very largely for the purpose,109
NA,of getting information on the geo-,109
NA,logical character of the particular basins in,109
NA,which oil could possible occur. We should,109
NA,take notice of the fact that people did say,109
NA,from at that time that Australia was too old a,109
NA,"country to produce oil, and that oil does",109
NA,not occur south of the equator. Certainly,109
NA,there is more oil produced north of the,109
NA,"equator, but that is mainly because of the",109
NA,greater land masses there. With some-,109
NA,"thing like 87 per cent, of the earth's sur-",109
NA,face being situated north of the equator,109
NA,one would expect to find more oil there.,109
NA,"After all, oil has been found in most of",109
NA,the countries of the world today. Austra-,109
NA,"lia, as the honorable member for Eden",109
NA,"Monaro said, is one place where oil has",109
NA,not been found in commercial quantities,109
NA,although it is urgently needed. I could,109
NA,not agree more with what he said in that,109
NA,"regard, but he wants to do what is neces-",109
NA,sary too fast. It is known that two-thirds,109
NA,of Australia's geological formations were,109
NA,laid down in the same oil-making condi-,109
NA,tions and in the same geological ages as,109
NA,many of the oil-producing formations in,109
NA,other parts of the world. But when we,109
NA,went into this in the first place no one had,109
NA,"discovered more than traces of oil, in",109
NA,"deepwater bores, for example, although",109
NA,there had been good signs of petroliferous,109
NA,gas in Roma as far back as 1900.,109
NA,Now we are confirmed in the knowledge,109
NA,"that there is oil in this continent, because",109
NA,at Cabawin it flowed up from a depth of,109
NA,"10,000 ft. through a pipe only 5/16ths",109
NA,"of an inch in diameter, giving 2.000 gallons",109
NA,a day. and was accompanied by thousands,109
NA,"of cubic feet of petroliferous gas, but it",109
NA,is too far from the market to be called a,110
NA,commercial proposition. During the last,110
NA,recess I was fortunate enough to see the,110
NA,actual site of this strike. I and some other,110
NA,members of the Government Members',110
NA,"Mining Committee, which has taken such",110
NA,"a keen interest in oil search, visited that",110
NA,part of Queensland to see for ourselves,110
NA,just how the search was carried out. We,110
NA,saw it from the seismic teams working on,110
NA,"the job, right through to the drilling of",110
NA,the well. We even watched sadly the dis-,110
NA,"mantling of one giant rig from a dry hole,",110
NA,ready for transport to the next site. The,110
NA,thing that worried us most was that the,110
NA,company was not able to go on immediately,110
NA,and spud in a new well because the delay,110
NA,in producing seismic information is seri-,110
NA,ously lagging behind the drilling capacity,110
NA,owing to lack of funds. But the Govern-,110
NA,"ment, in this bill, is taking a lot of steps",110
NA,to overcome this deficiency. It is being,110
NA,"done as fast as Australia can afford,",110
NA,although not as fast as the honorable,110
NA,member for Eden-Monaro would like.,110
NA,"The Cabawin strike, plus the natural",110
NA,flow found by an Australian company at,110
NA,Roma where the electricity generating,110
NA,station is now being supplied with power,110
NA,"piped directly from the hole, gives every",110
NA,indication that we are at last beginning to,110
NA,break into the early stages of having,110
NA,and oil discovered in this country in comis,110
NA,mercial quantities. Since those discoveries,110
NA,the activity has been stepped up. Investcan,110
NA,ment in the oil search is much greater,110
NA,and we are doing all we can to keep,110
NA,"oil rig actively drilling, by increasing",110
NA,activities in seismic work.,110
NA,This bill will assist to some extent,110
NA,"overcoming the difficulty we have had, as",110
NA,it proposes to increase the actual amount,110
NA,"of money available for the search, although",110
NA,this will have to be shared by more and,110
NA,more companies coming in because,110
NA,realize that we will ultimately find oil.,110
NA,One of the most important things in this,110
NA,legislation is the change in the emphasis,110
NA,on the requirements of the Bureau of,110
NA,Mineral Resources. [Quorum formed.],110
NA,Until now the subsidy has been approved,110
NA,only for projects likely to increase,110
NA,bureau's knowledge of the stratigraphic,110
NA,formations. I have heard this called neversubsidy,110
NA,"never geology, because although it is necesfused,",110
NA,"sary as a starting-off point, you never",110
NA,never find oil in that way. Now this legis-,110
NA,lation makes it possible for the subsidy to,110
NA,be granted for detailed exploration of geo-,110
NA,"logical structures and for test drilling,",110
NA,without the inhibition of having to bring,110
NA,up new stratigraphical information of a,110
NA,regional character.,110
NA,"As honorable members well know, oil",110
NA,collects in sedimentary basins and the,110
NA,problem is to locate the enclosed forma-,110
NA,tions. The main tool that the operator has,110
NA,in discovering these is the seismic apparatus.,110
NA,"It cos;s £4,000 a week to keep a seismic",110
NA,"team in the field, but even with the infor-",110
NA,mation that that gives about contours and,110
NA,"levels under the surface, it cannot tell the",110
NA,porosity of the sandstones. It can tell only,110
NA,where the right sort of enclosed basin,110
NA,"exists, and the extent of it. Once that is",110
NA,established you can find oil only by drilling.,110
NA,The Government realizes the urgency of,110
NA,the need for discovering oil in Australia,110
NA,and has stepped up the subsidy from,110
NA,"£1,400,000 last year to £2,700,000 this",110
NA,"year, as well as expanding its direct con-",110
NA,"gas tribution from £900,000 to £1,400,000, so",110
NA,"that this year £4,100,000 will be available",110
NA,for sponsoring oil search programmes.,110
NA,Although the Minister for National De-,110
NA,"velopment (Senator Spooner), who is in",110
NA,"gas another place, has said that this amount",110
NA,what his department thinks is about the,110
NA,limit that the companies searching for oil,110
NA,"use, they do not agree with his esti-",110
NA,now mate. The Minister has indicated that in,110
NA,every his opinion a crash programme is not,110
NA,"our warranted. The programme we propose,",110
NA,"based on steady examination and testing,",110
NA,"is sufficient. The use of the term "" crash",110
NA,"in programme"" was perhaps unfortunate",110
NA,because it implies the idea of a considerable,110
NA,amount of wildcatting. But the plan put,110
NA,forward by the Australian Petroleum Ex-,110
NA,"ploration Association is, as the honorable",110
NA,"they member for Eden-Monaro mentioned,",110
NA,intended to provide a basis for forward,110
NA,"planning, so that the twelve drilling rigs",110
NA,now in Australia can be kept working at,110
NA,"their capacity of about 50 wells a year,",110
NA,although last year we drilled only 22 wells.,110
NA,An examination of the report by the,110
NA,the Minister on the 1959 act for the year,110
NA,1960-61 shows that 89 applications for,110
NA,were dealt with and 31 were re-,110
NA,while 44 applications were approved.,110
NA,There were only 44 applications approved,110
NA,to seek oil in 24 sedimentary basins of a,111
NA,"total of 1,362.000 square miles. But even",111
NA,the basic exploration of these basins has,111
NA,yet to be done.,111
NA,Mr Daly - I rise to a point of order. At,111
NA,"12.10 a.m., is it in order for an honorable",111
NA,member to speak when no one is listening,111
NA,to him?,111
Mr DEPUTY SPEAKER ,N o point of,111
NA,order is involved.,111
Mr BUCHANAN , 1 have listened to a,111
NA,lot of rubbish from the honorable member,111
NA,for Grayndler for a good while. It is the,111
NA,Government's intention that the effort in,111
NA,this basic exploration will be a concerted,111
NA,effort.,111
NA,Tn the year of which I speak-1960-61 -,111
NA,"the amount appropriated was £1,400,000,",111
NA,"of which £1,399,000 was spent. The com-",111
NA,panies concerned have indicated their in-,111
NA,tention to carry out further works to the,111
NA,"value of £1,589,000. At the time that the",111
NA,report was published these works had not,111
NA,been started. Against this background the,111
NA,Australian Petroleum Exploration Associa-,111
NA,tion has submitted a projected programme,111
NA,which shows that for the year ending,111
NA,"December, 1962, the Australian companies",111
NA,"expect to raise £3,156,000, and that the",111
NA,overseas companies will probably have more,111
NA,"than £4,850,000 available to spend in Aus-",111
NA,tralia. Those figures do not bring us to the,111
NA,level that the honorable member for Eden-,111
NA,"Monaro wants, but they are practical figures",111
NA,which we should be able to manage.,111
NA,"Based on that level, and so that we can",111
NA,"do some forward planning, such as bringing",111
NA,"more seismic crews from overseas, the",111
NA,A.P.E.A. submitted a programme to be,111
NA,"spread over four years, which the honorable",111
NA,member for Eden-Monaro has covered. The,111
NA,"amount the A.P.E.A. suggests, together with",111
NA,"the subsidy, is £6,000,000 a year for two",111
NA,"years to step up the lag in seismic surveys,",111
NA,"followed by £5,000,000 and then by",111
NA,"£4,000,000, with a drilling programme to",111
NA,"match amounting to £5,000,000 in the. first",111
NA,"years, £7,000,000 in trie next, £8,000,000",111
NA,"in the next and finally rising to £9,000,000.",111
NA,"As the information becomes available, the",111
NA,work can be stepped up. The total amount,111
NA,over the four years would be something like,111
NA,"the £50,000,000 of which the honorable",111
NA,"member for Eden-Monaro spoke finally,",111
NA,although previously he had been speaking,111
NA,"of £80,000,000, which, I submit, was",111
NA,fantastic.,111
NA,The actual subsidy needed to implement,111
NA,"the programme would be £5,500,000 in the",111
NA,"first year and £6,500,000 in each of the",111
NA,"following three years. This, I agree, would",111
NA,not be a high price to pay for a major,111
NA,breakthrough in the search for oil. I should,111
NA,"like to emphasize, Mr Speaker, that",111
NA,although this plan was proposed by the,111
NA,Australian Petroleum Exploration Associa-,111
NA,tion the association does not suggest that we,111
NA,should keep the whole of the effort in the,111
NA,hands of Australian companies. It is well,111
NA,recognized that the expert knowledge and,111
NA,ready finance provided by the large overseas,111
NA,oil companies has been of tremendous value,111
NA,"in Australia needed, and still needs.",111
NA,One of the basic reasons for overseas,111
NA,companies coming here is that the areas of,111
NA,the leases granted by the State Governments,111
NA,are mostly much too large for any one group,111
NA,to explore adequately. It is laid down that,111
NA,certain works must be undertaken in respect,111
NA,"of each lease, but there should be no",111
NA,obstacle to a take-over of unprospected,111
NA,areas by the many interests now coming,111
NA,forward and seeking a place in Australian,111
NA,exploration.,111
NA,programme showing what it considers the,111
NA,"Mr Speaker, the Australian Petroleum",111
NA,Exploration Association has put up this,111
NA,and the foreseeable contribution of the,111
NA,overseas companies which are vitally,111
NA,interested in discovering oil in Australia.,111
NA,The figures are considerably in excess of,111
NA,those provided for in this bill. The indus-,111
NA,try no doubt believes that it can fulfil its,111
NA,Australian market is capable of providing,111
NA,in giving the impetus that the search for oil,111
NA,"part of the programme. If it can do this,",111
NA,I know that it will find the Government to,111
NA,be entirely sympathetic with its ambitions.,111
NA,I can assure the industry of the fullest co-,111
NA,operation of the Government Members',111
NA,"Mining Committee, which will use its in-",111
NA,fluence to the full lo urge the Government,111
NA,to match whatever sums the industry finds,111
NA,it can usefully employ in this direction.,111
NA,We are confident that our representations,111
NA,would be very favourably received. The,111
NA,Minister has stated his faith that oil exists,111
NA,in Australia and that the finding of it is,111
NA,"only a matter of time, depending on the",112
NA,intensity of the search. I am sure that if,112
NA,the industry itself will accept the challenge,112
NA,"of intensifying the search, the Government",112
NA,will be prepared to consider sympathetically,112
NA,representations for an increase in its,112
NA,contribution.,112
NA,There is another point in this legislation,112
NA,on which I would like to touch. I am very,112
NA,pleased to see the inclusion of a footage,112
NA,formula as a basis for subsidy. This,112
NA,posal was suggested by the Government,112
NA,Members' Mining Committee because it,112
NA,believes that too much frustration and,112
NA,delay have been occasioned by all the,112
NA,paper work that has to be gone through,112
NA,establish costs. There is also a waste,112
NA,effort because of the inevitable red tape,112
NA,of departmental checking. It is believed,112
NA,that too many plans have been on a rather,112
NA,"extravagant basis, and that in certain",112
NA,it has been possible to do a little juggling,112
NA,with subsidiary operating companies,112
NA,tendering for holding companies. With a,112
NA,known amount of subsidy on the basis of,112
NA,footage drilled-i n the case of seismic,112
NA,work it would have to be on the basis,112
NA,a distance covered- a company considerdrilling,112
NA,ing a specific project would know just what,112
NA,"it would receive in the way of assistance,",112
NA,and could budget accordingly. The departto,112
NA,ment would know just how many feet of,112
NA,"drilling it would get for a specific sum, and",112
NA,both parties would eliminate a lot of,112
NA,guesswork and complicated cross-checking.,112
NA,I am of the opinion that we would make,112
NA,very considerably savings on the subsidy,112
NA,if there were a known limitation accordinformation,112
NA,ing to footage drilled. The companies,112
NA,concerned would need to trim their plans,112
NA,to make the utmost use of the funds avail-,112
NA,able-the y would cut down on some of,112
NA,the frills-an d we would get more feet,112
NA,drilled for the same money. We would,112
NA,pay less by way of subsidy for the total,112
NA,footage produced. I know that the other,112
NA,department has the final say on all subwe,112
NA,"missions, and that its experience in this",112
NA,prevents too much padding of the particularly,112
NA,"accounts, but it seems that this basis would",112
NA,give us the most for our money. The feasible.,112
NA,experience of the department would enable,112
NA,it to formulate an appropriate footage,112
NA,"basis. For those reasons, I hope",112
NA,eventually this method will be the sole,112
NA,"method of subsidy, not just an alternative",112
NA,method as at present.,112
NA,We do not have unlimited money to,112
NA,"spend, and it is essential that we get full",112
NA,value for every £1 spent. It is also essen-,112
NA,tial that everybody taking part in the drive,112
NA,for oil should have equal access to the funds,112
NA,"available, and that the big-time operators",112
NA,should not hog the whole of the available,112
NA,profunds and squeeze out the smaller opera-,112
NA,tors because the big boys have used up all,112
NA,the funds available. For this reason I,112
NA,would like to suggest that a limit be placed,112
NA,on the total subsidy that may be allotted,112
NA,"to for any one hole, and I suggest that",112
NA,"of £150,000 would be a suitable figure.",112
NA,Here in Australia we have a tendency,112
NA,to start a hole and just keep on drilling,112
NA,cases until we come to bedrock. There is no,112
NA,question about that. In looking at the statis-,112
NA,tics of exploration I note that a least 80,112
NA,"per cent, of the free world's oil comes from",112
NA,"wells not exceeding 7,000 feet in depth,",112
NA,"and 60 per cent, of it comes from wells",112
NA,"of under 5,000 feet deep. The cost of",112
NA,starts at less than £10 a foot. At a,112
NA,"depth of 7,000 feet it increases to about",112
NA,"£16 a foot. At 10,000 feet the cost gets up",112
NA,"between £24 and £28 a foot, and below",112
NA,that depth it increases so steeply that drilling,112
NA,could be regarded as impracticable. Limit-,112
NA,"ing the total subsidy to £150,000 for any",112
NA,one hole means that any company wishing,112
NA,to go ahead on an unpromising well will,112
NA,have to make a careful decision on the,112
NA,available and decide whether it,112
NA,will be worth while to carry on.,112
NA,"In conclusion, Mr Deputy Speaker, I",112
NA,commend the bill to honorable members.,112
NA,"Having in mind the size of Australia, this",112
NA,Government is making a greater contribu-,112
NA,tion to oil search than the government of any,112
NA,country in the free world. I think,112
NA,must concentrate on those areas where,112
NA,"work the indications have been most promising,",112
NA,areas that are close enough to,112
NA,industry and capital cities to be commercially,112
NA,"The only other thing we need, for",112
NA,"which we cannot make legislative provision,",112
NA,is the proverbial stroke of luck that is re-,112
NA,that quired in all mining ventures.,112
NA,"Friday, 27lh October, 1961.",113
NA,Question put-,113
NA,That the words proposed to be omitted ( Mr .,113
NA,Allan Fraser's amendment) stand part of the,113
NA,question.,113
NA,The House divided.,113
( Mr DEPUTY SPEAKER ,Hon . W. C.,113
NA,Ayes . . ..,113
NA,Noes . . .. . . 28,113
NA,Majority,113
NA,"Adermann. C. F. Howson, P.",113
NA,"Anderson, C. G. W. Hulme, A. S.",113
NA,"Anthony. J. D. Jess, J. D.",113
NA,"Bandidt, H . N . C. Kelly, C. R.",113
NA,"Barnes, C. E. Kent Hughes, Sir Wilfrid Chaney. F. C.",113
NA,"Barwick. Sir Garfield KiUen, D. J.",113
NA,"Buchanan, A. A. King, R. S.",113
NA,"Cameron, Dr Donald Lindsay, R. W. L .",113
NA,"Cash, E. D. Lucock, P. E.",113
NA,Chaney. F. C. Mackinnon. E. D.,113
NA,"Chiop. D. L. MCMahon, W.",113
NA,"Chresby, A. A. Murray, J.",113
NA,Davidson. C. W. Opperman. H. F.,113
NA,Davis. F. J. Osborne. F. M .,113
NA,"Dean, R. L. Roberton, H . S.",113
NA,"Downer, A. R. Snedden. B. M .",113
NA,"Drummond, D. H . Stokes, P. W. C.",113
NA,England. J. A. Swartz. R. W. C.,113
NA,"Failes. L. J. Townley, A. G.",113
NA,"Forbes. A. J. Turner, H. B.",113
NA,"Fox. E. M . Wentworth, W. C",113
NA,"Fraser, Malcolm Wheeler. R. C.",113
NA,Freeth. G. Whittorn. R. H.,113
NA,Halbert. H. V. Wilson. K. C.,113
NA,Hamilton. L. W.,113
NA,Hasluck. P. M. Tellers:,113
NA,"Holt, Harold Pearce. H. G.",113
NA,"Beaton. N . L. James, A. W.",113
NA,Bryant. G. M . Johnson. L. R.,113
NA,"Cairns. J. F. Jones, C. K.",113
NA,Clav. L. D. Luchetti. A. S.,113
NA,"Cope. J. F. Makin, N . J. O.",113
NA,"Costa, D. E. O'Connor. W. P.",113
NA,"Courtnay. F. Peters, E. W.",113
NA,"Crean. F. Pollard, R. T.",113
NA,"Daly, F. M . Reynolds. L. J.",113
NA,"Davies. R. Ward, E. J.",113
NA,"Fraser. Allan Whitlam, E. G.",113
NA,Fulton. W. J.,113
NA,Griffiths. C. E. Tellers:,113
