Speaker,Text,pageNumbers
NA,no substance in that point of order.,72
Mr HAROLD HOLT , I was about to,72
NA,say that not only my colleague the Minister,72
NA,"for Civil Aviation-who , I think, requires",72
NA,"no defence by any member in this place,",72
NA,because there is no member opposite who be-,72
NA,lieves in his heart one word of the charges,72
NA,which have been bandied round so wildly,72
NA,against him here in recent days-ha s been,72
NA,subjected to attack; there is also the,72
NA,personal attack made on a man who has,72
NA,been one of the great pioneering figures in,72
NA,commercial aviation in Australia- Mr Reg,72
NA,Ansett. That is a dreadful thing to say to,72
NA,the people of Australia who are among the,72
NA,most air-minded people in the world. By,72
NA,reason of the vast distances we have to,72
NA,"cover, we are more frequent users of air-",72
NA,craft per head of population than probably,72
NA,any other people in the world.,72
NA,Yet here we have a spokesman for the,72
NA,"Australian Labour Party in this place who,",72
NA,"in order to achieve a cheap political trick,",72
NA,"has claimed that one airline is an insecure,",72
NA,dangerous airline for the people to use. It,72
NA,is the Department of Civil Aviation which,72
NA,determines the safety standards for flying,72
NA,in Australia. Australia can be very proud,72
NA,of (he safety record we have enjoyed. That,72
NA,"applies to all airlines-T.A.A. , Ansett-",72
NA,A.N.A. and the other airlines which,72
NA,in this country. If they were not,72
NA,operating on the safety standards which are,72
NA,required by the authorities they would be,72
NA,grounded. The very fact that their aircraft,72
NA,are in the air is proof that they are observing,72
NA,the conditions we prescribe for them. Any,72
NA,Opposition which descends to the tactics,72
NA,of trying to create in the minds of the public,72
NA,fears that they will be unsafe if they travel,72
NA,in a particular airline is worthy of the con-,72
NA,I demnation of the Australian people.,72
Mr HAYLEN ,Parkes) [8.12] -I f ever,72
NA,"Sir, there was a Jekyll and Hyde in the Parlia-",72
NA,ment it is the Treasurer ( Mr Harold Holt).,72
NA,"During this past week, the right honorable",72
NA,gentleman has been smearing members of,72
NA,Australian Labour Party who are :o,72
NA,stand for election to the Senate and has been,72
NA,enjoying himself thoroughly. To-night he,73
NA,came into the chamber beating his breast.,73
NA,We know that he comes from a well-known,73
NA,"theatrical family, but this sort of ham acting",73
NA,is not to be endured. He spoke of the,73
NA,Minister for Civil Aviation (Senator,73
NA,"Paltridge) as this Minister without reproach,",73
NA,this great man who has done all of these,73
NA,things. And then the right honorable,73
NA,gentleman switched a remark made by the,73
NA,honorable member for East Sydney ( Mr.,73
NA,Ward). All the honorable member for East,73
NA,Sydney did was to compare the safety reports,73
NA,"of the two airlines, something that could be",73
NA,legitimately done.,73
NA,But I want to return to the sneer and,73
NA,smear merchant who has qualified as one of,73
NA,the worst MCCarthy-ites in this chamber in,73
NA,one short week. We are putting it up to the,73
NA,Government that we are not taking it. Is,73
NA,the Government going to run into the dis-,73
NA,solution of this Parliament and out of this,73
NA,session without answering what people are,73
NA,saying outside? If supporters of the Go-,73
NA,vernment do not believe what we are saying,73
NA,"and if they think we are playing at politics,",73
NA,are they prepared to take up the challenge?,73
NA,Is the Government so smug that it does not,73
NA,believe anything can happen to it? If that,73
NA,"is what supporters of the Government think,",73
NA,"let them listen to what the "" Sydney Morn-",73
NA,"ing Herald"" has said. There are words",73
NA,there that any government with any guts,73
NA,would answer. It wou!d not run away from,73
NA,them. It would not duck into recess or dis-,73
NA,"solution and say, "" Thank God, we have",73
NA,"escaped that"".",73
NA,There is a case to answer and supporters,73
NA,of the Government should remember that if,73
NA,"they get out of this Parliament, we will pur-",73
NA,sue them through the electorate and demand,73
NA,"an answer. The "" Sydney Morning Herald """,73
NA,is a reputable newspaper. Sometimes it is,73
NA,"misguided in the way it reports my activities,",73
NA,"but I forgive it for that because, in a general",73
NA,"sense, it is pretty fair. It spoke yesterday",73
NA,of the sight of the Minister in tantrums and,73
NA,the Prime Minister ( Mr Menzies) defending,73
NA,him. But that was only the lead-in. It,73
NA,stated something that the Government should,73
NA,"consider. It uses such words as "" serious",73
NA,"scandal"" and "" a gross betrayal of prin-",73
NA,"ciple"". The newspaper has stated this in",73
NA,discussing the famous conversation that took,73
NA,place between the Minister and the directors,73
NA,of East-West Airlines. Did it take place?,73
NA,What was said? Who said it? It reflects,73
NA,the utter confusion of the public as to what,73
NA,"the Minister for Civil Aviation did say, or",73
NA,how many times he said what he did not,73
NA,"say, and how many people denied it. Then",73
NA,he was full of tantrums and fears.,73
NA,Let me tell the committee what the,73
NA,""" Sydney Morning Herald"" said and let",73
NA,the Government answer these statements,73
NA,before it gets out of this place. If it does,73
NA,"not answer it, the Government will stand",73
NA,condemned outside. This is what the,73
NA,""" Sydney Morning Herald "" stated to-day-",73
NA,"If, however, as a great many people will prefer",73
NA,to believe . . . the Federal Government,73
NA,through the Minister for Civil Aviation tried to,73
NA,intimidate a small private airline into surrendering,73
NA,to a big competitor manifestly favoured by the,73
NA,"Government in other directions, then the affair",73
NA,assumes the proportions of a serious scandal.,73
NA,"Are the Government, the Prime Minister and",73
NA,his Cabinet going to walk out of the Parlia-,73
NA,"ment and not answer the "" Sydney Morning",73
NA,"Herald ""? The newspaper has said that this",73
NA,""" assumes the proportions of a serious",73
NA,"scandal"". Yet we have this Jekyll and",73
NA,"Hyde getting up and saying: "" Look what the",73
NA,Labour Party is doing. Look at what the,73
NA,"honorable member for East Sydney said.""",73
NA,We are trying to bring the Government to,73
NA,a sense of its democratic responsibilities. If,73
NA,"what I have read is not enough, let me read",73
NA,the concluding passage referring to the inter-,73
NA,vention of the Government-,73
NA,That the Government should intervene at all in,73
NA,such an issue is beyond all propriety.,73
NA,Is the Government going outside this,73
NA,chamber and admitting that it is beyond all,73
NA,propriety? If it is power-drunk and does not,73
NA,care what sort of scandal is tied to its tail,73
NA,during the general election culminating on,73
NA,9th December; if it is afraid to face,73
The CHAIRMAN ,Order ! The remarks,73
NA,of the honorable member for Parkes have,73
NA,no relation to the bill or the amendment,73
NA,moved by the honorable member for East,73
NA,Sydney that are now before the committee.,73
NA,I rule that the honorable member must,73
NA,return to the subject before the committee.,73
Mr HAYLEN ,"Wil l you tell me, Sir,",73
NA,what was the relation of the remarks of,73
NA,the Treasurer in the same connexion? I,73
NA,am referring to the Airlines Agreements,73
NA,"Bill. The ""Sydney Morning Herald""",73
NA,stated in relation to the Government's,73
NA,attempt to promote a monopoly and force,74
NA,free enterprise out of existence that this,74
NA,was the grossest possible betrayal. Will the,74
NA,Government answer that charge? It is the,74
NA,grossest possible betrayal of the Govern-,74
NA,ment's policy. Is the Government going to,74
NA,re-write its policy speech for 9th,74
NA,"December, and say: "" We believe in the",74
NA,grossest possible betrayal of free enterprise.,74
NA,We believe we have concocted a scandal,74
NA,and we have not the guts,74
The CHAIRMAN ,Order ! The honorpened,74
NA,able member must direct his remarks,74
NA,the clause and the amendment before the,74
NA,committee.,74
Mr HAYLEN ,Perhap s you will he,74
NA,"allow me to say this, Sir: These are the",74
NA,hours of this Parliament and I would have 1946,74
NA,been grateful if you had intervened to pro-,74
NA,tect me from the Treasurer. Since that,74
NA,"cannot happen, I will conclude by saying",74
NA,that I support what the honorable member,74
NA,for East Sydney has said and I deny what,74
NA,"the Treasurer has said in bis simulated,",74
NA,phoney anxiety about the airlines. He,74
NA,could not care a tinker's damn. All he,74
NA,was trying to do was to secure a point.,74
NA,We are trying to provoke the Government,74
NA,and its supporters into some sensibility,74
NA,their democratic duties. We ask them,74
NA,stand up to this fight and not run away.,74
NA,We ask supporters of the Government to,74
NA,listen to the amendments and debate them. tioned by them.,74
NA,Apart from the Minister for Defence ( Mr.,74
NA,Townley) there has not been a senior Minis-,74
NA,ter at the table or a Minister in the,74
NA,ber when we have been discussing this,74
NA,"matter. We are contesting the title,",74
NA,clause and the agreement and we will conCanning,74
NA,test the schedule until we bring Ministers,74
NA,to their feejt to denounce this thing.,74
NA,A charge has been made outside by,74
NA,responsible people that the Government,74
NA,been guilty of the grossest act in relation,74
NA,to its own policy and that this is a public,74
NA,scandal. Will the Government sit down,74
NA,"and take it? If so, we have every right to",74
NA,keep moving amendment after amendment lating,74
NA,until we bring the Government to a sense,74
NA,of its duty.,74
Mr CHANEY ,Perth) [8.19] -Th,74
NA,honorable member for Parkes ( Mr Haylen),74
NA,only has to shift the rose in his buttonhole,74
NA,to his nose and he would really look like,74
NA,Ferdinand the bull. Ferdinand was brought,74
NA,up on the plains of Spain to be a very,74
NA,"terrible fighter, but when it came to the",74
NA,point he was not so good. What the honor-,74
NA,able member has said is a lot of nonsense.,74
NA,If you go to the Parliamentary Library,74
NA,there is a book there on how to lie with,74
NA,statistics. It is an extremely useful publica-,74
NA,tion and the honorable member for Parkes,74
NA,as an author might appreciate it. There is,74
NA,a story in this book about a man who was,74
NA,drowned in a river with an average depth,74
NA,of 7 inches. That is exactly what has hap-,74
NA,with this bill. Since the sitting was,74
NA,"to resumed to-night, the honorable member",74
NA,"for Canning ( Mr Hamilton), who is not",74
NA,"with us at present, made a speech in which",74
NA,pointed out that in his early days in,74
NA,final Parliament- I think he was elected in,74
NA,"Mr Haylen - I rise to order, Mr Chair-",74
NA,"man. If what I said was irrelevant, will",74
NA,you rule as to whether the honorable,74
NA,member's remarks are relevant at the,74
NA,moment? The clause before the committee,74
NA,now deals with the title of the bill. What,74
NA,relation has this to Ferdinand the bull?,74
The CHAIRMAN ,Ther e is no sub-,74
NA,stance in the point of order taken by the,74
NA,of honorable member for Parkes. The honor-,74
NA,to able member for Perth has mentioned two,74
NA,honorable members who have spoken on,74
NA,the bill and has referred to matters men-,74
Mr CHANEY ,A HI have done is to,74
NA,chammake a few introductory remarks. The,74
NA,honorable member for East Sydney ( Mr.,74
NA,the Ward) took the honorable member for,74
NA,to task on what he said about the,74
NA,Government assisting one airline to the,74
NA,detriment of another. This was at a definite,74
NA,"period, just after the war, when parts were",74
NA,hard to get and only some varieties of,74
NA,has aircraft were available. He said- I take,74
NA,his word for it-tha t favouritism was,74
NA,extended to Trans-Australia Airlines. The,74
NA,honorable member for East Sydney men-,74
NA,tioned the accident rate. The statistics re-,74
NA,to civil aviation in Australia for the,74
NA,"overall operation of all airlines, including",74
NA,"T.A.A. and Ansett-A.N.A., would surprise",74
NA,"e honorable members. To my knowledge,",74
NA,there have been only two fatal crashes. One,74
NA,occurred with an Ansett-A.N.A. aircraft in,74
NA,the days when the organization was Aus-,74
NA,tralian National Airways Proprietary,74
NA,Limited. A DC4 crashed in the hills near,75
NA,York after take-off from Perth.,75
NA,"Mr Cope -On e crashed in Tasmania,",75
NA,too.,75
Mr CHANEY ,"Yes , but that was a",75
NA,freighter.,75
NA,"Mr Cope -No , it was a passenger",75
NA,aircraft.,75
Mr CHANEY ,I f the honorable mem-,75
NA,ber looks up the records he will find I am,75
NA,right. I am referring to accidents in which,75
NA,passengers were involved. Following the,75
NA,"crash of the DC4 near Perth, there was a",75
NA,tremendously long inquiry. I attended some,75
NA,of the sessions. The best legal brains in,75
NA,"Australia appeared at the inquiry, but the",75
NA,cause of the crash was not determined.,75
NA,Originally it was thought that there was,75
NA,water in the petrol. Other theories were,75
NA,advanced and experts were brought from,75
NA,"America. However, the cause of the crash",75
NA,was never definitely established. Then,75
NA,T.A.A. had a fatal crash at Mackay when,75
NA,a Fokker Friendship went into the sea at,75
NA,night. The cause of this has been guessed,75
NA,at or assumed.,75
NA,The worst feature of this debate is that,75
NA,honorable members should use aircraft,75
NA,crashes in this way. The accident rate is,75
NA,the lowest in the world and it should not,75
NA,be used as some sort of political lever. We,75
NA,should keep in mind that relatives are still,75
NA,interested in these matters. Our low acci-,75
NA,dent rate does great credit to the Depart-,75
NA,ment of Civil Aviation for the rules and,75
NA,regulations it has introduced and enforced.,75
NA,This action has made air travel in Australia,75
NA,extremely safe. If honorable members,75
NA,"want any proof of this, they need only go",75
NA,"to an insurance company, For a few",75
NA,"pounds, they can obtain a tremendous cover",75
NA,on their lives if they are about to travel,75
NA,in an aeroplane. The odds prove that air,75
NA,travel here is much safer than is travel in,75
NA,motor vehicles or by any other means. To,75
NA,bring in the accident rate and to talk about,75
NA,airlines in this way is a poor,75
NA,"In actual fact, the two airlines have much",75
NA,"the same record, and both can be extremely",75
NA,proud of their records. Their records are,75
NA,good because the Department of Civil Avia-,75
NA,"tion, administered by Senator Paltridge, lays",75
NA,down rules that make it almost impossible,75
NA,for aeroplanes to crash or for people to,75
NA,lose their lives.,75
NA,Mr Jones -Wh y does the Government,75
NA,not agree to appoint a royal commission?,75
Mr CHANEY ,I f we were to appoint,75
NA,a royal commission on everything you raised,75
NA,"in this place, we would never finish. I",75
NA,"have been here for only six years, but the",75
NA,Opposition has objected to everything the,75
NA,Government has done. Does that mean,75
NA,we should have a royal commission on,75
NA,everything? Surely it is about time the,75
NA,Opposition accepted something.,75
NA,The honorable member for East Sydney,75
NA,said that the proof that T.A.A. was a better,75
NA,and a safer airline was the number of,75
NA,Government members who travelled on it.,75
NA,If honorable members look at the statistics,75
NA,of airline travel they will find that there,75
NA,are certain passenger loading factors that,75
NA,must be observed if the airline is to operate,75
NA,profitably. If this chamber rose at 9 o'clock,75
NA,"to-night, I am quite certain that those mem-",75
NA,bers who are fortunate enough to live in,75
NA,Melbourne or Sydney only an hour or an,75
NA,"hour and a half away, would have a special",75
NA,aircraft provided for' them. They are not,75
NA,like us poor unfortunates who must travel,75
NA,to Western Australia.,75
NA,Mr Turnbull - I take longer to reach my,75
NA,home than you do.,75
Mr CHANEY , I accept that the honor-,75
NA,able member for Mallee takes longer to,75
NA,reach his home than we do. If a special,75
NA,aircraft were brought here for honorable,75
NA,"members, it would have a 100 per cent,",75
NA,load factor but would still operate at a loss.,75
NA,Any special aircraft must come here first,75
NA,without any load and therefore the maxi-,75
NA,"mum load factor it could have, even if",75
NA,every seat were occupied on the outward,75
NA,"flight, would be 50 per cent. I do not say",75
NA,that honorable members should be denied,75
NA,"this privilege, but a company such as",75
NA,Ansett-A.N.A. has a responsibility to its,75
NA,shareholders to ensure that its load factor,75
NA,"is above 50 per cent, or, in some instances,",75
NA,political trick. above 70 per cent.,75
NA,Mr L. R. Johnson -Thi s is a bit wide of,75
NA,the clause.,75
Mr CHANEY ,I t is a salient fact. It,75
NA,is very easy to stand up here and make,75
NA,statements that are not based on facts.,75
NA,Honorable members should obtain copies,76
NA,"of the book "" How to Lie with Statistics"".",76
NA,"Mr L. R. Johnson - Mr Chairman, I",76
NA,wish to take a point of order. Having in,76
NA,mind that you ruled the speech of the honor-,76
NA,"able member for Parkes out of order,",76
NA,I ask you whether the honorable member,76
NA,for Perth is directing his speech to the,76
NA,clause under discussion?,76
The CHAIRMAN ,Th e honorable memborrowers,76
NA,ber for Perth is relating his remarks to,76
NA,amendment moved by the Opposition. The,76
NA,honorable member for Parkes was not doing,76
NA,so. When I ruled that the honorable memproperty,76
NA,"ber for Parkes was out of order, I explained",76
NA,my reason and I pointed out that he was,76
NA,not directing his remarks to the,76
NA,to the amendment. There is no substance,76
NA,jn the point of order raised by the honoronly,76
NA,able member for Hughes.,76
Mr CHANEY , I want to say only one,76
NA,thing before I sit down.,76
NA,"Mr Daly -Tha t will be enough, too.",76
Mr CHANEY ," I think it will, actually.",76
NA,Your words are prophetic.,76
NA,"As I said, the debate was being drawn",76
NA,by the Opposition this afternoon. I and,76
NA,many of my colleagues are quite willing,76
NA,"sit here all night, if necessary. After all,",76
NA,I cannot catch an aeroplane back to Western,76
NA,"Australia until to-morrow afternoon, and",76
NA,"am quite willing to stay here all to-morrow,",76
NA,too. But I am determined to stand in my,76
NA,place at every opportunity and answer all,76
NA,the wild statements made by honorable,76
NA,members opposite. I refer honorable memstruction of homes.,76
NA,"bers to the Senate "" Hansard"" of 4th",76
NA,"October last at page 875. There, a table of",76
NA,"comparative safety factors is given, with",76
NA,"the passenger fatalities per 100,000,000",76
NA,miles flown. I am an air traveller and,76
NA,former member of the Royal Australian Air,76
NA,Force. I think the Deputy Leader of the,76
NA,Opposition ( Mr Whitlam) will agree with,76
NA,me that the way to bring on crashes in the,76
NA,Air Force was to talk about them or to,76
NA,about the safety factor; some one was,76
NA,to upset the safety record. I do not appremade,76
NA,ciate this subject being brought into the,76
NA,debate.,76
NA,Progress reported.,76
NA,WAR SERVICE HOMES BILL 1961.,76
NA,Second Reading.,76
NA,Debate resumed from 29th August (vide,76
NA,"page 541), on motion by Mr Roberton-",76
NA,That the bill be now read a second time.,76
Mr STEWART ,Lang) [8.30] -Thi s biil,76
NA,seeks to make two minor amendments to,76
NA,the principal act. One of those amend-,76
NA,ments relates to excess moneys paid in by,76
NA,from the War Service Homes,76
NA,the Division. It provides that the borrower,76
NA,may withdraw excess payments to effect,76
NA,"repairs, make additions or alterations to his",76
NA,and do other things to conserve,76
NA,and increase his equity in that property.,76
NA,This is in conformity with what has been,76
NA,clause or the practice for years now.,76
NA,The second amendment provides that,76
NA,eligible persons may obtain loans from,76
NA,the War Service Homes Division.,76
NA,"Apparently, because of loop-holes in the",76
NA,"act, there has developed a practice under",76
NA,which certain people who have not been,76
NA,enti.led to them have obtained loans from,76
NA,the War Service Homes Division. The,76
NA,Opposition does not oppose the measure.,76
NA,But we do argue that the administration,76
NA,"of the War Service Homes Act, under",76
NA,out which money is made available at 3 i per,76
NA,"cent, interest over long periods, has demon-",76
NA,to strated clearly that money can be lent at,76
NA,low rates of interest over long periods with,76
NA,profit to those administering the scheme.,76
NA,I We therefore suggest lhat the Government,76
NA,should introduce a scheme similar to this,76
NA,for the lending of money to all sections,76
NA,of the community at low rates of interest,76
NA,over long periods for the purchase or con-,76
NA,"I propose to show that, whilst the war",76
NA,"service homes scheme is a magnificent one,",76
NA,it has been deliberately hamstrung by this,76
NA,a Government in that it has suffered from,76
NA,shortage of funds. That the activities of,76
NA,the War Service Homes Division have been,76
NA,curtailed by this Government is plain from,76
NA,a perusal of the reports of that organiza-,76
NA,talk tion. Part V. of the act lays down the,76
NA,sure conditions under which advances may be,76
NA,"to eligible persons. For instance, an",76
NA,advance may be made to an eligible person,76
NA,to enable him to erect a dwelling house on,76
NA,"his holding, or to purchase land and erect",76
NA,"thereon a dwelling house, or to purchase a",76
NA,"dwelling house, together with the land on",77
NA,"which it is erected, or to enlarge a dwelling",77
NA,"house owned by him, and so on. The act",77
NA,also provides that the Director of War,77
NA,"Service Homes, may, at the discretion of the",77
NA,"Minister, take over existing mortgages or",77
NA,grant second assistance. It is only in very,77
NA,rare instances that those two provisions can,77
NA,be availed of.,77
NA,One important point which I wish to,77
NA,emphasize is that considerable delay takes,77
NA,place between the time of making applica-,77
NA,tion and the time of obtaining loans for,77
NA,the purposes set out in the act.,77
NA,"instance, the delay in obtaining finance for",77
NA,the purchase of existing properties is 20,77
NA,months while that in obtaining money for,77
NA,the carrying out of extensions is eighteen,77
NA,months. In those cases where applicants,77
NA,wish to buy homes which the division itself,77
NA,"has erected under group schemes, the delay",77
NA,in obtaining finance in Nesv South Wales,77
NA,"is sixteen months. In Queensland, it is",77
NA,"eight months, and in Western Australia six",77
NA,"months, although, of course, that time",77
NA,includes the time taken to construct the,77
NA,house. It is a long time now since loans,77
NA,could be obtained without having to wait,77
NA,for any time at all. Because of this long,77
NA,"waiting time, many ex-servicemen who",77
NA,would be eligible for assistance from the,77
NA,War Service Homes Division have found it,77
NA,necessary to obtain accommodation,77
NA,elsewhere.,77
Mr SPEAKER ,Hon. John MCLeay),77
NA,Order! I direct the honorable member's,77
NA,attention to the fact that this is not a wide,77
NA,open bill. I very much doubt whether,77
NA,question of waiting time can,77
NA,to this measure. 1 suggest that the honor-,77
NA,able member keep that in mind from now the bill:-,77
NA,on.,77
NA,Mr Haylen - I rise to order. Do you,77
NA,consider that this is not a wide open bill? fifty,77
NA,Have you a copy of the bill before you?,77
Mr SPEAKER ,Yes .,77
NA,Mr Haylen -I t concerns administration,77
NA,and the approval of loans. In my,77
NA,it is in essence a wide bill.,77
Mr SPEAKER ,Order ! This is a very,77
NA,restricted bill. 1 find difficulty in deciding,77
NA,whether the honorable member's remarks,77
NA,are relevant to the measure. I think a degree,77
NA,of tolerance should be exercised. At the,77
NA,"same time, I suggest that there should be no",77
NA,abuse of that tolerance.,77
Mr STEWART , I am endeavouring to,77
NA,show that further amendments to the act are,77
NA,required to make the scheme work in the,77
NA,way in which it was intended it should work,77
NA,when the act was introduced in 1918. Since,77
NA,"it was introduced in 1918, 224,775 persons",77
NA,have been assisted and of that number,77
NA,54 024 were returned servicemen from,77
NA,"World War I., while 170,751 were returned",77
NA,"servicemen from World War II . , Korea and",77
NA,"Malaya. Only 16 per cent, of those eligible",77
NA,For servicemen who returned from World War,77
NA,1. have received assistance. Possibly that,77
NA,is because from the end of World War I .,77
NA,until the 1930's money was not very plen-,77
NA,"tiful. During that period, we went through",77
NA,a great depression and many people who,77
NA,would have liked to buy homes were un-,77
NA,able to find the necessary deposit.,77
Mr SPEAKER ,Order ! The honorable,77
NA,member will not be in order in referring,77
NA,to waiting time. The honorable member is,77
NA,now opening up a wide discussion of the,77
NA,whole question of war service homes. This,77
NA,"is a very restricted measure, and I suggest",77
NA,that he try to co-operate with the Chair.,77
Mr STEWART ,Th e Opposition,77
