Speaker,Text,pageNumbers
NA,Australia. 1 think that one of our greatest,32
NA,problems today is that we want more skilled,32
NA,labour in Australia. One of our greatest,32
NA,inflationary pressures at the present time,32
NA,results from the fact that we do not have,32
NA,sufficient labour to carry out the develop-,32
NA,ment work thai is confronting us.,32
NA,So the first obligation of the Government,32
NA,is to create a healthy climate in which these,32
NA,"things can be done. If this is not done, then",32
NA,it is empty words to suggest that the,32
NA,Government recommends that they should,32
NA,be done. The Government does not oppose,32
NA,the principle of equal pay for the sexes and,32
NA,"has not opposed it in the United Nations,",32
NA,which is perhaps the highest authority in,32
NA,the world in which these matters can be,32
NA,debated. The Government has agreed to,32
NA,resolutions on this question which have been,32
NA,"moved at the United Nations, lt did not vote",32
NA,"for them, but tbat is only a technical point.",32
NA,It has agreed to the principle not only in,32
NA,Australia but also in the wider field of the,32
NA,United Nations. It is clear to me that it is,32
NA,not a matter on which we should make any,32
NA,decisions in this House. It should be left to,32
NA,13861/69--143 ],32
NA,the appropriate authority. Could you,32
NA,imagine anything worse than the govern-,32
NA,ment of the day making decisions in its own,32
NA,right in relation to wbat wages or salaries,32
NA,should be paid within the nation? What a,32
NA,chaotic situation that would create. That is,32
NA,why I said when I first rose to speak that,32
NA,I was a little surprised that this matter,32
NA,should be debated at this particular time.,32
NA,Perhaps we do not always agree with,32
NA,the decisions which are made in some,32
NA,"cases, but J believe that the correct policy",32
NA,is lo have a tribunal to sort out the,32
NA,particular issues. That is the only fair and,32
NA,just way in which a case can be debated,32
NA,and in which each side of an argument,32
NA,can be put in an unbiased way before an,32
NA,independent commission. It is not for,32
NA,governments and it is not for parliaments,32
NA,"to deal with these matters, other than to",32
NA,set up the machinery. 1 repeat again that,32
NA,in this atmosphere and with the machinery,32
NA,"we have in Australia, the first responsi-",32
NA,bility of the Government is to maintain a,32
NA,stable economy and to attract to this,32
NA,country the right sort of industries which,32
NA,can in fact employ labour-no t only men,32
NA,"but women. As we know, many women",32
NA,are in employment in Australia. The,32
NA,Governinent has a responsibility to main-,32
NA,"tain employment, and this has been done.",32
NA,In my own State the registered unemploy-,32
NA,ment figure was approximately .7% or,32
NA,.8% for a long time. It is slightly higher,32
NA,"than that at the present time, but it is fall-",32
NA,"ing again. In my book, it is too high and",32
NA,it results in inflationary pressure. The,32
NA,Government has a responsibility to ensure,32
NA,that a balance is maintained. It is not for,32
NA,a government to sort out differences of,32
NA,opinion between employers and employees.,32
NA,The government simply has to set up the,32
NA,necessary machinery. As thc honourable,32
NA,member for Parkes ( Mr Hughes) pointed,32
NA,"out, there are six State governments also",32
NA,to be consulted regarding the ratification,32
NA,of the particular conventions of which we,32
NA,have been speaking this afternoon. The,32
NA,procedure is even more complex in Aus-,32
NA,tralia than it is in many other countries.,32
NA,It is not an easy matter to sort out all thc,32
NA,problems associated with international,32
NA,conventions. It is difficult enough to sort,32
NA,out the many complications in Australia.,32
NA,I suggest that the Government has carried,32
NA,out its responsibilities in establishing tbe,32
NA,climate whereby this principle of equal pay,33
NA,for equal work can be introduced. The,33
NA,technical details can be overcome.,33
Mr BRYANT ,WUls) [4.37]-Di d 1 hear,33
NA,the honourable member for Canning ( Mr,33
NA,Hallett) aright when I heard bim suggest,33
NA,that we are at a stage of over full employ-,33
NA,ment?,33
NA,NA,33
Mr BRYANT,"I n fact, unemployment is",33
NA,part and parcel of his philosophy. He does,33
NA,not look like that kind of a person. The,33
NA,matter seems to be quite foreign to what we,33
NA,are debating this afternoon and to the,33
NA,general principles of the International,33
NA,"Labour Organisation. Of course, we know",33
NA,that honourable members opposite do not,33
NA,care a darn when people are out of work.,33
NA,They are more concerned with inflation,33
NA,than they are with people. It is time that,33
NA,they started to apply themselves to the,33
NA,human problem which is before the House,33
NA,this afternoon. We have listened to a suc-,33
NA,"cession of speakers, including apologists",33
NA,"for inaction, inequality, inability and insin-",33
NA,cerity who are capable of any slide of lan-,33
NA,guage or of logic rather than looking at the,33
NA,subject fairly and squarely. Today we are,33
NA,discussing Australia's attitude to conven-,33
NA,tions in accordance with its membership of,33
NA,"the International Labour Organisation, of",33
NA,which we were a foundation member and,33
NA,of which we have been a continuing mem-,33
NA,ber. In some ways it is an admirable orga-,33
NA,"nisation, as far as its structure is concerned.",33
NA,Governments send to the organisation dele-,33
NA,"gates from employers, employees and go-",33
NA,"vernment sources, all, I understand, with",33
NA,the right to vote as they think fit when,33
NA,they get there. It is an estimable organisa-,33
NA,tion in that regard.,33
NA,It has been disappointing that honourable,33
NA,members opposite do not face up to the,33
NA,question of where our responsibilities really,33
NA,lie. We have heard so much this afternoon,33
NA,about how difficult it is to do things. The,33
NA,honourable member for Parkes ( Mr,33
NA,Hughes)-h e has fled the field but I have,33
NA,no doubt he will return because he is a,33
NA,man of great honour and intrepid political,33
NA,capacity but with a lack of sagacity in this,33
NA,matter-sai d that we were unable to face,33
NA,up to the basic difficulties in ratifying this,33
NA,question in a federal system. This afternoon,33
NA,an attempt was made to dodge the issue,33
NA,by means of a point of order which was,33
NA,taken by my friend the honourable member,33
NA,"for Higinbotham ( Mr Chipp), and by means",33
NA,of remarks in the debate to the effect that,33
NA,some questions which we bave raised today,33
NA,are sub judice. The subject of equal pay,33
NA,for women is supposed to be sub judice.,33
NA,The matter of land rights of Aboriginals is,33
NA,"supposed to be sub judice. I for one, speak-",33
NA,"ing in the forum of this Parliament, do not",33
NA,recognise that sanction whatsoever. This,33
NA,Parliament must be in a position at any time,33
NA,to discuss whatsoever it needs to discuss and,33
NA,ought to discuss. It ought not be restricted,33
NA,in any way in these discussions.,33
NA,What are our duties? It has been said,33
NA,here that wc should look at comparable,33
NA,"countries. In fact, there are very few com-",33
NA,parable countries. Of the 130 nations in,33
NA,the world very few have our standard of,33
NA,living and very few now have continuing,33
NA,political stability. But of those 130 nations,33
NA,only some 30 or so could claim to be,33
NA,"democratic, taking the most liberal view of",33
NA,democracy. Only 12 or 15 countries would,33
NA,measure up to the kind of society most of,33
NA,us want to live and play a part in. Until,33
NA,2 or 3 years ago there were only four,33
NA,countries in which there were no political,33
NA,prisoners and Australia was one of them.,33
NA,I. am afraid we have spoilt our record by,33
NA,the way we have treated conscientious,33
NA,objectors. So we are not here this afternoon,33
NA,to follow other people. It is time Australia,33
NA,started to set some standards. Australia is a,33
NA,foundation member of and played a form-,33
NA,ative part in the creation of the United,33
NA,Nations. Our responsibility here today is to,33
NA,see whether we can apply the principles,33
NA,that have been worked out at these inter-,33
NA,"national organisations, to get them cracking",33
NA,in this community and not look continuously,33
NA,for an escape hatch.,33
NA,Like my colleagues the honourable mem-,33
NA,ber for Oxley ( Mr Hayden) and the Leader,33
NA,of the Opposition ( Mr Whitlam) I want to,33
NA,refer to the question of the Aboriginal,33
NA,people of Australia and talk about our,33
NA,"responsibility there, because our responsi-",33
NA,"bilities are now clear-cut. Has my friend,",33
NA,the honourable member for Parkes not,33
NA,"noted that in 1967, some 2 years ago, the",33
NA,people accepted a referendum proposal,33
NA,which placed the responsibility for,33
NA,Aboriginal people fairly and squarely on,33
NA,"this House, and that in fact the federal",33
NA,"system no Longer need apply in this regard,",34
NA,"if we have the sense, the wit and",34
NA,moral attitude towards,34
NA,"Aboriginals of Australia, 21,000 of whom",34
NA,live in the Northern Territory. We have,34
NA,also the responsibility to apply the high,34
NA,principles which are expressed in the prestates:,34
NA,amble to the amended constitution of the,34
NA,International Labor Organisation which we,34
NA,adopted when we put it into the Act in,34
NA,1947-49. I t reads:,34
NA,"The High Contracting Parties, moved by sentiis",34
NA,ments of justice and humanity as well as by,34
NA,desire to secure the permanent peace of the,34
NA,and with a view to attaining the objectives,34
NA,"forth in this Preamble, agree to the following",34
NA,Constitution of the International,34
NA,tion:,34
NA,Now let me come to ILO Convention No.,34
NA,107. How is it that we are unable to apply,34
NA,this convention? It seems to me that the,34
NA,issues are clear-cut and that our responsipeople,34
NA,bilities are well defined. Our constitutional,34
NA,responsibilities now Jie with this Parliament.,34
NA,Morally and in every other way it is our,34
NA,bounden duty to get on with the job.,34
NA,Article 2 of the Convention states:,34
NA,Government shall have the primary responsibility,34
NA,for developing co-ordinated and systematic,34
NA,for the protection of the populations concerned,34
NA,and their progressive integration into the life,34
NA,their respective countries.,34
NA,There is nothing in that section which has,34
NA,been beyond the scope of this Parliament.,34
NA,"This has been the case since May 1957, at shall",34
NA,least. Article 3 states:,34
NA,. . . special measures shall be adopted for,34
NA,"protection of the institutions, persons, property",34
NA,labour of these populations.,34
NA,This afternoon the point was made that we,34
NA,may not bring up the question of the people,34
NA,"of Yirrkala, who I believe are being visited",34
NA,"trampled on rather unceremoniously,",34
NA,because the matter is sub judice. But the,34
NA,fact is that the culture and institutions,34
NA,these people are not being treated with,34
NA,proper regard. This would also apply to,34
NA,Aboriginals at Wattie Creek and other,34
NA,Aboriginals in other parts of Australia.,34
NA,There are two or three other instances in,34
NA,which people are being moved off their,34
NA,land and that land is being taken over,34
NA,commercial purposes. Article 4 of the,34
NA,Convention states:,34
NA,due account shall be taken of the cultural and,34
NA,religious values and of the forms of social control,34
NA,Have we really observed that? Do we really,34
NA,the right observe it even in Papua and New,34
NA,"the 80,000 Guinea where, strange to say, we bave",34
NA,often been more tender about the rights of,34
NA,the people than we have about the rights,34
NA,of the Aboriginals in Australia. Article 6,34
NA,The improvement of the conditions of life and,34
NA,"work, and level of education of tbe populations",34
NA,concerned shall be given high priority . . .,34
NA,What have we done in that field? There,34
NA,nothing to stop us. No State government,34
NA,the is going to cavil if we produce plans which,34
NA,"world, are definite and dynamic in the field of the",34
NA,set development of Aboriginals and of their,34
NA,Labour Organisaeducation.,34
NA,I visited Yirrkala as recently as January.,34
NA,I have been there four or five times in the,34
NA,last 5 or so years. On each occasion I have,34
NA,taken a look to see what steps have been,34
NA,taken for the vocational training of these,34
NA,to meet the confrontation which will,34
NA,happen as a result of the mining develop-,34
NA,ment. I can see very little evidence of any,34
NA,such steps. Article 9 of the convention states:,34
NA,Except in cases prescribed by law for all citizens,34
NA,the exaction from the mcmbers of the populations,34
NA,concerned of compulsory personal services . . .,34
NA,action shall be prohibited. . . .,34
NA,of Do we take any steps to see that on pastoral,34
NA,properties and other places this type of,34
NA,service is not exacted from the Aboriginal,34
NA,people? Article 10 of the Convention states:,34
NA,Persons belonging to the populations concerned,34
NA,be specially safeguarded against the improper,34
NA,application of preventive detention. . . .,34
NA,thc It is time we did something about that.,34
NA,"and Back in January, accompanied by some of",34
NA,"my colleagues, I. visited the Woorabinda",34
NA,settlement in Queensland. An apologist for,34
NA,the system from the Melbourne 'Herald',34
NA,the place a few days later and said:,34
NA,"'Well, the prison was all right. It was cooler",34
NA,inside the prison than it was in the office.',34
NA,"of The prison, in fact, was as I described it.",34
NA,It was similar to the cells which were used,34
NA,the at Port Arthur over a century ago. The,34
NA,prison in this Aboriginal settlement con-,34
NA,sisted of 8 ft by 10 ft reinforced concrete,34
NA,cells. The prisoners are locked up in them,34
NA,for 14 days for the vicious and deplorable,34
NA,for and abominable crime of overdrinking. I,34
NA,say it is a pity this punishment was not,34
NA,applied-speakin g a.s a wowser-t o a lot,34
NA,of other people i f this is the system that,34
NA,"we are to adopt. But, of course, we do not",34
NA,apply it to others.,34
NA,What I am saying this afternoon is that,35
NA,most of the principles contained in Con-,35
NA,vention 107 are ones most members of this,35
NA,House would adopt in their personal rela-,35
NA,tionships. They are mostly ones that people,35
NA,here would say are correct and in line with,35
NA,the generally established ethics and morality,35
NA,of the people of this community. I can think,35
NA,of no sound reason why Convention 107,35
NA,ought not be adopted. It may well be that,35
NA,until the referendum in 1967 the Conven-,35
NA,tion could not have been ratified because,35
NA,there were 6 State authorities and 2 Com-,35
NA,"monwealth authorities, 1 here and the other",35
NA,in the Northern Territory. It also may well,35
NA,be that this matter was complicated by State,35
NA,rights and such things. But that situation no,35
NA,"longer exists. The political power, the con-",35
NA,stitutional authority and the dynamics of,35
NA,the whole system lie in this Parliament.,35
NA,While one may be able to say about equal,35
NA,wages-an d I do not agree with it-tha t,35
NA,"there are constitutional difficulties, and",35
NA,while this may apply to some other con-,35
NA,"vention, it does not apply to Convention",35
NA,107. It ought not apply to Convention 111,35
NA,and it should not apply to any of the con-,35
NA,ventions that are applicable to our external,35
NA,territories.,35
NA,"So, this afternoon, when we say we are",35
NA,concerned and disappointed at the Govern-,35
NA,ment's failure to establish principles of policy,35
NA,"in line with ILO conventions, we are not",35
NA,speaking here just simply for the sake of,35
NA,politics. We are speaking because we believe,35
NA,that in this field at least Australia has the,35
NA,capacity and the social dynamics established,35
NA,in the past to set up standards for the rest,35
NA,of the world and should not wait for some-,35
NA,one else to set the signpost up for us.,35
Mr CHIPP ,Higinbotham) [4.48]-,35
NA,Today we have had a very clever subterfuge,35
NA,perpetrated on this House by honourable,35
NA,members of the Opposition. I suppose it is,35
NA,good tactics in an election year to propose,35
NA,matters of public importance for discussion,35
NA,in this House each day. It gives the Opposi-,35
NA,"tion a chance of obtaining headlines, and",35
NA,this is good tactics. I can visualise the dis-,35
NA,cussion that was held by the Executive of,35
NA,the Australian Labor Party when it met,35
NA,"tbis week. When someone said: 'Well, Mr",35
NA,"Chairman, what is the matter to be pro-",35
NA,"posed for discussion on Wednesday?', I can",35
NA,imagine the honourable member for Stirling,35
NA,"( Mr Webb) would have chimed up and said,",35
NA,'What about giving equal pay another run?',35
NA,Someone with some sense of honour would,35
NA,"have said: 'No, we cannot do that because",35
NA,it is being discussed at the moment by the,35
NA,Commonwealth Conciliation and Arbitra-,35
NA,tion Commission'. Now we see the subter-,35
NA,fuge- a rather clever one. Equal pay is not,35
NA,the item on the agenda; it is the ratification,35
NA,of the International Labor Organisation's,35
NA,conventions. Once the honourable member,35
NA,for Stirling paid lip service to this for about,35
NA,"60 seconds, he then proceeded for the rest",35
NA,of his speech to discuss equal pay. This,35
NA,was notwithstanding a point of order 1 took.,35
NA,I am glad I did this because I was able to,35
NA,register my deep concern. I now re-register,35
NA,"my concern, Mr Deputy Speaker. While",35
NA,paying ultimate courtesy to Mr Speaker and,35
NA,"to yourself, I think this Parliament is drift-",35
NA,ing into a very dangerous method of pro-,35
NA,"cedure if, when a matter is before a court,",35
NA,"or a body such as the Commission, which",35
NA,"has all the stature and facilities of a court,",35
NA,that matter is allowed to be debated by,35
NA,politicians in the heat and the cut and thrust,35
NA,of parliamentary debate..If this is done I,35
NA,think the integrity of one of our most,35
NA,"precious institutions, the judiciary, will be",35
NA,under some threat.,35
NA,"However, having made that comment,",35
NA,"which I do with respect, let me come back",35
NA,"to the substance, if one can so natter it, of",35
NA,the matter of public importance which is,35
NA,before the Chair. The honourable member,35
NA,"for Stirling, who is a notoriously gallant",35
NA,"man as far as ladies are concerned, ended",35
NA,his speech with a rather extraordinary,35
NA,attack on the women of today. He said-,35
NA,and I hope I do not misquote him-tha t,35
NA,the women of today do not have the sting,35
NA,and the courage of their counterparts 50,35
NA,years ago. I hope the honourable member,35
NA,for Watson ( Mr Cope) will admonish his,35
NA,colleague for being so ungallant in this the,35
NA,twentieth century. What a dreadful thing to,35
NA,say! Why blame the women of today for,35
NA,the present situation? The honourable mem-,35
NA,"ber for Stirling, who has had considerable",35
NA,"experience in the trade union movement,",35
NA,knows very well that no trade union in,35
NA,Australia has raised the question of equal,35
NA,pay since this Government has been in,35
NA,office. The Government came into office in,35
NA,1949. For 19 years the trade union move-,35
NA,ment has not brought this matter before an,35
NA,industrial tribunal in any form. With,35
NA,"respect to you, Sir. I challenge any honour-",36
NA,able member opposite to quarrel with that,36
NA,by way of interjection. They cannot because,36
NA,"it is an absolute fact. Instead, we have the",36
NA,facade of an equal pay debate raised twice,36
NA,a year in this Parliament by Opposition pub-,36
NA,licity seekers to keep the pot boiling as,36
NA,far as the women are concerned. I take,36
NA,objection to the honourable member for,36
NA,Stirling blaming the women of today for,36
NA,the situation which exists.,36
NA,I wish to refer briefly to the International,36
NA,Labour Organisation conventions themselves.,36
NA,The honourable member for Stirling and,36
NA,the Leader of the Opposition ( Mr Whitlam),36
NA,know full well that the ILO conventions,36
NA,"are not adopted, cannot be adopted and",36
NA,were not meant to be adopted by all mem-,36
NA,ber states attending ILO conferences. The,36
NA,statistics would in a flash indicate that this,36
NA,is true. The average number of ratifications,36
NA,per member nation is 29. The honourable,36
NA,member for Stirling knows this. Why does,36
NA,he not say so and put his case in proper,36
NA,context? Australia has ratified 26 of the,36
NA,resolutions which have been brought for-,36
NA,ward. Some of the resolutions brought for-,36
NA,"ward are clearly inappropriate to Australia,",36
NA,as the honourable member well knows.,36
NA,Canada hns ratified only 24 and the United,36
NA,"States only 7. Of course, the honourable",36
NA,member would be aware of this. He would,36
NA,also know that under the constitution of,36
NA,the ILO a membeT state is not obliged to,36
NA,ratify a convention and that until a con-,36
NA,vention is ratified by a member state that,36
NA,state has no obligation to obey it. On this,36
NA,point I wish to refer to the comments made,36
NA,by the Leader of the Opposition. The,36
NA,honourable gentleman makes an outward,36
NA,fetish of credibility. He has an obsession,36
NA,about the credibility of other people. He,36
NA,should look inwards at some stage and,36
NA,examine his own credibility. He said that,36
NA,Australia now has a legal obligation under,36
NA,the conventions to grant equal pay and other,36
NA,things. So that I cannot be accused of being,36
NA,"inaccurate in quoting what he said today,",36
NA,I will also quote what he said on 18th May,36
NA,1965. It appears at page 1565 of Hansard.,36
NA,"Referring to equal pay, the Leader of",36
NA,Opposition said:,36
NA,The Commonwealth now has some obligations,36
NA,internationally.,36
NA,"So, he is on record as having said it.",36
NA,he knows as well as anybody else in,36
NA,place tbat Australia has no legal obligations,36
NA,to follow these conventions until it has in,36
NA,fact ratified them. As the honourable mem-,36
NA,"ber for Canning ( Mr Hallett) said, we rely",36
NA,on the conciliation and arbitration system,36
NA,to bring changes of wage conditions and,36
NA,wage rates into being.,36
NA,I come now to the effect of equal pay,36
NA,on the economy. I state categorically that,36
NA,I am for equal pay. I have stated this before.,36
NA,But I want it implemented in such a way,36
NA,that it will not fracture our economy or,36
NA,disadvantage the women who now consti-,36
NA,tute 30% of the work force. Over 1.5,36
NA,million females are now in the work force.,36
NA,What would be the effect on certain indus-,36
NA,"tries, such as the food processing industry",36
NA,"and the textile industry, where a predomi-",36
NA,"nance of females is employed, if equal pay",36
NA,for work of equal value were immediately,36
NA,impacted on them? The obvious result would,36
NA,be wholesale unemployment of women in,36
NA,those industries and skyrocketing costs.,36
NA,These industries are a very important and,36
NA,significant component of the cost of living,36
NA,structure which affects the working man.,36
NA,"Does the Opposition want this Parliament,",36
NA,without the expertise and analytical back-,36
NA,"ground of a full scale investigation, which",36
NA,only the Commonwealth Conciliation and,36
NA,"Arbitration Commission can undertake, to",36
NA,"pluck a figure out of the air-sa y $200m,",36
NA,$300m or $400m-a s an estimate of what,36
NA,equal pay would cost the economy without,36
NA,going into it in a scientific way? The Oppo-,36
NA,sition regards this subject as a matter of,36
NA,definite public importance and has brought,36
NA,on the debate on that basis. I regard the,36
NA,Opposition's attitude as sheer humbug be-,36
NA,cause the Commonwealth has already made,36
NA,it quite clear in the case that is being heard,36
NA,"at present, as the honourable member for",36
NA,"Stirling would know, that it does not object",36
NA,"to equal pay. Mr Woodward, Q.C, has",36
NA,stated the Commonwealth's position. The,36
NA,Commonwealth is in favour of it. He has,36
NA,pleaded with the Commission not to allow,36
NA,any undue delay in its decision.,36
NA,"In conclusion, may I add one more",36
NA,the remark of my own? I hope that equal pay,36
NA,for women will be with us soon because,36
NA,I have never been persuaded of the justice,36
NA,or the equity of a breadwinner in a family,36
NA,who docs precisely the same work as a,36
NA,But man and with equal efficiency having to,36
NA,this go home with a pay packet which is,36
NA,reduced by 25% and look after an aged,37
NA,or ill mother. The same applies with a,37
NA,widow who has to look after 3 or 4,37
NA,children. I make the plea that I have,37
NA,made before in this House: If the Com-,37
NA,misison does not see its way clear to equate,37
NA,"wage levels at this point of time, will the",37
NA,Government take action of a social services,37
NA,nature to equate the income of the female,37
NA,breadwinners in a family with that of their,37
NA,male counterparts until such time as equal,37
NA,pay is instituted for equal work?,37
Mr DEPUTY SPEAKER , Mr Lucock),37
NA,-Th e discussion is now concluded.,37
NA,INCOME TAX ASSESSMENT BILL 1969,37
NA,Second Reading,37
NA,Debate resumed from 26 March (vide,37
NA,"page 917), on motion by Mr Swartz:",37
