Speaker,Text,pageNumbers
NA,that are available no matter where any per-,66
NA,"son may live, we ought to be able to",66
NA,achieve something.,66
NA,My regret is that in this instance we are,66
NA,repealing what is the fundamental charter,66
NA,of this Parliament and replacing it with a,66
NA,very singlcminded education objective. In,66
NA,some ways I am one of those who believe,66
NA,that scholarships do not have strictly educa-,66
NA,tional objectives. They represent some ideal,66
NA,which I reject as an educational ideal. 1,66
NA,"know, of course, that some of the honour-",66
NA,able members opposite seem to be com-,66
NA,pletely out of sympathy with our approach,66
NA,to education. 1 think it was the honourable,66
NA,member for Angas ( Mr Giles) who sug-,66
NA,gested that the Leader of the Opposition,66
NA,( Mr Whitlam) was dredging up some,66
NA,elements of the class war. I am not sure,66
NA,"what exactly he did say, but I know that",66
NA,he attacked the concept that there is,66
NA,economic deprivation in the field of educa-,66
NA,tion in Australia. One only has to look at,66
NA,the honourable member's background to see,67
NA,that he does not know what serious to,67
NA,"economic deprivation could mean, and 1 in Victoria.",67
NA,would not like to wish economic hardship,67
NA,upon him.,67
NA,At the present time the Minister for,67
NA,Education and Science ( Mr Malcolm,67
NA,Fraser) in all his public announcements,67
NA,seems to be concerned with non-State,67
NA,education. We can look at his public,67
NA,announcements and see that they are always,67
NA,concerned with some political gimmickry,67
NA,such as what we are to do with what are,67
NA,"technically called independent, schools.",67
NA,"course, independent schools are non-existent",67
NA,anyhow. I do not see any approach to,67
NA,education in the total sense. I would remind,67
NA,honourable members that the 1945 Educabe,67
NA,tion Act imposed some seven or eight,67
NA,obligations upon the Commonwealth Office,67
NA,of Education. One would presume that the,67
NA,Department of Education and Science has,67
NA,become the beir of the functions of this,67
NA,body. What has been happening to some,67
NA,of these obligations? One obligation was,67
NA,advise the Minister on matters relating,67
NA,education. I. have no doubt that that is,67
NA,done. Another obligation was to establish,67
NA,and maintain a liaison on matters relating,67
NA,to education with other countries and with,67
NA,the States and to arrange for consultations,67
NA,between Commonwealth and,67
NA,authorities on matters relating to education.,67
NA,There were three or four more of them.,67
NA,- The interesting point is that tbis charter,67
NA,was enshrined in legislation and it was,67
NA,for all to read. Tonight we are repealing,67
NA,"that charter, we are removing it from the",67
NA,legislation. The Government makes no,67
NA,attack upon what I believe are the features,67
NA,of Australian education that ought to be,67
NA,under attack. What are we doing about probably,67
NA,inequalities in education? The Leader,67
NA,"the Opposition, tbe Deputy Leader of the",67
NA,Opposition ( Mr Barnard) and the honourpresent,67
NA,able member for Dawson (Dr Patterson),67
NA,have pointed out where some of these women,67
NA,inequalities lie. There is no doubt that,67
NA,are great inequalities in this country arising,67
NA,from geography. Some of it is political,67
NA,geography inasmuch as there is a difference,67
NA,between the capacity of universities in New,67
NA,South Wales and universities in Victoria,67
NA,absorb students. This is the product of,67
NA,political attitudes that have developed over,67
NA,a quarter to half a century. People in,67
NA,South Wales in general have greater access,67
NA,university education than people who live,67
NA,Then there is the geographical disability,67
NA,imposed upon people who live in remote,67
NA,areas. What are we doing lo allow people,67
NA,who pass through the secondary stage of,67
NA,"education in the remoter areas, of Australia",67
NA,to find satisfactory accommodation and,67
NA,financial support when they do go to the,67
NA,university? What are we doing to supply,67
NA,some mobility inside the university scheme,67
NA,so that the Australian National University,67
NA,"Of could be expanded by perhaps 4,000 or",67
NA,"5,000 students, or so that the university in",67
NA,"Tasmania, the one at Townsville or the one",67
NA,at Armidaie could be expanded? This might,67
NA,a more satisfactory method of approach-,67
NA,ing the problem tban expanding the metro-,67
NA,politan universities. One does not have to,67
NA,look very far to realise that there are great,67
NA,areas of economic deprivation in Australian,67
NA,education. I represent one of the industrial,67
NA,"areas of Australia, an area in which the",67
NA,to great majority of the. people are in the,67
NA,to lower income bracket. Every family whose,67
NA,"being children manage to matriculate, and even",67
NA,those whose children achieve a Common-,67
NA,"wealth scholarship, have a great struggle to",67
NA,get their children through to the university.,67
NA,The Government has made no approach to,67
NA,State this problem at all. The general Common-,67
NA,wealth scholarship scheme is based upon,67
NA,"what might be called academic excellence,",67
NA,or whatever it is that one achieves to get,67
NA,a satisfactory result at the secondary and,67
NA,"there tertiary level. As I said, there is no",67
NA,approach to this problem at all.,67
NA,Tlie great wastage in Australian educa-,67
NA,tion is the disability imposed upon women,67
NA,"by their sex. As I have said before, this is",67
NA,not a political' issue but is some-,67
NA,of thing to do with the society in which we,67
NA,live. I tbink the ngures show that at the,67
NA,"time about 60,000 or 70,000 young",67
NA,"men and about 25,000 or 30,000 young",67
NA,in Australia are at the universities.,67
NA,"there Between 40,000 and 50,000 young women",67
NA,"have the same capacities as their brothers,",67
NA,"and same social backgrounds, the same",67
NA,economic backgrounds and the same intel-,67
NA,lectual capacities. These girls who take out,67
NA,to prizes at certain levels of education some-,67
NA,how drop out of the system. This is a most,67
NA,tragic wastage. It is one that all honourable,67
NA,New members have to take up in some way or,67
NA,other if Australia is to get the greatest,68
NA,possible advantage from the intellectual,68
NA,capacity of the community.,68
NA,There is also the wastage based upon,68
NA,race. 1 raised this question this morning,68
NA,"during another debate, but during the day",68
NA,I received a new bulletin from the Com-,68
NA,monwealth Bureau of Census and Statistics.,68
NA,It showed the Aboriginal population of,68
NA,Australia. Figures at page 29 of that docu-,68
NA,ment show that 39.23% of the Aboriginal,68
NA,population have no education at all. Of,68
NA,course that includes 16% under school age;,68
NA,so 23% of the adult Aboriginal population,68
NA,have no education whatsoever. But in the,68
NA,non-Aboriginal community only about 1%,68
NA,have no education. Any Australian govern-,68
NA,ment conscious of its duty would be tackling,68
NA,these problems.,68
NA,What do we intend to do about the,68
NA,environment in which education is carried,68
NA,out? I suggest that honourable members,68
NA,should visit the schools in Canberra. These,68
NA,schools may have their deficiencies. I have,68
NA,heard Canberra citizens complain about,68
NA,"them, but compared with schools in the rest",68
NA,of Australia or in most areas of Australia,68
NA,"they are, although not exactly luxurious,",68
NA,substantially in advance of other schools.,68
NA,The Minister for Education and Science,68
NA,represents the western part of Victoria. I,68
NA,understand from his friends that he owns,68
NA,most of it. I suggest that he should drive,68
NA,a little further north out of his electorate,68
NA,"and visit the city of Horsham, which is",68
NA,the centre of one of the wealthiest pastoral,68
NA,areas in Australia. I visited the high school,68
NA,there last week. I did not know that there,68
NA,was any such school building in Australia.,68
NA,I represent an area in which there is a,68
NA,"great amount of neglect of school buildings,",68
NA,but thc Horsham High School building is a,68
NA,disgrace to Australia's education system.,68
NA,It is a disgrace to those people who have,68
NA,represented that area in this place and in,68
NA,the State Parliament. The walls of the,68
NA,building are cracking and the roofs are fall-,68
NA,ing in. One area of the walls is buttressed,68
NA,up and part of it is capable of inflicting,68
NA,both serious injury on people should it col-,68
NA,lapse and hardship by inflictions on health.,68
NA,I suggest that tbe Minister for Education,68
NA,and Science should take a drive up there and,68
NA,have a look at the buildings instead of,68
NA,worrying about some of the wealthy schools,68
NA,which his children and the children of his,68
NA,friends attend. He might even come along,68
NA,to the Moreland High School in my elec-,68
NA,torate which has some substantial new build-,68
NA,ings but where there is no room for any,68
NA,of the children to spread their wings.,68
Mr SPEAKER,Order ! I would remind,68
NA,the honourable member for Wills that this,68
NA,Bill deals with scholarships.,68
Mr BRYANT,Tha t is right.,68
Mr SPEAKER,Order! It does not cover,68
NA,the whole field of education. I remind the,68
NA,honourable member that I cannot see the,68
NA,relevance between the state of schools and,68
NA,the question of scholarships. I suggest the,68
NA,honourable member might get back to the,68
NA,Bill.,68
Mr BRYANT,"Wit h due respect, I point",68
NA,out that clause 3 repeals the Education,68
NA,Act of 1945. That Act sets out a number,68
NA,of functions for the Ministry and I am,68
NA,suggesting that those functions ought to have,68
NA,"been retained. I am producing, I hope,",68
NA,evidence that it needs Commonwealth atten-,68
NA,"tion. However, I intend to conclude my",68
NA,speech in a moment because I want my col-,68
NA,league the honourable member for Griffith,68
NA,"( Mr Donald Cameron) to have his say, not",68
NA,that he will often vote against the gag when,68
NA,it is applied against me.,68
NA,Fundamental requirements of education,68
NA,exist in the field of teaching. The Minister,68
NA,for Education and Science should consider,68
NA,making available scholarships to women in,68
NA,"their 30s, 40s and even in their 50s. A great",68
NA,"reservoir of skills, intellectual and otherwise,",68
NA,would be available in the community if,68
NA,there were a special system for training such,68
NA,"people. If Australia needed 20,000 or 30,000",68
NA,secondary teachers within the next few,68
NA,"year, with dramatic and dynamic planning",68
NA,and by offering something to women whose,68
NA,family responsibilities were nearing comple-,68
NA,tion it could obtain these teachers and have,68
NA,them qualified within 4 or 5 years. I have,68
NA,noted amongst my own circle of friends,68
NA,and in my own family the way in which,68
NA,many women are taking up university,68
NA,education quite late in life. Women in their,68
NA,40s still have a quarter of a century of profit-,68
NA,able professional endeavour before them.,68
NA,The present approach is quite unimaginative.,68
NA,The scholarship system that is inflicted upon,68
NA,the Australian community is a perpetuation,68
NA,of the continual competitive system of elitist,68
NA,education. Labor's philosophy is one of,69
NA,totality as compared to the competitive,69
NA,system wbich the Liberal Party and its,69
NA,lite inflict on society generally. I hope,69
NA,the Minister for Education and Science will,69
NA,shortly bring some omnibus legislation,69
NA,before the House to tell honourable,69
NA,members what the Government's proposals,69
NA,are to systematise Australian education.,69
Mr DONALD CAMERON ,Griffith) and,69
NA,"[10.28]- I fully realise that, time is moving",69
NA,on and the Minister. for' Education and,69
NA,Science ( Mr Malcolm Fraser) is preparing,69
NA,to close the debate. I refer briefly to.,69
NA,the charge . of . political gimmickry know,69
NA,laid by the honourable member. for Wills,69
NA,( Mr Bryant) against the Minister and his,69
NA,claim that every .time the Minister speaks,69
NA,what he says has something to do with gim-.,69
NA,micks. It is very easy for the honourable,69
NA,member for Wills to overlook the fact that,69
NA,the Minister has stated-thi s is not a,69
NA,of gimmickry-tha t in 1964-65 the expendiwork,69
NA,ture qn Commonwealth scholarships was,69
NA,$ 12.7m; in 1969 it was $28.9m; and that,69
NA,it is anticipated that in 1971-72 it will,69
NA,$35m. Since. 1964-65 the expenditure has,69
NA,"increased almost, threetimes, and yet",69
NA,the honourable member for Wills ( Mr,69
NA,shrugs it off. I refer also to remarks,69
NA,"made by the honourable, member",69
NA,"for Dawson (Dr Patterson), particularly his",69
NA,"claim about the shortage of veterinary,",69
NA,scientists. Perhaps the lack of incentive,69
NA,not just at the scholarship stage. It may,69
NA,be the end result when these men are out,69
NA,in the field. The honourable member for,69
NA,"Dawson, who himself is so close to the soil,",69
NA,knows that many prospective veterinary raised,69
NA,scientists opt out of this field and choose,69
NA,"medicine instead, perhaps because of the",69
NA,attractiveness and glory of the medical proin,69
NA,fession. I agree with him when he says that,69
NA,the situation has arisen in the country areas . which I have been concerned. The Leader,69
NA,where more than ever before technical,69
NA,knowledge is required.,69
NA,I liave risen to speak mainly on the,69
NA,ject of mature age scholarships. I am very,69
NA,pleased to see the Minister for Education,69
NA,and Science present tonight. He is aware,69
NA,that I have written various letters to,69
NA,on this subject. I am quite sure that the,69
NA,Minister himself is quite concerned about,69
NA,"this problem. However, for the purpose",69
NA,the record I want to state that at present,69
NA,we have 250 mature age scholarships. In,69
NA,my electorate in recent weeks I have had,69
NA,no fewer than eight people over 25 years,69
NA,satelof age who have approached' me with the,69
NA,that problem of whether or not they would,69
NA,receive a mature age scholarship. Many of,69
NA,these people are in their late 20s or early,69
NA,"30s. They left school at an early age and,",69
NA,in this society of ours which offers oppor-,69
NA,"tunity for self education, they, have reached",69
NA,the stage where they haye entered university,69
NA,have passed their first year. I sincerely,69
NA,hope that serious consideration will be,69
NA,given either to increasing the lower age,69
NA,limit to 30 or 35 or increasing'the number-,69
NA,of mature age scholarships available. I,69
NA,that a sad situation exists now. in that,69
NA,many second year students have no hope,69
NA,whatsoever ' of ' obtaining a scholarship.,69
NA,Many of them have acquired up to three,69
NA,distinctions and credits in their first year's,69
NA,"studies. Many who have perhaps done early,",69
NA,years at the university on a pari time basis,69
NA,matter and have had to face married life and,69
NA,during the day have had early failures,69
NA,takeninto consideration. I cannot allow the,69
NA,opportunity to pass without saying some-,69
NA,be thing on their behalf. I hope that a freer-,69
NA,attitude will be taken in - relation to this,69
NA,matter. I see that the Leader of the House-,69
NA,Erwin) is hot on my trail to ...s/se,69
NA,"me to cease, so on that note I 'conclude.",69
NA,Mr MALCOLM FRASER'. (Wannon-,69
NA,Minister for Education and. Science) [10.32],69
NA,is -i n reply- I would like to thank honour-,69
NA,able members for the remarks that they have,69
NA,made during this debate. I am glad to see,69
NA,that the Opposition in broad terms supports,69
NA,the Bill but a number of matters have been,69
NA,"that do, in part at least, require some",69
NA,kind of answer. I would like to apologise to,69
NA,the House for riot having been able to be,69
NA,"the chamber throughout the' debate, but-",69
NA,Cabinet has been meeting'on matters with,69
NA,1,69
NA,"of the Opposition ( Mr Whitlam), I am",69
NA,"advised, made a number of points, not all",69
NA,strictly related to this Bill. He made some,69
NA,subpoints which I think need greater examina-,69
NA,tion than he has perhaps given them. For,69
NA,"example, he said that he would abolish all",69
NA,university fees and that this would cost,69
NA,"him Slim. All right, that is Slim, but where",69
NA,are one's priorities in terms of education?,69
NA,It is not just one amount.of Slim. It is,69
NA,of Slim or an increasing amount for every,69
NA,year thereafter. If one sets this beside the,69
NA,other things that could be done in support,69
NA,"of education with Slim, I suggest that it is",70
NA,extremely doubtful whether one would give,70
NA,the abolition of university fees complete and,70
NA,absolute priority.,70
NA,I should also like to raise another ques-,70
NA,tion in relation to the abolition of university,70
NA,fees which I tbink I mentioned once before,70
NA,in this House and which representatives of,70
NA,unions in this place might do very well to,70
NA,consider. I tbink it is very widely recognised,70
NA,that whatever advances might be made in,70
NA,education in the future the majority of our,70
NA,population will not be going to universities.,70
NA,An increasing number and an increasing,70
NA,percentage will go to universities and an,70
NA,increasing number and an increasing per-,70
NA,centage will go to colleges of advanced,70
NA,"education. But no country, I think, has",70
NA,achieved a .situation in which a majority,70
NA,of its people of university age do in fact,70
NA,go to a university. What is the justice of,70
NA,taxing the unionist and the average worker,70
NA,"throughout the country, to provide a free",70
NA,"education for a doctor, a lawyer or a",70
NA,"solicitor, who will be going out into the",70
NA,world with professional qualifications enab-,70
NA,ling him to charge fees at an extraordinarily,70
NA,high level-i n a large part a charge on the,70
NA,unionists who are said to be the supporters,70
NA,of the Labor Opposition? I believe that this,70
NA,is a matter which members sitting behind,70
NA,the Leader of the Opposition might do well,70
NA,"to consider, and to see where the true",70
NA,"balance of justice, need and equity lies in",70
NA,relation to this matter. Tt is by no means,70
NA,as simple as the Leader of the Opposition,70
NA,suggests.,70
NA,"He has also said, as I think other speakers",70
NA,"have said, that more scholarships are",70
NA,"needed. Of course, it is always easy to say",70
NA,that more are needed. This is one of the,70
NA,things that the Opposition always can do,70
NA,and it is the Opposition's privilege to be,70
NA,"able to do it. But in saying that, one should",70
NA,not ignore the fact that repeatedly through-,70
NA,out its period in office the Government has,70
NA,increased tbe number of scholarships. It,70
NA,was the Government that first introduced,70
NA,thc Commonwealth scholarship schemes. It,70
NA,"was the Government, when the present",70
NA,Prime Minister ( Mr Gorton) was Minister,70
NA,in Charge of Commonwealth Activities in,70
NA,"Education and Research, which did most to",70
NA,broaden our concern for education and,70
NA,"which first did most, to be specific, in",70
NA,"relation to scholarships, to increase the",70
NA,variety of scholarships and their numbers.,70
NA,Advanced education scholarships were,70
NA,introduced in 1966. Secondary scholar-,70
NA,ships and technical scholarships were,70
NA,introduced in 1965. Over the years,70
NA,the number holding scholarships has,70
NA,"increased from a litde under 6,500 to",70
NA,"an estimated 56,500 in 1969, and the num-",70
NA,ber of new scholarships that were available,70
NA,to be awarded in any one year has in-,70
NA,"creased from 3,000 to 24,150. So the",70
NA,Government has given a great deal of atten-,70
NA,tion to these matters. Growing from,70
NA,"nothing, the annua] bill for scholarships will",70
NA,"in a relatively short time rise to $35m, so",70
NA,it cannot be said that the Government has,70
NA,not given a great deal of attention to these,70
NA,"matters-muc h more attention, I believe,",70
NA,than the Opposition might have believed,70
NA,we have in fact given. But still the criticism,70
NA,"comes, as one would expect.",70
NA,I believe that these figures and this per-,70
NA,formance show how unreasonable is the,70
NA,claim of the Leader of the Opposition that,70
NA,we use scholarships to restrict education,70
NA,to an elite. This certainly cannot be said,70
NA,when we look at the numbers of those who,70
NA,are now finding places in universities. There,70
NA,"were 100,000 last year, when the United",70
NA,"Kingdom, with five or six times our popu-",70
NA,"lation, had an objective, according to one",70
NA,"article I read, of about 225,000 university",70
NA,students in 1972-73. The United Kingdom,70
NA,swelled its numbers of university students,70
NA,"by signing over, at one stroke, a number",70
NA,of technological institutions. By signing a,70
NA,piece of paper it called these institutions,70
NA,universities. That is one of the ways in,70
NA,which it achieved a figure much less than,70
NA,ours. It is a case of Australia having per-,70
NA,formed very much better than the United,70
NA,Kingdom in this regard. The Leader of the,70
NA,"Opposition also said, I am advised, that the",70
NA,scholarships do not basically provide assis-,70
NA,tance to those who are in need. Not only,70
NA,do they provide for those who are in need,70
NA,but also that need must be judged on,70
NA,ability. There is no point in providing,70
NA,scholarships to those who have not a reason-,70
NA,able chance and a reasonable opportunity,70
NA,of passing through university without too,70
NA,great a difficulty. This is one of the bases,70
NA,on which the scholarships are in fact made,70
NA,available. The living allowance is provided,70
NA,for those who win scholarships and who,70
NA,are in fact most in need. So the scholarships,70
NA,system does a great deal to assist people who,70
NA,would otherwise not find places in univer-,71
NA,sities. The days are very far gone when,71
NA,one's parents own finances could find one,71
NA,a place at a university irrespective of one's,71
NA,own ability and irrespective of other con-,71
NA,siderations. The able student can get to a,71
NA,"university and, I believe, does.",71
NA,It should be worth noting that either,71
NA,the Martin Report on the Future of Ter-,71
NA,tiary Education in Australia or one of the,71
NA,Australian Universities Commission reports,71
NA,at a time when Sir Leslie Martin was Chair-,71
NA,"man, indicated that one of the bases of",71
NA,judging university entrants should be that,71
NA,students be able to pass through university,71
NA,in minimum time or in minimum time plus,71
NA,one year. In fact not all of those who are,71
NA,awarded Commonwealth scholarships,71
NA,achieve this performance and there are,71
NA,numbers in universities who after some,71
NA,difficulty pass but do so with a greater,71
NA,"time lag than one year. We know, of course,",71
NA,that about one-third of those who do enter,71
NA,universities fail to leave with any degree,71
NA,This merely makes the point tbat we are,71
NA,not restircting entry to universities only to,71
NA,those who can qualify in a minimum time,71
NA,or only to those who can qualify at all.,71
NA,There are sufficient places to enable a great,71
NA,"number of people to go to a university,",71
NA,even though their chances of passing at the,71
NA,bottom level of entrance to universities are,71
NA,not particularly high.,71
NA,The Leader of the Opposition again,71
NA,returned to the old criticism that we do not,71
NA,adopt the Martin Report recommendations,71
NA,on teacher training. Once again he ignored,71
NA,the fact that a great many of those recom-,71
NA,mendations were the particular prerogative,71
NA,"of the States and it was for the States, hav-",71
NA,ing regard to their own administration and,71
NA,"to their own systems, which had the",71
NA,responsibility of giving effect to those,71
NA,recommendations. One of those was that,71
NA,teacher training should be extended to 3,71
NA,years. This is something on which every,71
NA,"State has now acted, but it was the States",71
NA,"which had to make a decision, and they",71
NA,have done so. The same report suggested,71
NA,that the Commonwealth should spend,71
NA,$2.5m on capital facilities for teacher,71
NA,ing matched by a similar sum from the,71
NA,"States. Tn fact, we have spent $24m on",71
NA,"teacher training, or are in the process of",71
NA,spending it. and these are unmatched funds,71
NA,"to provide an additional 5,000 teacher",71
NA,trainee places.,71
NA,The Canberra College of Advanced,71
NA,Education is also actively planning to intro-,71
NA,duce courses in teacher training. So it can-,71
NA,not by any means be said that we have,71
NA,been ignoring this important matter of,71
NA,teacher training. I thought in view of the,71
NA,criticisms that have been made concerning,71
NA,the number of teachers that the House may,71
NA,be interested in the improved pupil-teacher,71
NA,ratios which have occurred over recent,71
NA,times in spite of the fact that there has,71
NA,been an explosive growth in the demand,71
NA,for education caused not so much by a,71
NA,higher number in a particular age group,71
NA,or by immigration as by a much higher,71
NA,percentage of those in the upper years of,71
NA,secondary schooling in the 15 to 18 year,71
NA,old age group seeking to stay at school,71
NA,longer than was once the case. This per-,71
