Speaker,Text,pageNumbers
NA,families and whose parents cannot pay for,51
NA,their university education and who cannot,51
NA,qualify for a Commonwealth scholarship,51
NA,under the present scheme are the students,51
NA,who concern members on this side of the,51
NA,House. The Government must face up to,51
NA,its responsibilities on tbe loss of oppor-,51
NA,tunities and the wastage of talent at this,51
NA,level.,51
NA,"Having made those points, I would like",52
NA,to say in summary that the Opposition does,52
NA,not oppose this Bill. It welcomes the very,52
NA,substantial modifications to the legislation,52
NA,outlined by the Minister for Education and,52
NA,Science. 1 have tried to draw attention to,52
NA,the deterioration of the present scholarship,52
NA,scheme and the need for rehabilitating and,52
NA,supplementing it. Unfortunately the Minis-,52
NA,ter for Education and Science is not in the,52
NA,"House tonight, but I hope that when he",52
NA,reads the points that have been made by,52
NA,myself in resuming this debate on behalf,52
NA,of the Opposition and the points that will,52
NA,be made by my colleagues who will follow,52
NA,me in this debate he will incorporate these,52
NA,suggestions in lhe Bill. If it is not possible,52
NA,to incorporate these provisions now I hope,52
NA,the Government will give serious considera-,52
NA,tion to amending the legislation as soon as,52
NA,possible.,52
Mr ARTHUR ,Barton) [8.50]- I rise to,52
NA,support the Scholarships Bill 1969 for our industrial life.,52
NA,several reasons. Before stating those reasons,52
NA,may I say that Ibe attitude of the Aus-,52
NA,tralian Labor Party to education has always,52
NA,amazed me. Honourable members on the,52
NA,"Opposition side are great theoreticians,",52
NA,their main forte is in trying to cast suspicion,52
NA,on the aims and integrity of the Governthe,52
NA,"ment in this field. I can understand this,",52
NA,because the record of the Labor Party in,52
NA,thc field of education is so lamentable that,52
NA,the Parly tries to hide its inadequacy by,52
NA,making wild promises and vaguely veiled,52
NA,aspersions. I often wonder whether it is,52
NA,really interested in education or only,52
NA,gaining votes at the next election. It must,52
NA,be rather frustrating for members of the,52
NA,Labor Party to view the great strides,52
NA,Government has made in tbe past decade.,52
NA,Let us face the fact that the performance,52
NA,of the Labor Party in the field of educaof,52
NA,"tion has been a poor one, and the speech",52
NA,the Deputy Leader of the Opposition ( Mr,52
NA,Barnard) made tonight will do nothing to,52
NA,change ihis. I often wonder why the Oppobodies,52
NA,sition still carries on with its,52
NA,attempt to keep alive in Australia the,52
NA,phoney class attitude that permeates almost,52
NA,every phase of its political philosophy. That,52
NA,attitude was perpetuated tonight in,52
NA,speech of the Deputy Leader of the Oppodebate,52
NA,"sition, and it is just as phoney today as",52
NA,was when the Opposition adopted it a am,52
NA,"decade ago. This type of snobbery, inverted",52
NA,though it may be. does little justice to Ihe,52
NA,young people of today who care nothing,52
NA,for the time worn cliches of three decades,52
NA,"ago, and who have completely rejected the",52
NA,emotional appeals to class hatred that the,52
NA,Opposition is consistently making in this,52
NA,House. The Opposition should recognise,52
NA,that we are at the end of tbe 1960s and,52
NA,not in the depression of the 1930s.,52
NA,Another thing that amazed me about the,52
NA,speech of the Deputy Leader of the Oppo-,52
NA,sition was that he spent most of his time,52
NA,extolling the virtues of having a university,52
NA,education and uttered not a word about the,52
NA,education of those who wished to become,52
NA,tradesmen or technicians. For a Party which,52
NA,professes to have an interest in the working,52
NA,man and his family it is astonishing that,52
NA,he did not even mention the thousands of,52
NA,splendid young men and women who every,52
NA,year train to become tradesmen or tech-,52
NA,nicians. These people are the backbone of,52
NA,The first reason why 1 support this Bill,52
NA,is that I have great respect for the vast,52
NA,strides in education this Government has,52
NA,but made possible in the last decade. One does,52
NA,not need to have a long memory to recall,52
NA,days when it was considered to be quite,52
NA,improper for the Federal Government to,52
NA,take any part in the development of educa-,52
NA,tional facilities in Australia. Education was,52
NA,"regarded strictly as a State function, and",52
NA,attempts by the Federal Government to,52
NA,assist the States with specific projects were,52
NA,in looked upon with great suspicion. This,52
NA,"Government, under successive Ministers for",52
NA,"Education and Science, first the then Sena-",52
NA,this tor John Gorton and now the Honourable,52
NA,Malcolm Fraser. has initiated moves vastly,52
NA,to improve the facilities for and the quality,52
NA,education in Australia. Most of the,52
NA,advances made by the Government were,52
NA,"new and imaginative, but almost invariably",52
NA,they were met with hostility by the Oppo-,52
NA,sition in this Parliament and by the outside,52
NA,which control the Labor Party and,52
NA,extraordinary dictate its policies.,52
Mr SPEAKER,Order ! I remind the,52
NA,the honourable member for Barton that the,52
NA,on the Scholarships Bill does not,52
NA,it range over the whole field of education. I,52
NA,finding it a little difficult to see the,52
NA,relevance of these remarks to this Bill.,52
Mr ARTHUR, J hope that I can remedy,53
NA,that. J think it may be of interest to honourstudents,53
NA,able members to have a look at the types,53
NA,of scholarship schemes in operation at the,53
NA,moment because not everyone realises what,53
NA,is being done by tbis Government in the,53
NA,field of education. The first one is the,53
NA,monwealth postgraduate awards scheme,53
NA,which has been in existence since 1959 and,53
NA,was introduced by the Liberal Government,53
NA,after it considered the Murray report on,53
NA,Australian universities. The scheme provides,53
NA,assistance for well qualified graduates for,53
NA,an approved programme of postgraduate,53
NA,"studies, usually leading to either a master's",53
NA,degree or a doctorate at an Australian uni-,53
NA,versity. The benefits payable under this,53
NA,"scheme comprise a stipend of $2,350 per",53
NA,"annum, an annual contribution of $400 to",53
NA,"go towards research costs for each student,",53
NA,and other allowances.,53
NA,The second scheme is the Commonwealth,53
NA,university scholarship scheme. This scheme,53
NA,was commenced in 1951 by tbe Liberal,53
NA,Government as the Commonwealth scholar-,53
NA,ship scheme when awards were offered for,53
NA,first degree and diploma courses at univer-,53
NA,sities and tertiary courses at other approved,53
NA,institutions such as technical colleges. In,53
NA,1966 the Commonwealth scholarship,53
NA,"scheme was replaced by two schemes, the",53
NA,Commonwealth university scholarship,53
NA,scheme and the Commonwealth advanced,53
NA,education scholarship scheme.,53
NA,The Commonwealth university scholarship,53
NA,scheme provides awards for full-time and,53
NA,part-time study in first degree and diploma,53
NA,courses at Australian universities. Pre-,53
NA,viously the detailed administration of these,53
NA,awards was carried out by the State Educa-,53
NA,tion Departments. It was decided that the,53
NA,Commonwealth should take over this func-,53
NA,"tion, starting at the beginning of 1968. There",53
NA,are three types of scholarships-ope n,53
NA,"entrance scholarships for matriculation,",53
NA,later year scholarships for students who,53
NA,"have completed some university studies, and",53
NA,mature age scholarships for students who,53
NA,have turned 25 years of age.,53
NA,Benefits paid by the Liberal Government,53
NA,include the payment of all compulsory fees,53
NA,for all award holders without means test. A,53
NA,living allowance is also payable subject to,53
NA,a means test. Maximum living allowance,53
NA,rales in 1969 are $559 per annum for,53
NA,living at home and $904.80 per,53
NA,annum for students Hving away from home.,53
NA,Then we bave the Commonwealth,53
NA,advanced education scholarships which were,53
NA,provided by this Government under a,53
NA,Com- separate scheme from the beginning of,53
NA,"1966, assistance for similar courses being",53
NA,previously available under the old Com-,53
NA,monwealth scholarship scheme. Awards are,53
NA,given by this Government for full-time and,53
NA,part-time study in diploma and other,53
NA,approved tertiary courses at technical col-,53
NA,leges and similar institutions. There are two,53
NA,kinds of scholarships-ope n entrance,53
NA,scholarships for students at matriculation,53
NA,"standard, and later year scholarships for",53
NA,students who have completed part of an,53
NA,approved course. Benefits are the same as,53
NA,those paid under the university scholarship,53
NA,scheme.,53
NA,The fourth scheme is Commonwealth,53
NA,secondary scholarships scheme. The first,53
NA,secondary scholarships were taken up in,53
NA,1965. Awards are given for the final 2,53
NA,years of secondary schooling. Benefits avail-,53
NA,able to a secondary scholarship holder,53
NA,"include a living allowance of $200 per year,",53
NA,a text book and equipment allowance of,53
NA,"$50 per year, and up to $150 per year for",53
NA,"compulsory tuition fees, examination fees",53
NA,and service fees on production of receipts.,53
NA,The last one is the Commonwealth tech-,53
NA,nical scholarships scheme. The first tech-,53
NA,nical scholarships were taken up in 1965,53
NA,by this Governnient. Awards are given,53
NA,mainly for certificate level courses at tech-,53
NA,nical institutions. Benefits available to a full-,53
NA,time technical scholarship holder are: a,53
NA,"living allowance of $200 per year, a text-",53
NA,book and equipment allowance of $50 per,53
NA,"year, and up to $150 per year for com-",53
NA,"pulsory tuition fees, examination fees and",53
NA,service fees on production of receipts. A,53
NA,technical scholarship holder taking a course,53
NA,part-time receives an allowance of $100 per,53
NA,year and reimbursement of compulsory fees,53
NA,up to $100 per year.,53
NA,I want to emphasise that all these,53
NA,schemes were introduced by this Liberal,53
NA,Government and that all these payments,53
NA,were made by the Government. These were,53
NA,completely new advances in the field of,53
NA,education. In order to have some perspec-,53
NA,tive in this matter I would like to draw,53
NA,the attention of the House to the number,53
NA,of awards given under each heading in,54
NA,1969. The number for ihe Commonwealth,54
NA,postgraduate awards is 650; Commonwealth,54
NA,"university scholarships, 9,500; Common-",54
NA,monwealth advanced education scholar-,54
NA,"ships. 1,500; Commonwealth secondary",54
NA,"scholarships, 10,000; and Commonwealth",54
NA,"technical scholarships, 2,500. This gives an",54
NA,overall total of 24.150 for the year 1969.,54
NA,The number of scholarship holders in train-,54
NA,ing in 1969-thi s includes people who are,54
NA,undertaking the second and third year of,54
NA,"their course-i s estimated to be 56,500,",54
NA,which is a far cry from the total of only,54
NA,"6,444 in 1951, just after the Labor Govern-",54
NA,ment went out of office. The appropriations,54
NA,to finance these scholarships for the year,54
NA,"1968-69 totalled 828.880,000 compared",54
NA,with S632.194 in 1950-51. I mention these,54
NA,figures because the Opposition in this,54
NA,Parliament talks as though it had made,54
NA,great strides in the field of education when,54
NA,"it was last in power. The reverse is true,",54
NA,however. The AustraUan Labor Parly has,54
NA,done little about education except talk about,54
NA,it and it was left to Liberal-Country Party,54
NA,governments to get down to work,54
Mr SPEAKER,Order ! There is far too,54
NA,much conversation on my lefi.,54
Mr ARTHUR, I can understand that.,54
NA,This cannot be palatable to the Opposition.,54
NA,It was left to the Liberal-Country Party,54
NA,governments to introduce the forward-,54
NA,looking policies of the past decade.,54
Mr WHITLAM ,"H e reads so badlv, Mr",54
NA,Speaker.,54
Mr ARTHUR, I hear mutterings from,54
NA,the Opposition benches and particularly,54
NA,from the Leader of the Opposition to the,54
NA,effect that the Labor Party has not been in,54
NA,"power in the past rwo decades, so it cannot",54
NA,"be blamed. This is true, despite the fact",54
NA,that it has tried at election after election,54
NA,to buy votes of the Australian people by,54
NA,offering fantastic measures that it knew,54
NA,could not be carried out by any responsible,54
NA,governmeni and that it knew it would never,54
NA,have the responsibility to carry out. It,54
NA,"true that the Labor Party, due to the sound",54
NA,"common sense of the Australian voter, has",54
NA,not been in power in the federal sphere,54
NA,"for 20 years, but it was in power in New",54
NA,South Wales for several decades and it,54
NA,the education system deteriorate to such,54
NA,an extent,54
Mr SPEAKER,Order ! I would again,54
NA,remind the honourable member for Barton,54
NA,that his remarks are very wide of the con-,54
NA,tents of the Bill. 1 can see in the last few,54
NA,statements no real relevance to the Bill.,54
Mr ARTHUR," I apologise, Mr Speaker",54
NA,I thought that they were most apposite.,54
NA,I hope I may be able to finish that sentence.,54
NA,When the Labor Party was in power in,54
NA,New South Wales it let the education system,54
NA,deteriorate to such an extent,54
Mr SPEAKER,Order ! If the honour-,54
NA,able member persists in abusing the forms,54
NA,of the House 1 shall have to deal with him.,54
Mr ARTHUR, I certainly do not per-,54
NA,sist. I am sorry if I was transgressing. I,54
NA,thought I could finish my sentence. Let,54
NA,me say that this Bill brings up to date the,54
NA,requirements needed for such a vast scheme,54
NA,"to operate effectively, while at the same",54
NA,time it gives full protection to those who,54
NA,"come under its various, wide-ranging rami-",54
NA,"fications. It also, 1 am pleased to note,",54
NA,emphasises the need to preserve ministerial,54
NA,discretion. Those of us who deal constantly,54
NA,with a wide range of educational problems,54
NA,"for our constituents, as 1 do in Barton, know",54
NA,how many apparent anomalies crop up in,54
NA,such a vast scheme as this. While we may,54
NA,not always agree with the decisions of the,54
NA,"Minister when he exercises his discretion,",54
NA,we know that these decisions are the result,54
NA,of long and searching research into each,54
NA,"individual case and that the Minister is, to",54
NA,"use a well worn Australianism, completely",54
NA,fair dinkum in both his approach and his,54
NA,outlook. We know that under his wise and,54
NA,imaginative administration we will have new,54
NA,and improved assistance given to both State,54
NA,and independent schools in Australia in the,54
NA,years ahead. I commend this Bill.,54
Mr WHITLAM ,Werriwa-Leader of,54
NA,the Opposition) [9.3]-Australian s increas-,54
NA,ingly recognise that their Federal Govern-,54
NA,ment must treat education as a national,54
NA,is problem and a national challenge. They,54
NA,recognise that a nation's children can enjoy,54
NA,equal opportunities for the development of,54
NA,their talents only if its education system is,54
NA,financed and planned on a national basis.,54
NA,let They recognise that education is the key,54
NA,"to national development, national prosperity",54
NA,and national survival. Successive Liberal,54
NA,governments and successive Liberal Minis-,55
NA,"ters responsible for education have, as a",55
NA,"matter of policy, minimised the role of the",55
NA,Commonwealth in education. They have,55
NA,resisted the development of new Common-,55
NA,wealth initiatives in educational matters.,55
NA,Liberals are as anxious to slow down the,55
NA,inevitable increase in government expendi-,55
NA,ture on schools as they are to slow down,55
NA,expenditure on hospitals and urban services.,55
NA,"Accordingly, both State and Federal",55
NA,"Liberals assert that schools, hospitals and",55
NA,urban services are State functions. They,55
NA,know that the best way to restrict govern-,55
NA,ment expenditure on any activity is to say,55
NA,that the particular activity is one for the,55
NA,"States, which have fewer financial resources",55
NA,"than the Commonwealth, and which raise",55
NA,tbeir revenue by indirect rather than direct,55
NA,"taxation, by regressive rather than by pro-",55
NA,"gressive taxation. Again, Liberals seek con-",55
NA,stantly to dampen public interest in educa-,55
NA,tion and to lower the temperature of public,55
NA,debate by insisting that there is no crisis,55
NA,education and by resisting demands for any,55
NA,national inquiry into education. State,55
NA,inquiries into education such as the inquiry,55
NA,recently commenced by the Government of,55
NA,South Australia are no substitute for a com-,55
NA,prehensive investigation at the national,55
NA,level.,55
NA,Mr Kevin Cairns- I take a point of,55
NA,"order, Mr Deputy Speaker. Are these",55
NA,matters appropriate to the Commonwealth,55
NA,"Scholarships Bill, in view of tbe ruling given",55
NA,in relation to the remarks of the last,55
NA,speaker?,55
Mr DEPUTY SPEAKER , Mr Lucock),55
NA,-Tber e is no substance in the point of,55
NA,order.,55
Mr WHITLAM,I t would be possible,55
NA,for every State government to conduct an,55
NA,inquiry into its own education system,55
NA,without establishing the national needs and,55
NA,national priorities around which national,55
NA,expenditure may be organised with greatest,55
NA,"advantage, and for which public support",55
NA,"would be most extensive. Moreover,",55
NA,Liberals use scholarships as a device to,55
NA,defer free education for all by paying the,55
NA,fees of a minority. Commonwealth scholarwere,55
NA,ships mask the failure of our national,55
NA,government to follow comparable national,55
NA,governments into sharing the provision of,55
NA,education without charge. Commonwealth,55
NA,Secondary Scholarships are a typical,55
NA,example of the way in which Liberals defer,55
NA,pressing educational reforms by buying off,55
NA,potentially critical minorities within the,55
NA,electorate. They exemplify this Govern-,55
NA,1,55
NA,ment's cynical disregard for social priori-,55
NA,ties. Secondary Scholarships are awarded,55
NA,on the basis of intellectual tests and not,55
NA,"nnancial need. Inevitably, therefore, they",55
NA,favour students who have benefited from,55
NA,"social and economic advantages, not least",55
NA,among them access to superior schooling.,55
NA,"Inevitably, a high proportion of the funds",55
NA,which are provided go to parents who are,55
NA,well able to afford to keep their children,55
NA,at school. A questionnaire sent to members,55
NA,of the Victorian Association of Head-,55
NA,masters in 1964 elicited the information,55
NA,that of 2151 Secondary Scholarship winners,55
NA,only 24 would have left school if they had,55
NA,not been awarded a scholarship. The,55
NA,headmasters pointed out that there was no,55
NA,way of knowing how many of the children,55
NA,in who in fact left school would have been,55
NA,able to remain if they had received,55
NA,appropriate assistance. It is highly unlikely,55
NA,that the Secondary Scholarship scheme has,55
NA,significantly increased the number of young,55
NA,Australians who are able to complete a,55
NA,"secondary education. Instead, the system",55
NA,has enhanced the situation described by the,55
NA,Director of Secondary Education in Vic-,55
NA,"toria, Mr R. A. Reed, on 3rd September",55
NA,1968. He said:,55
NA,"Compared with secondary schools, the cele-",55
NA,brated rat race of industry and commerce is,55
NA,like a picnic forfieldmice.Education is the only,55
NA,human enterprise based on a confident anticipa-,55
NA,tion of failure. We not only accept failure as,55
NA,"inevitable, we actually build it into the system.",55
NA,Liberals are unable to see that at this stage,55
NA,of Australia's development it may be worth,55
NA,devoting a signincant part of our resources,55
NA,to developing the capacities of all our,55
NA,citizens. They cannot understand that there,55
NA,is no way of accurately sorting out human,55
NA,"beings, and that attempts to do so in",55
NA,secondary schools invariably cost the,55
NA,nation some of its finest intellects and most,55
NA,useful graduates.,55
NA,Twenty-four thousand young Australians,55
NA,admitted to universities in 1968 but,55
NA,"only 6,000 were able to secure Common-",55
NA,wealth scholarships. The total enrolment,55
NA,"of Australian universities rose to 102,000,",55
NA,"of whom only 25,000 were Commonwealth",55
NA,scholars. The Secretary of the Social,56
NA,Science Research Council of Australia,56
NA,commented:,56
NA,It seems to me impossible to argue that barely,56
NA,more than a quarter of the new students entering,56
NA,degree courses in our universities are worth a,56
NA,scholarship. At least one half should qualify for,56
NA,such an award.,56
NA,The leader writer of the 'Australian',56
NA,pointed out:,56
NA,Penalisation of a substantial proportion of,56
NA,"annual matriculants, otherwise well qualified, by",56
NA,the government's failure to offer financial,56
NA,tance is inexcusable.,56
NA,The number of Commonwealth scholar-,56
NA,ships available to university entrants has in,56
NA,"fact declined from 40% in 1951, when the",56
NA,"postwar scheme was launched, to 25% in",56
NA,"1968. The additional 1,500 scholarships",56
NA,foreshadowed in the 1968 Budget will not,56
NA,"even restore the 1951 situation, far less",56
NA,improve it. Nor will the situation be im-,56
NA,proved by the Minister for Education and,56
NA,"Science ( Mr Malcolm Fraser) arguing, as",56
NA,he did in the 'Australian' on 20th May,56
NA,"1968, that:",56
NA,When Commonwealth assistance to students,56
NA,being considered it is important to survey the,56
NA,whole field and not just one particular aspect,56
NA,assistance.,56
NA,University students who now enjoy not,56
NA,much more than half as good a chance of,56
NA,obtaining a scholarship as they did in 1951,56
NA,are no better off for knowing that scholara,56
NA,ships are available elsewhere for education,56
NA,of a different kind. The loss the nation,56
NA,sustains when talented people are unable,56
NA,to undertake university studies for want,56
NA,financial assistance is not reduced because,56
NA,scholarships are now available at colleges,56
NA,"of advanced education. The Minister, moreResearch.",56
NA,"over, should be in no doubt about the",56
NA,status to which colleges of advanced educa-,56
NA,tion have been reduced by the policies of,56
NA,his Government. The essential features,56
NA,these colleges set out in the report of the,56
NA,Martin Committee have now largely disthe,56
NA,"appeared. In particular, the Martin",56
NA,mittee's insistence that they should acquire,56
NA,status equivalent to that of universities has,56
NA,been explicitly abandoned.,56
NA,The public no longer believes and the,56
NA,Government no longer troubles to,56
NA,that colleges of advanced education are anyTeacher,56
NA,"thing other than also-rans, providing",56
NA,limited tertiary education at bargain prices.,56
NA,The Minister himself is so little concerned,56
NA,with the colleges that he has so far been,56
NA,unable to tell me for how many students,56
NA,they cater. The Government is so little con-,56
NA,cerned that it provides for the colleges only,56
NA,one-fifth the number of scholarships which,56
NA,"it provides for universities. Even so, the",56
NA,pent-up demand for a tertiary education is,56
NA,so great that the colleges are already falling,56
NA,a prey to many of the difficulties which,56
NA,beset the universities. Quotas have already,56
NA,been imposed for a number of courses in,56
NA,"assisNew South Wales, Victoria, South Aus-",56
NA,tralia and Western Australia. They will,56
NA,become much more widespread if the Wark,56
NA,Committee succumbs to pressure from,56
NA,State governments and recommends grants,56
NA,for the new triennium which are unrealisti-,56
NA,cally low. Restricted entry applies also,56
NA,throughout the nation's teacher training col-,56
NA,leges. Although the number of Higher Cer-,56
NA,tificate examination candidates in New South,56
NA,Wales increased between 1967 and 1968 by,56
NA,"5,000, only 200 additional places were pro-",56
NA,"vided in teachers colleges, and at least J .500",56
NA,eligible applicants were refused studentships.,56
NA,The Martin Committee recognised that any,56
NA,is serious plan for tertiary education in Aus-,56
NA,of tralia must include teacher training. By,56
NA,refusing to accept responsibility for teacher,56
NA,"training in any form, Sir Robert Menzies",56
NA,abandoned at a stroke the possibility of an,56
NA,integrated tertiary system. He abandoned,56
NA,unique opportunity to improve the quality,56
NA,of Australian schools. He abandoned a most,56
NA,relevant method of helping the struggling,56
NA,State authorities cope with their education,56
NA,of crises. The present Prime Minister ( Mr,56
NA,Gorton) was then Minister-in-charge of,56
NA,Commonwealth Activities in Education and,56
NA,While Sir Robert Menzies on 24th March,56
NA,1965 was extracting the heart from the,56
NA,of Martin proposals in the House of Represen-,56
NA,"tatives, Senator Gorton was extracting it in",56
NA,other place. He said in his ministerial,56
NA,Comstatement on the report that:,56
NA,"Therefore, while we do not in the least deni-",56
NA,grate the importance of the Committee's recom-,56
NA,"mendation in this field, we believe that it is one",56
NA,"where action can be, and should be, left to the",56
