speakerGroups,Speaker,text,pageNumbers
296,Mr CORBETT ,"Maranoa) (10.15)-We have just listened to the honourable member for Burke ( Mr Keith Johnson) who seemed to wander a bit. He also seemed very concerned about the situation in Victoria and asked us to prove that money was provided under the Bill. I think the boot should have been on the other foot. If he is complaining about money not being provided under the Bill he should prove that that is the case. This Bill is part of the package of finance for the States distributed by the Commonwealth Government. One cannot but be critical of the incessant clamouring of State governments and State politicians about the limitation of funds to the States by the Federal Government. These unjust and ill-founded utterances should be put to rest once and for all. There is far too much complaint from the States about the funds they get from the Commonwealth. Under this Bill, which owes its existence to arrangements formulated by Liberal-National Country Party governments in years gone by, the States will receive an injection of some $477.933m as a straight out grant. There is ho interest payable on it. There is no repayment and there is JO control. The States have complete autonomy in regard to what they do with this money. It is part of the total Loan Council gram of $ 1,433.8m for the year 1977-78. The States will receive under tax sharing lation announced in the Budget $4,336.lm, increase of $62lm or 16.8 per cent on the preincrease vious year. Yet the Opposition in its amendment claims that in real terms this is reducing the funds available to the States. How can that properly claimed under the circumstances? When one This takes into account Loan Council programs and other special grants to the States, total general purpose grants to the States are estimated to increase by $685.lm in 1977-78. This again is contradiction of the amendment moved by the Opposition. All State governments therefore should be able to bring down Budgets which will provide maximum services without any increase in State taxation either direct or indirect. In the States get a very good deal from the Commonwealth Government although they do not always acknowledge it. They do not have any excuse if their objectives cannot be achieved in a reasonabletime.No State government needs to be comprised of financial wizards to make its budget balance in view of the generosity of the Commonwealth Government-and that should be emphasised- a generosity which has to be maintained under very difficult financial circumstances. Under this Bill every possible consideration has been extended to the States. It allocates money without an interest component. The grant component was introduced because of a realisation by the Commonwealth Government that some State government responsibilities do not attract any income and it is reasonable that the States should get money free of interest to service those responsibilities. In this regard we can mention the money spent on education, on the provision of schools and police stations. They are what might be termed essential needs in a modern era. Interest is charged on other Loan Council programs by virtue of the fact that money expended by State governments on such things as power houses and dams does attract a financial return. An examination of Budget Paper No. 6 for the years 1976-77 and 1977-78 reveals some other interesting facts. In 1976-77 the securities on issue on account of the States per head of population at 30 June 1976 were as follow: In New South Wales $770.64; in Victoria $766.18; in Queensland $762.74; in South Australia $1,117.15; in Western Australia $952.95; and in Tasmania $1,837, giving an average debt of $848.94. The annual interest liablitity per head, State proby State, was: New South Wales, $54.58; Victoria, $54.40; Queensland, $52.80; South Australia, $80.09; Western Austraha, $68.05; legisand Tasmania $130.90. That means an average an interest of $60.14 per head. There was an in 1977 both in the amounts and in the interest. For example, the average interest went up from $60.14 to $65.53, showing that a lot of be money is being invested in Government bonds. is partly due to the fact that this money is made available to the States. Notwithstanding the fact that the Commonwealth gives money to the States free of interest as a grant, under the conditions which I have just enumerated, it is disturbing to note that people in all States have this increasing amount of funds going into bonds and, consequently, an increasing debt through the Commonwealth to Australian bond holders. fact I hope to see an expansion of investment in enterprises which will provide employment and generally increase the welfare of the community as a whole. Similarly, in Budget Paper No. 6, Table No. 8, wefindthat total securides on issue per head of population, as far as the Commonwealth Government's debt to Austrahan bond holders is concerned, shows an increase from $647.50 per head as at 30 June 1976 to $795.65 per head as at 30 June 1977. The point I am making is the need for the Government to try to make conditions available which will attract that money into other avenues of investment. Unless we of the free enterprise parties do something to reverse this trend of investment in bonds, we are failing in the trust which has been placed in us by those who owe their allegiance to our political philosophy. Quite obviously the Government has to create an environment which wtil maximise the opportunities for people to invest in private enterprise with the hope of reward and not allow their funds to be used to a significant degree in the manner in which I have just been talking about, that is, to be used by the Government again for other developments. It is much better for the commumty at large to have this money flowing through private enterprise investment. We have to create an environment where porters people will take risks in creating job opportunigovernment-interes ties by allowing them a reasonable chance of reward for effort expended and risks undertaken. This is something which the Opposition will never concede. Honourable members opposite say that if there is a falling off in expenditure and labour in the private enterprise section, they will make that up with Government enterprise. That under has been a great failure. It was a tragic failure in high interest the years when Labor was in office. We as a traUans the opportunity Government have a responsibility to accept the homes and to purchase some challenge to carefully examine ways of improving productivity and, consequently, competiUfe tiveness. State governments must also be madedous aware of this. There should be general cothat operation in this area. I want to be critical of a words growing feeling in many areas of Australia of a Whitlam point of view which calls upon the Government infectiousGovernment to provide all types of services. when it was in government encouraged too much interest rates.correspondingly dependence on the Government. That is somedid reduce interest thing we should try to overcome. It is not easy, time is appropriate for but we should make the attempt. My political philosophy leads mefirmlyto the point of view that what we want is more initiative, more tralians paying their own way and less governments ment interference in the basic responsibilities the individual. There should be less union interSome ference and fewer trivial and unjustified strikes. Governments should be providing only the foundation for development for the Australian people. The people should supply the basic framework and butid on that under a free enterprise system. This Bill goes part of the way in decreasing the amount of interest paid by State governments. Again, this is contrary to the amendment moved by the Opposition. One of the thrusts of the Budget, of course, is to reduce interest rates. A deficit of reasonable proportions, such as this year's deficit, is the catalyst which wtil allow interest rates to decrease. This is something which the Austrahan Labor Party Government never recognised and does not seem to recognise now. Australia has been pricing itself out of world markets. Interest has been a contributing factor to this. The statistical bulletin put out by the Reserve Bank of Australia in June 1976 shows that the interest rate in June 1973 was 7.75 per cent for trading bank overdraft and that increased to 9.5 per cent in June 1974 and to 11.5 per cent in June 1975, the last year of the Whitlam regime. It is interesting to note that in February 1976, a few months after the FraserAnthony Government was returned to office with an overwhelming majority of support from the Australian people-that showed Labor supwhat the people thought of their type of t rates were reduced to 10.5 a per cent per annum. Quite obviously this is intolerably high. It has mitigated against people being able to compete in international markets.",104
297,Mr BRYANT ,When are you going to reduce it?,105
298,Mr CORBETT,"The rate was 11.5 per cent your Government; do not forget that. This rate has denied many young Austo purchase their own of the comforts of which aUow people to absorb the tremenpressures exerted by modern living; and is what this Government aims to do. Actions speak louder than words. We take action. We get from the other side, but no action. The quite obviously had an enthusiasm for huge deficits in the The Opposition Budget with regular increases in The Fraser-Anthony Government rates and I beUeve that the further reductions. This Bill is positive proof that relationships beAustween the State and the Commonwealth governshould be a partnership. A partnership of automatically denotes a share of responsibUity. of the States appear to me to look upon a partnership as something which allows them to have a vice Uke grip on the right to have troUed spending, and absolute this Government without having to act responsibly because they get money lected by this Government. For too long too many of them have been telling the loud and long about aU they would do if only they could get more money from the Federal Government. I ask honourable members to bear in mind that the Federal Government has reduced the deficit from $4.5 bUUon to $2.2 billion in an endeavour to get economy back on to a reasonably sound basis. Under a BUl which has been introduced into honourable the Parhament-the Income Tax (Arrangements 10.30 p.m. with the States) BUl 1977-al l the States have the right to raise their own taxes but they wiU this because it is not poUticaUy advantageous do so. It is about time they gave up blaming Commonwealth Government for being unable to accede to the insatible demands of their electo tors. For too long they have avoided telhng the people that increased services can be provided on. only through increased taxation. They have avoided telhng the people that. should be telling the people. It is not good enough to blame the Commonwealth. As partners they must also share the responsibUity. I plore the atutudes of some of the State ments in their approach to this are not a federalist government but I suggest to some of the States that, if they want to be partners in a truly co-operative federal system, they also have a responsibUity to Uve within their Budgets and to prune their expenditure so our greatest problem-mflation-ca n be controlled. We must bring back into the Australian poUtical community some blunt, straight forward honesty in assessing what can and what be done. The Federal Government has indicated to States in this Bill that it realises the many ing problems the States have. State governments are a lot better off than they were last year. is a contradiction to the amendment moved the Opposition because the States have received increased amounts. The Commonwealth, neverwhich the less, has contained its spending. It has set an country? example and it will continue to do that. When we go to the people again the false hopes sition supporters have that they might win some of the seats on this side at which viously will be dissipated. I have very much pleasure in supporting the BUl and opposing this amendment which is in every aspect quite the posite to what the BUl proposes. uncon Mr Crean- I wish to move that the debate be right to criticise now adjourned. Mr Macphee- I require that the question be that is colput forthwith without debate.",105
299,Mr DEPUTY SPEAKER ,Mr Jannan)-Is there any honourable member who is ready to speak? Thetimeis not yet 10.30 a.m. Mr Crean- I am ready to speak but it is nearly 10.30 p.m. I suggest that unless there is some indication that die Government wishes to conthis country's tinue with the debateMONICA,106
300,Mr DEPUTY SPEAKER,"Order! If the to begin, I member for Melbourne Ports wishes think he will be able to continue after not do Mr Crean-It is so close to 10.30 p.m. I to thought that there would have been some more the sensible arrangement. With all respect, if the Minister indicates that the Government is going finish this debate tonight instead of going on with the adjournment debate, I certainly will go Mr Bourchier-We are going to negate the That is what they adjournment motion.",106
301,Mr DEPUTY SPEAKER,It has been indidecated to me that the adjournment motion wtil be governnegated. Thetimeis now 10.30 p.m. responsibUity. We Debate interrupted. ADJOURNMENT,106
302,Mr DEPUTY SPEAKER,"It being 10.30 p.m., in accordance with the order of the House that of 10 March 19771 propose the question: That the House do now adjourn. Mr Macphee- I require that the question be cannot put forthwith without debate. Question resolved in the negative.",106
303,Mr HAYDEN ,"Mr Deputy Speaker, could I ask the you a question about the procedure of this pressHouse? Does this mean that there will be no adjournment debate tonight? Does this mean This that the National Country Party can again by shelter behind the re-arrangements so we will not have the opportunity of exposing the way in it has dumped rural industry in this",106
304,Mr DEPUTY SPEAKER,Order! The Chair has no knowledge of whether there wtil be an they look so en-adjournment debate.,106
305,Mr HAYDEN ,Coul d I ask you whether we wtil be able to raise later the need for an adjournopment debate to expose how remiss the Country Party has been in relation to rural industiy?,106
306,Mr DEPUTY SPEAKER,"I ask the honourterms able member for Oxley to resume his seat. Mr Corbett- Mr Deputy Speaker, the denly National Country Party did not arrange anythink thing about this adjournment debate. We are afraid of the honourable member for Oxley. would hke him to speak. The more he speaks in this House, the better it is for us.",107
307,Mr DEPUTY SPEAKER,Order! I ask honourable member for Maranoa to resume his seat. STATES GRANTS (CAPITAL ASSISTANCE) BILL 1977 Second Reading Debate resumed.,107
308,Mr CREAN ,Melbourne Ports) (10.31)-It would be much more pleasant if we knew what was happening. My understanding was that the debate would be interrupted at 10.30 p.m.,107
309,Mr DEPUTY SPEAKER,It is a matter for real the Government whether the House continues.,107
310,Mr CREAN,"I accept that. I draw the attendrop tion of the House to the Budget Paper entitled 'Payments to or for the States and Local Governto ment Authorities 1977-78'. At page 6 details of funds to the States for capital purposes are prothere vided. They are divided into two groupstions general purpose capital funds, of which this Bill is part, and specific purpose payments for capital purposes. A total for die two groups is given. For 1976-77, as against 1975-76, there was a decline of 3.6 per cent. For 1977-78 it is estimated that there will be a decline of one per cent when pared with thefigurefor the previous year, which had been a decline also. It means that in real terms the sums being granted to the States for capital funds are less this year. They were less previous year. These are in money terms only. When one takes into account inflation and the like, in real terms capital expenditure is less this year, and it was less last year. also to page 10 of the Budget Paper entitled 'National Income and Expenditure 1976-77'. At current prices, grossfixedcapital expenditure all public authorities rose by 9 per cent in 1976-77 but fell by 2 per cent at constant prices. Surely at atimewhen we have a substantial number of unemployed affecting the economy no one can justify capital expenditure being less real terms than previously. I sometimes wonder at the rather curious economic theories Grants propagated about solving the unemployment problem. Surely at the moment one means increasing employment would be to put into capital expenditure expenditure in the same real at least as previously. I do not beheve that all those who are currendy unemployed can sudbe absorbed in pubhc works programs. I this is one of the great difficulties with unnot employment at the moment. It has been said on We this side of the House by quite a number of speakers that one of the difficulties is matching the demands that are still in the community for labour resources against the skills or lack of skills the that are currently available. The White Paper on National Income and Expenditure gives a number of interesting statistics about capital expenditure. I refer to table 18 on page 22 entitled Gross Fixed Capital Expenditure on New Assets, by Purpose. It shows that Federal authorities in 1976-77, as against 1975-76, which I have mentioned, were spending, in real terms, less than the amounts spent in the previous Budget. There was less spent on education in real terms. There was less spent on health, social security and welfare in terms. There was a very substantial drop in transport facilities. There was a very substantial in the item called 'All other'. Surely at the moment nobody can suggest that if we are able match people out of work with facilities that we lack, it is inflationary. Can anybody suggest if are shortages of nursing homes, police staand pre-school facilities and people are out of work that somehow it is violating some sound economic canon by putting to work the people who are out of work to do the sorts of jobs which wtil provide the facilities that are lacking? This is the reality in Australia at the moment. There is comno doubt, and the aggregate statistics in the document entitled 'Payments to or for the States and Local Government Authorities' show that in real terms capital expenditure at all levels of the government in Australia, whether Federal, State or local, is less this year than the previous year. Yet the Government, for some reason, expects us to commend it this year for what it says are very I draw attention substantial sums. Surely we all understand now that if inflation is at a minimum nearly 10 per cent-the Governby ment has not brought the rate of inflation below 10 per cent; it was horrified when it was above 10 per cent during the term of the Labor Government but it has done nothing to bring it below 10 per cent-w e can no longer simply take nominal in sums and regard them as indicative of performance. In his second reading speech on the States (Capital Assistance) Bill, the Minister for Aboriginal Affairs ( Mr Viner) representing the of Treasurer ( Mr Lynch) at the time said: The purpose of this Bill is to authorise the payment of capital grants to the States in 1977-78 totalling $477,933,000. This amount represents the grant component of the Loan CouncU program for State governments in 1977-78, and is one-third of the total program of $l,433.8m . . . That $l,433.8m means a percentage increase in 1976-77 of 5.7 per cent when there was an came increase in prices in that period of nearly 13 per cent. Surely that would mean a decline, in real terms, in what we are able to do with that sum money. When it is obvious that the private sector of the economy is not prepared to take slack which exists, surely there is an obligation on the pubhc sector to do so. One way by which the pubhc sector could increase real in the community is for it to be provided with greater sums of money. I suppose we get back to the awful obsession with this thing called 'the deficit'-the difference between the total expenditure has to meet and the resources it has available meet that expenditure. The Government calls the difference 'the deficit'. This year the Government sees great virtue in the fact that the deficit is billion instead of $2.7 billion. honourable member on the other side of the House to stand up and argue that the performance of the economy would be worse if we were to spend another $500m in the in lieu of performance by the private didly, I do not think any honourable members opposite could do that. Mr Groom-Inflatio n would be higher.",107
311,Mr CREAN,Why would inflation be higher? Mr Groom-Of course it would be higher.,108
312,Mr CREAN,"The honourable gentleman states that inflation would be higher. I should like to hear the profundity of his explanation. Why would putting people into work assets which the commumty needs be any more inflationary than paying the unemployment benefit from pubhc revenues, which at ment is costing $800m? I do not know what the honourable gentleman who interjected holds and I do not know whether he will be returned the next general election. He ought to go his electorate and say to the unemployed people there that he does not think that putting work would be a good thing and that what they are doing is helping to abate inflation. Does the honourable gentleman seriously maintain that? At the moment this Government is paying out of the tax collected from those who are working sum of $800m in unemployment benefit to people who are not working. In most cases the Government is paying near enough to one-half or two-thirds of a wage to people nothing. Would it not be more sensible and, I suggest, no more inflationary to pay them a full wage to do something that would be socially useful? I know that the honourable gendeman who interjected has not been here for very long. He here in the euphoria of the last election, as part of the greatest majority ever to be elected in the history of this country. But he can hardly beof lieve that the economy is any better because of the things which he claims his Government has up the changed. Is inflation any less? Mr Groom-Yes , it is less.",108
313,Mr CREAN,How much less? Mr Groom-Six per cent less.,108
314,Mr CREAN,"Is unemployment any less? Mr Groom-You put 100,000 people out of the Government work in one year.",108
315,Mr CREAN,"The honourable gentleman has been very frank in giving an answer about inflation. I simply ask mm: Is unemployment in the $2.2 electorate he represents any less than it was 2 I should like some years ago? Mr Groom-Yes , than it was in January 1976.",108
316,Mr CREAN,Tha n it was when you were public sector elected to this Parhament?,108
317,Mr DEPUTY SPEAKER ,Mr Jarman)Order! I suggest that all remarks be directed to the Chair and channelled through the Chair. I do not think that this cross-fire across the chamber should be tolerated. Mr Innes- I rise to a point of order.,108
318,Mr HODGMAN ,He is out ofhis seat.,108
319,Mr DEPUTY SPEAKER,"Yes, the honourable member for Melbourne is out ofhis seat. He to create must resume his seat. Mr Innes- I have done so. My point of order is that the honourable member for Braddon is the mointerjecting from out ofhis seat.",108
320,Mr DEPUTY SPEAKER,That is correct. If the honourable member for Braddon wishes to in interject he should return to his own seat. Even back to then I will not allow him to do so.,108
321,Mr CREAN,I am sure that the honourable member for Braddon will be out of his seat in a short while. He will be out of his seat if he is prepared to go back to the electorate he represents and say that the total unemployment in that electorate is less than it was when he came into the a seat. He is silent about that proposition. Mr Groom-Chec k on the facts.,108
322,Mr CREAN,What I asked of him and what who are doing he was brash enough toMONICA,108
323,Mr DEPUTY SPEAKER,If the honourable member for Braddon wishes to interject better go back to his seat to do it.,109
