Speaker,Text,pageNumbers
Mr STALEY ,Bu t in a way it will bring things,42
NA,"together, will it not?",42
Mr BRYANT,Som e of the responsibUities,42
NA,wUl be dispersed to some other Mimster who,42
NA,not bother much about them because he wUl simply,42
NA,have 45 other things to do. I have several fears,42
NA,which I would like to express. One is that,42
NA,financing provisions will be such that they willand,42
NA,start to cause atrophy in this city. The citizens,42
NA,will have a much heavier burden to bear in,42
NA,to keep up the standard ofthe Australian Capital,42
NA,Territory. I foresee the deadening hand of the,42
NA,Treasurer coming into it. On,42
NA,think that part time membership ofthe Legislat-,42
NA,ive Assembly will mean that its members,42
NA,have enoughtimeto apply themselves to the job.,42
NA,The Minister responsible willfindthe Legislative,42
NA,Assembly on the edge of his duties and therefore,42
NA,we willfindthat many things wUl flow back and,42
NA,the place will become just another bureaucratic,42
NA,enclave.,42
NA,The Minister having brought the matter here utes,42
NA,"and having initiated discussion, the time",42
NA,come for us to try to get the community to think,42
NA,Uttle more constructively about it. I hope that,42
NA,some of the thoughts expressed here and in,42
NA,other place about the AustraUan Capital Terripare,42
NA,tory can be put out in such a way that the citizens,42
NA,wUl start to think a Uttle more constructively,42
NA,about this matter. If we are not careful we will,42
NA,end up in a situation of confrontation.,42
NA,"people wUl be for it and others will be against it,",42
NA,and somebody wUl have to make a decision to,42
NA,"which, with the hindsight of history, probably",42
NA,wUl be the wrong decision.,42
Mr SPEAKER,Order! The honourable back,42
NA,gentleman'stimehas expired.,42
Mr DONALD CAMERON ,Griffith) may,42
NA,"(12.56)- Mr Speaker, on looking at the Constiif",42
NA,tution Ifindthat section 125 refers to the estabassure,42
NA,Ushment of a capital territory no closer than,42
NA,miles from Sydney. If one looks back to our,42
NA,history onefindsthat the only reason the AusGovernment,42
NA,traUan Capital Territory was established was,42
NA,satisfy the jealousies which existed between Vicpiece.,42
NA,toria and New South Wales. It was agreed that,42
NA,this Territory would be established to meet the,42
NA,needs or rather whims of those 2 States. We havetralians,42
NA,seen the Territory grow in its splendour over,42
NA,and today we have aflourishingcity and,42
NA,Previously in this House I have proposed the,42
NA,concept of changing section 125 of the Consti-,42
NA,tution in order that the AustraUan Capital Terri-,42
NA,tory might be placed back in New South Wales. I,42
NA,"have a veryfirmview about tbis, a view which",42
NA,has been commended by people in almost every,42
NA,"State, namely, that there is no need whatsoever",42
NA,to keep up a duplication of the bureaucracy and,42
NA,will the forms of government that are necessary,42
NA,to look after the needs of only a quarter of,42
NA,"a million people. Everywhere I go in AustraUa,",42
NA,"the except in New South Wales, people come to me",42
NA,say: 'I agree with your formula for the Aus-,42
NA,traUan Capital Territory'. People in New South,42
NA,orderWales come to me and say: 'What have we done,42
NA,wrong?' New South Wales is the only State that,42
NA,is opposed to the idea; the rest are totaUy in,42
NA,"the other hand, I favour of it.",42
NA,wdl not We talk about cutting down government,42
NA,"expenditure, and I believe that we can start right",42
NA,here in Canberra. There is absolutely no need for,42
NA,a smaU population to have its own parUamentary,42
NA,system and a dupUcation of government depart-,42
NA,ments when the Government of New South,42
NA,"Wales, only four hours away by road or 30 min-",42
NA,"by air, could do the job most adequately. In",42
NA,Canberra we are splurging the pubUc purse to,42
NA,has pander to the whims of a handful of people.,42
NA,a People in Canberra know that this is where the,42
NA,lucky country is. When we see the way that the,42
NA,the people of Canberra are looked after and com-,42
NA,the facUities here with the facUities that the,42
NA,"rest of Australia has to suffer, there is Uttle",42
NA,wonder that the people of Canbena want to,42
NA,Some retain their selfish litde nest.,42
NA,"I notice that it is nearly one o'clock, but I want",42
NA,register here once and for all my total oppo-,42
NA,sition to any concept of government for the Aus-,42
NA,tralian Capital Territory other than thrusting it,42
NA,into New South Wales whence it come and,42
NA,allowing it to stand on its own feet with the rest. I,42
NA,can understand that the people of the Territory,42
NA,be a Utde nervous about what might happen,42
NA,"Mr Wran became their Premier, but let me",42
NA,them that the foundations of Canberra,42
NA,100 have been so well laid and the city has been so,42
NA,early weU planned that now not even a Labor State,42
NA,could destroy it. It is here. Let us,42
NA,to call an end to the charade. We have' our show-,42
NA,I beUeve that it is time the Capital Terri-,42
NA,tory was put back into New South Wales and the,42
NA,people in this area were treated like other Aus-,42
NA,and not accorded the special treatment,42
NA,the they command under the present system.,42
NA,Question resolved in the affirmative.,43
NA,Sitting suspended from 1 to 2.1S p.m.,43
NA,APPROPRIATION (URBAN PUBLIC,43
NA,TRANSPORT) BILL 1977,43
NA,"Bill presented by Mr Nixon, and read a first",43
NA,time.,43
Mr NIXON ,Gippsland-Minister for,43
NA,Transport) (2.15)- I move:,43
NA,That the Bill be now read a second time.,43
NA,The purpose of this Bill is to appropriate,43
NA,$30.3 lm for expenditure under the terms of the,43
NA,joint Commonwealth/State Urban Public some,43
NA,Transport Agreement. Of this amount $5m is ceding,43
NA,allocated for new projects and $25.31 m provided,43
NA,to meet cost increases on approved,43
NA,Included in the Budget allocation for urban pub-,43
NA,Uc transport is $20.6m avaUable from existing,43
NA,appropriations of which $ 18.27m is for the conleave,43
NA,tinuation of approved urban pubUc transport granted.,43
NA,improvement projects and $2.42m is the carry-,43
NA,over from the $20m aUocated last year to meet,43
NA,MONEYS SPENT UNDER URBAN PUBLIC,43
NA,State,43
NA,NewSouth Wales,43
NA,Victoria,43
NA,Queensland,43
NA,South AustraUa,43
NA,Western Australia,43
NA,Tasmania,43
NA,Total,43
Mr NIXON,I thank the House. Honourable,43
NA,members will recall that in my second reading,43
NA,speech introducing the Appropriation (Urban,43
NA,PubUc Transport) BUl 1976 I referred to pro-,43
NA,gram revisions I had approved to that stage. 1,43
NA,have continued to work with the States to ap-,43
NA,prove the revision of programs and the re-,43
NA,allocation of avaUable funds to projects with the,43
NA,highest priority. This approach of course greatly,43
NA,State Projects,43
NA,NSW Acquisition ofl8double deck rail cars,43
NA,Vic. Acquisition of 5 new trains,43
NA,"cost increases. The BUl therefore, brings the total",43
NA,Commonwealth Budget aUocation in 1977-78 to,43
NA,$51m.,43
NA,WhUst the Government has been forced to,43
NA,reduce its aUocation this year our overall com-,43
NA,mitment has been substantial if we consider the,43
NA,fullfiveyears of the program. In thefirstthree,43
NA,Second Reading years of the program -1973-7 4 to,43
NA,1975-76-som e $79m was paid to the States,43
NA,whUe in the first two budgets of the present,43
NA,Government-1976-77 and 1977-78-an,43
NA,amount of $58.4m was spent last year and $5 lm,43
NA,is budgeted for expenditure this year making a,43
NA,total of $ 109.4m-a n increase in two years of,43
NA,40 per cent over that provided in the pre-,43
NA,three years. I seek leave to incorporate in,43
NA,Hansard Table 1 which sets out advances made,43
NA,projects. to the States to 30 June 1977.,43
Mr DEPUTY SPEAKER , Mr Lucock)-Is,43
NA,"granted. There being no objection, leave is",43
NA,The table read asfollows-,43
NA,Table 1,43
NA,TRANSPORT AGREEMENT 1973-74-1976-77,43
NA,1974-75 1975-76 1976-77 Total,43
NA,"14,763,403 5,693,666 24,596,051 45,053,120",43
NA,"18,867,227 9,332,523 15,884,936 44,084,686",43
NA,"2,126,029 8,984,714 11,379,744 22,490,487",43
NA,"6,083,784 6,757,152 4,420,366 17,261,302",43
NA,"2,828,653 750,080 1,869,044 5,447,777",43
NA,"359,333 2,380,013 252,610 2,991,956",43
NA,"45,028,429 33,898,148 58,402,751 137,329,328",43
NA,assists the States in meeting their more urgent,43
NA,needs. For the information of honourable mem-,43
NA,bers Table 1 provides for further detaUs of the,43
NA,approved program revisions. I seek leave to,43
NA,incorporate Table 2 in Hansard.,43
Mr DEPUTY SPEAKER , Mr Lucock)-Is,43
NA,"leave granted. There being no objection, leave is",43
NA,granted.,43
NA,The table read asfollows-,43
NA,Table 2,43
NA,Previously approved,43
NA,projects discontinued,43
NA,$m Sm,43
NA,3.970 Amount from previous unallocated savings 3.970,43
NA,3.970 3.970,43
NA,6.970 Caulfield/Mordialloc,43
NA,-signal works . . 0.580,43
NA,State Projects,44
NA,Qld Work on Southside platforms,44
NA,SA Purchase of 76 volvo buses,44
NA,WA Radio telephones,44
NA,in buses,44
NA,Bus Automatic,44
NA,Door Improvements,44
NA,Mitchell Busway additional works . . . 0.138 Vanous Bus Station Improvements,44
NA,Bus servicing facilities,44
NA,Innaloo car parking facilities,44
NA,Tas. Bus improvements,44
Mr NIXON,I thank the House. It is also sigWales,44
NA,nificant that our provision for new projects,44
NA,year is the first allocation for new works under,44
NA,the Urban Pubhc Transport Agreement since the,44
NA,1974 budget. Although $5m is a relatively minor,44
NA,amount I believe that its allocation is a clear,44
NA,indication of the commitment this Government,44
NA,has to ensure urban public transport services,44
NA,"upgraded. However, the apportionment of the",44
NA,$5m for new projects was not an easy task.,44
NA,"Consequendy, I sought from my State colleagues",44
NA,their views on possible allocations. In all cases,44
NA,there was an overwhelming priority given to the,44
NA,acquisition of rolling stock. I am in agreement Hansard.,44
NA,with this ranking and I therefore decided to allo-,44
NA,cate all funds towards rolling stock,44
NA,commitments.,44
NA,In determining each State's allocation I have,44
NA,taken into account the relative availabihty of,44
NA,funds from current appropriations and existing Commonwealth,44
NA,State commitments. In particular I took cogof,44
NA,nizance of the opportunity which New South,44
NA,Previously approved,44
NA,projects discontinued,44
NA,$m $m,44
NA,Macleod/Greensborough remainder of,44
NA,project 0.890,44
NA,Ringwood Corridor remainder of project 3.240,44
NA,Glen Waverley Model Line remainder of,44
NA,project 0.980,44
NA,Communications Upgrading,44
NA,-telephon e exchange 0.960,44
NA,Geelong Minor Works,44
NA,-platfor m extension and public address,44
NA,installation 0.320,44
NA,6.970 6.970,44
NA,0.253 Electrification Nonhgate-Shorncliffe (part) 0.253,44
NA,0.253 0.253,44
NA,5.044 Adelaide-Christie Downs Railway elec-,44
NA,trification 4.839,44
NA,Other Minor capital works 0.205,44
NA,5.044 5.044,44
NA,Central Bus Station,44
NA,0.600 -pedestrian access bridge 0.890,44
NA,Michell Bus way,44
NA,0.106 Stage 1-Design 0.053,44
NA,. . 0.060,44
NA,0.154 Car Parks at 5 Railway Stations . . . . 0.019,44
NA,0.024,44
NA,1.022 1.022,44
NA,0.030 1973-74 New Buses (part) 0.015,44
NA,Springfield Bus Depot Design (pan) 0.015,44
NA,0.03 0 0.03 0,44
NA,has to reallocate its avaUable funds. Allo-,44
NA,this cations were: $0.60m to New South Wales for,44
NA,double deck suburban raU cars; $lm to Victoria,44
NA,for suburban trains; $lm to Victoria for trams;,44
NA,$0.06 to Queensland towards electric raU cars;,44
NA,$0.94m to Queensland for buses; $lm to South,44
NA,AustraUa for buses; $0.30m to Western AustraUa,44
NA,are for buses; $0.1m to Tasmania for buses.,44
NA,Table 2 provides detaUs of the allocation to,44
NA,the States of the funds for approved projects,44
NA,other than the $27.73m for cost increases for,44
NA,1977-78. I seek leave to incorporate Table 3 in,44
Mr DEPUTY SPEAKER,I s leave granted?,44
NA,"There being no objection, leave is granted.",44
NA,The table read asfollows-,44
NA,Table 3,44
NA,Allocations to the States for Continuation,44
NA,Approved Projects and New Projects in 1977-78 under,44
NA,the Urban Public Transport Agreement.,44
NA,State projects projects,45
NA,NSW 11.28,45
NA,Vic 3.56,45
NA,Qld 2.80,45
NA,SA 0.45,45
NA,WA 0.18,45
NA,Tas only),45
Mr NIXON,I thank the House. The remain-,45
NA,ing $27.73m of this year's allocation of $5 lm is time.,45
NA,to meet cost increases. As honourable members,45
NA,will appreciate these funds are not payable in,45
NA,relation to particular projects until cost,45
NA,are justified in accordance with clause,45
NA,the Agreement. Consequently it is not possible,45
NA,this stage to advise Parliament of the ultimate al-,45
NA,location of these funds. Whilst many projects are,45
NA,yet to befinishedwe are already seeing the,45
NA,benefits from those that have been completed.,45
NA,"a number of cities, for example, it is now not",45
NA,usual to see people allow older rolling stock to,45
NA,"pass so that they can catch the new bus, train",45
NA,tram that is following. This is a clear indication,45
NA,of the value the community attaches to the,45
NA,improvements in comfort and ride provided,45
NA,the rolling stock funded under the Urban,45
NA,Transport Agreement.,45
NA,Substantial increases in ridership have States,45
NA,"occurred, for instance, since the Christie Downs vancesfor",45
NA,RaUway was opened. Patronage at the Christie period ending,45
NA,Downs station is already exceeding 1975 predic-,45
NA,tions by almost 30 per cent. Particularly pleasingprovided,45
NA,is the fact that over 50 per cent of users prethe National,45
NA,viously travelled to central Adelaide by car. The Pending,45
NA,"success of this project is a clear indication that House,",45
NA,weU planned pubhc transport improvements can to,45
NA,increase patronage particularly by attracting premonths,45
NA,vious car users. SimUar results have also been proposedof,45
NA,achieved by the interchanges constructed in Brisnow proposed wUl subsume,45
NA,bane and Perth. At Petrie and Enoggera railway,45
NA,"stations, for example, since completion",45
NA,interchange facUities increased ticket sales,45
NA,almost 70 per cent and over 50 per cent respecfor,45
NA,tively have been experienced. At Innaloo about,45
NA,one third of aU park-and-ride patrons previously,45
NA,did not use pubhc transport. The success of this,45
NA,interchange is demonstrated by the recent agreean,45
NA,ment between the Western AustraUan Minister Each,45
NA,and myself that a second car park wUl be,45
NA,constructed.,45
NA,Honourable members wiU appreciate that al-,45
NA,Continuation New locations under this program are not the only,45
NA,Total,45
NA,contribution made by the Commonwealth to,45
NA,$m $m Sm transport services in urban areas. We make sub-,45
NA,0.6 11.88 stantial investments in the provision of transport,45
NA,2.0 5.56 infrastructure in urban areas such as airport and,45
NA,"1.0 3.80 port facUities, as weU as the substantial funds",45
NA,1.0 1.45,45
NA,which are provided towards the urban roads pro-,45
NA,grams. OveraU the Commonwealth Govern-,45
NA,0.3 0.48 ment'sfinancialcommitment to urban transport,45
NA,neg and the problems of the cities is clear and sig-,45
NA,($157,45
NA,0.1 0.10 nificant. I commend the BUl to the House.,45
NA,18.27 5.0 23.27 Debate (on motion by Mr Morris) adjourned.,45
NA,STATES GRANTS (ROADS) BILL 1977,45
NA,"BUl presented by Mr Nixon, and read a first",45
NA,Second Reading,45
Mr NIXON ,Gippsland-Minister for,45
NA,16 (3) of Transport) (2.21 ) -I move:,45
NA,at That the Bill be now read a second ume.,45
NA,The main purpose of this BUl is to provide finan-,45
NA,cial assistance by way of section 96 non-,45
NA,In repayable advances to the States for road,45
NA,unconstruction and maintenance over the three,45
NA,financial years 1977-78 to 1979-80 inclusive. The,45
NA,or BUl is a major item of legislation and involves a,45
NA,number of fairly complex issues. I have therefore,45
NA,arranged to have circulated to all members an,45
NA,by explanatory memorandum outUning the main,45
NA,PubUc principles ofthe legislation.,45
NA,"As honourable members wUl know, the Com-",45
NA,monwealth has made assistance avaUable to the,45
NA,roads by way of non-repayable ad-,45
NA,for a great many years. For the 3-year,45
NA,"30 June this year, assistance was",45
NA,to the States for roads purposes under,45
NA,Roads Act and Roads Grants Act.,45
NA,passage of the BUl now before the,45
NA,the States Grants (Roads Interim Assist-,45
NA,ance) Act 1977 was passed in the autumn session,45
NA,cover advances to the States for the first three,45
NA,1977-78 1977-78 equal to one-quarter of the,45
NA,allocation. The legislation,45
NA,the interim assist-,45
NA,of the ance arrangements.,45
NA,of -The legislation now before the House provides,45
NA,a basic grant in each of the three years of,45
NA,$475m. The States have been advised of the,45
NA,Government's intention to maintain the basic,45
NA,grant to each State for 1978-79 and 1979-80 at,45
NA,amount equivalent in real terms to 1977-78.,45
NA,"State's share of the indexed total grant wUl,",45
NA,"of course, remain constant. The Government is",45
NA,proposing to give effect to this intention by,45
NA,adjusting the basic grant to allow for cost,46
NA,ments on an annual basis in Une with movementswealth,46
NA,in the nauonal accounts' implicit price deflator,46
NA,for private investment in 'other buUding and finance,46
NA,construcuon*.,46
NA,This adjustment may be varied on account,46
NA,special factors which cannot presendy be forehighways,46
NA,seen or which may not be adequately reflected,46
NA,the proposed index. DetaUs of this particular,46
NA,aspect are to be finalised in discussion with the,46
NA,States. These discussions wUl also be useful of,46
NA,course in helping to avoid any misunderstandin,46
NA,ings about the indexation arrangements. Generport,46
NA,ally I would not anticipate any drastic alterations,46
NA,to the adjustments derived by use of the price,46
NA,deflator proposed and the overall effect of the,46
NA,proposed arrangements wUl be a substantial,46
NA,"basic guarantee to the States. Furthermore, I",46
NA,must also point out to the House that the,46
NA,proposed indexation arrangements wUl provide,46
NA,a guaranteed nunimum. As the States already,46
NA,know through advice from the Prime Minister,46
NA,"( Mr Malcolm Fraser), the Commonwealth's",46
NA,commitment is to provide funds at least,46
NA,equivalent in real terms to the 1977-78 allouse,46
NA,cations. The actual increase each year will need,46
NA,to befinalisedin the Ught ofthe overall budget-the,46
NA,ary and economic situation.,46
NA,Total funds to be appropriated for roads wUl,46
NA,"be $ 1,425m, an increase of almost $200m",46
NA,the grants provided in the triennium just ended.Transport,46
NA,This is a very substantial effort on the part,46
NA,Government and it signifies our determination,46
NA,stay with our proper responsibUities with regard,46
NA,to Australia's road network. It is a particularly,46
NA,significant effort on our part when considered,46
NA,the Ught of overaU budgetary problems. The to,46
NA,Government recognises the importance,46
NA,adequate transport networks for the economic,46
NA,weU-being of AustraUa and I should comment,46
NA,passing that in addition to our funding for,46
NA,purposes we also have substantial commitments,46
NA,in relation to other transport modes which we,46
NA,discharging responsibly. Honourable members,46
NA,wUl probably be aware that at the February,46
NA,meeting of the AustraUan Transport Advisory,46
NA,CouncU I announced that the Government,46
NA,intended to make $475m avaUable for road,46
NA,grants in 1977-78. At thattimeI also announced,46
NA,a number of significant pohcy initiatives on the,46
NA,part of the Commonwealth Government with prove,46
NA,regard to the areas in which we propose to,46
NA,"centrate ourfinancialassistance. In particular,",46
NA,announced that the Commonwealth Governmore,46
NA,ment intended to ensure that its funds were,46
NA,avaUable for use by local authorities in such,46
NA,move-way and to such an extent that the Common-,46
NA,Government could not in the future be,46
NA,held out as responsible for inadequate road,46
NA,at this level. It was also made clear in the,46
NA,aUocations which I proposed to the AustraUan,46
NA,Transport Advisory CouncU that we were,46
NA,of committed to continue funding for the national,46
NA,network and the main rural arterial,46
NA,"innetwork, which is of course a key part of the",46
NA,inter-regional and inter-urban transport system.,46
NA,This re-direction of Commonwealth effort was,46
NA,part based on recognition ofthe fact that sup-,46
NA,for urban arterial roads in the legislation,46
NA,"just ended had, in our view, taken an excessive",46
NA,part of the total avaUable Commonwealth funds.,46
NA,"In fact, we informed the State Governments that",46
NA,we were not prepared to continue providing a,46
NA,major part of funds for the construction of urban,46
NA,freeways at the expense of other road works. We,46
NA,are not abandoning urban transport as is eviden-,46
NA,ced by our decision to provide a further $5lm to,46
NA,the States under the urban transport agreement,46
NA,in 1977-78. We recognise that in the cities a,46
NA,"balanced approach to transport, including the",46
NA,"of pubhc transport, is essential and we are",46
NA,pursuing vigorously with the State governments,46
NA,problems which are faced in developing and,46
NA,improving these systems for the future. Honour-,46
NA,able members should also be aware that since,46
NA,our return to office we have held detaUed and ex-,46
NA,abovetended discussions through the Australian,46
NA,Advisory Council with the object of,46
NA,of theeliminating unnecessary complexity and,46
NA,to intrusion on our part in the affairs of State,46
NA,governments in relation to transport matters.,46
NA,"This is, of course, part of our wider approach in",46
NA,inthe development of a federaUsm pohcy designed,46
NA,avoid the many areas of friction which charac-,46
NA,of terised our predecessor's arrangements.,46
NA,in I should comment that the allocations for,46
NA,"roads1977-78 which are proposed in this BUl, also",46
NA,"reflect to an extent, requests from State Ministers",46
NA,arefor changes to allocations which I proposed to,46
NA,them at the AustraUan Transport Advisory,46
NA,CouncU. The allocations which I am proposing in,46
NA,the schedules to the BUl to cover 1978-79 and,46
NA,1979-80 wUl maintain the new thrust of Com-,46
NA,monwealth funding to which I have already,46
NA,"referred. However, the legislation wUl continue",46
NA,to contain provisions which wUl enable me to ap-,46
NA,requests from the States for transfers be-,46
NA,"con-tween road categories, to meet for example,",46
NA,I changes in State road works priorities. Further-,46
NA,I should make it quite clear to the House,46
NA,madethat the BUl does not aUocate the additional,46
NA,a indexation funds for 1978-79 and 1979-80 to,46
NA,particular road categories. Obviously the Parlianote,47
NA,ment will in due course be asked to appropriate,47
NA,these extra funds and their allocation to the,47
NA,ous road categories within each State.,47
NA,I would now like to draw the attention of,47
NA,honourable members to the main features of this,47
NA,"Bill. Firsdy, in the interest of simplified adminisline",47
NA,tration the legislation is being presented as,47
NA,Bill instead of two separate Acts similar to those,47
NA,which were in force up to 30 June last. State Min-substituting,47
NA,isters have welcomed this feature. In addition,47
NA,there will in future be no difference in the,47
NA,cial administration for national roads as,47
NA,pared with other road categories since pro rata,47
NA,advances will be made to the-States for all road,47
NA,categories on a monthly basis. The present separusing,47
NA,atefinancialarrangements in respect of national,47
NA,highways will be discontinued. The Bill also,47
NA,vides that the only Ministers with administrative,47
NA,responsibilities will be the Minister for Transport,47
NA,and the Treasurer.,47
NA,Of particular interest is our decision that the,47
NA,new legislation will continue the change Federal-State,47
NA,introduced recendy whereby payroll tax may be,47
NA,included as an eligible item of expenditure both,47
NA,from the Commonwealth grants and as a complarming,47
NA,ponent of matching State quotas. This is consistcapable,47
NA,ent with the approach adopted in relation to,47
NA,Commonwealth grants in some other programs.,47
NA,The road categories which are specified in,47
NA,legislation are as follows: National highways,47
NA,construction; national highways maintenance;,47
NA,national commerce road construction; rural,47
NA,arterial road construction; rural,47
NA,struction and maintenance; urban arterial road,47
NA,construction; urban local road construction; and,47
NA,Minor Traffic Engineering and Road Safety,47
NA,Improvements Program.,47
NA,Honourable members will be aware that these,47
NA,categories are similar to those of the previous,47
NA,"legislation. There is, however, no longer a separstandard",47
NA,ate reference in the legislation to beef roads,47
NA,developmental roads although beef roads will,47
NA,continue to be eligible for assistance. The,47
NA,category export and major commercial roads has,47
NA,been replaced by the category national combackground,47
NA,merce roads. The legislation will provide for,47
NA,State quotas of matching expenditure. The States,47
NA,are required to find from their own resources,47
