Speaker,Text,pageNumbers
NA,tors. For too long they have avoided telhng the,106
NA,people that increased services can be provided on.,106
NA,only through increased taxation. They have,106
NA,avoided telhng the people that.,106
NA,should be telling the people. It is not good,106
NA,enough to blame the Commonwealth. As part-,106
NA,ners they must also share the responsibUity. I,106
NA,plore the atutudes of some of the State,106
NA,ments in their approach to this,106
NA,are not a federalist government but I suggest to,106
NA,"some of the States that, if they want to be par-",106
NA,"tners in a truly co-operative federal system, they",106
NA,also have a responsibUity to Uve within their,106
NA,Budgets and to prune their expenditure so,106
NA,our greatest problem-mflation-ca n be con-,106
NA,trolled. We must bring back into the AustraUan,106
NA,"poUtical community some blunt, straight forward",106
NA,honesty in assessing what can and what,106
NA,be done.,106
NA,The Federal Government has indicated to,106
NA,States in this Bill that it realises the many,106
NA,ing problems the States have. State governments,106
NA,are a lot better off than they were last year.,106
NA,is a contradiction to the amendment moved,106
NA,the Opposition because the States have received,106
NA,"increased amounts. The Commonwealth, neverwhich",106
NA,"theless, has contained its spending. It has set an country?",106
NA,example and it wUl continue to do that. When we,106
NA,go to the people again the false hopes,106
NA,sition supporters have that they might win some,106
NA,of the seats on this side at which,106
NA,viously wUl be dissipated. I have very much,106
NA,pleasure in supporting the BUl and opposing this,106
NA,amendment which is in every aspect quite the,106
NA,posite to what the BUl proposes.,106
NA,uncon Mr Crean- I wish to move that the debate be,106
NA,right to criticise now adjourned.,106
NA,Mr Macphee- I require that the question be,106
NA,that is colput forthwith without debate.,106
Mr DEPUTY SPEAKER , Mr Jannan)-Is,106
NA,there any honourable member who is ready to,106
NA,speak? Thetimeis not yet 10.30 a.m.,106
NA,Mr Crean- I am ready to speak but it is nearly,106
NA,10.30 p.m. I suggest that unless there is some,106
NA,indication that die Government wishes to con-,106
NA,this country's tinue with the debate-,106
Mr DEPUTY SPEAKER,Order! If the,106
NA,"to begin, I",106
NA,member for Melbourne Ports wishes,106
NA,think he wUl be able to continue after,106
NA,not do Mr Crean-I t is so close to 10.30 p.m. I,106
NA,to thought that there would have been some more,106
NA,"the sensible arrangement. With all respect, if the",106
NA,Minister indicates that the Government is going,106
NA,finish this debate tonight instead of going on,106
NA,"with the adjournment debate, I certainly wUl go",106
NA,Mr Bourchier-W e are going to negate the,106
NA,That is what they adjournment motion.,106
Mr DEPUTY SPEAKER,I t has been indi-,106
NA,decated to me that the adjournment motion wtil be,106
NA,governnegated. Thetimeis now 10.30 p.m.,106
NA,responsibUity. We Debate interrupted.,106
NA,ADJOURNMENT,106
Mr DEPUTY SPEAKER,I t being 10.30,106
NA,"p.m., in accordance with the order of the House",106
NA,that of 10 March 19771 propose the question:,106
NA,That the House do now adjourn.,106
NA,Mr Macphee- I require that the question be,106
NA,cannot put forthwith without debate.,106
NA,Question resolved in the negative.,106
Mr HAYDEN ," Mr Deputy Speaker, could I ask",106
NA,the you a question about the procedure of this,106
NA,pressHouse? Does this mean that there will be no,106
NA,adjournment debate tonight? Does this mean,106
NA,This that the National Country Party can again,106
NA,by shelter behind the re-arrangements so we wUl,106
NA,not have the opportunity of exposing the way in,106
NA,it has dumped rural industry in this,106
Mr DEPUTY SPEAKER,Order! The Chair,106
NA,has no knowledge of whether there wtil be an,106
NA,they look so en-adjournment debate.,106
Mr HAYDEN ,Coul d I ask you whether we wtil,106
NA,be able to raise later the need for an adjourn-,106
NA,opment debate to expose how remiss the Country,106
NA,Party has been in relation to rural industiy?,106
Mr DEPUTY SPEAKER,I ask the honourterms,107
NA,able member for Oxley to resume his seat.,107
NA,"Mr Corbett- Mr Deputy Speaker, the denly",107
NA,National Country Party did not arrange anythink,107
NA,thing about this adjournment debate. We are,107
NA,afraid of the honourable member for Oxley.,107
NA,would hke him to speak. The more he speaks in,107
NA,"this House, the better it is for us.",107
Mr DEPUTY SPEAKER,Order! I ask,107
NA,honourable member for Maranoa to resume his,107
NA,seat.,107
NA,STATES GRANTS (CAPITAL,107
NA,ASSISTANCE) BILL 1977,107
NA,Second Reading,107
NA,Debate resumed.,107
Mr CREAN ,Melbourne Ports) (10.31)-I t,107
NA,would be much more pleasant if we knew what,107
NA,was happening. My understanding was that the,107
NA,debate would be interrupted at 10.30 p.m.,107
Mr DEPUTY SPEAKER,I t is a matter for real,107
NA,the Government whether the House continues.,107
Mr CREAN,I accept that. I draw the attendrop,107
NA,tion of the House to the Budget Paper entitled,107
NA,'Payments to or for the States and Local Governto,107
NA,ment Authorities 1977-78'. At page 6 details of,107
NA,funds to the States for capital purposes are prothere,107
NA,vided. They are divided into two groupstions,107
NA,"general purpose capital funds, of which this Bill",107
NA,"is part, and specific purpose payments for capital",107
NA,purposes. A total for die two groups is given. For,107
NA,"1976-77, as against 1975-76, there was a decline",107
NA,of 3.6 per cent. For 1977-78 it is estimated that,107
NA,there will be a decline of one per cent when,107
NA,"pared with thefigurefor the previous year, which",107
NA,had been a decline also. It means that in real,107
NA,terms the sums being granted to the States for,107
NA,capital funds are less this year. They were less,107
NA,previous year. These are in money terms only.,107
NA,When one takes into account inflation and the,107
NA,"like, in real terms capital expenditure is less this",107
NA,"year, and it was less last year.",107
NA,also to page 10 of the Budget Paper entitled,107
NA,'National Income and Expenditure 1976-77'. At,107
NA,"current prices, grossfixedcapital expenditure",107
NA,all public authorities rose by 9 per cent in,107
NA,1976-77 but fell by 2 per cent at constant prices.,107
NA,Surely at atimewhen we have a substantial,107
NA,number of unemployed affecting the economy no,107
NA,one can justify capital expenditure being less,107
NA,real terms than previously. I sometimes wonder,107
NA,at the rather curious economic theories Grants,107
NA,propagated about solving the unemployment,107
NA,problem. Surely at the moment one means,107
NA,increasing employment would be to put into,107
NA,capital expenditure expenditure in the same real,107
NA,at least as previously. I do not beheve that,107
NA,all those who are currendy unemployed can sud-,107
NA,be absorbed in pubhc works programs. I,107
NA,this is one ofthe great difficulties with un-,107
NA,not employment at the moment. It has been said on,107
NA,We this side of the House by quite a number of,107
NA,speakers that one of the difficulties is matching,107
NA,the demands that are still in the community for,107
NA,labour resources against the skills or lack of skills,107
NA,the that are currently available.,107
NA,The White Paper on National Income and,107
NA,Expenditure gives a number of interesting stat-,107
NA,istics about capital expenditure. I refer to table,107
NA,18 on page 22 entitled Gross Fixed Capital,107
NA,"Expenditure on New Assets, by Purpose. It",107
NA,"shows that Federal authorities in 1976-77, as",107
NA,"against 1975-76, which I have mentioned, were",107
NA,"spending, in real terms, less than the amounts",107
NA,spent in the previous Budget. There was less,107
NA,spent on education in real terms. There was less,107
NA,"spent on health, social security and welfare in",107
NA,terms. There was a very substantial drop in,107
NA,transport facilities. There was a very substantial,107
NA,in the item called 'All other'. Surely at the,107
NA,moment nobody can suggest that if we are able,107
NA,match people out of work with facilities that,107
NA,"we lack, it is inflationary. Can anybody suggest if",107
NA,"are shortages of nursing homes, police sta-",107
NA,and pre-school facilities and people are out,107
NA,of work that somehow it is violating some sound,107
NA,economic canon by putting to work the people,107
NA,who are out of work to do the sorts of jobs which,107
NA,wtil provide the facilities that are lacking? This is,107
NA,the reality in Australia at the moment. There is,107
NA,"comno doubt, and the aggregate statistics in the",107
NA,document entitled 'Payments to or for the States,107
NA,and Local Government Authorities' show that in,107
NA,real terms capital expenditure at all levels of,107
NA,"the government in Australia, whether Federal, State",107
NA,"or local, is less this year than the previous year.",107
NA,"Yet the Government, for some reason, expects us",107
NA,to commend it this year for what it says are very,107
NA,I draw attention substantial sums.,107
NA,Surely we all understand now that if inflation,107
NA,is at a minimum nearly 10 per cent-th e Govern-,107
NA,by ment has not brought the rate of inflation below,107
NA,10 per cent; it was horrified when it was above 10,107
NA,per cent during the term of the Labor Govern-,107
NA,ment but it has done nothing to bring it below 10,107
NA,per cent-w e can no longer simply take nominal,107
NA,in sums and regard them as indicative of perform-,107
NA,ance. In his second reading speech on the States,107
NA,"(Capital Assistance) Bill, the Mimster for",107
NA,Aboriginal Affairs ( Mr Viner) representing the,107
NA,of Treasurer ( Mr Lynch) at the time said:,107
NA,The purpose of this Bill is to authorise the payment of,107
NA,capital grants to the States in 1977-78 totalling,107
NA,"$477,933,000. This amount represents the grant component",108
NA,of the Loan CouncU program for State governments in,108
NA,"1977-78, and is one-third of the total program of",108
NA,"$l,433.8m . . .",108
NA,"That $l,433.8m means a percentage increase in",108
NA,1976-77 of 5.7 per cent when there was an came,108
NA,increase in prices in that period of nearly 13 per,108
NA,"cent. Surely that would mean a decline, in real",108
NA,"terms, in what we are able to do with that sum",108
NA,money. When it is obvious that the private sector,108
NA,of the economy is not prepared to take,108
NA,"slack which exists, surely there is an obligation",108
NA,on the pubhc sector to do so. One way by which,108
NA,the pubhc sector could increase real,108
NA,in the community is for it to be provided with,108
NA,greater sums of money.,108
NA,I suppose we get back to the awful obsession,108
NA,with this thing called 'the deficit'-th e difference,108
NA,between the total expenditure,108
NA,has to meet and the resources it has available,108
NA,meet that expenditure. The Government calls the,108
NA,difference 'the deficit'. This year the Government,108
NA,sees great virtue in the fact that the deficit is,108
NA,billion instead of $2.7 billion.,108
NA,honourable member on the other side of the,108
NA,House to stand up and argue that the perfor-,108
NA,mance of the economy would be worse if we,108
NA,were to spend another $500m in the,108
NA,in lieu of performance by the private,108
NA,"didly, I do not think any honourable members",108
NA,opposite could do that.,108
NA,Mr Groom-Inflatio n would be higher.,108
Mr CREAN,Wh y would inflation be higher?,108
NA,Mr Groom-O f course it would be higher.,108
Mr CREAN,Th e honourable gentleman,108
NA,states that inflation would be higher. I should,108
NA,like to hear the profundity of his explanation.,108
NA,Why would putting people into work,108
NA,assets which the commumty needs be any more,108
NA,inflationary than paying the unemployment,108
NA,"benefit from pubhc revenues, which at",108
NA,ment is costing $800m? I do not know what,108
NA,the honourable gentleman who interjected holds,108
NA,and I do not know whether he will be returned,108
NA,the next general election. He ought to go,108
NA,his electorate and say to the unemployed people,108
NA,there that he does not think that putting,108
NA,work would be a good thing and that what they,108
NA,are doing is helping to abate inflation. Does the,108
NA,honourable gentleman seriously maintain that?,108
NA,At the moment this Government is paying out,108
NA,of the tax collected from those who are working,108
NA,sum of $800m in unemployment benefit to,108
NA,people who are not working. In most cases the,108
NA,Government is paying near enough to one-half,108
NA,or two-thirds of a wage to people,108
NA,"nothing. Would it not be more sensible and, I",108
NA,"suggest, no more inflationary to pay them a full",108
NA,wage to do something that would be socially use-,108
NA,ful? I know that the honourable gendeman who,108
NA,interjected has not been here for very long. He,108
NA,"here in the euphoria of the last election, as",108
NA,part of the greatest majority ever to be elected in,108
NA,the history of this country. But he can hardly be-,108
NA,of lieve that the economy is any better because of,108
NA,the things which he claims his Government has,108
NA,up the changed. Is inflation any less?,108
NA,"Mr Groom-Yes , it is less.",108
Mr CREAN,How much less?,108
NA,Mr Groom-Si x per cent less.,108
Mr CREAN,I s unemployment any less?,108
NA,"Mr Groom-You put 100,000 people out of",108
NA,the Government work in one year.,108
Mr CREAN,Th e honourable gentleman has,108
NA,been very frank in giving an answer about infla-,108
NA,tion. I simply ask mm: Is unemployment in the,108
NA,$2.2 electorate he represents any less than it was 2,108
NA,I should like some years ago?,108
NA,"Mr Groom-Yes , than it was in January 1976.",108
Mr CREAN,Tha n it was when you were,108
NA,public sector elected to this Parhament?,108
Mr DEPUTY SPEAKER , Mr Jarman)-,108
NA,Order! I suggest that all remarks be directed to,108
NA,the Chair and channelled through the Chair. I do,108
NA,not think that this cross-fire across the chamber,108
NA,should be tolerated.,108
NA,Mr Innes- I rise to a point of order.,108
Mr HODGMAN ,H e is out ofhis seat.,108
Mr DEPUTY SPEAKER,"Yes, the honour-",108
NA,able member for Melbourne is out ofhis seat. He,108
NA,to create must resume his seat.,108
NA,Mr Innes- I have done so. My point of order is,108
NA,that the honourable member for Braddon is,108
NA,the mointerjecting from out ofhis seat.,108
Mr DEPUTY SPEAKER,That is correct. If,108
NA,the honourable member for Braddon wishes to,108
NA,in interject he should return to his own seat. Even,108
NA,back to then I will not allow him to do so.,108
Mr CREAN,I am sure that the honourable,108
NA,member for Braddon will be out of his seat in a,108
NA,short while. He will be out of his seat if he is pre-,108
NA,pared to go back to the electorate he represents,108
NA,and say that the total unemployment in that elec-,108
NA,torate is less than it was when he came into the,108
NA,a seat. He is silent about that proposition.,108
NA,Mr Groom-Chec k on the facts.,108
Mr CREAN,What I asked of him and what,108
NA,who are doing he was brash enough to-,108
Mr DEPUTY SPEAKER,I f the honourable,109
NA,member for Braddon wishes to interject,109
NA,better go back to his seat to do it.,109
Mr CREAN,Th e honourable member for,109
NA,Braddon was brash enough to suggest that,109
NA,people were put to work performing what mightwhom,109
NA,be called socially useful tasks it would cause,109
NA,inflation. I hope he will go and tell his electoratehas,109
NA,that I simply think that this is an example ofthespeaks,109
NA,kind of economic nonsense that is being perHouse,109
NA,petrated in the system at the moment I beheve,109
NA,that it is economic nonsense to pay a person,109
NA,something between one-half and two-thirds of,109
NA,wage for doing nothing when there are plenty offederation.,109
NA,tasks remaining to be done- I would suggest that,109
NA,that applies no less in his electorate wan any-,109
NA,where else in the rest of Australia-th e doing,109
NA,which could be socially useful. I said to this,109
NA,porter of the Government from Tasmania the respected,109
NA,other day that he is a 'Tassiephile'. Hisfilesarecase.,109
NA,down in the bottom of the drawer.,109
NA,"members opposite came to office, as",109
NA,"office in 1972, on the subject of the",109
NA,employment The level of unemployment in,109
NA,1972 was higher than it ought to have been.,109
NA,level of unemployment in 1975 was higher than,109
NA,it ought to have been. The level of unemployfrom,109
NA,ment in 1977 is higher than it ought to be. Surelyeconomic,109
NA,that is what we are here about If the Australianlocal,109
NA,"pubhc, as a voting system, is prepared to acceptance",109
NA,that once the level of unemployment gets above,109
NA,2 per cent it is dangerous to whoever happens,109
NA,be in government honourable members opincome,109
NA,posite must be at least a Uttle bit trembly at,109
NA,moment about the imminence or otherwise of,109
NA,election as unemployment is of a magnitude of,109
NA,percent,109
NA,At least I try to be frank about this matter. I smaUer,109
NA,suggest that none of us is yet facing up to the,109
NA,ality of the totaUty of the unemployment situin real terms.,109
NA,"ation in AustraUa, but I think that we are being",109
NA,rather stily at the moment if we do not beUeve,109
NA,that the situation would be improved if we weregovernmental,109
NA,prepared to spend more in real terms on what,109
NA,often described by the use of a rather hackneyedare,109
NA,phrase as pubUc works. Surely this is what we,109
NA,about now. What has been given by these solocal,109
NA,caUed beneficial grants is less hi realtermsthis,109
NA,year than was the case in the previous year,109
NA,was less in realtermsthe year before. Surely thatbeen,109
NA,means that we are getting less in the way of,109
NA,"hospitals, schools, community faculties and the",109
NA,Uke. I suggest that anybody who says that to trytonight.,109
NA,to match the people out of work with the unfilledcate,109
NA,social needs would be inflationary needs a Uttlefor,109
NA,brainwashing.,109
Mr DEPUTY SPEAKER,Order! The,109
NA,he hadhonourable member'stimehas expired.,109
Mr CADMAN ,MitcheU) (10.50)-It has been,109
NA,iUuntinating to Usten to the honourable member,109
NA,for Melbourne Ports ( Mr Crean). He spoke,109
NA,if about economic nonsense. He was the man,109
NA,the Labor Party rejected as its Treasurer.,109
NA,It has not taken him back. It rejected him and it,109
NA,consistently failed to Usten to him. He now,109
NA,from the back benches. Everybody in this,109
NA,respects his integrity and quiet manner,109
NA,except members ofhis own party. The payments,109
NA,of various descriptions which have been made to,109
NA,a the States have continued since the beginning of,109
NA,Mr Armitage- I take a point of order. The,109
NA,of honourable member for MitcheU just said that,109
NA,sup-the honourable member for Melbourne Ports is,109
NA,except by his own party. That is not the,109
NA,He is held in the highest respect throughout,109
NA,Honourable the AustraUan Labor Party.,109
Mr DEPUTY SPEAKER , Mr Jarman)-,109
NA,level of unThere is no point of order.,109
Mr CADMAN,Sinc e the Second World War,109
NA,there has been an increasing aUocation of funds,109
NA,the Federal Government for things such as,109
NA,and social development to State and,109
NA,government. In 1976-77financialassist-,109
NA,grants were replaced by an arrangement,109
NA,under which State governments are entitled to a,109
NA,tospecified share of Commonwealth net personal,109
NA,tax coUections. If we look at the assist-,109
NA,theance being provided to the States in the table on,109
NA,anpage 8 of the Treasury document 'Payments to,109
NA,5 or for the States and Local Government Authori-,109
NA,ties' wefindthat the aUocation of general pur-,109
NA,"pose funds to States, large State authorities and",109
NA,State authorities has increased by 17.8,109
NA,per cent. With inflation at the moment at 9.2 per,109
NA,recent or 9.3 per cent that is a considerable growth,109
NA,The larger authorities which comprise semi-,109
NA,"authorities such as water, sewer-",109
NA,isage and drainage boards and boards of works,109
NA,receiving an mcreased loan capacity of 21.3,109
NA,areper cent this year. The bonowing capacity of,109
NA,government authorities has mcreased by,109
NA,34.4 per cent Opposition members have moved,109
NA,and itan amendment which indicates that there has,109
NA,a reduction in realtermsin payments to the,109
NA,States and local government under the terms of,109
NA,the agreement ofthe legislation we are debating,109
NA,This is certainly not so. Thefiguresindi-,109
NA,an increase of 17 per cent in loan capacity,109
NA,"State governments, 21.3 per cent for semi-",109
NA,governmental authorities and 34.4 per cent for,109
NA,local government. The Opposition's first point,110
NA,does not stand. The House does not recognise,110
NA,If funds were reduced in the previous year it isprogram.,110
NA,interesting to note that the New South Wales,110
NA,Government almostfinishedthe financial year,110
NA,with a surplus of $45m. It finished the year with anot,110
NA,"small surplus of $200,000. One wonders what recognised",110
NA,happened to that $45m.,110
Mr HODGMAN ,I t was tucked away.,110
Mr CADMAN,I t was tucked away. It was,110
NA,"saved for a rainy day or perhaps an early elecwages,",110
NA,tion. I think that next year we will see an,110
NA,"exaggerated works program sponsored by the vide,",110
NA,New South Wales Government with these addemands,110
NA,ditional funds from the Federal Government. last few years.,110
NA,The increased borrowing capacity of the States,110
NA,has been enunciated by previous speakers. I,110
NA,dorse their comments. Honourable members on,110
NA,this side of the House understand how to read,110
NA,Budget papers. They recognise the increased,110
NA,pacity of State governments. Opposition memunanimously,110
NA,bers say that this proposal has forced the Statesaccess,110
NA,to reduce the services they provide. How could,110
NA,it? During the last 12 months the States have,110
NA,"increased their public servants by 20,000.",110
NA,Mr Groom-Fou r per cent.,110
Mr CADMAN,"Th e States have increased, as",110
NA,"the honourable member for Braddon says, by",110
NA,four per cent their capacity to give service by,110
NA,of the staff they employ. The honourable memgive,110
NA,"ber for Adelaide ( Mr Hurford), in his",110
NA,"ment, claims to represent the views ofthe Oppo-",110
NA,sition and understand these matters. Why do,110
NA,honourable members opposite not assess what,110
NA,local governments and State governments are,110
NA,"doing? Why do they not look at their accounts,",110
NA,and look at what they are really achieving and,110
NA,what they are delivering? How can it be that withiers,110
NA,"an increased staff of 20,000 pubhc servants sertheir",110
NA,vices are decreasing? One would perhaps tend totax.,110
NA,think that the New South Wales Government it,110
NA,might be decreasing its services when one looksa,110
NA,at the pubhc transport system in that State. It,110
NA,a massive deficit of $300m. This is after the,110
NA,"Labor Party went to the people claiming, in",110
NA,that one of its priorities as a government,110
NA,be to improve the public transport services,110
NA,that State. It has not done so. The dangerous,110
NA,"ditions, with derailments still apply.",110
NA,We have further statements that the Bill will,110
NA,lead to increased unemployment. This Bill is not,110
NA,related to matters of unemployment. The wished,110
NA,"honourable member for Melbourne Ports, mencould",110
NA,tioned some programs. I take it he was referring,110
NA,to programs something like the RED scheme. Heposals.,110
NA,must recognise the huge expense involved in thatStates,110
NA,program by paying full salaries and making all,110
NA,it. those arrangements. In fact the honourable,110
NA,member's own Party eventually rejected that,110
NA,It was an incredibly imaginative pro-,110
NA,gram but an incredibly incompetent one. It did,110
NA,achieve the objectives. The Labor Party,110
NA,rejected it and all AustraUansrejectedit. They,110
NA,the concept; they rejected the prac-,110
NA,tice. What we need is not greater assistance m the,110
NA,form of loan moneys to State governments but,110
NA,an expanding opportunity and a control of,110
NA,an expanding opportunity for business,110
NA,such as this Government has been able to pro-,110
NA,and also a restriction ofthe continual wage,110
NA,with which we have been pressed in the,110
NA,enState governments have consistently expressed,110
NA,the view that over a long period the arrange-,110
NA,ments which they previously worked under were,110
NA,"caunsatisfactory. In fact in 1970, the six States",110
NA,proposed that they be given direct,110
NA,to income tax broadly along the lines of,110
NA,the scheme that operated then in Canada. In,110
NA,1975 they proposed again unanimously that the,110
NA,general revenue grants arrangements should be,110
NA,based on the principle that the States should be,110
NA,compensated for their lack of access to income,110
NA,tax. This principle has been recognised by the,110
NA,present Government. In fact as part ofits feder-,110
NA,wayaUsm program it has given and wtil continue to,110
NA,the States the opportunity to take up tax-,110
NA,amendation on behalf of their people.,110
NA,What is happening at the moment? Through,110
NA,the State Premiers there is a de facto taxing,110
NA,power given to the States. They have a share of,110
NA,taxation which they set. They have a share of,110
