speakerGroups,Speaker,text,pageNumbers
13,Mr CAMERON THOMPSON ,"Blair) (10.32 Amendment (Members of Local Government bill in this place-and I am pleased to hear been a matter of great controversy. The idea a disincentive and try to head off the idea that ment I think was shameful. We live in a democracy, promote people having a full understanding level but at the local and federal levels. We really must endorse somebody progressing politics because people need to have a good is that all politics is local, and I think local people to get involved in politics, to take it profile locally. These things are absolutely The steps taken by the Queensland government head off what they saw as being a training ground that whatsoever. In my area is the Ipswich City links to the Labor Party. The fact that they from being strong advocates on local issues and move on to state or federal politics. So it thing through the eyes of party political advantage training ground for advancement into politics. I would like to highlight the great contribution through the various councils in my area and talking ticularly the mayors in those communities make. said, any one of those could advance to different are significant advancements happening there figureheads and their work deserves recognition. At Kingaroy, Mayor Roger Nunn has been advancing education in the area. He has been TAFE college, providing opportunities for local versity study but who perhaps do not want to mend Roger and the whole of the council Reg MACCallum at Nanango has to be one of the quintessential bushie, and has been active the Tarong North project, something the member Reg has been instrumental in making sure that He has an immense understanding of forestry. of the South-East Queensland Forest Agreement, sland, Reg has been an absolute ally. Noel Strohfeldt is Mayor of Rosalie. Rosalie regulation. Noel has been a fierce and hard working MAIN COMMITTEE 11879 bill. It is appropriate for the Commonthat this bill will receive unanimous support, not as well. I commend the bill to the House. a.m.)-The Commonwealth Electoral Bodies) Bill 2002 may not be a controversial that it is not-but in Queensland it certainly has that the state government would want to provide local councillors should be standing for parliaand there should be every effort made to of how democracy works-not only at the state It is an absolutely perfect thing to do. from a council to state politics or to federal choice of experienced candidates. The old saying government is the ultimate training ground for up and pursue it, to get a reputation and to get a essential, and we must continue to endorse them. were taken in a blatant political attempt to for conservative politicians. I do not accept Council, which has long had councillors with have links to the Labor Party does not stop them and does not stop them from wanting to progress is shameful for that government to see the whole and to try to head off local government as a that is made by local councils by running about the contributions that they and parWhile all councillors contribute-and, as I levels of government-the fact is that there and the mayors in particular tend to be local active on issues like the Kingaroy Airport and trying to develop university links to the local school students who wish to undertake unileave their community in order to do so. I comfor continuing to promote the issue. the longest serving mayors in Australia. He is in making sure that employment is generated by for Hunter and I were discussing yesterday. the project provides jobs in the Nanango area. In the ridiculous debate about the development which was a disaster for South-East Queenis an area hard hit by drought and by dairy deadvocate on those issues. I urge him to REPRESENTATIVES MAIN COMMITTEE 11880 keep up the good work. I also commend Mayor again, the impact of drought there is huge. local issues with the hospital in Crows Nest with the hospital, is there on the sidelines closure of the hospital has focused that health support. The fundamental difficulties with the term, and the council has taken a hard and forward in the long term. At the Esk Shire Council, Mayor Jean Bray in the whole of my area. She is someone who, duck her responsibilities. Recently there was has ever had anything to do with dog laws issue that can ever come up. When the huge did not go and hide under the couch, although peared to do so. She attended all the controversial cerned and, at the end of it all, there has commend her for that. Up at Kilcoy, Terry Dredge has been a strong uty Speaker Adams, I know the forest industry endorse the efforts that Terry has gone to to edge there is amongst the people who have been our country for so many years. To have all come-lately green views that do not represent eas is a terrible shame. Instead of a strong, completely under-resourced national park just lay it to waste. It is a terrible scene, but Terry In the past, Ipswich has been a hotbed of dependent, and he does a very good job. I would of the Labor Party but also someone who does with the mayor and other councillors. I would multiculturalism and the work they regularly Ipswich citizenship ceremonies are unmatched from the council. The whole community comes do not think a migrant looking to take up Australian come than that extended by the Ipswich community are provided in large measure by the Ipswich City Council. At Boonah-and I have only a very small Brent is known as a strong campaigner. I would gether in relation to banks. The Commonwealth Brent and I met the head of the Commonwealth down and kicked up a big fuss. The bank, immovable activities in that regard. However, in the Bank branch at Brassall. The fact that we actually That was a very good outcome. Apart from thanking also like to thank the treasurer, MAIN COMMITTEE Thursday, 13 February 2003 Geoff Patch, at Crows Nest Shire. Once On top of that there have been some very thorny Shire. The council, while not directly involved and its contribution is very important. The recent institution more on aged care, an outcome that I hospital could not be surmounted in the short very bold decision that will carry the community is one of the most outstanding local advocates when a controversial issue comes up, does not quite a furore there over dog laws. Anyone who knows they are probably the most controversial uproar emerged over dog laws in that area, Jean practically every other local councillor apmeetings and spoke with the people conbeen a better outcome due to her participation. I campaigner on the issue of forestry. Mr Depis dear to your heart and I am sure you would focus attention on the immense wealth of knowlmaintaining the forest industry resource in that knowledge being undermined by Johnnythe best for the development of those forest arvibrant forest industry resource, we wind up with a waiting for some terrible fire to come along and is fighting on that, and I commend him for it. Labor politics. John Nugent, the mayor, is an Inalso like to mention Paul Pisasale, a member a lot of good work for our community along like to mention their strong endorsement of do to conduct citizenship ceremonies. I think in Australia. There is a strong level of support out to support those citizenship ceremonies. I citizenship would find any greater welthrough the citizenship ceremonies which part of Boonah in my electorate-Mayor John like to highlight the steps that we took toBank tried to close some local branches. John Bank in Queensland. We jumped up and as ever, endeavoured to pooh-pooh our end, we did manage to save the Commonwealth saved a bank branch is news these days. John Brent for his part in that, I would because he helped as well. REPRESENTATIVES MAIN COMMITTEE Thursday, 13 February 2003 In Laidley, Mayor Shirley Pitt is very strong another person who has campaigned on bank closures. overcome some of the difficulties created in residential subdivisions without complementary many areas of my electorate and it can leave There are then problems with kids who have out there by themselves, with no transport and been strong on that. The Laidley council has works hard on those matters. So, once again, local issues and doing something about them. Jim MACDonald, the Mayor of Gatton, is the local economy. For example, with Jim's Sprints. People get into their hot rods and comes to see them. It is good to watch and the a very vibrant community. I know that Jim will state government to take away TAB recognition appalling. However, the Gatton community is there are playing an important part in that. Finally, of Blair, one small part of Blair-a very important part of the Brisbane City Council area. The one, and so I do not need to make any comments about Jim. Underlying the massive infrastructure that dreds of elected representatives in the area ices to local people. They have a valuable addition to this parliament or to the state parliament. courage people with those skills to use them that is the way they want to go. This amendment, The state government stands condemned for having was a terrible thing for it to do. It is good to through this bill-although I think it still leaves future in Queensland. We are not talking only about federal politics, ment level in Queensland it is important that progress into the state scene. This is not something Party or the coalition partners up there; it slanders. That is what the state I commend the opposition and members of portant step but it is appalling that the question to make it quite clear that those local representatives endorse their participation and encourage greater nity who may wish to get into local councils to do so.",111
14,Mr FITZGIBBON ,"Hunter) (10.46 a.m.)-I member for Calare to range widely on the MAIN COMMITTEE 11881 and very active in the local community. She is She has also been working very hard to a community in which there are a lot of rural infrastructure. This is a terrible problem in people marooned in an area without any support. nothing to do in small communities and are stuck no way of getting out. Mayor Shirley Pitt has a very active youth consultative group which that is an example of a local council confronting orientated towards developing and diversifying contribution they have developed the Gatton do some laps around Gatton and a huge crowd council has made that quite an event. Gatton is be absolutely gutted by the decision of the of the Gatton race meetings. I think that is going places, and Jim and the other councillors on my long list of mayors in the electorate part-is around Karana Downs, which is mayor there, Jim Soorley, is well known to everycouncils provide across that area are the hunof Blair. They are providing very important servskill and knowledge base which would be a great We have to do everything we can to enand to advance into federal or state politics, if as the opposition has said, is common sense. taken steps to go in the other direction. It see the opposition supporting setting matters right open the question of what will happen in the although this bill does. At the local governpeople with those skills have the opportunity to that is going to advantage either the Labor is something that is going to benefit all Queengovernment should be there for. the federal parliament for taking this very imremains up in the air in Queensland. We have are welcome at all levels of politics. We participation by all members in the commuor state politics. We support them and urge them think it was appropriate that you allowed the Commonwealth Electoral Amendment (Members REPRESENTATIVES MAIN COMMITTEE 11882 of Local Government Bodies) Bill 2002 because recognition to those who make such a large Following on from the member for Calare ors, with whom I am very fortunate to have more at Maitland, John Clarence at Cessnock, Muswellbrook, a fine group of men. It is women filling those positions in the past in people behind them and they do an excellent very fortunate that there is not too much politics with the mayors, their councillors and their persuasions. Like others, I support this bill. As the member do not know why the Queensland Labor government government-chose to attempt to block councillors politically motivated. I think The member for Blair said it was about politicians. I suspect that it might have been and federal politics. I know there were some about corruption at the local government level. sibilities. I can understand why people might ment when they are, at the same time, sitting not excuse the state government's attempts councillor. That is grossly unfair. The member for Braddon may have been forced coming to this place. Why did he do that? Because be elected to the federal parliament while sitting Constitution, the office of profit under the resigned his position on council and been unsuccessful have been left stranded and the people in his They would have lost the opportunity to have in this place but also a fantastic local representative. from council to the parliament. I am very pleased that the latest legal advice local council at the same time does not breach go to the question, not of the words ‘profit' or der the Crown'. When the founding fathers inserted hold the separation between the bureaucracy to do. But the High Court in its judgments really particularly in the case of the electorate of simply because he worked for the department service leave at the time. At some point the that by way of a referendum. Of course, we ate can be on these matters, and history tells MAIN COMMITTEE Thursday, 13 February 2003 it does give us an opportunity to pay some contribution to our local government bodies. I, too, would like to acknowledge my local maya very good working relationship-Peter BlackFred Harvison at Singleton and John Colvin at unfortunate that they are all men. We have had the valley. These men have very good teams of job in every sense in a non-political way. I am in councils in my local area. I work very well council staff regardless of the varying political for Banks said, it is common sense to do so. I in 1993-I think it was the Goss Labor seeking federal office. No doubt it was it was a pretty silly thing to do. blocking the career paths of some conservative more about trying to get corruption out of local very deep concerns in Queensland at the time. I suppose people saw a blurring of the responnot want members sitting in the federal parliaon the local government authority. But that does to block someone from entering parliament as a to resign his position on the council before there was some concern at that time that to as a councillor might offend section 44 of the Crown provision. If the member for Braddon had in his bid for the parliament he would local area would have been all the poorer for it. not only a fantastic member representing them It makes no sense to stop the transition seems to be that sitting in this place and on a section 44 of the Constitution, although it does ‘office', but of what constitutes a position ‘unthis provision they were looking to upand the legislature, which was a very fine thing does draw a very long bow on this provision, Wills, where Mr Cleary was found to be ineligible of education at a state level and was on long parliament should really have a look at addressing all know how suspicious and cynical the electorus such a referendum would be unlikely to be REPRESENTATIVES MAIN COMMITTEE Thursday, 13 February 2003 MAIN COMMITTEE successful. But to claim that someone working the Constitution terms an office of profit under Similarly, I do not mind acknowledging that basis that she had not formally resigned from founding fathers had in mind at the time of framing has been interpreted so widely. But, having said that councillors do not hold an office of profit state, the legislation that gives effect to the tween the two. In New South Wales you probably Crown, but in other states-I am not so familiar Local councillors have to be very careful statutory bodies constituted under state legislation, these cases, it could be that the councillor may council position, but might hold an office of a member, as the councillor, of the statutory Paterson was elected to this place as a local ernment councillor. But, prior to re-entering was appointed to the insurance inquiries and company-which poses questions in itself. Being of profit under the Crown. But the Mrs Bronwyn Bishop- Mr Deputy Speaker, tolerance for the wide-ranging nature and content is no contention. The honourable member on the profit. I do not think it is appropriate to be this debate. I would ask you to rule that",113
15,The DEPUTY SPEAKER ,Hon. D.G.H. will come to the matter before the,115
16,Mr FITZGIBBON,"I am addressing the matter is something very relevant to the bill before immediately asked in my own mind whether, were acting ultra vires and whether we were deciding who should and should not run for office. important issues. As I was saying, Minister board, effective from 23 August 2000. The member until the middle of last year.",115
17,The DEPUTY SPEAKER,Order! The member House.,115
18,Mr FITZGIBBON,"Not at all,",115
19,The DEPUTY SPEAKER,The honourable relation to the subject matter of the bill. I which is the local government bodies bill.,115
20,Mr FITZGIBBON,"With respect, Mr Deputy for Paterson. I am just stating issues of fact. 11883 for a state department of education holds what the Crown really is drawing a very long bow. to disqualify the member for Lindsay on the the Air Force was just silly. That is not what our this provision, and it is unfortunate that it that it appears on the balance of legal advice under the Crown, it very much depends on the local government body and the relationship bedo not have an office of profit under the with their legislation-that could be the case. when, as a councillor, they are appointed to or federal legislation for that matter. In not be disqualified on the basis of holding the profit under the Crown on the basis that they are body. I can give an example. The member for government councillor and remains a local govthe parliament in 2002, the member for Paterson complaints board, which is a limited liability a limited company, obviously it is an office appointment was made by Minister HockeyI rise on a point of order. You have shown of this debate. This is a debate where there other side has made his point about office of going into other members' issues in the terms of he move on to the subject matter of the debate. Adams)-The honourable member for Hunter chair and the consideration of the bill. of office of profit under the Crown, which the House. Indeed, when I first saw the bill, I like the Queensland government in 1993, we in a position of usurping the Constitution and That is a question in itself. These are very Hockey appointed the member for Paterson to this for Paterson continued to sit on that board is reflecting on another member of the Mr Deputy Speaker, with respect. member for Hunter is getting very broad in ask him to come back to the details of the bill, Speaker, I am not reflecting on the member I have drawn into the debate questions aboutREPRESENTATIVES MAIN COMMITTEE 11884 Mrs Bronwyn Bishop- Mr Deputy",115
21,Mr FITZGIBBON,"This is becoming ridiculous now, Bronwyn. Mrs Bronwyn Bishop-In terms of what we subject matter of the bill. Through you, Mr move on in his speech.",116
22,Mr FITZGIBBON,On the point of order: this of a local government councillor to run for the Australian community. There are also questions the Constitution. I am outraged that the member right to raise constitutional issues in this place. Mrs Bronwyn Bishop-Further to the point there are points that he wishes to make about reflecting on another member.,116
23,The DEPUTY SPEAKER,"On the point of order, of the Commonwealth and it also deals with for Hunter not to reflect on any member of",116
24,Mr FITZGIBBON,"Out of respect to you, to do so. But this is a new precedent. One is House? We are not allowed to pass judgments outrageous point for the member We have serious issues here about conflicts ernment drafted the legislation. I think their But now the federal government is seeking to matters. It is a serious matter when there are this place. I ask the member for Mackellar this: to be sitting in this place, what can I do here? protecting her mate; that is what she is doing. only too well. I was not reflecting on the member for Paterson; pointed him to a board on 23 August 2000, and year. That is not a reflection. I am just raising under the Crown? I have had advice on this matter of the member for Paterson, but we Mrs Bronwyn Bishop- Mr Deputy Speaker, about matters coming into this chamber",116
25,Mr FITZGIBBON,Like Iraq.,116
26,The DEPUTY SPEAKER,Order! Member for Hunter. Mrs Bronwyn Bishop-They come in here rulings that you have made previously are,116
27,Mr FITZGIBBON,"On the point of order: is no agreement to be gagged-no agreement to tions to represent our electorates. MAIN COMMITTEE Thursday, 13 February 2003 Speaker, I raise a point of order. are discussing, this is not germane to the Deputy Speaker, I ask the honourable member to is a bill which seeks to validate the right high office. This is a question very important in arising from this bill that go directly to for Mackellar should seek to deny me the of order: the point I was making is that, if constitutionality, he can do it quite well without the bill does touch on the electoral acts the Constitution. I ask the honourable member the House and to be conscious of that fact. Mr Deputy Speaker, I will do my very best not not allowed to reflect on another member of the on people's decisions in this place? What an for Mackellar to be raising. of interest. That is why the Queensland govlegislation was flawed. I think they got it wrong. use its power over the states. These are serious questions arising about one's eligibility to sit in if I cannot reflect on someone's qualification What an outrageous thing to do. She is just All those listening out there understand that I was stating a fact. Minister Hockey aphe continued to sit on that board until mid last a question. What constitutes an office of profit from John MCCarthy QC-not particularly on the had wide-ranging discussions on this matter. I raise a point of order. The whole point is that they are to be non-contentious. by agreement, Mr Deputy Speaker. I think the quite appropriate, and I ask you to rule again. these bills come here by agreement, but there forgo our constitutional right and our obligaREPRESENTATIVES MAIN COMMITTEE Thursday, 13 February 2003",116
28,The DEPUTY SPEAKER,"Order! You are talking point of order raised by the member All imputations of improper motives and all personal disorderly. The member for Hunter has not reflected on do not uphold the point of order on the standing standing order 76. By substantive motion, he ber he wishes.",117
29,Mr FITZGIBBON,"I thank you for your ruling, one. The member for Mackellar raises the concern ber. I am not. But I seem to recall another ber just happened to be the member for Paterson, right all the allegations I made about him in for him to do. Unfortunately, I did not hear certain things; for example, that he illegally I have here a letter from the council, which states: There have been two parcels of land in Palanda I seek leave to table the letter from the council. Mrs Bronwyn Bishop- Mr Deputy Speaker, I ing on standing order 76, when you ruled that for Paterson. Clearly, in his last utterances",117
30,The DEPUTY SPEAKER,Does the member for der?,117
31,Mr FITZGIBBON,No. I do not want to waste more time.,117
32,The DEPUTY SPEAKER,The member has raised the chamber. I ask the member to come back erly reflecting on other members.,117
33,Mr FITZGIBBON,"I seek leave to table member for Paterson or someone representing him, saying: There have been two parcels of land in Palanda That work was carried out.",117
34,The DEPUTY SPEAKER,Are you seeking leave?,117
35,Mr FITZGIBBON,I am. Mrs Bronwyn Bishop-Leave is not granted.,117
