speakerGroups,Speaker,text,pageNumbers
51,Mr CADMAN ,"Mitchell) (11.38 a.m.)-I want which is part of the Family and Community fore the House today. I also want to make the the flaws that I believe are in the thinking many years in our support systems for families. Catherine Hakim of the London School of Economics. els and competing social policies and how they who was in the parliament this week, chose choice for women with families. She concluded styles-home-centred, work-centred or what she both with different proportions of work or ence dictated. The adaptive women, as she called them, not give a priority, preferring to have both. They gained fulfilment and a sense of worth This research was done in Britain, but it would because, from my knowledge of the community would be present here in Australia. Dr Hakim ity. They are the women who want to be totally sive influx of women into higher education and she felt that in her survey this group, whilst manent work, changed their minds during their system, which is the combination of employment tally home-centred lifestyle. Catherine Hakim then examined the circumstances they were looked after for child care, how lifestyle and demands on their families. She educational difference between those who had based. I have the figures here. She found that to have a higher education-26 per cent compared there is not a big difference in educational We have competing social policies in these we seem to be doing in Australia-and it is borne in Europe and in Great Britain-is channelling oriented families instead of taking account lifestyle. The majority of women choose a gain fulfilment from both. One of the recommendations ought to be looking at the equity of this situation, Thursday, 13 February 2003 this government gets the message. They ought to side. They have been certainly getting it consisfamilies. It is making it harder for them to it harder for them to survive financially. It is is putting them under pressure both emotionally took some action to fix it in legislation of to deal with the broader issue of families, Services Legislation Amendment Bill 2002 beHouse aware of lifestyle changes and some of behind many of the policies that have existed for I refer in particular to a study done by Dr She looked at competing family modimpacted on families. In particular, Dr Hakim, to look at the development in recent decades of that women choose three different lifecalled ‘adaptive', which is a combination of home as circumstances of family or their preferwho combined employment and family work did They wanted to enjoy the best of both worlds. out of working and out of their families as well. be very interesting for us to replicate it here I represent, I think many of the same attitudes found that work-centred women are in a minorfocused on a work lifestyle. Despite the masinto professional and managerial occupations, starting out with the intention of long-term perlives, and most women adopt the adaptive and family. Only a few women have a towithin those families to establish how they were being taxed and how they managed the found, for instance, that there was not a great the adaptive lifestyle and those who were work work-centred women were slightly more likely with 18 per cent in the other groups. So level; the factors are ones of choice. areas and they deserve to be looked at. What out by the experience internationally, both most of our family support to the workof the broader group which prefers an adaptive lifestyle where they work and have a family and that Dr Hakim is making is that we where we seem to be giving more governREPRESENTATIVES MAIN COMMITTEE Thursday, 13 February 2003 ment child-care support and tax concessions rather than taking into account, for instance, who prefer an adaptive lifestyle. We do not assign and look after the kids, yet somebody who goes assistance with child care. Dr Hakim is arguing here and we are not really treating the broad may be the case in Australia, but I would In a paper that Dr Hakim presented, It is often argued that maternity leave (paid or children. However a preference theory perspective to a lesser extent adaptive women who lean towards lated job rights-that is, women who have the lowest So maternity leave is generally taken up by the most work oriented, whereas those who are on the advantages of maternity benefits, whether Childcare services provide another example of policies generally but in fact favour one particular group. subsidised) are primarily of benefit to work-centred birth. That is probably right. I think that most mums use occasional care services. Some prefer long of child-care services rather Catherine Hakim gives examples of work care allowance introduced to provide more equity appears from the emerging information that pared with paid jobs redresses the bias against on fertility rates. Women feel more valued are more likely to enjoy having children. That is the finding from Britain. I do not suing. If the way in which we are providing change that. We ought to look at whether the They deserve for us to look at this seriously have listened to the line of fully employed, social advisers advocating payments to certain cial pleading for their own case rather than The whole area of family relationships tion in a recent article in December. Bettina wrote a paper or an article that is headed, ‘The can't we?' She refers to a study in the United by James Q. Wilson, who is a social scientist. ory'. If you are in a suburb where the broken attitude of disregard for law and order which mately the development of serious crime. MAIN COMMITTEE 11893 to those women who are fully in the work force the value of the caring for children done by those child care any value if people stay at home off to work gets not only a salary but also that there is an equity problem for women group of women fairly. Intuitively, I believe this like to find out whether it is or not. she makes this statement: unpaid) helps women to combine paid work with having clarifies that it is mainly work-centred women (and careers) who benefit from maternity leave and refertility and are least likely to increase it. that group which has the smallest family and is dealing with families miss out to a fair degree they are paid or unpaid. She goes on to say: that are presented as being beneficial to women Like maternity leave, public childcare services (free or women who choose to return to work shortly after who have an adaptive lifestyle tend to want to day care for periods. They tend to use a variety than the single long day care. done in Finland, Norway and France on a home in the family situation. In that instance, it raising the social status of motherhood as commotherhood as an activity and can also impact and more comfortable to mix work and home and know whether it applies here, but it is worth purservices to women is inequitable, we ought to mothers of Australia are being fairly treated. and make changes if changes are necessary. We highly professional work-orientated women and areas. In many instances, this seems to be spelooking at the needs of women across the board. and how we manage them was brought to my attenArndt, who has had a somewhat colourful career, US recognises the peril of absent fathers. Why States carried out fairly recently and promoted Wilson's idea is called the ‘broken window thewindows do not get fixed, that encourages an leads to graffiti, bad social behaviour and ultiREPRESENTATIVES MAIN COMMITTEE 11894 The social theory that James Q. Wilson Giuliani in New York. He said, ‘We're going things start to look crook we're going to move venile and minor crime that is building and that That process has produced some really In his latest book, entitled The Marriage lies, Wilson makes some very interesting points. culture some issues about children living with Things happen and, man, life is tough. People we should look at some of these statistics and assist families where there is tension and hurt These statistics from the US are interesting. appears that similar situations apply here. single mothers are five times more likely to you look at the Australian scene, you find Amanda Vanstone was badly misquoted by the ing the case for looking after single mums. where 80 per cent of mothers in single-parent Another finding was: Growing up in a single-parent family also roughly have difficulty finding a job, or become a teen parent. but the other half is due to non-economic factors habiting partners and in stepfamilies generally do cal parents. We can say that we do not believe the statistics, in his recent publication in the United States. scientist. He is partly responsible for the So are we going to take notice of him? I certainly think that these things are worth examining. Bettina Arndt says: Now, 40 years later, most politicians and social national priority. That is the case in the United States. It came fact that 80 per cent of African-American children from their families. In the United States, this of encouraging ‘the formation and maintenance responsible fatherhood'. If there is any group have their heads put straight, it is the men of their responsibilities, they should recognise this process. The US has pledged $300 million in federal grams. That might be a difficult start but in too hard for us to handle. We do not use too hard to talk about here. It is not socially MAIN COMMITTEE Thursday, 13 February 2003 developed was adopted as a guideline by Mayor to fix that broken window syndrome, and where in with remedial programs and redress the juwill create an environment of serious crime.' interesting changes in New York City. Problem: How Our Culture Has Weakened FamiHe has strongly documented in the American single mothers. This is not a go at single mums. do crook things to each other. I am arguing that see if we can put some remediation in place to to manage their difficulties and stay together. From sections of surveys done in Australia, it The US statistics show that children living with be poor than those in two-parent families. When that 80 per cent of single mums are on welfare. previous speaker. Amanda Vanstone is buildWhy would you want to put up with a situation families are living on welfare? doubles the risk that a child will drop out of school, About half these effects appear due to poverty, such as poorer supervision. Children living with coless well than those living with two married biologibut these are the findings of James Q. Wilson He has a track record of success as a good social theories that have turned New York crime around. will. I think he is worth looking at and I analysts agree that tackling fatherlessness must be a about when Bill Clinton drew attention to the spent part of their childhood living apart year's new welfare reform act includes the goal of healthy two-parent married families and that needs to have remediation and needs to our community. Instead of turning their backs on that they have a special, very significant role in funding to support marriage promotion prothis country, as Bettina Arndt says, the M word is it here in the House. The M word-‘marriage'-is popular. But the fact is that kids do better when REPRESENTATIVES MAIN COMMITTEE Thursday, 13 February 2003 MAIN COMMITTEE they are looked after by two parents who are well enough with our single mums, either. Dr family related programs of a suitable type. We are not providing programs that are suitable have a lifestyle which the majority wish to mix of family and work responsibilities, enjoying or feeling themselves to be second-class citizens adaptive group who feel, ‘Because I am not working I am not doing my job for society or my family a proper job for society because I really value That balance needs to be achieved and attention The value that society places on the raising have long claimed that welfare support merely stone for lone parents. However, startling Gregory, a great Australian economist, completed finding is that lone parents will stay on welfare might be on the sole parent benefit for two or tem on different types of benefit and stay on 12 years. That is a very compelling argument the problems that I have spoken about. Does this mean that we need to know what cerned? Yes, we need to do the inquiries to see the same as those that have been demonstrated Europe. Does it mean we ought to be examining parent families applies in Australia? Yes, it tion but have not been prepared to tackle these popular to say there are better ways of doing marriages have failed or because they are on not a blame game; it is a lifting-up process and Because, at the end of the day, the problem that continue to engage in antisocial behaviour, should be striving to change that. I will really be pressing the government also share the view that we can be doing it better she has recently released, draws our attention about some of these issues and she has talked government has started to pick it up. We need for the sake of our parents, our mothers in particular, ultimate success.",124
52,Mr ZAHRA ,"MCMillan) (11.58 a.m.)-The Amendment Bill 2002 deals largely with issues yesterday, many families were confronted by large bushfire develop in Morwell in the Grand side of the railway line, which quickly developed 11895 biologically related to them. We are not doing Catherine Hakim says that we are not providing for women to be able to feel valued and have, an adaptive lifestyle which allows a proper both and not feeling damaged or criticised for doing that. There are many within that full-time, I can't be a worthwhile citizen. because I do not feel stressed. I am not doing my kids, my husband and family environment.' to appropriate family policies is demanded. of kids can have long-term impact. Welfare bodies provides a brief twoto three-year stepping new facts have emerged from an inquiry by Bob in the middle of last year. His startling new payments for an average of 12 years. They three years, but they will shift through the syswelfare of one sort or another for an average of for why we need to intervene to address some of we are talking about as far as the stats are conwhether the situation in Australian families is by Dr Catherine Hakim in the UK and in whether Wilson's work in the US on single does, but I believe we already have that informahard issues. It is socially and politically unthings. People are not second rate because their their own or because they are a single mum. It is a changing of outlook so we get better results. really comes home to the kids. They are the ones to perform poorly and to live in poverty. We hard, and I know that a number of my colleagues as a nation. The minister's own paper, which to these facts. She herself, I know, feels strongly about them many times. I am pleased that this to drive it home for the sake of our familiesand for our children, their lifestyle and Family and Community Services Legislation relating to families. In the Latrobe Valley the very real threat of bushfire. We had a very Ridge Plantations site located on the south into a substantial fire front and headed east REPRESENTATIVES MAIN COMMITTEE 11896 towards Traralgon. The fire very quickly became in particular, Traralgon. Deputy Speaker Gambaro, as you are from too familiar with the geography of the Latrobe and a substantial threat to a large amount Traralgon has a population of some 21,000 mum and dad, were told to activate their fire such was the risk associated with it, that people-not people actually in the town-were being asked as safe from the risk of spotting as was possible. Thankfully, we had a very swift response full-time staff and our outstanding volunteers. crews involved, and I want to give them some standing work and their efforts, we may well the Latrobe Valley. The fire crews involved Maryvale pulp and paper mill, owned by PaperlinX, CFA brigades from Toongabbie, Glengarry, Traralgon South, Traralgon East, Churchill, Maffra, Flynn, Labertouche, Willow Grove, many others lent a hand in fighting the fire. It was a very real threat to a very substantial portant infrastructure in that district as well. gional Hospital was seriously under threat from the two large car yards that we have on the were under threat, which would have involved worth of infrastructure, property and cars and and residences in that area as well. We are talking about families, and in country lies have is the fear of bushfire. Yesterday families very large fire front which quickly developed hectares of bush were destroyed. It is a big things happen. On behalf of the people of my emergency services personnel who helped.",127
53,The DEPUTY SPEAKER ,"Ms Gambaro)-I siderable leeway. I share your sympathy for the passion, but we are here to speak about Amendment Bill 2002. Will you be coming",128
54,Mr ZAHRA,"I am addressing it, but I will just ask, Madam Deputy Speaker, for a bit of the member for Mitchell talking about all types within the range to try to address",128
55,The DEPUTY SPEAKER,"The member for to him, including the adjournment and grievance debates.",128
56,Mr ZAHRA,"So does the member MAIN COMMITTEE Thursday, 13 February 2003 a very real threat to families in Morwell and, Queensland, I do not expect that you would be Valley. We are talking about very large towns of property and a very substantial population. people, and people in the town, including my plans. Such was the intensity of the fire, and out on five acres outside of town, but to take action to ensure that their property was from our emergency services personnel, both There were a large number of brigades and recognition today because, without their outhave been faced with a very real catastrophe in were from the Grand Ridge plantations, the and the Loy Yang power station, and Tyers, Maryvale, Morwell, Traralgon West, Driffield, Moe, Erica, Mirboo North, Rosedale, Hallston, Thorpdale, Wurruk, Tinamba, Sale and number of people and a very real threat to imThere was a lot of concern that the Latrobe Rethe bushfire. There was a very real threat that Princes Highway between Morwell and Traralgon the destruction of tens of millions of dollars threatened a large number of people's properties districts one of the very real fears that famiin the Latrobe Valley were confronted by a into a 600-hectare bushfire. More than 600 issue for us in the country when these types of electorate, I thank all of those volunteers and have given the member for MCMillan conpeople of your electorate and we all feel comthe Family and Community Services Legislation to the point of the bill shortly? deal more specifically with it in due course. I a fair go about these things. We have just heard of social policy overseas and I think it is well some of these issues as well. MCMillan has a number of avenues available for Mitchell, Madam Deputy Speaker. REPRESENTATIVES MAIN COMMITTEE Thursday, 13 February 2003",128
57,The DEPUTY SPEAKER,"The member for Mitchell ters, and though we are all very compassionate back to the subject of the bill which we",129
58,Mr ZAHRA,"As I said, Madam Deputy Speaker, way that what the member for Mitchell was argue that what I am talking about is as relevant-probably and this is the last point that I want to make on record my appreciation and that of people all of the volunteer brigades and full-time just from the Latrobe Valley but also from West Sale and Wurruk in particular-and for their difficult circumstances. We are here to talk about the Family and 2002. The bill deals with a substantial issue and tries to address some of the problems that handling of the family tax benefit and child-care issue. It has affected many thousands of families families in my electorate have had about the which inadvertently, through no fault of their they end up owing the Commonwealth money. I know of many instances where people have formation to Centrelink. They have come forward stance, and have still ended up with a debt grieved about this because they have not set gone out of their way to be sneaky, to try to get ordinary people who have put in for a benefit, somehow have ended up owing the Commonwealth feel that their honour has been impugned by debt collector knocking on their door saying, feel they should have been put in a position These people have done everything right, so been made to feel a certain way-as if they they have given all the information. I say fair they feel. A large number of people in my electorate put in their tax returns, only to have the owed it-what the Commonwealth called an As you would know, Madam Deputy Speaker, many refund and organise their budgets around it. habit, when they get their tax cheque-people fice, especially low income families-of using ents. So not having that $500, $600 or $700 electorate last year. A lot of people were very media in my electorate. Many families came that money directly from their tax cheques had MAIN COMMITTEE 11897 did refer, however, to family matabout the bushfires I do ask that you come are all here today to discuss and debate. this does affect families. In the same talking about was relevant to the bill, I would more relevant. As I was sayingin relation to the fires in my electorate-I place in the Latrobe Valley for the swift response from emergency service personnel who responded-not Gippsland, South Gippsland and further east, efforts in coming to help us when we faced very Community Services Legislation Amendment Bill which has existed in my electorate for some time have been in place through the government's benefit arrangements. This is an important in my electorate. One of the big concerns administration of this program is the way in own, they can be caught in a situation where done the right thing and given all the right inwhen they have had a change of circumto the Commonwealth. These people feel agout to defraud the Commonwealth. They have not a benefit they are not entitled to. They are just given Centrelink all of the information and money. They feel lousy about this. They the fact that they now have the Commonwealth ‘You have to pay this money back.' They do not in the first place to have to pay the money back. probably they are right about that. They have have done the wrong thing-by people to whom enough to those people; I can understand how were given a nasty surprise last year when they amount of money which the Commonwealth said they ‘overpayment'-stripped from their tax refund. families look forward to getting their tax Many families in my electorate have got into the usually get some money back from the tax of that money to buy their kids Christmas prescome in made a big difference to families in my concerned about it. It became a big issue in the forward and explained how the taking away of affected their budgets. It had meant that a lot REPRESENTATIVES MAIN COMMITTEE 11898 of the stuff they had planned, like presents for for a little while, they could not do last year. because many people who try to do the right These are people who have tried to do everything Commonwealth and by Centrelink. They are basically vide some safety for those people in their link. An issue of concern in my electorate which been the issue of protecting their motor vehicles ethanol in fuel. It has been one of those interesting an esoteric way. They say, ‘We should do this should do this because it's good for some other it.' A lot of families get affected by these use those boats to go on holidays, and this issue you have a boat that costs you $10,000, it the repayments or to save up for it, and you not going to either be up for a replacement have saved long and hard for in the first place. My concern is that the way the government that there is no protection for families who have board motor. The government has not mandated lot of people are going to be caught up in this the engine in their motor vehicle damaged. It lot of expense for people. Unfortunately, there motor vehicles or motorboat petrol with a higher engine or their outboard motor might be ruined of money which the people who have motor boats is a fairly broad ranging debate, but it",129
59,The DEPUTY SPEAKER ,Ms Gambaro)-The he says that it is very broad ranging.,130
60,Mr ZAHRA,"Give me a bit of a fair go, member for Mitchell talk about his view",130
61,The DEPUTY SPEAKER,If the member for nol is related to the subject of the bill which him a little more indulgence. But I remind him can.,130
62,Mr ZAHRA,"I know that you are a fair matter which affects families. We are here to enough money to deal with some of the issues issues as well. If families do not have much might cost them $5,000 or $10,000MONICA",130
